upload=true&script=true&cardinfo=
!!################################
!!ALSA Information Script v 0.4.61
!!################################

!!Script ran on: Fri Mar  8 08:55:51 UTC 2013


!!Linux Distribution
!!------------------

Ubuntu 12.04.2 LTS \n \l DISTRIB_ID=Ubuntu DISTRIB_DESCRIPTION="Ubuntu 12.04.2 LTS" NAME="Ubuntu" ID=ubuntu ID_LIKE=debian PRETTY_NAME="Ubuntu precise (12.04.2 LTS)"


!!DMI Information
!!---------------

Manufacturer:      Hewlett-Packard
Product Name:      520-1299
Product Version:   1.00
Firmware Version:  8.10


!!Kernel Information
!!------------------

Kernel release:    3.5.0-23-generic
Operating System:  GNU/Linux
Architecture:      x86_64
Processor:         x86_64
SMP Enabled:       Yes


!!ALSA Version
!!------------

Driver version:     1.0.25
Library version:    1.0.25
Utilities version:  1.0.25


!!Loaded ALSA modules
!!-------------------

snd_hda_intel


!!Sound Servers on this system
!!----------------------------

Pulseaudio:
      Installed - Yes (/usr/bin/pulseaudio)
      Running - Yes


!!Soundcards recognised by ALSA
!!-----------------------------

 0 [PCH            ]: HDA-Intel - HDA Intel PCH
                      HDA Intel PCH at 0xf7c00000 irq 51


!!PCI Soundcards installed in the system
!!--------------------------------------

00:1b.0 Audio device: Intel Corporation 6 Series/C200 Series Chipset Family High Definition Audio Controller (rev 05)
04:00.0 Multimedia video controller: NEC Corporation Device 0165 (rev 0b)


!!Advanced information - PCI Vendor/Device/Subsystem ID's
!!-------------------------------------------------------

00:1b.0 0403: 8086:1c20 (rev 05)
	Subsystem: 103c:2adc


!!Modprobe options (Sound related)
!!--------------------------------

snd-atiixp-modem: index=-2
snd-intel8x0m: index=-2
snd-via82xx-modem: index=-2
snd-usb-audio: index=-2
snd-usb-caiaq: index=-2
snd-usb-ua101: index=-2
snd-usb-us122l: index=-2
snd-usb-usx2y: index=-2
snd-cmipci: mpu_port=0x330 fm_port=0x388
snd-pcsp: index=-2
snd-usb-audio: index=-2


!!Loaded sound module options
!!---------------------------

!!Module: snd_hda_intel
	align_buffer_size : -1
	bdl_pos_adj : 1,-1,-1,-1,-1,-1,-1,-1,-1,-1,-1,-1,-1,-1,-1,-1,-1,-1,-1,-1,-1,-1,-1,-1,-1,-1,-1,-1,-1,-1,-1,-1
	beep_mode : 0,0,0,0,0,0,0,0,0,0,0,0,0,0,0,0,0,0,0,0,0,0,0,0,0,0,0,0,0,0,0,0
	enable : Y,Y,Y,Y,Y,Y,Y,Y,Y,Y,Y,Y,Y,Y,Y,Y,Y,Y,Y,Y,Y,Y,Y,Y,Y,Y,Y,Y,Y,Y,Y,Y
	enable_msi : -1
	id : (null),(null),(null),(null),(null),(null),(null),(null),(null),(null),(null),(null),(null),(null),(null),(null),(null),(null),(null),(null),(null),(null),(null),(null),(null),(null),(null),(null),(null),(null),(null),(null)
	index : -1,-1,-1,-1,-1,-1,-1,-1,-1,-1,-1,-1,-1,-1,-1,-1,-1,-1,-1,-1,-1,-1,-1,-1,-1,-1,-1,-1,-1,-1,-1,-1
	model : (null),(null),(null),(null),(null),(null),(null),(null),(null),(null),(null),(null),(null),(null),(null),(null),(null),(null),(null),(null),(null),(null),(null),(null),(null),(null),(null),(null),(null),(null),(null),(null)
	patch : (null),(null),(null),(null),(null),(null),(null),(null),(null),(null),(null),(null),(null),(null),(null),(null),(null),(null),(null),(null),(null),(null),(null),(null),(null),(null),(null),(null),(null),(null),(null),(null)
	position_fix : 0,0,0,0,0,0,0,0,0,0,0,0,0,0,0,0,0,0,0,0,0,0,0,0,0,0,0,0,0,0,0,0
	power_save : 0
	power_save_controller : Y
	probe_mask : -1,-1,-1,-1,-1,-1,-1,-1,-1,-1,-1,-1,-1,-1,-1,-1,-1,-1,-1,-1,-1,-1,-1,-1,-1,-1,-1,-1,-1,-1,-1,-1
	probe_only : 0,0,0,0,0,0,0,0,0,0,0,0,0,0,0,0,0,0,0,0,0,0,0,0,0,0,0,0,0,0,0,0
	single_cmd : N
	snoop : Y


!!HDA-Intel Codec information
!!---------------------------
--startcollapse--

Codec: IDT 92HD91BXX
Address: 0
AFG Function Id: 0x1 (unsol 1)
Vendor Id: 0x111d76e0
Subsystem Id: 0x103c2adc
Revision Id: 0x100102
No Modem Function Group found
Default PCM:
    rates [0x5e0]: 44100 48000 88200 96000 192000
    bits [0xe]: 16 20 24
    formats [0x1]: PCM
Default Amp-In caps: ofs=0x00, nsteps=0x03, stepsize=0x27, mute=0
Default Amp-Out caps: ofs=0x7f, nsteps=0x7f, stepsize=0x02, mute=1
GPIO: io=5, o=0, i=0, unsolicited=1, wake=1
  IO[0]: enable=0, dir=0, wake=0, sticky=0, data=0, unsol=0
  IO[1]: enable=0, dir=0, wake=0, sticky=0, data=0, unsol=0
  IO[2]: enable=0, dir=0, wake=0, sticky=0, data=0, unsol=0
  IO[3]: enable=0, dir=0, wake=0, sticky=0, data=0, unsol=0
  IO[4]: enable=0, dir=0, wake=0, sticky=0, data=0, unsol=0
Power-Map: 0x76
Node 0x0a [Pin Complex] wcaps 0x400583: Stereo Amp-In
  Control: name="Mic Jack Mode", index=0, device=0
    ControlAmp: chs=0, dir=In, idx=0, ofs=0
  Control: name="Mic Capture Volume", index=0, device=0
    ControlAmp: chs=3, dir=In, idx=0, ofs=0
  Control: name="Mic Jack", index=0, device=0
  Amp-In caps: N/A
  Amp-In vals:  [0x00 0x00]
  Pincap 0x0001173c: IN OUT HP EAPD Detect
    Vref caps: HIZ 50 GRD 80
  EAPD 0x2: EAPD
  Pin Default 0x03a11080: [Jack] Mic at Ext Left
    Conn = 1/8, Color = Black
    DefAssociation = 0x8, Sequence = 0x0
  Pin-ctls: 0x24: IN VREF_80
  Unsolicited: tag=03, enabled=1
  Power: setting=D0, actual=D0
  Connection: 3
     0x13* 0x14 0x1c
Node 0x0b [Pin Complex] wcaps 0x400581: Stereo
  Control: name="Headphone Jack", index=0, device=0
  Pincap 0x0001001c: OUT HP EAPD Detect
  EAPD 0x2: EAPD
  Pin Default 0x0321103f: [Jack] HP Out at Ext Left
    Conn = 1/8, Color = Black
    DefAssociation = 0x3, Sequence = 0xf
  Pin-ctls: 0xc0: OUT HP
  Unsolicited: tag=01, enabled=1
  Power: setting=D0, actual=D0
  Connection: 3
     0x13 0x14* 0x1c
Node 0x0c [Pin Complex] wcaps 0x400583: Stereo Amp-In
  Amp-In caps: N/A
  Amp-In vals:  [0x00 0x00]
  Pincap 0x00011734: IN OUT EAPD Detect
    Vref caps: HIZ 50 GRD 80
  EAPD 0x2: EAPD
  Pin Default 0x40f000f0: [N/A] Other at Ext N/A
    Conn = Unknown, Color = Unknown
    DefAssociation = 0xf, Sequence = 0x0
  Pin-ctls: 0x00: VREF_HIZ
  Unsolicited: tag=00, enabled=0
  Power: setting=D0, actual=D0
  Connection: 3
     0x13* 0x14 0x1c
Node 0x0d [Pin Complex] wcaps 0x400501: Stereo
  Control: name="Speaker Phantom Jack", index=0, device=0
  Pincap 0x00010050: OUT EAPD Balanced
  EAPD 0x2: EAPD
  Pin Default 0xd2130130: [Both] Speaker at Int Front
    Conn = ATAPI, Color = Unknown
    DefAssociation = 0x3, Sequence = 0x0
    Misc = NO_PRESENCE
  Pin-ctls: 0x40: OUT
  Power: setting=D0, actual=D0
  Connection: 3
     0x13* 0x14 0x1c
Node 0x0e [Pin Complex] wcaps 0x400583: Stereo Amp-In
  Control: name="Line Out Jack", index=0, device=0
  Amp-In caps: N/A
  Amp-In vals:  [0x00 0x00]
  Pincap 0x00010034: IN OUT EAPD Detect
  EAPD 0x2: EAPD
  Pin Default 0x01011040: [Jack] Line Out at Ext Rear
    Conn = 1/8, Color = Black
    DefAssociation = 0x4, Sequence = 0x0
  Pin-ctls: 0x40: OUT
  Unsolicited: tag=02, enabled=1
  Power: setting=D0, actual=D0
  Connection: 3
     0x13* 0x14 0x1c
Node 0x0f [Pin Complex] wcaps 0x400583: Stereo Amp-In
  Amp-In caps: N/A
  Amp-In vals:  [0x00 0x00]
  Pincap 0x00010034: IN OUT EAPD Detect
  EAPD 0x2: EAPD
  Pin Default 0x40f000f0: [N/A] Other at Ext N/A
    Conn = Unknown, Color = Unknown
    DefAssociation = 0xf, Sequence = 0x0
  Pin-ctls: 0x00:
  Unsolicited: tag=00, enabled=0
  Power: setting=D0, actual=D0
  Connection: 3
     0x13* 0x14 0x1c
Node 0x10 [Pin Complex] wcaps 0x400500: Mono
  Pincap 0x00000010: OUT
  Pin Default 0x40f000f0: [N/A] Other at Ext N/A
    Conn = Unknown, Color = Unknown
    DefAssociation = 0xf, Sequence = 0x0
  Pin-ctls: 0x00:
  Power: setting=D0, actual=D0
  Connection: 1
     0x1a
Node 0x11 [Pin Complex] wcaps 0x400483: Stereo Amp-In
  Control: name="Internal Mic Capture Volume", index=0, device=0
    ControlAmp: chs=3, dir=In, idx=0, ofs=0
  Amp-In caps: N/A
  Amp-In vals:  [0x00 0x00]
  Pincap 0x00000024: IN Detect
  Pin Default 0xd5a30190: [Both] Mic at Int Top
    Conn = ATAPI, Color = Unknown
    DefAssociation = 0x9, Sequence = 0x0
    Misc = NO_PRESENCE
  Pin-ctls: 0x20: IN
  Unsolicited: tag=00, enabled=0
  Power: setting=D0, actual=D0
Node 0x12 [Vendor Defined Widget] wcaps 0xf00503: Stereo Amp-In
  Amp-In caps: N/A
  Amp-In vals:  [0x00 0x00]
  Power: setting=D0, actual=D0
  Connection: 1
     0x20
Node 0x13 [Audio Output] wcaps 0xd0c05: Stereo Amp-Out R/L
  Control: name="Front Playback Volume", index=0, device=0
    ControlAmp: chs=3, dir=Out, idx=0, ofs=63
  Control: name="Front Playback Switch", index=0, device=0
    ControlAmp: chs=3, dir=Out, idx=0, ofs=0
  Device: name="STAC92xx Analog", type="Audio", device=0
  Amp-Out caps: N/A
  Amp-Out vals:  [0x67 0x67]
  Converter: stream=8, channel=0
  Power: setting=D0, actual=D0
  Delay: 13 samples
Node 0x14 [Audio Output] wcaps 0xd0c05: Stereo Amp-Out R/L
  Control: name="Headphone Playback Volume", index=0, device=0
    ControlAmp: chs=3, dir=Out, idx=0, ofs=63
  Control: name="Headphone Playback Switch", index=0, device=0
    ControlAmp: chs=3, dir=Out, idx=0, ofs=0
  Amp-Out caps: N/A
  Amp-Out vals:  [0x67 0x67]
  Converter: stream=8, channel=0
  Power: setting=D0, actual=D0
  Delay: 13 samples
Node 0x15 [Audio Input] wcaps 0x1d0541: Stereo
  Device: name="STAC92xx Analog", type="Audio", device=0
  Converter: stream=4, channel=0
  SDI-Select: 0
  Power: setting=D0, actual=D0
  Delay: 13 samples
  Connection: 1
     0x17
  Processing caps: benign=0, ncoeff=0
Node 0x16 [Audio Input] wcaps 0x1d0541: Stereo
  Converter: stream=0, channel=0
  SDI-Select: 0
  Power: setting=D0, actual=D0
  Delay: 13 samples
  Connection: 1
     0x18
  Processing caps: benign=0, ncoeff=0
Node 0x17 [Audio Selector] wcaps 0x300d0d: Stereo Amp-Out R/L
  Control: name="Capture Volume", index=0, device=0
    ControlAmp: chs=3, dir=Out, idx=0, ofs=0
  Control: name="Capture Switch", index=0, device=0
    ControlAmp: chs=3, dir=Out, idx=0, ofs=0
  Amp-Out caps: ofs=0x10, nsteps=0x2e, stepsize=0x03, mute=1
  Amp-Out vals:  [0x10 0x10]
  Power: setting=D0, actual=D0
  Connection: 7
     0x1b 0x0a 0x0c 0x0e 0x0f 0x11* 0x12
Node 0x18 [Audio Selector] wcaps 0x300d0d: Stereo Amp-Out R/L
  Amp-Out caps: ofs=0x10, nsteps=0x2e, stepsize=0x03, mute=1
  Amp-Out vals:  [0x90 0x90]
  Power: setting=D0, actual=D0
  Connection: 7
     0x1b* 0x0a 0x0c 0x0e 0x0f 0x11 0x12
Node 0x19 [Audio Selector] wcaps 0x300501: Stereo
  Power: setting=D0, actual=D0
  Connection: 3
     0x13* 0x14 0x1c
Node 0x1a [Audio Mixer] wcaps 0x200500: Mono
  Power: setting=D0, actual=D0
  Connection: 1
     0x19
Node 0x1b [Audio Mixer] wcaps 0x20050b: Stereo Amp-In
  Amp-In caps: ofs=0x17, nsteps=0x1f, stepsize=0x05, mute=1
  Amp-In vals:  [0x97 0x97] [0x97 0x97] [0x97 0x97] [0x97 0x97] [0x97 0x97] [0x97 0x97]
  Power: setting=D0, actual=D0
  Connection: 6
     0x13 0x14 0x0a 0x0c 0x0e 0x0f
Node 0x1c [Audio Selector] wcaps 0x30050d: Stereo Amp-Out
  Amp-Out caps: ofs=0x1f, nsteps=0x1f, stepsize=0x05, mute=1
  Amp-Out vals:  [0x9f 0x9f]
  Power: setting=D0, actual=D0
  Connection: 1
     0x1b
Node 0x1d [Audio Output] wcaps 0x4061d: Stereo Digital Amp-Out
  Amp-Out caps: ofs=0x00, nsteps=0x00, stepsize=0x00, mute=1
  Amp-Out vals:  [0x00 0x00]
  Converter: stream=0, channel=0
  Digital:
  Digital category: 0x0
  PCM:
    rates [0x5e0]: 44100 48000 88200 96000 192000
    bits [0xe]: 16 20 24
    formats [0x5]: PCM AC3
  Power: setting=D0, actual=D0
  Delay: 4 samples
Node 0x1e [Audio Output] wcaps 0x4061d: Stereo Digital Amp-Out
  Amp-Out caps: ofs=0x00, nsteps=0x00, stepsize=0x00, mute=1
  Amp-Out vals:  [0x00 0x00]
  Converter: stream=0, channel=0
  Digital:
  Digital category: 0x0
  PCM:
    rates [0x5e0]: 44100 48000 88200 96000 192000
    bits [0xe]: 16 20 24
    formats [0x5]: PCM AC3
  Power: setting=D0, actual=D0
  Delay: 4 samples
Node 0x1f [Pin Complex] wcaps 0x400781: Stereo Digital
  Pincap 0x00000014: OUT Detect
  Pin Default 0x40f000f0: [N/A] Other at Ext N/A
    Conn = Unknown, Color = Unknown
    DefAssociation = 0xf, Sequence = 0x0
  Pin-ctls: 0x00:
  Unsolicited: tag=00, enabled=0
  Power: setting=D0, actual=D0
  Connection: 1
     0x1d
Node 0x20 [Pin Complex] wcaps 0x400781: Stereo Digital
  Pincap 0x00000034: IN OUT Detect
  Pin Default 0x40f000f0: [N/A] Other at Ext N/A
    Conn = Unknown, Color = Unknown
    DefAssociation = 0xf, Sequence = 0x0
  Pin-ctls: 0x00:
  Unsolicited: tag=00, enabled=0
  Power: setting=D0, actual=D0
  Connection: 1
     0x1e
Node 0x21 [Beep Generator Widget] wcaps 0x70040c: Mono Amp-Out
  Control: name="Beep Playback Switch", index=0, device=0
    ControlAmp: chs=1, dir=Out, idx=0, ofs=0
  Control: name="Beep Playback Volume", index=0, device=0
    ControlAmp: chs=1, dir=Out, idx=0, ofs=0
  Amp-Out caps: ofs=0x03, nsteps=0x03, stepsize=0x17, mute=1
  Amp-Out vals:  [0x00]
  Power: setting=D0, actual=D0
Node 0x22 [Vendor Defined Widget] wcaps 0xf00001: Stereo
--endcollapse--


!!ALSA Device nodes
!!-----------------

crw-rw---T+ 1 root audio 116,  5 Mar  8 03:42 /dev/snd/controlC0
crw-rw---T+ 1 root audio 116,  4 Mar  8 03:42 /dev/snd/hwC0D0
crw-rw---T+ 1 root audio 116,  3 Mar  8 03:42 /dev/snd/pcmC0D0c
crw-rw---T+ 1 root audio 116,  2 Mar  8 03:42 /dev/snd/pcmC0D0p
crw-rw---T+ 1 root audio 116,  1 Mar  8 03:42 /dev/snd/seq
crw-rw---T+ 1 root audio 116, 33 Mar  8 03:42 /dev/snd/timer

/dev/snd/by-path:
total 0
drwxr-xr-x 2 root root  60 Mar  8 03:42 .
drwxr-xr-x 3 root root 180 Mar  8 03:42 ..
lrwxrwxrwx 1 root root  12 Mar  8 03:42 pci-0000:00:1b.0 -> ../controlC0


!!Aplay/Arecord output
!!--------------------

APLAY

**** List of PLAYBACK Hardware Devices ****
card 0: PCH [HDA Intel PCH], device 0: STAC92xx Analog [STAC92xx Analog]
  Subdevices: 1/1
  Subdevice #0: subdevice #0

ARECORD

**** List of CAPTURE Hardware Devices ****
card 0: PCH [HDA Intel PCH], device 0: STAC92xx Analog [STAC92xx Analog]
  Subdevices: 1/1
  Subdevice #0: subdevice #0

!!Amixer output
!!-------------

!!-------Mixer controls for card 0 [PCH]

Card hw:0 'PCH'/'HDA Intel PCH at 0xf7c00000 irq 51'
  Mixer name	: 'IDT 92HD91BXX'
  Components	: 'HDA:111d76e0,103c2adc,00100102'
  Controls      : 18
  Simple ctrls  : 9
Simple mixer control 'Master',0
  Capabilities: pvolume pvolume-joined pswitch pswitch-joined penum
  Playback channels: Mono
  Limits: Playback 0 - 64
  Mono: Playback 40 [62%] [-18.00dB] [on]
Simple mixer control 'Headphone',0
  Capabilities: pvolume pswitch penum
  Playback channels: Front Left - Front Right
  Limits: Playback 0 - 64
  Mono:
  Front Left: Playback 64 [100%] [0.00dB] [on]
  Front Right: Playback 64 [100%] [0.00dB] [on]
Simple mixer control 'PCM',0
  Capabilities: pvolume penum
  Playback channels: Front Left - Front Right
  Limits: Playback 0 - 255
  Mono:
  Front Left: Playback 255 [100%] [0.00dB]
  Front Right: Playback 255 [100%] [0.00dB]
Simple mixer control 'Front',0
  Capabilities: pvolume pswitch penum
  Playback channels: Front Left - Front Right
  Limits: Playback 0 - 64
  Mono:
  Front Left: Playback 64 [100%] [0.00dB] [on]
  Front Right: Playback 64 [100%] [0.00dB] [on]
Simple mixer control 'Mic',0
  Capabilities: cvolume penum
  Capture channels: Front Left - Front Right
  Limits: Capture 0 - 3
  Front Left: Capture 0 [0%] [0.00dB]
  Front Right: Capture 0 [0%] [0.00dB]
Simple mixer control 'Mic Jack Mode',0
  Capabilities: enum
  Items: 'Mic In' 'Line In'
  Item0: 'Mic In'
Simple mixer control 'Beep',0
  Capabilities: pvolume pvolume-joined pswitch pswitch-joined penum
  Playback channels: Mono
  Limits: Playback 0 - 3
  Mono: Playback 1 [33%] [-12.00dB] [on]
Simple mixer control 'Capture',0
  Capabilities: cvolume cswitch penum
  Capture channels: Front Left - Front Right
  Limits: Capture 0 - 46
  Front Left: Capture 16 [35%] [0.00dB] [on]
  Front Right: Capture 16 [35%] [0.00dB] [on]
Simple mixer control 'Internal Mic',0
  Capabilities: cvolume penum
  Capture channels: Front Left - Front Right
  Limits: Capture 0 - 3
  Front Left: Capture 0 [0%] [0.00dB]
  Front Right: Capture 0 [0%] [0.00dB]


!!Alsactl output
!!--------------

--startcollapse--
state.PCH {
	control.1 {
		iface MIXER
		name 'Front Playback Volume'
		value.0 64
		value.1 64
		comment {
			access 'read write'
			type INTEGER
			count 2
			range '0 - 64'
			dbmin -4800
			dbmax 0
			dbvalue.0 0
			dbvalue.1 0
		}
	}
	control.2 {
		iface MIXER
		name 'Front Playback Switch'
		value.0 true
		value.1 true
		comment {
			access 'read write'
			type BOOLEAN
			count 2
		}
	}
	control.3 {
		iface MIXER
		name 'Mic Jack Mode'
		value 'Mic In'
		comment {
			access 'read write'
			type ENUMERATED
			count 1
			item.0 'Mic In'
			item.1 'Line In'
		}
	}
	control.4 {
		iface MIXER
		name 'Beep Playback Switch'
		value true
		comment {
			access 'read write'
			type BOOLEAN
			count 1
		}
	}
	control.5 {
		iface MIXER
		name 'Beep Playback Volume'
		value 1
		comment {
			access 'read write'
			type INTEGER
			count 1
			range '0 - 3'
			dbmin -1800
			dbmax 0
			dbvalue.0 -1200
		}
	}
	control.6 {
		iface MIXER
		name 'Headphone Playback Volume'
		value.0 64
		value.1 64
		comment {
			access 'read write'
			type INTEGER
			count 2
			range '0 - 64'
			dbmin -4800
			dbmax 0
			dbvalue.0 0
			dbvalue.1 0
		}
	}
	control.7 {
		iface MIXER
		name 'Headphone Playback Switch'
		value.0 true
		value.1 true
		comment {
			access 'read write'
			type BOOLEAN
			count 2
		}
	}
	control.8 {
		iface MIXER
		name 'Capture Volume'
		value.0 16
		value.1 16
		comment {
			access 'read write'
			type INTEGER
			count 2
			range '0 - 46'
			dbmin -1600
			dbmax 3000
			dbvalue.0 0
			dbvalue.1 0
		}
	}
	control.9 {
		iface MIXER
		name 'Capture Switch'
		value.0 true
		value.1 true
		comment {
			access 'read write'
			type BOOLEAN
			count 2
		}
	}
	control.10 {
		iface MIXER
		name 'Mic Capture Volume'
		value.0 0
		value.1 0
		comment {
			access 'read write'
			type INTEGER
			count 2
			range '0 - 3'
			dbmin 0
			dbmax 3000
			dbvalue.0 0
			dbvalue.1 0
		}
	}
	control.11 {
		iface MIXER
		name 'Internal Mic Capture Volume'
		value.0 0
		value.1 0
		comment {
			access 'read write'
			type INTEGER
			count 2
			range '0 - 3'
			dbmin 0
			dbmax 3000
			dbvalue.0 0
			dbvalue.1 0
		}
	}
	control.12 {
		iface MIXER
		name 'Master Playback Volume'
		value 40
		comment {
			access 'read write'
			type INTEGER
			count 1
			range '0 - 64'
			dbmin -9999999
			dbmax 0
			dbvalue.0 -1800
		}
	}
	control.13 {
		iface MIXER
		name 'Master Playback Switch'
		value true
		comment {
			access 'read write'
			type BOOLEAN
			count 1
		}
	}
	control.14 {
		iface CARD
		name 'Line Out Jack'
		value false
		comment {
			access read
			type BOOLEAN
			count 1
		}
	}
	control.15 {
		iface CARD
		name 'Headphone Jack'
		value false
		comment {
			access read
			type BOOLEAN
			count 1
		}
	}
	control.16 {
		iface CARD
		name 'Speaker Phantom Jack'
		value true
		comment {
			access read
			type BOOLEAN
			count 1
		}
	}
	control.17 {
		iface CARD
		name 'Mic Jack'
		value false
		comment {
			access read
			type BOOLEAN
			count 1
		}
	}
	control.18 {
		iface MIXER
		name 'PCM Playback Volume'
		value.0 255
		value.1 255
		comment {
			access 'read write user'
			type INTEGER
			count 2
			range '0 - 255'
			tlv '0000000100000008ffffec1400000014'
			dbmin -5100
			dbmax 0
			dbvalue.0 0
			dbvalue.1 0
		}
	}
}
--endcollapse--


!!All Loaded Modules
!!------------------

Module
nls_utf8
isofs
bnep
parport_pc
rfcomm
bluetooth
ppdev
snd_hda_codec_idt
snd_hda_intel
snd_hda_codec
snd_hwdep
snd_pcm
snd_seq_midi
joydev
coretemp
snd_rawmidi
snd_seq_midi_event
kvm
snd_seq
ghash_clmulni_intel
aesni_intel
cryptd
aes_x86_64
arc4
rt2800pci
rt2800lib
crc_ccitt
rt2x00pci
rt2x00lib
snd_timer
snd_seq_device
mac80211
cfg80211
snd
eeprom_93cx6
hid_generic
mxm_wmi
wmi
mac_hid
uvcvideo
videobuf2_core
lp
parport
videodev
videobuf2_vmalloc
videobuf2_memops
usbhid
hid
microcode
i915
serio_raw
drm_kms_helper
drm
lpc_ich
mei
i2c_algo_bit
video
soundcore
rts_pstor
snd_page_alloc
r8169


!!Sysfs Files
!!-----------

/sys/class/sound/hwC0D0/init_pin_configs:
0x0a 0x03a11080
0x0b 0x0321103f
0x0c 0x40f000f0
0x0d 0xd2130130
0x0e 0x01011040
0x0f 0x40f000f0
0x10 0x40f000f0
0x11 0xd5a30190
0x1f 0x40f000f0
0x20 0x40f000f0

/sys/class/sound/hwC0D0/driver_pin_configs:

/sys/class/sound/hwC0D0/user_pin_configs:

/sys/class/sound/hwC0D0/init_verbs:


!!ALSA/HDA dmesg
!!--------------

[    9.303313] [drm] Initialized i915 1.6.0 20080730 for 0000:00:02.0 on minor 0
[    9.303397] snd_hda_intel 0000:00:1b.0: irq 51 for MSI/MSI-X
[    9.350457] input: HDA Intel PCH Mic as /devices/pci0000:00/0000:00:1b.0/sound/card0/input7
[    9.350519] input: HDA Intel PCH Headphone as /devices/pci0000:00/0000:00:1b.0/sound/card0/input8
[    9.350703] input: HDA Intel PCH Line Out as /devices/pci0000:00/0000:00:1b.0/sound/card0/input9
[    9.547622] ppdev: user-space parallel port driver


