upload=true&script=true&cardinfo=
!!################################
!!ALSA Information Script v 0.4.61
!!################################

!!Script ran on: Wed Mar 13 17:52:35 UTC 2013


!!Linux Distribution
!!------------------

Ubuntu 12.04.2 LTS \n \l DISTRIB_ID=Ubuntu DISTRIB_DESCRIPTION="Ubuntu 12.04.2 LTS" NAME="Ubuntu" ID=ubuntu ID_LIKE=debian PRETTY_NAME="Ubuntu precise (12.04.2 LTS)"


!!DMI Information
!!---------------

Manufacturer:      Hewlett-Packard
Product Name:      HP Z210 Workstation
Product Version:   
Firmware Version:  J51 v01.09


!!Kernel Information
!!------------------

Kernel release:    3.5.0-23-generic
Operating System:  GNU/Linux
Architecture:      x86_64
Processor:         x86_64
SMP Enabled:       Yes


!!ALSA Version
!!------------

Driver version:     1.0.25
Library version:    1.0.25
Utilities version:  1.0.25


!!Loaded ALSA modules
!!-------------------

snd_hda_intel


!!Sound Servers on this system
!!----------------------------

Pulseaudio:
      Installed - Yes (/usr/bin/pulseaudio)
      Running - Yes


!!Soundcards recognised by ALSA
!!-----------------------------

 0 [PCH            ]: HDA-Intel - HDA Intel PCH
                      HDA Intel PCH at 0xfe420000 irq 49


!!PCI Soundcards installed in the system
!!--------------------------------------

00:1b.0 Audio device: Intel Corporation 6 Series/C200 Series Chipset Family High Definition Audio Controller (rev 04)


!!Advanced information - PCI Vendor/Device/Subsystem ID's
!!-------------------------------------------------------

00:1b.0 0403: 8086:1c20 (rev 04)
	Subsystem: 103c:1587


!!Modprobe options (Sound related)
!!--------------------------------

snd-atiixp-modem: index=-2
snd-intel8x0m: index=-2
snd-via82xx-modem: index=-2
snd-usb-audio: index=-2
snd-usb-caiaq: index=-2
snd-usb-ua101: index=-2
snd-usb-us122l: index=-2
snd-usb-usx2y: index=-2
snd-cmipci: mpu_port=0x330 fm_port=0x388
snd-pcsp: index=-2
snd-usb-audio: index=-2


!!Loaded sound module options
!!---------------------------

!!Module: snd_hda_intel
	align_buffer_size : -1
	bdl_pos_adj : 1,-1,-1,-1,-1,-1,-1,-1,-1,-1,-1,-1,-1,-1,-1,-1,-1,-1,-1,-1,-1,-1,-1,-1,-1,-1,-1,-1,-1,-1,-1,-1
	beep_mode : 0,0,0,0,0,0,0,0,0,0,0,0,0,0,0,0,0,0,0,0,0,0,0,0,0,0,0,0,0,0,0,0
	enable : Y,Y,Y,Y,Y,Y,Y,Y,Y,Y,Y,Y,Y,Y,Y,Y,Y,Y,Y,Y,Y,Y,Y,Y,Y,Y,Y,Y,Y,Y,Y,Y
	enable_msi : -1
	id : (null),(null),(null),(null),(null),(null),(null),(null),(null),(null),(null),(null),(null),(null),(null),(null),(null),(null),(null),(null),(null),(null),(null),(null),(null),(null),(null),(null),(null),(null),(null),(null)
	index : -1,-1,-1,-1,-1,-1,-1,-1,-1,-1,-1,-1,-1,-1,-1,-1,-1,-1,-1,-1,-1,-1,-1,-1,-1,-1,-1,-1,-1,-1,-1,-1
	model : (null),(null),(null),(null),(null),(null),(null),(null),(null),(null),(null),(null),(null),(null),(null),(null),(null),(null),(null),(null),(null),(null),(null),(null),(null),(null),(null),(null),(null),(null),(null),(null)
	patch : (null),(null),(null),(null),(null),(null),(null),(null),(null),(null),(null),(null),(null),(null),(null),(null),(null),(null),(null),(null),(null),(null),(null),(null),(null),(null),(null),(null),(null),(null),(null),(null)
	position_fix : 0,0,0,0,0,0,0,0,0,0,0,0,0,0,0,0,0,0,0,0,0,0,0,0,0,0,0,0,0,0,0,0
	power_save : 0
	power_save_controller : Y
	probe_mask : -1,-1,-1,-1,-1,-1,-1,-1,-1,-1,-1,-1,-1,-1,-1,-1,-1,-1,-1,-1,-1,-1,-1,-1,-1,-1,-1,-1,-1,-1,-1,-1
	probe_only : 0,0,0,0,0,0,0,0,0,0,0,0,0,0,0,0,0,0,0,0,0,0,0,0,0,0,0,0,0,0,0,0
	single_cmd : N
	snoop : Y


!!HDA-Intel Codec information
!!---------------------------
--startcollapse--

Codec: Realtek ALC262
Address: 0
AFG Function Id: 0x1 (unsol 1)
Vendor Id: 0x10ec0262
Subsystem Id: 0x103c1587
Revision Id: 0x100202
No Modem Function Group found
Default PCM:
    rates [0x560]: 44100 48000 96000 192000
    bits [0xe]: 16 20 24
    formats [0x1]: PCM
Default Amp-In caps: N/A
Default Amp-Out caps: N/A
GPIO: io=4, o=0, i=0, unsolicited=1, wake=0
  IO[0]: enable=0, dir=0, wake=0, sticky=0, data=0, unsol=0
  IO[1]: enable=0, dir=0, wake=0, sticky=0, data=0, unsol=0
  IO[2]: enable=0, dir=0, wake=0, sticky=0, data=0, unsol=0
  IO[3]: enable=0, dir=0, wake=0, sticky=0, data=0, unsol=0
Node 0x02 [Audio Output] wcaps 0x11: Stereo
  Converter: stream=8, channel=0
  PCM:
    rates [0x560]: 44100 48000 96000 192000
    bits [0xe]: 16 20 24
    formats [0x1]: PCM
Node 0x03 [Audio Output] wcaps 0x11: Stereo
  Device: name="ALC262 Analog", type="Audio", device=0
  Converter: stream=8, channel=0
  PCM:
    rates [0x560]: 44100 48000 96000 192000
    bits [0xe]: 16 20 24
    formats [0x1]: PCM
Node 0x04 [Vendor Defined Widget] wcaps 0xf00000: Mono
Node 0x05 [Vendor Defined Widget] wcaps 0xf00000: Mono
Node 0x06 [Audio Output] wcaps 0x211: Stereo Digital
  Converter: stream=0, channel=0
  Digital:
  Digital category: 0x0
  PCM:
    rates [0x560]: 44100 48000 96000 192000
    bits [0x1e]: 16 20 24 32
    formats [0x1]: PCM
Node 0x07 [Audio Input] wcaps 0x10011b: Stereo Amp-In
  Control: name="Capture Switch", index=0, device=0
  Control: name="Capture Volume", index=0, device=0
  Device: name="ALC262 Analog", type="Audio", device=0
  Amp-In caps: ofs=0x08, nsteps=0x1f, stepsize=0x05, mute=1
  Amp-In vals:  [0x0a 0x0a]
  Converter: stream=4, channel=0
  SDI-Select: 0
  PCM:
    rates [0x160]: 44100 48000 96000
    bits [0x6]: 16 20
    formats [0x1]: PCM
  Connection: 1
     0x24
Node 0x08 [Audio Input] wcaps 0x10011b: Stereo Amp-In
  Control: name="Capture Switch", index=1, device=0
  Control: name="Capture Volume", index=1, device=0
  Device: name="ALC262 Analog", type="Audio", device=2
  Amp-In caps: ofs=0x08, nsteps=0x1f, stepsize=0x05, mute=1
  Amp-In vals:  [0x80 0x80]
  Converter: stream=0, channel=0
  SDI-Select: 0
  PCM:
    rates [0x160]: 44100 48000 96000
    bits [0x6]: 16 20
    formats [0x1]: PCM
  Connection: 1
     0x23
Node 0x09 [Audio Input] wcaps 0x10011b: Stereo Amp-In
  Control: name="Capture Switch", index=2, device=0
  Control: name="Capture Volume", index=2, device=0
  Amp-In caps: ofs=0x08, nsteps=0x1f, stepsize=0x05, mute=1
  Amp-In vals:  [0x80 0x80]
  Converter: stream=0, channel=0
  SDI-Select: 0
  PCM:
    rates [0x160]: 44100 48000 96000
    bits [0x6]: 16 20
    formats [0x1]: PCM
  Connection: 1
     0x22
Node 0x0a [Audio Input] wcaps 0x100391: Stereo Digital
  Converter: stream=0, channel=0
  SDI-Select: 0
  Digital:
  Digital category: 0x0
  PCM:
    rates [0x560]: 44100 48000 96000 192000
    bits [0x1e]: 16 20 24 32
    formats [0x1]: PCM
  Unsolicited: tag=00, enabled=0
  Connection: 1
     0x1f
Node 0x0b [Audio Mixer] wcaps 0x20010b: Stereo Amp-In
  Control: name="Rear Mic Playback Volume", index=0, device=0
    ControlAmp: chs=3, dir=In, idx=0, ofs=0
  Control: name="Rear Mic Playback Switch", index=0, device=0
    ControlAmp: chs=3, dir=In, idx=0, ofs=0
  Control: name="Front Mic Playback Volume", index=0, device=0
    ControlAmp: chs=3, dir=In, idx=1, ofs=0
  Control: name="Front Mic Playback Switch", index=0, device=0
    ControlAmp: chs=3, dir=In, idx=1, ofs=0
  Control: name="Line Playback Volume", index=0, device=0
    ControlAmp: chs=3, dir=In, idx=2, ofs=0
  Control: name="Line Playback Switch", index=0, device=0
    ControlAmp: chs=3, dir=In, idx=2, ofs=0
  Control: name="Beep Playback Volume", index=0, device=0
    ControlAmp: chs=3, dir=In, idx=5, ofs=0
  Control: name="Beep Playback Switch", index=0, device=0
    ControlAmp: chs=3, dir=In, idx=5, ofs=0
  Amp-In caps: ofs=0x17, nsteps=0x1f, stepsize=0x05, mute=1
  Amp-In vals:  [0x80 0x80] [0x80 0x80] [0x80 0x80] [0x80 0x80] [0x80 0x80] [0x80 0x80] [0x80 0x80] [0x80 0x80]
  Connection: 8
     0x18 0x19 0x1a 0x1b 0x1c 0x1d 0x14 0x15
Node 0x0c [Audio Mixer] wcaps 0x20010f: Stereo Amp-In Amp-Out
  Amp-In caps: ofs=0x00, nsteps=0x00, stepsize=0x00, mute=1
  Amp-In vals:  [0x00 0x00] [0x80 0x80]
  Amp-Out caps: ofs=0x1f, nsteps=0x1f, stepsize=0x05, mute=0
  Amp-Out vals:  [0x01 0x01]
  Connection: 2
     0x02 0x0b
Node 0x0d [Audio Mixer] wcaps 0x20010f: Stereo Amp-In Amp-Out
  Control: name="PCM Playback Volume", index=0, device=0
    ControlAmp: chs=3, dir=Out, idx=0, ofs=0
  Amp-In caps: ofs=0x00, nsteps=0x00, stepsize=0x00, mute=1
  Amp-In vals:  [0x00 0x00] [0x00 0x00]
  Amp-Out caps: ofs=0x1f, nsteps=0x1f, stepsize=0x05, mute=0
  Amp-Out vals:  [0x13 0x13]
  Connection: 2
     0x03 0x0b
Node 0x0e [Audio Mixer] wcaps 0x20010e: Mono Amp-In Amp-Out
  Control: name="Speaker Playback Volume", index=0, device=0
    ControlAmp: chs=1, dir=Out, idx=0, ofs=0
  Amp-In caps: ofs=0x00, nsteps=0x00, stepsize=0x00, mute=1
  Amp-In vals:  [0x00] [0x00]
  Amp-Out caps: ofs=0x1f, nsteps=0x1f, stepsize=0x05, mute=0
  Amp-Out vals:  [0x13]
  Connection: 2
     0x02 0x0b
Node 0x0f [Vendor Defined Widget] wcaps 0xf00000: Mono
Node 0x10 [Vendor Defined Widget] wcaps 0xf00000: Mono
Node 0x11 [Vendor Defined Widget] wcaps 0xf00000: Mono
Node 0x12 [Pin Complex] wcaps 0x400001: Stereo
  Pincap 0x00000020: IN
  Pin Default 0x411111f0: [N/A] Speaker at Ext Rear
    Conn = 1/8, Color = Black
    DefAssociation = 0xf, Sequence = 0x0
    Misc = NO_PRESENCE
  Pin-ctls: 0x00:
Node 0x13 [Vendor Defined Widget] wcaps 0xf00000: Mono
Node 0x14 [Pin Complex] wcaps 0x40018f: Stereo Amp-In Amp-Out
  Amp-In caps: ofs=0x00, nsteps=0x03, stepsize=0x27, mute=0
  Amp-In vals:  [0x00 0x00]
  Amp-Out caps: ofs=0x00, nsteps=0x00, stepsize=0x00, mute=1
  Amp-Out vals:  [0x80 0x80]
  Pincap 0x0000003e: IN OUT HP Detect Trigger
  Pin Default 0x411111f0: [N/A] Speaker at Ext Rear
    Conn = 1/8, Color = Black
    DefAssociation = 0xf, Sequence = 0x0
    Misc = NO_PRESENCE
  Pin-ctls: 0x20: IN
  Unsolicited: tag=00, enabled=0
  Connection: 2
     0x0c* 0x0d
Node 0x15 [Pin Complex] wcaps 0x40018f: Stereo Amp-In Amp-Out
  Control: name="PCM Playback Switch", index=0, device=0
    ControlAmp: chs=3, dir=Out, idx=0, ofs=0
  Control: name="Line Out Jack", index=0, device=0
  Amp-In caps: ofs=0x00, nsteps=0x03, stepsize=0x27, mute=0
  Amp-In vals:  [0x00 0x00]
  Amp-Out caps: ofs=0x00, nsteps=0x00, stepsize=0x00, mute=1
  Amp-Out vals:  [0x00 0x00]
  Pincap 0x0000003e: IN OUT HP Detect Trigger
  Pin Default 0x01014c10: [Jack] Line Out at Ext Rear
    Conn = 1/8, Color = Green
    DefAssociation = 0x1, Sequence = 0x0
  Pin-ctls: 0x40: OUT
  Unsolicited: tag=02, enabled=1
  Connection: 2
     0x0c 0x0d*
Node 0x16 [Pin Complex] wcaps 0x40010c: Mono Amp-Out
  Control: name="Speaker Playback Switch", index=0, device=0
    ControlAmp: chs=1, dir=Out, idx=0, ofs=0
  Control: name="Speaker Phantom Jack", index=0, device=0
  Amp-Out caps: ofs=0x00, nsteps=0x00, stepsize=0x00, mute=1
  Amp-Out vals:  [0x00]
  Pincap 0x00000010: OUT
  Pin Default 0x99030120: [Fixed] Line Out at Int ATAPI
    Conn = ATAPI, Color = Unknown
    DefAssociation = 0x2, Sequence = 0x0
    Misc = NO_PRESENCE
  Pin-ctls: 0x40: OUT
  Connection: 1
     0x0e
Node 0x17 [Vendor Defined Widget] wcaps 0xf00000: Mono
Node 0x18 [Pin Complex] wcaps 0x40018f: Stereo Amp-In Amp-Out
  Control: name="Rear Mic Boost Volume", index=0, device=0
    ControlAmp: chs=3, dir=In, idx=0, ofs=0
  Control: name="Rear Mic Jack", index=0, device=0
  Amp-In caps: ofs=0x00, nsteps=0x03, stepsize=0x27, mute=0
  Amp-In vals:  [0x00 0x00]
  Amp-Out caps: ofs=0x00, nsteps=0x00, stepsize=0x00, mute=1
  Amp-Out vals:  [0x80 0x80]
  Pincap 0x0000173e: IN OUT HP Detect Trigger
    Vref caps: HIZ 50 GRD 80
  Pin Default 0x01a19c30: [Jack] Mic at Ext Rear
    Conn = 1/8, Color = Pink
    DefAssociation = 0x3, Sequence = 0x0
  Pin-ctls: 0x21: IN VREF_50
  Unsolicited: tag=04, enabled=1
  Connection: 2
     0x0c* 0x0d
Node 0x19 [Pin Complex] wcaps 0x40018f: Stereo Amp-In Amp-Out
  Control: name="Front Mic Boost Volume", index=0, device=0
    ControlAmp: chs=3, dir=In, idx=0, ofs=0
  Control: name="Front Mic Jack", index=0, device=0
  Amp-In caps: ofs=0x00, nsteps=0x03, stepsize=0x27, mute=0
  Amp-In vals:  [0x00 0x00]
  Amp-Out caps: ofs=0x00, nsteps=0x00, stepsize=0x00, mute=1
  Amp-Out vals:  [0x80 0x80]
  Pincap 0x0000173e: IN OUT HP Detect Trigger
    Vref caps: HIZ 50 GRD 80
  Pin Default 0x02a11c31: [Jack] Mic at Ext Front
    Conn = 1/8, Color = Black
    DefAssociation = 0x3, Sequence = 0x1
  Pin-ctls: 0x24: IN VREF_80
  Unsolicited: tag=05, enabled=1
  Connection: 2
     0x0c* 0x0d
Node 0x1a [Pin Complex] wcaps 0x40018f: Stereo Amp-In Amp-Out
  Control: name="Line Jack", index=0, device=0
  Amp-In caps: ofs=0x00, nsteps=0x03, stepsize=0x27, mute=0
  Amp-In vals:  [0x00 0x00]
  Amp-Out caps: ofs=0x00, nsteps=0x00, stepsize=0x00, mute=1
  Amp-Out vals:  [0x80 0x80]
  Pincap 0x0000173e: IN OUT HP Detect Trigger
    Vref caps: HIZ 50 GRD 80
  Pin Default 0x01813c3f: [Jack] Line In at Ext Rear
    Conn = 1/8, Color = Blue
    DefAssociation = 0x3, Sequence = 0xf
  Pin-ctls: 0x20: IN VREF_HIZ
  Unsolicited: tag=06, enabled=1
  Connection: 2
     0x0c* 0x0d
Node 0x1b [Pin Complex] wcaps 0x40018f: Stereo Amp-In Amp-Out
  Control: name="Headphone Playback Switch", index=0, device=0
    ControlAmp: chs=3, dir=Out, idx=0, ofs=0
  Control: name="Front Headphone Jack", index=0, device=0
  Amp-In caps: ofs=0x00, nsteps=0x03, stepsize=0x27, mute=0
  Amp-In vals:  [0x00 0x00]
  Amp-Out caps: ofs=0x00, nsteps=0x00, stepsize=0x00, mute=1
  Amp-Out vals:  [0x00 0x00]
  Pincap 0x0000173e: IN OUT HP Detect Trigger
    Vref caps: HIZ 50 GRD 80
  Pin Default 0x02211c40: [Jack] HP Out at Ext Front
    Conn = 1/8, Color = Black
    DefAssociation = 0x4, Sequence = 0x0
  Pin-ctls: 0xc0: OUT HP VREF_HIZ
  Unsolicited: tag=01, enabled=1
  Connection: 2
     0x0c 0x0d*
Node 0x1c [Pin Complex] wcaps 0x400001: Stereo
  Pincap 0x00000020: IN
  Pin Default 0x411111f0: [N/A] Speaker at Ext Rear
    Conn = 1/8, Color = Black
    DefAssociation = 0xf, Sequence = 0x0
    Misc = NO_PRESENCE
  Pin-ctls: 0x20: IN
Node 0x1d [Pin Complex] wcaps 0x400000: Mono
  Pincap 0x00000020: IN
  Pin Default 0x411111f0: [N/A] Speaker at Ext Rear
    Conn = 1/8, Color = Black
    DefAssociation = 0xf, Sequence = 0x0
    Misc = NO_PRESENCE
  Pin-ctls: 0x20: IN
Node 0x1e [Pin Complex] wcaps 0x400380: Mono Digital
  Pincap 0x00000010: OUT
  Pin Default 0x411111f0: [N/A] Speaker at Ext Rear
    Conn = 1/8, Color = Black
    DefAssociation = 0xf, Sequence = 0x0
    Misc = NO_PRESENCE
  Pin-ctls: 0x40: OUT
  Unsolicited: tag=00, enabled=0
  Connection: 1
     0x06
Node 0x1f [Pin Complex] wcaps 0x400280: Mono Digital
  Pincap 0x00000020: IN
  Pin Default 0x411111f0: [N/A] Speaker at Ext Rear
    Conn = 1/8, Color = Black
    DefAssociation = 0xf, Sequence = 0x0
    Misc = NO_PRESENCE
  Pin-ctls: 0x20: IN
  Unsolicited: tag=00, enabled=0
Node 0x20 [Vendor Defined Widget] wcaps 0xf00040: Mono
  Processing caps: benign=0, ncoeff=17
Node 0x21 [Volume Knob Widget] wcaps 0x600080: Mono
  Volume-Knob: delta=0, steps=32, direct=0, val=64
  Unsolicited: tag=00, enabled=0
  Connection: 0
Node 0x22 [Audio Selector] wcaps 0x300101: Stereo
  Control: name="Input Source", index=2, device=0
  Connection: 10
     0x18* 0x19 0x1a 0x1b 0x1c 0x1d 0x14 0x15 0x0b 0x12
Node 0x23 [Audio Mixer] wcaps 0x20010b: Stereo Amp-In
  Control: name="Input Source", index=1, device=0
  Amp-In caps: ofs=0x00, nsteps=0x00, stepsize=0x00, mute=1
  Amp-In vals:  [0x00 0x00] [0x80 0x80] [0x80 0x80] [0x80 0x80] [0x80 0x80] [0x80 0x80] [0x80 0x80] [0x80 0x80] [0x80 0x80]
  Connection: 9
     0x18 0x19 0x1a 0x1b 0x1c 0x1d 0x14 0x15 0x0b
Node 0x24 [Audio Mixer] wcaps 0x20010b: Stereo Amp-In
  Control: name="Input Source", index=0, device=0
  Amp-In caps: ofs=0x00, nsteps=0x00, stepsize=0x00, mute=1
  Amp-In vals:  [0x80 0x80] [0x00 0x00] [0x80 0x80] [0x80 0x80] [0x80 0x80] [0x80 0x80] [0x80 0x80] [0x80 0x80] [0x80 0x80]
  Connection: 9
     0x18 0x19 0x1a 0x1b 0x1c 0x1d 0x14 0x15 0x0b
Codec: Intel CougarPoint HDMI
Address: 3
AFG Function Id: 0x1 (unsol 0)
Vendor Id: 0x80862805
Subsystem Id: 0x103c1587
Revision Id: 0x100000
No Modem Function Group found
Default PCM:
    rates [0x0]:
    bits [0x0]:
    formats [0x0]:
Default Amp-In caps: N/A
Default Amp-Out caps: N/A
GPIO: io=0, o=0, i=0, unsolicited=0, wake=0
Node 0x02 [Audio Output] wcaps 0x6611: 8-Channels Digital
  Converter: stream=0, channel=0
  Digital: Enabled
  Digital category: 0x0
  PCM:
    rates [0x7f0]: 32000 44100 48000 88200 96000 176400 192000
    bits [0x1e]: 16 20 24 32
    formats [0x5]: PCM AC3
  Power states:  D0 D3 EPSS
  Power: setting=D0, actual=D0
Node 0x03 [Audio Output] wcaps 0x6611: 8-Channels Digital
  Converter: stream=0, channel=0
  Digital: Enabled GenLevel
  Digital category: 0x2
  PCM:
    rates [0x7f0]: 32000 44100 48000 88200 96000 176400 192000
    bits [0x1e]: 16 20 24 32
    formats [0x5]: PCM AC3
  Power states:  D0 D3 EPSS
  Power: setting=D0, actual=D0
Node 0x04 [Audio Output] wcaps 0x6611: 8-Channels Digital
  Converter: stream=0, channel=0
  Digital: Enabled
  Digital category: 0x0
  PCM:
    rates [0x7f0]: 32000 44100 48000 88200 96000 176400 192000
    bits [0x1e]: 16 20 24 32
    formats [0x5]: PCM AC3
  Power states:  D0 D3 EPSS
  Power: setting=D0, actual=D0
Node 0x05 [Pin Complex] wcaps 0x40778d: 8-Channels Digital Amp-Out CP
  Amp-Out caps: ofs=0x00, nsteps=0x00, stepsize=0x00, mute=1
  Amp-Out vals:  [0x00 0x80]
  Pincap 0x09000094: OUT Detect HBR HDMI DP
  Pin Default 0x58560010: [N/A] Digital Out at Int HDMI
    Conn = Digital, Color = Unknown
    DefAssociation = 0x1, Sequence = 0x0
  Pin-ctls: 0x40: OUT
  Unsolicited: tag=00, enabled=0
  Power states:  D0 D3 EPSS
  Power: setting=D0, actual=D0
  Connection: 1
     0x02
Node 0x06 [Pin Complex] wcaps 0x40778d: 8-Channels Digital Amp-Out CP
  Control: name="HDMI/DP,pcm=3 Jack", index=0, device=0
  Control: name="IEC958 Playback Con Mask", index=0, device=0
  Control: name="IEC958 Playback Pro Mask", index=0, device=0
  Control: name="IEC958 Playback Default", index=0, device=0
  Control: name="IEC958 Playback Switch", index=0, device=0
  Control: name="ELD", index=0, device=3
  Amp-Out caps: ofs=0x00, nsteps=0x00, stepsize=0x00, mute=1
  Amp-Out vals:  [0x00 0x00]
  Pincap 0x09000094: OUT Detect HBR HDMI DP
  Pin Default 0x18560020: [Jack] Digital Out at Int HDMI
    Conn = Digital, Color = Unknown
    DefAssociation = 0x2, Sequence = 0x0
  Pin-ctls: 0x00:
  Unsolicited: tag=01, enabled=1
  Power states:  D0 D3 EPSS
  Power: setting=D0, actual=D0
  Connection: 1
     0x03
Node 0x07 [Pin Complex] wcaps 0x40778d: 8-Channels Digital Amp-Out CP
  Amp-Out caps: ofs=0x00, nsteps=0x00, stepsize=0x00, mute=1
  Amp-Out vals:  [0x00 0x80]
  Pincap 0x09000094: OUT Detect HBR HDMI DP
  Pin Default 0x58560030: [N/A] Digital Out at Int HDMI
    Conn = Digital, Color = Unknown
    DefAssociation = 0x3, Sequence = 0x0
  Pin-ctls: 0x40: OUT
  Unsolicited: tag=00, enabled=0
  Power states:  D0 D3 EPSS
  Power: setting=D0, actual=D0
  Connection: 1
     0x04
Node 0x08 [Vendor Defined Widget] wcaps 0xf00000: Mono
--endcollapse--


!!ALSA Device nodes
!!-----------------

crw-rw---T+ 1 root audio 116,  8 Mar 13 13:50 /dev/snd/controlC0
crw-rw---T+ 1 root audio 116,  7 Mar 13 13:50 /dev/snd/hwC0D0
crw-rw---T+ 1 root audio 116,  6 Mar 13 13:50 /dev/snd/hwC0D3
crw-rw---T+ 1 root audio 116,  5 Mar 13 13:51 /dev/snd/pcmC0D0c
crw-rw---T+ 1 root audio 116,  4 Mar 13 13:51 /dev/snd/pcmC0D0p
crw-rw---T+ 1 root audio 116,  3 Mar 13 13:50 /dev/snd/pcmC0D2c
crw-rw---T+ 1 root audio 116,  2 Mar 13 13:51 /dev/snd/pcmC0D3p
crw-rw---T+ 1 root audio 116,  1 Mar 13 13:50 /dev/snd/seq
crw-rw---T+ 1 root audio 116, 33 Mar 13 13:50 /dev/snd/timer

/dev/snd/by-path:
total 0
drwxr-xr-x 2 root root  60 Mar 13 13:50 .
drwxr-xr-x 3 root root 240 Mar 13 13:50 ..
lrwxrwxrwx 1 root root  12 Mar 13 13:50 pci-0000:00:1b.0 -> ../controlC0


!!Aplay/Arecord output
!!--------------------

APLAY

**** List of PLAYBACK Hardware Devices ****
card 0: PCH [HDA Intel PCH], device 0: ALC262 Analog [ALC262 Analog]
  Subdevices: 1/1
  Subdevice #0: subdevice #0
card 0: PCH [HDA Intel PCH], device 3: HDMI 0 [HDMI 0]
  Subdevices: 1/1
  Subdevice #0: subdevice #0

ARECORD

**** List of CAPTURE Hardware Devices ****
card 0: PCH [HDA Intel PCH], device 0: ALC262 Analog [ALC262 Analog]
  Subdevices: 1/1
  Subdevice #0: subdevice #0
card 0: PCH [HDA Intel PCH], device 2: ALC262 Analog [ALC262 Analog]
  Subdevices: 2/2
  Subdevice #0: subdevice #0
  Subdevice #1: subdevice #1

!!Amixer output
!!-------------

!!-------Mixer controls for card 0 [PCH]

Card hw:0 'PCH'/'HDA Intel PCH at 0xfe420000 irq 49'
  Mixer name	: 'Intel CougarPoint HDMI'
  Components	: 'HDA:10ec0262,103c1587,00100202 HDA:80862805,103c1587,00100000'
  Controls      : 39
  Simple ctrls  : 18
Simple mixer control 'Master',0
  Capabilities: pvolume pvolume-joined pswitch pswitch-joined penum
  Playback channels: Mono
  Limits: Playback 0 - 31
  Mono: Playback 19 [61%] [-18.00dB] [on]
Simple mixer control 'Headphone',0
  Capabilities: pswitch penum
  Playback channels: Front Left - Front Right
  Mono:
  Front Left: Playback [on]
  Front Right: Playback [on]
Simple mixer control 'Speaker',0
  Capabilities: pvolume pvolume-joined pswitch pswitch-joined penum
  Playback channels: Mono
  Limits: Playback 0 - 31
  Mono: Playback 31 [100%] [0.00dB] [on]
Simple mixer control 'PCM',0
  Capabilities: pvolume pswitch penum
  Playback channels: Front Left - Front Right
  Limits: Playback 0 - 31
  Mono:
  Front Left: Playback 31 [100%] [0.00dB] [on]
  Front Right: Playback 31 [100%] [0.00dB] [on]
Simple mixer control 'Front Mic',0
  Capabilities: pvolume pswitch penum
  Playback channels: Front Left - Front Right
  Limits: Playback 0 - 31
  Mono:
  Front Left: Playback 0 [0%] [-34.50dB] [off]
  Front Right: Playback 0 [0%] [-34.50dB] [off]
Simple mixer control 'Front Mic Boost',0
  Capabilities: volume penum
  Playback channels: Front Left - Front Right
  Capture channels: Front Left - Front Right
  Limits: 0 - 3
  Front Left: 0 [0%] [0.00dB]
  Front Right: 0 [0%] [0.00dB]
Simple mixer control 'Line',0
  Capabilities: pvolume pswitch penum
  Playback channels: Front Left - Front Right
  Limits: Playback 0 - 31
  Mono:
  Front Left: Playback 0 [0%] [-34.50dB] [off]
  Front Right: Playback 0 [0%] [-34.50dB] [off]
Simple mixer control 'IEC958',0
  Capabilities: pswitch pswitch-joined penum
  Playback channels: Mono
  Mono: Playback [on]
Simple mixer control 'Beep',0
  Capabilities: pvolume pswitch penum
  Playback channels: Front Left - Front Right
  Limits: Playback 0 - 31
  Mono:
  Front Left: Playback 0 [0%] [-34.50dB] [off]
  Front Right: Playback 0 [0%] [-34.50dB] [off]
Simple mixer control 'Capture',0
  Capabilities: cvolume cswitch penum
  Capture channels: Front Left - Front Right
  Limits: Capture 0 - 31
  Front Left: Capture 10 [32%] [3.00dB] [on]
  Front Right: Capture 10 [32%] [3.00dB] [on]
Simple mixer control 'Capture',1
  Capabilities: cvolume cswitch penum
  Capture channels: Front Left - Front Right
  Limits: Capture 0 - 31
  Front Left: Capture 0 [0%] [-12.00dB] [off]
  Front Right: Capture 0 [0%] [-12.00dB] [off]
Simple mixer control 'Capture',2
  Capabilities: cvolume cswitch penum
  Capture channels: Front Left - Front Right
  Limits: Capture 0 - 31
  Front Left: Capture 0 [0%] [-12.00dB] [off]
  Front Right: Capture 0 [0%] [-12.00dB] [off]
Simple mixer control 'Auto-Mute Mode',0
  Capabilities: enum
  Items: 'Disabled' 'Speaker Only' 'Line Out+Speaker'
  Item0: 'Line Out+Speaker'
Simple mixer control 'Input Source',0
  Capabilities: cenum
  Items: 'Rear Mic' 'Front Mic' 'Line'
  Item0: 'Front Mic'
Simple mixer control 'Input Source',1
  Capabilities: cenum
  Items: 'Rear Mic' 'Front Mic' 'Line'
  Item0: 'Rear Mic'
Simple mixer control 'Input Source',2
  Capabilities: cenum
  Items: 'Rear Mic' 'Front Mic' 'Line'
  Item0: 'Rear Mic'
Simple mixer control 'Rear Mic',0
  Capabilities: pvolume pswitch penum
  Playback channels: Front Left - Front Right
  Limits: Playback 0 - 31
  Mono:
  Front Left: Playback 0 [0%] [-34.50dB] [off]
  Front Right: Playback 0 [0%] [-34.50dB] [off]
Simple mixer control 'Rear Mic Boost',0
  Capabilities: volume penum
  Playback channels: Front Left - Front Right
  Capture channels: Front Left - Front Right
  Limits: 0 - 3
  Front Left: 0 [0%] [0.00dB]
  Front Right: 0 [0%] [0.00dB]


!!Alsactl output
!!--------------

--startcollapse--
state.PCH {
	control.1 {
		iface MIXER
		name 'PCM Playback Volume'
		value.0 31
		value.1 31
		comment {
			access 'read write'
			type INTEGER
			count 2
			range '0 - 31'
			dbmin -4650
			dbmax 0
			dbvalue.0 0
			dbvalue.1 0
		}
	}
	control.2 {
		iface MIXER
		name 'PCM Playback Switch'
		value.0 true
		value.1 true
		comment {
			access 'read write'
			type BOOLEAN
			count 2
		}
	}
	control.3 {
		iface MIXER
		name 'Headphone Playback Switch'
		value.0 true
		value.1 true
		comment {
			access 'read write'
			type BOOLEAN
			count 2
		}
	}
	control.4 {
		iface MIXER
		name 'Speaker Playback Volume'
		value 31
		comment {
			access 'read write'
			type INTEGER
			count 1
			range '0 - 31'
			dbmin -4650
			dbmax 0
			dbvalue.0 0
		}
	}
	control.5 {
		iface MIXER
		name 'Speaker Playback Switch'
		value true
		comment {
			access 'read write'
			type BOOLEAN
			count 1
		}
	}
	control.6 {
		iface MIXER
		name 'Rear Mic Playback Volume'
		value.0 0
		value.1 0
		comment {
			access 'read write'
			type INTEGER
			count 2
			range '0 - 31'
			dbmin -3450
			dbmax 1200
			dbvalue.0 -3450
			dbvalue.1 -3450
		}
	}
	control.7 {
		iface MIXER
		name 'Rear Mic Playback Switch'
		value.0 false
		value.1 false
		comment {
			access 'read write'
			type BOOLEAN
			count 2
		}
	}
	control.8 {
		iface MIXER
		name 'Front Mic Playback Volume'
		value.0 0
		value.1 0
		comment {
			access 'read write'
			type INTEGER
			count 2
			range '0 - 31'
			dbmin -3450
			dbmax 1200
			dbvalue.0 -3450
			dbvalue.1 -3450
		}
	}
	control.9 {
		iface MIXER
		name 'Front Mic Playback Switch'
		value.0 false
		value.1 false
		comment {
			access 'read write'
			type BOOLEAN
			count 2
		}
	}
	control.10 {
		iface MIXER
		name 'Line Playback Volume'
		value.0 0
		value.1 0
		comment {
			access 'read write'
			type INTEGER
			count 2
			range '0 - 31'
			dbmin -3450
			dbmax 1200
			dbvalue.0 -3450
			dbvalue.1 -3450
		}
	}
	control.11 {
		iface MIXER
		name 'Line Playback Switch'
		value.0 false
		value.1 false
		comment {
			access 'read write'
			type BOOLEAN
			count 2
		}
	}
	control.12 {
		iface MIXER
		name 'Auto-Mute Mode'
		value 'Line Out+Speaker'
		comment {
			access 'read write'
			type ENUMERATED
			count 1
			item.0 Disabled
			item.1 'Speaker Only'
			item.2 'Line Out+Speaker'
		}
	}
	control.13 {
		iface MIXER
		name 'Rear Mic Boost Volume'
		value.0 0
		value.1 0
		comment {
			access 'read write'
			type INTEGER
			count 2
			range '0 - 3'
			dbmin 0
			dbmax 3000
			dbvalue.0 0
			dbvalue.1 0
		}
	}
	control.14 {
		iface MIXER
		name 'Front Mic Boost Volume'
		value.0 0
		value.1 0
		comment {
			access 'read write'
			type INTEGER
			count 2
			range '0 - 3'
			dbmin 0
			dbmax 3000
			dbvalue.0 0
			dbvalue.1 0
		}
	}
	control.15 {
		iface MIXER
		name 'Capture Switch'
		value.0 true
		value.1 true
		comment {
			access 'read write'
			type BOOLEAN
			count 2
		}
	}
	control.16 {
		iface MIXER
		name 'Capture Switch'
		index 1
		value.0 false
		value.1 false
		comment {
			access 'read write'
			type BOOLEAN
			count 2
		}
	}
	control.17 {
		iface MIXER
		name 'Capture Switch'
		index 2
		value.0 false
		value.1 false
		comment {
			access 'read write'
			type BOOLEAN
			count 2
		}
	}
	control.18 {
		iface MIXER
		name 'Capture Volume'
		value.0 10
		value.1 10
		comment {
			access 'read write'
			type INTEGER
			count 2
			range '0 - 31'
			dbmin -1200
			dbmax 3450
			dbvalue.0 300
			dbvalue.1 300
		}
	}
	control.19 {
		iface MIXER
		name 'Capture Volume'
		index 1
		value.0 0
		value.1 0
		comment {
			access 'read write'
			type INTEGER
			count 2
			range '0 - 31'
			dbmin -1200
			dbmax 3450
			dbvalue.0 -1200
			dbvalue.1 -1200
		}
	}
	control.20 {
		iface MIXER
		name 'Capture Volume'
		index 2
		value.0 0
		value.1 0
		comment {
			access 'read write'
			type INTEGER
			count 2
			range '0 - 31'
			dbmin -1200
			dbmax 3450
			dbvalue.0 -1200
			dbvalue.1 -1200
		}
	}
	control.21 {
		iface MIXER
		name 'Input Source'
		value 'Front Mic'
		comment {
			access 'read write'
			type ENUMERATED
			count 1
			item.0 'Rear Mic'
			item.1 'Front Mic'
			item.2 Line
		}
	}
	control.22 {
		iface MIXER
		name 'Input Source'
		index 1
		value 'Rear Mic'
		comment {
			access 'read write'
			type ENUMERATED
			count 1
			item.0 'Rear Mic'
			item.1 'Front Mic'
			item.2 Line
		}
	}
	control.23 {
		iface MIXER
		name 'Input Source'
		index 2
		value 'Rear Mic'
		comment {
			access 'read write'
			type ENUMERATED
			count 1
			item.0 'Rear Mic'
			item.1 'Front Mic'
			item.2 Line
		}
	}
	control.24 {
		iface MIXER
		name 'Beep Playback Volume'
		value.0 0
		value.1 0
		comment {
			access 'read write'
			type INTEGER
			count 2
			range '0 - 31'
			dbmin -3450
			dbmax 1200
			dbvalue.0 -3450
			dbvalue.1 -3450
		}
	}
	control.25 {
		iface MIXER
		name 'Beep Playback Switch'
		value.0 false
		value.1 false
		comment {
			access 'read write'
			type BOOLEAN
			count 2
		}
	}
	control.26 {
		iface MIXER
		name 'Master Playback Volume'
		value 19
		comment {
			access 'read write'
			type INTEGER
			count 1
			range '0 - 31'
			dbmin -4650
			dbmax 0
			dbvalue.0 -1800
		}
	}
	control.27 {
		iface MIXER
		name 'Master Playback Switch'
		value true
		comment {
			access 'read write'
			type BOOLEAN
			count 1
		}
	}
	control.28 {
		iface CARD
		name 'Line Out Jack'
		value false
		comment {
			access read
			type BOOLEAN
			count 1
		}
	}
	control.29 {
		iface CARD
		name 'Front Headphone Jack'
		value false
		comment {
			access read
			type BOOLEAN
			count 1
		}
	}
	control.30 {
		iface CARD
		name 'Speaker Phantom Jack'
		value true
		comment {
			access read
			type BOOLEAN
			count 1
		}
	}
	control.31 {
		iface CARD
		name 'Rear Mic Jack'
		value false
		comment {
			access read
			type BOOLEAN
			count 1
		}
	}
	control.32 {
		iface CARD
		name 'Front Mic Jack'
		value false
		comment {
			access read
			type BOOLEAN
			count 1
		}
	}
	control.33 {
		iface CARD
		name 'Line Jack'
		value false
		comment {
			access read
			type BOOLEAN
			count 1
		}
	}
	control.34 {
		iface CARD
		name 'HDMI/DP,pcm=3 Jack'
		value false
		comment {
			access read
			type BOOLEAN
			count 1
		}
	}
	control.35 {
		iface MIXER
		name 'IEC958 Playback Con Mask'
		value '0fff000000000000000000000000000000000000000000000000000000000000000000000000000000000000000000000000000000000000000000000000000000000000000000000000000000000000000000000000000000000000000000000000000000000000000000000000000000000000000000000000000000000000000000000000000000000000000000000000000000000000000000000000000000000000000000000000000000000000'
		comment {
			access read
			type IEC958
			count 1
		}
	}
	control.36 {
		iface MIXER
		name 'IEC958 Playback Pro Mask'
		value '0f00000000000000000000000000000000000000000000000000000000000000000000000000000000000000000000000000000000000000000000000000000000000000000000000000000000000000000000000000000000000000000000000000000000000000000000000000000000000000000000000000000000000000000000000000000000000000000000000000000000000000000000000000000000000000000000000000000000000000'
		comment {
			access read
			type IEC958
			count 1
		}
	}
	control.37 {
		iface MIXER
		name 'IEC958 Playback Default'
		value '0400000000000000000000000000000000000000000000000000000000000000000000000000000000000000000000000000000000000000000000000000000000000000000000000000000000000000000000000000000000000000000000000000000000000000000000000000000000000000000000000000000000000000000000000000000000000000000000000000000000000000000000000000000000000000000000000000000000000000'
		comment {
			access 'read write'
			type IEC958
			count 1
		}
	}
	control.38 {
		iface MIXER
		name 'IEC958 Playback Switch'
		value true
		comment {
			access 'read write'
			type BOOLEAN
			count 1
		}
	}
	control.39 {
		iface PCM
		device 3
		name ELD
		value ''
		comment {
			access read
			type BYTES
			count 0
		}
	}
}
--endcollapse--


!!All Loaded Modules
!!------------------

Module
bnep
rfcomm
parport_pc
bluetooth
ppdev
snd_hda_codec_hdmi
snd_hda_codec_realtek
snd_hda_intel
snd_hda_codec
joydev
coretemp
snd_hwdep
snd_pcm
snd_seq_midi
snd_rawmidi
snd_seq_midi_event
snd_seq
snd_timer
kvm
snd_seq_device
i915
ghash_clmulni_intel
psmouse
aesni_intel
snd
cryptd
gpio_ich
mei
aes_x86_64
hp_wmi
drm_kms_helper
drm
lpc_ich
sparse_keymap
microcode
soundcore
serio_raw
snd_page_alloc
wmi
i2c_algo_bit
mac_hid
video
lp
parport
hid_generic
usbhid
hid
e1000e


!!Sysfs Files
!!-----------

/sys/class/sound/hwC0D0/init_pin_configs:
0x12 0x411111f0
0x14 0x411111f0
0x15 0x01014c10
0x16 0x99030120
0x18 0x01a19c30
0x19 0x02a11c31
0x1a 0x01813c3f
0x1b 0x02211c40
0x1c 0x411111f0
0x1d 0x411111f0
0x1e 0x411111f0
0x1f 0x411111f0

/sys/class/sound/hwC0D0/driver_pin_configs:

/sys/class/sound/hwC0D0/user_pin_configs:

/sys/class/sound/hwC0D0/init_verbs:

/sys/class/sound/hwC0D3/init_pin_configs:
0x05 0x58560010
0x06 0x18560020
0x07 0x58560030

/sys/class/sound/hwC0D3/driver_pin_configs:

/sys/class/sound/hwC0D3/user_pin_configs:

/sys/class/sound/hwC0D3/init_verbs:


!!ALSA/HDA dmesg
!!--------------

[    8.297956] [drm] Initialized i915 1.6.0 20080730 for 0000:00:02.0 on minor 0
[    8.298053] snd_hda_intel 0000:00:1b.0: irq 49 for MSI/MSI-X
[    8.513002] e1000e 0000:00:19.0: irq 46 for MSI/MSI-X
--
[    8.614899] IPv6: ADDRCONF(NETDEV_UP): eth0: link is not ready
[    8.858392] hda_codec: ALC262: SKU not ready 0x411111f0
[    8.869527] input: HDA Intel PCH HDMI/DP,pcm=3 as /devices/pci0000:00/0000:00:1b.0/sound/card0/input5
[    8.869592] input: HDA Intel PCH Line as /devices/pci0000:00/0000:00:1b.0/sound/card0/input6
[    8.869624] input: HDA Intel PCH Front Mic as /devices/pci0000:00/0000:00:1b.0/sound/card0/input7
[    8.869656] input: HDA Intel PCH Rear Mic as /devices/pci0000:00/0000:00:1b.0/sound/card0/input8
[    8.869685] input: HDA Intel PCH Front Headphone as /devices/pci0000:00/0000:00:1b.0/sound/card0/input9
[    8.869716] input: HDA Intel PCH Line Out as /devices/pci0000:00/0000:00:1b.0/sound/card0/input10
[    9.580719] ppdev: user-space parallel port driver


