upload=true&script=true&cardinfo=
!!################################
!!ALSA Information Script v 0.4.61
!!################################

!!Script ran on: Mon Aug 25 07:23:06 UTC 2014


!!Linux Distribution
!!------------------

Ubuntu 12.04.4 LTS \n \l DISTRIB_ID=Ubuntu DISTRIB_DESCRIPTION="Ubuntu 12.04.4 LTS" NAME="Ubuntu" ID=ubuntu ID_LIKE=debian PRETTY_NAME="Ubuntu precise (12.04.4 LTS)"


!!DMI Information
!!---------------

Manufacturer:      Hewlett-Packard
Product Name:      HP ProDesk 400 G1 SFF
Product Version:   
Firmware Version:  L02 v02.01


!!Kernel Information
!!------------------

Kernel release:    3.11.0-18-generic
Operating System:  GNU/Linux
Architecture:      x86_64
Processor:         x86_64
SMP Enabled:       Yes


!!ALSA Version
!!------------

Driver version:     k3.11.0-18-generic
Library version:    1.0.25
Utilities version:  1.0.25


!!Loaded ALSA modules
!!-------------------

snd_hda_intel


!!Sound Servers on this system
!!----------------------------

Pulseaudio:
      Installed - Yes (/usr/bin/pulseaudio)
      Running - Yes


!!Soundcards recognised by ALSA
!!-----------------------------

 0 [PCH            ]: HDA-Intel - HDA Intel PCH
                      HDA Intel PCH at 0xf7d10000 irq 44


!!PCI Soundcards installed in the system
!!--------------------------------------

00:1b.0 Audio device: Intel Corporation 8 Series/C220 Series Chipset High Definition Audio Controller (rev 04)


!!Advanced information - PCI Vendor/Device/Subsystem ID's
!!-------------------------------------------------------

00:02.0 0300: 8086:0402 (rev 06) (prog-if 00 [VGA controller])
	Subsystem: 103c:18e9
--
00:1b.0 0403: 8086:8c20 (rev 04)
	Subsystem: 103c:18e9


!!Modprobe options (Sound related)
!!--------------------------------

snd-atiixp-modem: index=-2
snd-intel8x0m: index=-2
snd-via82xx-modem: index=-2
snd-usb-audio: index=-2
snd-usb-caiaq: index=-2
snd-usb-ua101: index=-2
snd-usb-us122l: index=-2
snd-usb-usx2y: index=-2
snd-cmipci: mpu_port=0x330 fm_port=0x388
snd-pcsp: index=-2
snd-usb-audio: index=-2


!!Loaded sound module options
!!---------------------------

!!Module: snd_hda_intel
	align_buffer_size : -1
	bdl_pos_adj : 1,-1,-1,-1,-1,-1,-1,-1,-1,-1,-1,-1,-1,-1,-1,-1,-1,-1,-1,-1,-1,-1,-1,-1,-1,-1,-1,-1,-1,-1,-1,-1
	beep_mode : N,N,N,N,N,N,N,N,N,N,N,N,N,N,N,N,N,N,N,N,N,N,N,N,N,N,N,N,N,N,N,N
	enable : Y,Y,Y,Y,Y,Y,Y,Y,Y,Y,Y,Y,Y,Y,Y,Y,Y,Y,Y,Y,Y,Y,Y,Y,Y,Y,Y,Y,Y,Y,Y,Y
	enable_msi : -1
	id : (null),(null),(null),(null),(null),(null),(null),(null),(null),(null),(null),(null),(null),(null),(null),(null),(null),(null),(null),(null),(null),(null),(null),(null),(null),(null),(null),(null),(null),(null),(null),(null)
	index : -1,-1,-1,-1,-1,-1,-1,-1,-1,-1,-1,-1,-1,-1,-1,-1,-1,-1,-1,-1,-1,-1,-1,-1,-1,-1,-1,-1,-1,-1,-1,-1
	jackpoll_ms : 0,0,0,0,0,0,0,0,0,0,0,0,0,0,0,0,0,0,0,0,0,0,0,0,0,0,0,0,0,0,0,0
	model : (null),(null),(null),(null),(null),(null),(null),(null),(null),(null),(null),(null),(null),(null),(null),(null),(null),(null),(null),(null),(null),(null),(null),(null),(null),(null),(null),(null),(null),(null),(null),(null)
	patch : (null),(null),(null),(null),(null),(null),(null),(null),(null),(null),(null),(null),(null),(null),(null),(null),(null),(null),(null),(null),(null),(null),(null),(null),(null),(null),(null),(null),(null),(null),(null),(null)
	position_fix : -1,-1,-1,-1,-1,-1,-1,-1,-1,-1,-1,-1,-1,-1,-1,-1,-1,-1,-1,-1,-1,-1,-1,-1,-1,-1,-1,-1,-1,-1,-1,-1
	power_save : 1
	power_save_controller : Y
	probe_mask : -1,-1,-1,-1,-1,-1,-1,-1,-1,-1,-1,-1,-1,-1,-1,-1,-1,-1,-1,-1,-1,-1,-1,-1,-1,-1,-1,-1,-1,-1,-1,-1
	probe_only : 0,0,0,0,0,0,0,0,0,0,0,0,0,0,0,0,0,0,0,0,0,0,0,0,0,0,0,0,0,0,0,0
	single_cmd : N
	snoop : Y


!!HDA-Intel Codec information
!!---------------------------
--startcollapse--

Codec: Realtek ALC221
Address: 0
AFG Function Id: 0x1 (unsol 1)
Vendor Id: 0x10ec0221
Subsystem Id: 0x103c18e9
Revision Id: 0x100003
No Modem Function Group found
Default PCM:
    rates [0x560]: 44100 48000 96000 192000
    bits [0xe]: 16 20 24
    formats [0x1]: PCM
Default Amp-In caps: N/A
Default Amp-Out caps: N/A
State of AFG node 0x01:
  Power states:  D0 D1 D2 D3 CLKSTOP EPSS
  Power: setting=D0, actual=D0
GPIO: io=2, o=0, i=0, unsolicited=1, wake=0
  IO[0]: enable=0, dir=0, wake=0, sticky=0, data=0, unsol=0
  IO[1]: enable=0, dir=0, wake=0, sticky=0, data=0, unsol=0
Node 0x02 [Audio Output] wcaps 0x1d: Stereo Amp-Out
  Control: name="Speaker Playback Volume", index=0, device=0
    ControlAmp: chs=3, dir=Out, idx=0, ofs=0
  Amp-Out caps: ofs=0x57, nsteps=0x57, stepsize=0x02, mute=0
  Amp-Out vals:  [0x3d 0x3d]
  Converter: stream=0, channel=0
  PCM:
    rates [0x560]: 44100 48000 96000 192000
    bits [0xe]: 16 20 24
    formats [0x1]: PCM
Node 0x03 [Audio Output] wcaps 0x1d: Stereo Amp-Out
  Control: name="PCM Playback Volume", index=0, device=0
    ControlAmp: chs=3, dir=Out, idx=0, ofs=0
  Device: name="ALC221 Analog", type="Audio", device=0
  Amp-Out caps: ofs=0x57, nsteps=0x57, stepsize=0x02, mute=0
  Amp-Out vals:  [0x3d 0x3d]
  Converter: stream=0, channel=0
  PCM:
    rates [0x560]: 44100 48000 96000 192000
    bits [0xe]: 16 20 24
    formats [0x1]: PCM
Node 0x04 [Vendor Defined Widget] wcaps 0xf00000: Mono
Node 0x05 [Vendor Defined Widget] wcaps 0xf00000: Mono
Node 0x06 [Audio Output] wcaps 0x211: Stereo Digital
  Converter: stream=0, channel=0
  Digital:
  Digital category: 0x0
  IEC Coding Type: 0x0
  PCM:
    rates [0x5e0]: 44100 48000 88200 96000 192000
    bits [0xe]: 16 20 24
    formats [0x1]: PCM
Node 0x07 [Vendor Defined Widget] wcaps 0xf00000: Mono
Node 0x08 [Audio Input] wcaps 0x10011b: Stereo Amp-In
  Control: name="Capture Volume", index=0, device=0
    ControlAmp: chs=3, dir=In, idx=0, ofs=0
  Control: name="Capture Switch", index=0, device=0
    ControlAmp: chs=3, dir=In, idx=0, ofs=0
  Device: name="ALC221 Analog", type="Audio", device=0
  Amp-In caps: ofs=0x0b, nsteps=0x1f, stepsize=0x05, mute=1
  Amp-In vals:  [0x13 0x13]
  Converter: stream=0, channel=0
  SDI-Select: 0
  PCM:
    rates [0x560]: 44100 48000 96000 192000
    bits [0xe]: 16 20 24
    formats [0x1]: PCM
  Connection: 1
     0x23
Node 0x09 [Audio Input] wcaps 0x10011b: Stereo Amp-In
  Control: name="Capture Volume", index=1, device=0
    ControlAmp: chs=3, dir=In, idx=0, ofs=0
  Control: name="Capture Switch", index=1, device=0
    ControlAmp: chs=3, dir=In, idx=0, ofs=0
  Device: name="ALC221 Alt Analog", type="Audio", device=2
  Amp-In caps: ofs=0x0b, nsteps=0x1f, stepsize=0x05, mute=1
  Amp-In vals:  [0x80 0x80]
  Converter: stream=0, channel=0
  SDI-Select: 0
  PCM:
    rates [0x560]: 44100 48000 96000 192000
    bits [0xe]: 16 20 24
    formats [0x1]: PCM
  Connection: 1
     0x22
Node 0x0a [Vendor Defined Widget] wcaps 0xf00000: Mono
Node 0x0b [Audio Mixer] wcaps 0x20010b: Stereo Amp-In
  Control: name="Mic Playback Volume", index=0, device=0
    ControlAmp: chs=3, dir=In, idx=2, ofs=0
  Control: name="Mic Playback Switch", index=0, device=0
    ControlAmp: chs=3, dir=In, idx=2, ofs=0
  Control: name="Line Playback Volume", index=0, device=0
    ControlAmp: chs=3, dir=In, idx=3, ofs=0
  Control: name="Line Playback Switch", index=0, device=0
    ControlAmp: chs=3, dir=In, idx=3, ofs=0
  Control: name="Beep Playback Volume", index=0, device=0
    ControlAmp: chs=3, dir=In, idx=4, ofs=0
  Control: name="Beep Playback Switch", index=0, device=0
    ControlAmp: chs=3, dir=In, idx=4, ofs=0
  Amp-In caps: ofs=0x17, nsteps=0x1f, stepsize=0x05, mute=1
  Amp-In vals:  [0x80 0x80] [0x80 0x80] [0x80 0x80] [0x80 0x80] [0x80 0x80]
  Connection: 5
     0x18 0x19 0x1a 0x1b 0x1d
Node 0x0c [Audio Mixer] wcaps 0x20010b: Stereo Amp-In
  Amp-In caps: ofs=0x00, nsteps=0x00, stepsize=0x00, mute=1
  Amp-In vals:  [0x00 0x00] [0x80 0x80]
  Connection: 2
     0x02 0x0b
Node 0x0d [Audio Mixer] wcaps 0x20010b: Stereo Amp-In
  Amp-In caps: ofs=0x00, nsteps=0x00, stepsize=0x00, mute=1
  Amp-In vals:  [0x00 0x00] [0x00 0x00]
  Connection: 2
     0x03 0x0b
Node 0x0e [Vendor Defined Widget] wcaps 0xf00000: Mono
Node 0x0f [Audio Mixer] wcaps 0x20010a: Mono Amp-In
  Amp-In caps: ofs=0x00, nsteps=0x00, stepsize=0x00, mute=1
  Amp-In vals:  [0x00] [0x00]
  Connection: 2
     0x02 0x0b
Node 0x10 [Vendor Defined Widget] wcaps 0xf00000: Mono
Node 0x11 [Vendor Defined Widget] wcaps 0xf00000: Mono
Node 0x12 [Pin Complex] wcaps 0x40000b: Stereo Amp-In
  Amp-In caps: ofs=0x00, nsteps=0x03, stepsize=0x2f, mute=0
  Amp-In vals:  [0x00 0x00]
  Pincap 0x00000020: IN
  Pin Default 0x40080000: [N/A] Line Out at Ext N/A
    Conn = DIN, Color = Unknown
    DefAssociation = 0x0, Sequence = 0x0
  Pin-ctls: 0x00:
Node 0x13 [Vendor Defined Widget] wcaps 0xf00000: Mono
Node 0x14 [Pin Complex] wcaps 0x40018d: Stereo Amp-Out
  Control: name="PCM Playback Switch", index=0, device=0
    ControlAmp: chs=3, dir=Out, idx=0, ofs=0
  Control: name="Line Out Jack", index=0, device=0
  Amp-Out caps: ofs=0x00, nsteps=0x00, stepsize=0x00, mute=1
  Amp-Out vals:  [0x00 0x00]
  Pincap 0x00010014: OUT EAPD Detect
  EAPD 0x2: EAPD
  Pin Default 0x01014020: [Jack] Line Out at Ext Rear
    Conn = 1/8, Color = Green
    DefAssociation = 0x2, Sequence = 0x0
  Pin-ctls: 0x40: OUT
  Unsolicited: tag=02, enabled=1
  Connection: 2
     0x0c 0x0d*
Node 0x15 [Vendor Defined Widget] wcaps 0xf00000: Mono
Node 0x16 [Vendor Defined Widget] wcaps 0xf00000: Mono
Node 0x17 [Pin Complex] wcaps 0x40010c: Mono Amp-Out
  Control: name="Speaker Playback Switch", index=0, device=0
    ControlAmp: chs=1, dir=Out, idx=0, ofs=0
  Control: name="Speaker Phantom Jack", index=0, device=0
  Amp-Out caps: ofs=0x00, nsteps=0x00, stepsize=0x00, mute=1
  Amp-Out vals:  [0x00]
  Pincap 0x00010010: OUT EAPD
  EAPD 0x2: EAPD
  Pin Default 0x90170110: [Fixed] Speaker at Int N/A
    Conn = Analog, Color = Unknown
    DefAssociation = 0x1, Sequence = 0x0
    Misc = NO_PRESENCE
  Pin-ctls: 0x40: OUT
  Connection: 1
     0x0f
Node 0x18 [Pin Complex] wcaps 0x40018f: Stereo Amp-In Amp-Out
  Amp-In caps: ofs=0x00, nsteps=0x03, stepsize=0x2f, mute=0
  Amp-In vals:  [0x00 0x00]
  Amp-Out caps: ofs=0x00, nsteps=0x00, stepsize=0x00, mute=1
  Amp-Out vals:  [0x80 0x80]
  Pincap 0x00003734: IN OUT Detect
    Vref caps: HIZ 50 GRD 80 100
  Pin Default 0x411111f0: [N/A] Speaker at Ext Rear
    Conn = 1/8, Color = Black
    DefAssociation = 0xf, Sequence = 0x0
    Misc = NO_PRESENCE
  Pin-ctls: 0x20: IN VREF_HIZ
  Unsolicited: tag=00, enabled=0
  Connection: 1
     0x0d
Node 0x19 [Pin Complex] wcaps 0x40008b: Stereo Amp-In
  Amp-In caps: ofs=0x00, nsteps=0x03, stepsize=0x2f, mute=0
  Amp-In vals:  [0x00 0x00]
  Pincap 0x00003724: IN Detect
    Vref caps: HIZ 50 GRD 80 100
  Pin Default 0x411111f0: [N/A] Speaker at Ext Rear
    Conn = 1/8, Color = Black
    DefAssociation = 0xf, Sequence = 0x0
    Misc = NO_PRESENCE
  Pin-ctls: 0x20: IN VREF_HIZ
  Unsolicited: tag=00, enabled=0
Node 0x1a [Pin Complex] wcaps 0x40018f: Stereo Amp-In Amp-Out
  Control: name="Mic Boost Volume", index=0, device=0
    ControlAmp: chs=3, dir=In, idx=0, ofs=0
  Control: name="Mic Jack", index=0, device=0
  Amp-In caps: ofs=0x00, nsteps=0x03, stepsize=0x2f, mute=0
  Amp-In vals:  [0x00 0x00]
  Amp-Out caps: ofs=0x00, nsteps=0x00, stepsize=0x00, mute=1
  Amp-Out vals:  [0x80 0x80]
  Pincap 0x0000373c: IN OUT HP Detect
    Vref caps: HIZ 50 GRD 80 100
  Pin Default 0x02a11030: [Jack] Mic at Ext Front
    Conn = 1/8, Color = Black
    DefAssociation = 0x3, Sequence = 0x0
  Pin-ctls: 0x24: IN VREF_80
  Unsolicited: tag=03, enabled=1
  Connection: 2
     0x0c* 0x0d
Node 0x1b [Pin Complex] wcaps 0x40018f: Stereo Amp-In Amp-Out
  Control: name="Line Boost Volume", index=0, device=0
    ControlAmp: chs=3, dir=In, idx=0, ofs=0
  Control: name="Line Jack", index=0, device=0
  Amp-In caps: ofs=0x00, nsteps=0x03, stepsize=0x2f, mute=0
  Amp-In vals:  [0x00 0x00]
  Amp-Out caps: ofs=0x00, nsteps=0x00, stepsize=0x00, mute=1
  Amp-Out vals:  [0x80 0x80]
  Pincap 0x00000034: IN OUT Detect
  Pin Default 0x0181303f: [Jack] Line In at Ext Rear
    Conn = 1/8, Color = Blue
    DefAssociation = 0x3, Sequence = 0xf
  Pin-ctls: 0x20: IN
  Unsolicited: tag=04, enabled=1
  Connection: 2
     0x0c* 0x0d
Node 0x1c [Vendor Defined Widget] wcaps 0xf00000: Mono
Node 0x1d [Pin Complex] wcaps 0x400000: Mono
  Pincap 0x00000020: IN
  Pin Default 0x40500001: [N/A] Digital Out at Ext N/A
    Conn = Unknown, Color = Unknown
    DefAssociation = 0x0, Sequence = 0x1
  Pin-ctls: 0x20: IN
Node 0x1e [Pin Complex] wcaps 0x400381: Stereo Digital
  Pincap 0x00000010: OUT
  Pin Default 0x411111f0: [N/A] Speaker at Ext Rear
    Conn = 1/8, Color = Black
    DefAssociation = 0xf, Sequence = 0x0
    Misc = NO_PRESENCE
  Pin-ctls: 0x40: OUT
  Unsolicited: tag=00, enabled=0
  Connection: 1
     0x06
Node 0x1f [Vendor Defined Widget] wcaps 0xf00000: Mono
Node 0x20 [Vendor Defined Widget] wcaps 0xf00040: Mono
  Processing caps: benign=0, ncoeff=28
Node 0x21 [Pin Complex] wcaps 0x40018d: Stereo Amp-Out
  Control: name="Headphone Playback Switch", index=0, device=0
    ControlAmp: chs=3, dir=Out, idx=0, ofs=0
  Control: name="Front Headphone Jack", index=0, device=0
  Amp-Out caps: ofs=0x00, nsteps=0x00, stepsize=0x00, mute=1
  Amp-Out vals:  [0x00 0x00]
  Pincap 0x0001001c: OUT HP EAPD Detect
  EAPD 0x2: EAPD
  Pin Default 0x0221102f: [Jack] HP Out at Ext Front
    Conn = 1/8, Color = Black
    DefAssociation = 0x2, Sequence = 0xf
  Pin-ctls: 0xc0: OUT HP
  Unsolicited: tag=01, enabled=1
  Connection: 2
     0x0c 0x0d*
Node 0x22 [Audio Selector] wcaps 0x30010b: Stereo Amp-In
  Amp-In caps: N/A
  Amp-In vals:  [0x00 0x00] [0x00 0x00] [0x00 0x00] [0x00 0x00] [0x00 0x00] [0x00 0x00] [0x00 0x00]
  Connection: 7
     0x18 0x19 0x1a* 0x1b 0x1d 0x0b 0x12
Node 0x23 [Audio Mixer] wcaps 0x20010b: Stereo Amp-In
  Amp-In caps: ofs=0x00, nsteps=0x00, stepsize=0x00, mute=1
  Amp-In vals:  [0x80 0x80] [0x80 0x80] [0x00 0x00] [0x80 0x80] [0x80 0x80] [0x80 0x80]
  Connection: 6
     0x18 0x19 0x1a 0x1b 0x1d 0x0b
--endcollapse--


!!ALSA Device nodes
!!-----------------

crw-rw---T+ 1 root audio 116,  6 Aug 25 03:14 /dev/snd/controlC0
crw-rw---T+ 1 root audio 116,  5 Aug 25 03:14 /dev/snd/hwC0D0
crw-rw---T+ 1 root audio 116,  4 Aug 25 03:14 /dev/snd/pcmC0D0c
crw-rw---T+ 1 root audio 116,  3 Aug 25 03:14 /dev/snd/pcmC0D0p
crw-rw---T+ 1 root audio 116,  2 Aug 25 03:14 /dev/snd/pcmC0D2c
crw-rw---T+ 1 root audio 116,  1 Aug 25 03:14 /dev/snd/seq
crw-rw---T+ 1 root audio 116, 33 Aug 25 03:14 /dev/snd/timer

/dev/snd/by-path:
total 0
drwxr-xr-x 2 root root  60 Aug 25 03:14 .
drwxr-xr-x 3 root root 200 Aug 25 03:14 ..
lrwxrwxrwx 1 root root  12 Aug 25 03:14 pci-0000:00:1b.0 -> ../controlC0


!!Aplay/Arecord output
!!--------------------

APLAY

**** List of PLAYBACK Hardware Devices ****
card 0: PCH [HDA Intel PCH], device 0: ALC221 Analog [ALC221 Analog]
  Subdevices: 1/1
  Subdevice #0: subdevice #0

ARECORD

**** List of CAPTURE Hardware Devices ****
card 0: PCH [HDA Intel PCH], device 0: ALC221 Analog [ALC221 Analog]
  Subdevices: 1/1
  Subdevice #0: subdevice #0
card 0: PCH [HDA Intel PCH], device 2: ALC221 Alt Analog [ALC221 Alt Analog]
  Subdevices: 1/1
  Subdevice #0: subdevice #0

!!Amixer output
!!-------------

!!-------Mixer controls for card 0 [PCH]

Card hw:0 'PCH'/'HDA Intel PCH at 0xf7d10000 irq 44'
  Mixer name	: 'Realtek ALC221'
  Components	: 'HDA:10ec0221,103c18e9,00100003'
  Controls      : 30
  Simple ctrls  : 14
Simple mixer control 'Master',0
  Capabilities: pvolume pvolume-joined pswitch pswitch-joined penum
  Playback channels: Mono
  Limits: Playback 0 - 87
  Mono: Playback 61 [70%] [-19.50dB] [on]
Simple mixer control 'Headphone',0
  Capabilities: pswitch penum
  Playback channels: Front Left - Front Right
  Mono:
  Front Left: Playback [on]
  Front Right: Playback [on]
Simple mixer control 'Speaker',0
  Capabilities: pvolume pswitch pswitch-joined penum
  Playback channels: Front Left - Front Right
  Limits: Playback 0 - 87
  Mono:
  Front Left: Playback 87 [100%] [0.00dB] [on]
  Front Right: Playback 87 [100%] [0.00dB] [on]
Simple mixer control 'PCM',0
  Capabilities: pvolume pswitch penum
  Playback channels: Front Left - Front Right
  Limits: Playback 0 - 87
  Mono:
  Front Left: Playback 87 [100%] [0.00dB] [on]
  Front Right: Playback 87 [100%] [0.00dB] [on]
Simple mixer control 'Line',0
  Capabilities: pvolume pswitch penum
  Playback channels: Front Left - Front Right
  Limits: Playback 0 - 31
  Mono:
  Front Left: Playback 0 [0%] [-34.50dB] [off]
  Front Right: Playback 0 [0%] [-34.50dB] [off]
Simple mixer control 'Line Boost',0
  Capabilities: volume penum
  Playback channels: Front Left - Front Right
  Capture channels: Front Left - Front Right
  Limits: 0 - 3
  Front Left: 0 [0%] [0.00dB]
  Front Right: 0 [0%] [0.00dB]
Simple mixer control 'Mic',0
  Capabilities: pvolume pswitch penum
  Playback channels: Front Left - Front Right
  Limits: Playback 0 - 31
  Mono:
  Front Left: Playback 0 [0%] [-34.50dB] [off]
  Front Right: Playback 0 [0%] [-34.50dB] [off]
Simple mixer control 'Mic Boost',0
  Capabilities: volume penum
  Playback channels: Front Left - Front Right
  Capture channels: Front Left - Front Right
  Limits: 0 - 3
  Front Left: 0 [0%] [0.00dB]
  Front Right: 0 [0%] [0.00dB]
Simple mixer control 'Beep',0
  Capabilities: pvolume pswitch penum
  Playback channels: Front Left - Front Right
  Limits: Playback 0 - 31
  Mono:
  Front Left: Playback 0 [0%] [-34.50dB] [off]
  Front Right: Playback 0 [0%] [-34.50dB] [off]
Simple mixer control 'Capture',0
  Capabilities: cvolume cswitch penum
  Capture channels: Front Left - Front Right
  Limits: Capture 0 - 31
  Front Left: Capture 19 [61%] [12.00dB] [on]
  Front Right: Capture 19 [61%] [12.00dB] [on]
Simple mixer control 'Capture',1
  Capabilities: cvolume cswitch penum
  Capture channels: Front Left - Front Right
  Limits: Capture 0 - 31
  Front Left: Capture 0 [0%] [-16.50dB] [off]
  Front Right: Capture 0 [0%] [-16.50dB] [off]
Simple mixer control 'Auto-Mute Mode',0
  Capabilities: enum
  Items: 'Disabled' 'Speaker Only' 'Line Out+Speaker'
  Item0: 'Line Out+Speaker'
Simple mixer control 'Input Source',0
  Capabilities: cenum
  Items: 'Mic' 'Line'
  Item0: 'Mic'
Simple mixer control 'Input Source',1
  Capabilities: cenum
  Items: 'Mic' 'Line'
  Item0: 'Mic'


!!Alsactl output
!!--------------

--startcollapse--
state.PCH {
	control.1 {
		iface MIXER
		name 'PCM Playback Volume'
		value.0 87
		value.1 87
		comment {
			access 'read write'
			type INTEGER
			count 2
			range '0 - 87'
			dbmin -6525
			dbmax 0
			dbvalue.0 0
			dbvalue.1 0
		}
	}
	control.2 {
		iface MIXER
		name 'PCM Playback Switch'
		value.0 true
		value.1 true
		comment {
			access 'read write'
			type BOOLEAN
			count 2
		}
	}
	control.3 {
		iface MIXER
		name 'Headphone Playback Switch'
		value.0 true
		value.1 true
		comment {
			access 'read write'
			type BOOLEAN
			count 2
		}
	}
	control.4 {
		iface MIXER
		name 'Speaker Playback Volume'
		value.0 87
		value.1 87
		comment {
			access 'read write'
			type INTEGER
			count 2
			range '0 - 87'
			dbmin -6525
			dbmax 0
			dbvalue.0 0
			dbvalue.1 0
		}
	}
	control.5 {
		iface MIXER
		name 'Speaker Playback Switch'
		value true
		comment {
			access 'read write'
			type BOOLEAN
			count 1
		}
	}
	control.6 {
		iface MIXER
		name 'Mic Playback Volume'
		value.0 0
		value.1 0
		comment {
			access 'read write'
			type INTEGER
			count 2
			range '0 - 31'
			dbmin -3450
			dbmax 1200
			dbvalue.0 -3450
			dbvalue.1 -3450
		}
	}
	control.7 {
		iface MIXER
		name 'Mic Playback Switch'
		value.0 false
		value.1 false
		comment {
			access 'read write'
			type BOOLEAN
			count 2
		}
	}
	control.8 {
		iface MIXER
		name 'Line Playback Volume'
		value.0 0
		value.1 0
		comment {
			access 'read write'
			type INTEGER
			count 2
			range '0 - 31'
			dbmin -3450
			dbmax 1200
			dbvalue.0 -3450
			dbvalue.1 -3450
		}
	}
	control.9 {
		iface MIXER
		name 'Line Playback Switch'
		value.0 false
		value.1 false
		comment {
			access 'read write'
			type BOOLEAN
			count 2
		}
	}
	control.10 {
		iface MIXER
		name 'Auto-Mute Mode'
		value 'Line Out+Speaker'
		comment {
			access 'read write'
			type ENUMERATED
			count 1
			item.0 Disabled
			item.1 'Speaker Only'
			item.2 'Line Out+Speaker'
		}
	}
	control.11 {
		iface MIXER
		name 'Input Source'
		value Mic
		comment {
			access 'read write'
			type ENUMERATED
			count 1
			item.0 Mic
			item.1 Line
		}
	}
	control.12 {
		iface MIXER
		name 'Input Source'
		index 1
		value Mic
		comment {
			access 'read write'
			type ENUMERATED
			count 1
			item.0 Mic
			item.1 Line
		}
	}
	control.13 {
		iface MIXER
		name 'Capture Volume'
		value.0 19
		value.1 19
		comment {
			access 'read write'
			type INTEGER
			count 2
			range '0 - 31'
			dbmin -1650
			dbmax 3000
			dbvalue.0 1200
			dbvalue.1 1200
		}
	}
	control.14 {
		iface MIXER
		name 'Capture Switch'
		value.0 true
		value.1 true
		comment {
			access 'read write'
			type BOOLEAN
			count 2
		}
	}
	control.15 {
		iface MIXER
		name 'Capture Volume'
		index 1
		value.0 0
		value.1 0
		comment {
			access 'read write'
			type INTEGER
			count 2
			range '0 - 31'
			dbmin -1650
			dbmax 3000
			dbvalue.0 -1650
			dbvalue.1 -1650
		}
	}
	control.16 {
		iface MIXER
		name 'Capture Switch'
		index 1
		value.0 false
		value.1 false
		comment {
			access 'read write'
			type BOOLEAN
			count 2
		}
	}
	control.17 {
		iface MIXER
		name 'Mic Boost Volume'
		value.0 0
		value.1 0
		comment {
			access 'read write'
			type INTEGER
			count 2
			range '0 - 3'
			dbmin 0
			dbmax 3600
			dbvalue.0 0
			dbvalue.1 0
		}
	}
	control.18 {
		iface MIXER
		name 'Line Boost Volume'
		value.0 0
		value.1 0
		comment {
			access 'read write'
			type INTEGER
			count 2
			range '0 - 3'
			dbmin 0
			dbmax 3600
			dbvalue.0 0
			dbvalue.1 0
		}
	}
	control.19 {
		iface MIXER
		name 'Master Playback Volume'
		value 61
		comment {
			access 'read write'
			type INTEGER
			count 1
			range '0 - 87'
			dbmin -6525
			dbmax 0
			dbvalue.0 -1950
		}
	}
	control.20 {
		iface MIXER
		name 'Master Playback Switch'
		value true
		comment {
			access 'read write'
			type BOOLEAN
			count 1
		}
	}
	control.21 {
		iface CARD
		name 'Mic Jack'
		value false
		comment {
			access read
			type BOOLEAN
			count 1
		}
	}
	control.22 {
		iface CARD
		name 'Line Jack'
		value false
		comment {
			access read
			type BOOLEAN
			count 1
		}
	}
	control.23 {
		iface CARD
		name 'Line Out Jack'
		value false
		comment {
			access read
			type BOOLEAN
			count 1
		}
	}
	control.24 {
		iface CARD
		name 'Front Headphone Jack'
		value false
		comment {
			access read
			type BOOLEAN
			count 1
		}
	}
	control.25 {
		iface CARD
		name 'Speaker Phantom Jack'
		value true
		comment {
			access read
			type BOOLEAN
			count 1
		}
	}
	control.26 {
		iface MIXER
		name 'Beep Playback Volume'
		value.0 0
		value.1 0
		comment {
			access 'read write'
			type INTEGER
			count 2
			range '0 - 31'
			dbmin -3450
			dbmax 1200
			dbvalue.0 -3450
			dbvalue.1 -3450
		}
	}
	control.27 {
		iface MIXER
		name 'Beep Playback Switch'
		value.0 false
		value.1 false
		comment {
			access 'read write'
			type BOOLEAN
			count 2
		}
	}
	control.28 {
		iface PCM
		name 'Playback Channel Map'
		value.0 0
		value.1 0
		comment {
			access read
			type INTEGER
			count 2
			range '0 - 36'
		}
	}
	control.29 {
		iface PCM
		name 'Capture Channel Map'
		value.0 0
		value.1 0
		comment {
			access read
			type INTEGER
			count 2
			range '0 - 36'
		}
	}
	control.30 {
		iface PCM
		device 2
		name 'Capture Channel Map'
		value.0 0
		value.1 0
		comment {
			access read
			type INTEGER
			count 2
			range '0 - 36'
		}
	}
}
--endcollapse--


!!All Loaded Modules
!!------------------

Module
nfsd
nfs_acl
auth_rpcgss
nfs
fscache
lockd
sunrpc
autofs4
coretemp
nvram
rfcomm
bnep
bluetooth
parport_pc
ppdev
snd_hda_codec_realtek
i915
dm_multipath
snd_hda_intel
snd_hda_codec
scsi_dh
snd_hwdep
hp_wmi
snd_pcm
drm_kms_helper
sparse_keymap
snd_seq_midi
snd_rawmidi
snd_seq_midi_event
drm
snd_seq
snd_timer
wmi
snd_seq_device
psmouse
snd
i2c_algo_bit
soundcore
mei_me
snd_page_alloc
mac_hid
serio_raw
mei
lpc_ich
video
lp
parport
disable_mmc
binfmt_misc
hid_generic
usbhid
hid
dm_raid45
dm_mirror
dm_region_hash
dm_log
btrfs
r8169
mii
raid6_pq
ahci
libahci
xor
zlib_deflate


!!Sysfs Files
!!-----------

/sys/class/sound/hwC0D0/init_pin_configs:
0x12 0x40080000
0x14 0x01014020
0x17 0x90170110
0x18 0x411111f0
0x19 0x411111f0
0x1a 0x02a11030
0x1b 0x0181303f
0x1d 0x40500001
0x1e 0x411111f0
0x21 0x0221102f

/sys/class/sound/hwC0D0/driver_pin_configs:

/sys/class/sound/hwC0D0/user_pin_configs:

/sys/class/sound/hwC0D0/init_verbs:


!!ALSA/HDA dmesg
!!--------------

[    6.420586] input: HP WMI hotkeys as /devices/virtual/input/input5
[    6.508614] snd_hda_intel 0000:00:1b.0: irq 44 for MSI/MSI-X
[    6.518606] device-mapper: multipath: version 1.6.0 loaded
--
[    6.608570] realtek: Enabling init ASM_ID=0x0001 CODEC_ID=10ec0221
[    6.614707] input: HDA Intel PCH Front Headphone as /devices/pci0000:00/0000:00:1b.0/sound/card0/input6
[    6.614759] input: HDA Intel PCH Line Out as /devices/pci0000:00/0000:00:1b.0/sound/card0/input7
[    6.614795] input: HDA Intel PCH Line as /devices/pci0000:00/0000:00:1b.0/sound/card0/input8
[    6.614836] input: HDA Intel PCH Mic as /devices/pci0000:00/0000:00:1b.0/sound/card0/input9
[    6.615847] [drm] Memory usable by graphics device = 2048M


