upload=true&script=true&cardinfo=
!!################################
!!ALSA Information Script v 0.4.61
!!################################

!!Script ran on: Wed May 21 09:32:59 UTC 2014


!!Linux Distribution
!!------------------

Ubuntu 12.04.4 LTS \n \l DISTRIB_ID=Ubuntu DISTRIB_DESCRIPTION="Ubuntu 12.04.4 LTS" NAME="Ubuntu" ID=ubuntu ID_LIKE=debian PRETTY_NAME="Ubuntu precise (12.04.4 LTS)"


!!DMI Information
!!---------------

Manufacturer:      Hewlett-Packard
Product Name:      HP ProBook 445 G2
Product Version:   A3009CD10002
Firmware Version:  M75 Ver. 93.20


!!Kernel Information
!!------------------

Kernel release:    3.11.0-18-generic
Operating System:  GNU/Linux
Architecture:      x86_64
Processor:         x86_64
SMP Enabled:       Yes


!!ALSA Version
!!------------

Driver version:     k3.11.0-18-generic
Library version:    1.0.25
Utilities version:  1.0.25


!!Loaded ALSA modules
!!-------------------

snd_hda_intel
snd_hda_intel


!!Sound Servers on this system
!!----------------------------

Pulseaudio:
      Installed - Yes (/usr/bin/pulseaudio)
      Running - Yes


!!Soundcards recognised by ALSA
!!-----------------------------

 0 [Generic        ]: HDA-Intel - HD-Audio Generic
                      HD-Audio Generic at 0xd0b40000 irq 92
 1 [Generic_1      ]: HDA-Intel - HD-Audio Generic
                      HD-Audio Generic at 0xd0b44000 irq 16


!!PCI Soundcards installed in the system
!!--------------------------------------

00:01.1 Audio device: Advanced Micro Devices, Inc. [AMD/ATI] Device 1308
00:14.2 Audio device: Advanced Micro Devices, Inc. [AMD] FCH Azalia Controller (rev 01)


!!Advanced information - PCI Vendor/Device/Subsystem ID's
!!-------------------------------------------------------

00:01.1 0403: 1002:1308
	Subsystem: 103c:2234
--
00:14.2 0403: 1022:780d (rev 01)
	Subsystem: 103c:2234


!!Modprobe options (Sound related)
!!--------------------------------

snd-atiixp-modem: index=-2
snd-intel8x0m: index=-2
snd-via82xx-modem: index=-2
snd-usb-audio: index=-2
snd-usb-caiaq: index=-2
snd-usb-ua101: index=-2
snd-usb-us122l: index=-2
snd-usb-usx2y: index=-2
snd-cmipci: mpu_port=0x330 fm_port=0x388
snd-pcsp: index=-2
snd-usb-audio: index=-2


!!Loaded sound module options
!!---------------------------

!!Module: snd_hda_intel
	align_buffer_size : -1
	bdl_pos_adj : 32,32,-1,-1,-1,-1,-1,-1,-1,-1,-1,-1,-1,-1,-1,-1,-1,-1,-1,-1,-1,-1,-1,-1,-1,-1,-1,-1,-1,-1,-1,-1
	beep_mode : N,N,N,N,N,N,N,N,N,N,N,N,N,N,N,N,N,N,N,N,N,N,N,N,N,N,N,N,N,N,N,N
	enable : Y,Y,Y,Y,Y,Y,Y,Y,Y,Y,Y,Y,Y,Y,Y,Y,Y,Y,Y,Y,Y,Y,Y,Y,Y,Y,Y,Y,Y,Y,Y,Y
	enable_msi : -1
	id : (null),(null),(null),(null),(null),(null),(null),(null),(null),(null),(null),(null),(null),(null),(null),(null),(null),(null),(null),(null),(null),(null),(null),(null),(null),(null),(null),(null),(null),(null),(null),(null)
	index : -1,-1,-1,-1,-1,-1,-1,-1,-1,-1,-1,-1,-1,-1,-1,-1,-1,-1,-1,-1,-1,-1,-1,-1,-1,-1,-1,-1,-1,-1,-1,-1
	jackpoll_ms : 0,0,0,0,0,0,0,0,0,0,0,0,0,0,0,0,0,0,0,0,0,0,0,0,0,0,0,0,0,0,0,0
	model : (null),(null),(null),(null),(null),(null),(null),(null),(null),(null),(null),(null),(null),(null),(null),(null),(null),(null),(null),(null),(null),(null),(null),(null),(null),(null),(null),(null),(null),(null),(null),(null)
	patch : (null),(null),(null),(null),(null),(null),(null),(null),(null),(null),(null),(null),(null),(null),(null),(null),(null),(null),(null),(null),(null),(null),(null),(null),(null),(null),(null),(null),(null),(null),(null),(null)
	position_fix : -1,-1,-1,-1,-1,-1,-1,-1,-1,-1,-1,-1,-1,-1,-1,-1,-1,-1,-1,-1,-1,-1,-1,-1,-1,-1,-1,-1,-1,-1,-1,-1
	power_save : 1
	power_save_controller : Y
	probe_mask : -1,-1,-1,-1,-1,-1,-1,-1,-1,-1,-1,-1,-1,-1,-1,-1,-1,-1,-1,-1,-1,-1,-1,-1,-1,-1,-1,-1,-1,-1,-1,-1
	probe_only : 0,0,0,0,0,0,0,0,0,0,0,0,0,0,0,0,0,0,0,0,0,0,0,0,0,0,0,0,0,0,0,0
	single_cmd : N
	snoop : Y

!!Module: snd_hda_intel
	align_buffer_size : -1
	bdl_pos_adj : 32,32,-1,-1,-1,-1,-1,-1,-1,-1,-1,-1,-1,-1,-1,-1,-1,-1,-1,-1,-1,-1,-1,-1,-1,-1,-1,-1,-1,-1,-1,-1
	beep_mode : N,N,N,N,N,N,N,N,N,N,N,N,N,N,N,N,N,N,N,N,N,N,N,N,N,N,N,N,N,N,N,N
	enable : Y,Y,Y,Y,Y,Y,Y,Y,Y,Y,Y,Y,Y,Y,Y,Y,Y,Y,Y,Y,Y,Y,Y,Y,Y,Y,Y,Y,Y,Y,Y,Y
	enable_msi : -1
	id : (null),(null),(null),(null),(null),(null),(null),(null),(null),(null),(null),(null),(null),(null),(null),(null),(null),(null),(null),(null),(null),(null),(null),(null),(null),(null),(null),(null),(null),(null),(null),(null)
	index : -1,-1,-1,-1,-1,-1,-1,-1,-1,-1,-1,-1,-1,-1,-1,-1,-1,-1,-1,-1,-1,-1,-1,-1,-1,-1,-1,-1,-1,-1,-1,-1
	jackpoll_ms : 0,0,0,0,0,0,0,0,0,0,0,0,0,0,0,0,0,0,0,0,0,0,0,0,0,0,0,0,0,0,0,0
	model : (null),(null),(null),(null),(null),(null),(null),(null),(null),(null),(null),(null),(null),(null),(null),(null),(null),(null),(null),(null),(null),(null),(null),(null),(null),(null),(null),(null),(null),(null),(null),(null)
	patch : (null),(null),(null),(null),(null),(null),(null),(null),(null),(null),(null),(null),(null),(null),(null),(null),(null),(null),(null),(null),(null),(null),(null),(null),(null),(null),(null),(null),(null),(null),(null),(null)
	position_fix : -1,-1,-1,-1,-1,-1,-1,-1,-1,-1,-1,-1,-1,-1,-1,-1,-1,-1,-1,-1,-1,-1,-1,-1,-1,-1,-1,-1,-1,-1,-1,-1
	power_save : 1
	power_save_controller : Y
	probe_mask : -1,-1,-1,-1,-1,-1,-1,-1,-1,-1,-1,-1,-1,-1,-1,-1,-1,-1,-1,-1,-1,-1,-1,-1,-1,-1,-1,-1,-1,-1,-1,-1
	probe_only : 0,0,0,0,0,0,0,0,0,0,0,0,0,0,0,0,0,0,0,0,0,0,0,0,0,0,0,0,0,0,0,0
	single_cmd : N
	snoop : Y


!!HDA-Intel Codec information
!!---------------------------
--startcollapse--

Codec: ATI R6xx HDMI
Address: 0
AFG Function Id: 0x1 (unsol 0)
Vendor Id: 0x1002aa01
Subsystem Id: 0x00aa0100
Revision Id: 0x100500
No Modem Function Group found
Default PCM:
    rates [0x70]: 32000 44100 48000
    bits [0x2]: 16
    formats [0x1]: PCM
Default Amp-In caps: N/A
Default Amp-Out caps: N/A
State of AFG node 0x01:
  Power states:  D0 D3 CLKSTOP EPSS
  Power: setting=D0, actual=D0, Clock-stop-OK
GPIO: io=0, o=0, i=0, unsolicited=0, wake=0
Node 0x02 [Audio Output] wcaps 0x221: Stereo Digital Stripe
  Converter: stream=0, channel=0
  Digital: Enabled
  Digital category: 0x0
  IEC Coding Type: 0x0
Node 0x03 [Pin Complex] wcaps 0x400381: Stereo Digital
  Control: name="HDMI/DP,pcm=3 Jack", index=0, device=0
  Control: name="IEC958 Playback Con Mask", index=0, device=0
  Control: name="IEC958 Playback Pro Mask", index=0, device=0
  Control: name="IEC958 Playback Default", index=0, device=0
  Control: name="IEC958 Playback Switch", index=0, device=0
  Control: name="ELD", index=0, device=3
  Pincap 0x00000094: OUT Detect HDMI
  Pin Default 0x185600f0: [Jack] Digital Out at Int HDMI
    Conn = Digital, Color = Unknown
    DefAssociation = 0xf, Sequence = 0x0
  Pin-ctls: 0x40: OUT
  Unsolicited: tag=01, enabled=1
  Connection: 1
     0x02
Node 0x04 [Audio Output] wcaps 0x221: Stereo Digital Stripe
  Converter: stream=0, channel=0
  Digital:
  Digital category: 0x0
  IEC Coding Type: 0x0
Node 0x05 [Pin Complex] wcaps 0x400381: Stereo Digital
  Pincap 0x00000094: OUT Detect HDMI
  Pin Default 0x585600f0: [N/A] Digital Out at Int HDMI
    Conn = Digital, Color = Unknown
    DefAssociation = 0xf, Sequence = 0x0
  Pin-ctls: 0x40: OUT
  Unsolicited: tag=00, enabled=0
  Connection: 1
     0x04
Node 0x06 [Audio Output] wcaps 0x221: Stereo Digital Stripe
  Converter: stream=0, channel=0
  Digital:
  Digital category: 0x0
  IEC Coding Type: 0x0
Node 0x07 [Pin Complex] wcaps 0x400381: Stereo Digital
  Pincap 0x00000094: OUT Detect HDMI
  Pin Default 0x585600f0: [N/A] Digital Out at Int HDMI
    Conn = Digital, Color = Unknown
    DefAssociation = 0xf, Sequence = 0x0
  Pin-ctls: 0x40: OUT
  Unsolicited: tag=00, enabled=0
  Connection: 1
     0x06
Node 0x08 [Audio Output] wcaps 0x221: Stereo Digital Stripe
  Converter: stream=0, channel=0
  Digital:
  Digital category: 0x0
  IEC Coding Type: 0x0
Node 0x09 [Pin Complex] wcaps 0x400381: Stereo Digital
  Pincap 0x00000094: OUT Detect HDMI
  Pin Default 0x585600f0: [N/A] Digital Out at Int HDMI
    Conn = Digital, Color = Unknown
    DefAssociation = 0xf, Sequence = 0x0
  Pin-ctls: 0x40: OUT
  Unsolicited: tag=00, enabled=0
  Connection: 1
     0x08
Node 0x0a [Audio Output] wcaps 0x221: Stereo Digital Stripe
  Converter: stream=0, channel=0
  Digital:
  Digital category: 0x0
  IEC Coding Type: 0x0
Node 0x0b [Pin Complex] wcaps 0x400381: Stereo Digital
  Pincap 0x00000094: OUT Detect HDMI
  Pin Default 0x585600f0: [N/A] Digital Out at Int HDMI
    Conn = Digital, Color = Unknown
    DefAssociation = 0xf, Sequence = 0x0
  Pin-ctls: 0x40: OUT
  Unsolicited: tag=00, enabled=0
  Connection: 1
     0x0a
Node 0x0c [Audio Output] wcaps 0x221: Stereo Digital Stripe
  Converter: stream=0, channel=0
  Digital:
  Digital category: 0x0
  IEC Coding Type: 0x0
Node 0x0d [Pin Complex] wcaps 0x400381: Stereo Digital
  Pincap 0x00000094: OUT Detect HDMI
  Pin Default 0x585600f0: [N/A] Digital Out at Int HDMI
    Conn = Digital, Color = Unknown
    DefAssociation = 0xf, Sequence = 0x0
  Pin-ctls: 0x40: OUT
  Unsolicited: tag=00, enabled=0
  Connection: 1
     0x0c
Node 0x0e [Audio Output] wcaps 0x221: Stereo Digital Stripe
  Converter: stream=0, channel=0
  Digital:
  Digital category: 0x0
  IEC Coding Type: 0x0
Node 0x0f [Pin Complex] wcaps 0x400381: Stereo Digital
  Pincap 0x00000094: OUT Detect HDMI
  Pin Default 0x585600f0: [N/A] Digital Out at Int HDMI
    Conn = Digital, Color = Unknown
    DefAssociation = 0xf, Sequence = 0x0
  Pin-ctls: 0x40: OUT
  Unsolicited: tag=00, enabled=0
  Connection: 1
     0x0e
Codec: Realtek ALC282
Address: 0
AFG Function Id: 0x1 (unsol 1)
Vendor Id: 0x10ec0282
Subsystem Id: 0x103c2234
Revision Id: 0x100003
No Modem Function Group found
Default PCM:
    rates [0x560]: 44100 48000 96000 192000
    bits [0xe]: 16 20 24
    formats [0x1]: PCM
Default Amp-In caps: N/A
Default Amp-Out caps: N/A
State of AFG node 0x01:
  Power states:  D0 D1 D2 D3 CLKSTOP EPSS
  Power: setting=D0, actual=D0
GPIO: io=3, o=0, i=0, unsolicited=1, wake=0
  IO[0]: enable=0, dir=0, wake=0, sticky=0, data=0, unsol=0
  IO[1]: enable=0, dir=0, wake=0, sticky=0, data=0, unsol=0
  IO[2]: enable=0, dir=0, wake=0, sticky=0, data=0, unsol=0
Node 0x02 [Audio Output] wcaps 0x41d: Stereo Amp-Out
  Control: name="Speaker Playback Volume", index=0, device=0
    ControlAmp: chs=3, dir=Out, idx=0, ofs=0
  Amp-Out caps: ofs=0x57, nsteps=0x57, stepsize=0x02, mute=0
  Amp-Out vals:  [0x3d 0x3d]
  Converter: stream=0, channel=0
  PCM:
    rates [0x560]: 44100 48000 96000 192000
    bits [0xe]: 16 20 24
    formats [0x1]: PCM
  Power states:  D0 D1 D2 D3 EPSS
  Power: setting=D0, actual=D0
Node 0x03 [Audio Output] wcaps 0x41d: Stereo Amp-Out
  Control: name="Headphone Playback Volume", index=0, device=0
    ControlAmp: chs=3, dir=Out, idx=0, ofs=0
  Device: name="ALC282 Analog", type="Audio", device=0
  Amp-Out caps: ofs=0x57, nsteps=0x57, stepsize=0x02, mute=0
  Amp-Out vals:  [0x3d 0x3d]
  Converter: stream=0, channel=0
  PCM:
    rates [0x560]: 44100 48000 96000 192000
    bits [0xe]: 16 20 24
    formats [0x1]: PCM
  Power states:  D0 D1 D2 D3 EPSS
  Power: setting=D0, actual=D0
Node 0x04 [Vendor Defined Widget] wcaps 0xf00000: Mono
Node 0x05 [Vendor Defined Widget] wcaps 0xf00000: Mono
Node 0x06 [Audio Output] wcaps 0x611: Stereo Digital
  Converter: stream=0, channel=0
  Digital:
  Digital category: 0x0
  IEC Coding Type: 0x0
  PCM:
    rates [0x5e0]: 44100 48000 88200 96000 192000
    bits [0xe]: 16 20 24
    formats [0x1]: PCM
  Power states:  D0 D1 D2 D3 EPSS
  Power: setting=D0, actual=D0
Node 0x07 [Vendor Defined Widget] wcaps 0xf00000: Mono
Node 0x08 [Audio Input] wcaps 0x10051b: Stereo Amp-In
  Control: name="Capture Volume", index=0, device=0
    ControlAmp: chs=3, dir=In, idx=0, ofs=0
  Control: name="Capture Switch", index=0, device=0
    ControlAmp: chs=3, dir=In, idx=0, ofs=0
  Device: name="ALC282 Analog", type="Audio", device=0
  Amp-In caps: ofs=0x17, nsteps=0x3f, stepsize=0x02, mute=1
  Amp-In vals:  [0x27 0x27]
  Converter: stream=0, channel=0
  SDI-Select: 0
  PCM:
    rates [0x560]: 44100 48000 96000 192000
    bits [0xe]: 16 20 24
    formats [0x1]: PCM
  Power states:  D0 D1 D2 D3 EPSS
  Power: setting=D0, actual=D0
  Connection: 1
     0x23
Node 0x09 [Audio Input] wcaps 0x10051b: Stereo Amp-In
  Amp-In caps: ofs=0x17, nsteps=0x3f, stepsize=0x02, mute=1
  Amp-In vals:  [0x97 0x97]
  Converter: stream=0, channel=0
  SDI-Select: 0
  PCM:
    rates [0x560]: 44100 48000 96000 192000
    bits [0xe]: 16 20 24
    formats [0x1]: PCM
  Power states:  D0 D1 D2 D3 EPSS
  Power: setting=D0, actual=D0
  Connection: 1
     0x22
Node 0x0a [Vendor Defined Widget] wcaps 0xf00000: Mono
Node 0x0b [Audio Mixer] wcaps 0x20010b: Stereo Amp-In
  Control: name="Mic Playback Volume", index=0, device=0
    ControlAmp: chs=3, dir=In, idx=1, ofs=0
  Control: name="Mic Playback Switch", index=0, device=0
    ControlAmp: chs=3, dir=In, idx=1, ofs=0
  Control: name="Beep Playback Volume", index=0, device=0
    ControlAmp: chs=3, dir=In, idx=4, ofs=0
  Control: name="Beep Playback Switch", index=0, device=0
    ControlAmp: chs=3, dir=In, idx=4, ofs=0
  Amp-In caps: ofs=0x17, nsteps=0x1f, stepsize=0x05, mute=1
  Amp-In vals:  [0x80 0x80] [0x80 0x80] [0x80 0x80] [0x80 0x80] [0x80 0x80]
  Connection: 5
     0x18 0x19 0x1a 0x1b 0x1d
Node 0x0c [Audio Mixer] wcaps 0x20010b: Stereo Amp-In
  Amp-In caps: ofs=0x00, nsteps=0x00, stepsize=0x00, mute=1
  Amp-In vals:  [0x00 0x00] [0x00 0x00]
  Connection: 2
     0x02 0x0b
Node 0x0d [Audio Mixer] wcaps 0x20010b: Stereo Amp-In
  Amp-In caps: ofs=0x00, nsteps=0x00, stepsize=0x00, mute=1
  Amp-In vals:  [0x00 0x00] [0x00 0x00]
  Connection: 2
     0x03 0x0b
Node 0x0e [Vendor Defined Widget] wcaps 0xf00000: Mono
Node 0x0f [Audio Mixer] wcaps 0x20010a: Mono Amp-In
  Amp-In caps: ofs=0x00, nsteps=0x00, stepsize=0x00, mute=1
  Amp-In vals:  [0x00]
  Connection: 1
     0x0d
Node 0x10 [Vendor Defined Widget] wcaps 0xf00000: Mono
Node 0x11 [Audio Input] wcaps 0x10051b: Stereo Amp-In
  Amp-In caps: ofs=0x17, nsteps=0x3f, stepsize=0x02, mute=1
  Amp-In vals:  [0x27 0x27]
  Converter: stream=0, channel=0
  SDI-Select: 0
  PCM:
    rates [0x560]: 44100 48000 96000 192000
    bits [0xe]: 16 20 24
    formats [0x1]: PCM
  Power states:  D0 D1 D2 D3 EPSS
  Power: setting=D0, actual=D0
  Connection: 1
     0x12
Node 0x12 [Pin Complex] wcaps 0x40040b: Stereo Amp-In
  Control: name="Internal Mic Boost Volume", index=0, device=0
    ControlAmp: chs=3, dir=In, idx=0, ofs=0
  Control: name="Internal Mic Phantom Jack", index=0, device=0
  Amp-In caps: ofs=0x00, nsteps=0x03, stepsize=0x2f, mute=0
  Amp-In vals:  [0x00 0x00]
  Pincap 0x00000020: IN
  Pin Default 0x90a60140: [Fixed] Mic at Int N/A
    Conn = Digital, Color = Unknown
    DefAssociation = 0x4, Sequence = 0x0
    Misc = NO_PRESENCE
  Pin-ctls: 0x20: IN
  Power states:  D0 D1 D2 D3 EPSS
  Power: setting=D0, actual=D0
Node 0x13 [Vendor Defined Widget] wcaps 0xf00000: Mono
Node 0x14 [Pin Complex] wcaps 0x40058d: Stereo Amp-Out
  Control: name="Speaker Playback Switch", index=0, device=0
    ControlAmp: chs=3, dir=Out, idx=0, ofs=0
  Control: name="Speaker Phantom Jack", index=0, device=0
  Amp-Out caps: ofs=0x00, nsteps=0x00, stepsize=0x00, mute=1
  Amp-Out vals:  [0x00 0x00]
  Pincap 0x00010014: OUT EAPD Detect
  EAPD 0x2: EAPD
  Pin Default 0x90170110: [Fixed] Speaker at Int N/A
    Conn = Analog, Color = Unknown
    DefAssociation = 0x1, Sequence = 0x0
    Misc = NO_PRESENCE
  Pin-ctls: 0x40: OUT
  Unsolicited: tag=00, enabled=0
  Power states:  D0 D1 D2 D3 EPSS
  Power: setting=D0, actual=D0
  Connection: 1
     0x0c
Node 0x15 [Vendor Defined Widget] wcaps 0xf00000: Mono
Node 0x16 [Vendor Defined Widget] wcaps 0xf00000: Mono
Node 0x17 [Pin Complex] wcaps 0x40050c: Mono Amp-Out
  Amp-Out caps: ofs=0x00, nsteps=0x00, stepsize=0x00, mute=1
  Amp-Out vals:  [0x80]
  Pincap 0x00000010: OUT
  Pin Default 0x40000000: [N/A] Line Out at Ext N/A
    Conn = Unknown, Color = Unknown
    DefAssociation = 0x0, Sequence = 0x0
  Pin-ctls: 0x00:
  Power states:  D0 D1 D2 D3 EPSS
  Power: setting=D0, actual=D0
  Connection: 1
     0x0f
Node 0x18 [Pin Complex] wcaps 0x40048b: Stereo Amp-In
  Amp-In caps: ofs=0x00, nsteps=0x03, stepsize=0x2f, mute=0
  Amp-In vals:  [0x00 0x00]
  Pincap 0x00003724: IN Detect
    Vref caps: HIZ 50 GRD 80 100
  Pin Default 0x411111f0: [N/A] Speaker at Ext Rear
    Conn = 1/8, Color = Black
    DefAssociation = 0xf, Sequence = 0x0
    Misc = NO_PRESENCE
  Pin-ctls: 0x20: IN VREF_HIZ
  Unsolicited: tag=00, enabled=0
  Power states:  D0 D1 D2 D3 EPSS
  Power: setting=D0, actual=D0
Node 0x19 [Pin Complex] wcaps 0x40048b: Stereo Amp-In
  Control: name="Mic Boost Volume", index=0, device=0
    ControlAmp: chs=3, dir=In, idx=0, ofs=0
  Control: name="Mic Jack", index=0, device=0
  Amp-In caps: ofs=0x00, nsteps=0x03, stepsize=0x2f, mute=0
  Amp-In vals:  [0x00 0x00]
  Pincap 0x00003724: IN Detect
    Vref caps: HIZ 50 GRD 80 100
  Pin Default 0x04a11030: [Jack] Mic at Ext Right
    Conn = 1/8, Color = Black
    DefAssociation = 0x3, Sequence = 0x0
  Pin-ctls: 0x24: IN VREF_80
  Unsolicited: tag=02, enabled=1
  Power states:  D0 D1 D2 D3 EPSS
  Power: setting=D0, actual=D0
Node 0x1a [Pin Complex] wcaps 0x40048b: Stereo Amp-In
  Amp-In caps: ofs=0x00, nsteps=0x03, stepsize=0x2f, mute=0
  Amp-In vals:  [0x00 0x00]
  Pincap 0x00003724: IN Detect
    Vref caps: HIZ 50 GRD 80 100
  Pin Default 0x411111f0: [N/A] Speaker at Ext Rear
    Conn = 1/8, Color = Black
    DefAssociation = 0xf, Sequence = 0x0
    Misc = NO_PRESENCE
  Pin-ctls: 0x20: IN VREF_HIZ
  Unsolicited: tag=00, enabled=0
  Power states:  D0 D1 D2 D3 EPSS
  Power: setting=D0, actual=D0
Node 0x1b [Pin Complex] wcaps 0x40058f: Stereo Amp-In Amp-Out
  Amp-In caps: ofs=0x00, nsteps=0x03, stepsize=0x2f, mute=0
  Amp-In vals:  [0x00 0x00]
  Amp-Out caps: ofs=0x00, nsteps=0x00, stepsize=0x00, mute=1
  Amp-Out vals:  [0x80 0x80]
  Pincap 0x0000373c: IN OUT HP Detect
    Vref caps: HIZ 50 GRD 80 100
  Pin Default 0x411111f0: [N/A] Speaker at Ext Rear
    Conn = 1/8, Color = Black
    DefAssociation = 0xf, Sequence = 0x0
    Misc = NO_PRESENCE
  Pin-ctls: 0x20: IN VREF_HIZ
  Unsolicited: tag=00, enabled=0
  Power states:  D0 D1 D2 D3 EPSS
  Power: setting=D0, actual=D0
  Connection: 2
     0x0c* 0x0d
Node 0x1c [Vendor Defined Widget] wcaps 0xf00000: Mono
Node 0x1d [Pin Complex] wcaps 0x400400: Mono
  Pincap 0x00000020: IN
  Pin Default 0x40f00001: [N/A] Other at Ext N/A
    Conn = Unknown, Color = Unknown
    DefAssociation = 0x0, Sequence = 0x1
  Pin-ctls: 0x20: IN
  Power states:  D0 D1 D2 D3 EPSS
  Power: setting=D0, actual=D0
Node 0x1e [Pin Complex] wcaps 0x400781: Stereo Digital
  Pincap 0x00000014: OUT Detect
  Pin Default 0x411111f0: [N/A] Speaker at Ext Rear
    Conn = 1/8, Color = Black
    DefAssociation = 0xf, Sequence = 0x0
    Misc = NO_PRESENCE
  Pin-ctls: 0x40: OUT
  Unsolicited: tag=00, enabled=0
  Power states:  D0 D1 D2 D3 EPSS
  Power: setting=D0, actual=D0
  Connection: 1
     0x06
Node 0x1f [Vendor Defined Widget] wcaps 0xf00000: Mono
Node 0x20 [Vendor Defined Widget] wcaps 0xf00040: Mono
  Processing caps: benign=0, ncoeff=117
Node 0x21 [Pin Complex] wcaps 0x40058d: Stereo Amp-Out
  Control: name="Headphone Playback Switch", index=0, device=0
    ControlAmp: chs=3, dir=Out, idx=0, ofs=0
  Control: name="Headphone Jack", index=0, device=0
  Amp-Out caps: ofs=0x00, nsteps=0x00, stepsize=0x00, mute=1
  Amp-Out vals:  [0x00 0x00]
  Pincap 0x0000001c: OUT HP Detect
  Pin Default 0x04211020: [Jack] HP Out at Ext Right
    Conn = 1/8, Color = Black
    DefAssociation = 0x2, Sequence = 0x0
  Pin-ctls: 0xc0: OUT HP
  Unsolicited: tag=01, enabled=1
  Power states:  D0 D1 D2 D3 EPSS
  Power: setting=D0, actual=D0
  Connection: 2
     0x0c 0x0d*
Node 0x22 [Audio Mixer] wcaps 0x20010b: Stereo Amp-In
  Amp-In caps: ofs=0x00, nsteps=0x00, stepsize=0x00, mute=1
  Amp-In vals:  [0x80 0x80] [0x80 0x80] [0x80 0x80] [0x80 0x80] [0x80 0x80] [0x80 0x80]
  Connection: 6
     0x18 0x19 0x1a 0x1b 0x1d 0x0b
Node 0x23 [Audio Mixer] wcaps 0x20010b: Stereo Amp-In
  Amp-In caps: ofs=0x00, nsteps=0x00, stepsize=0x00, mute=1
  Amp-In vals:  [0x80 0x80] [0x80 0x80] [0x80 0x80] [0x80 0x80] [0x80 0x80] [0x80 0x80]
  Connection: 6
     0x18 0x19 0x1a 0x1b 0x1d 0x0b
--endcollapse--


!!ALSA Device nodes
!!-----------------

crw-rw---T+ 1 root audio 116,  4 May 21 16:35 /dev/snd/controlC0
crw-rw---T+ 1 root audio 116,  8 May 21 16:35 /dev/snd/controlC1
crw-rw---T+ 1 root audio 116,  3 May 21 16:35 /dev/snd/hwC0D0
crw-rw---T+ 1 root audio 116,  7 May 21 16:35 /dev/snd/hwC1D0
crw-rw---T+ 1 root audio 116,  2 May 21 17:15 /dev/snd/pcmC0D3p
crw-rw---T+ 1 root audio 116,  6 May 21 17:15 /dev/snd/pcmC1D0c
crw-rw---T+ 1 root audio 116,  5 May 21 17:15 /dev/snd/pcmC1D0p
crw-rw---T+ 1 root audio 116,  1 May 21 16:35 /dev/snd/seq
crw-rw---T+ 1 root audio 116, 33 May 21 16:35 /dev/snd/timer

/dev/snd/by-path:
total 0
drwxr-xr-x 2 root root  80 May 21 16:35 .
drwxr-xr-x 3 root root 240 May 21 16:35 ..
lrwxrwxrwx 1 root root  12 May 21 16:35 pci-0000:00:01.1 -> ../controlC0
lrwxrwxrwx 1 root root  12 May 21 16:35 pci-0000:00:14.2 -> ../controlC1


!!Aplay/Arecord output
!!--------------------

APLAY

**** List of PLAYBACK Hardware Devices ****
card 0: Generic [HD-Audio Generic], device 3: HDMI 0 [HDMI 0]
  Subdevices: 1/1
  Subdevice #0: subdevice #0
card 1: Generic_1 [HD-Audio Generic], device 0: ALC282 Analog [ALC282 Analog]
  Subdevices: 1/1
  Subdevice #0: subdevice #0

ARECORD

**** List of CAPTURE Hardware Devices ****
card 1: Generic_1 [HD-Audio Generic], device 0: ALC282 Analog [ALC282 Analog]
  Subdevices: 1/1
  Subdevice #0: subdevice #0

!!Amixer output
!!-------------

!!-------Mixer controls for card 0 [Generic]

Card hw:0 'Generic'/'HD-Audio Generic at 0xd0b40000 irq 92'
  Mixer name	: 'ATI R6xx HDMI'
  Components	: 'HDA:1002aa01,00aa0100,00100500'
  Controls      : 7
  Simple ctrls  : 1
Simple mixer control 'IEC958',0
  Capabilities: pswitch pswitch-joined penum
  Playback channels: Mono
  Mono: Playback [on]

!!-------Mixer controls for card 1 [Generic_1]

Card hw:1 'Generic_1'/'HD-Audio Generic at 0xd0b44000 irq 16'
  Mixer name	: 'Realtek ALC282'
  Components	: 'HDA:10ec0282,103c2234,00100003'
  Controls      : 22
  Simple ctrls  : 10
Simple mixer control 'Master',0
  Capabilities: pvolume pvolume-joined pswitch pswitch-joined penum
  Playback channels: Mono
  Limits: Playback 0 - 87
  Mono: Playback 61 [70%] [-19.50dB] [on]
Simple mixer control 'Headphone',0
  Capabilities: pvolume pswitch penum
  Playback channels: Front Left - Front Right
  Limits: Playback 0 - 87
  Mono:
  Front Left: Playback 87 [100%] [0.00dB] [on]
  Front Right: Playback 87 [100%] [0.00dB] [on]
Simple mixer control 'Speaker',0
  Capabilities: pvolume pswitch penum
  Playback channels: Front Left - Front Right
  Limits: Playback 0 - 87
  Mono:
  Front Left: Playback 87 [100%] [0.00dB] [on]
  Front Right: Playback 87 [100%] [0.00dB] [on]
Simple mixer control 'PCM',0
  Capabilities: pvolume penum
  Playback channels: Front Left - Front Right
  Limits: Playback 0 - 255
  Mono:
  Front Left: Playback 255 [100%] [0.00dB]
  Front Right: Playback 255 [100%] [0.00dB]
Simple mixer control 'Mic',0
  Capabilities: pvolume pswitch penum
  Playback channels: Front Left - Front Right
  Limits: Playback 0 - 31
  Mono:
  Front Left: Playback 0 [0%] [-34.50dB] [off]
  Front Right: Playback 0 [0%] [-34.50dB] [off]
Simple mixer control 'Mic Boost',0
  Capabilities: volume penum
  Playback channels: Front Left - Front Right
  Capture channels: Front Left - Front Right
  Limits: 0 - 3
  Front Left: 0 [0%] [0.00dB]
  Front Right: 0 [0%] [0.00dB]
Simple mixer control 'Beep',0
  Capabilities: pvolume pswitch penum
  Playback channels: Front Left - Front Right
  Limits: Playback 0 - 31
  Mono:
  Front Left: Playback 0 [0%] [-34.50dB] [off]
  Front Right: Playback 0 [0%] [-34.50dB] [off]
Simple mixer control 'Capture',0
  Capabilities: cvolume cswitch penum
  Capture channels: Front Left - Front Right
  Limits: Capture 0 - 63
  Front Left: Capture 39 [62%] [12.00dB] [on]
  Front Right: Capture 39 [62%] [12.00dB] [on]
Simple mixer control 'Auto-Mute Mode',0
  Capabilities: enum
  Items: 'Disabled' 'Enabled'
  Item0: 'Enabled'
Simple mixer control 'Internal Mic Boost',0
  Capabilities: volume penum
  Playback channels: Front Left - Front Right
  Capture channels: Front Left - Front Right
  Limits: 0 - 3
  Front Left: 0 [0%] [0.00dB]
  Front Right: 0 [0%] [0.00dB]


!!Alsactl output
!!--------------

--startcollapse--
state.Generic {
	control.1 {
		iface CARD
		name 'HDMI/DP,pcm=3 Jack'
		value false
		comment {
			access read
			type BOOLEAN
			count 1
		}
	}
	control.2 {
		iface MIXER
		name 'IEC958 Playback Con Mask'
		value '0fff000000000000000000000000000000000000000000000000000000000000000000000000000000000000000000000000000000000000000000000000000000000000000000000000000000000000000000000000000000000000000000000000000000000000000000000000000000000000000000000000000000000000000000000000000000000000000000000000000000000000000000000000000000000000000000000000000000000000'
		comment {
			access read
			type IEC958
			count 1
		}
	}
	control.3 {
		iface MIXER
		name 'IEC958 Playback Pro Mask'
		value '0f00000000000000000000000000000000000000000000000000000000000000000000000000000000000000000000000000000000000000000000000000000000000000000000000000000000000000000000000000000000000000000000000000000000000000000000000000000000000000000000000000000000000000000000000000000000000000000000000000000000000000000000000000000000000000000000000000000000000000'
		comment {
			access read
			type IEC958
			count 1
		}
	}
	control.4 {
		iface MIXER
		name 'IEC958 Playback Default'
		value '0400000000000000000000000000000000000000000000000000000000000000000000000000000000000000000000000000000000000000000000000000000000000000000000000000000000000000000000000000000000000000000000000000000000000000000000000000000000000000000000000000000000000000000000000000000000000000000000000000000000000000000000000000000000000000000000000000000000000000'
		comment {
			access 'read write'
			type IEC958
			count 1
		}
	}
	control.5 {
		iface MIXER
		name 'IEC958 Playback Switch'
		value true
		comment {
			access 'read write'
			type BOOLEAN
			count 1
		}
	}
	control.6 {
		iface PCM
		device 3
		name ELD
		value ''
		comment {
			access 'read volatile'
			type BYTES
			count 0
		}
	}
	control.7 {
		iface PCM
		device 3
		name 'Playback Channel Map'
		value.0 0
		value.1 0
		comment {
			access 'read write'
			type INTEGER
			count 2
			range '0 - 36'
		}
	}
}
state.Generic_1 {
	control.1 {
		iface MIXER
		name 'Headphone Playback Volume'
		value.0 87
		value.1 87
		comment {
			access 'read write'
			type INTEGER
			count 2
			range '0 - 87'
			dbmin -6525
			dbmax 0
			dbvalue.0 0
			dbvalue.1 0
		}
	}
	control.2 {
		iface MIXER
		name 'Headphone Playback Switch'
		value.0 true
		value.1 true
		comment {
			access 'read write'
			type BOOLEAN
			count 2
		}
	}
	control.3 {
		iface MIXER
		name 'Speaker Playback Volume'
		value.0 87
		value.1 87
		comment {
			access 'read write'
			type INTEGER
			count 2
			range '0 - 87'
			dbmin -6525
			dbmax 0
			dbvalue.0 0
			dbvalue.1 0
		}
	}
	control.4 {
		iface MIXER
		name 'Speaker Playback Switch'
		value.0 true
		value.1 true
		comment {
			access 'read write'
			type BOOLEAN
			count 2
		}
	}
	control.5 {
		iface MIXER
		name 'Mic Playback Volume'
		value.0 0
		value.1 0
		comment {
			access 'read write'
			type INTEGER
			count 2
			range '0 - 31'
			dbmin -3450
			dbmax 1200
			dbvalue.0 -3450
			dbvalue.1 -3450
		}
	}
	control.6 {
		iface MIXER
		name 'Mic Playback Switch'
		value.0 false
		value.1 false
		comment {
			access 'read write'
			type BOOLEAN
			count 2
		}
	}
	control.7 {
		iface MIXER
		name 'Auto-Mute Mode'
		value Enabled
		comment {
			access 'read write'
			type ENUMERATED
			count 1
			item.0 Disabled
			item.1 Enabled
		}
	}
	control.8 {
		iface MIXER
		name 'Capture Volume'
		value.0 39
		value.1 39
		comment {
			access 'read write'
			type INTEGER
			count 2
			range '0 - 63'
			dbmin -1725
			dbmax 3000
			dbvalue.0 1200
			dbvalue.1 1200
		}
	}
	control.9 {
		iface MIXER
		name 'Capture Switch'
		value.0 true
		value.1 true
		comment {
			access 'read write'
			type BOOLEAN
			count 2
		}
	}
	control.10 {
		iface MIXER
		name 'Mic Boost Volume'
		value.0 0
		value.1 0
		comment {
			access 'read write'
			type INTEGER
			count 2
			range '0 - 3'
			dbmin 0
			dbmax 3600
			dbvalue.0 0
			dbvalue.1 0
		}
	}
	control.11 {
		iface MIXER
		name 'Internal Mic Boost Volume'
		value.0 0
		value.1 0
		comment {
			access 'read write'
			type INTEGER
			count 2
			range '0 - 3'
			dbmin 0
			dbmax 3600
			dbvalue.0 0
			dbvalue.1 0
		}
	}
	control.12 {
		iface MIXER
		name 'Master Playback Volume'
		value 61
		comment {
			access 'read write'
			type INTEGER
			count 1
			range '0 - 87'
			dbmin -6525
			dbmax 0
			dbvalue.0 -1950
		}
	}
	control.13 {
		iface MIXER
		name 'Master Playback Switch'
		value true
		comment {
			access 'read write'
			type BOOLEAN
			count 1
		}
	}
	control.14 {
		iface CARD
		name 'Mic Jack'
		value false
		comment {
			access read
			type BOOLEAN
			count 1
		}
	}
	control.15 {
		iface CARD
		name 'Internal Mic Phantom Jack'
		value true
		comment {
			access read
			type BOOLEAN
			count 1
		}
	}
	control.16 {
		iface CARD
		name 'Headphone Jack'
		value false
		comment {
			access read
			type BOOLEAN
			count 1
		}
	}
	control.17 {
		iface CARD
		name 'Speaker Phantom Jack'
		value true
		comment {
			access read
			type BOOLEAN
			count 1
		}
	}
	control.18 {
		iface MIXER
		name 'Beep Playback Volume'
		value.0 0
		value.1 0
		comment {
			access 'read write'
			type INTEGER
			count 2
			range '0 - 31'
			dbmin -3450
			dbmax 1200
			dbvalue.0 -3450
			dbvalue.1 -3450
		}
	}
	control.19 {
		iface MIXER
		name 'Beep Playback Switch'
		value.0 false
		value.1 false
		comment {
			access 'read write'
			type BOOLEAN
			count 2
		}
	}
	control.20 {
		iface PCM
		name 'Playback Channel Map'
		value.0 0
		value.1 0
		comment {
			access read
			type INTEGER
			count 2
			range '0 - 36'
		}
	}
	control.21 {
		iface PCM
		name 'Capture Channel Map'
		value.0 0
		value.1 0
		comment {
			access read
			type INTEGER
			count 2
			range '0 - 36'
		}
	}
	control.22 {
		iface MIXER
		name 'PCM Playback Volume'
		value.0 255
		value.1 255
		comment {
			access 'read write user'
			type INTEGER
			count 2
			range '0 - 255'
			tlv '0000000100000008ffffec1400000014'
			dbmin -5100
			dbmax 0
			dbvalue.0 0
			dbvalue.1 0
		}
	}
}
--endcollapse--


!!All Loaded Modules
!!------------------

Module
vesafb
nvram
fglrx
uvcvideo
videobuf2_core
videodev
videobuf2_vmalloc
videobuf2_memops
rtk_btusb
joydev
arc4
rfcomm
bnep
snd_hda_codec_realtek
snd_hda_codec_hdmi
bluetooth
snd_hda_intel
snd_hda_codec
parport_pc
rtsx_pci_sdmmc
ppdev
snd_hwdep
snd_pcm
rtl8723be
rtlwifi
snd_seq_midi
snd_rawmidi
mac80211
rtsx_pci_ms
snd_seq_midi_event
memstick
snd_seq
snd_timer
snd_seq_device
rtsx_pci
snd
tpm_infineon
hp_wmi
cfg80211
soundcore
snd_page_alloc
i2c_piix4
amd_iommu_v2
k10temp
btcoexist
hp_accel
psmouse
lis3lv02d
serio_raw
video
dm_multipath
mac_hid
tpm_tis
hp_wireless
kbccmnd
wmi
input_polldev
scsi_dh
sparse_keymap
lp
parport
disable_mmc
binfmt_misc
ahci
libahci
dm_raid45
dm_mirror
dm_region_hash
dm_log
btrfs
r8169
mii
raid6_pq
xor
zlib_deflate


!!Sysfs Files
!!-----------

/sys/class/sound/hwC0D0/init_pin_configs:
0x03 0x185600f0
0x05 0x585600f0
0x07 0x585600f0
0x09 0x585600f0
0x0b 0x585600f0
0x0d 0x585600f0
0x0f 0x585600f0

/sys/class/sound/hwC0D0/driver_pin_configs:

/sys/class/sound/hwC0D0/user_pin_configs:

/sys/class/sound/hwC0D0/init_verbs:

/sys/class/sound/hwC1D0/init_pin_configs:
0x12 0x90a60140
0x14 0x90170110
0x17 0x40000000
0x18 0x411111f0
0x19 0x04a11030
0x1a 0x411111f0
0x1b 0x411111f0
0x1d 0x40f00001
0x1e 0x411111f0
0x21 0x04211020

/sys/class/sound/hwC1D0/driver_pin_configs:

/sys/class/sound/hwC1D0/user_pin_configs:

/sys/class/sound/hwC1D0/init_verbs:


!!ALSA/HDA dmesg
!!--------------

[   11.582947] rtlwifi-0:_rtl_init_hw_ht_capab():<0-0> 1T1R
[   11.584851] hda-intel 0000:00:01.1: Using LPIB position fix
[   11.584906] snd_hda_intel 0000:00:01.1: irq 92 for MSI/MSI-X
[   11.593066] hda-intel 0000:00:01.1: Enable sync_write for stable communication
[   11.624232] psmouse serio3: synaptics: Touchpad model: 1, fw: 7.5, id: 0x1e0b1, caps: 0xf00173/0x640000/0xa2400, board id: 2653, fw id: 1481159
[   11.658574] input: HD-Audio Generic HDMI/DP,pcm=3 as /devices/pci0000:00/0000:00:01.1/sound/card0/input7
[   11.659673] Bluetooth: Core ver 2.16
--
[   11.660116] Bluetooth: HCI device and connection manager initialized
[   11.661035] hda-intel 0000:00:14.2: Using LPIB position fix
[   11.661160] Bluetooth: HCI socket layer initialized
--
[   11.665217] input: SynPS/2 Synaptics TouchPad as /devices/platform/i8042/serio3/input/input8
[   11.666166] hda-intel 0000:00:14.2: Enable sync_write for stable communication
[   11.692223] SKU: Nid=0x1d sku_cfg=0x40f00001
--
[   11.692673] realtek: Enabling init ASM_ID=0x0001 CODEC_ID=10ec0282
[   11.699598] input: HD-Audio Generic Headphone as /devices/pci0000:00/0000:00:14.2/sound/card1/input9
[   11.699870] input: HD-Audio Generic Mic as /devices/pci0000:00/0000:00:14.2/sound/card1/input10
[   11.751031] Bluetooth: BNEP (Ethernet Emulation) ver 1.3


