upload=true&script=true&cardinfo=
!!################################
!!ALSA Information Script v 0.4.61
!!################################

!!Script ran on: Fri Apr 11 06:46:56 UTC 2014


!!Linux Distribution
!!------------------

Ubuntu 12.04.1 LTS \n \l DISTRIB_ID=Ubuntu DISTRIB_DESCRIPTION="Ubuntu 12.04.1 LTS" NAME="Ubuntu" ID=ubuntu ID_LIKE=debian PRETTY_NAME="Ubuntu precise (12.04.1 LTS)"


!!DMI Information
!!---------------

Manufacturer:      Dell Inc.
Product Name:      OptiPlex 9030 AIO
Product Version:   01
Firmware Version:  A00


!!Kernel Information
!!------------------

Kernel release:    3.5.0-44-generic
Operating System:  GNU/Linux
Architecture:      x86_64
Processor:         x86_64
SMP Enabled:       Yes


!!ALSA Version
!!------------

Driver version:     1.0.25
Library version:    1.0.25
Utilities version:  1.0.25


!!Loaded ALSA modules
!!-------------------

snd_hda_intel
snd_hda_intel


!!Sound Servers on this system
!!----------------------------

Pulseaudio:
      Installed - Yes (/usr/bin/pulseaudio)
      Running - Yes


!!Soundcards recognised by ALSA
!!-----------------------------

 0 [HDMI           ]: HDA-Intel - HDA Intel HDMI
                      HDA Intel HDMI at 0xf7f34000 irq 48
 1 [PCH            ]: HDA-Intel - HDA Intel PCH
                      HDA Intel PCH at 0xf7f30000 irq 49


!!PCI Soundcards installed in the system
!!--------------------------------------

00:03.0 Audio device: Intel Corporation Haswell HD Audio Controller (rev 06)
00:1b.0 Audio device: Intel Corporation Lynx Point HD Audio Controller (rev 04)


!!Advanced information - PCI Vendor/Device/Subsystem ID's
!!-------------------------------------------------------

00:03.0 0403: 8086:0c0c (rev 06)
	Subsystem: 1028:0625
--
00:1b.0 0403: 8086:8c20 (rev 04)
	Subsystem: 1028:0625


!!Modprobe options (Sound related)
!!--------------------------------

snd-atiixp-modem: index=-2
snd-intel8x0m: index=-2
snd-via82xx-modem: index=-2
snd-usb-audio: index=-2
snd-usb-caiaq: index=-2
snd-usb-ua101: index=-2
snd-usb-us122l: index=-2
snd-usb-usx2y: index=-2
snd-cmipci: mpu_port=0x330 fm_port=0x388
snd-pcsp: index=-2
snd-usb-audio: index=-2


!!Loaded sound module options
!!---------------------------

!!Module: snd_hda_intel
	align_buffer_size : -1
	bdl_pos_adj : 32,1,-1,-1,-1,-1,-1,-1,-1,-1,-1,-1,-1,-1,-1,-1,-1,-1,-1,-1,-1,-1,-1,-1,-1,-1,-1,-1,-1,-1,-1,-1
	beep_mode : N,N,N,N,N,N,N,N,N,N,N,N,N,N,N,N,N,N,N,N,N,N,N,N,N,N,N,N,N,N,N,N
	enable : Y,Y,Y,Y,Y,Y,Y,Y,Y,Y,Y,Y,Y,Y,Y,Y,Y,Y,Y,Y,Y,Y,Y,Y,Y,Y,Y,Y,Y,Y,Y,Y
	enable_msi : -1
	id : (null),(null),(null),(null),(null),(null),(null),(null),(null),(null),(null),(null),(null),(null),(null),(null),(null),(null),(null),(null),(null),(null),(null),(null),(null),(null),(null),(null),(null),(null),(null),(null)
	index : -1,-1,-1,-1,-1,-1,-1,-1,-1,-1,-1,-1,-1,-1,-1,-1,-1,-1,-1,-1,-1,-1,-1,-1,-1,-1,-1,-1,-1,-1,-1,-1
	jackpoll_ms : 0,0,0,0,0,0,0,0,0,0,0,0,0,0,0,0,0,0,0,0,0,0,0,0,0,0,0,0,0,0,0,0
	model : (null),(null),(null),(null),(null),(null),(null),(null),(null),(null),(null),(null),(null),(null),(null),(null),(null),(null),(null),(null),(null),(null),(null),(null),(null),(null),(null),(null),(null),(null),(null),(null)
	patch : (null),(null),(null),(null),(null),(null),(null),(null),(null),(null),(null),(null),(null),(null),(null),(null),(null),(null),(null),(null),(null),(null),(null),(null),(null),(null),(null),(null),(null),(null),(null),(null)
	position_fix : -1,-1,-1,-1,-1,-1,-1,-1,-1,-1,-1,-1,-1,-1,-1,-1,-1,-1,-1,-1,-1,-1,-1,-1,-1,-1,-1,-1,-1,-1,-1,-1
	power_save : 0
	power_save_controller : Y
	probe_mask : -1,-1,-1,-1,-1,-1,-1,-1,-1,-1,-1,-1,-1,-1,-1,-1,-1,-1,-1,-1,-1,-1,-1,-1,-1,-1,-1,-1,-1,-1,-1,-1
	probe_only : 0,0,0,0,0,0,0,0,0,0,0,0,0,0,0,0,0,0,0,0,0,0,0,0,0,0,0,0,0,0,0,0
	single_cmd : N
	snoop : Y

!!Module: snd_hda_intel
	align_buffer_size : -1
	bdl_pos_adj : 32,1,-1,-1,-1,-1,-1,-1,-1,-1,-1,-1,-1,-1,-1,-1,-1,-1,-1,-1,-1,-1,-1,-1,-1,-1,-1,-1,-1,-1,-1,-1
	beep_mode : N,N,N,N,N,N,N,N,N,N,N,N,N,N,N,N,N,N,N,N,N,N,N,N,N,N,N,N,N,N,N,N
	enable : Y,Y,Y,Y,Y,Y,Y,Y,Y,Y,Y,Y,Y,Y,Y,Y,Y,Y,Y,Y,Y,Y,Y,Y,Y,Y,Y,Y,Y,Y,Y,Y
	enable_msi : -1
	id : (null),(null),(null),(null),(null),(null),(null),(null),(null),(null),(null),(null),(null),(null),(null),(null),(null),(null),(null),(null),(null),(null),(null),(null),(null),(null),(null),(null),(null),(null),(null),(null)
	index : -1,-1,-1,-1,-1,-1,-1,-1,-1,-1,-1,-1,-1,-1,-1,-1,-1,-1,-1,-1,-1,-1,-1,-1,-1,-1,-1,-1,-1,-1,-1,-1
	jackpoll_ms : 0,0,0,0,0,0,0,0,0,0,0,0,0,0,0,0,0,0,0,0,0,0,0,0,0,0,0,0,0,0,0,0
	model : (null),(null),(null),(null),(null),(null),(null),(null),(null),(null),(null),(null),(null),(null),(null),(null),(null),(null),(null),(null),(null),(null),(null),(null),(null),(null),(null),(null),(null),(null),(null),(null)
	patch : (null),(null),(null),(null),(null),(null),(null),(null),(null),(null),(null),(null),(null),(null),(null),(null),(null),(null),(null),(null),(null),(null),(null),(null),(null),(null),(null),(null),(null),(null),(null),(null)
	position_fix : -1,-1,-1,-1,-1,-1,-1,-1,-1,-1,-1,-1,-1,-1,-1,-1,-1,-1,-1,-1,-1,-1,-1,-1,-1,-1,-1,-1,-1,-1,-1,-1
	power_save : 0
	power_save_controller : Y
	probe_mask : -1,-1,-1,-1,-1,-1,-1,-1,-1,-1,-1,-1,-1,-1,-1,-1,-1,-1,-1,-1,-1,-1,-1,-1,-1,-1,-1,-1,-1,-1,-1,-1
	probe_only : 0,0,0,0,0,0,0,0,0,0,0,0,0,0,0,0,0,0,0,0,0,0,0,0,0,0,0,0,0,0,0,0
	single_cmd : N
	snoop : Y


!!HDA-Intel Codec information
!!---------------------------
--startcollapse--

Codec: Intel Haswell HDMI
Address: 0
AFG Function Id: 0x1 (unsol 0)
Vendor Id: 0x80862807
Subsystem Id: 0x80860101
Revision Id: 0x100000
No Modem Function Group found
Default PCM:
    rates [0x0]:
    bits [0x0]:
    formats [0x0]:
Default Amp-In caps: N/A
Default Amp-Out caps: N/A
State of AFG node 0x01:
  Power states:  D0 D3 CLKSTOP EPSS
  Power: setting=D0, actual=D0, Clock-stop-OK
GPIO: io=0, o=0, i=0, unsolicited=0, wake=0
Node 0x02 [Audio Output] wcaps 0x6611: 8-Channels Digital
  Converter: stream=2, channel=0
  Digital: Enabled KAE
  Digital category: 0x0
  IEC Coding Type: 0x0
  PCM:
    rates [0x7f0]: 32000 44100 48000 88200 96000 176400 192000
    bits [0x1e]: 16 20 24 32
    formats [0x5]: PCM AC3
  Power states:  D0 D3 EPSS
  Power: setting=D0, actual=D0
Node 0x03 [Audio Output] wcaps 0x6611: 8-Channels Digital
  Converter: stream=0, channel=0
  Digital: Enabled KAE
  Digital category: 0x0
  IEC Coding Type: 0x0
  PCM:
    rates [0x7f0]: 32000 44100 48000 88200 96000 176400 192000
    bits [0x1e]: 16 20 24 32
    formats [0x5]: PCM AC3
  Power states:  D0 D3 EPSS
  Power: setting=D3, actual=D3
Node 0x04 [Audio Output] wcaps 0x6611: 8-Channels Digital
  Converter: stream=0, channel=0
  Digital: Enabled KAE
  Digital category: 0x0
  IEC Coding Type: 0x0
  PCM:
    rates [0x7f0]: 32000 44100 48000 88200 96000 176400 192000
    bits [0x1e]: 16 20 24 32
    formats [0x5]: PCM AC3
  Power states:  D0 D3 EPSS
  Power: setting=D3, actual=D3
Node 0x05 [Pin Complex] wcaps 0x40778d: 8-Channels Digital Amp-Out CP
  Control: name="HDMI/DP,pcm=3 Jack", index=0, device=0
  Control: name="IEC958 Playback Con Mask", index=0, device=0
  Control: name="IEC958 Playback Pro Mask", index=0, device=0
  Control: name="IEC958 Playback Default", index=0, device=0
  Control: name="IEC958 Playback Switch", index=0, device=0
  Control: name="ELD", index=0, device=3
  Amp-Out caps: ofs=0x00, nsteps=0x00, stepsize=0x00, mute=1
  Amp-Out vals:  [0x00 0x00]
  Pincap 0x0b000094: OUT Detect HBR HDMI DP
  Pin Default 0x18560010: [Jack] Digital Out at Int HDMI
    Conn = Digital, Color = Unknown
    DefAssociation = 0x1, Sequence = 0x0
  Pin-ctls: 0x00:
  Unsolicited: tag=00, enabled=0
  Power states:  D0 D3 EPSS
  Power: setting=D0, actual=D0
  Devices: 0
  Connection: 0
  In-driver Connection: 3
     0x02 0x03 0x04
Node 0x06 [Pin Complex] wcaps 0x40778d: 8-Channels Digital Amp-Out CP
  Amp-Out caps: ofs=0x00, nsteps=0x00, stepsize=0x00, mute=1
  Amp-Out vals:  [0x00 0x00]
  Pincap 0x0b000094: OUT Detect HBR HDMI DP
  Pin Default 0x58560020: [N/A] Digital Out at Int HDMI
    Conn = Digital, Color = Unknown
    DefAssociation = 0x2, Sequence = 0x0
  Pin-ctls: 0x00:
  Unsolicited: tag=00, enabled=0
  Power states:  D0 D3 EPSS
  Power: setting=D0, actual=D0
  Devices: 0
  Connection: 0
Node 0x07 [Pin Complex] wcaps 0x40778d: 8-Channels Digital Amp-Out CP
  Control: name="HDMI/DP,pcm=7 Jack", index=0, device=0
  Control: name="IEC958 Playback Con Mask", index=1, device=0
  Control: name="IEC958 Playback Pro Mask", index=1, device=0
  Control: name="IEC958 Playback Default", index=1, device=0
  Control: name="IEC958 Playback Switch", index=1, device=0
  Control: name="ELD", index=0, device=7
  Amp-Out caps: ofs=0x00, nsteps=0x00, stepsize=0x00, mute=1
  Amp-Out vals:  [0x00 0x00]
  Pincap 0x0b000094: OUT Detect HBR HDMI DP
  Pin Default 0x18560030: [Jack] Digital Out at Int HDMI
    Conn = Digital, Color = Unknown
    DefAssociation = 0x3, Sequence = 0x0
  Pin-ctls: 0x00:
  Unsolicited: tag=00, enabled=0
  Power states:  D0 D3 EPSS
  Power: setting=D0, actual=D0
  Devices: 0
  Connection: 0
  In-driver Connection: 3
     0x02 0x03 0x04
Node 0x08 [Vendor Defined Widget] wcaps 0xf00000: Mono
Codec: Realtek ALC3661
Address: 0
AFG Function Id: 0x1 (unsol 1)
Vendor Id: 0x10ec0668
Subsystem Id: 0x10280625
Revision Id: 0x100003
No Modem Function Group found
Default PCM:
    rates [0x560]: 44100 48000 96000 192000
    bits [0xe]: 16 20 24
    formats [0x1]: PCM
Default Amp-In caps: N/A
Default Amp-Out caps: N/A
State of AFG node 0x01:
  Power states:  D0 D1 D2 D3 EPSS
  Power: setting=D0, actual=D0
GPIO: io=4, o=0, i=0, unsolicited=1, wake=0
  IO[0]: enable=0, dir=0, wake=0, sticky=0, data=0, unsol=0
  IO[1]: enable=0, dir=0, wake=0, sticky=0, data=0, unsol=0
  IO[2]: enable=0, dir=0, wake=0, sticky=0, data=0, unsol=0
  IO[3]: enable=0, dir=0, wake=0, sticky=0, data=0, unsol=0
Node 0x02 [Audio Output] wcaps 0x41d: Stereo Amp-Out
  Control: name="PCM Playback Volume", index=0, device=0
    ControlAmp: chs=3, dir=Out, idx=0, ofs=0
  Device: name="ALC3661 Analog", type="Audio", device=0
  Amp-Out caps: ofs=0x57, nsteps=0x57, stepsize=0x02, mute=0
  Amp-Out vals:  [0x3d 0x3d]
  Converter: stream=8, channel=0
  PCM:
    rates [0x560]: 44100 48000 96000 192000
    bits [0xe]: 16 20 24
    formats [0x1]: PCM
  Power states:  D0 D1 D2 D3 EPSS
  Power: setting=D0, actual=D0
Node 0x03 [Audio Output] wcaps 0x41d: Stereo Amp-Out
  Control: name="Headphone Playback Volume", index=0, device=0
    ControlAmp: chs=3, dir=Out, idx=0, ofs=0
  Amp-Out caps: ofs=0x57, nsteps=0x57, stepsize=0x02, mute=0
  Amp-Out vals:  [0x3d 0x3d]
  Converter: stream=8, channel=0
  PCM:
    rates [0x560]: 44100 48000 96000 192000
    bits [0xe]: 16 20 24
    formats [0x1]: PCM
  Power states:  D0 D1 D2 D3 EPSS
  Power: setting=D0, actual=D0
Node 0x04 [Audio Output] wcaps 0x41d: Stereo Amp-Out
  Control: name="Speaker Playback Volume", index=0, device=0
    ControlAmp: chs=3, dir=Out, idx=0, ofs=0
  Amp-Out caps: ofs=0x57, nsteps=0x57, stepsize=0x02, mute=0
  Amp-Out vals:  [0x3d 0x3d]
  Converter: stream=8, channel=0
  PCM:
    rates [0x560]: 44100 48000 96000 192000
    bits [0xe]: 16 20 24
    formats [0x1]: PCM
  Power states:  D0 D1 D2 D3 EPSS
  Power: setting=D0, actual=D0
Node 0x05 [Vendor Defined Widget] wcaps 0xf00000: Mono
Node 0x06 [Audio Output] wcaps 0x611: Stereo Digital
  Converter: stream=0, channel=0
  Digital:
  Digital category: 0x0
  IEC Coding Type: 0x0
  PCM:
    rates [0x5f0]: 32000 44100 48000 88200 96000 192000
    bits [0xe]: 16 20 24
    formats [0x1]: PCM
  Power states:  D0 D1 D2 D3 EPSS
  Power: setting=D0, actual=D0
Node 0x07 [Audio Input] wcaps 0x10051b: Stereo Amp-In
  Device: name="ALC3661 Analog", type="Audio", device=0
  Amp-In caps: ofs=0x17, nsteps=0x3f, stepsize=0x02, mute=1
  Amp-In vals:  [0x27 0x27]
  Converter: stream=4, channel=0
  SDI-Select: 0
  PCM:
    rates [0x560]: 44100 48000 96000 192000
    bits [0xe]: 16 20 24
    formats [0x1]: PCM
  Power states:  D0 D1 D2 D3 EPSS
  Power: setting=D0, actual=D0
  Connection: 1
     0x12
Node 0x08 [Audio Input] wcaps 0x10051b: Stereo Amp-In
  Control: name="Capture Volume", index=0, device=0
    ControlAmp: chs=3, dir=In, idx=0, ofs=0
  Control: name="Capture Switch", index=0, device=0
    ControlAmp: chs=3, dir=In, idx=0, ofs=0
  Amp-In caps: ofs=0x17, nsteps=0x3f, stepsize=0x02, mute=1
  Amp-In vals:  [0x27 0x27]
  Converter: stream=0, channel=0
  SDI-Select: 0
  PCM:
    rates [0x560]: 44100 48000 96000 192000
    bits [0xe]: 16 20 24
    formats [0x1]: PCM
  Power states:  D0 D1 D2 D3 EPSS
  Power: setting=D0, actual=D0
  Connection: 1
     0x23
Node 0x09 [Audio Input] wcaps 0x10051b: Stereo Amp-In
  Amp-In caps: ofs=0x17, nsteps=0x3f, stepsize=0x02, mute=1
  Amp-In vals:  [0x97 0x97]
  Converter: stream=0, channel=0
  SDI-Select: 0
  PCM:
    rates [0x560]: 44100 48000 96000 192000
    bits [0xe]: 16 20 24
    formats [0x1]: PCM
  Power states:  D0 D1 D2 D3 EPSS
  Power: setting=D0, actual=D0
  Connection: 1
     0x22
Node 0x0a [Audio Input] wcaps 0x100791: Stereo Digital
  Converter: stream=0, channel=0
  SDI-Select: 0
  Digital:
  Digital category: 0x0
  IEC Coding Type: 0x0
  PCM:
    rates [0x570]: 32000 44100 48000 96000 192000
    bits [0xe]: 16 20 24
    formats [0x1]: PCM
  Unsolicited: tag=00, enabled=0
  Power states:  D0 D1 D2 D3 EPSS
  Power: setting=D0, actual=D0
  Connection: 1
     0x1f
Node 0x0b [Audio Mixer] wcaps 0x20010b: Stereo Amp-In
  Control: name="Headphone Mic Playback Volume", index=0, device=0
    ControlAmp: chs=3, dir=In, idx=1, ofs=0
  Control: name="Headphone Mic Playback Switch", index=0, device=0
    ControlAmp: chs=3, dir=In, idx=1, ofs=0
  Control: name="Headset Mic Playback Volume", index=0, device=0
    ControlAmp: chs=3, dir=In, idx=3, ofs=0
  Control: name="Headset Mic Playback Switch", index=0, device=0
    ControlAmp: chs=3, dir=In, idx=3, ofs=0
  Amp-In caps: ofs=0x17, nsteps=0x1f, stepsize=0x05, mute=1
  Amp-In vals:  [0x80 0x80] [0x80 0x80] [0x80 0x80] [0x80 0x80] [0x80 0x80] [0x80 0x80]
  Connection: 6
     0x18 0x19 0x1a 0x1b 0x1d 0x14
Node 0x0c [Audio Mixer] wcaps 0x20010b: Stereo Amp-In
  Amp-In caps: ofs=0x00, nsteps=0x00, stepsize=0x00, mute=1
  Amp-In vals:  [0x00 0x00] [0x00 0x00]
  Connection: 2
     0x02 0x0b
Node 0x0d [Audio Mixer] wcaps 0x20010b: Stereo Amp-In
  Amp-In caps: ofs=0x00, nsteps=0x00, stepsize=0x00, mute=1
  Amp-In vals:  [0x00 0x00] [0x00 0x00]
  Connection: 2
     0x03 0x0b
Node 0x0e [Audio Mixer] wcaps 0x20010b: Stereo Amp-In
  Amp-In caps: ofs=0x00, nsteps=0x00, stepsize=0x00, mute=1
  Amp-In vals:  [0x00 0x00] [0x00 0x00]
  Connection: 2
     0x04 0x0b
Node 0x0f [Vendor Defined Widget] wcaps 0xf00000: Mono
Node 0x10 [Vendor Defined Widget] wcaps 0xf00000: Mono
Node 0x11 [Vendor Defined Widget] wcaps 0xf00000: Mono
Node 0x12 [Pin Complex] wcaps 0x400401: Stereo
  Control: name="Internal Mic Phantom Jack", index=0, device=0
  Pincap 0x00000020: IN
  Pin Default 0x99a30130: [Fixed] Mic at Int ATAPI
    Conn = ATAPI, Color = Unknown
    DefAssociation = 0x3, Sequence = 0x0
    Misc = NO_PRESENCE
  Pin-ctls: 0x20: IN
  Power states:  D0 D1 D2 D3 EPSS
  Power: setting=D0, actual=D0
Node 0x13 [Vendor Defined Widget] wcaps 0xf00000: Mono
Node 0x14 [Pin Complex] wcaps 0x40058f: Stereo Amp-In Amp-Out
  Control: name="Speaker Playback Switch", index=0, device=0
    ControlAmp: chs=3, dir=Out, idx=0, ofs=0
  Control: name="Speaker Phantom Jack", index=0, device=0
  Amp-In caps: N/A
  Amp-In vals:  [0x00 0x00]
  Amp-Out caps: ofs=0x00, nsteps=0x00, stepsize=0x00, mute=1
  Amp-Out vals:  [0x00 0x00]
  Pincap 0x0001003c: IN OUT HP EAPD Detect
  EAPD 0x2: EAPD
  Pin Default 0x90170110: [Fixed] Speaker at Int N/A
    Conn = Analog, Color = Unknown
    DefAssociation = 0x1, Sequence = 0x0
    Misc = NO_PRESENCE
  Pin-ctls: 0x40: OUT
  Unsolicited: tag=00, enabled=0
  Power states:  D0 D1 D2 D3 EPSS
  Power: setting=D0, actual=D0
  Connection: 3
     0x0c 0x0d 0x0e*
Node 0x15 [Pin Complex] wcaps 0x40058d: Stereo Amp-Out
  Control: name="Headphone Playback Switch", index=0, device=0
    ControlAmp: chs=3, dir=Out, idx=0, ofs=0
  Control: name="Headphone Mic Jack", index=0, device=0
  Amp-Out caps: ofs=0x00, nsteps=0x00, stepsize=0x00, mute=1
  Amp-Out vals:  [0x00 0x00]
  Pincap 0x0001001c: OUT HP EAPD Detect
  EAPD 0x2: EAPD
  Pin Default 0x0321101f: [Jack] HP Out at Ext Left
    Conn = 1/8, Color = Black
    DefAssociation = 0x1, Sequence = 0xf
  Pin-ctls: 0xc0: OUT HP
  Unsolicited: tag=01, enabled=1
  Power states:  D0 D1 D2 D3 EPSS
  Power: setting=D0, actual=D0
  Connection: 3
     0x0c 0x0d* 0x0e
Node 0x16 [Pin Complex] wcaps 0x40058d: Stereo Amp-Out
  Control: name="PCM Playback Switch", index=0, device=0
    ControlAmp: chs=3, dir=Out, idx=0, ofs=0
  Control: name="Line Out Jack", index=0, device=0
  Amp-Out caps: ofs=0x00, nsteps=0x00, stepsize=0x00, mute=1
  Amp-Out vals:  [0x00 0x00]
  Pincap 0x0000001c: OUT HP Detect
  Pin Default 0x03011020: [Jack] Line Out at Ext Left
    Conn = 1/8, Color = Black
    DefAssociation = 0x2, Sequence = 0x0
  Pin-ctls: 0x40: OUT
  Unsolicited: tag=02, enabled=1
  Power states:  D0 D1 D2 D3 EPSS
  Power: setting=D0, actual=D0
  Connection: 3
     0x0c* 0x0d 0x0e
Node 0x17 [Vendor Defined Widget] wcaps 0xf00000: Mono
Node 0x18 [Pin Complex] wcaps 0x40058f: Stereo Amp-In Amp-Out
  Amp-In caps: ofs=0x00, nsteps=0x03, stepsize=0x27, mute=0
  Amp-In vals:  [0x00 0x00]
  Amp-Out caps: ofs=0x00, nsteps=0x00, stepsize=0x00, mute=1
  Amp-Out vals:  [0x80 0x80]
  Pincap 0x0000373c: IN OUT HP Detect
    Vref caps: HIZ 50 GRD 80 100
  Pin Default 0x40000008: [N/A] Line Out at Ext N/A
    Conn = Unknown, Color = Unknown
    DefAssociation = 0x0, Sequence = 0x8
  Pin-ctls: 0x00: VREF_HIZ
  Unsolicited: tag=00, enabled=0
  Power states:  D0 D1 D2 D3 EPSS
  Power: setting=D0, actual=D0
  Connection: 3
     0x0c* 0x0d 0x0e
Node 0x19 [Pin Complex] wcaps 0x40058f: Stereo Amp-In Amp-Out
  Control: name="Headphone Mic Boost Volume", index=0, device=0
    ControlAmp: chs=3, dir=In, idx=0, ofs=0
  Amp-In caps: ofs=0x00, nsteps=0x03, stepsize=0x27, mute=0
  Amp-In vals:  [0x00 0x00]
  Amp-Out caps: ofs=0x00, nsteps=0x00, stepsize=0x00, mute=1
  Amp-Out vals:  [0x80 0x80]
  Pincap 0x0000373c: IN OUT HP Detect
    Vref caps: HIZ 50 GRD 80 100
  Pin Default 0x411111f0: [N/A] Speaker at Ext Rear
    Conn = 1/8, Color = Black
    DefAssociation = 0xf, Sequence = 0x0
    Misc = NO_PRESENCE
  Pin-ctls: 0x20: IN VREF_HIZ
  Unsolicited: tag=00, enabled=0
  Power states:  D0 D1 D2 D3 EPSS
  Power: setting=D0, actual=D0
  Connection: 3
     0x0c* 0x0d 0x0e
Node 0x1a [Pin Complex] wcaps 0x40058f: Stereo Amp-In Amp-Out
  Amp-In caps: ofs=0x00, nsteps=0x03, stepsize=0x27, mute=0
  Amp-In vals:  [0x00 0x00]
  Amp-Out caps: ofs=0x00, nsteps=0x00, stepsize=0x00, mute=1
  Amp-Out vals:  [0x80 0x80]
  Pincap 0x0000373c: IN OUT HP Detect
    Vref caps: HIZ 50 GRD 80 100
  Pin Default 0x411111f0: [N/A] Speaker at Ext Rear
    Conn = 1/8, Color = Black
    DefAssociation = 0xf, Sequence = 0x0
    Misc = NO_PRESENCE
  Pin-ctls: 0x20: IN VREF_HIZ
  Unsolicited: tag=00, enabled=0
  Power states:  D0 D1 D2 D3 EPSS
  Power: setting=D0, actual=D0
  Connection: 3
     0x0c* 0x0d 0x0e
Node 0x1b [Pin Complex] wcaps 0x40048b: Stereo Amp-In
  Control: name="Headset Mic Boost Volume", index=0, device=0
    ControlAmp: chs=3, dir=In, idx=0, ofs=0
  Control: name="Headset Mic Phantom Jack", index=0, device=0
  Amp-In caps: ofs=0x00, nsteps=0x03, stepsize=0x27, mute=0
  Amp-In vals:  [0x00 0x00]
  Pincap 0x00003724: IN Detect
    Vref caps: HIZ 50 GRD 80 100
  Pin Default 0x411111f0: [N/A] Speaker at Ext Rear
    Conn = 1/8, Color = Black
    DefAssociation = 0xf, Sequence = 0x0
    Misc = NO_PRESENCE
  Pin-ctls: 0x24: IN VREF_80
  Unsolicited: tag=00, enabled=0
  Power states:  D0 D1 D2 D3 EPSS
  Power: setting=D0, actual=D0
Node 0x1c [Vendor Defined Widget] wcaps 0xf00000: Mono
Node 0x1d [Pin Complex] wcaps 0x400400: Mono
  Pincap 0x00000020: IN
  Pin Default 0x41000001: [N/A] Line Out at Ext Rear
    Conn = Unknown, Color = Unknown
    DefAssociation = 0x0, Sequence = 0x1
  Pin-ctls: 0x20: IN
  Power states:  D0 D1 D2 D3 EPSS
  Power: setting=D0, actual=D0
Node 0x1e [Pin Complex] wcaps 0x400781: Stereo Digital
  Pincap 0x00000010: OUT
  Pin Default 0x411111f0: [N/A] Speaker at Ext Rear
    Conn = 1/8, Color = Black
    DefAssociation = 0xf, Sequence = 0x0
    Misc = NO_PRESENCE
  Pin-ctls: 0x40: OUT
  Unsolicited: tag=00, enabled=0
  Power states:  D0 D1 D2 D3 EPSS
  Power: setting=D0, actual=D0
  Connection: 1
     0x06
Node 0x1f [Pin Complex] wcaps 0x400681: Stereo Digital
  Pincap 0x00000020: IN
  Pin Default 0x411111f0: [N/A] Speaker at Ext Rear
    Conn = 1/8, Color = Black
    DefAssociation = 0xf, Sequence = 0x0
    Misc = NO_PRESENCE
  Pin-ctls: 0x20: IN
  Unsolicited: tag=00, enabled=0
  Power states:  D0 D1 D2 D3 EPSS
  Power: setting=D0, actual=D0
Node 0x20 [Vendor Defined Widget] wcaps 0xf00040: Mono
  Processing caps: benign=0, ncoeff=197
Node 0x21 [Vendor Defined Widget] wcaps 0xf00000: Mono
Node 0x22 [Audio Mixer] wcaps 0x20010b: Stereo Amp-In
  Amp-In caps: ofs=0x00, nsteps=0x00, stepsize=0x00, mute=1
  Amp-In vals:  [0x80 0x80] [0x80 0x80] [0x80 0x80] [0x80 0x80] [0x80 0x80] [0x80 0x80] [0x80 0x80]
  Connection: 7
     0x18 0x19 0x1a 0x1b 0x1d 0x14 0x0b
Node 0x23 [Audio Mixer] wcaps 0x20010b: Stereo Amp-In
  Amp-In caps: ofs=0x00, nsteps=0x00, stepsize=0x00, mute=1
  Amp-In vals:  [0x80 0x80] [0x80 0x80] [0x80 0x80] [0x80 0x80] [0x80 0x80] [0x80 0x80] [0x80 0x80]
  Connection: 7
     0x18 0x19 0x1a 0x1b 0x1d 0x14 0x0b
Node 0x24 [Vendor Defined Widget] wcaps 0xf00000: Mono
--endcollapse--


!!ALSA Device nodes
!!-----------------

crw-rw---T+ 1 root audio 116,  9 Apr 11 01:55 /dev/snd/controlC0
crw-rw---T+ 1 root audio 116,  5 Apr 11 01:55 /dev/snd/controlC1
crw-rw---T+ 1 root audio 116,  8 Apr 11 01:55 /dev/snd/hwC0D0
crw-rw---T+ 1 root audio 116,  4 Apr 11 01:55 /dev/snd/hwC1D0
crw-rw---T+ 1 root audio 116,  7 Apr 11 02:04 /dev/snd/pcmC0D3p
crw-rw---T+ 1 root audio 116,  6 Apr 11 02:04 /dev/snd/pcmC0D7p
crw-rw---T+ 1 root audio 116,  3 Apr 11 02:04 /dev/snd/pcmC1D0c
crw-rw---T+ 1 root audio 116,  2 Apr 11 02:04 /dev/snd/pcmC1D0p
crw-rw---T+ 1 root audio 116,  1 Apr 11 01:55 /dev/snd/seq
crw-rw---T+ 1 root audio 116, 33 Apr 11 01:55 /dev/snd/timer

/dev/snd/by-path:
total 0
drwxr-xr-x 2 root root  80 Apr 11 01:55 .
drwxr-xr-x 3 root root 260 Apr 11 01:55 ..
lrwxrwxrwx 1 root root  12 Apr 11 01:55 pci-0000:00:03.0 -> ../controlC0
lrwxrwxrwx 1 root root  12 Apr 11 01:55 pci-0000:00:1b.0 -> ../controlC1


!!Aplay/Arecord output
!!--------------------

APLAY

**** List of PLAYBACK Hardware Devices ****
card 0: HDMI [HDA Intel HDMI], device 3: HDMI 0 [HDMI 0]
  Subdevices: 1/1
  Subdevice #0: subdevice #0
card 0: HDMI [HDA Intel HDMI], device 7: HDMI 1 [HDMI 1]
  Subdevices: 1/1
  Subdevice #0: subdevice #0
card 1: PCH [HDA Intel PCH], device 0: ALC3661 Analog [ALC3661 Analog]
  Subdevices: 1/1
  Subdevice #0: subdevice #0

ARECORD

**** List of CAPTURE Hardware Devices ****
card 1: PCH [HDA Intel PCH], device 0: ALC3661 Analog [ALC3661 Analog]
  Subdevices: 1/1
  Subdevice #0: subdevice #0

!!Amixer output
!!-------------

!!-------Mixer controls for card 0 [HDMI]

Card hw:0 'HDMI'/'HDA Intel HDMI at 0xf7f34000 irq 48'
  Mixer name	: 'Intel Haswell HDMI'
  Components	: 'HDA:80862807,80860101,00100000'
  Controls      : 12
  Simple ctrls  : 2
Simple mixer control 'IEC958',0
  Capabilities: pswitch pswitch-joined penum
  Playback channels: Mono
  Mono: Playback [on]
Simple mixer control 'IEC958',1
  Capabilities: pswitch pswitch-joined penum
  Playback channels: Mono
  Mono: Playback [on]

!!-------Mixer controls for card 1 [PCH]

Card hw:1 'PCH'/'HDA Intel PCH at 0xf7f30000 irq 49'
  Mixer name	: 'Realtek ALC3661'
  Components	: 'HDA:10ec0668,10280625,00100003'
  Controls      : 23
  Simple ctrls  : 11
Simple mixer control 'Master',0
  Capabilities: pvolume pvolume-joined pswitch pswitch-joined penum
  Playback channels: Mono
  Limits: Playback 0 - 87
  Mono: Playback 61 [70%] [-19.50dB] [on]
Simple mixer control 'Headphone',0
  Capabilities: pvolume pswitch penum
  Playback channels: Front Left - Front Right
  Limits: Playback 0 - 87
  Mono:
  Front Left: Playback 87 [100%] [0.00dB] [on]
  Front Right: Playback 87 [100%] [0.00dB] [on]
Simple mixer control 'Headphone Mic',0
  Capabilities: pvolume pswitch cswitch cswitch-joined cswitch-exclusive penum
  Capture exclusive group: 0
  Playback channels: Front Left - Front Right
  Capture channels: Mono
  Limits: Playback 0 - 31
  Mono: Capture [off]
  Front Left: Playback 0 [0%] [-34.50dB] [off]
  Front Right: Playback 0 [0%] [-34.50dB] [off]
Simple mixer control 'Headphone Mic Boost',0
  Capabilities: volume penum
  Playback channels: Front Left - Front Right
  Capture channels: Front Left - Front Right
  Limits: 0 - 3
  Front Left: 0 [0%] [0.00dB]
  Front Right: 0 [0%] [0.00dB]
Simple mixer control 'Speaker',0
  Capabilities: pvolume pswitch penum
  Playback channels: Front Left - Front Right
  Limits: Playback 0 - 87
  Mono:
  Front Left: Playback 87 [100%] [0.00dB] [on]
  Front Right: Playback 87 [100%] [0.00dB] [on]
Simple mixer control 'PCM',0
  Capabilities: pvolume pswitch penum
  Playback channels: Front Left - Front Right
  Limits: Playback 0 - 87
  Mono:
  Front Left: Playback 87 [100%] [0.00dB] [on]
  Front Right: Playback 87 [100%] [0.00dB] [on]
Simple mixer control 'Capture',0
  Capabilities: cvolume cswitch penum
  Capture channels: Front Left - Front Right
  Limits: Capture 0 - 63
  Front Left: Capture 39 [62%] [12.00dB] [on]
  Front Right: Capture 39 [62%] [12.00dB] [on]
Simple mixer control 'Auto-Mute Mode',0
  Capabilities: enum
  Items: 'Disabled' 'Speaker Only' 'Line Out+Speaker'
  Item0: 'Line Out+Speaker'
Simple mixer control 'Headset Mic',0
  Capabilities: pvolume pswitch cswitch cswitch-joined cswitch-exclusive penum
  Capture exclusive group: 0
  Playback channels: Front Left - Front Right
  Capture channels: Mono
  Limits: Playback 0 - 31
  Mono: Capture [off]
  Front Left: Playback 0 [0%] [-34.50dB] [off]
  Front Right: Playback 0 [0%] [-34.50dB] [off]
Simple mixer control 'Headset Mic Boost',0
  Capabilities: volume penum
  Playback channels: Front Left - Front Right
  Capture channels: Front Left - Front Right
  Limits: 0 - 3
  Front Left: 0 [0%] [0.00dB]
  Front Right: 0 [0%] [0.00dB]
Simple mixer control 'Internal Mic',0
  Capabilities: cswitch cswitch-joined cswitch-exclusive penum
  Capture exclusive group: 0
  Capture channels: Mono
  Mono: Capture [on]


!!Alsactl output
!!--------------

--startcollapse--
state.HDMI {
	control.1 {
		iface CARD
		name 'HDMI/DP,pcm=3 Jack'
		value false
		comment {
			access read
			type BOOLEAN
			count 1
		}
	}
	control.2 {
		iface MIXER
		name 'IEC958 Playback Con Mask'
		value '0fff000000000000000000000000000000000000000000000000000000000000000000000000000000000000000000000000000000000000000000000000000000000000000000000000000000000000000000000000000000000000000000000000000000000000000000000000000000000000000000000000000000000000000000000000000000000000000000000000000000000000000000000000000000000000000000000000000000000000'
		comment {
			access read
			type IEC958
			count 1
		}
	}
	control.3 {
		iface MIXER
		name 'IEC958 Playback Pro Mask'
		value '0f00000000000000000000000000000000000000000000000000000000000000000000000000000000000000000000000000000000000000000000000000000000000000000000000000000000000000000000000000000000000000000000000000000000000000000000000000000000000000000000000000000000000000000000000000000000000000000000000000000000000000000000000000000000000000000000000000000000000000'
		comment {
			access read
			type IEC958
			count 1
		}
	}
	control.4 {
		iface MIXER
		name 'IEC958 Playback Default'
		value '0400000000000000000000000000000000000000000000000000000000000000000000000000000000000000000000000000000000000000000000000000000000000000000000000000000000000000000000000000000000000000000000000000000000000000000000000000000000000000000000000000000000000000000000000000000000000000000000000000000000000000000000000000000000000000000000000000000000000000'
		comment {
			access 'read write'
			type IEC958
			count 1
		}
	}
	control.5 {
		iface MIXER
		name 'IEC958 Playback Switch'
		value true
		comment {
			access 'read write'
			type BOOLEAN
			count 1
		}
	}
	control.6 {
		iface PCM
		device 3
		name ELD
		value ''
		comment {
			access read
			type BYTES
			count 0
		}
	}
	control.7 {
		iface CARD
		name 'HDMI/DP,pcm=7 Jack'
		value false
		comment {
			access read
			type BOOLEAN
			count 1
		}
	}
	control.8 {
		iface MIXER
		name 'IEC958 Playback Con Mask'
		index 1
		value '0fff000000000000000000000000000000000000000000000000000000000000000000000000000000000000000000000000000000000000000000000000000000000000000000000000000000000000000000000000000000000000000000000000000000000000000000000000000000000000000000000000000000000000000000000000000000000000000000000000000000000000000000000000000000000000000000000000000000000000'
		comment {
			access read
			type IEC958
			count 1
		}
	}
	control.9 {
		iface MIXER
		name 'IEC958 Playback Pro Mask'
		index 1
		value '0f00000000000000000000000000000000000000000000000000000000000000000000000000000000000000000000000000000000000000000000000000000000000000000000000000000000000000000000000000000000000000000000000000000000000000000000000000000000000000000000000000000000000000000000000000000000000000000000000000000000000000000000000000000000000000000000000000000000000000'
		comment {
			access read
			type IEC958
			count 1
		}
	}
	control.10 {
		iface MIXER
		name 'IEC958 Playback Default'
		index 1
		value '0400000000000000000000000000000000000000000000000000000000000000000000000000000000000000000000000000000000000000000000000000000000000000000000000000000000000000000000000000000000000000000000000000000000000000000000000000000000000000000000000000000000000000000000000000000000000000000000000000000000000000000000000000000000000000000000000000000000000000'
		comment {
			access 'read write'
			type IEC958
			count 1
		}
	}
	control.11 {
		iface MIXER
		name 'IEC958 Playback Switch'
		index 1
		value true
		comment {
			access 'read write'
			type BOOLEAN
			count 1
		}
	}
	control.12 {
		iface PCM
		device 7
		name ELD
		value ''
		comment {
			access read
			type BYTES
			count 0
		}
	}
}
state.PCH {
	control.1 {
		iface MIXER
		name 'PCM Playback Volume'
		value.0 87
		value.1 87
		comment {
			access 'read write'
			type INTEGER
			count 2
			range '0 - 87'
			dbmin -6525
			dbmax 0
			dbvalue.0 0
			dbvalue.1 0
		}
	}
	control.2 {
		iface MIXER
		name 'PCM Playback Switch'
		value.0 true
		value.1 true
		comment {
			access 'read write'
			type BOOLEAN
			count 2
		}
	}
	control.3 {
		iface MIXER
		name 'Headphone Playback Volume'
		value.0 87
		value.1 87
		comment {
			access 'read write'
			type INTEGER
			count 2
			range '0 - 87'
			dbmin -6525
			dbmax 0
			dbvalue.0 0
			dbvalue.1 0
		}
	}
	control.4 {
		iface MIXER
		name 'Headphone Playback Switch'
		value.0 true
		value.1 true
		comment {
			access 'read write'
			type BOOLEAN
			count 2
		}
	}
	control.5 {
		iface MIXER
		name 'Speaker Playback Volume'
		value.0 87
		value.1 87
		comment {
			access 'read write'
			type INTEGER
			count 2
			range '0 - 87'
			dbmin -6525
			dbmax 0
			dbvalue.0 0
			dbvalue.1 0
		}
	}
	control.6 {
		iface MIXER
		name 'Speaker Playback Switch'
		value.0 true
		value.1 true
		comment {
			access 'read write'
			type BOOLEAN
			count 2
		}
	}
	control.7 {
		iface MIXER
		name 'Headphone Mic Playback Volume'
		value.0 0
		value.1 0
		comment {
			access 'read write'
			type INTEGER
			count 2
			range '0 - 31'
			dbmin -3450
			dbmax 1200
			dbvalue.0 -3450
			dbvalue.1 -3450
		}
	}
	control.8 {
		iface MIXER
		name 'Headphone Mic Playback Switch'
		value.0 false
		value.1 false
		comment {
			access 'read write'
			type BOOLEAN
			count 2
		}
	}
	control.9 {
		iface MIXER
		name 'Headset Mic Playback Volume'
		value.0 0
		value.1 0
		comment {
			access 'read write'
			type INTEGER
			count 2
			range '0 - 31'
			dbmin -3450
			dbmax 1200
			dbvalue.0 -3450
			dbvalue.1 -3450
		}
	}
	control.10 {
		iface MIXER
		name 'Headset Mic Playback Switch'
		value.0 false
		value.1 false
		comment {
			access 'read write'
			type BOOLEAN
			count 2
		}
	}
	control.11 {
		iface MIXER
		name 'Auto-Mute Mode'
		value 'Line Out+Speaker'
		comment {
			access 'read write'
			type ENUMERATED
			count 1
			item.0 Disabled
			item.1 'Speaker Only'
			item.2 'Line Out+Speaker'
		}
	}
	control.12 {
		iface MIXER
		name 'Capture Source'
		value 'Internal Mic'
		comment {
			access 'read write'
			type ENUMERATED
			count 1
			item.0 'Headphone Mic'
			item.1 'Headset Mic'
			item.2 'Internal Mic'
		}
	}
	control.13 {
		iface MIXER
		name 'Capture Volume'
		value.0 39
		value.1 39
		comment {
			access 'read write'
			type INTEGER
			count 2
			range '0 - 63'
			dbmin -1725
			dbmax 3000
			dbvalue.0 1200
			dbvalue.1 1200
		}
	}
	control.14 {
		iface MIXER
		name 'Capture Switch'
		value.0 true
		value.1 true
		comment {
			access 'read write'
			type BOOLEAN
			count 2
		}
	}
	control.15 {
		iface MIXER
		name 'Headphone Mic Boost Volume'
		value.0 0
		value.1 0
		comment {
			access 'read write'
			type INTEGER
			count 2
			range '0 - 3'
			dbmin 0
			dbmax 3000
			dbvalue.0 0
			dbvalue.1 0
		}
	}
	control.16 {
		iface MIXER
		name 'Headset Mic Boost Volume'
		value.0 0
		value.1 0
		comment {
			access 'read write'
			type INTEGER
			count 2
			range '0 - 3'
			dbmin 0
			dbmax 3000
			dbvalue.0 0
			dbvalue.1 0
		}
	}
	control.17 {
		iface MIXER
		name 'Master Playback Volume'
		value 61
		comment {
			access 'read write'
			type INTEGER
			count 1
			range '0 - 87'
			dbmin -6525
			dbmax 0
			dbvalue.0 -1950
		}
	}
	control.18 {
		iface MIXER
		name 'Master Playback Switch'
		value true
		comment {
			access 'read write'
			type BOOLEAN
			count 1
		}
	}
	control.19 {
		iface CARD
		name 'Headphone Mic Jack'
		value false
		comment {
			access read
			type BOOLEAN
			count 1
		}
	}
	control.20 {
		iface CARD
		name 'Headset Mic Phantom Jack'
		value true
		comment {
			access read
			type BOOLEAN
			count 1
		}
	}
	control.21 {
		iface CARD
		name 'Internal Mic Phantom Jack'
		value true
		comment {
			access read
			type BOOLEAN
			count 1
		}
	}
	control.22 {
		iface CARD
		name 'Line Out Jack'
		value false
		comment {
			access read
			type BOOLEAN
			count 1
		}
	}
	control.23 {
		iface CARD
		name 'Speaker Phantom Jack'
		value true
		comment {
			access read
			type BOOLEAN
			count 1
		}
	}
}
--endcollapse--


!!All Loaded Modules
!!------------------

Module
usb_storage
ufs
qnx4
hfsplus
hfs
minix
ntfs
msdos
jfs
xfs
reiserfs
ext2
nls_iso8859_1
bnep
rfcomm
parport_pc
ppdev
uvcvideo
coretemp
i915_hsw
kvm_intel
drm_kms_helper
kvm
videobuf2_core
videodev
snd_hda_codec_hdmi
snd_hda_codec_realtek
snd_hda_codec_generic
snd_hda_intel
videobuf2_vmalloc
joydev
videobuf2_memops
ghash_clmulni_intel
snd_hda_codec
snd_hwdep
hid_multitouch
snd_pcm
hid_generic
snd_seq_midi
snd_rawmidi
drm
snd_seq_midi_event
arc4
psmouse
snd_seq
aesni_intel
dm_multipath
cryptd
scsi_dh
iwlmvm
snd_timer
snd_seq_device
aes_x86_64
mac80211
i2c_algo_bit
fglrx
dell_wmi_aio
snd
sparse_keymap
lpc_ich
serio_raw
microcode
dcdbas
intel_ips
amd_iommu_v2
mac_hid
soundcore
snd_page_alloc
iwlwifi
cfg80211
btusb
bluetooth
compat
lp
parport
dm_raid45
xor
dm_mirror
dm_region_hash
dm_log
btrfs
zlib_deflate
libcrc32c
vesafb
usbhid
hid
video
wmi
ahci
libahci
sdhci_pci
sdhci
e1000e


!!Sysfs Files
!!-----------

/sys/class/sound/hwC0D0/init_pin_configs:
0x05 0x18560010
0x06 0x58560020
0x07 0x18560030

/sys/class/sound/hwC0D0/driver_pin_configs:

/sys/class/sound/hwC0D0/user_pin_configs:

/sys/class/sound/hwC0D0/init_verbs:

/sys/class/sound/hwC1D0/init_pin_configs:
0x12 0x99a30130
0x14 0x90170110
0x15 0x0321101f
0x16 0x03011020
0x18 0x40000008
0x19 0x411111f0
0x1a 0x411111f0
0x1b 0x411111f0
0x1d 0x41000001
0x1e 0x411111f0
0x1f 0x411111f0

/sys/class/sound/hwC1D0/driver_pin_configs:
0x19 0x03a1913d
0x1b 0x03a1113c

/sys/class/sound/hwC1D0/user_pin_configs:

/sys/class/sound/hwC1D0/init_verbs:


!!ALSA/HDA dmesg
!!--------------

[    9.746836] hid-multitouch 0003:2149:2330.0004: input,hidraw4: USB HID v1.10 Device [Advanced Silicon S.A CoolTouch(TM) System] on usb-0000:00:1d.0-1.7/input0
[    9.845121] hda-intel Haswell must build in CONFIG_SND_HDA_I915
[    9.845155] snd_hda_intel 0000:00:03.0: irq 48 for MSI/MSI-X
[    9.845211] snd_hda_intel 0000:00:1b.0: irq 49 for MSI/MSI-X
[    9.900987] input: HDA Intel PCH Line Out as /devices/pci0000:00/0000:00:1b.0/sound/card1/input7
[    9.901057] input: HDA Intel PCH Headphone Mic as /devices/pci0000:00/0000:00:1b.0/sound/card1/input8
[    9.909660] input: HDA Intel HDMI HDMI/DP,pcm=7 as /devices/pci0000:00/0000:00:03.0/sound/card0/input9
[    9.909716] input: HDA Intel HDMI HDMI/DP,pcm=3 as /devices/pci0000:00/0000:00:03.0/sound/card0/input10
[   10.141493] cfg80211: World regulatory domain updated:


