upload=true&script=true&cardinfo=
!!################################
!!ALSA Information Script v 0.4.60
!!################################

!!Script ran on: Mon Jun 25 07:50:26 UTC 2012


!!Linux Distribution
!!------------------

Ubuntu 12.04 LTS \n \l DISTRIB_ID=Ubuntu DISTRIB_DESCRIPTION="Ubuntu 12.04 LTS"


!!DMI Information
!!---------------

Manufacturer:      Dell Inc.
Product Name:      Vostro V131
Product Version:   Not Specified


!!Kernel Information
!!------------------

Kernel release:    3.2.0-23-generic
Operating System:  GNU/Linux
Architecture:      x86_64
Processor:         x86_64
SMP Enabled:       Yes


!!ALSA Version
!!------------

Driver version:     1.0.24
Library version:    1.0.25
Utilities version:  1.0.25


!!Loaded ALSA modules
!!-------------------

snd_hda_intel


!!Sound Servers on this system
!!----------------------------

Pulseaudio:
      Installed - Yes (/usr/bin/pulseaudio)
      Running - Yes


!!Soundcards recognised by ALSA
!!-----------------------------

 0 [PCH            ]: HDA-Intel - HDA Intel PCH
                      HDA Intel PCH at 0xf7f00000 irq 50


!!PCI Soundcards installed in the system
!!--------------------------------------

00:1b.0 Audio device: Intel Corporation 6 Series/C200 Series Chipset Family High Definition Audio Controller (rev 05)


!!Advanced information - PCI Vendor/Device/Subsystem ID's
!!--------------------------------------------------------

00:1b.0 0403: 8086:1c20 (rev 05)
	Subsystem: 1028:0510


!!Modprobe options (Sound related)
!!--------------------------------

snd-atiixp-modem: index=-2
snd-intel8x0m: index=-2
snd-via82xx-modem: index=-2
snd-usb-audio: index=-2
snd-usb-caiaq: index=-2
snd-usb-ua101: index=-2
snd-usb-us122l: index=-2
snd-usb-usx2y: index=-2
snd-cmipci: mpu_port=0x330 fm_port=0x388
snd-pcsp: index=-2
snd-usb-audio: index=-2


!!Loaded sound module options
!!--------------------------

!!Module: snd_hda_intel
	align_buffer_size : Y
	bdl_pos_adj : 1,-1,-1,-1,-1,-1,-1,-1,-1,-1,-1,-1,-1,-1,-1,-1,-1,-1,-1,-1,-1,-1,-1,-1,-1,-1,-1,-1,-1,-1,-1,-1
	beep_mode : 0,0,0,0,0,0,0,0,0,0,0,0,0,0,0,0,0,0,0,0,0,0,0,0,0,0,0,0,0,0,0,0
	enable : Y,Y,Y,Y,Y,Y,Y,Y,Y,Y,Y,Y,Y,Y,Y,Y,Y,Y,Y,Y,Y,Y,Y,Y,Y,Y,Y,Y,Y,Y,Y,Y
	enable_msi : -1
	id : (null),(null),(null),(null),(null),(null),(null),(null),(null),(null),(null),(null),(null),(null),(null),(null),(null),(null),(null),(null),(null),(null),(null),(null),(null),(null),(null),(null),(null),(null),(null),(null)
	index : -1,-1,-1,-1,-1,-1,-1,-1,-1,-1,-1,-1,-1,-1,-1,-1,-1,-1,-1,-1,-1,-1,-1,-1,-1,-1,-1,-1,-1,-1,-1,-1
	model : (null),(null),(null),(null),(null),(null),(null),(null),(null),(null),(null),(null),(null),(null),(null),(null),(null),(null),(null),(null),(null),(null),(null),(null),(null),(null),(null),(null),(null),(null),(null),(null)
	patch : (null),(null),(null),(null),(null),(null),(null),(null),(null),(null),(null),(null),(null),(null),(null),(null),(null),(null),(null),(null),(null),(null),(null),(null),(null),(null),(null),(null),(null),(null),(null),(null)
	position_fix : 0,0,0,0,0,0,0,0,0,0,0,0,0,0,0,0,0,0,0,0,0,0,0,0,0,0,0,0,0,0,0,0
	power_save : 0
	power_save_controller : Y
	probe_mask : -1,-1,-1,-1,-1,-1,-1,-1,-1,-1,-1,-1,-1,-1,-1,-1,-1,-1,-1,-1,-1,-1,-1,-1,-1,-1,-1,-1,-1,-1,-1,-1
	probe_only : 0,0,0,0,0,0,0,0,0,0,0,0,0,0,0,0,0,0,0,0,0,0,0,0,0,0,0,0,0,0,0,0
	single_cmd : N
	snoop : Y


!!HDA-Intel Codec information
!!---------------------------
--startcollapse--

Codec: Conexant CX20590
Address: 0
AFG Function Id: 0x1 (unsol 1)
Vendor Id: 0x14f1506e
Subsystem Id: 0x10280510
Revision Id: 0x100000
No Modem Function Group found
Default PCM:
    rates [0x160]: 44100 48000 96000
    bits [0xe]: 16 20 24
    formats [0x1]: PCM
Default Amp-In caps: N/A
Default Amp-Out caps: N/A
GPIO: io=4, o=0, i=0, unsolicited=1, wake=0
  IO[0]: enable=0, dir=0, wake=0, sticky=0, data=0, unsol=0
  IO[1]: enable=0, dir=0, wake=0, sticky=0, data=0, unsol=0
  IO[2]: enable=0, dir=0, wake=0, sticky=0, data=0, unsol=0
  IO[3]: enable=0, dir=0, wake=0, sticky=0, data=0, unsol=0
Node 0x10 [Audio Output] wcaps 0xc1d: Stereo Amp-Out R/L
  Control: name="Master Playback Volume", index=0, device=0
    ControlAmp: chs=3, dir=Out, idx=0, ofs=0
  Device: name="CONEXANT Analog", type="Audio", device=0
  Amp-Out caps: ofs=0x4a, nsteps=0x4a, stepsize=0x03, mute=1
  Amp-Out vals:  [0x38 0x38]
  Converter: stream=8, channel=0
  PCM:
    rates [0x560]: 44100 48000 96000 192000
    bits [0xe]: 16 20 24
    formats [0x1]: PCM
  Power states:  D0 D1 D2 D3 D3cold EPSS
  Power: setting=D0, actual=D0
Node 0x11 [Audio Output] wcaps 0xc1d: Stereo Amp-Out R/L
  Amp-Out caps: ofs=0x4a, nsteps=0x4a, stepsize=0x03, mute=1
  Amp-Out vals:  [0x3c 0x3c]
  Converter: stream=0, channel=0
  PCM:
    rates [0x560]: 44100 48000 96000 192000
    bits [0xe]: 16 20 24
    formats [0x1]: PCM
  Power states:  D0 D1 D2 D3 D3cold EPSS
  Power: setting=D0, actual=D0
Node 0x12 [Audio Output] wcaps 0x611: Stereo Digital
  Converter: stream=0, channel=0
  Digital:
  Digital category: 0x0
  PCM:
    rates [0x160]: 44100 48000 96000
    bits [0xe]: 16 20 24
    formats [0x5]: PCM AC3
  Power states:  D0 D1 D2 D3 D3cold EPSS
  Power: setting=D0, actual=D0
Node 0x13 [Beep Generator Widget] wcaps 0x70000c: Mono Amp-Out
  Control: name="Beep Playback Volume", index=0, device=0
    ControlAmp: chs=1, dir=Out, idx=0, ofs=0
  Control: name="Beep Playback Switch", index=0, device=0
    ControlAmp: chs=1, dir=Out, idx=0, ofs=0
  Amp-Out caps: ofs=0x07, nsteps=0x07, stepsize=0x0f, mute=0
  Amp-Out vals:  [0x00]
Node 0x14 [Audio Input] wcaps 0x100d1b: Stereo Amp-In R/L
  Device: name="CONEXANT Analog", type="Audio", device=0
  Amp-In caps: ofs=0x4a, nsteps=0x50, stepsize=0x03, mute=1
  Amp-In vals:  [0x3d 0x3d] [0x80 0x80] [0x3d 0x3d] [0x80 0x80]
  Converter: stream=4, channel=0
  SDI-Select: 0
  PCM:
    rates [0x160]: 44100 48000 96000
    bits [0xe]: 16 20 24
    formats [0x1]: PCM
  Power states:  D0 D1 D2 D3 D3cold EPSS
  Power: setting=D0, actual=D0
  Connection: 4
     0x17 0x18 0x23* 0x24
Node 0x15 [Audio Input] wcaps 0x100d1b: Stereo Amp-In R/L
  Amp-In caps: ofs=0x4a, nsteps=0x50, stepsize=0x03, mute=1
  Amp-In vals:  [0x4a 0x4a] [0x4a 0x4a] [0x4a 0x4a] [0x4a 0x4a]
  Converter: stream=0, channel=0
  SDI-Select: 0
  PCM:
    rates [0x160]: 44100 48000 96000
    bits [0xe]: 16 20 24
    formats [0x1]: PCM
  Power states:  D0 D1 D2 D3 D3cold EPSS
  Power: setting=D0, actual=D0
  Connection: 4
     0x17* 0x18 0x23 0x24
Node 0x16 [Audio Input] wcaps 0x100d1b: Stereo Amp-In R/L
  Amp-In caps: ofs=0x4a, nsteps=0x50, stepsize=0x03, mute=1
  Amp-In vals:  [0x4a 0x4a] [0x4a 0x4a] [0x4a 0x4a] [0x4a 0x4a]
  Converter: stream=0, channel=0
  SDI-Select: 0
  PCM:
    rates [0x160]: 44100 48000 96000
    bits [0xe]: 16 20 24
    formats [0x1]: PCM
  Power states:  D0 D1 D2 D3 D3cold EPSS
  Power: setting=D0, actual=D0
  Connection: 4
     0x17* 0x18 0x23 0x24
Node 0x17 [Audio Selector] wcaps 0x30050d: Stereo Amp-Out
  Amp-Out caps: ofs=0x00, nsteps=0x04, stepsize=0x27, mute=0
  Amp-Out vals:  [0x02 0x02]
  Power states:  D0 D1 D2 D3 D3cold EPSS
  Power: setting=D0, actual=D0
  Connection: 4
     0x1a 0x1b* 0x1d 0x1e
Node 0x18 [Audio Selector] wcaps 0x30050d: Stereo Amp-Out
  Amp-Out caps: ofs=0x00, nsteps=0x04, stepsize=0x27, mute=0
  Amp-Out vals:  [0x00 0x00]
  Power states:  D0 D1 D2 D3 D3cold EPSS
  Power: setting=D0, actual=D0
  Connection: 4
     0x1a* 0x1b 0x1d 0x1e
Node 0x19 [Pin Complex] wcaps 0x400581: Stereo
  Pincap 0x0000001c: OUT HP Detect
  Pin Default 0x04211040: [Jack] HP Out at Ext Right
    Conn = 1/8, Color = Black
    DefAssociation = 0x4, Sequence = 0x0
  Pin-ctls: 0x00:
  Unsolicited: tag=37, enabled=1
  Power states:  D0 D1 D2 D3 D3cold EPSS
  Power: setting=D0, actual=D0
  Connection: 2
     0x10* 0x11
Node 0x1a [Pin Complex] wcaps 0x400481: Stereo
  Pincap 0x00001324: IN Detect
    Vref caps: HIZ 50 80
  Pin Default 0x400001f0: [N/A] Line Out at Ext N/A
    Conn = Unknown, Color = Unknown
    DefAssociation = 0xf, Sequence = 0x0
    Misc = NO_PRESENCE
  Pin-ctls: 0x24: IN VREF_80
  Unsolicited: tag=00, enabled=0
  Power states:  D0 D1 D2 D3 D3cold EPSS
  Power: setting=D0, actual=D0
Node 0x1b [Pin Complex] wcaps 0x400581: Stereo
  Pincap 0x00011334: IN OUT EAPD Detect
    Vref caps: HIZ 50 80
  EAPD 0x2: EAPD
  Pin Default 0x04a11030: [Jack] Mic at Ext Right
    Conn = 1/8, Color = Black
    DefAssociation = 0x3, Sequence = 0x0
  Pin-ctls: 0x00: VREF_HIZ
  Unsolicited: tag=38, enabled=1
  Power states:  D0 D1 D2 D3 D3cold EPSS
  Power: setting=D0, actual=D0
  Connection: 2
     0x10* 0x11
Node 0x1c [Pin Complex] wcaps 0x400581: Stereo
  Pincap 0x00000014: OUT Detect
  Pin Default 0x400001f0: [N/A] Line Out at Ext N/A
    Conn = Unknown, Color = Unknown
    DefAssociation = 0xf, Sequence = 0x0
    Misc = NO_PRESENCE
  Pin-ctls: 0x00:
  Unsolicited: tag=00, enabled=0
  Power states:  D0 D1 D2 D3 D3cold EPSS
  Power: setting=D0, actual=D0
  Connection: 2
     0x10* 0x11
Node 0x1d [Pin Complex] wcaps 0x400581: Stereo
  Pincap 0x00010034: IN OUT EAPD Detect
  EAPD 0x2: EAPD
  Pin Default 0x400001f0: [N/A] Line Out at Ext N/A
    Conn = Unknown, Color = Unknown
    DefAssociation = 0xf, Sequence = 0x0
    Misc = NO_PRESENCE
  Pin-ctls: 0x20: IN
  Unsolicited: tag=00, enabled=0
  Power states:  D0 D1 D2 D3 D3cold EPSS
  Power: setting=D0, actual=D0
  Connection: 2
     0x10* 0x11
Node 0x1e [Pin Complex] wcaps 0x400481: Stereo
  Pincap 0x00000024: IN Detect
  Pin Default 0x400001f0: [N/A] Line Out at Ext N/A
    Conn = Unknown, Color = Unknown
    DefAssociation = 0xf, Sequence = 0x0
    Misc = NO_PRESENCE
  Pin-ctls: 0x20: IN
  Unsolicited: tag=00, enabled=0
  Power states:  D0 D1 D2 D3 D3cold EPSS
  Power: setting=D0, actual=D0
Node 0x1f [Pin Complex] wcaps 0x400501: Stereo
  Pincap 0x00000010: OUT
  Pin Default 0x92170110: [Fixed] Speaker at Int Front
    Conn = Analog, Color = Unknown
    DefAssociation = 0x1, Sequence = 0x0
    Misc = NO_PRESENCE
  Pin-ctls: 0x40: OUT
  Power states:  D0 D1 D2 D3 D3cold EPSS
  Power: setting=D0, actual=D0
  Connection: 2
     0x10* 0x11
Node 0x20 [Pin Complex] wcaps 0x400781: Stereo Digital
  Pincap 0x00000010: OUT
  Pin Default 0x400001f0: [N/A] Line Out at Ext N/A
    Conn = Unknown, Color = Unknown
    DefAssociation = 0xf, Sequence = 0x0
    Misc = NO_PRESENCE
  Pin-ctls: 0x40: OUT
  Unsolicited: tag=00, enabled=0
  Power states:  D0 D1 D2 D3 D3cold EPSS
  Power: setting=D0, actual=D0
  Connection: 1
     0x12
Node 0x21 [Audio Output] wcaps 0x611: Stereo Digital
  Converter: stream=0, channel=0
  Digital:
  Digital category: 0x0
  PCM:
    rates [0x160]: 44100 48000 96000
    bits [0xe]: 16 20 24
    formats [0x5]: PCM AC3
  Power states:  D0 D1 D2 D3 D3cold EPSS
  Power: setting=D0, actual=D0
Node 0x22 [Pin Complex] wcaps 0x400781: Stereo Digital
  Pincap 0x00000010: OUT
  Pin Default 0x400001f0: [N/A] Line Out at Ext N/A
    Conn = Unknown, Color = Unknown
    DefAssociation = 0xf, Sequence = 0x0
    Misc = NO_PRESENCE
  Pin-ctls: 0x40: OUT
  Unsolicited: tag=00, enabled=0
  Power states:  D0 D1 D2 D3 D3cold EPSS
  Power: setting=D0, actual=D0
  Connection: 1
     0x21
Node 0x23 [Pin Complex] wcaps 0x40040b: Stereo Amp-In
  Amp-In caps: ofs=0x00, nsteps=0x04, stepsize=0x2f, mute=0
  Amp-In vals:  [0x02 0x02]
  Pincap 0x00000020: IN
  Pin Default 0x95a60150: [Fixed] Mic at Int Top
    Conn = Digital, Color = Unknown
    DefAssociation = 0x5, Sequence = 0x0
    Misc = NO_PRESENCE
  Pin-ctls: 0x20: IN
  Power states:  D0 D1 D2 D3 D3cold EPSS
  Power: setting=D0, actual=D0
Node 0x24 [Audio Mixer] wcaps 0x20050b: Stereo Amp-In
  Amp-In caps: ofs=0x4a, nsteps=0x4a, stepsize=0x03, mute=1
  Amp-In vals:  [0x00 0x00] [0x00 0x00]
  Power states:  D0 D1 D2 D3 D3cold EPSS
  Power: setting=D0, actual=D0
  Connection: 2
     0x10 0x11
Node 0x25 [Vendor Defined Widget] wcaps 0xf00000: Mono
Codec: Intel CougarPoint HDMI
Address: 3
AFG Function Id: 0x1 (unsol 0)
Vendor Id: 0x80862805
Subsystem Id: 0x80860101
Revision Id: 0x100000
No Modem Function Group found
Default PCM:
    rates [0x0]:
    bits [0x0]:
    formats [0x0]:
Default Amp-In caps: N/A
Default Amp-Out caps: N/A
GPIO: io=0, o=0, i=0, unsolicited=0, wake=0
Node 0x02 [Audio Output] wcaps 0x6611: 8-Channels Digital
  Converter: stream=0, channel=0
  Digital: Enabled GenLevel
  Digital category: 0x2
  PCM:
    rates [0x7f0]: 32000 44100 48000 88200 96000 176400 192000
    bits [0x1e]: 16 20 24 32
    formats [0x5]: PCM AC3
  Power states:  D0 D3 EPSS
  Power: setting=D0, actual=D0
Node 0x03 [Audio Output] wcaps 0x6611: 8-Channels Digital
  Converter: stream=0, channel=0
  Digital: Enabled
  Digital category: 0x0
  PCM:
    rates [0x7f0]: 32000 44100 48000 88200 96000 176400 192000
    bits [0x1e]: 16 20 24 32
    formats [0x5]: PCM AC3
  Power states:  D0 D3 EPSS
  Power: setting=D0, actual=D0
Node 0x04 [Audio Output] wcaps 0x6611: 8-Channels Digital
  Converter: stream=0, channel=0
  Digital: Enabled
  Digital category: 0x0
  PCM:
    rates [0x7f0]: 32000 44100 48000 88200 96000 176400 192000
    bits [0x1e]: 16 20 24 32
    formats [0x5]: PCM AC3
  Power states:  D0 D3 EPSS
  Power: setting=D0, actual=D0
Node 0x05 [Pin Complex] wcaps 0x40778d: 8-Channels Digital Amp-Out CP
  Control: name="HDMI/DP,pcm=3 Jack", index=0, device=0
  Control: name="IEC958 Playback Con Mask", index=0, device=0
  Control: name="IEC958 Playback Pro Mask", index=0, device=0
  Control: name="IEC958 Playback Default", index=0, device=0
  Control: name="IEC958 Playback Switch", index=0, device=0
  Control: name="ELD", index=0, device=3
  Amp-Out caps: ofs=0x00, nsteps=0x00, stepsize=0x00, mute=1
  Amp-Out vals:  [0x00 0x00]
  Pincap 0x09000094: OUT Detect HBR HDMI DP
  Pin Default 0x18560010: [Jack] Digital Out at Int HDMI
    Conn = Digital, Color = Unknown
    DefAssociation = 0x1, Sequence = 0x0
  Pin-ctls: 0x00:
  Unsolicited: tag=01, enabled=1
  Power states:  D0 D3 EPSS
  Power: setting=D0, actual=D0
  Connection: 1
     0x02
Node 0x06 [Pin Complex] wcaps 0x40778d: 8-Channels Digital Amp-Out CP
  Amp-Out caps: ofs=0x00, nsteps=0x00, stepsize=0x00, mute=1
  Amp-Out vals:  [0x00 0x80]
  Pincap 0x09000094: OUT Detect HBR HDMI DP
  Pin Default 0x58560020: [N/A] Digital Out at Int HDMI
    Conn = Digital, Color = Unknown
    DefAssociation = 0x2, Sequence = 0x0
  Pin-ctls: 0x40: OUT
  Unsolicited: tag=00, enabled=0
  Power states:  D0 D3 EPSS
  Power: setting=D0, actual=D0
  Connection: 1
     0x03
Node 0x07 [Pin Complex] wcaps 0x40778d: 8-Channels Digital Amp-Out CP
  Amp-Out caps: ofs=0x00, nsteps=0x00, stepsize=0x00, mute=1
  Amp-Out vals:  [0x00 0x80]
  Pincap 0x09000094: OUT Detect HBR HDMI DP
  Pin Default 0x58560030: [N/A] Digital Out at Int HDMI
    Conn = Digital, Color = Unknown
    DefAssociation = 0x3, Sequence = 0x0
  Pin-ctls: 0x40: OUT
  Unsolicited: tag=00, enabled=0
  Power states:  D0 D3 EPSS
  Power: setting=D0, actual=D0
  Connection: 1
     0x04
Node 0x08 [Vendor Defined Widget] wcaps 0xf00000: Mono
--endcollapse--


!!ALSA Device nodes
!!-----------------

crw-rw---T+ 1 root audio 116,  7 Jun 25 03:39 /dev/snd/controlC0
crw-rw---T+ 1 root audio 116,  6 Jun 25 03:39 /dev/snd/hwC0D0
crw-rw---T+ 1 root audio 116,  5 Jun 25 03:39 /dev/snd/hwC0D3
crw-rw---T+ 1 root audio 116,  4 Jun 25 03:46 /dev/snd/pcmC0D0c
crw-rw---T+ 1 root audio 116,  3 Jun 25 03:50 /dev/snd/pcmC0D0p
crw-rw---T+ 1 root audio 116,  2 Jun 25 03:39 /dev/snd/pcmC0D3p
crw-rw---T+ 1 root audio 116,  1 Jun 25 03:39 /dev/snd/seq
crw-rw---T+ 1 root audio 116, 33 Jun 25 03:39 /dev/snd/timer

/dev/snd/by-path:
total 0
drwxr-xr-x 2 root root  60 Jun 25 03:39 .
drwxr-xr-x 3 root root 220 Jun 25 03:39 ..
lrwxrwxrwx 1 root root  12 Jun 25 03:39 pci-0000:00:1b.0 -> ../controlC0


!!Aplay/Arecord output
!!------------

APLAY

**** List of PLAYBACK Hardware Devices ****
card 0: PCH [HDA Intel PCH], device 0: CONEXANT Analog [CONEXANT Analog]
  Subdevices: 1/1
  Subdevice #0: subdevice #0
card 0: PCH [HDA Intel PCH], device 3: HDMI 0 [HDMI 0]
  Subdevices: 1/1
  Subdevice #0: subdevice #0

ARECORD

**** List of CAPTURE Hardware Devices ****
card 0: PCH [HDA Intel PCH], device 0: CONEXANT Analog [CONEXANT Analog]
  Subdevices: 0/1
  Subdevice #0: subdevice #0

!!Amixer output
!!-------------

!!-------Mixer controls for card 0 [PCH]

Card hw:0 'PCH'/'HDA Intel PCH at 0xf7f00000 irq 50'
  Mixer name	: 'Intel CougarPoint HDMI'
  Components	: 'HDA:14f1506e,10280510,00100000 HDA:80862805,80860101,00100000'
  Controls      : 14
  Simple ctrls  : 6
Simple mixer control 'Master',0
  Capabilities: pvolume pswitch pswitch-joined penum
  Playback channels: Front Left - Front Right
  Limits: Playback 0 - 74
  Mono:
  Front Left: Playback 56 [76%] [-18.00dB] [on]
  Front Right: Playback 56 [76%] [-18.00dB] [on]
Simple mixer control 'PCM',0
  Capabilities: pvolume penum
  Playback channels: Front Left - Front Right
  Limits: Playback 0 - 255
  Mono:
  Front Left: Playback 255 [100%] [0.00dB]
  Front Right: Playback 255 [100%] [0.00dB]
Simple mixer control 'IEC958',0
  Capabilities: pswitch pswitch-joined penum
  Playback channels: Mono
  Mono: Playback [on]
Simple mixer control 'Beep',0
  Capabilities: pvolume pvolume-joined pswitch pswitch-joined penum
  Playback channels: Mono
  Limits: Playback 0 - 7
  Mono: Playback 0 [0%] [-28.00dB] [on]
Simple mixer control 'Capture',0
  Capabilities: cvolume cswitch penum
  Capture channels: Front Left - Front Right
  Limits: Capture 0 - 80
  Front Left: Capture 61 [76%] [-13.00dB] [on]
  Front Right: Capture 61 [76%] [-13.00dB] [on]
Simple mixer control 'Analog Mic Boost',0
  Capabilities: cenum
  Items: '0dB' '10dB' '20dB' '30dB' '40dB'
  Item0: '20dB'


!!Alsactl output
!!-------------

--startcollapse--
state.PCH {
	control.1 {
		iface MIXER
		name 'Master Playback Volume'
		value.0 56
		value.1 56
		comment {
			access 'read write'
			type INTEGER
			count 2
			range '0 - 74'
			dbmin -7400
			dbmax 0
			dbvalue.0 -1800
			dbvalue.1 -1800
		}
	}
	control.2 {
		iface MIXER
		name 'Master Playback Switch'
		value true
		comment {
			access 'read write'
			type BOOLEAN
			count 1
		}
	}
	control.3 {
		iface MIXER
		name 'Analog Mic Boost Capture Enum'
		value '20dB'
		comment {
			access 'read write'
			type ENUMERATED
			count 1
			item.0 '0dB'
			item.1 '10dB'
			item.2 '20dB'
			item.3 '30dB'
			item.4 '40dB'
		}
	}
	control.4 {
		iface MIXER
		name 'Capture Volume'
		value.0 61
		value.1 61
		comment {
			access 'read write'
			type INTEGER
			count 2
			range '0 - 80'
			dbmin -7400
			dbmax 600
			dbvalue.0 -1300
			dbvalue.1 -1300
		}
	}
	control.5 {
		iface MIXER
		name 'Capture Switch'
		value.0 true
		value.1 true
		comment {
			access 'read write'
			type BOOLEAN
			count 2
		}
	}
	control.6 {
		iface MIXER
		name 'Beep Playback Volume'
		value 0
		comment {
			access 'read write'
			type INTEGER
			count 1
			range '0 - 7'
			dbmin -2800
			dbmax 0
			dbvalue.0 -2800
		}
	}
	control.7 {
		iface MIXER
		name 'Beep Playback Switch'
		value true
		comment {
			access 'read write'
			type BOOLEAN
			count 1
		}
	}
	control.8 {
		iface CARD
		name 'HDMI/DP,pcm=3 Jack'
		value false
		comment {
			access read
			type BOOLEAN
			count 1
		}
	}
	control.9 {
		iface MIXER
		name 'IEC958 Playback Con Mask'
		value '0fff000000000000000000000000000000000000000000000000000000000000000000000000000000000000000000000000000000000000000000000000000000000000000000000000000000000000000000000000000000000000000000000000000000000000000000000000000000000000000000000000000000000000000000000000000000000000000000000000000000000000000000000000000000000000000000000000000000000000'
		comment {
			access read
			type IEC958
			count 1
		}
	}
	control.10 {
		iface MIXER
		name 'IEC958 Playback Pro Mask'
		value '0f00000000000000000000000000000000000000000000000000000000000000000000000000000000000000000000000000000000000000000000000000000000000000000000000000000000000000000000000000000000000000000000000000000000000000000000000000000000000000000000000000000000000000000000000000000000000000000000000000000000000000000000000000000000000000000000000000000000000000'
		comment {
			access read
			type IEC958
			count 1
		}
	}
	control.11 {
		iface MIXER
		name 'IEC958 Playback Default'
		value '0400000000000000000000000000000000000000000000000000000000000000000000000000000000000000000000000000000000000000000000000000000000000000000000000000000000000000000000000000000000000000000000000000000000000000000000000000000000000000000000000000000000000000000000000000000000000000000000000000000000000000000000000000000000000000000000000000000000000000'
		comment {
			access 'read write'
			type IEC958
			count 1
		}
	}
	control.12 {
		iface MIXER
		name 'IEC958 Playback Switch'
		value true
		comment {
			access 'read write'
			type BOOLEAN
			count 1
		}
	}
	control.13 {
		iface PCM
		device 3
		name ELD
		value ''
		comment {
			access read
			type BYTES
			count 0
		}
	}
	control.14 {
		iface MIXER
		name 'PCM Playback Volume'
		value.0 255
		value.1 255
		comment {
			access 'read write user'
			type INTEGER
			count 2
			range '0 - 255'
			tlv '0000000100000008ffffec1400000014'
			dbmin -5100
			dbmax 0
			dbvalue.0 0
			dbvalue.1 0
		}
	}
}
--endcollapse--


!!All Loaded Modules
!!------------------

Module
rfcomm
parport_pc
ppdev
snd_hda_codec_hdmi
bnep
snd_hda_codec_conexant
snd_hda_intel
snd_hda_codec
snd_hwdep
snd_pcm
snd_seq_midi
snd_rawmidi
snd_seq_midi_event
snd_seq
uvcvideo
videodev
joydev
arc4
ath3k
btusb
ath9k
bluetooth
snd_timer
snd_seq_device
snd
mac80211
ath9k_common
ath9k_hw
i915
dell_wmi
v4l2_compat_ioctl32
sparse_keymap
psmouse
soundcore
ath
dell_laptop
dcdbas
mei
cfg80211
wmi
drm_kms_helper
snd_page_alloc
drm
i2c_algo_bit
serio_raw
video
mac_hid
lp
parport
ums_realtek
usb_storage
uas
r8169


!!Sysfs Files
!!-----------

/sys/class/sound/hwC0D0/init_pin_configs:
0x19 0x04211040
0x1a 0x400001f0
0x1b 0x04a11030
0x1c 0x400001f0
0x1d 0x400001f0
0x1e 0x400001f0
0x1f 0x92170110
0x20 0x400001f0
0x22 0x400001f0
0x23 0x95a60150

/sys/class/sound/hwC0D0/driver_pin_configs:

/sys/class/sound/hwC0D0/user_pin_configs:

/sys/class/sound/hwC0D0/init_verbs:

/sys/class/sound/hwC0D3/init_pin_configs:
0x05 0x18560010
0x06 0x58560020
0x07 0x58560030

/sys/class/sound/hwC0D3/driver_pin_configs:

/sys/class/sound/hwC0D3/user_pin_configs:

/sys/class/sound/hwC0D3/init_verbs:


!!ALSA/HDA dmesg
!!------------------

[   15.590055] usb 1-1.4: USB disconnect, device number 3
[   15.960418] snd_hda_intel 0000:00:1b.0: PCI INT A -> GSI 22 (level, low) -> IRQ 22
[   15.960494] snd_hda_intel 0000:00:1b.0: irq 50 for MSI/MSI-X
[   15.960529] snd_hda_intel 0000:00:1b.0: setting latency timer to 64
[   16.108266] input: Laptop_Integrated_Webcam_HD as /devices/pci0000:00/0000:00:1a.0/usb1/1-1/1-1.5/1-1.5:1.0/input/input8
--
[   16.790039] Bluetooth: BNEP filters: protocol multicast
[   16.813155] HDMI status: Codec=3 Pin=5 Presence_Detect=0 ELD_Valid=0
[   16.813236] input: HDA Intel PCH HDMI/DP,pcm=3 as /devices/pci0000:00/0000:00:1b.0/sound/card0/input9
[   16.831856] ppdev: user-space parallel port driver
--
[  358.268771] ehci_hcd 0000:00:1d.0: PCI INT A disabled
[  358.460919] snd_hda_intel 0000:00:1b.0: PCI INT A disabled
[  358.476468] PM: suspend of drv:snd_hda_intel dev:0000:00:1b.0 complete after 222.284 msecs
[  358.824060] PM: suspend of drv:sd dev:0:0:0:0 complete after 607.397 msecs
--
[  359.429056] ehci_hcd 0000:00:1a.0: PME# disabled
[  359.429073] snd_hda_intel 0000:00:1b.0: restoring config space at offset 0xf (was 0x100, writing 0x105)
[  359.429088] snd_hda_intel 0000:00:1b.0: restoring config space at offset 0x3 (was 0x0, writing 0x10)
[  359.429094] snd_hda_intel 0000:00:1b.0: restoring config space at offset 0x1 (was 0x100000, writing 0x100002)
[  359.429122] pcieport 0000:00:1c.0: restoring config space at offset 0xf (was 0x100, writing 0x10010b)
--
[  359.432678] mei 0000:00:16.0: irq 48 for MSI/MSI-X
[  359.432681] snd_hda_intel 0000:00:1b.0: PCI INT A -> GSI 22 (level, low) -> IRQ 22
[  359.432689] snd_hda_intel 0000:00:1b.0: setting latency timer to 64
[  359.432721] pciehp 0000:00:1c.7:pcie04: pciehp_resume ENTRY
[  359.432730] ehci_hcd 0000:00:1d.0: PCI INT A -> GSI 23 (level, low) -> IRQ 23
[  359.432733] snd_hda_intel 0000:00:1b.0: irq 50 for MSI/MSI-X
[  359.432739] ehci_hcd 0000:00:1d.0: setting latency timer to 64


