upload=true&script=true&cardinfo=
!!################################
!!ALSA Information Script v 0.4.60
!!################################

!!Script ran on: Mon Jun  4 22:11:28 UTC 2012


!!Linux Distribution
!!------------------

Ubuntu quantal (development branch) \n \l DISTRIB_ID=Ubuntu DISTRIB_DESCRIPTION="Ubuntu quantal (development branch)"


!!DMI Information
!!---------------

Manufacturer:      Dell Inc.
Product Name:      Inspiron 1525                   
Product Version:   


!!Kernel Information
!!------------------

Kernel release:    3.4.0-3-generic
Operating System:  GNU/Linux
Architecture:      x86_64
Processor:         x86_64
SMP Enabled:       Yes


!!ALSA Version
!!------------

Driver version:     1.0.25
Library version:    1.0.25
Utilities version:  1.0.25


!!Loaded ALSA modules
!!-------------------

snd_hda_intel


!!Sound Servers on this system
!!----------------------------

Pulseaudio:
      Installed - Yes (/usr/bin/pulseaudio)
      Running - Yes


!!Soundcards recognised by ALSA
!!-----------------------------

 0 [Intel          ]: HDA-Intel - HDA Intel
                      HDA Intel at 0xfe9fc000 irq 46


!!PCI Soundcards installed in the system
!!--------------------------------------

00:1b.0 Audio device: Intel Corporation 82801H (ICH8 Family) HD Audio Controller (rev 02)


!!Advanced information - PCI Vendor/Device/Subsystem ID's
!!--------------------------------------------------------

00:1b.0 0403: 8086:284b (rev 02)
	Subsystem: 1028:022f


!!Modprobe options (Sound related)
!!--------------------------------

snd-atiixp-modem: index=-2
snd-intel8x0m: index=-2
snd-via82xx-modem: index=-2
snd-usb-audio: index=-2
snd-usb-caiaq: index=-2
snd-usb-ua101: index=-2
snd-usb-us122l: index=-2
snd-usb-usx2y: index=-2
snd-cmipci: mpu_port=0x330 fm_port=0x388
snd-pcsp: index=-2
snd-usb-audio: index=-2


!!Loaded sound module options
!!--------------------------

!!Module: snd_hda_intel
	align_buffer_size : -1
	bdl_pos_adj : 1,-1,-1,-1,-1,-1,-1,-1,-1,-1,-1,-1,-1,-1,-1,-1,-1,-1,-1,-1,-1,-1,-1,-1,-1,-1,-1,-1,-1,-1,-1,-1
	beep_mode : 0,0,0,0,0,0,0,0,0,0,0,0,0,0,0,0,0,0,0,0,0,0,0,0,0,0,0,0,0,0,0,0
	enable : Y,Y,Y,Y,Y,Y,Y,Y,Y,Y,Y,Y,Y,Y,Y,Y,Y,Y,Y,Y,Y,Y,Y,Y,Y,Y,Y,Y,Y,Y,Y,Y
	enable_msi : -1
	id : (null),(null),(null),(null),(null),(null),(null),(null),(null),(null),(null),(null),(null),(null),(null),(null),(null),(null),(null),(null),(null),(null),(null),(null),(null),(null),(null),(null),(null),(null),(null),(null)
	index : -1,-1,-1,-1,-1,-1,-1,-1,-1,-1,-1,-1,-1,-1,-1,-1,-1,-1,-1,-1,-1,-1,-1,-1,-1,-1,-1,-1,-1,-1,-1,-1
	model : (null),(null),(null),(null),(null),(null),(null),(null),(null),(null),(null),(null),(null),(null),(null),(null),(null),(null),(null),(null),(null),(null),(null),(null),(null),(null),(null),(null),(null),(null),(null),(null)
	patch : (null),(null),(null),(null),(null),(null),(null),(null),(null),(null),(null),(null),(null),(null),(null),(null),(null),(null),(null),(null),(null),(null),(null),(null),(null),(null),(null),(null),(null),(null),(null),(null)
	position_fix : 0,0,0,0,0,0,0,0,0,0,0,0,0,0,0,0,0,0,0,0,0,0,0,0,0,0,0,0,0,0,0,0
	power_save : 0
	power_save_controller : Y
	probe_mask : -1,-1,-1,-1,-1,-1,-1,-1,-1,-1,-1,-1,-1,-1,-1,-1,-1,-1,-1,-1,-1,-1,-1,-1,-1,-1,-1,-1,-1,-1,-1,-1
	probe_only : 0,0,0,0,0,0,0,0,0,0,0,0,0,0,0,0,0,0,0,0,0,0,0,0,0,0,0,0,0,0,0,0
	single_cmd : N
	snoop : Y


!!HDA-Intel Codec information
!!---------------------------
--startcollapse--

Codec: Conexant ID 2c06
Address: 0
MFG Function Id: 0x2 (unsol 1)
Vendor Id: 0x14f12c06
Subsystem Id: 0x14f1000f
Revision Id: 0x100000
Modem Function Group: 0x2
Codec: Silicon Image SiI1392 HDMI
Address: 1
AFG Function Id: 0x1 (unsol 0)
Vendor Id: 0x10951392
Subsystem Id: 0x10280242
Revision Id: 0x100000
No Modem Function Group found
Default PCM:
    rates [0x0]:
    bits [0x0]:
    formats [0x0]:
Default Amp-In caps: N/A
Default Amp-Out caps: N/A
GPIO: io=0, o=0, i=0, unsolicited=0, wake=0
Node 0x02 [Audio Output] wcaps 0x6211: 8-Channels Digital
  Converter: stream=0, channel=0
  Digital: Enabled GenLevel
  Digital category: 0x2
  PCM:
    rates [0x7f0]: 32000 44100 48000 88200 96000 176400 192000
    bits [0x1e]: 16 20 24 32
    formats [0x5]: PCM AC3
Node 0x03 [Pin Complex] wcaps 0x40738d: 8-Channels Digital Amp-Out CP
  Control: name="HDMI/DP,pcm=3 Jack", index=0, device=0
  Control: name="IEC958 Playback Con Mask", index=0, device=0
  Control: name="IEC958 Playback Pro Mask", index=0, device=0
  Control: name="IEC958 Playback Default", index=0, device=0
  Control: name="IEC958 Playback Switch", index=0, device=0
  Control: name="ELD", index=0, device=3
  Amp-Out caps: ofs=0x00, nsteps=0x00, stepsize=0x00, mute=1
  Amp-Out vals:  [0x00 0x00]
  Pincap 0x00000094: OUT Detect HDMI
  Pin Default 0x18560010: [Jack] Digital Out at Int HDMI
    Conn = Digital, Color = Unknown
    DefAssociation = 0x1, Sequence = 0x0
  Pin-ctls: 0x00:
  Unsolicited: tag=01, enabled=1
  Connection: 1
     0x02
Codec: SigmaTel STAC9228
Address: 2
AFG Function Id: 0x1 (unsol 1)
Vendor Id: 0x83847616
Subsystem Id: 0x10280242
Revision Id: 0x100201
No Modem Function Group found
Default PCM:
    rates [0x7e0]: 44100 48000 88200 96000 176400 192000
    bits [0xe]: 16 20 24
    formats [0x1]: PCM
Default Amp-In caps: ofs=0x00, nsteps=0x0e, stepsize=0x05, mute=0
Default Amp-Out caps: ofs=0x7f, nsteps=0x7f, stepsize=0x02, mute=1
GPIO: io=3, o=0, i=0, unsolicited=1, wake=1
  IO[0]: enable=0, dir=0, wake=0, sticky=0, data=0, unsol=0
  IO[1]: enable=0, dir=0, wake=0, sticky=0, data=0, unsol=0
  IO[2]: enable=1, dir=1, wake=0, sticky=0, data=1, unsol=0
Analog Loopback: 0x00
Node 0x02 [Audio Output] wcaps 0xd0c05: Stereo Amp-Out R/L
  Control: name="Headphone Playback Volume", index=0, device=0
    ControlAmp: chs=3, dir=Out, idx=0, ofs=63
  Control: name="Headphone Playback Switch", index=0, device=0
    ControlAmp: chs=3, dir=Out, idx=0, ofs=0
  Device: name="STAC92xx Analog", type="Audio", device=0
  Amp-Out caps: N/A
  Amp-Out vals:  [0x64 0x64]
  Converter: stream=8, channel=0
  Power: setting=D0, actual=D0
  Delay: 13 samples
Node 0x03 [Audio Output] wcaps 0xd0c05: Stereo Amp-Out R/L
  Amp-Out caps: N/A
  Amp-Out vals:  [0xff 0xff]
  Converter: stream=0, channel=0
  Power: setting=D3, actual=D3
  Delay: 13 samples
Node 0x04 [Audio Output] wcaps 0xd0c05: Stereo Amp-Out R/L
  Amp-Out caps: N/A
  Amp-Out vals:  [0xff 0xff]
  Converter: stream=0, channel=0
  Power: setting=D3, actual=D3
  Delay: 13 samples
Node 0x05 [Audio Output] wcaps 0xd0c05: Stereo Amp-Out R/L
  Control: name="Headphone Playback Volume", index=1, device=0
    ControlAmp: chs=3, dir=Out, idx=0, ofs=63
  Control: name="Headphone Playback Switch", index=1, device=0
    ControlAmp: chs=3, dir=Out, idx=0, ofs=0
  Amp-Out caps: N/A
  Amp-Out vals:  [0x64 0x64]
  Converter: stream=8, channel=0
  Power: setting=D0, actual=D0
  Delay: 13 samples
Node 0x06 [Vendor Defined Widget] wcaps 0xfd0c05: Stereo Amp-Out R/L
  Amp-Out caps: N/A
  Amp-Out vals:  [0xff 0xff]
  Power: setting=D3, actual=D3
  Delay: 13 samples
Node 0x07 [Audio Input] wcaps 0x1d0541: Stereo
  Device: name="STAC92xx Analog", type="Audio", device=0
  Converter: stream=4, channel=0
  SDI-Select: 0
  Power: setting=D0, actual=D0
  Delay: 13 samples
  Connection: 1
     0x1b
  Processing caps: benign=0, ncoeff=0
Node 0x08 [Audio Input] wcaps 0x1d0541: Stereo
  Converter: stream=0, channel=0
  SDI-Select: 0
  Power: setting=D0, actual=D0
  Delay: 13 samples
  Connection: 1
     0x1c
  Processing caps: benign=0, ncoeff=0
Node 0x09 [Audio Input] wcaps 0x1d0541: Stereo
  Converter: stream=0, channel=0
  SDI-Select: 0
  Power: setting=D0, actual=D0
  Delay: 13 samples
  Connection: 1
     0x1d
  Processing caps: benign=0, ncoeff=0
Node 0x0a [Pin Complex] wcaps 0x400181: Stereo
  Pincap 0x0000173f: IN OUT HP Detect Trigger ImpSense
    Vref caps: HIZ 50 GRD 80
  Pin Default 0x0221101f: [Jack] HP Out at Ext Front
    Conn = 1/8, Color = Black
    DefAssociation = 0x1, Sequence = 0xf
  Pin-ctls: 0xc0: OUT HP VREF_HIZ
  Unsolicited: tag=01, enabled=1
  Connection: 2
     0x02* 0x03
Node 0x0b [Pin Complex] wcaps 0x400181: Stereo
  Pincap 0x0000173f: IN OUT HP Detect Trigger ImpSense
    Vref caps: HIZ 50 GRD 80
  Pin Default 0x40f000f1: [N/A] Other at Ext N/A
    Conn = Unknown, Color = Unknown
    DefAssociation = 0xf, Sequence = 0x1
  Pin-ctls: 0x00: VREF_HIZ
  Unsolicited: tag=00, enabled=0
  Connection: 2
     0x02 0x03*
Node 0x0c [Pin Complex] wcaps 0x400181: Stereo
  Pincap 0x00001737: IN OUT Detect Trigger ImpSense
    Vref caps: HIZ 50 GRD 80
  Pin Default 0x90a79130: [Fixed] Mic at Int N/A
    Conn = Analog, Color = Pink
    DefAssociation = 0x3, Sequence = 0x0
    Misc = NO_PRESENCE
  Pin-ctls: 0x24: IN VREF_80
  Unsolicited: tag=00, enabled=0
  Connection: 1
     0x03
Node 0x0d [Pin Complex] wcaps 0x400181: Stereo
  Pincap 0x0000173f: IN OUT HP Detect Trigger ImpSense
    Vref caps: HIZ 50 GRD 80
  Pin Default 0x90170110: [Fixed] Speaker at Int N/A
    Conn = Analog, Color = Unknown
    DefAssociation = 0x1, Sequence = 0x0
    Misc = NO_PRESENCE
  Pin-ctls: 0x40: OUT VREF_HIZ
  Unsolicited: tag=00, enabled=0
  Connection: 1
     0x02
Node 0x0e [Pin Complex] wcaps 0x400181: Stereo
  Control: name="Mic Jack Mode", index=0, device=0
    ControlAmp: chs=0, dir=In, idx=0, ofs=0
  Pincap 0x00001737: IN OUT Detect Trigger ImpSense
    Vref caps: HIZ 50 GRD 80
  Pin Default 0x02a79130: [Jack] Mic at Ext Front
    Conn = Analog, Color = Pink
    DefAssociation = 0x3, Sequence = 0x0
    Misc = NO_PRESENCE
  Pin-ctls: 0x24: IN VREF_80
  Unsolicited: tag=00, enabled=0
  Connection: 1
     0x04
Node 0x0f [Pin Complex] wcaps 0x400181: Stereo
  Pincap 0x00001737: IN OUT Detect Trigger ImpSense
    Vref caps: HIZ 50 GRD 80
  Pin Default 0x0227011f: [Jack] HP Out at Ext Front
    Conn = Analog, Color = Unknown
    DefAssociation = 0x1, Sequence = 0xf
    Misc = NO_PRESENCE
  Pin-ctls: 0x40: OUT VREF_HIZ
  Unsolicited: tag=00, enabled=0
  Connection: 1
     0x05
Node 0x10 [Pin Complex] wcaps 0x400181: Stereo
  Pincap 0x00000037: IN OUT Detect Trigger ImpSense
  Pin Default 0x40f000f2: [N/A] Other at Ext N/A
    Conn = Unknown, Color = Unknown
    DefAssociation = 0xf, Sequence = 0x2
  Pin-ctls: 0x00:
  Unsolicited: tag=00, enabled=0
  Connection: 1
     0x04
Node 0x11 [Pin Complex] wcaps 0x400181: Stereo
  Pincap 0x00000037: IN OUT Detect Trigger ImpSense
  Pin Default 0x40f000f3: [N/A] Other at Ext N/A
    Conn = Unknown, Color = Unknown
    DefAssociation = 0xf, Sequence = 0x3
  Pin-ctls: 0x00:
  Unsolicited: tag=00, enabled=0
  Connection: 1
     0x03
Node 0x12 [Pin Complex] wcaps 0x400001: Stereo
  Pincap 0x00000020: IN
  Pin Default 0x40f000f4: [N/A] Other at Ext N/A
    Conn = Unknown, Color = Unknown
    DefAssociation = 0xf, Sequence = 0x4
  Pin-ctls: 0x00:
Node 0x13 [Pin Complex] wcaps 0x400001: Stereo
  Pincap 0x00000020: IN
  Pin Default 0x90a6012e: [Fixed] Mic at Int N/A
    Conn = Digital, Color = Unknown
    DefAssociation = 0x2, Sequence = 0xe
    Misc = NO_PRESENCE
  Pin-ctls: 0x20: IN
Node 0x14 [Pin Complex] wcaps 0x400001: Stereo
  Pincap 0x00000020: IN
  Pin Default 0x40f000f5: [N/A] Other at Ext N/A
    Conn = Unknown, Color = Unknown
    DefAssociation = 0xf, Sequence = 0x5
  Pin-ctls: 0x20: IN
Node 0x15 [Audio Selector] wcaps 0x30010d: Stereo Amp-Out
  Control: name="Mux Capture Volume", index=0, device=0
    ControlAmp: chs=3, dir=Out, idx=0, ofs=0
  Amp-Out caps: ofs=0x00, nsteps=0x04, stepsize=0x27, mute=0
  Amp-Out vals:  [0x00 0x00]
  Connection: 9
     0x0e 0x12 0x0f 0x0b 0x0c* 0x0d 0x0a 0x10 0x11
Node 0x16 [Audio Selector] wcaps 0x30010d: Stereo Amp-Out
  Control: name="Mux Capture Volume", index=1, device=0
    ControlAmp: chs=3, dir=Out, idx=0, ofs=0
  Amp-Out caps: ofs=0x00, nsteps=0x04, stepsize=0x27, mute=0
  Amp-Out vals:  [0x00 0x00]
  Connection: 9
     0x0e 0x12 0x0f 0x0b 0x0c* 0x0d 0x0a 0x10 0x11
Node 0x17 [Audio Selector] wcaps 0x30010d: Stereo Amp-Out
  Control: name="Mux Capture Volume", index=2, device=0
    ControlAmp: chs=3, dir=Out, idx=0, ofs=0
  Amp-Out caps: ofs=0x00, nsteps=0x04, stepsize=0x27, mute=0
  Amp-Out vals:  [0x00 0x00]
  Connection: 9
     0x0e 0x12 0x0f 0x0b 0x0c* 0x0d 0x0a 0x10 0x11
Node 0x18 [Audio Selector] wcaps 0x300103: Stereo Amp-In
  Control: name="Capture Volume", index=0, device=0
    ControlAmp: chs=3, dir=In, idx=0, ofs=0
  Amp-In caps: N/A
  Amp-In vals:  [0x08 0x08]
  Connection: 1
     0x15
Node 0x19 [Audio Selector] wcaps 0x300103: Stereo Amp-In
  Control: name="Capture Volume", index=1, device=0
    ControlAmp: chs=3, dir=In, idx=0, ofs=0
  Amp-In caps: N/A
  Amp-In vals:  [0x00 0x00]
  Connection: 1
     0x16
Node 0x1a [Audio Selector] wcaps 0x300103: Stereo Amp-In
  Control: name="Capture Volume", index=2, device=0
    ControlAmp: chs=3, dir=In, idx=0, ofs=0
  Amp-In caps: N/A
  Amp-In vals:  [0x00 0x00]
  Connection: 1
     0x17
Node 0x1b [Audio Selector] wcaps 0x30090d: Stereo Amp-Out R/L
  Control: name="Capture Switch", index=0, device=0
    ControlAmp: chs=3, dir=Out, idx=0, ofs=0
  Amp-Out caps: ofs=0x00, nsteps=0x00, stepsize=0x00, mute=1
  Amp-Out vals:  [0x00 0x00]
  Connection: 3
     0x18 0x13* 0x14
Node 0x1c [Audio Selector] wcaps 0x30090d: Stereo Amp-Out R/L
  Control: name="Capture Switch", index=1, device=0
    ControlAmp: chs=3, dir=Out, idx=0, ofs=0
  Amp-Out caps: ofs=0x00, nsteps=0x00, stepsize=0x00, mute=1
  Amp-Out vals:  [0x80 0x80]
  Connection: 3
     0x19* 0x13 0x14
Node 0x1d [Audio Selector] wcaps 0x30090d: Stereo Amp-Out R/L
  Control: name="Capture Switch", index=2, device=0
    ControlAmp: chs=3, dir=Out, idx=0, ofs=0
  Amp-Out caps: ofs=0x00, nsteps=0x00, stepsize=0x00, mute=1
  Amp-Out vals:  [0x80 0x80]
  Connection: 3
     0x1a* 0x13 0x14
Node 0x1e [Audio Output] wcaps 0x40211: Stereo Digital
  Control: name="IEC958 Playback Con Mask", index=1, device=0
  Control: name="IEC958 Playback Pro Mask", index=1, device=0
  Control: name="IEC958 Playback Default", index=1, device=0
  Control: name="IEC958 Playback Switch", index=1, device=0
  Control: name="IEC958 Default PCM Playback Switch", index=0, device=0
  Device: name="STAC92xx Digital", type="HDMI", device=7
  Converter: stream=8, channel=0
  Digital: Enabled
  Digital category: 0x0
  PCM:
    rates [0x7e0]: 44100 48000 88200 96000 176400 192000
    bits [0xe]: 16 20 24
    formats [0x5]: PCM AC3
  Delay: 4 samples
Node 0x1f [Vendor Defined Widget] wcaps 0xf30201: Stereo Digital
  Delay: 3 samples
Node 0x20 [Audio Input] wcaps 0x140311: Stereo Digital
  Converter: stream=0, channel=0
  SDI-Select: 0
  Digital:
  Digital category: 0x0
  PCM:
    rates [0x160]: 44100 48000 96000
    bits [0xe]: 16 20 24
    formats [0x5]: PCM AC3
  Delay: 4 samples
  Connection: 1
     0x22
Node 0x21 [Pin Complex] wcaps 0x400301: Stereo Digital
  Pincap 0x00000010: OUT
  Pin Default 0x985610a0: [Fixed] Digital Out at Int HDMI
    Conn = Digital, Color = Black
    DefAssociation = 0xa, Sequence = 0x0
  Pin-ctls: 0x40: OUT
  Connection: 5
     0x1e* 0x1f 0x1b 0x1c 0x1d
Node 0x22 [Pin Complex] wcaps 0x430681: Stereo Digital
  Pincap 0x00010024: IN EAPD Detect
  EAPD 0x0:
  Pin Default 0x40f000f6: [N/A] Other at Ext N/A
    Conn = Unknown, Color = Unknown
    DefAssociation = 0xf, Sequence = 0x6
  Pin-ctls: 0x00:
  Unsolicited: tag=00, enabled=0
  Power: setting=D0, actual=D0
  Delay: 3 samples
Node 0x23 [Beep Generator Widget] wcaps 0x70000c: Mono Amp-Out
  Control: name="Beep Playback Volume", index=0, device=0
    ControlAmp: chs=1, dir=Out, idx=0, ofs=0
  Amp-Out caps: ofs=0x03, nsteps=0x03, stepsize=0x17, mute=0
  Amp-Out vals:  [0x00]
Node 0x24 [Volume Knob Widget] wcaps 0x600000: Mono
  Volume-Knob: delta=1, steps=127, direct=0, val=127
  Connection: 4
     0x02 0x03 0x04 0x05
--endcollapse--


!!ALSA Device nodes
!!-----------------

crw-rw---T+ 1 root audio 116,  9 Jun  4 18:09 /dev/snd/controlC0
crw-rw---T+ 1 root audio 116,  8 Jun  4 18:09 /dev/snd/hwC0D0
crw-rw---T+ 1 root audio 116,  7 Jun  4 18:09 /dev/snd/hwC0D1
crw-rw---T+ 1 root audio 116,  6 Jun  4 18:09 /dev/snd/hwC0D2
crw-rw---T+ 1 root audio 116,  4 Jun  4 18:09 /dev/snd/pcmC0D0c
crw-rw---T+ 1 root audio 116,  3 Jun  4 18:09 /dev/snd/pcmC0D0p
crw-rw---T+ 1 root audio 116,  5 Jun  4 18:09 /dev/snd/pcmC0D3p
crw-rw---T+ 1 root audio 116,  2 Jun  4 18:09 /dev/snd/pcmC0D7p
crw-rw---T+ 1 root audio 116,  1 Jun  4 18:09 /dev/snd/seq
crw-rw---T+ 1 root audio 116, 33 Jun  4 18:09 /dev/snd/timer

/dev/snd/by-path:
total 0
drwxr-xr-x 2 root root  60 Jun  4 18:09 .
drwxr-xr-x 3 root root 260 Jun  4 18:09 ..
lrwxrwxrwx 1 root root  12 Jun  4 18:09 pci-0000:00:1b.0 -> ../controlC0


!!Aplay/Arecord output
!!------------

APLAY

**** List of PLAYBACK Hardware Devices ****
card 0: Intel [HDA Intel], device 0: STAC92xx Analog [STAC92xx Analog]
  Subdevices: 1/1
  Subdevice #0: subdevice #0
card 0: Intel [HDA Intel], device 3: HDMI 0 [HDMI 0]
  Subdevices: 1/1
  Subdevice #0: subdevice #0
card 0: Intel [HDA Intel], device 7: STAC92xx Digital [STAC92xx Digital]
  Subdevices: 1/1
  Subdevice #0: subdevice #0

ARECORD

**** List of CAPTURE Hardware Devices ****
card 0: Intel [HDA Intel], device 0: STAC92xx Analog [STAC92xx Analog]
  Subdevices: 3/3
  Subdevice #0: subdevice #0
  Subdevice #1: subdevice #1
  Subdevice #2: subdevice #2

!!Amixer output
!!-------------

!!-------Mixer controls for card 0 [Intel]

Card hw:0 'Intel'/'HDA Intel at 0xfe9fc000 irq 46'
  Mixer name	: 'SigmaTel STAC9228'
  Components	: 'HDA:14f12c06,14f1000f,00100000 HDA:10951392,10280242,00100000 HDA:83847616,10280242,00100201'
  Controls      : 33
  Simple ctrls  : 19
Simple mixer control 'Master',0
  Capabilities: pvolume pvolume-joined pswitch pswitch-joined penum
  Playback channels: Mono
  Limits: Playback 0 - 64
  Mono: Playback 37 [58%] [-20.25dB] [on]
Simple mixer control 'Headphone',0
  Capabilities: pvolume pswitch penum
  Playback channels: Front Left - Front Right
  Limits: Playback 0 - 64
  Mono:
  Front Left: Playback 64 [100%] [0.00dB] [on]
  Front Right: Playback 64 [100%] [0.00dB] [on]
Simple mixer control 'Headphone',1
  Capabilities: pvolume pswitch penum
  Playback channels: Front Left - Front Right
  Limits: Playback 0 - 64
  Mono:
  Front Left: Playback 64 [100%] [0.00dB] [on]
  Front Right: Playback 64 [100%] [0.00dB] [on]
Simple mixer control 'PCM',0
  Capabilities: pvolume penum
  Playback channels: Front Left - Front Right
  Limits: Playback 0 - 255
  Mono:
  Front Left: Playback 255 [100%] [0.00dB]
  Front Right: Playback 255 [100%] [0.00dB]
Simple mixer control 'Mic Jack Mode',0
  Capabilities: enum
  Items: 'Mic In' 'Line In'
  Item0: 'Mic In'
Simple mixer control 'IEC958',0
  Capabilities: pswitch pswitch-joined penum
  Playback channels: Mono
  Mono: Playback [on]
Simple mixer control 'IEC958 Default PCM',0
  Capabilities: pswitch pswitch-joined penum
  Playback channels: Mono
  Mono: Playback [on]
Simple mixer control 'IEC958 Playback Source',0
  Capabilities: enum
  Items: 'Digital Playback' 'ADAT' 'Analog Mux 1' 'Analog Mux 2' 'Analog Mux 3'
  Item0: 'Digital Playback'
Simple mixer control 'IEC958',1
  Capabilities: pswitch pswitch-joined penum
  Playback channels: Mono
  Mono: Playback [on]
Simple mixer control 'Beep',0
  Capabilities: pvolume pvolume-joined penum
  Playback channels: Mono
  Limits: Playback 0 - 3
  Mono: Playback 0 [0%] [-18.00dB]
Simple mixer control 'Capture',0
  Capabilities: cvolume cswitch penum
  Capture channels: Front Left - Front Right
  Limits: Capture 0 - 14
  Front Left: Capture 8 [57%] [12.00dB] [on]
  Front Right: Capture 8 [57%] [12.00dB] [on]
Simple mixer control 'Capture',1
  Capabilities: cvolume cswitch penum
  Capture channels: Front Left - Front Right
  Limits: Capture 0 - 14
  Front Left: Capture 0 [0%] [0.00dB] [off]
  Front Right: Capture 0 [0%] [0.00dB] [off]
Simple mixer control 'Capture',2
  Capabilities: cvolume cswitch penum
  Capture channels: Front Left - Front Right
  Limits: Capture 0 - 14
  Front Left: Capture 0 [0%] [0.00dB] [off]
  Front Right: Capture 0 [0%] [0.00dB] [off]
Simple mixer control 'Input Source',0
  Capabilities: cenum
  Items: 'Internal Mic' 'Mic' 'Internal Mic 1'
  Item0: 'Internal Mic 1'
Simple mixer control 'Input Source',1
  Capabilities: cenum
  Items: 'Internal Mic' 'Mic' 'Internal Mic 1'
  Item0: 'Internal Mic'
Simple mixer control 'Input Source',2
  Capabilities: cenum
  Items: 'Internal Mic' 'Mic' 'Internal Mic 1'
  Item0: 'Internal Mic'
Simple mixer control 'Mux',0
  Capabilities: cvolume penum
  Capture channels: Front Left - Front Right
  Limits: Capture 0 - 4
  Front Left: Capture 0 [0%] [0.00dB]
  Front Right: Capture 0 [0%] [0.00dB]
Simple mixer control 'Mux',1
  Capabilities: cvolume penum
  Capture channels: Front Left - Front Right
  Limits: Capture 0 - 4
  Front Left: Capture 0 [0%] [0.00dB]
  Front Right: Capture 0 [0%] [0.00dB]
Simple mixer control 'Mux',2
  Capabilities: cvolume penum
  Capture channels: Front Left - Front Right
  Limits: Capture 0 - 4
  Front Left: Capture 0 [0%] [0.00dB]
  Front Right: Capture 0 [0%] [0.00dB]


!!Alsactl output
!!-------------

--startcollapse--
state.Intel {
	control.1 {
		iface CARD
		name 'HDMI/DP,pcm=3 Jack'
		value false
		comment {
			access read
			type BOOLEAN
			count 1
		}
	}
	control.2 {
		iface MIXER
		name 'IEC958 Playback Con Mask'
		value '0fff000000000000000000000000000000000000000000000000000000000000000000000000000000000000000000000000000000000000000000000000000000000000000000000000000000000000000000000000000000000000000000000000000000000000000000000000000000000000000000000000000000000000000000000000000000000000000000000000000000000000000000000000000000000000000000000000000000000000'
		comment {
			access read
			type IEC958
			count 1
		}
	}
	control.3 {
		iface MIXER
		name 'IEC958 Playback Pro Mask'
		value '0f00000000000000000000000000000000000000000000000000000000000000000000000000000000000000000000000000000000000000000000000000000000000000000000000000000000000000000000000000000000000000000000000000000000000000000000000000000000000000000000000000000000000000000000000000000000000000000000000000000000000000000000000000000000000000000000000000000000000000'
		comment {
			access read
			type IEC958
			count 1
		}
	}
	control.4 {
		iface MIXER
		name 'IEC958 Playback Default'
		value '0400000000000000000000000000000000000000000000000000000000000000000000000000000000000000000000000000000000000000000000000000000000000000000000000000000000000000000000000000000000000000000000000000000000000000000000000000000000000000000000000000000000000000000000000000000000000000000000000000000000000000000000000000000000000000000000000000000000000000'
		comment {
			access 'read write'
			type IEC958
			count 1
		}
	}
	control.5 {
		iface MIXER
		name 'IEC958 Playback Switch'
		value true
		comment {
			access 'read write'
			type BOOLEAN
			count 1
		}
	}
	control.6 {
		iface PCM
		device 3
		name ELD
		value ''
		comment {
			access read
			type BYTES
			count 0
		}
	}
	control.7 {
		iface MIXER
		name 'Headphone Playback Volume'
		value.0 64
		value.1 64
		comment {
			access 'read write'
			type INTEGER
			count 2
			range '0 - 64'
			dbmin -4800
			dbmax 0
			dbvalue.0 0
			dbvalue.1 0
		}
	}
	control.8 {
		iface MIXER
		name 'Headphone Playback Switch'
		value.0 true
		value.1 true
		comment {
			access 'read write'
			type BOOLEAN
			count 2
		}
	}
	control.9 {
		iface MIXER
		name 'Headphone Playback Volume'
		index 1
		value.0 64
		value.1 64
		comment {
			access 'read write'
			type INTEGER
			count 2
			range '0 - 64'
			dbmin -4800
			dbmax 0
			dbvalue.0 0
			dbvalue.1 0
		}
	}
	control.10 {
		iface MIXER
		name 'Headphone Playback Switch'
		index 1
		value.0 true
		value.1 true
		comment {
			access 'read write'
			type BOOLEAN
			count 2
		}
	}
	control.11 {
		iface MIXER
		name 'Mic Jack Mode'
		value 'Mic In'
		comment {
			access 'read write'
			type ENUMERATED
			count 1
			item.0 'Mic In'
			item.1 'Line In'
		}
	}
	control.12 {
		iface MIXER
		name 'Beep Playback Volume'
		value 0
		comment {
			access 'read write'
			type INTEGER
			count 1
			range '0 - 3'
			dbmin -1800
			dbmax 0
			dbvalue.0 -1800
		}
	}
	control.13 {
		iface MIXER
		name 'Capture Volume'
		value.0 8
		value.1 8
		comment {
			access 'read write'
			type INTEGER
			count 2
			range '0 - 14'
			dbmin 0
			dbmax 2100
			dbvalue.0 1200
			dbvalue.1 1200
		}
	}
	control.14 {
		iface MIXER
		name 'Capture Switch'
		value.0 true
		value.1 true
		comment {
			access 'read write'
			type BOOLEAN
			count 2
		}
	}
	control.15 {
		iface MIXER
		name 'Capture Volume'
		index 1
		value.0 0
		value.1 0
		comment {
			access 'read write'
			type INTEGER
			count 2
			range '0 - 14'
			dbmin 0
			dbmax 2100
			dbvalue.0 0
			dbvalue.1 0
		}
	}
	control.16 {
		iface MIXER
		name 'Capture Switch'
		index 1
		value.0 false
		value.1 false
		comment {
			access 'read write'
			type BOOLEAN
			count 2
		}
	}
	control.17 {
		iface MIXER
		name 'Capture Volume'
		index 2
		value.0 0
		value.1 0
		comment {
			access 'read write'
			type INTEGER
			count 2
			range '0 - 14'
			dbmin 0
			dbmax 2100
			dbvalue.0 0
			dbvalue.1 0
		}
	}
	control.18 {
		iface MIXER
		name 'Capture Switch'
		index 2
		value.0 false
		value.1 false
		comment {
			access 'read write'
			type BOOLEAN
			count 2
		}
	}
	control.19 {
		iface MIXER
		name 'Mux Capture Volume'
		value.0 0
		value.1 0
		comment {
			access 'read write'
			type INTEGER
			count 2
			range '0 - 4'
			dbmin 0
			dbmax 4000
			dbvalue.0 0
			dbvalue.1 0
		}
	}
	control.20 {
		iface MIXER
		name 'Mux Capture Volume'
		index 1
		value.0 0
		value.1 0
		comment {
			access 'read write'
			type INTEGER
			count 2
			range '0 - 4'
			dbmin 0
			dbmax 4000
			dbvalue.0 0
			dbvalue.1 0
		}
	}
	control.21 {
		iface MIXER
		name 'Mux Capture Volume'
		index 2
		value.0 0
		value.1 0
		comment {
			access 'read write'
			type INTEGER
			count 2
			range '0 - 4'
			dbmin 0
			dbmax 4000
			dbvalue.0 0
			dbvalue.1 0
		}
	}
	control.22 {
		iface MIXER
		name 'Input Source'
		value 'Internal Mic 1'
		comment {
			access 'read write'
			type ENUMERATED
			count 1
			item.0 'Internal Mic'
			item.1 Mic
			item.2 'Internal Mic 1'
		}
	}
	control.23 {
		iface MIXER
		name 'Input Source'
		index 1
		value 'Internal Mic'
		comment {
			access 'read write'
			type ENUMERATED
			count 1
			item.0 'Internal Mic'
			item.1 Mic
			item.2 'Internal Mic 1'
		}
	}
	control.24 {
		iface MIXER
		name 'Input Source'
		index 2
		value 'Internal Mic'
		comment {
			access 'read write'
			type ENUMERATED
			count 1
			item.0 'Internal Mic'
			item.1 Mic
			item.2 'Internal Mic 1'
		}
	}
	control.25 {
		iface MIXER
		name 'IEC958 Playback Source'
		value 'Digital Playback'
		comment {
			access 'read write'
			type ENUMERATED
			count 1
			item.0 'Digital Playback'
			item.1 ADAT
			item.2 'Analog Mux 1'
			item.3 'Analog Mux 2'
			item.4 'Analog Mux 3'
		}
	}
	control.26 {
		iface MIXER
		name 'IEC958 Playback Con Mask'
		index 1
		value '0fff000000000000000000000000000000000000000000000000000000000000000000000000000000000000000000000000000000000000000000000000000000000000000000000000000000000000000000000000000000000000000000000000000000000000000000000000000000000000000000000000000000000000000000000000000000000000000000000000000000000000000000000000000000000000000000000000000000000000'
		comment {
			access read
			type IEC958
			count 1
		}
	}
	control.27 {
		iface MIXER
		name 'IEC958 Playback Pro Mask'
		index 1
		value '0f00000000000000000000000000000000000000000000000000000000000000000000000000000000000000000000000000000000000000000000000000000000000000000000000000000000000000000000000000000000000000000000000000000000000000000000000000000000000000000000000000000000000000000000000000000000000000000000000000000000000000000000000000000000000000000000000000000000000000'
		comment {
			access read
			type IEC958
			count 1
		}
	}
	control.28 {
		iface MIXER
		name 'IEC958 Playback Default'
		index 1
		value '0400000000000000000000000000000000000000000000000000000000000000000000000000000000000000000000000000000000000000000000000000000000000000000000000000000000000000000000000000000000000000000000000000000000000000000000000000000000000000000000000000000000000000000000000000000000000000000000000000000000000000000000000000000000000000000000000000000000000000'
		comment {
			access 'read write'
			type IEC958
			count 1
		}
	}
	control.29 {
		iface MIXER
		name 'IEC958 Playback Switch'
		index 1
		value true
		comment {
			access 'read write'
			type BOOLEAN
			count 1
		}
	}
	control.30 {
		iface MIXER
		name 'IEC958 Default PCM Playback Switch'
		value true
		comment {
			access 'read write'
			type BOOLEAN
			count 1
		}
	}
	control.31 {
		iface MIXER
		name 'Master Playback Volume'
		value 37
		comment {
			access 'read write'
			type INTEGER
			count 1
			range '0 - 64'
			dbmin -9999999
			dbmax 0
			dbvalue.0 -2025
		}
	}
	control.32 {
		iface MIXER
		name 'Master Playback Switch'
		value true
		comment {
			access 'read write'
			type BOOLEAN
			count 1
		}
	}
	control.33 {
		iface MIXER
		name 'PCM Playback Volume'
		value.0 255
		value.1 255
		comment {
			access 'read write user'
			type INTEGER
			count 2
			range '0 - 255'
			tlv '0000000100000008ffffec1400000014'
			dbmin -5100
			dbmax 0
			dbvalue.0 0
			dbvalue.1 0
		}
	}
}
--endcollapse--


!!All Loaded Modules
!!------------------

Module
parport_pc
bnep
rfcomm
ppdev
snd_hda_codec_idt
snd_hda_codec_hdmi
snd_hda_intel
snd_hda_codec
arc4
snd_hwdep
snd_pcm
snd_seq_midi
iwl3945
iwlegacy
mac80211
snd_rawmidi
r852
sm_common
snd_seq_midi_event
snd_seq
nand
uvcvideo
videobuf2_core
videodev
snd_timer
snd_seq_device
nand_ids
videobuf2_vmalloc
snd
mtd
videobuf2_memops
i915
btusb
cfg80211
r592
nand_bch
memstick
bch
nand_ecc
usbhid
hid
drm_kms_helper
bluetooth
soundcore
dell_laptop
dell_wmi
joydev
drm
snd_page_alloc
sparse_keymap
dcdbas
i2c_algo_bit
video
coretemp
wmi
mac_hid
psmouse
serio_raw
microcode
lp
parport
sdhci_pci
sdhci
firewire_ohci
firewire_core
crc_itu_t
sky2


!!Sysfs Files
!!-----------

/sys/class/sound/hwC0D0/init_pin_configs:
0x73 0x016a10f0

/sys/class/sound/hwC0D0/driver_pin_configs:

/sys/class/sound/hwC0D0/user_pin_configs:

/sys/class/sound/hwC0D0/init_verbs:

/sys/class/sound/hwC0D1/init_pin_configs:
0x03 0x18560010

/sys/class/sound/hwC0D1/driver_pin_configs:

/sys/class/sound/hwC0D1/user_pin_configs:

/sys/class/sound/hwC0D1/init_verbs:

/sys/class/sound/hwC0D2/init_pin_configs:
0x0a 0x0221101f
0x0b 0x40f000f1
0x0c 0x40f000f7
0x0d 0x90170110
0x0e 0x02a11020
0x0f 0x02011030
0x10 0x40f000f2
0x11 0x40f000f3
0x12 0x40f000f4
0x13 0x90a6012e
0x14 0x40f000f5
0x21 0x985610a0
0x22 0x40f000f6

/sys/class/sound/hwC0D2/driver_pin_configs:
0x0c 0x90a79130
0x0f 0x0227011f
0x0e 0x02a79130

/sys/class/sound/hwC0D2/user_pin_configs:

/sys/class/sound/hwC0D2/init_verbs:


!!ALSA/HDA dmesg
!!------------------

[    9.891609] composite sync not supported
[   10.130161] snd_hda_intel 0000:00:1b.0: irq 46 for MSI/MSI-X
[   10.820200] input: HDA Intel HDMI/DP,pcm=3 as /devices/pci0000:00/0000:00:1b.0/sound/card0/input11
[   11.882938] sky2 0000:09:00.0: eth0: enabling interface


