upload=true&script=true&cardinfo=
!!################################
!!ALSA Information Script v 0.4.60
!!################################

!!Script ran on: Mon Sep 24 07:19:04 UTC 2012


!!Linux Distribution
!!------------------

Ubuntu 12.04.1 LTS \n \l DISTRIB_ID=Ubuntu DISTRIB_DESCRIPTION="Ubuntu 12.04.1 LTS"


!!DMI Information
!!---------------

Manufacturer:      ASUSTeK COMPUTER INC.
Product Name:      X55U
Product Version:   1.0       


!!Kernel Information
!!------------------

Kernel release:    3.2.0-29-generic
Operating System:  GNU/Linux
Architecture:      x86_64
Processor:         x86_64
SMP Enabled:       Yes


!!ALSA Version
!!------------

Driver version:     1.0.24
Library version:    1.0.25
Utilities version:  1.0.25


!!Loaded ALSA modules
!!-------------------

snd_hda_intel
snd_hda_intel


!!Sound Servers on this system
!!----------------------------

Pulseaudio:
      Installed - Yes (/usr/bin/pulseaudio)
      Running - Yes


!!Soundcards recognised by ALSA
!!-----------------------------

 0 [Generic        ]: HDA-Intel - HD-Audio Generic
                      HD-Audio Generic at 0xfeb44000 irq 47
 1 [Generic_1      ]: HDA-Intel - HD-Audio Generic
                      HD-Audio Generic at 0xfeb40000 irq 16


!!PCI Soundcards installed in the system
!!--------------------------------------

00:01.1 Audio device: Advanced Micro Devices [AMD] nee ATI Wrestler HDMI Audio [Radeon HD 6250/6310]
00:14.2 Audio device: Advanced Micro Devices [AMD] Hudson Azalia Controller (rev 01)


!!Advanced information - PCI Vendor/Device/Subsystem ID's
!!--------------------------------------------------------

00:01.1 0403: 1002:1314
	Subsystem: 1043:14e7
--
00:14.2 0403: 1022:780d (rev 01)
	Subsystem: 1043:1c23


!!Modprobe options (Sound related)
!!--------------------------------

snd-atiixp-modem: index=-2
snd-intel8x0m: index=-2
snd-via82xx-modem: index=-2
snd-usb-audio: index=-2
snd-usb-caiaq: index=-2
snd-usb-ua101: index=-2
snd-usb-us122l: index=-2
snd-usb-usx2y: index=-2
snd-cmipci: mpu_port=0x330 fm_port=0x388
snd-pcsp: index=-2
snd-usb-audio: index=-2


!!Loaded sound module options
!!--------------------------

!!Module: snd_hda_intel
	align_buffer_size : -1
	bdl_pos_adj : 32,32,-1,-1,-1,-1,-1,-1,-1,-1,-1,-1,-1,-1,-1,-1,-1,-1,-1,-1,-1,-1,-1,-1,-1,-1,-1,-1,-1,-1,-1,-1
	beep_mode : 0,0,0,0,0,0,0,0,0,0,0,0,0,0,0,0,0,0,0,0,0,0,0,0,0,0,0,0,0,0,0,0
	enable : Y,Y,Y,Y,Y,Y,Y,Y,Y,Y,Y,Y,Y,Y,Y,Y,Y,Y,Y,Y,Y,Y,Y,Y,Y,Y,Y,Y,Y,Y,Y,Y
	enable_msi : -1
	id : (null),(null),(null),(null),(null),(null),(null),(null),(null),(null),(null),(null),(null),(null),(null),(null),(null),(null),(null),(null),(null),(null),(null),(null),(null),(null),(null),(null),(null),(null),(null),(null)
	index : -1,-1,-1,-1,-1,-1,-1,-1,-1,-1,-1,-1,-1,-1,-1,-1,-1,-1,-1,-1,-1,-1,-1,-1,-1,-1,-1,-1,-1,-1,-1,-1
	model : (null),(null),(null),(null),(null),(null),(null),(null),(null),(null),(null),(null),(null),(null),(null),(null),(null),(null),(null),(null),(null),(null),(null),(null),(null),(null),(null),(null),(null),(null),(null),(null)
	patch : (null),(null),(null),(null),(null),(null),(null),(null),(null),(null),(null),(null),(null),(null),(null),(null),(null),(null),(null),(null),(null),(null),(null),(null),(null),(null),(null),(null),(null),(null),(null),(null)
	position_fix : 0,0,0,0,0,0,0,0,0,0,0,0,0,0,0,0,0,0,0,0,0,0,0,0,0,0,0,0,0,0,0,0
	power_save : 0
	power_save_controller : Y
	probe_mask : -1,-1,-1,-1,-1,-1,-1,-1,-1,-1,-1,-1,-1,-1,-1,-1,-1,-1,-1,-1,-1,-1,-1,-1,-1,-1,-1,-1,-1,-1,-1,-1
	probe_only : 0,0,0,0,0,0,0,0,0,0,0,0,0,0,0,0,0,0,0,0,0,0,0,0,0,0,0,0,0,0,0,0
	single_cmd : N
	snoop : Y

!!Module: snd_hda_intel
	align_buffer_size : -1
	bdl_pos_adj : 32,32,-1,-1,-1,-1,-1,-1,-1,-1,-1,-1,-1,-1,-1,-1,-1,-1,-1,-1,-1,-1,-1,-1,-1,-1,-1,-1,-1,-1,-1,-1
	beep_mode : 0,0,0,0,0,0,0,0,0,0,0,0,0,0,0,0,0,0,0,0,0,0,0,0,0,0,0,0,0,0,0,0
	enable : Y,Y,Y,Y,Y,Y,Y,Y,Y,Y,Y,Y,Y,Y,Y,Y,Y,Y,Y,Y,Y,Y,Y,Y,Y,Y,Y,Y,Y,Y,Y,Y
	enable_msi : -1
	id : (null),(null),(null),(null),(null),(null),(null),(null),(null),(null),(null),(null),(null),(null),(null),(null),(null),(null),(null),(null),(null),(null),(null),(null),(null),(null),(null),(null),(null),(null),(null),(null)
	index : -1,-1,-1,-1,-1,-1,-1,-1,-1,-1,-1,-1,-1,-1,-1,-1,-1,-1,-1,-1,-1,-1,-1,-1,-1,-1,-1,-1,-1,-1,-1,-1
	model : (null),(null),(null),(null),(null),(null),(null),(null),(null),(null),(null),(null),(null),(null),(null),(null),(null),(null),(null),(null),(null),(null),(null),(null),(null),(null),(null),(null),(null),(null),(null),(null)
	patch : (null),(null),(null),(null),(null),(null),(null),(null),(null),(null),(null),(null),(null),(null),(null),(null),(null),(null),(null),(null),(null),(null),(null),(null),(null),(null),(null),(null),(null),(null),(null),(null)
	position_fix : 0,0,0,0,0,0,0,0,0,0,0,0,0,0,0,0,0,0,0,0,0,0,0,0,0,0,0,0,0,0,0,0
	power_save : 0
	power_save_controller : Y
	probe_mask : -1,-1,-1,-1,-1,-1,-1,-1,-1,-1,-1,-1,-1,-1,-1,-1,-1,-1,-1,-1,-1,-1,-1,-1,-1,-1,-1,-1,-1,-1,-1,-1
	probe_only : 0,0,0,0,0,0,0,0,0,0,0,0,0,0,0,0,0,0,0,0,0,0,0,0,0,0,0,0,0,0,0,0
	single_cmd : N
	snoop : Y


!!HDA-Intel Codec information
!!---------------------------
--startcollapse--

Codec: ATI R6xx HDMI
Address: 0
AFG Function Id: 0x1 (unsol 0)
Vendor Id: 0x1002aa01
Subsystem Id: 0x00aa0100
Revision Id: 0x100200
No Modem Function Group found
Default PCM:
    rates [0x70]: 32000 44100 48000
    bits [0x2]: 16
    formats [0x1]: PCM
Default Amp-In caps: N/A
Default Amp-Out caps: N/A
GPIO: io=0, o=0, i=0, unsolicited=0, wake=0
Node 0x02 [Audio Output] wcaps 0x201: Stereo Digital
  Converter: stream=1, channel=0
  Digital: Enabled GenLevel
  Digital category: 0x2
Node 0x03 [Pin Complex] wcaps 0x400381: Stereo Digital
  Control: name="HDMI/DP,pcm=3 Jack", index=0, device=0
  Control: name="IEC958 Playback Con Mask", index=0, device=0
  Control: name="IEC958 Playback Pro Mask", index=0, device=0
  Control: name="IEC958 Playback Default", index=0, device=0
  Control: name="IEC958 Playback Switch", index=0, device=0
  Control: name="ELD", index=0, device=3
  Pincap 0x00000094: OUT Detect HDMI
  Pin Default 0x18560010: [Jack] Digital Out at Int HDMI
    Conn = Digital, Color = Unknown
    DefAssociation = 0x1, Sequence = 0x0
  Pin-ctls: 0x00:
  Unsolicited: tag=01, enabled=1
  Connection: 1
     0x02
Codec: VIA VT1802
Address: 0
AFG Function Id: 0x1 (unsol 0)
Vendor Id: 0x11068446
Subsystem Id: 0x10431c23
Revision Id: 0x100000
No Modem Function Group found
Default PCM:
    rates [0x0]:
    bits [0x0]:
    formats [0x0]:
Default Amp-In caps: N/A
Default Amp-Out caps: N/A
GPIO: io=0, o=0, i=0, unsolicited=0, wake=0
Node 0x08 [Audio Output] wcaps 0x41d: Stereo Amp-Out
  Control: name="Speaker Playback Volume", index=0, device=0
    ControlAmp: chs=3, dir=Out, idx=0, ofs=0
  Device: name="VT1802 Analog", type="Audio", device=0
  Amp-Out caps: ofs=0x2a, nsteps=0x2a, stepsize=0x05, mute=0
  Amp-Out vals:  [0x1d 0x1d]
  Converter: stream=8, channel=0
  PCM:
    rates [0x5e0]: 44100 48000 88200 96000 192000
    bits [0xe]: 16 20 24
    formats [0x1]: PCM
  Power states:  D0 D1 D2 D3 EPSS
  Power: setting=D0, actual=D0
Node 0x09 [Audio Output] wcaps 0x41d: Stereo Amp-Out
  Control: name="Headphone Playback Volume", index=0, device=0
    ControlAmp: chs=3, dir=Out, idx=0, ofs=0
  Device: name="VT1802 HP", type="Audio", device=2
  Amp-Out caps: ofs=0x2a, nsteps=0x2a, stepsize=0x05, mute=0
  Amp-Out vals:  [0x1d 0x1d]
  Converter: stream=8, channel=0
  PCM:
    rates [0x5e0]: 44100 48000 88200 96000 192000
    bits [0xe]: 16 20 24
    formats [0x1]: PCM
  Power states:  D0 D1 D2 D3 EPSS
  Power: setting=D0, actual=D0
Node 0x0a [Vendor Defined Widget] wcaps 0xf00000: Mono
Node 0x0b [Vendor Defined Widget] wcaps 0xf00000: Mono
Node 0x0c [Vendor Defined Widget] wcaps 0xf00000: Mono
Node 0x0d [Vendor Defined Widget] wcaps 0xf00000: Mono
Node 0x0e [Audio Output] wcaps 0x611: Stereo Digital
  Converter: stream=0, channel=0
  Digital:
  Digital category: 0x0
  PCM:
    rates [0x5e0]: 44100 48000 88200 96000 192000
    bits [0xe]: 16 20 24
    formats [0x1]: PCM
  Power states:  D0 D1 D2 D3 EPSS
  Power: setting=D0, actual=D0
Node 0x0f [Vendor Defined Widget] wcaps 0xf00000: Mono
Node 0x10 [Audio Input] wcaps 0x10051b: Stereo Amp-In
  Control: name="Capture Volume", index=0, device=0
    ControlAmp: chs=3, dir=In, idx=0, ofs=0
  Control: name="Capture Switch", index=0, device=0
    ControlAmp: chs=3, dir=In, idx=0, ofs=0
  Device: name="VT1802 Analog", type="Audio", device=0
  Amp-In caps: ofs=0x0b, nsteps=0x1f, stepsize=0x05, mute=1
  Amp-In vals:  [0x13 0x13]
  Converter: stream=4, channel=0
  SDI-Select: 0
  PCM:
    rates [0x560]: 44100 48000 96000 192000
    bits [0xe]: 16 20 24
    formats [0x1]: PCM
  Power states:  D0 D1 D2 D3 EPSS
  Power: setting=D0, actual=D0
  Connection: 1
     0x1e
Node 0x11 [Audio Input] wcaps 0x10051b: Stereo Amp-In
  Control: name="Capture Volume", index=1, device=0
    ControlAmp: chs=3, dir=In, idx=0, ofs=0
  Control: name="Capture Switch", index=1, device=0
    ControlAmp: chs=3, dir=In, idx=0, ofs=0
  Amp-In caps: ofs=0x0b, nsteps=0x1f, stepsize=0x05, mute=1
  Amp-In vals:  [0x00 0x00]
  Converter: stream=0, channel=0
  SDI-Select: 0
  PCM:
    rates [0x560]: 44100 48000 96000 192000
    bits [0xe]: 16 20 24
    formats [0x1]: PCM
  Power states:  D0 D1 D2 D3 EPSS
  Power: setting=D0, actual=D0
  Connection: 1
     0x1f
Node 0x12 [Vendor Defined Widget] wcaps 0xf00000: Mono
Node 0x13 [Vendor Defined Widget] wcaps 0xf00000: Mono
Node 0x14 [Audio Mixer] wcaps 0x20050b: Stereo Amp-In
  Amp-In caps: ofs=0x00, nsteps=0x00, stepsize=0x00, mute=1
  Amp-In vals:  [0x00 0x00] [0x80 0x80]
  Power states:  D0 D1 D2 D3
  Power: setting=D0, actual=D0
  Connection: 2
     0x34 0x21
Node 0x15 [Audio Mixer] wcaps 0x20050b: Stereo Amp-In
  Amp-In caps: ofs=0x00, nsteps=0x00, stepsize=0x00, mute=1
  Amp-In vals:  [0x00 0x00] [0x80 0x80]
  Power states:  D0 D1 D2 D3
  Power: setting=D0, actual=D0
  Connection: 2
     0x35 0x21
Node 0x16 [Vendor Defined Widget] wcaps 0xf00000: Mono
Node 0x17 [Vendor Defined Widget] wcaps 0xf00000: Mono
Node 0x18 [Audio Mixer] wcaps 0x20050b: Stereo Amp-In
  Amp-In caps: ofs=0x00, nsteps=0x00, stepsize=0x00, mute=1
  Amp-In vals:  [0x80 0x80] [0x80 0x80]
  Power states:  D0 D1 D2 D3
  Power: setting=D3, actual=D3
  Connection: 2
     0x38 0x21
Node 0x19 [Vendor Defined Widget] wcaps 0xf00000: Mono
Node 0x1a [Vendor Defined Widget] wcaps 0xf00000: Mono
Node 0x1b [Vendor Defined Widget] wcaps 0xf00000: Mono
Node 0x1c [Audio Mixer] wcaps 0x20050b: Stereo Amp-In
  Amp-In caps: ofs=0x00, nsteps=0x00, stepsize=0x00, mute=1
  Amp-In vals:  [0x80 0x80] [0x80 0x80]
  Power states:  D0 D1 D2 D3
  Power: setting=D0, actual=D0
  Connection: 2
     0x3c 0x21
Node 0x1d [Vendor Defined Widget] wcaps 0xf00000: Mono
Node 0x1e [Audio Selector] wcaps 0x300501: Stereo
  Control: name="Input Source", index=0, device=0
  Power states:  D0 D1 D2 D3
  Power: setting=D0, actual=D0
  Connection: 5
     0x2b 0x2a 0x29* 0x21 0x30
Node 0x1f [Audio Selector] wcaps 0x300501: Stereo
  Control: name="Input Source", index=1, device=0
  Power states:  D0 D1 D2 D3
  Power: setting=D0, actual=D0
  Connection: 5
     0x2b* 0x2a 0x29 0x21 0x30
Node 0x20 [Vendor Defined Widget] wcaps 0xf00000: Mono
Node 0x21 [Audio Mixer] wcaps 0x20050b: Stereo Amp-In
  Control: name="PCM Loopback Playback Volume", index=0, device=0
    ControlAmp: chs=3, dir=In, idx=3, ofs=0
  Control: name="PCM Loopback Playback Switch", index=0, device=0
    ControlAmp: chs=3, dir=In, idx=3, ofs=0
  Control: name="Internal Mic Playback Volume", index=0, device=0
    ControlAmp: chs=3, dir=In, idx=2, ofs=0
  Control: name="Internal Mic Playback Switch", index=0, device=0
    ControlAmp: chs=3, dir=In, idx=2, ofs=0
  Control: name="Mic Playback Volume", index=0, device=0
    ControlAmp: chs=3, dir=In, idx=0, ofs=0
  Control: name="Mic Playback Switch", index=0, device=0
    ControlAmp: chs=3, dir=In, idx=0, ofs=0
  Amp-In caps: ofs=0x17, nsteps=0x1f, stepsize=0x05, mute=1
  Amp-In vals:  [0x80 0x80] [0x80 0x80] [0x80 0x80]
  Power states:  D0 D1 D2 D3
  Power: setting=D3, actual=D3
  Connection: 3
     0x2b 0x2a 0x29
Node 0x22 [Beep Generator Widget] wcaps 0x70040c: Mono Amp-Out
  Amp-Out caps: ofs=0x0a, nsteps=0x12, stepsize=0x05, mute=1
  Amp-Out vals:  [0x00]
  Power states:  D0 D1 D2 D3
  Power: setting=D0, actual=D0
Node 0x23 [Vendor Defined Widget] wcaps 0xf00000: Mono
Node 0x24 [Pin Complex] wcaps 0x40050d: Stereo Amp-Out
  Control: name="Speaker Playback Switch", index=0, device=0
    ControlAmp: chs=3, dir=Out, idx=0, ofs=0
  Control: name="Speaker Phantom Jack", index=0, device=0
  Amp-Out caps: ofs=0x00, nsteps=0x00, stepsize=0x00, mute=1
  Amp-Out vals:  [0x00 0x00]
  Pincap 0x00010050: OUT EAPD Balanced
  EAPD 0x3: BALANCED EAPD
  Pin Default 0x90170110: [Fixed] Speaker at Int N/A
    Conn = Analog, Color = Unknown
    DefAssociation = 0x1, Sequence = 0x0
    Misc = NO_PRESENCE
  Pin-ctls: 0x40: OUT
  Power states:  D0 D1 D2 D3 EPSS
  Power: setting=D0, actual=D0
  Connection: 2
     0x14* 0x3e
Node 0x25 [Pin Complex] wcaps 0x40058d: Stereo Amp-Out
  Control: name="Headphone Playback Switch", index=0, device=0
    ControlAmp: chs=3, dir=Out, idx=0, ofs=0
  Control: name="Independent HP", index=0, device=0
  Control: name="Front Headphone Jack", index=0, device=0
  Amp-Out caps: ofs=0x00, nsteps=0x00, stepsize=0x00, mute=1
  Amp-Out vals:  [0x00 0x00]
  Pincap 0x0001001c: OUT HP EAPD Detect
  EAPD 0x2: EAPD
  Pin Default 0x0221401f: [Jack] HP Out at Ext Front
    Conn = 1/8, Color = Green
    DefAssociation = 0x1, Sequence = 0xf
  Pin-ctls: 0xc0: OUT HP
  Unsolicited: tag=01, enabled=1
  Power states:  D0 D1 D2 D3 EPSS
  Power: setting=D0, actual=D0
  Connection: 1
     0x15
Node 0x26 [Vendor Defined Widget] wcaps 0xf00000: Mono
Node 0x27 [Vendor Defined Widget] wcaps 0xf00000: Mono
Node 0x28 [Pin Complex] wcaps 0x40058d: Stereo Amp-Out
  Amp-Out caps: ofs=0x00, nsteps=0x00, stepsize=0x00, mute=1
  Amp-Out vals:  [0x80 0x80]
  Pincap 0x0000001c: OUT HP Detect
  Pin Default 0x422140f0: [N/A] HP Out at Ext Front
    Conn = 1/8, Color = Green
    DefAssociation = 0xf, Sequence = 0x0
  Pin-ctls: 0x00:
  Unsolicited: tag=00, enabled=0
  Power states:  D0 D1 D2 D3 EPSS
  Power: setting=D3, actual=D3
  Connection: 1
     0x18
Node 0x29 [Pin Complex] wcaps 0x400481: Stereo
  Control: name="Internal Mic Boost Volume", index=0, device=0
    ControlAmp: chs=3, dir=In, idx=0, ofs=0
  Control: name="Internal Mic Phantom Jack", index=0, device=0
  Pincap 0x00002324: IN Detect
    Vref caps: HIZ 50 100
  Pin Default 0x90a70137: [Fixed] Mic at Int N/A
    Conn = Analog, Color = Unknown
    DefAssociation = 0x3, Sequence = 0x7
    Misc = NO_PRESENCE
  Pin-ctls: 0x21: IN VREF_50
  Unsolicited: tag=00, enabled=0
  Power states:  D0 D1 D2 D3 EPSS
  Power: setting=D0, actual=D0
Node 0x2a [Pin Complex] wcaps 0x400481: Stereo
  Pincap 0x00002324: IN Detect
    Vref caps: HIZ 50 100
  Pin Default 0x418130f8: [N/A] Line In at Ext Rear
    Conn = 1/8, Color = Blue
    DefAssociation = 0xf, Sequence = 0x8
  Pin-ctls: 0x00: VREF_HIZ
  Unsolicited: tag=00, enabled=0
  Power states:  D0 D1 D2 D3 EPSS
  Power: setting=D3, actual=D3
Node 0x2b [Pin Complex] wcaps 0x400481: Stereo
  Control: name="Mic Boost Volume", index=0, device=0
    ControlAmp: chs=3, dir=In, idx=0, ofs=0
  Control: name="Mic Jack", index=0, device=0
  Pincap 0x00002324: IN Detect
    Vref caps: HIZ 50 100
  Pin Default 0x01a1903e: [Jack] Mic at Ext Rear
    Conn = 1/8, Color = Pink
    DefAssociation = 0x3, Sequence = 0xe
  Pin-ctls: 0x21: IN VREF_50
  Unsolicited: tag=02, enabled=1
  Power states:  D0 D1 D2 D3 EPSS
  Power: setting=D0, actual=D0
Node 0x2c [Vendor Defined Widget] wcaps 0xf00000: Mono
Node 0x2d [Pin Complex] wcaps 0x400701: Stereo Digital
  Pincap 0x00000010: OUT
  Pin Default 0x474411f0: [N/A] SPDIF Out at Ext Rear Panel
    Conn = RCA, Color = Black
    DefAssociation = 0xf, Sequence = 0x0
    Misc = NO_PRESENCE
  Pin-ctls: 0x00:
  Power states:  D0 D1 D2 D3 EPSS
  Power: setting=D0, actual=D0
  Connection: 1
     0x0e
Node 0x2e [Vendor Defined Widget] wcaps 0xf00000: Mono
Node 0x2f [Vendor Defined Widget] wcaps 0xf00000: Mono
Node 0x30 [Pin Complex] wcaps 0x40040b: Stereo Amp-In
  Amp-In caps: ofs=0x00, nsteps=0x03, stepsize=0x2f, mute=0
  Amp-In vals:  [0x00 0x00]
  Pincap 0x00000020: IN
  Pin Default 0x50a601f0: [N/A] Mic at Int N/A
    Conn = Digital, Color = Unknown
    DefAssociation = 0xf, Sequence = 0x0
    Misc = NO_PRESENCE
  Pin-ctls: 0x00:
  Power states:  D0 D1 D2 D3 EPSS
  Power: setting=D0, actual=D0
Node 0x31 [Vendor Defined Widget] wcaps 0xf00000: Mono
Node 0x32 [Vendor Defined Widget] wcaps 0xf00000: Mono
Node 0x33 [Pin Complex] wcaps 0x40050c: Mono Amp-Out
  Amp-Out caps: ofs=0x00, nsteps=0x00, stepsize=0x00, mute=1
  Amp-Out vals:  [0x00]
  Pincap 0x00000010: OUT
  Pin Default 0x501701f0: [N/A] Speaker at Int N/A
    Conn = Analog, Color = Unknown
    DefAssociation = 0xf, Sequence = 0x0
    Misc = NO_PRESENCE
  Pin-ctls: 0x00:
  Power states:  D0 D1 D2 D3 EPSS
  Power: setting=D0, actual=D0
  Connection: 1
     0x3e
Node 0x34 [Audio Selector] wcaps 0x300501: Stereo
  Power states:  D0 D1 D2 D3
  Power: setting=D0, actual=D0
  Connection: 2
     0x08* 0x09
Node 0x35 [Audio Selector] wcaps 0x300501: Stereo
  Power states:  D0 D1 D2 D3
  Power: setting=D0, actual=D0
  Connection: 2
     0x08 0x09*
Node 0x36 [Vendor Defined Widget] wcaps 0xf00000: Mono
Node 0x37 [Vendor Defined Widget] wcaps 0xf00000: Mono
Node 0x38 [Audio Selector] wcaps 0x300501: Stereo
  Power states:  D0 D1 D2 D3
  Power: setting=D3, actual=D3
  Connection: 2
     0x08* 0x09
Node 0x39 [Vendor Defined Widget] wcaps 0xf00000: Mono
Node 0x3a [Vendor Defined Widget] wcaps 0xf00000: Mono
Node 0x3b [Vendor Defined Widget] wcaps 0xf00000: Mono
Node 0x3c [Audio Selector] wcaps 0x300501: Stereo
  Power states:  D0 D1 D2 D3
  Power: setting=D0, actual=D0
  Connection: 2
     0x08* 0x09
--endcollapse--


!!ALSA Device nodes
!!-----------------

crw-rw---T+ 1 root audio 116,  4 Sep 24 03:12 /dev/snd/controlC0
crw-rw---T+ 1 root audio 116,  9 Sep 24 03:12 /dev/snd/controlC1
crw-rw---T+ 1 root audio 116,  3 Sep 24 03:12 /dev/snd/hwC0D0
crw-rw---T+ 1 root audio 116,  8 Sep 24 03:12 /dev/snd/hwC1D0
crw-rw---T+ 1 root audio 116,  2 Sep 24 03:12 /dev/snd/pcmC0D3p
crw-rw---T+ 1 root audio 116,  7 Sep 24 03:12 /dev/snd/pcmC1D0c
crw-rw---T+ 1 root audio 116,  6 Sep 24 03:12 /dev/snd/pcmC1D0p
crw-rw---T+ 1 root audio 116,  5 Sep 24 03:12 /dev/snd/pcmC1D2p
crw-rw---T+ 1 root audio 116,  1 Sep 24 03:12 /dev/snd/seq
crw-rw---T+ 1 root audio 116, 33 Sep 24 03:12 /dev/snd/timer

/dev/snd/by-path:
total 0
drwxr-xr-x 2 root root  80 Sep 24 03:12 .
drwxr-xr-x 3 root root 260 Sep 24 03:12 ..
lrwxrwxrwx 1 root root  12 Sep 24 03:12 pci-0000:00:01.1 -> ../controlC0
lrwxrwxrwx 1 root root  12 Sep 24 03:12 pci-0000:00:14.2 -> ../controlC1


!!Aplay/Arecord output
!!------------

APLAY

**** List of PLAYBACK Hardware Devices ****
card 0: Generic [HD-Audio Generic], device 3: HDMI 0 [HDMI 0]
  Subdevices: 1/1
  Subdevice #0: subdevice #0
card 1: Generic_1 [HD-Audio Generic], device 0: VT1802 Analog [VT1802 Analog]
  Subdevices: 1/1
  Subdevice #0: subdevice #0
card 1: Generic_1 [HD-Audio Generic], device 2: VT1802 HP [VT1802 HP]
  Subdevices: 1/1
  Subdevice #0: subdevice #0

ARECORD

**** List of CAPTURE Hardware Devices ****
card 1: Generic_1 [HD-Audio Generic], device 0: VT1802 Analog [VT1802 Analog]
  Subdevices: 2/2
  Subdevice #0: subdevice #0
  Subdevice #1: subdevice #1

!!Amixer output
!!-------------

!!-------Mixer controls for card 0 [Generic]

Card hw:0 'Generic'/'HD-Audio Generic at 0xfeb44000 irq 47'
  Mixer name	: 'ATI R6xx HDMI'
  Components	: 'HDA:1002aa01,00aa0100,00100200'
  Controls      : 6
  Simple ctrls  : 1
Simple mixer control 'IEC958',0
  Capabilities: pswitch pswitch-joined penum
  Playback channels: Mono
  Mono: Playback [on]

!!-------Mixer controls for card 1 [Generic_1]

Card hw:1 'Generic_1'/'HD-Audio Generic at 0xfeb40000 irq 16'
  Mixer name	: 'VIA VT1802'
  Components	: 'HDA:11068446,10431c23,00100000'
  Controls      : 28
  Simple ctrls  : 16
Simple mixer control 'Master',0
  Capabilities: pvolume pvolume-joined pswitch pswitch-joined penum
  Playback channels: Mono
  Limits: Playback 0 - 42
  Mono: Playback 29 [69%] [-19.50dB] [on]
Simple mixer control 'Headphone',0
  Capabilities: pvolume pswitch penum
  Playback channels: Front Left - Front Right
  Limits: Playback 0 - 42
  Mono:
  Front Left: Playback 42 [100%] [0.00dB] [on]
  Front Right: Playback 42 [100%] [0.00dB] [on]
Simple mixer control 'Speaker',0
  Capabilities: pvolume pswitch penum
  Playback channels: Front Left - Front Right
  Limits: Playback 0 - 42
  Mono:
  Front Left: Playback 42 [100%] [0.00dB] [on]
  Front Right: Playback 42 [100%] [0.00dB] [on]
Simple mixer control 'PCM',0
  Capabilities: pvolume penum
  Playback channels: Front Left - Front Right
  Limits: Playback 0 - 255
  Mono:
  Front Left: Playback 255 [100%] [0.00dB]
  Front Right: Playback 255 [100%] [0.00dB]
Simple mixer control 'PCM Loopback',0
  Capabilities: pvolume pswitch penum
  Playback channels: Front Left - Front Right
  Limits: Playback 0 - 31
  Mono:
  Front Left: Playback 23 [74%] [0.00dB] [off]
  Front Right: Playback 23 [74%] [0.00dB] [off]
Simple mixer control 'Mic',0
  Capabilities: pvolume pswitch penum
  Playback channels: Front Left - Front Right
  Limits: Playback 0 - 31
  Mono:
  Front Left: Playback 23 [74%] [0.00dB] [off]
  Front Right: Playback 23 [74%] [0.00dB] [off]
Simple mixer control 'Mic Boost',0
  Capabilities: volume penum
  Playback channels: Front Left - Front Right
  Capture channels: Front Left - Front Right
  Limits: 0 - 3
  Front Left: 0 [0%] [0.00dB]
  Front Right: 0 [0%] [0.00dB]
Simple mixer control 'Capture',0
  Capabilities: cvolume cswitch penum
  Capture channels: Front Left - Front Right
  Limits: Capture 0 - 31
  Front Left: Capture 19 [61%] [12.00dB] [on]
  Front Right: Capture 19 [61%] [12.00dB] [on]
Simple mixer control 'Capture',1
  Capabilities: cvolume cswitch penum
  Capture channels: Front Left - Front Right
  Limits: Capture 0 - 31
  Front Left: Capture 0 [0%] [-16.50dB] [on]
  Front Right: Capture 0 [0%] [-16.50dB] [on]
Simple mixer control 'Dynamic Power-Control',0
  Capabilities: enum
  Items: 'Disabled' 'Enabled'
  Item0: 'Disabled'
Simple mixer control 'Independent HP',0
  Capabilities: enum
  Items: 'OFF' 'ON'
  Item0: 'OFF'
Simple mixer control 'Input Source',0
  Capabilities: cenum
  Items: 'Internal Mic' 'Mic' 'Stereo Mixer'
  Item0: 'Internal Mic'
Simple mixer control 'Input Source',1
  Capabilities: cenum
  Items: 'Internal Mic' 'Mic' 'Stereo Mixer'
  Item0: 'Internal Mic'
Simple mixer control 'Internal Mic',0
  Capabilities: pvolume pswitch penum
  Playback channels: Front Left - Front Right
  Limits: Playback 0 - 31
  Mono:
  Front Left: Playback 23 [74%] [0.00dB] [off]
  Front Right: Playback 23 [74%] [0.00dB] [off]
Simple mixer control 'Internal Mic Boost',0
  Capabilities: volume penum
  Playback channels: Front Left - Front Right
  Capture channels: Front Left - Front Right
  Limits: 0 - 3
  Front Left: 0 [0%] [0.00dB]
  Front Right: 0 [0%] [0.00dB]
Simple mixer control 'Loopback Mixing',0
  Capabilities: enum
  Items: 'Disabled' 'Enabled'
  Item0: 'Disabled'


!!Alsactl output
!!-------------

--startcollapse--
state.Generic {
	control.1 {
		iface CARD
		name 'HDMI/DP,pcm=3 Jack'
		value false
		comment {
			access read
			type BOOLEAN
			count 1
		}
	}
	control.2 {
		iface MIXER
		name 'IEC958 Playback Con Mask'
		value '0fff000000000000000000000000000000000000000000000000000000000000000000000000000000000000000000000000000000000000000000000000000000000000000000000000000000000000000000000000000000000000000000000000000000000000000000000000000000000000000000000000000000000000000000000000000000000000000000000000000000000000000000000000000000000000000000000000000000000000'
		comment {
			access read
			type IEC958
			count 1
		}
	}
	control.3 {
		iface MIXER
		name 'IEC958 Playback Pro Mask'
		value '0f00000000000000000000000000000000000000000000000000000000000000000000000000000000000000000000000000000000000000000000000000000000000000000000000000000000000000000000000000000000000000000000000000000000000000000000000000000000000000000000000000000000000000000000000000000000000000000000000000000000000000000000000000000000000000000000000000000000000000'
		comment {
			access read
			type IEC958
			count 1
		}
	}
	control.4 {
		iface MIXER
		name 'IEC958 Playback Default'
		value '0400000000000000000000000000000000000000000000000000000000000000000000000000000000000000000000000000000000000000000000000000000000000000000000000000000000000000000000000000000000000000000000000000000000000000000000000000000000000000000000000000000000000000000000000000000000000000000000000000000000000000000000000000000000000000000000000000000000000000'
		comment {
			access 'read write'
			type IEC958
			count 1
		}
	}
	control.5 {
		iface MIXER
		name 'IEC958 Playback Switch'
		value true
		comment {
			access 'read write'
			type BOOLEAN
			count 1
		}
	}
	control.6 {
		iface PCM
		device 3
		name ELD
		value ''
		comment {
			access read
			type BYTES
			count 0
		}
	}
}
state.Generic_1 {
	control.1 {
		iface MIXER
		name 'Speaker Playback Volume'
		value.0 42
		value.1 42
		comment {
			access 'read write'
			type INTEGER
			count 2
			range '0 - 42'
			dbmin -6300
			dbmax 0
			dbvalue.0 0
			dbvalue.1 0
		}
	}
	control.2 {
		iface MIXER
		name 'Speaker Playback Switch'
		value.0 true
		value.1 true
		comment {
			access 'read write'
			type BOOLEAN
			count 2
		}
	}
	control.3 {
		iface MIXER
		name 'PCM Loopback Playback Volume'
		value.0 23
		value.1 23
		comment {
			access 'read write'
			type INTEGER
			count 2
			range '0 - 31'
			dbmin -3450
			dbmax 1200
			dbvalue.0 0
			dbvalue.1 0
		}
	}
	control.4 {
		iface MIXER
		name 'PCM Loopback Playback Switch'
		value.0 false
		value.1 false
		comment {
			access 'read write'
			type BOOLEAN
			count 2
		}
	}
	control.5 {
		iface MIXER
		name 'Headphone Playback Volume'
		value.0 42
		value.1 42
		comment {
			access 'read write'
			type INTEGER
			count 2
			range '0 - 42'
			dbmin -6300
			dbmax 0
			dbvalue.0 0
			dbvalue.1 0
		}
	}
	control.6 {
		iface MIXER
		name 'Headphone Playback Switch'
		value.0 true
		value.1 true
		comment {
			access 'read write'
			type BOOLEAN
			count 2
		}
	}
	control.7 {
		iface MIXER
		name 'Loopback Mixing'
		value Disabled
		comment {
			access 'read write'
			type ENUMERATED
			count 1
			item.0 Disabled
			item.1 Enabled
		}
	}
	control.8 {
		iface MIXER
		name 'Capture Volume'
		value.0 19
		value.1 19
		comment {
			access 'read write'
			type INTEGER
			count 2
			range '0 - 31'
			dbmin -1650
			dbmax 3000
			dbvalue.0 1200
			dbvalue.1 1200
		}
	}
	control.9 {
		iface MIXER
		name 'Capture Switch'
		value.0 true
		value.1 true
		comment {
			access 'read write'
			type BOOLEAN
			count 2
		}
	}
	control.10 {
		iface MIXER
		name 'Capture Volume'
		index 1
		value.0 0
		value.1 0
		comment {
			access 'read write'
			type INTEGER
			count 2
			range '0 - 31'
			dbmin -1650
			dbmax 3000
			dbvalue.0 -1650
			dbvalue.1 -1650
		}
	}
	control.11 {
		iface MIXER
		name 'Capture Switch'
		index 1
		value.0 true
		value.1 true
		comment {
			access 'read write'
			type BOOLEAN
			count 2
		}
	}
	control.12 {
		iface MIXER
		name 'Input Source'
		value 'Internal Mic'
		comment {
			access 'read write'
			type ENUMERATED
			count 1
			item.0 'Internal Mic'
			item.1 Mic
			item.2 'Stereo Mixer'
		}
	}
	control.13 {
		iface MIXER
		name 'Input Source'
		index 1
		value 'Internal Mic'
		comment {
			access 'read write'
			type ENUMERATED
			count 1
			item.0 'Internal Mic'
			item.1 Mic
			item.2 'Stereo Mixer'
		}
	}
	control.14 {
		iface MIXER
		name 'Internal Mic Playback Volume'
		value.0 23
		value.1 23
		comment {
			access 'read write'
			type INTEGER
			count 2
			range '0 - 31'
			dbmin -3450
			dbmax 1200
			dbvalue.0 0
			dbvalue.1 0
		}
	}
	control.15 {
		iface MIXER
		name 'Internal Mic Playback Switch'
		value.0 false
		value.1 false
		comment {
			access 'read write'
			type BOOLEAN
			count 2
		}
	}
	control.16 {
		iface MIXER
		name 'Mic Playback Volume'
		value.0 23
		value.1 23
		comment {
			access 'read write'
			type INTEGER
			count 2
			range '0 - 31'
			dbmin -3450
			dbmax 1200
			dbvalue.0 0
			dbvalue.1 0
		}
	}
	control.17 {
		iface MIXER
		name 'Mic Playback Switch'
		value.0 false
		value.1 false
		comment {
			access 'read write'
			type BOOLEAN
			count 2
		}
	}
	control.18 {
		iface MIXER
		name 'Internal Mic Boost Volume'
		value.0 0
		value.1 0
		comment {
			access 'read write'
			type INTEGER
			count 2
			range '0 - 3'
			dbmin 0
			dbmax 3075
			dbvalue.0 0
			dbvalue.1 0
		}
	}
	control.19 {
		iface MIXER
		name 'Mic Boost Volume'
		value.0 0
		value.1 0
		comment {
			access 'read write'
			type INTEGER
			count 2
			range '0 - 3'
			dbmin 0
			dbmax 3075
			dbvalue.0 0
			dbvalue.1 0
		}
	}
	control.20 {
		iface MIXER
		name 'Independent HP'
		value OFF
		comment {
			access 'read write'
			type ENUMERATED
			count 1
			item.0 OFF
			item.1 ON
		}
	}
	control.21 {
		iface MIXER
		name 'Dynamic Power-Control'
		value Disabled
		comment {
			access 'read write'
			type ENUMERATED
			count 1
			item.0 Disabled
			item.1 Enabled
		}
	}
	control.22 {
		iface MIXER
		name 'Master Playback Volume'
		value 29
		comment {
			access 'read write'
			type INTEGER
			count 1
			range '0 - 42'
			dbmin -6300
			dbmax 0
			dbvalue.0 -1950
		}
	}
	control.23 {
		iface MIXER
		name 'Master Playback Switch'
		value true
		comment {
			access 'read write'
			type BOOLEAN
			count 1
		}
	}
	control.24 {
		iface CARD
		name 'Speaker Phantom Jack'
		value true
		comment {
			access read
			type BOOLEAN
			count 1
		}
	}
	control.25 {
		iface CARD
		name 'Front Headphone Jack'
		value false
		comment {
			access read
			type BOOLEAN
			count 1
		}
	}
	control.26 {
		iface CARD
		name 'Internal Mic Phantom Jack'
		value true
		comment {
			access read
			type BOOLEAN
			count 1
		}
	}
	control.27 {
		iface CARD
		name 'Mic Jack'
		value false
		comment {
			access read
			type BOOLEAN
			count 1
		}
	}
	control.28 {
		iface MIXER
		name 'PCM Playback Volume'
		value.0 255
		value.1 255
		comment {
			access 'read write user'
			type INTEGER
			count 2
			range '0 - 255'
			tlv '0000000100000008ffffec1400000014'
			dbmin -5100
			dbmax 0
			dbvalue.0 0
			dbvalue.1 0
		}
	}
}
--endcollapse--


!!All Loaded Modules
!!------------------

Module
asus_nb_wmi
joydev
asus_wmi
sparse_keymap
parport_pc
rfcomm
bnep
ppdev
snd_hda_codec_via
psmouse
serio_raw
snd_hda_codec_hdmi
uvcvideo
videodev
snd_hda_intel
dm_multipath
snd_hda_codec
snd_hwdep
snd_pcm
nls_iso8859_1
v4l2_compat_ioctl32
nls_cp437
k10temp
i2c_piix4
vfat
fat
snd_seq_midi
alx
compat
snd_rawmidi
rt3290sta
snd_seq_midi_event
snd_seq
rtbth
bluetooth
snd_timer
fglrx
snd_seq_device
video
wmi
mac_hid
snd
soundcore
snd_page_alloc
lp
parport
sdhci_pci
sdhci
dm_raid45
xor
dm_mirror
dm_region_hash
dm_log
btrfs
zlib_deflate
libcrc32c


!!Sysfs Files
!!-----------

/sys/class/sound/hwC0D0/init_pin_configs:
0x03 0x18560010

/sys/class/sound/hwC0D0/driver_pin_configs:

/sys/class/sound/hwC0D0/user_pin_configs:

/sys/class/sound/hwC0D0/init_verbs:

/sys/class/sound/hwC1D0/init_pin_configs:
0x24 0x90170110
0x25 0x0221401f
0x28 0x422140f0
0x29 0x90a70137
0x2a 0x418130f8
0x2b 0x01a1903e
0x2d 0x474411f0
0x30 0x50a601f0
0x33 0x501701f0

/sys/class/sound/hwC1D0/driver_pin_configs:

/sys/class/sound/hwC1D0/user_pin_configs:

/sys/class/sound/hwC1D0/init_verbs:


!!ALSA/HDA dmesg
!!------------------



