upload=true&script=true&cardinfo=
!!################################
!!ALSA Information Script v 0.4.51
!!################################

!!Script ran on: Thu Feb  5 10:53:06 EST 2009


!!Linux Distribution
!!------------------

Welcome to SUSE Linux Enterprise Desktop 11 RC3 (x86_64) - Kernel \r (\l). SUSE Linux Enterprise Desktop 11 (x86_64) SUSE Linux Enterprise Desktop 11 (x86_64)


!!Kernel Information
!!------------------

Kernel release:    2.6.27.13-1-default
Operating System:  GNU/Linux
Architecture:      x86_64
Processor:         x86_64
SMP Enabled:       Yes


!!ALSA Version
!!------------

Driver version:     1.0.17
Library version:    
Utilities version:  1.0.18


!!Loaded ALSA modules
!!-------------------

snd_hda_intel


!!Soundcards recognised by ALSA
!!-----------------------------

 0 [Intel          ]: HDA-Intel - HDA Intel
                      HDA Intel at 0x98900000 irq 17


!!PCI Soundcards installed in the system
!!--------------------------------------

00:1b.0 Audio device: Intel Corporation 82801I (ICH9 Family) HD Audio Controller (rev 03)


!!Advanced information - PCI Vendor/Device/Susbsystem ID's
!!--------------------------------------------------------

00:1b.0 0403: 8086:293e (rev 03)
	Subsystem: 103c:3072


!!Modprobe options (Sound related)
!!--------------------------------

snd-hda-intel: model=laptop


!!Loaded sound module options
!!--------------------------

!!Module: snd_hda_intel
bdl_pos_adj : 1,-1,-1,-1,-1,-1,-1,-1,-1,-1,-1,-1,-1,-1,-1,-1,-1,-1,-1,-1,-1,-1,-1,-1,-1,-1,-1,-1,-1,-1,-1,-1
enable : Y,Y,Y,Y,Y,Y,Y,Y,Y,Y,Y,Y,Y,Y,Y,Y,Y,Y,Y,Y,Y,Y,Y,Y,Y,Y,Y,Y,Y,Y,Y,Y
enable_msi : 0
id : <NULL>,<NULL>,<NULL>,<NULL>,<NULL>,<NULL>,<NULL>,<NULL>,<NULL>,<NULL>,<NULL>,<NULL>,<NULL>,<NULL>,<NULL>,<NULL>,<NULL>,<NULL>,<NULL>,<NULL>,<NULL>,<NULL>,<NULL>,<NULL>,<NULL>,<NULL>,<NULL>,<NULL>,<NULL>,<NULL>,<NULL>,<NULL>
index : -1,-1,-1,-1,-1,-1,-1,-1,-1,-1,-1,-1,-1,-1,-1,-1,-1,-1,-1,-1,-1,-1,-1,-1,-1,-1,-1,-1,-1,-1,-1,-1
model : laptop,<NULL>,<NULL>,<NULL>,<NULL>,<NULL>,<NULL>,<NULL>,<NULL>,<NULL>,<NULL>,<NULL>,<NULL>,<NULL>,<NULL>,<NULL>,<NULL>,<NULL>,<NULL>,<NULL>,<NULL>,<NULL>,<NULL>,<NULL>,<NULL>,<NULL>,<NULL>,<NULL>,<NULL>,<NULL>,<NULL>,<NULL>
position_fix : 0,0,0,0,0,0,0,0,0,0,0,0,0,0,0,0,0,0,0,0,0,0,0,0,0,0,0,0,0,0,0,0
power_save : 10
power_save_controller : Y
probe_mask : -1,-1,-1,-1,-1,-1,-1,-1,-1,-1,-1,-1,-1,-1,-1,-1,-1,-1,-1,-1,-1,-1,-1,-1,-1,-1,-1,-1,-1,-1,-1,-1
single_cmd : N


!!HDA-Intel Codec information
!!---------------------------
--startcollapse--

Codec: Analog Devices AD1984A
Address: 0
Vendor Id: 0x11d4194a
Subsystem Id: 0x103c3072
Revision Id: 0x100400
No Modem Function Group found
Default PCM:
    rates [0x7ff]: 8000 11025 16000 22050 32000 44100 48000 88200 96000 176400 192000
    bits [0xe]: 16 20 24
    formats [0x1]: PCM
Default Amp-In caps: ofs=0x00, nsteps=0x00, stepsize=0x00, mute=1
Default Amp-Out caps: ofs=0x27, nsteps=0x27, stepsize=0x05, mute=0
GPIO: io=3, o=0, i=0, unsolicited=1, wake=0
  IO[0]: enable=0, dir=0, wake=0, sticky=0, data=1
  IO[1]: enable=0, dir=0, wake=0, sticky=0, data=1
  IO[2]: enable=0, dir=0, wake=0, sticky=0, data=1
Node 0x02 [Audio Output] wcaps 0x30211: Stereo Digital
  Converter: stream=0, channel=0
  Digital:
  Digital category: 0x0
  PCM:
    rates [0x7e0]: 44100 48000 88200 96000 176400 192000
    bits [0xe]: 16 20 24
    formats [0x5]: PCM AC3
  Delay: 3 samples
Node 0x03 [Audio Output] wcaps 0x405: Stereo Amp-Out
  Amp-Out caps: ofs=0x27, nsteps=0x27, stepsize=0x05, mute=0
  Amp-Out vals:  [0x27 0x27]
  Converter: stream=0, channel=0
  Power: setting=D0, actual=D0
Node 0x04 [Audio Output] wcaps 0x405: Stereo Amp-Out
  Amp-Out caps: ofs=0x27, nsteps=0x27, stepsize=0x05, mute=0
  Amp-Out vals:  [0x27 0x27]
  Converter: stream=0, channel=0
  Power: setting=D0, actual=D0
Node 0x05 [Vendor Defined Widget] wcaps 0xf00000: Mono
Node 0x06 [Vendor Defined Widget] wcaps 0xf00000: Mono
Node 0x07 [Audio Mixer] wcaps 0x200103: Stereo Amp-In
  Amp-In caps: ofs=0x00, nsteps=0x00, stepsize=0x00, mute=1
  Amp-In vals:  [0x80 0x80] [0x00 0x00]
  Connection: 2
     0x22 0x21
Node 0x08 [Audio Input] wcaps 0x100501: Stereo
  Converter: stream=0, channel=0
  SDI-Select: 0
  Power: setting=D0, actual=D0
  Connection: 1
     0x0c
Node 0x09 [Audio Input] wcaps 0x100501: Stereo
  Converter: stream=0, channel=0
  SDI-Select: 0
  Power: setting=D0, actual=D0
  Connection: 1
     0x0d
Node 0x0a [Audio Mixer] wcaps 0x200103: Stereo Amp-In
  Amp-In caps: ofs=0x00, nsteps=0x00, stepsize=0x00, mute=1
  Amp-In vals:  [0x80 0x80] [0x00 0x00]
  Connection: 2
     0x04 0x21
Node 0x0b [Audio Mixer] wcaps 0x200103: Stereo Amp-In
  Amp-In caps: ofs=0x00, nsteps=0x00, stepsize=0x00, mute=1
  Amp-In vals:  [0x80 0x80] [0x00 0x00]
  Connection: 2
     0x0f 0x21
Node 0x0c [Audio Selector] wcaps 0x30010d: Stereo Amp-Out
  Amp-Out caps: ofs=0x27, nsteps=0x36, stepsize=0x05, mute=1
  Amp-Out vals:  [0x34 0x34]
  Connection: 6
     0x14 0x15* 0x16 0x20 0x25 0x17
Node 0x0d [Audio Selector] wcaps 0x30010d: Stereo Amp-Out
  Amp-Out caps: ofs=0x27, nsteps=0x36, stepsize=0x05, mute=1
  Amp-Out vals:  [0x80 0x80]
  Connection: 6
     0x14* 0x15 0x16 0x20 0x25 0x17
Node 0x0e [Audio Selector] wcaps 0x300101: Stereo
  Connection: 2
     0x03* 0x04
Node 0x0f [Audio Selector] wcaps 0x300101: Stereo
  Connection: 2
     0x03* 0x04
Node 0x10 [Beep Generator Widget] wcaps 0x70000c: Mono Amp-Out
  Amp-Out caps: ofs=0x0f, nsteps=0x0f, stepsize=0x0b, mute=1
  Amp-Out vals:  [0x00]
Node 0x11 [Pin Complex] wcaps 0x40018d: Stereo Amp-Out
  Amp-Out caps: ofs=0x00, nsteps=0x00, stepsize=0x00, mute=1
  Amp-Out vals:  [0x00 0x00]
  Pincap 0x0000001f: OUT HP Detect Trigger ImpSense
  Pin Default 0x02212040: [Jack] HP Out at Ext Front
    Conn = 1/8, Color = Grey
    DefAssociation = 0x4, Sequence = 0x0
  Pin-ctls: 0xc0: OUT HP
  Unsolicited: tag=37, enabled=1
  Connection: 1
     0x07
Node 0x12 [Pin Complex] wcaps 0x40058d: Stereo Amp-Out
  Amp-Out caps: ofs=0x00, nsteps=0x00, stepsize=0x00, mute=1
  Amp-Out vals:  [0x80 0x80]
  Pincap 0x0001001f: OUT HP EAPD Detect Trigger ImpSense
  EAPD 0x0:
  Pin Default 0x410140f0: [N/A] Line Out at Ext Rear
    Conn = 1/8, Color = Green
    DefAssociation = 0xf, Sequence = 0x0
  Pin-ctls: 0xc0: OUT HP
  Unsolicited: tag=00, enabled=0
  Power: setting=D0, actual=D0
  Connection: 1
     0x0a
Node 0x13 [Pin Complex] wcaps 0x40050c: Mono Amp-Out
  Amp-Out caps: ofs=0x1f, nsteps=0x1f, stepsize=0x05, mute=1
  Amp-Out vals:  [0x00]
  Pincap 0x00010010: OUT EAPD
  EAPD 0x0:
  Pin Default 0x413711f0: [N/A] CD at Ext Rear
    Conn = Analog, Color = Black
    DefAssociation = 0xf, Sequence = 0x0
    Misc = NO_PRESENCE
  Pin-ctls: 0x40: OUT
  Power: setting=D0, actual=D0
  Connection: 1
     0x1f
Node 0x14 [Pin Complex] wcaps 0x40008b: Stereo Amp-In
  Amp-In caps: ofs=0x00, nsteps=0x03, stepsize=0x27, mute=0
  Amp-In vals:  [0x02 0x02]
  Pincap 0x00003727: IN Detect Trigger ImpSense
    Vref caps: HIZ 50 GRD 80 100
  Pin Default 0x02a12060: [Jack] Mic at Ext Front
    Conn = 1/8, Color = Grey
    DefAssociation = 0x6, Sequence = 0x0
  Pin-ctls: 0x24: IN VREF_80
  Unsolicited: tag=36, enabled=1
Node 0x15 [Pin Complex] wcaps 0x40008b: Stereo Amp-In
  Amp-In caps: ofs=0x00, nsteps=0x03, stepsize=0x27, mute=0
  Amp-In vals:  [0x02 0x02]
  Pincap 0x00003727: IN Detect Trigger ImpSense
    Vref caps: HIZ 50 GRD 80 100
  Pin Default 0x91a71120: [Fixed] Mic at Int Rear
    Conn = Analog, Color = Black
    DefAssociation = 0x2, Sequence = 0x0
    Misc = NO_PRESENCE
  Pin-ctls: 0x24: IN VREF_80
  Unsolicited: tag=00, enabled=0
Node 0x16 [Pin Complex] wcaps 0x40058d: Stereo Amp-Out
  Amp-Out caps: ofs=0x00, nsteps=0x00, stepsize=0x00, mute=1
  Amp-Out vals:  [0x00 0x00]
  Pincap 0x00010037: IN OUT EAPD Detect Trigger ImpSense
  EAPD 0x2: EAPD
  Pin Default 0x92174110: [Fixed] Speaker at Int Front
    Conn = Analog, Color = Green
    DefAssociation = 0x1, Sequence = 0x0
    Misc = NO_PRESENCE
  Pin-ctls: 0x40: OUT
  Unsolicited: tag=00, enabled=0
  Power: setting=D0, actual=D0
  Connection: 1
     0x0b
Node 0x17 [Pin Complex] wcaps 0x40020b: Stereo Digital Amp-In
  Amp-In caps: ofs=0x00, nsteps=0x03, stepsize=0x17, mute=0
  Amp-In vals:  [0x02 0x02]
  Pincap 0x00000020: IN
  Pin Default 0x41a6e130: [N/A] Mic at Ext Rear
    Conn = Digital, Color = White
    DefAssociation = 0x3, Sequence = 0x0
    Misc = NO_PRESENCE
  Pin-ctls: 0x24: IN
Node 0x18 [Vendor Defined Widget] wcaps 0xf00100: Mono
  Connection: 1
     0x06
Node 0x19 [Power Widget] wcaps 0x500500: Mono
  Power: setting=D0, actual=D0
  Connection: 2
     0x20* 0x21
Node 0x1a [Pin Complex] wcaps 0x400000: Mono
  Pincap 0x00000020: IN
  Pin Default 0x90f711f0: [Fixed] Other at Int N/A
    Conn = Analog, Color = Black
    DefAssociation = 0xf, Sequence = 0x0
    Misc = NO_PRESENCE
  Pin-ctls: 0x20: IN
Node 0x1b [Pin Complex] wcaps 0x40038d: Stereo Digital Amp-Out
  Amp-Out caps: ofs=0x27, nsteps=0x27, stepsize=0x05, mute=1
  Amp-Out vals:  [0x27 0x27]
  Pincap 0x00000014: OUT Detect
  Pin Default 0x41561150: [N/A] Digital Out at Ext Rear
    Conn = Digital, Color = Black
    DefAssociation = 0x5, Sequence = 0x0
    Misc = NO_PRESENCE
  Pin-ctls: 0x00:
  Unsolicited: tag=00, enabled=0
  Connection: 1
     0x02
Node 0x1c [Pin Complex] wcaps 0x40018d: Stereo Amp-Out
  Amp-Out caps: ofs=0x00, nsteps=0x00, stepsize=0x00, mute=1
  Amp-Out vals:  [0x80 0x80]
  Pincap 0x00003737: IN OUT Detect Trigger ImpSense
    Vref caps: HIZ 50 GRD 80 100
  Pin Default 0x018130f0: [Jack] Line In at Ext Rear
    Conn = 1/8, Color = Blue
    DefAssociation = 0xf, Sequence = 0x0
  Pin-ctls: 0x24: IN VREF_80
  Unsolicited: tag=00, enabled=0
  Connection: 1
     0x24
Node 0x1d [Vendor Defined Widget] wcaps 0xf00100: Mono
  Connection: 25
     0x07* 0x0a 0x0b 0x0c 0x0d 0x0e 0x0f 0x11 0x12 0x13 0x14 0x15 0x16 0x19 0x1a 0x1c 0x1e 0x1f 0x20 0x21 0x22 0x23 0x24 0x25 0x26
Node 0x1e [Audio Mixer] wcaps 0x200103: Stereo Amp-In
  Amp-In caps: ofs=0x00, nsteps=0x00, stepsize=0x00, mute=1
  Amp-In vals:  [0x80 0x80] [0x00 0x00]
  Connection: 2
     0x0e 0x21
Node 0x1f [Audio Mixer] wcaps 0x200100: Mono
  Connection: 1
     0x1e
Node 0x20 [Audio Mixer] wcaps 0x20010b: Stereo Amp-In
  Amp-In caps: ofs=0x17, nsteps=0x1f, stepsize=0x05, mute=1
  Amp-In vals:  [0x80 0x80] [0x80 0x80] [0x80 0x80] [0x12 0x12] [0x80 0x80] [0x17 0x17] [0x97 0x97]
  Connection: 7
     0x14 0x15 0x16 0x1a 0x25 0x03 0x04
Node 0x21 [Audio Selector] wcaps 0x30010d: Stereo Amp-Out
  Amp-Out caps: ofs=0x1f, nsteps=0x1f, stepsize=0x05, mute=1
  Amp-Out vals:  [0x11 0x11]
  Connection: 1
     0x20
Node 0x22 [Audio Selector] wcaps 0x300101: Stereo
  Connection: 2
     0x03* 0x04
Node 0x23 [Audio Selector] wcaps 0x300101: Stereo
  Connection: 2
     0x03* 0x04
Node 0x24 [Audio Mixer] wcaps 0x200103: Stereo Amp-In
  Amp-In caps: ofs=0x00, nsteps=0x00, stepsize=0x00, mute=1
  Amp-In vals:  [0x80 0x80] [0x80 0x80]
  Connection: 2
     0x23 0x21
Node 0x25 [Audio Selector] wcaps 0x30010d: Stereo Amp-Out
  Amp-Out caps: ofs=0x00, nsteps=0x03, stepsize=0x27, mute=0
  Amp-Out vals:  [0x00 0x00]
  Connection: 1
     0x1c
Node 0x26 [Vendor Defined Widget] wcaps 0xf00100: Mono
  Connection: 3
     0x14* 0x15 0x1c
Node 0x27 [Vendor Defined Widget] wcaps 0xf00301: Stereo Digital
  Connection: 2
     0x08* 0x09
Node 0x28 [Vendor Defined Widget] wcaps 0xf0030d: Stereo Digital Amp-Out
  Amp-Out caps: ofs=0x00, nsteps=0x00, stepsize=0x00, mute=1
  Amp-Out vals:  [0x80 0x80]
  Connection: 2
     0x08* 0x09
Node 0x29 [Vendor Defined Widget] wcaps 0xf0030d: Stereo Digital Amp-Out
  Amp-Out caps: ofs=0x00, nsteps=0x00, stepsize=0x00, mute=1
  Amp-Out vals:  [0x80 0x80]
  Connection: 2
     0x08* 0x09
Node 0x2a [Vendor Defined Widget] wcaps 0xf00301: Stereo Digital
  Connection: 2
     0x01* 0x27
Codec: Generic 8086 ID 2802
Address: 2
Vendor Id: 0x80862802
Subsystem Id: 0x80860101
Revision Id: 0x100000
No Modem Function Group found
Default PCM:
    rates [0x0]:
    bits [0x0]:
    formats [0x0]:
Default Amp-In caps: N/A
Default Amp-Out caps: N/A
GPIO: io=0, o=0, i=0, unsolicited=0, wake=0
Node 0x02 [Audio Output] wcaps 0x6211: 8-Channels Digital
  Converter: stream=0, channel=0
  Digital: Enabled
  Digital category: 0x0
  PCM:
    rates [0x7f0]: 32000 44100 48000 88200 96000 176400 192000
    bits [0x1e]: 16 20 24 32
    formats [0x5]: PCM AC3
Node 0x03 [Pin Complex] wcaps 0x40739d: 8-Channels Digital Amp-Out CP
  Amp-Out caps: ofs=0x00, nsteps=0x00, stepsize=0x00, mute=1
  Amp-Out vals:  [0x00 0x80]
  Pincap 0x00000094: OUT Detect HDMI R/L
  Pin Default 0x18560010: [Jack] Digital Out at Int HDMI
    Conn = Digital, Color = Unknown
    DefAssociation = 0x1, Sequence = 0x0
  Pin-ctls: 0x40: OUT
  Unsolicited: tag=00, enabled=0
  Connection: 1
     0x02
--endcollapse--


!!ALSA Device nodes
!!-----------------

crw-rw----+ 1 root audio 116, 7 2009-02-05 05:42 /dev/snd/controlC0
crw-rw----+ 1 root audio 116, 6 2009-02-05 05:42 /dev/snd/hwC0D0
crw-rw----+ 1 root audio 116, 5 2009-02-05 05:42 /dev/snd/hwC0D2
crw-rw----+ 1 root audio 116, 4 2009-02-05 10:44 /dev/snd/pcmC0D0c
crw-rw----+ 1 root audio 116, 3 2009-02-05 10:44 /dev/snd/pcmC0D0p
crw-rw----+ 1 root audio 116, 8 2009-02-05 10:43 /dev/snd/seq
crw-rw----+ 1 root audio 116, 2 2009-02-05 05:42 /dev/snd/timer


!!Aplay/Arecord output
!!------------

APLAY

**** List of PLAYBACK Hardware Devices ****
card 0: Intel [HDA Intel], device 0: AD198x Analog [AD198x Analog]
  Subdevices: 1/1
  Subdevice #0: subdevice #0

ARECORD

**** List of CAPTURE Hardware Devices ****
card 0: Intel [HDA Intel], device 0: AD198x Analog [AD198x Analog]
  Subdevices: 2/2
  Subdevice #0: subdevice #0
  Subdevice #1: subdevice #1

!!Amixer output
!!-------------

!!-------Mixer controls for card 0 [Intel]

Card hw:0 'Intel'/'HDA Intel at 0x98900000 irq 17'
  Mixer name	: 'Generic 8086 ID 2802'
  Components	: 'HDA:11d4194a HDA:80862802'
  Controls      : 23
  Simple ctrls  : 15
Simple mixer control 'Master',0
  Capabilities: pvolume pswitch
  Playback channels: Front Left - Front Right
  Limits: Playback 0 - 31
  Mono:
  Front Left: Playback 17 [55%] [-21.00dB] [on]
  Front Right: Playback 17 [55%] [-21.00dB] [on]
Simple mixer control 'PCM',0
  Capabilities: pvolume pswitch
  Playback channels: Front Left - Front Right
  Limits: Playback 0 - 31
  Mono:
  Front Left: Playback 23 [74%] [0.00dB] [on]
  Front Right: Playback 23 [74%] [0.00dB] [on]
Simple mixer control 'Mic',0
  Capabilities: pvolume pswitch
  Playback channels: Front Left - Front Right
  Limits: Playback 0 - 31
  Mono:
  Front Left: Playback 0 [0%] [-34.50dB] [off]
  Front Right: Playback 0 [0%] [-34.50dB] [off]
Simple mixer control 'Mic Boost',0
  Capabilities: volume
  Playback channels: Front Left - Front Right
  Capture channels: Front Left - Front Right
  Limits: 0 - 3
  Front Left: 2 [67%]
  Front Right: 2 [67%]
Simple mixer control 'Capture',0
  Capabilities: cvolume cswitch
  Capture channels: Front Left - Front Right
  Limits: Capture 0 - 54
  Front Left: Capture 52 [96%] [19.50dB] [on]
  Front Right: Capture 52 [96%] [19.50dB] [on]
Simple mixer control 'Capture',1
  Capabilities: cvolume cswitch
  Capture channels: Front Left - Front Right
  Limits: Capture 0 - 54
  Front Left: Capture 0 [0%] [-58.50dB] [off]
  Front Right: Capture 0 [0%] [-58.50dB] [off]
Simple mixer control 'Beep',0
  Capabilities: pvolume pswitch
  Playback channels: Front Left - Front Right
  Limits: Playback 0 - 31
  Mono:
  Front Left: Playback 18 [58%] [-7.50dB] [on]
  Front Right: Playback 18 [58%] [-7.50dB] [on]
Simple mixer control 'Digital',0
  Capabilities: cvolume
  Capture channels: Front Left - Front Right
  Limits: Capture 0 - 120
  Front Left: Capture 60 [50%] [0.00dB]
  Front Right: Capture 60 [50%] [0.00dB]
Simple mixer control 'Dock',0
  Capabilities: pswitch
  Playback channels: Front Left - Front Right
  Mono:
  Front Left: Playback [off]
  Front Right: Playback [off]
Simple mixer control 'Dock Mic',0
  Capabilities: pvolume pswitch
  Playback channels: Front Left - Front Right
  Limits: Playback 0 - 31
  Mono:
  Front Left: Playback 0 [0%] [-34.50dB] [off]
  Front Right: Playback 0 [0%] [-34.50dB] [off]
Simple mixer control 'Dock Mic Boost',0
  Capabilities: volume
  Playback channels: Front Left - Front Right
  Capture channels: Front Left - Front Right
  Limits: 0 - 3
  Front Left: 0 [0%]
  Front Right: 0 [0%]
Simple mixer control 'Input Source',0
  Capabilities: cenum
  Items: 'Mic' 'Internal Mic' 'Dock Mic' 'Mix'
  Item0: 'Internal Mic'
Simple mixer control 'Input Source',1
  Capabilities: cenum
  Items: 'Mic' 'Internal Mic' 'Dock Mic' 'Mix'
  Item0: 'Mic'
Simple mixer control 'Internal Mic',0
  Capabilities: pvolume pswitch
  Playback channels: Front Left - Front Right
  Limits: Playback 0 - 31
  Mono:
  Front Left: Playback 0 [0%] [-34.50dB] [off]
  Front Right: Playback 0 [0%] [-34.50dB] [off]
Simple mixer control 'Internal Mic Boost',0
  Capabilities: volume
  Playback channels: Front Left - Front Right
  Capture channels: Front Left - Front Right
  Limits: 0 - 3
  Front Left: 2 [67%]
  Front Right: 2 [67%]


!!Alsactl output
!!-------------

--startcollapse--
state.Intel {
	control.1 {
		comment.access 'read write'
		comment.type INTEGER
		comment.count 2
		comment.range '0 - 31'
		comment.dbmin -4650
		comment.dbmax 0
		iface MIXER
		name 'Master Playback Volume'
		value.0 17
		value.1 17
	}
	control.2 {
		comment.access 'read write'
		comment.type BOOLEAN
		comment.count 2
		iface MIXER
		name 'Master Playback Switch'
		value.0 true
		value.1 true
	}
	control.3 {
		comment.access 'read write'
		comment.type BOOLEAN
		comment.count 2
		iface MIXER
		name 'Dock Playback Switch'
		value.0 false
		value.1 false
	}
	control.4 {
		comment.access 'read write'
		comment.type INTEGER
		comment.count 2
		comment.range '0 - 31'
		comment.dbmin -3450
		comment.dbmax 1200
		iface MIXER
		name 'PCM Playback Volume'
		value.0 23
		value.1 23
	}
	control.5 {
		comment.access 'read write'
		comment.type BOOLEAN
		comment.count 2
		iface MIXER
		name 'PCM Playback Switch'
		value.0 true
		value.1 true
	}
	control.6 {
		comment.access 'read write'
		comment.type INTEGER
		comment.count 2
		comment.range '0 - 31'
		comment.dbmin -3450
		comment.dbmax 1200
		iface MIXER
		name 'Mic Playback Volume'
		value.0 0
		value.1 0
	}
	control.7 {
		comment.access 'read write'
		comment.type BOOLEAN
		comment.count 2
		iface MIXER
		name 'Mic Playback Switch'
		value.0 false
		value.1 false
	}
	control.8 {
		comment.access 'read write'
		comment.type INTEGER
		comment.count 2
		comment.range '0 - 31'
		comment.dbmin -3450
		comment.dbmax 1200
		iface MIXER
		name 'Internal Mic Playback Volume'
		value.0 0
		value.1 0
	}
	control.9 {
		comment.access 'read write'
		comment.type BOOLEAN
		comment.count 2
		iface MIXER
		name 'Internal Mic Playback Switch'
		value.0 false
		value.1 false
	}
	control.10 {
		comment.access 'read write'
		comment.type INTEGER
		comment.count 2
		comment.range '0 - 31'
		comment.dbmin -3450
		comment.dbmax 1200
		iface MIXER
		name 'Dock Mic Playback Volume'
		value.0 0
		value.1 0
	}
	control.11 {
		comment.access 'read write'
		comment.type BOOLEAN
		comment.count 2
		iface MIXER
		name 'Dock Mic Playback Switch'
		value.0 false
		value.1 false
	}
	control.12 {
		comment.access 'read write'
		comment.type INTEGER
		comment.count 2
		comment.range '0 - 31'
		comment.dbmin -3450
		comment.dbmax 1200
		iface MIXER
		name 'Beep Playback Volume'
		value.0 18
		value.1 18
	}
	control.13 {
		comment.access 'read write'
		comment.type BOOLEAN
		comment.count 2
		iface MIXER
		name 'Beep Playback Switch'
		value.0 true
		value.1 true
	}
	control.14 {
		comment.access 'read write'
		comment.type INTEGER
		comment.count 2
		comment.range '0 - 3'
		comment.dbmin 0
		comment.dbmax 3000
		iface MIXER
		name 'Mic Boost'
		value.0 2
		value.1 2
	}
	control.15 {
		comment.access 'read write'
		comment.type INTEGER
		comment.count 2
		comment.range '0 - 3'
		comment.dbmin 0
		comment.dbmax 3000
		iface MIXER
		name 'Internal Mic Boost'
		value.0 2
		value.1 2
	}
	control.16 {
		comment.access 'read write'
		comment.type INTEGER
		comment.count 2
		comment.range '0 - 3'
		comment.dbmin 0
		comment.dbmax 3000
		iface MIXER
		name 'Dock Mic Boost'
		value.0 0
		value.1 0
	}
	control.17 {
		comment.access 'read write'
		comment.type INTEGER
		comment.count 2
		comment.range '0 - 54'
		comment.dbmin -5850
		comment.dbmax 2250
		iface MIXER
		name 'Capture Volume'
		value.0 52
		value.1 52
	}
	control.18 {
		comment.access 'read write'
		comment.type BOOLEAN
		comment.count 2
		iface MIXER
		name 'Capture Switch'
		value.0 true
		value.1 true
	}
	control.19 {
		comment.access 'read write'
		comment.type INTEGER
		comment.count 2
		comment.range '0 - 54'
		comment.dbmin -5850
		comment.dbmax 2250
		iface MIXER
		name 'Capture Volume'
		index 1
		value.0 0
		value.1 0
	}
	control.20 {
		comment.access 'read write'
		comment.type BOOLEAN
		comment.count 2
		iface MIXER
		name 'Capture Switch'
		index 1
		value.0 false
		value.1 false
	}
	control.21 {
		comment.access 'read write'
		comment.type ENUMERATED
		comment.count 1
		comment.item.0 Mic
		comment.item.1 'Internal Mic'
		comment.item.2 'Dock Mic'
		comment.item.3 Mix
		iface MIXER
		name 'Input Source'
		value 'Internal Mic'
	}
	control.22 {
		comment.access 'read write'
		comment.type ENUMERATED
		comment.count 1
		comment.item.0 Mic
		comment.item.1 'Internal Mic'
		comment.item.2 'Dock Mic'
		comment.item.3 Mix
		iface MIXER
		name 'Input Source'
		index 1
		value Mic
	}
	control.23 {
		comment.access 'read write user'
		comment.type INTEGER
		comment.count 2
		comment.range '0 - 120'
		comment.tlv '0000000100000008fffff44800000032'
		comment.dbmin -3000
		comment.dbmax 3000
		iface MIXER
		name 'Digital Capture Volume'
		value.0 60
		value.1 60
	}
}
--endcollapse--


!!All Loaded Modules
!!------------------

Module
nfs
lockd
nfs_acl
sunrpc
xt_physdev
af_packet
bridge
stp
bnep
sco
rfcomm
l2cap
bluetooth
ip6t_LOG
xt_tcpudp
xt_pkttype
ipt_LOG
xt_limit
snd_pcm_oss
snd_mixer_oss
binfmt_misc
snd_seq
snd_seq_device
ip6t_REJECT
nf_conntrack_ipv6
ip6table_raw
xt_NOTRACK
ipt_REJECT
xt_state
iptable_raw
iptable_filter
ip6table_mangle
nf_conntrack_netbios_ns
nf_conntrack_ipv4
nf_conntrack
ip_tables
ip6table_filter
ip6_tables
x_tables
ipv6
microcode
fuse
loop
dm_mod
snd_hda_intel
snd_pcm
snd_timer
snd_page_alloc
snd_hwdep
snd
video
battery
rtc_cmos
rtc_core
pcspkr
wmi
output
rtc_lib
ac
button
soundcore
container
serio_raw
sr_mod
intel_agp
joydev
sky2
cdrom
sg
uhci_hcd
sd_mod
crc_t10dif
ehci_hcd
usbcore
edd
ext3
mbcache
jbd
fan
ahci
libata
scsi_mod
dock
thermal
processor
thermal_sys
hwmon


