Codec: Analog Devices AD1988B
Address: 0
Vendor Id: 0x11d4198b
Subsystem Id: 0x104381f2
Revision Id: 0x100300
No Modem Function Group found
Default PCM:
    rates [0x7ff]: 8000 11025 16000 22050 32000 44100 48000 88200 96000 176400 192000
    bits [0xe]: 16 20 24
    formats [0x1]: PCM
Default Amp-In caps: ofs=0x00, nsteps=0x00, stepsize=0x00, mute=1
Default Amp-Out caps: ofs=0x27, nsteps=0x27, stepsize=0x05, mute=0
Node 0x02 [Audio Output] wcaps 0x30311: Stereo Digital
  PCM:
    rates [0x7e0]: 44100 48000 88200 96000 176400 192000
    bits [0xe]: 16 20 24
    formats [0x5]: PCM AC3
  Connection: 1
     0x1d
Node 0x03 [Audio Output] wcaps 0x405: Stereo Amp-Out
  Amp-Out caps: ofs=0x27, nsteps=0x27, stepsize=0x05, mute=0
  Amp-Out vals:  [0x27 0x27]
  Power: 0x0
Node 0x04 [Audio Output] wcaps 0x405: Stereo Amp-Out
  Amp-Out caps: ofs=0x27, nsteps=0x27, stepsize=0x05, mute=0
  Amp-Out vals:  [0x20 0x20]
  Power: 0x0
Node 0x05 [Audio Output] wcaps 0x405: Stereo Amp-Out
  Amp-Out caps: ofs=0x27, nsteps=0x27, stepsize=0x05, mute=0
  Amp-Out vals:  [0x20 0x11]
  Power: 0x0
Node 0x06 [Audio Output] wcaps 0x405: Stereo Amp-Out
  Amp-Out caps: ofs=0x27, nsteps=0x27, stepsize=0x05, mute=0
  Amp-Out vals:  [0x20 0x20]
  Power: 0x0
Node 0x07 [Audio Input] wcaps 0x130391: Stereo Digital
  PCM:
    rates [0x7e0]: 44100 48000 88200 96000 176400 192000
    bits [0xe]: 16 20 24
    formats [0x5]: PCM AC3
  Connection: 1
     0x1c
Node 0x08 [Audio Input] wcaps 0x100501: Stereo
  Power: 0x0
  Connection: 1
     0x0c
Node 0x09 [Audio Input] wcaps 0x100501: Stereo
  Power: 0x0
  Connection: 1
     0x0d
Node 0x0a [Audio Output] wcaps 0x405: Stereo Amp-Out
  Amp-Out caps: ofs=0x27, nsteps=0x27, stepsize=0x05, mute=0
  Amp-Out vals:  [0x1e 0x1e]
  Power: 0x0
Node 0x0b [Audio Selector] wcaps 0x300301: Stereo Digital
  Connection: 3
     0x08* 0x09 0x0f
Node 0x0c [Audio Selector] wcaps 0x30010d: Stereo Amp-Out
  Amp-Out caps: ofs=0x27, nsteps=0x36, stepsize=0x05, mute=1
  Amp-Out vals:  [0x80 0x80]
  Connection: 10
     0x38 0x39* 0x3a 0x3b 0x3c 0x18 0x24 0x25 0x3d 0x20
Node 0x0d [Audio Selector] wcaps 0x30010d: Stereo Amp-Out
  Amp-Out caps: ofs=0x27, nsteps=0x36, stepsize=0x05, mute=1
  Amp-Out vals:  [0x80 0x80]
  Connection: 10
     0x38 0x39* 0x3a 0x3b 0x3c 0x18 0x24 0x25 0x3d 0x20
Node 0x0e [Audio Selector] wcaps 0x30010d: Stereo Amp-Out
  Amp-Out caps: ofs=0x27, nsteps=0x36, stepsize=0x05, mute=1
  Amp-Out vals:  [0x80 0x80]
  Connection: 10
     0x38 0x39* 0x3a 0x3b 0x3c 0x18 0x24 0x25 0x3d 0x20
Node 0x0f [Audio Input] wcaps 0x100501: Stereo
  Power: 0x0
  Connection: 1
     0x0e
Node 0x10 [Beep Generator Widget] wcaps 0x70000c: Mono Amp-Out
  Amp-Out caps: ofs=0x0f, nsteps=0x0f, stepsize=0x0b, mute=1
  Amp-Out vals:  [0x00]
Node 0x11 [Pin Complex] wcaps 0x40018d: Stereo Amp-Out
  Amp-Out caps: ofs=0x00, nsteps=0x00, stepsize=0x00, mute=1
  Amp-Out vals:  [0x00 0x00]
  Pincap 0x08373f: IN OUT HP Detect
  Pin Default 0x02214030: [Jack] HP Out at Ext Front
    Conn = 1/8, Color = Green
  Pin-ctls: 0xc0: OUT HP
  Connection: 1
     0x22
Node 0x12 [Pin Complex] wcaps 0x40018d: Stereo Amp-Out
  Amp-Out caps: ofs=0x00, nsteps=0x00, stepsize=0x00, mute=1
  Amp-Out vals:  [0x00 0x00]
  Pincap 0x08373f: IN OUT HP Detect
  Pin Default 0x01014010: [Jack] Line Out at Ext Rear
    Conn = 1/8, Color = Green
  Pin-ctls: 0x40: OUT
  Connection: 1
     0x29
Node 0x13 [Pin Complex] wcaps 0x40010c: Mono Amp-Out
  Amp-Out caps: ofs=0x1f, nsteps=0x1f, stepsize=0x05, mute=1
  Amp-Out vals:  [0x00]
  Pincap 0x0810: OUT
  Pin Default 0x511711f0: [N/A] Speaker at Int Rear
    Conn = Analog, Color = Black
  Pin-ctls: 0x40: OUT
  Connection: 1
     0x2d
Node 0x14 [Pin Complex] wcaps 0x40018d: Stereo Amp-Out
  Amp-Out caps: ofs=0x00, nsteps=0x00, stepsize=0x00, mute=1
  Amp-Out vals:  [0x80 0x80]
  Pincap 0x08373f: IN OUT HP Detect
  Pin Default 0x02a1902e: [Jack] Mic at Ext Front
    Conn = 1/8, Color = Pink
  Pin-ctls: 0x24: IN
  Connection: 1
     0x2b
Node 0x15 [Pin Complex] wcaps 0x40018d: Stereo Amp-Out
  Amp-Out caps: ofs=0x00, nsteps=0x00, stepsize=0x00, mute=1
  Amp-Out vals:  [0x80 0x80]
  Pincap 0x083737: IN OUT Detect
  Pin Default 0x01813021: [Jack] Line In at Ext Rear
    Conn = 1/8, Color = Blue
  Pin-ctls: 0x20: IN
  Connection: 1
     0x2c
Node 0x16 [Pin Complex] wcaps 0x40018d: Stereo Amp-Out
  Amp-Out caps: ofs=0x00, nsteps=0x00, stepsize=0x00, mute=1
  Amp-Out vals:  [0x00 0x00]
  Pincap 0x083737: IN OUT Detect
  Pin Default 0x01011012: [Jack] Line Out at Ext Rear
    Conn = 1/8, Color = Black
  Pin-ctls: 0x40: OUT
  Connection: 1
     0x2a
Node 0x17 [Pin Complex] wcaps 0x40098d: Stereo Amp-Out
  Amp-Out caps: ofs=0x00, nsteps=0x00, stepsize=0x00, mute=1
  Amp-Out vals:  [0x80 0x80]
  Pincap 0x083737: IN OUT Detect
  Pin Default 0x01a19020: [Jack] Mic at Ext Rear
    Conn = 1/8, Color = Pink
  Pin-ctls: 0x24: IN
  Connection: 1
     0x26
Node 0x18 [Pin Complex] wcaps 0x400001: Stereo
  Pincap 0x0820: IN
  Pin Default 0x99331122: [Fixed] CD at Int ATAPI
    Conn = ATAPI, Color = Black
  Pin-ctls: 0x00:
Node 0x19 [Power Widget] wcaps 0x500500: Mono
  Power: 0x0
  Connection: 2
     0x20* 0x21
Node 0x1a [Pin Complex] wcaps 0x400000: Mono
  Pincap 0x0820: IN
  Pin Default 0x51f711f0: [N/A] Other at Int Rear
    Conn = Analog, Color = Black
  Pin-ctls: 0x20: IN
Node 0x1b [Pin Complex] wcaps 0x40030d: Stereo Digital Amp-Out
  Amp-Out caps: ofs=0x27, nsteps=0x27, stepsize=0x05, mute=1
  Amp-Out vals:  [0x27 0x27]
  Pincap 0x0810: OUT
  Pin Default 0x0145f1f0: [Jack] SPDIF Out at Ext Rear
    Conn = Optical, Color = Other
  Pin-ctls: 0x40: OUT
  Connection: 1
     0x02
Node 0x1c [Pin Complex] wcaps 0x40020b: Stereo Digital Amp-In
  Amp-In caps: ofs=0x17, nsteps=0x1f, stepsize=0x05, mute=1
  Amp-In vals: 
  Pincap 0x0820: IN
  Pin Default 0x41c5f1f0: [N/A] SPDIF In at Ext Rear
    Conn = Optical, Color = Other
  Pin-ctls: 0x20: IN
Node 0x1d [Audio Mixer] wcaps 0x200303: Stereo Digital Amp-In
  Amp-In caps: ofs=0x00, nsteps=0x00, stepsize=0x00, mute=1
  Amp-In vals:  [0x00 0x00] [0x00 0x00]
  Connection: 2
     0x01 0x0b
Node 0x1e [Audio Mixer] wcaps 0x200103: Stereo Amp-In
  Amp-In caps: ofs=0x00, nsteps=0x00, stepsize=0x00, mute=1
  Amp-In vals:  [0x80 0x80] [0x80 0x80]
  Connection: 2
     0x36 0x21
Node 0x1f [Volume Knob Widget] wcaps 0x600080: Mono
Node 0x20 [Audio Mixer] wcaps 0x20010b: Stereo Amp-In
  Amp-In caps: ofs=0x17, nsteps=0x1f, stepsize=0x05, mute=1
  Amp-In vals:  [0x80 0x80] [0x80 0x80] [0x80 0x80] [0x80 0x80] [0x80 0x80] [0x80 0x80] [0x96 0x96] [0x80 0x80]
  Connection: 8
     0x39 0x33 0x38 0x3d 0x34 0x3b 0x18 0x1a
Node 0x21 [Audio Selector] wcaps 0x30010d: Stereo Amp-Out
  Amp-Out caps: ofs=0x1f, nsteps=0x1f, stepsize=0x05, mute=1
  Amp-Out vals:  [0x80 0x80]
  Connection: 1
     0x20
Node 0x22 [Audio Mixer] wcaps 0x200103: Stereo Amp-In
  Amp-In caps: ofs=0x00, nsteps=0x00, stepsize=0x00, mute=1
  Amp-In vals:  [0x80 0x80] [0x80 0x80]
  Connection: 2
     0x37 0x21
Node 0x23 [Vendor Defined Widget] wcaps 0xf00100: Mono
  Connection: 18
     0x11* 0x12 0x13 0x14 0x15 0x16 0x17 0x18 0x24 0x25 0x38 0x39 0x3a 0x3b 0x3c 0x3d 0x20 0x21
Node 0x24 [Pin Complex] wcaps 0x40098d: Stereo Amp-Out
  Amp-Out caps: ofs=0x00, nsteps=0x00, stepsize=0x00, mute=1
  Amp-Out vals:  [0x00 0x00]
  Pincap 0x0837: IN OUT Detect
  Pin Default 0x01016011: [Jack] Line Out at Ext Rear
    Conn = 1/8, Color = Orange
  Pin-ctls: 0x40: OUT
  Connection: 1
     0x27
Node 0x25 [Pin Complex] wcaps 0x40018d: Stereo Amp-Out
  Amp-Out caps: ofs=0x00, nsteps=0x00, stepsize=0x00, mute=1
  Amp-Out vals:  [0x00 0x00]
  Pincap 0x0837: IN OUT Detect
  Pin Default 0x01012014: [Jack] Line Out at Ext Rear
    Conn = 1/8, Color = Grey
  Pin-ctls: 0x40: OUT
  Connection: 1
     0x28
Node 0x26 [Audio Mixer] wcaps 0x200103: Stereo Amp-In
  Amp-In caps: ofs=0x00, nsteps=0x00, stepsize=0x00, mute=1
  Amp-In vals:  [0x80 0x80] [0x80 0x80]
  Connection: 2
     0x32 0x21
Node 0x27 [Audio Mixer] wcaps 0x200103: Stereo Amp-In
  Amp-In caps: ofs=0x00, nsteps=0x00, stepsize=0x00, mute=1
  Amp-In vals:  [0x00 0x00] [0x00 0x00]
  Connection: 2
     0x05 0x21
Node 0x28 [Audio Mixer] wcaps 0x200103: Stereo Amp-In
  Amp-In caps: ofs=0x00, nsteps=0x00, stepsize=0x00, mute=1
  Amp-In vals:  [0x80 0x80] [0x80 0x80]
  Connection: 2
     0x0a 0x21
Node 0x29 [Audio Mixer] wcaps 0x200103: Stereo Amp-In
  Amp-In caps: ofs=0x00, nsteps=0x00, stepsize=0x00, mute=1
  Amp-In vals:  [0x00 0x00] [0x00 0x00]
  Connection: 2
     0x04 0x21
Node 0x2a [Audio Mixer] wcaps 0x200103: Stereo Amp-In
  Amp-In caps: ofs=0x00, nsteps=0x00, stepsize=0x00, mute=1
  Amp-In vals:  [0x00 0x00] [0x00 0x00]
  Connection: 2
     0x06 0x21
Node 0x2b [Audio Mixer] wcaps 0x200103: Stereo Amp-In
  Amp-In caps: ofs=0x00, nsteps=0x00, stepsize=0x00, mute=1
  Amp-In vals:  [0x80 0x80] [0x80 0x80]
  Connection: 2
     0x30 0x21
Node 0x2c [Audio Mixer] wcaps 0x200103: Stereo Amp-In
  Amp-In caps: ofs=0x00, nsteps=0x00, stepsize=0x00, mute=1
  Amp-In vals:  [0x80 0x80] [0x80 0x80]
  Connection: 2
     0x31 0x21
Node 0x2d [Audio Mixer] wcaps 0x200100: Mono
  Connection: 1
     0x1e
Node 0x2e [Vendor Defined Widget] wcaps 0xf00000: Mono
Node 0x2f [Vendor Defined Widget] wcaps 0xf00100: Mono
  Connection: 6
     0x11* 0x12 0x14 0x15 0x16 0x17
Node 0x30 [Audio Selector] wcaps 0x300101: Stereo
  Connection: 3
     0x03* 0x04 0x06
Node 0x31 [Audio Selector] wcaps 0x300101: Stereo
  Connection: 2
     0x04* 0x0a
Node 0x32 [Audio Selector] wcaps 0x300101: Stereo
  Connection: 2
     0x05* 0x04
Node 0x33 [Audio Selector] wcaps 0x300101: Stereo
  Connection: 3
     0x3a* 0x25 0x24
Node 0x34 [Audio Selector] wcaps 0x300101: Stereo
  Connection: 3
     0x3c* 0x25 0x24
Node 0x35 [Vendor Defined Widget] wcaps 0xf00000: Mono
Node 0x36 [Audio Selector] wcaps 0x300101: Stereo
  Connection: 3
     0x03 0x04* 0x06
Node 0x37 [Audio Selector] wcaps 0x300101: Stereo
  Connection: 3
     0x03 0x04* 0x06
Node 0x38 [Audio Selector] wcaps 0x30010d: Stereo Amp-Out
  Amp-Out caps: ofs=0x00, nsteps=0x03, stepsize=0x27, mute=0
  Amp-Out vals:  [0x00 0x00]
  Connection: 1
     0x11
Node 0x39 [Audio Selector] wcaps 0x30010d: Stereo Amp-Out
  Amp-Out caps: ofs=0x00, nsteps=0x03, stepsize=0x27, mute=0
  Amp-Out vals:  [0x00 0x00]
  Connection: 1
     0x14
Node 0x3a [Audio Selector] wcaps 0x30010d: Stereo Amp-Out
  Amp-Out caps: ofs=0x00, nsteps=0x03, stepsize=0x27, mute=0
  Amp-Out vals:  [0x00 0x00]
  Connection: 1
     0x15
Node 0x3b [Audio Selector] wcaps 0x30010d: Stereo Amp-Out
  Amp-Out caps: ofs=0x00, nsteps=0x03, stepsize=0x27, mute=0
  Amp-Out vals:  [0x00 0x00]
  Connection: 1
     0x16
Node 0x3c [Audio Selector] wcaps 0x30010d: Stereo Amp-Out
  Amp-Out caps: ofs=0x00, nsteps=0x03, stepsize=0x27, mute=0
  Amp-Out vals:  [0x00 0x00]
  Connection: 1
     0x17
Node 0x3d [Audio Selector] wcaps 0x30010d: Stereo Amp-Out
  Amp-Out caps: ofs=0x00, nsteps=0x03, stepsize=0x27, mute=0
  Amp-Out vals:  [0x00 0x00]
  Connection: 1
     0x12
NVidia
VOLUME "Front" 0
BASS "" 0
TREBLE "" 0
SYNTH "" 0
PCM "" 0
SPEAKER "" 0
LINE "Line" 0
MIC "Mic" 0
CD "CD" 0
IMIX "" 0
ALTPCM "Headphone" 0
RECLEV "" 0
IGAIN "Capture" 0
OGAIN "" 0
LINE1 "" 0
LINE2 "" 0
LINE3 "" 0
DIGITAL1 "IEC958" 0
DIGITAL2 "" 0
DIGITAL3 "" 0
PHONEIN "" 0
PHONEOUT "" 0
VIDEO "" 0
RADIO "" 0
MONITOR "" 0
