upload=true&script=true&cardinfo=
!!################################
!!ALSA Information Script v 0.4.56
!!################################

!!Script ran on: Tue Jun 23 11:23:57 UTC 2009


!!Linux Distribution
!!------------------

Ubuntu 8.10 \n \l DISTRIB_ID=Ubuntu DISTRIB_DESCRIPTION="Ubuntu 8.10"


!!DMI Information
!!---------------

Manufacturer:      SAMSUNG ELECTRONICS CO., LTD.
Product Name:      SP50S


!!Kernel Information
!!------------------

Kernel release:    2.6.27-14-generic
Operating System:  GNU/Linux
Architecture:      i686
Processor:         unknown
SMP Enabled:       Yes


!!ALSA Version
!!------------

Driver version:     1.0.20
Library version:    1.0.20
Utilities version:  1.0.20


!!Loaded ALSA modules
!!-------------------

snd_hda_intel


!!Sound Servers on this system
!!----------------------------

aRts:
      Installed - Yes (/usr/bin/artsd)
      Running - No


!!Soundcards recognised by ALSA
!!-----------------------------

 0 [Intel          ]: HDA-Intel - HDA Intel
                      HDA Intel at 0xde400000 irq 22


!!PCI Soundcards installed in the system
!!--------------------------------------

00:1b.0 Audio device: Intel Corporation 82801G (ICH7 Family) High Definition Audio Controller (rev 02)


!!Advanced information - PCI Vendor/Device/Susbsystem ID's
!!--------------------------------------------------------

00:1b.0 0403: 8086:27d8 (rev 02)
	Subsystem: 144d:c024


!!Modprobe options (Sound related)
!!--------------------------------

snd-atiixp-modem: index=-2
snd-intel8x0m: index=-2
snd-via82xx-modem: index=-2
snd-usb-audio: index=-2
snd-usb-usx2y: index=-2
snd-usb-caiaq: index=-2
snd-cmipci: mpu_port=0x330 fm_port=0x388
snd-pcsp: index=-2


!!Loaded sound module options
!!--------------------------

!!Module: snd_hda_intel
bdl_pos_adj : 1,-1,-1,-1,-1,-1,-1,-1
enable : Y,Y,Y,Y,Y,Y,Y,Y
enable_msi : 0
id : <NULL>,<NULL>,<NULL>,<NULL>,<NULL>,<NULL>,<NULL>,<NULL>
index : -1,-1,-1,-1,-1,-1,-1,-1
model : <NULL>,<NULL>,<NULL>,<NULL>,<NULL>,<NULL>,<NULL>,<NULL>
position_fix : 0,0,0,0,0,0,0,0
power_save : 0
power_save_controller : Y
probe_mask : -1,-1,-1,-1,-1,-1,-1,-1
probe_only : N,N,N,N,N,N,N,N
single_cmd : N


!!HDA-Intel Codec information
!!---------------------------
--startcollapse--

Codec: Analog Devices AD1986A
Address: 0
Function Id: 0x1
Vendor Id: 0x11d41986
Subsystem Id: 0x144dc024
Revision Id: 0x100500
No Modem Function Group found
Default PCM:
    rates [0x7f]: 8000 11025 16000 22050 32000 44100 48000
    bits [0xe]: 16 20 24
    formats [0x1]: PCM
Default Amp-In caps: ofs=0x00, nsteps=0x00, stepsize=0x00, mute=1
Default Amp-Out caps: ofs=0x1f, nsteps=0x1f, stepsize=0x05, mute=1
GPIO: io=0, o=1, i=0, unsolicited=0, wake=0
Node 0x02 [Audio Output] wcaps 0x30311: Stereo Digital
  Converter: stream=5, channel=0
  Digital:
  Digital category: 0x0
  PCM:
    rates [0x60]: 44100 48000
    bits [0x2]: 16
    formats [0x5]: PCM AC3
  Delay: 3 samples
  Connection: 2
     0x01* 0x06
Node 0x03 [Audio Output] wcaps 0x44d: Stereo Amp-Out
  Amp-Out caps: ofs=0x17, nsteps=0x1f, stepsize=0x05, mute=1
  Amp-Out vals:  [0x1d 0x1d]
  Converter: stream=5, channel=0
  Power: setting=D0, actual=D0
  Processing caps: benign=1, ncoeff=70
Node 0x04 [Audio Output] wcaps 0x40d: Stereo Amp-Out
  Amp-Out caps: ofs=0x17, nsteps=0x1f, stepsize=0x05, mute=1
  Amp-Out vals:  [0x80 0x80]
  Converter: stream=1, channel=0
  Power: setting=D0, actual=D0
Node 0x05 [Audio Output] wcaps 0x40d: Stereo Amp-Out
  Amp-Out caps: ofs=0x17, nsteps=0x1f, stepsize=0x05, mute=1
  Amp-Out vals:  [0x80 0x80]
  Converter: stream=0, channel=0
  Power: setting=D0, actual=D0
Node 0x06 [Audio Input] wcaps 0x100511: Stereo
  Converter: stream=0, channel=0
  SDI-Select: 0
  PCM:
    rates [0x7f]: 8000 11025 16000 22050 32000 44100 48000
    bits [0x6]: 16 20
    formats [0x1]: PCM
  Power: setting=D0, actual=D0
  Connection: 1
     0x12
Node 0x07 [Audio Mixer] wcaps 0x200101: Stereo
  Connection: 8
     0x03 0x09 0x13 0x14 0x15 0x16 0x17 0x18
Node 0x08 [Audio Mixer] wcaps 0x200100: Mono
  Connection: 1
     0x07
Node 0x09 [Audio Mixer] wcaps 0x20010e: Mono Amp-In Amp-Out
  Amp-In caps: ofs=0x00, nsteps=0x00, stepsize=0x00, mute=1
  Amp-In vals:  [0x80] [0x80]
  Amp-Out caps: ofs=0x00, nsteps=0x00, stepsize=0x00, mute=1
  Amp-Out vals:  [0x80]
  Connection: 2
     0x04 0x05
Node 0x0a [Audio Selector] wcaps 0x300101: Stereo
  Connection: 3
     0x07* 0x04 0x05
Node 0x0b [Audio Selector] wcaps 0x300101: Stereo
  Connection: 2
     0x07* 0x04
Node 0x0c [Audio Selector] wcaps 0x300101: Stereo
  Connection: 2
     0x04* 0x07
Node 0x0d [Audio Selector] wcaps 0x300101: Stereo
  Connection: 2
     0x05* 0x08
Node 0x0e [Audio Selector] wcaps 0x300100: Mono
  Connection: 2
     0x08* 0x11
Node 0x0f [Audio Selector] wcaps 0x30010d: Stereo Amp-Out
  Amp-Out caps: ofs=0x00, nsteps=0x03, stepsize=0x27, mute=0
  Amp-Out vals:  [0x00 0x00]
  Connection: 8
     0x1f 0x20 0x1d* 0x1d 0x27 0x28 0x29 0x2a
Node 0x10 [Audio Selector] wcaps 0x300101: Stereo
  Connection: 3
     0x20* 0x1c 0x1f
Node 0x11 [Audio Selector] wcaps 0x300941: Stereo R/L
  Connection: 2
     0x0f* 0x2b
  Processing caps: benign=1, ncoeff=0
Node 0x12 [Audio Selector] wcaps 0x30010d: Stereo Amp-Out
  Amp-Out caps: ofs=0x00, nsteps=0x0f, stepsize=0x05, mute=1
  Amp-Out vals:  [0x80 0x80]
  Connection: 8
     0x11* 0x22 0x00 0x21 0x10 0x07 0x08 0x23
Node 0x13 [Audio Selector] wcaps 0x30010d: Stereo Amp-Out
  Amp-Out caps: ofs=0x17, nsteps=0x1f, stepsize=0x05, mute=1
  Amp-Out vals:  [0x80 0x80]
  Connection: 1
     0x11
Node 0x14 [Audio Selector] wcaps 0x30010c: Mono Amp-Out
  Amp-Out caps: ofs=0x17, nsteps=0x1f, stepsize=0x05, mute=1
  Amp-Out vals:  [0x80]
  Connection: 1
     0x23
Node 0x15 [Audio Selector] wcaps 0x30010d: Stereo Amp-Out
  Amp-Out caps: ofs=0x17, nsteps=0x1f, stepsize=0x05, mute=1
  Amp-Out vals:  [0x80 0x80]
  Connection: 1
     0x22
Node 0x16 [Audio Selector] wcaps 0x30010d: Stereo Amp-Out
  Amp-Out caps: ofs=0x17, nsteps=0x1f, stepsize=0x05, mute=1
  Amp-Out vals:  [0x80 0x80]
  Connection: 1
     0x21
Node 0x17 [Audio Selector] wcaps 0x30010d: Stereo Amp-Out
  Amp-Out caps: ofs=0x17, nsteps=0x1f, stepsize=0x05, mute=1
  Amp-Out vals:  [0x80 0x80]
  Connection: 1
     0x10
Node 0x18 [Audio Selector] wcaps 0x30010c: Mono Amp-Out
  Amp-Out caps: ofs=0x0f, nsteps=0x0f, stepsize=0x0b, mute=1
  Amp-Out vals:  [0x80]
  Connection: 2
     0x19* 0x24
Node 0x19 [Beep Generator Widget] wcaps 0x700000: Mono
Node 0x1a [Pin Complex] wcaps 0x400185: Stereo Amp-Out
  Amp-Out caps: ofs=0x1f, nsteps=0x1f, stepsize=0x05, mute=1
  Amp-Out vals:  [0x05 0x05]
  Pincap 0x0000001f: OUT HP Detect Trigger ImpSense
  Pin Default 0x02214021: [Jack] HP Out at Ext Front
    Conn = 1/8, Color = Green
    DefAssociation = 0x2, Sequence = 0x1
  Pin-ctls: 0xc0: OUT HP
  Unsolicited: tag=00, enabled=0
  Connection: 1
     0x0a
Node 0x1b [Pin Complex] wcaps 0x400185: Stereo Amp-Out
  Amp-Out caps: ofs=0x1f, nsteps=0x1f, stepsize=0x05, mute=1
  Amp-Out vals:  [0x05 0x05]
  Pincap 0x0001001f: OUT HP EAPD Detect Trigger ImpSense
  EAPD 0x0:
  Pin Default 0x01014011: [Jack] Line Out at Ext Rear
    Conn = 1/8, Color = Green
    DefAssociation = 0x1, Sequence = 0x1
  Pin-ctls: 0x40: OUT
  Unsolicited: tag=00, enabled=0
  Connection: 1
     0x0b
Node 0x1c [Pin Complex] wcaps 0x400185: Stereo Amp-Out
  Amp-Out caps: ofs=0x1f, nsteps=0x1f, stepsize=0x05, mute=1
  Amp-Out vals:  [0x80 0x80]
  Pincap 0x00000037: IN OUT Detect Trigger ImpSense
  Pin Default 0x41013012: [N/A] Line Out at Ext Rear
    Conn = 1/8, Color = Blue
    DefAssociation = 0x1, Sequence = 0x2
  Pin-ctls: 0x40: OUT
  Unsolicited: tag=00, enabled=0
  Connection: 1
     0x0c
Node 0x1d [Pin Complex] wcaps 0x400985: Stereo Amp-Out R/L
  Amp-Out caps: ofs=0x1f, nsteps=0x1f, stepsize=0x05, mute=1
  Amp-Out vals:  [0x80 0x80]
  Pincap 0x00001737: IN OUT Detect Trigger ImpSense
    Vref caps: HIZ 50 GRD 80
  Pin Default 0x01019015: [Jack] Line Out at Ext Rear
    Conn = 1/8, Color = Pink
    DefAssociation = 0x1, Sequence = 0x5
  Pin-ctls: 0x24: IN VREF_80
  Unsolicited: tag=00, enabled=0
  Connection: 1
     0x0d
Node 0x1e [Pin Complex] wcaps 0x400104: Mono Amp-Out
  Amp-Out caps: ofs=0x1f, nsteps=0x1f, stepsize=0x05, mute=1
  Amp-Out vals:  [0x80]
  Pincap 0x00000010: OUT
  Pin Default 0x511710f0: [N/A] Speaker at Int Rear
    Conn = Analog, Color = Black
    DefAssociation = 0xf, Sequence = 0x0
  Pin-ctls: 0x40: OUT
  Connection: 1
     0x0e
Node 0x1f [Pin Complex] wcaps 0x400081: Stereo
  Pincap 0x00001727: IN Detect Trigger ImpSense
    Vref caps: HIZ 50 GRD 80
  Pin Default 0x02a190f0: [Jack] Mic at Ext Front
    Conn = 1/8, Color = Pink
    DefAssociation = 0xf, Sequence = 0x0
  Pin-ctls: 0x24: IN VREF_80
  Unsolicited: tag=36, enabled=1
Node 0x20 [Pin Complex] wcaps 0x400081: Stereo
  Pincap 0x00001727: IN Detect Trigger ImpSense
    Vref caps: HIZ 50 GRD 80
  Pin Default 0x018130f0: [Jack] Line In at Ext Rear
    Conn = 1/8, Color = Blue
    DefAssociation = 0xf, Sequence = 0x0
  Pin-ctls: 0x20: IN VREF_HIZ
  Unsolicited: tag=00, enabled=0
Node 0x21 [Pin Complex] wcaps 0x400081: Stereo
  Pincap 0x00000027: IN Detect Trigger ImpSense
  Pin Default 0x5997e0f0: [N/A] Aux at Int ATAPI
    Conn = Analog, Color = White
    DefAssociation = 0xf, Sequence = 0x0
  Pin-ctls: 0x20: IN
  Unsolicited: tag=00, enabled=0
Node 0x22 [Pin Complex] wcaps 0x400001: Stereo
  Pincap 0x00000020: IN
  Pin Default 0x593310f0: [N/A] CD at Int ATAPI
    Conn = ATAPI, Color = Black
    DefAssociation = 0xf, Sequence = 0x0
  Pin-ctls: 0x20: IN
Node 0x23 [Pin Complex] wcaps 0x400000: Mono
  Pincap 0x00000020: IN
  Pin Default 0x59b770f0: [N/A] Telephony at Int ATAPI
    Conn = Analog, Color = Yellow
    DefAssociation = 0xf, Sequence = 0x0
  Pin-ctls: 0x20: IN
Node 0x24 [Pin Complex] wcaps 0x400000: Mono
  Pincap 0x00000020: IN
  Pin Default 0x91f710f0: [Fixed] Other at Int Rear
    Conn = Analog, Color = Black
    DefAssociation = 0xf, Sequence = 0x0
  Pin-ctls: 0x20: IN
Node 0x25 [Pin Complex] wcaps 0x400301: Stereo Digital
  Pincap 0x00000010: OUT
  Pin Default 0x0145f0f0: [Jack] SPDIF Out at Ext Rear
    Conn = Optical, Color = Other
    DefAssociation = 0xf, Sequence = 0x0
  Pin-ctls: 0x40: OUT
  Connection: 1
     0x02
Node 0x26 [Power Widget] wcaps 0x500500: Mono
  Power: setting=D0, actual=D0
  Connection: 8
     0x07 0x08 0x13 0x14 0x15 0x16 0x17 0x18
Node 0x27 [Audio Mixer] wcaps 0x200101: Stereo
  Connection: 2
     0x1f 0x1d
Node 0x28 [Audio Mixer] wcaps 0x200101: Stereo
  Connection: 2
     0x1f 0x20
Node 0x29 [Audio Mixer] wcaps 0x200101: Stereo
  Connection: 2
     0x1d 0x20
Node 0x2a [Audio Mixer] wcaps 0x200101: Stereo
  Connection: 3
     0x1f 0x1d 0x20
Node 0x2b [Audio Mixer] wcaps 0x200100: Mono
  Connection: 1
     0x0f
Codec: LSI Si3054
Address: 1
Function Id: 0x2
Vendor Id: 0x11c13026
Subsystem Id: 0x2117144d
Revision Id: 0x100700
Modem Function Group: 0x1
--endcollapse--


!!ALSA Device nodes
!!-----------------

crw-rw----+ 1 root audio 116,  0 Jun 23 11:49 /dev/snd/controlC0
crw-rw----+ 1 root audio 116,  4 Jun 23 11:49 /dev/snd/hwC0D0
crw-rw----+ 1 root audio 116,  5 Jun 23 11:49 /dev/snd/hwC0D1
crw-rw----+ 1 root audio 116, 24 Jun 23 11:49 /dev/snd/pcmC0D0c
crw-rw----+ 1 root audio 116, 16 Jun 23 13:05 /dev/snd/pcmC0D0p
crw-rw----+ 1 root audio 116, 17 Jun 23 11:49 /dev/snd/pcmC0D1p
crw-rw----+ 1 root audio 116, 30 Jun 23 11:49 /dev/snd/pcmC0D6c
crw-rw----+ 1 root audio 116, 22 Jun 23 11:49 /dev/snd/pcmC0D6p
crw-rw----+ 1 root audio 116,  1 Jun 23 11:49 /dev/snd/seq
crw-rw----+ 1 root audio 116, 33 Jun 23 11:49 /dev/snd/timer


!!Aplay/Arecord output
!!------------

APLAY

**** List of PLAYBACK Hardware Devices ****
card 0: Intel [HDA Intel], device 0: AD198x Analog [AD198x Analog]
  Subdevices: 0/1
  Subdevice #0: subdevice #0
card 0: Intel [HDA Intel], device 1: AD198x Digital [AD198x Digital]
  Subdevices: 1/1
  Subdevice #0: subdevice #0
card 0: Intel [HDA Intel], device 6: Si3054 Modem [Si3054 Modem]
  Subdevices: 1/1
  Subdevice #0: subdevice #0

ARECORD

**** List of CAPTURE Hardware Devices ****
card 0: Intel [HDA Intel], device 0: AD198x Analog [AD198x Analog]
  Subdevices: 1/1
  Subdevice #0: subdevice #0
card 0: Intel [HDA Intel], device 6: Si3054 Modem [Si3054 Modem]
  Subdevices: 1/1
  Subdevice #0: subdevice #0

!!Amixer output
!!-------------

!!-------Mixer controls for card 0 [Intel]

Card hw:0 'Intel'/'HDA Intel at 0xde400000 irq 22'
  Mixer name	: 'Analog Devices AD1986A'
  Components	: 'HDA:11d41986,144dc024,00100500 HDA:11c13026,2117144d,00100700'
  Controls      : 21
  Simple ctrls  : 13
Simple mixer control 'Master',0
  Capabilities: pvolume pswitch
  Playback channels: Front Left - Front Right
  Limits: Playback 0 - 31
  Mono:
  Front Left: Playback 5 [16%] [-39.00dB] [on]
  Front Right: Playback 5 [16%] [-39.00dB] [on]
Simple mixer control 'PCM',0
  Capabilities: pvolume pswitch
  Playback channels: Front Left - Front Right
  Limits: Playback 0 - 31
  Mono:
  Front Left: Playback 29 [94%] [9.00dB] [on]
  Front Right: Playback 29 [94%] [9.00dB] [on]
Simple mixer control 'Mic',0
  Capabilities: pvolume pswitch cswitch cswitch-joined cswitch-exclusive
  Capture exclusive group: 0
  Playback channels: Front Left - Front Right
  Capture channels: Mono
  Limits: Playback 0 - 31
  Mono: Capture [on]
  Front Left: Playback 0 [0%] [-34.50dB] [off]
  Front Right: Playback 0 [0%] [-34.50dB] [off]
Simple mixer control 'Mic Boost',0
  Capabilities: volume
  Playback channels: Front Left - Front Right
  Capture channels: Front Left - Front Right
  Limits: 0 - 3
  Front Left: 0 [0%]
  Front Right: 0 [0%]
Simple mixer control 'IEC958',0
  Capabilities: pswitch pswitch-joined
  Playback channels: Mono
  Mono: Playback [off]
Simple mixer control 'IEC958 Default PCM',0
  Capabilities: pswitch pswitch-joined
  Playback channels: Mono
  Mono: Playback [on]
Simple mixer control 'Capture',0
  Capabilities: cvolume cswitch
  Capture channels: Front Left - Front Right
  Limits: Capture 0 - 15
  Front Left: Capture 0 [0%] [0.00dB] [off]
  Front Right: Capture 0 [0%] [0.00dB] [off]
Simple mixer control 'Mix',0
  Capabilities: cswitch cswitch-joined cswitch-exclusive
  Capture exclusive group: 0
  Capture channels: Mono
  Mono: Capture [off]
Simple mixer control 'Beep',0
  Capabilities: pvolume pvolume-joined pswitch pswitch-joined
  Playback channels: Mono
  Limits: Playback 0 - 15
  Mono: Playback 0 [0%] [-45.00dB] [on]
Simple mixer control 'Caller ID',0
  Capabilities: pswitch pswitch-joined
  Playback channels: Mono
  Mono: Playback [off]
Simple mixer control 'Digital',0
  Capabilities: cvolume
  Capture channels: Front Left - Front Right
  Limits: Capture 0 - 120
  Front Left: Capture 0 [0%] [-30.00dB]
  Front Right: Capture 0 [0%] [-30.00dB]
Simple mixer control 'External Amplifier',0
  Capabilities: pswitch pswitch-joined
  Playback channels: Mono
  Mono: Playback [on]
Simple mixer control 'Off-hook',0
  Capabilities: pswitch pswitch-joined
  Playback channels: Mono
  Mono: Playback [off]


!!Alsactl output
!!-------------

--startcollapse--
state.Intel {
	control.1 {
		comment.access 'read write'
		comment.type INTEGER
		comment.count 2
		comment.range '0 - 31'
		comment.dbmin -4650
		comment.dbmax 0
		iface MIXER
		name 'Master Playback Volume'
		value.0 5
		value.1 5
	}
	control.2 {
		comment.access 'read write'
		comment.type BOOLEAN
		comment.count 2
		iface MIXER
		name 'Master Playback Switch'
		value.0 true
		value.1 true
	}
	control.3 {
		comment.access 'read write'
		comment.type INTEGER
		comment.count 2
		comment.range '0 - 31'
		comment.dbmin -3450
		comment.dbmax 1200
		iface MIXER
		name 'PCM Playback Volume'
		value.0 29
		value.1 29
	}
	control.4 {
		comment.access 'read write'
		comment.type BOOLEAN
		comment.count 2
		iface MIXER
		name 'PCM Playback Switch'
		value.0 true
		value.1 true
	}
	control.5 {
		comment.access 'read write'
		comment.type INTEGER
		comment.count 2
		comment.range '0 - 31'
		comment.dbmin -3450
		comment.dbmax 1200
		iface MIXER
		name 'Mic Playback Volume'
		value.0 0
		value.1 0
	}
	control.6 {
		comment.access 'read write'
		comment.type BOOLEAN
		comment.count 2
		iface MIXER
		name 'Mic Playback Switch'
		value.0 false
		value.1 false
	}
	control.7 {
		comment.access 'read write'
		comment.type INTEGER
		comment.count 2
		comment.range '0 - 3'
		comment.dbmin 0
		comment.dbmax 3000
		iface MIXER
		name 'Mic Boost'
		value.0 0
		value.1 0
	}
	control.8 {
		comment.access 'read write'
		comment.type INTEGER
		comment.count 2
		comment.range '0 - 15'
		comment.dbmin 0
		comment.dbmax 2250
		iface MIXER
		name 'Capture Volume'
		value.0 0
		value.1 0
	}
	control.9 {
		comment.access 'read write'
		comment.type BOOLEAN
		comment.count 2
		iface MIXER
		name 'Capture Switch'
		value.0 false
		value.1 false
	}
	control.10 {
		comment.access 'read write'
		comment.type ENUMERATED
		comment.count 1
		comment.item.0 Mic
		comment.item.1 Mix
		iface MIXER
		name 'Capture Source'
		value Mic
	}
	control.11 {
		comment.access 'read write'
		comment.type BOOLEAN
		comment.count 1
		iface MIXER
		name 'External Amplifier'
		value true
	}
	control.12 {
		comment.access read
		comment.type IEC958
		comment.count 1
		iface MIXER
		name 'IEC958 Playback Con Mask'
		value '0fff000000000000000000000000000000000000000000000000000000000000000000000000000000000000000000000000000000000000000000000000000000000000000000000000000000000000000000000000000000000000000000000000000000000000000000000000000000000000000000000000000000000000000000000000000000000000000000000000000000000000000000000000000000000000000000000000000000000000'
	}
	control.13 {
		comment.access read
		comment.type IEC958
		comment.count 1
		iface MIXER
		name 'IEC958 Playback Pro Mask'
		value '0f00000000000000000000000000000000000000000000000000000000000000000000000000000000000000000000000000000000000000000000000000000000000000000000000000000000000000000000000000000000000000000000000000000000000000000000000000000000000000000000000000000000000000000000000000000000000000000000000000000000000000000000000000000000000000000000000000000000000000'
	}
	control.14 {
		comment.access 'read write'
		comment.type IEC958
		comment.count 1
		iface MIXER
		name 'IEC958 Playback Default'
		value '0400000000000000000000000000000000000000000000000000000000000000000000000000000000000000000000000000000000000000000000000000000000000000000000000000000000000000000000000000000000000000000000000000000000000000000000000000000000000000000000000000000000000000000000000000000000000000000000000000000000000000000000000000000000000000000000000000000000000000'
	}
	control.15 {
		comment.access 'read write'
		comment.type BOOLEAN
		comment.count 1
		iface MIXER
		name 'IEC958 Playback Switch'
		value false
	}
	control.16 {
		comment.access 'read write'
		comment.type BOOLEAN
		comment.count 1
		iface MIXER
		name 'IEC958 Default PCM Playback Switch'
		value true
	}
	control.17 {
		comment.access 'read write'
		comment.type INTEGER
		comment.count 1
		comment.range '0 - 15'
		comment.dbmin -4500
		comment.dbmax 0
		iface MIXER
		name 'Beep Playback Volume'
		value 0
	}
	control.18 {
		comment.access 'read write'
		comment.type BOOLEAN
		comment.count 1
		iface MIXER
		name 'Beep Playback Switch'
		value true
	}
	control.19 {
		comment.access 'read write'
		comment.type BOOLEAN
		comment.count 1
		iface MIXER
		name 'Off-hook Switch'
		value false
	}
	control.20 {
		comment.access 'read write'
		comment.type BOOLEAN
		comment.count 1
		iface MIXER
		name 'Caller ID Switch'
		value false
	}
	control.21 {
		comment.access 'read write user'
		comment.type INTEGER
		comment.count 2
		comment.range '0 - 120'
		comment.tlv '0000000100000008fffff44800000032'
		comment.dbmin -3000
		comment.dbmax 3000
		iface MIXER
		name 'Digital Capture Volume'
		value.0 0
		value.1 0
	}
}
--endcollapse--


!!All Loaded Modules
!!------------------

Module
af_packet
rfcomm
bridge
stp
bnep
sco
l2cap
vboxnetflt
vboxdrv
ppdev
ipv6
acpi_cpufreq
cpufreq_ondemand
cpufreq_stats
cpufreq_userspace
freq_table
cpufreq_powersave
cpufreq_conservative
pci_slot
sbs
sbshc
iptable_filter
ip_tables
x_tables
sbp2
parport_pc
lp
parport
snd_hda_codec_si3054
snd_hda_codec_analog
pcmcia
snd_hda_intel
snd_hda_codec
snd_hwdep
snd_pcm_oss
snd_mixer_oss
snd_pcm
snd_seq_dummy
arc4
ecb
crypto_blkcipher
snd_seq_oss
snd_seq_midi
snd_rawmidi
iwl3945
snd_seq_midi_event
joydev
pcspkr
rfkill
evdev
iTCO_wdt
snd_seq
mac80211
psmouse
btusb
iTCO_vendor_support
serio_raw
led_class
bluetooth
nvidia
cfg80211
snd_timer
wmi
yenta_socket
rsrc_nonstatic
snd_seq_device
i2c_core
pcmcia_core
tpm_infineon
snd
tpm
container
ac
video
tpm_bios
output
battery
button
soundcore
intel_agp
agpgart
shpchp
pci_hotplug
snd_page_alloc
ext3
jbd
mbcache
sr_mod
cdrom
sd_mod
crc_t10dif
sg
ata_piix
pata_acpi
usbhid
hid
ohci1394
ata_generic
ehci_hcd
ieee1394
libata
scsi_mod
dock
uhci_hcd
usbcore
tg3
libphy
thermal
processor
fan
fbcon
tileblit
font
bitblit
softcursor
fuse


!!Sysfs Files
!!-----------

/sys/class/sound/hwC0D0/init_pin_configs:
0x1a 0x02214021
0x1b 0x01014011
0x1c 0x41013012
0x1d 0x01019015
0x1e 0x511710f0
0x1f 0x02a190f0
0x20 0x018130f0
0x21 0x5997e0f0
0x22 0x593310f0
0x23 0x59b770f0
0x24 0x91f710f0
0x25 0x0145f0f0

/sys/class/sound/hwC0D0/driver_pin_configs:

/sys/class/sound/hwC0D0/user_pin_configs:

/sys/class/sound/hwC0D0/init_verbs:

/sys/class/sound/hwC0D1/init_pin_configs:

/sys/class/sound/hwC0D1/driver_pin_configs:

/sys/class/sound/hwC0D1/user_pin_configs:

/sys/class/sound/hwC0D1/init_verbs:


