
!!################################
!!ALSA Information Script v 0.4.51
!!################################

!!Script ran on: Fri Sep 12 14:03:46 CEST 2008


!!Linux Distribution
!!------------------

Welcome to openSUSE 11.0 (i586) - Kernel \r (\l). openSUSE 11.0 (i586)


!!Kernel Information
!!------------------

Kernel release:    2.6.25.16-0.1-default
Operating System:  GNU/Linux
Architecture:      i686
Processor:         i686
SMP Enabled:       Yes


!!ALSA Version
!!------------

Driver version:     1.0.16rc2
Library version:    
Utilities version:  1.0.18rc2


!!Loaded ALSA modules
!!-------------------

snd_hda_intel


!!Soundcards recognised by ALSA
!!-----------------------------

 0 [Intel          ]: HDA-Intel - HDA Intel
                      HDA Intel at 0xd000c000 irq 16


!!PCI Soundcards installed in the system
!!--------------------------------------

00:1b.0 Audio device: Intel Corporation 82801FB/FBM/FR/FW/FRW (ICH6 Family) High Definition Audio Controller (rev 04)


!!Advanced information - PCI Vendor/Device/Susbsystem ID's
!!--------------------------------------------------------

00:1b.0 0403: 8086:2668 (rev 04)
	Subsystem: 1025:007b


!!Loaded sound module options
!!--------------------------

!!Module: snd_hda_intel
enable : Y,Y,Y,Y,Y,Y,Y,Y,Y,Y,Y,Y,Y,Y,Y,Y,Y,Y,Y,Y,Y,Y,Y,Y,Y,Y,Y,Y,Y,Y,Y,Y
enable_msi : 0
id : <NULL>,<NULL>,<NULL>,<NULL>,<NULL>,<NULL>,<NULL>,<NULL>,<NULL>,<NULL>,<NULL>,<NULL>,<NULL>,<NULL>,<NULL>,<NULL>,<NULL>,<NULL>,<NULL>,<NULL>,<NULL>,<NULL>,<NULL>,<NULL>,<NULL>,<NULL>,<NULL>,<NULL>,<NULL>,<NULL>,<NULL>,<NULL>
index : -1,-1,-1,-1,-1,-1,-1,-1,-1,-1,-1,-1,-1,-1,-1,-1,-1,-1,-1,-1,-1,-1,-1,-1,-1,-1,-1,-1,-1,-1,-1,-1
model : <NULL>,<NULL>,<NULL>,<NULL>,<NULL>,<NULL>,<NULL>,<NULL>,<NULL>,<NULL>,<NULL>,<NULL>,<NULL>,<NULL>,<NULL>,<NULL>,<NULL>,<NULL>,<NULL>,<NULL>,<NULL>,<NULL>,<NULL>,<NULL>,<NULL>,<NULL>,<NULL>,<NULL>,<NULL>,<NULL>,<NULL>,<NULL>
position_fix : 0,0,0,0,0,0,0,0,0,0,0,0,0,0,0,0,0,0,0,0,0,0,0,0,0,0,0,0,0,0,0,0
power_save : 10
power_save_controller : Y
probe_mask : -1,-1,-1,-1,-1,-1,-1,-1,-1,-1,-1,-1,-1,-1,-1,-1,-1,-1,-1,-1,-1,-1,-1,-1,-1,-1,-1,-1,-1,-1,-1,-1
single_cmd : N


!!HDA-Intel Codec information
!!---------------------------
--startcollapse--

Codec: Realtek ALC260
Address: 0
Vendor Id: 0x10ec0260
Subsystem Id: 0x1025110d
Revision Id: 0x100400
No Modem Function Group found
Default PCM:
    rates [0x560]: 44100 48000 96000 192000
    bits [0xe]: 16 20 24
    formats [0x1]: PCM
Default Amp-In caps: N/A
Default Amp-Out caps: N/A
GPIO: io=4, o=0, i=0, unsolicited=1, wake=0
  IO[0]: enable=1, dir=1, wake=0, sticky=0, data=1
  IO[1]: enable=0, dir=0, wake=0, sticky=0, data=0
  IO[2]: enable=0, dir=0, wake=0, sticky=0, data=0
  IO[3]: enable=0, dir=0, wake=0, sticky=0, data=0
Node 0x02 [Audio Output] wcaps 0x11: Stereo
  Converter: stream=5, channel=0
  PCM:
    rates [0x560]: 44100 48000 96000 192000
    bits [0xe]: 16 20 24
    formats [0x1]: PCM
Node 0x03 [Audio Output] wcaps 0x211: Stereo Digital
  Converter: stream=0, channel=0
  Digital:
  Digital category: 0x0
  PCM:
    rates [0x560]: 44100 48000 96000 192000
    bits [0x1e]: 16 20 24 32
    formats [0x1]: PCM
Node 0x04 [Audio Input] wcaps 0x10011b: Stereo Amp-In
  Amp-In caps: ofs=0x00, nsteps=0x23, stepsize=0x03, mute=1
  Amp-In vals:  [0x00 0x00] [0x00 0x00] [0x00 0x00] [0x00 0x00] [0x00 0x00] [0x00 0x00] [0x00 0x00]
  Converter: stream=0, channel=0
  SDI-Select: 0
  PCM:
    rates [0x160]: 44100 48000 96000
    bits [0x6]: 16 20
    formats [0x1]: PCM
  Connection: 7
     0x12* 0x13 0x14 0x15 0x16 0x0f 0x10
Node 0x05 [Audio Input] wcaps 0x10011b: Stereo Amp-In
  Amp-In caps: ofs=0x00, nsteps=0x23, stepsize=0x03, mute=1
  Amp-In vals:  [0x80 0x80] [0x80 0x80] [0x80 0x80] [0x80 0x80] [0x80 0x80] [0x80 0x80] [0x80 0x80] [0x80 0x80]
  Converter: stream=0, channel=0
  SDI-Select: 0
  PCM:
    rates [0x160]: 44100 48000 96000
    bits [0x6]: 16 20
    formats [0x1]: PCM
  Connection: 8
     0x12* 0x13 0x14 0x15 0x16 0x07 0x0f 0x10
Node 0x06 [Audio Input] wcaps 0x100391: Stereo Digital
  Converter: stream=0, channel=0
  SDI-Select: 0
  Digital:
  Digital category: 0x0
  PCM:
    rates [0x160]: 44100 48000 96000
    bits [0x1e]: 16 20 24 32
    formats [0x1]: PCM
  Unsolicited: tag=00, enabled=0
  Connection: 1
     0x19
Node 0x07 [Audio Mixer] wcaps 0x20010b: Stereo Amp-In
  Amp-In caps: ofs=0x23, nsteps=0x41, stepsize=0x03, mute=1
  Amp-In vals:  [0x80 0x80] [0x80 0x80] [0x80 0x80] [0x80 0x80] [0x80 0x80] [0x80 0x80] [0x80 0x80] [0x80 0x80]
  Connection: 8
     0x12 0x13 0x14 0x15 0x16 0x17 0x0f 0x10
Node 0x08 [Audio Mixer] wcaps 0x20010f: Stereo Amp-In Amp-Out
  Amp-In caps: ofs=0x00, nsteps=0x00, stepsize=0x00, mute=1
  Amp-In vals:  [0x00 0x00] [0x00 0x00]
  Amp-Out caps: ofs=0x40, nsteps=0x40, stepsize=0x03, mute=0
  Amp-Out vals:  [0x40 0x40]
  Connection: 2
     0x02 0x07
Node 0x09 [Audio Mixer] wcaps 0x20010f: Stereo Amp-In Amp-Out
  Amp-In caps: ofs=0x00, nsteps=0x00, stepsize=0x00, mute=1
  Amp-In vals:  [0x80 0x80] [0x80 0x80]
  Amp-Out caps: ofs=0x40, nsteps=0x40, stepsize=0x03, mute=0
  Amp-Out vals:  [0x00 0x00]
  Connection: 2
     0x02 0x07
Node 0x0a [Audio Mixer] wcaps 0x20010e: Mono Amp-In Amp-Out
  Amp-In caps: ofs=0x00, nsteps=0x00, stepsize=0x00, mute=1
  Amp-In vals:  [0x80] [0x80]
  Amp-Out caps: ofs=0x23, nsteps=0x41, stepsize=0x03, mute=0
  Amp-Out vals:  [0x21]
  Connection: 2
     0x02 0x07
Node 0x0b [Audio Selector] wcaps 0x300101: Stereo
  Connection: 2
     0x08* 0x09
Node 0x0c [Audio Selector] wcaps 0x300101: Stereo
  Connection: 2
     0x08* 0x09
Node 0x0d [Audio Selector] wcaps 0x300101: Stereo
  Connection: 2
     0x08* 0x09
Node 0x0e [Audio Selector] wcaps 0x300101: Stereo
  Connection: 2
     0x08* 0x09
Node 0x0f [Pin Complex] wcaps 0x40018d: Stereo Amp-Out
  Amp-Out caps: ofs=0x00, nsteps=0x00, stepsize=0x00, mute=1
  Amp-Out vals:  [0x00 0x00]
  Pincap 0x081003f: IN OUT HP EAPD Detect Trigger ImpSense
  EAPD 0x0:
  Pin Default 0x0121411f: [Jack] HP Out at Ext Rear
    Conn = 1/8, Color = Green
    DefAssociation = 0x1, Sequence = 0xf
    Misc = NO_PRESENCE
  Pin-ctls: 0xc0: OUT HP
  Unsolicited: tag=00, enabled=0
  Connection: 1
     0x08
Node 0x10 [Pin Complex] wcaps 0x40018d: Stereo Amp-Out
  Amp-Out caps: ofs=0x00, nsteps=0x00, stepsize=0x00, mute=1
  Amp-Out vals:  [0x80 0x80]
  Pincap 0x081003f: IN OUT HP EAPD Detect Trigger ImpSense
  EAPD 0x0:
  Pin Default 0x411111f0: [N/A] Speaker at Ext Rear
    Conn = 1/8, Color = Black
    DefAssociation = 0xf, Sequence = 0x0
    Misc = NO_PRESENCE
  Pin-ctls: 0x00:
  Unsolicited: tag=00, enabled=0
  Connection: 1
     0x09
Node 0x11 [Pin Complex] wcaps 0x40010c: Mono Amp-Out
  Amp-Out caps: ofs=0x00, nsteps=0x00, stepsize=0x00, mute=1
  Amp-Out vals:  [0x00]
  Pincap 0x0810: OUT
  Pin Default 0xb7031110: [Fixed] Line Out at Oth Mobile-In
    Conn = ATAPI, Color = Black
    DefAssociation = 0x1, Sequence = 0x0
    Misc = NO_PRESENCE
  Pin-ctls: 0x40: OUT
  Connection: 1
     0x0a
Node 0x12 [Pin Complex] wcaps 0x40018d: Stereo Amp-Out
  Amp-Out caps: ofs=0x00, nsteps=0x00, stepsize=0x00, mute=1
  Amp-Out vals:  [0x80 0x80]
  Pincap 0x08133f: IN OUT HP Detect Trigger ImpSense
    Vref caps: HIZ 50 80
  Pin Default 0xb7a31130: [Fixed] Mic at Oth Mobile-In
    Conn = ATAPI, Color = Black
    DefAssociation = 0x3, Sequence = 0x0
    Misc = NO_PRESENCE
  Pin-ctls: 0x21: IN VREF_50
  Unsolicited: tag=00, enabled=0
  Connection: 1
     0x0b
Node 0x13 [Pin Complex] wcaps 0x40018d: Stereo Amp-Out
  Amp-Out caps: ofs=0x00, nsteps=0x00, stepsize=0x00, mute=1
  Amp-Out vals:  [0x80 0x80]
  Pincap 0x08133f: IN OUT HP Detect Trigger ImpSense
    Vref caps: HIZ 50 80
  Pin Default 0x411111f0: [N/A] Speaker at Ext Rear
    Conn = 1/8, Color = Black
    DefAssociation = 0xf, Sequence = 0x0
    Misc = NO_PRESENCE
  Pin-ctls: 0x00: VREF_HIZ
  Unsolicited: tag=00, enabled=0
  Connection: 1
     0x0c
Node 0x14 [Pin Complex] wcaps 0x40018d: Stereo Amp-Out
  Amp-Out caps: ofs=0x00, nsteps=0x00, stepsize=0x00, mute=1
  Amp-Out vals:  [0x80 0x80]
  Pincap 0x08133f: IN OUT HP Detect Trigger ImpSense
    Vref caps: HIZ 50 80
  Pin Default 0xc1811c31: [Both] Line In at Ext Rear
    Conn = 1/8, Color = Black
    DefAssociation = 0x3, Sequence = 0x1
  Pin-ctls: 0x20: IN VREF_HIZ
  Unsolicited: tag=00, enabled=0
  Connection: 1
     0x0d
Node 0x15 [Pin Complex] wcaps 0x40018d: Stereo Amp-Out
  Amp-Out caps: ofs=0x00, nsteps=0x00, stepsize=0x00, mute=1
  Amp-Out vals:  [0x80 0x80]
  Pincap 0x08133f: IN OUT HP Detect Trigger ImpSense
    Vref caps: HIZ 50 80
  Pin Default 0xb7831133: [Fixed] Line In at Oth Mobile-In
    Conn = ATAPI, Color = Black
    DefAssociation = 0x3, Sequence = 0x3
    Misc = NO_PRESENCE
  Pin-ctls: 0x00: VREF_HIZ
  Unsolicited: tag=00, enabled=0
  Connection: 1
     0x0e
Node 0x16 [Pin Complex] wcaps 0x400001: Stereo
  Pincap 0x0820: IN
  Pin Default 0x411111f0: [N/A] Speaker at Ext Rear
    Conn = 1/8, Color = Black
    DefAssociation = 0xf, Sequence = 0x0
    Misc = NO_PRESENCE
  Pin-ctls: 0x00:
Node 0x17 [Pin Complex] wcaps 0x400000: Mono
  Pincap 0x0820: IN
  Pin Default 0xb7831132: [Fixed] Line In at Oth Mobile-In
    Conn = ATAPI, Color = Black
    DefAssociation = 0x3, Sequence = 0x2
    Misc = NO_PRESENCE
  Pin-ctls: 0x00:
Node 0x18 [Pin Complex] wcaps 0x400380: Mono Digital
  Pincap 0x0814: OUT Detect
  Pin Default 0xb7431120: [Fixed] SPDIF Out at Oth Mobile-In
    Conn = ATAPI, Color = Black
    DefAssociation = 0x2, Sequence = 0x0
    Misc = NO_PRESENCE
  Pin-ctls: 0x00:
  Unsolicited: tag=00, enabled=0
  Connection: 1
     0x03
Node 0x19 [Pin Complex] wcaps 0x400280: Mono Digital
  Pincap 0x0824: IN Detect
  Pin Default 0x411111f0: [N/A] Speaker at Ext Rear
    Conn = 1/8, Color = Black
    DefAssociation = 0xf, Sequence = 0x0
    Misc = NO_PRESENCE
  Pin-ctls: 0x00:
  Unsolicited: tag=00, enabled=0
Node 0x1a [Vendor Defined Widget] wcaps 0xf00040: Mono
  Processing caps: benign=0, ncoeff=13
Node 0x1b [Volume Knob Widget] wcaps 0x600080: Mono
  Volume-Knob: delta=0, steps=64, direct=0, val=61
  Unsolicited: tag=00, enabled=0
  Connection: 0
Codec: Conexant ID 2bfa
Address: 1
Vendor Id: 0x14f12bfa
Subsystem Id: 0x1025007b
Revision Id: 0x90000
Modem Function Group: 0x2
--endcollapse--


!!ALSA Device nodes
!!-----------------

crw-rw----  1 root audio 116, 7 12 set 13:38 /dev/snd/controlC0
crw-rw----  1 root audio 116, 6 12 set 13:38 /dev/snd/hwC0D0
crw-rw----  1 root audio 116, 5 12 set 13:38 /dev/snd/hwC0D1
crw-rw----  1 root audio 116, 4 12 set 13:59 /dev/snd/pcmC0D0c
crw-rw----  1 root audio 116, 3 12 set 13:44 /dev/snd/pcmC0D0p
crw-rw----  1 root audio 116, 8 12 set 13:39 /dev/snd/seq
crw-rw----  1 root audio 116, 2 12 set 13:38 /dev/snd/timer


!!Aplay/Arecord output
!!------------

APLAY

**** List of PLAYBACK Hardware Devices ****
card 0: Intel [HDA Intel], device 0: ALC260 Analog [ALC260 Analog]
  Subdevices: 0/1
  Subdevice #0: subdevice #0

ARECORD

**** List of CAPTURE Hardware Devices ****
card 0: Intel [HDA Intel], device 0: ALC260 Analog [ALC260 Analog]
  Subdevices: 1/1
  Subdevice #0: subdevice #0

!!Amixer output
!!-------------

!!-------Mixer controls for card 0 [Intel]

Card hw:0 'Intel'/'HDA Intel at 0xd000c000 irq 16'
  Mixer name	: 'Realtek ALC260'
  Components	: 'HDA:10ec0260 HDA:14f12bfa'
  Controls      : 22
  Simple ctrls  : 14
Simple mixer control 'Master',0
  Capabilities: pvolume pswitch
  Playback channels: Front Left - Front Right
  Limits: Playback 0 - 64
  Mono:
  Front Left: Playback 64 [100%] [0.00dB] [on]
  Front Right: Playback 64 [100%] [0.00dB] [on]
Simple mixer control 'Headphone Jack Mode',0
  Capabilities: enum
  Items: 'Mic 50pc bias' 'Mic 80pc bias' 'Line in' 'Line out' 'Headphone out'
  Item0: 'Headphone out'
Simple mixer control 'PCM',0
  Capabilities: pvolume
  Playback channels: Front Left - Front Right
  Limits: Playback 0 - 255
  Mono:
  Front Left: Playback 255 [100%] [0.00dB]
  Front Right: Playback 255 [100%] [0.00dB]
Simple mixer control 'Line',0
  Capabilities: pvolume pswitch
  Playback channels: Front Left - Front Right
  Limits: Playback 0 - 65
  Mono:
  Front Left: Playback 0 [0%] [-35.00dB] [off]
  Front Right: Playback 0 [0%] [-35.00dB] [off]
Simple mixer control 'Line Jack Mode',0
  Capabilities: enum
  Items: 'Mic 50pc bias' 'Mic 80pc bias' 'Line in' 'Line out' 'Headphone out'
  Item0: 'Line in'
Simple mixer control 'CD',0
  Capabilities: pvolume pswitch
  Playback channels: Front Left - Front Right
  Limits: Playback 0 - 65
  Mono:
  Front Left: Playback 0 [0%] [-35.00dB] [off]
  Front Right: Playback 0 [0%] [-35.00dB] [off]
Simple mixer control 'Mic',0
  Capabilities: pvolume pswitch
  Playback channels: Front Left - Front Right
  Limits: Playback 0 - 65
  Mono:
  Front Left: Playback 0 [0%] [-35.00dB] [off]
  Front Right: Playback 0 [0%] [-35.00dB] [off]
Simple mixer control 'Mic Jack Mode',0
  Capabilities: enum
  Items: 'Mic 50pc bias' 'Mic 80pc bias' 'Line in'
  Item0: 'Mic 50pc bias'
Simple mixer control 'Capture',0
  Capabilities: cvolume cswitch
  Capture channels: Front Left - Front Right
  Limits: Capture 0 - 35
  Front Left: Capture 0 [0%] [0.00dB] [on]
  Front Right: Capture 0 [0%] [0.00dB] [on]
Simple mixer control 'Capture',1
  Capabilities: cvolume cswitch
  Capture channels: Front Left - Front Right
  Limits: Capture 0 - 35
  Front Left: Capture 0 [0%] [0.00dB] [off]
  Front Right: Capture 0 [0%] [0.00dB] [off]
Simple mixer control 'Beep',0
  Capabilities: pvolume pswitch
  Playback channels: Front Left - Front Right
  Limits: Playback 0 - 65
  Mono:
  Front Left: Playback 0 [0%] [-35.00dB] [off]
  Front Right: Playback 0 [0%] [-35.00dB] [off]
Simple mixer control 'Input Source',0
  Capabilities: cenum
  Items: 'Mic' 'Line' 'CD' 'Headphone'
  Item0: 'Mic'
Simple mixer control 'Input Source',1
  Capabilities: cenum
  Items: 'Mic' 'Line' 'CD' 'Headphone' 'Mixer'
  Item0: 'Mic'
Simple mixer control 'Speaker',0
  Capabilities: pvolume pvolume-joined pswitch pswitch-joined
  Playback channels: Mono
  Limits: Playback 0 - 65
  Mono: Playback 33 [51%] [-2.00dB] [on]


!!Alsactl output
!!-------------

--startcollapse--
state.Intel {
	control.1 {
		comment.access 'read write'
		comment.type INTEGER
		comment.count 2
		comment.range '0 - 64'
		comment.dbmin -6400
		comment.dbmax 0
		iface MIXER
		name 'Master Playback Volume'
		value.0 64
		value.1 64
	}
	control.2 {
		comment.access 'read write'
		comment.type BOOLEAN
		comment.count 2
		iface MIXER
		name 'Master Playback Switch'
		value.0 true
		value.1 true
	}
	control.3 {
		comment.access 'read write'
		comment.type ENUMERATED
		comment.count 1
		comment.item.0 'Mic 50pc bias'
		comment.item.1 'Mic 80pc bias'
		comment.item.2 'Line in'
		comment.item.3 'Line out'
		comment.item.4 'Headphone out'
		iface MIXER
		name 'Headphone Jack Mode'
		value 'Headphone out'
	}
	control.4 {
		comment.access 'read write'
		comment.type INTEGER
		comment.count 1
		comment.range '0 - 65'
		comment.dbmin -3500
		comment.dbmax 3000
		iface MIXER
		name 'Speaker Playback Volume'
		value 33
	}
	control.5 {
		comment.access 'read write'
		comment.type BOOLEAN
		comment.count 1
		iface MIXER
		name 'Speaker Playback Switch'
		value true
	}
	control.6 {
		comment.access 'read write'
		comment.type INTEGER
		comment.count 2
		comment.range '0 - 65'
		comment.dbmin -3500
		comment.dbmax 3000
		iface MIXER
		name 'CD Playback Volume'
		value.0 0
		value.1 0
	}
	control.7 {
		comment.access 'read write'
		comment.type BOOLEAN
		comment.count 2
		iface MIXER
		name 'CD Playback Switch'
		value.0 false
		value.1 false
	}
	control.8 {
		comment.access 'read write'
		comment.type INTEGER
		comment.count 2
		comment.range '0 - 65'
		comment.dbmin -3500
		comment.dbmax 3000
		iface MIXER
		name 'Mic Playback Volume'
		value.0 0
		value.1 0
	}
	control.9 {
		comment.access 'read write'
		comment.type BOOLEAN
		comment.count 2
		iface MIXER
		name 'Mic Playback Switch'
		value.0 false
		value.1 false
	}
	control.10 {
		comment.access 'read write'
		comment.type ENUMERATED
		comment.count 1
		comment.item.0 'Mic 50pc bias'
		comment.item.1 'Mic 80pc bias'
		comment.item.2 'Line in'
		iface MIXER
		name 'Mic Jack Mode'
		value 'Mic 50pc bias'
	}
	control.11 {
		comment.access 'read write'
		comment.type INTEGER
		comment.count 2
		comment.range '0 - 65'
		comment.dbmin -3500
		comment.dbmax 3000
		iface MIXER
		name 'Line Playback Volume'
		value.0 0
		value.1 0
	}
	control.12 {
		comment.access 'read write'
		comment.type BOOLEAN
		comment.count 2
		iface MIXER
		name 'Line Playback Switch'
		value.0 false
		value.1 false
	}
	control.13 {
		comment.access 'read write'
		comment.type ENUMERATED
		comment.count 1
		comment.item.0 'Mic 50pc bias'
		comment.item.1 'Mic 80pc bias'
		comment.item.2 'Line in'
		comment.item.3 'Line out'
		comment.item.4 'Headphone out'
		iface MIXER
		name 'Line Jack Mode'
		value 'Line in'
	}
	control.14 {
		comment.access 'read write'
		comment.type INTEGER
		comment.count 2
		comment.range '0 - 65'
		comment.dbmin -3500
		comment.dbmax 3000
		iface MIXER
		name 'Beep Playback Volume'
		value.0 0
		value.1 0
	}
	control.15 {
		comment.access 'read write'
		comment.type BOOLEAN
		comment.count 2
		iface MIXER
		name 'Beep Playback Switch'
		value.0 false
		value.1 false
	}
	control.16 {
		comment.access 'read write'
		comment.type INTEGER
		comment.count 2
		comment.range '0 - 35'
		comment.dbmin 0
		comment.dbmax 3500
		iface MIXER
		name 'Capture Volume'
		value.0 0
		value.1 0
	}
	control.17 {
		comment.access 'read write'
		comment.type BOOLEAN
		comment.count 2
		iface MIXER
		name 'Capture Switch'
		value.0 true
		value.1 true
	}
	control.18 {
		comment.access 'read write'
		comment.type INTEGER
		comment.count 2
		comment.range '0 - 35'
		comment.dbmin 0
		comment.dbmax 3500
		iface MIXER
		name 'Capture Volume'
		index 1
		value.0 0
		value.1 0
	}
	control.19 {
		comment.access 'read write'
		comment.type BOOLEAN
		comment.count 2
		iface MIXER
		name 'Capture Switch'
		index 1
		value.0 false
		value.1 false
	}
	control.20 {
		comment.access 'read write'
		comment.type ENUMERATED
		comment.count 1
		comment.item.0 Mic
		comment.item.1 Line
		comment.item.2 CD
		comment.item.3 Headphone
		iface MIXER
		name 'Input Source'
		value Mic
	}
	control.21 {
		comment.access 'read write'
		comment.type ENUMERATED
		comment.count 1
		comment.item.0 Mic
		comment.item.1 Line
		comment.item.2 CD
		comment.item.3 Headphone
		comment.item.4 Mixer
		iface MIXER
		name 'Input Source'
		index 1
		value Mic
	}
	control.22 {
		comment.access 'read write user'
		comment.type INTEGER
		comment.count 2
		comment.range '0 - 255'
		comment.tlv '0000000100000008ffffec1400000014'
		comment.dbmin -5100
		comment.dbmax 0
		iface MIXER
		name 'PCM Playback Volume'
		value.0 255
		value.1 255
	}
}
--endcollapse--


!!All Loaded Modules
!!------------------

Module
iptable_filter
ip_tables
ip6table_filter
ip6_tables
x_tables
arc4
ecb
crypto_blkcipher
ieee80211_crypt_wep
ipv6
binfmt_misc
snd_pcm_oss
snd_mixer_oss
snd_seq
snd_seq_device
af_packet
microcode
cpufreq_conservative
cpufreq_userspace
cpufreq_powersave
acpi_cpufreq
speedstep_lib
fuse
loop
dm_mod
pcmcia
ipw2200
iTCO_wdt
ieee80211
snd_hda_intel
iTCO_vendor_support
ieee80211_crypt
ppdev
snd_pcm
yenta_socket
rsrc_nonstatic
tifm_7xx1
ohci1394
video
snd_timer
parport_pc
firmware_class
pcmcia_core
output
ieee1394
rtc_cmos
snd_page_alloc
tifm_core
wmi
ac
container
button
battery
nvidia
i2c_i801
tg3
serio_raw
led_class
sr_mod
rtc_core
parport
snd_hwdep
intel_agp
cdrom
i2c_core
irda
crc_ccitt
snd
rtc_lib
soundcore
agpgart
sg
sd_mod
ehci_hcd
uhci_hcd
usbcore
edd
ata_piix
libata
scsi_mod
dock
ext3
mbcache
jbd
fan
thermal
processor


