
!!################################
!!ALSA Information Script v 0.4.34
!!################################

!!Script ran on: zo okt 28 13:50:46 CET 2007


!!Linux Distribution
!!------------------

Gentoo Base System release 1.12.9


!!Kernel Information
!!------------------

Kernel release:    2.6.22-gentoo-r8
Operating System:  GNU/Linux
Architecture:      i686
Processor:         Intel(R) Celeron(R) M CPU        520  @ 1.60GHz
SMP Enabled:       Yes


!!ALSA Version
!!------------

Driver version:     1.0.14
Library version:    1.0.14a
Utilities version:  1.0.14


!!Loaded ALSA modules
!!-------------------



!!Soundcards recognised by ALSA
!!-----------------------------

 0 [Intel          ]: HDA-Intel - HDA Intel
                      HDA Intel at 0xdc240000 irq 22


!!PCI Soundcards installed in the system
!!--------------------------------------

00:1b.0 Audio device: Intel Corporation 82801G (ICH7 Family) High Definition Audio Controller (rev 02)
0a:06.2 Mass storage controller: Texas Instruments 5-in-1 Multimedia Card Reader (SD/MMC/MS/MS PRO/xD)


!!Advanced information - PCI Vendor/Device/Susbsystem ID's
!!--------------------------------------------------------

00:1b.0 0403: 8086:27d8 (rev 02)
	Subsystem: 1025:0130


!!Loaded sound module options
!!--------------------------


!!HDA-Intel Codec information
!!---------------------------

Codec: Realtek ID 268
Address: 0
Vendor Id: 0x10ec0268
Subsystem Id: 0x10250130
Revision Id: 0x100003
Default PCM:
    rates [0x560]: 44100 48000 96000 192000
    bits [0xe]: 16 20 24
    formats [0x1]: PCM
Default Amp-In caps: N/A
Default Amp-Out caps: N/A
Node 0x02 [Audio Output] wcaps 0x1d: Stereo Amp-Out
  Amp-Out caps: ofs=0x40, nsteps=0x40, stepsize=0x03, mute=0
  Amp-Out vals:  [0x40 0x40]
  PCM:
    rates [0x560]: 44100 48000 96000 192000
    bits [0xe]: 16 20 24
    formats [0x1]: PCM
Node 0x03 [Audio Output] wcaps 0x1d: Stereo Amp-Out
  Amp-Out caps: ofs=0x40, nsteps=0x40, stepsize=0x03, mute=0
  Amp-Out vals:  [0x20 0x20]
  PCM:
    rates [0x560]: 44100 48000 96000 192000
    bits [0xe]: 16 20 24
    formats [0x1]: PCM
Node 0x04 [Vendor Defined Widget] wcaps 0xf00000: Mono
Node 0x05 [Vendor Defined Widget] wcaps 0xf00000: Mono
Node 0x06 [Audio Output] wcaps 0x211: Stereo Digital
  PCM:
    rates [0x5e0]: 44100 48000 88200 96000 192000
    bits [0x1e]: 16 20 24 32
    formats [0x1]: PCM
Node 0x07 [Audio Input] wcaps 0x100111: Stereo
  PCM:
    rates [0x160]: 44100 48000 96000
    bits [0x6]: 16 20
    formats [0x1]: PCM
  Connection: 1
     0x24
Node 0x08 [Audio Input] wcaps 0x100111: Stereo
  PCM:
    rates [0x160]: 44100 48000 96000
    bits [0x6]: 16 20
    formats [0x1]: PCM
  Connection: 1
     0x23
Node 0x09 [Vendor Defined Widget] wcaps 0xf00000: Mono
Node 0x0a [Vendor Defined Widget] wcaps 0xf00000: Mono
Node 0x0b [Vendor Defined Widget] wcaps 0xf00000: Mono
Node 0x0c [Vendor Defined Widget] wcaps 0xf00000: Mono
Node 0x0d [Vendor Defined Widget] wcaps 0xf00000: Mono
Node 0x0e [Audio Mixer] wcaps 0x20010a: Mono Amp-In
  Amp-In caps: ofs=0x00, nsteps=0x00, stepsize=0x00, mute=1
  Amp-In vals:  [0x00]
  Connection: 1
     0x02
Node 0x0f [Audio Mixer] wcaps 0x20010b: Stereo Amp-In
  Amp-In caps: ofs=0x00, nsteps=0x00, stepsize=0x00, mute=1
  Amp-In vals:  [0x00 0x00] [0x80 0x80]
  Connection: 2
     0x02 0x1d
Node 0x10 [Audio Mixer] wcaps 0x20010b: Stereo Amp-In
  Amp-In caps: ofs=0x00, nsteps=0x00, stepsize=0x00, mute=1
  Amp-In vals:  [0x00 0x00] [0x80 0x80] [0x80 0x80]
  Connection: 3
     0x03 0x1d 0x02
Node 0x11 [Vendor Defined Widget] wcaps 0xf00000: Mono
Node 0x12 [Pin Complex] wcaps 0x400001: Stereo
  Pincap 0x0820: IN
  Pin Default 0x411111f0: [N/A] Speaker at Ext Rear
    Conn = 1/8, Color = Black
  Pin-ctls: 0x00:
Node 0x13 [Pin Complex] wcaps 0x400001: Stereo
  Pincap 0x0820: IN
  Pin Default 0x411111f0: [N/A] Speaker at Ext Rear
    Conn = 1/8, Color = Black
  Pin-ctls: 0x00:
Node 0x14 [Pin Complex] wcaps 0x40018d: Stereo Amp-Out
  Amp-Out caps: ofs=0x00, nsteps=0x00, stepsize=0x00, mute=1
  Amp-Out vals:  [0x80 0x80]
  Pincap 0x081003c: IN OUT HP EAPD Detect
  Pin Default 0x0221401f: [Jack] HP Out at Ext Front
    Conn = 1/8, Color = Green
  Pin-ctls: 0x20: IN
  Connection: 1
     0x0f
Node 0x15 [Pin Complex] wcaps 0x40018d: Stereo Amp-Out
  Amp-Out caps: ofs=0x00, nsteps=0x00, stepsize=0x00, mute=1
  Amp-Out vals:  [0x00 0x00]
  Pincap 0x081003c: IN OUT HP EAPD Detect
  Pin Default 0x99139110: [Fixed] Speaker at Int ATAPI
    Conn = ATAPI, Color = Pink
  Pin-ctls: 0xc0: OUT HP
  Connection: 1
     0x10
Node 0x16 [Pin Complex] wcaps 0x40010c: Mono Amp-Out
  Amp-Out caps: ofs=0x00, nsteps=0x00, stepsize=0x00, mute=1
  Amp-Out vals:  [0x80]
  Pincap 0x0810: OUT
  Pin Default 0x411111f0: [N/A] Speaker at Ext Rear
    Conn = 1/8, Color = Black
  Pin-ctls: 0x00:
  Connection: 1
     0x0e
Node 0x17 [Vendor Defined Widget] wcaps 0xf00000: Mono
Node 0x18 [Pin Complex] wcaps 0x40018f: Stereo Amp-In Amp-Out
  Amp-In caps: ofs=0x00, nsteps=0x02, stepsize=0x4f, mute=0
  Amp-In vals:  [0x02 0x02]
  Amp-Out caps: ofs=0x00, nsteps=0x00, stepsize=0x00, mute=1
  Amp-Out vals:  [0x80 0x80]
  Pincap 0x083734: IN OUT Detect
  Pin Default 0x02a19820: [Jack] Mic at Ext Front
    Conn = 1/8, Color = Pink
  Pin-ctls: 0x24: IN
  Connection: 1
     0x02
Node 0x19 [Pin Complex] wcaps 0x40008b: Stereo Amp-In
  Amp-In caps: ofs=0x00, nsteps=0x02, stepsize=0x4f, mute=0
  Amp-In vals: 
  Pincap 0x083724: IN Detect
  Pin Default 0x99a39921: [Fixed] Mic at Int ATAPI
    Conn = ATAPI, Color = Pink
  Pin-ctls: 0x20: IN
Node 0x1a [Pin Complex] wcaps 0x40018f: Stereo Amp-In Amp-Out
  Amp-In caps: ofs=0x00, nsteps=0x02, stepsize=0x4f, mute=0
  Amp-In vals:  [0x00 0x00]
  Amp-Out caps: ofs=0x00, nsteps=0x00, stepsize=0x00, mute=1
  Amp-Out vals:  [0x80 0x80]
  Pincap 0x083734: IN OUT Detect
  Pin Default 0x0281302e: [Jack] Line In at Ext Front
    Conn = 1/8, Color = Blue
  Pin-ctls: 0x20: IN
  Connection: 1
     0x02
Node 0x1b [Vendor Defined Widget] wcaps 0xf00000: Mono
Node 0x1c [Pin Complex] wcaps 0x400001: Stereo
  Pincap 0x0820: IN
  Pin Default 0x411111f0: [N/A] Speaker at Ext Rear
    Conn = 1/8, Color = Black
  Pin-ctls: 0x20: IN
Node 0x1d [Pin Complex] wcaps 0x400000: Mono
  Pincap 0x0820: IN
  Pin Default 0x4017952d: [N/A] Speaker at Ext N/A
    Conn = Analog, Color = Pink
  Pin-ctls: 0x20: IN
Node 0x1e [Pin Complex] wcaps 0x400380: Mono Digital
  Pincap 0x0810: OUT
  Pin Default 0x411111f0: [N/A] Speaker at Ext Rear
    Conn = 1/8, Color = Black
  Pin-ctls: 0x40: OUT
  Connection: 1
     0x06
Node 0x1f [Vendor Defined Widget] wcaps 0xf00000: Mono
Node 0x20 [Vendor Defined Widget] wcaps 0xf00040: Mono
Node 0x21 [Vendor Defined Widget] wcaps 0xf00000: Mono
Node 0x22 [Vendor Defined Widget] wcaps 0xf00000: Mono
Node 0x23 [Audio Selector] wcaps 0x30010d: Stereo Amp-Out
  Amp-Out caps: ofs=0x0b, nsteps=0x1f, stepsize=0x05, mute=1
  Amp-Out vals:  [0x01 0x01]
  Connection: 7
     0x18 0x19 0x1a 0x1c 0x14 0x15* 0x12
Node 0x24 [Audio Selector] wcaps 0x30010d: Stereo Amp-Out
  Amp-Out caps: ofs=0x0b, nsteps=0x1f, stepsize=0x05, mute=1
  Amp-Out vals:  [0x14 0x14]
  Connection: 7
     0x18* 0x19 0x1a 0x1c 0x14 0x15 0x13
Codec: Conexant ID 2c06
Address: 1
Vendor Id: 0x14f12c06
Subsystem Id: 0x10250093
Revision Id: 0x100000


!!ALSA Device nodes
!!-----------------

crw-rw---- 1 root audio 116,  0 okt 28 11:41 /dev/snd/controlC0
crw-rw---- 1 root audio 116, 24 okt 28 11:41 /dev/snd/pcmC0D0c
crw-rw---- 1 root audio 116, 16 okt 28 11:41 /dev/snd/pcmC0D0p
crw-rw---- 1 root audio 116, 33 okt 28 11:41 /dev/snd/timer


!!Aplay/Arecord output
!!------------

APLAY

**** List of PLAYBACK Hardware Devices ****
card 0: Intel [HDA Intel], device 0: HDA Generic [HDA Generic]
  Subdevices: 1/1
  Subdevice #0: subdevice #0

ARECORD

**** List of CAPTURE Hardware Devices ****
card 0: Intel [HDA Intel], device 0: HDA Generic [HDA Generic]
  Subdevices: 1/1
  Subdevice #0: subdevice #0

!!Amixer output
!!-------------

!!-------Mixer controls for card 0 [Intel]

Simple mixer control 'Master',0
  Capabilities: pvolume
  Playback channels: Front Left - Front Right
  Limits: Playback 0 - 64
  Mono:
  Front Left: Playback 32 [50%] [-32.00dB]
  Front Right: Playback 32 [50%] [-32.00dB]
Simple mixer control 'PCM',0
  Capabilities: pvolume
  Playback channels: Front Left - Front Right
  Limits: Playback 0 - 255
  Mono:
  Front Left: Playback 255 [100%] [0.00dB]
  Front Right: Playback 255 [100%] [0.00dB]


!!All Loaded Modules
!!------------------

Module
ecb
cbc
arc4
pcbc
sha256
sha1
cryptomgr
cfg80211
ieee80211_crypt_wep
geode_aes
crypto_algapi
blkcipher
scsi_wait_scan
udf
smbfs
bcm43xx
ieee80211softmac
ieee80211
ieee80211_crypt
snd_hda_intel
snd_pcm
snd_timer
snd_page_alloc


