
!!################################
!!ALSA Information Script v 0.4.52
!!################################

!!Script ran on: Thu Feb 26 11:37:20 CET 2009


!!Linux Distribution
!!------------------

Pardus 2008.2 Canis aureus


!!Kernel Information
!!------------------

Kernel release:    2.6.25.20-114
Operating System:  GNU/Linux
Architecture:      i686
Processor:         Intel(R) Pentium(R) Dual  CPU  T2330  @ 1.60GHz
SMP Enabled:       Yes


!!ALSA Version
!!------------

Driver version:     1.0.18a
Library version:    1.0.18
Utilities version:  1.0.18


!!Loaded ALSA modules
!!-------------------

snd_hda_intel


!!Soundcards recognised by ALSA
!!-----------------------------

 0 [Intel          ]: HDA-Intel - HDA Intel
                      HDA Intel at 0xfc300000 irq 22


!!PCI Soundcards installed in the system
!!--------------------------------------

00:1b.0 Audio device: Intel Corporation 82801H (ICH8 Family) HD Audio Controller (rev 03)
08:03.2 Mass storage controller: Texas Instruments 5-in-1 Multimedia Card Reader (SD/MMC/MS/MS PRO/xD)


!!Advanced information - PCI Vendor/Device/Susbsystem ID's
!!--------------------------------------------------------

00:1b.0 0403: 8086:284b (rev 03)
	Subsystem: 104d:902d


!!Loaded sound module options
!!--------------------------

!!Module: snd_hda_intel
bdl_pos_adj : 1,-1,-1,-1,-1,-1,-1,-1
enable : Y,Y,Y,Y,Y,Y,Y,Y
enable_msi : 0
id : <NULL>,<NULL>,<NULL>,<NULL>,<NULL>,<NULL>,<NULL>,<NULL>
index : -1,-1,-1,-1,-1,-1,-1,-1
model : <NULL>,<NULL>,<NULL>,<NULL>,<NULL>,<NULL>,<NULL>,<NULL>
position_fix : 0,0,0,0,0,0,0,0
power_save : 0
power_save_controller : Y
probe_mask : -1,-1,-1,-1,-1,-1,-1,-1
single_cmd : N


!!HDA-Intel Codec information
!!---------------------------
--startcollapse--

Codec: Realtek ALC262
Address: 0
Vendor Id: 0x10ec0262
Subsystem Id: 0x104d2800
Revision Id: 0x100100
No Modem Function Group found
Default PCM:
    rates [0x560]: 44100 48000 96000 192000
    bits [0xe]: 16 20 24
    formats [0x1]: PCM
Default Amp-In caps: N/A
Default Amp-Out caps: N/A
GPIO: io=4, o=0, i=0, unsolicited=1, wake=0
  IO[0]: enable=0, dir=0, wake=0, sticky=0, data=0, unsol=0
  IO[1]: enable=0, dir=0, wake=0, sticky=0, data=0, unsol=0
  IO[2]: enable=0, dir=0, wake=0, sticky=0, data=0, unsol=0
  IO[3]: enable=0, dir=0, wake=0, sticky=0, data=0, unsol=0
Node 0x02 [Audio Output] wcaps 0x11: Stereo
  Converter: stream=0, channel=0
  PCM:
    rates [0x560]: 44100 48000 96000 192000
    bits [0xe]: 16 20 24
    formats [0x1]: PCM
Node 0x03 [Audio Output] wcaps 0x11: Stereo
  Converter: stream=0, channel=0
  PCM:
    rates [0x560]: 44100 48000 96000 192000
    bits [0xe]: 16 20 24
    formats [0x1]: PCM
Node 0x04 [Vendor Defined Widget] wcaps 0xf00000: Mono
Node 0x05 [Vendor Defined Widget] wcaps 0xf00000: Mono
Node 0x06 [Audio Output] wcaps 0x211: Stereo Digital
  Converter: stream=0, channel=0
  Digital:
  Digital category: 0x0
  PCM:
    rates [0x560]: 44100 48000 96000 192000
    bits [0x1e]: 16 20 24 32
    formats [0x1]: PCM
Node 0x07 [Audio Input] wcaps 0x10011b: Stereo Amp-In
  Amp-In caps: ofs=0x08, nsteps=0x1f, stepsize=0x05, mute=1
  Amp-In vals:  [0x15 0x15]
  Converter: stream=0, channel=0
  SDI-Select: 0
  PCM:
    rates [0x160]: 44100 48000 96000
    bits [0x6]: 16 20
    formats [0x1]: PCM
  Connection: 1
     0x24
Node 0x08 [Audio Input] wcaps 0x10011b: Stereo Amp-In
  Amp-In caps: ofs=0x08, nsteps=0x1f, stepsize=0x05, mute=1
  Amp-In vals:  [0x00 0x00]
  Converter: stream=0, channel=0
  SDI-Select: 0
  PCM:
    rates [0x160]: 44100 48000 96000
    bits [0x6]: 16 20
    formats [0x1]: PCM
  Connection: 1
     0x23
Node 0x09 [Audio Input] wcaps 0x10011b: Stereo Amp-In
  Amp-In caps: ofs=0x08, nsteps=0x1f, stepsize=0x05, mute=1
  Amp-In vals:  [0x00 0x00]
  Converter: stream=0, channel=0
  SDI-Select: 0
  PCM:
    rates [0x160]: 44100 48000 96000
    bits [0x6]: 16 20
    formats [0x1]: PCM
  Connection: 1
     0x22
Node 0x0a [Audio Input] wcaps 0x100391: Stereo Digital
  Converter: stream=0, channel=0
  SDI-Select: 0
  Digital:
  Digital category: 0x0
  PCM:
    rates [0x560]: 44100 48000 96000 192000
    bits [0x1e]: 16 20 24 32
    formats [0x1]: PCM
  Unsolicited: tag=00, enabled=0
  Connection: 1
     0x1f
Node 0x0b [Audio Mixer] wcaps 0x20010b: Stereo Amp-In
  Amp-In caps: ofs=0x17, nsteps=0x1f, stepsize=0x05, mute=1
  Amp-In vals:  [0x1f 0x1f] [0x80 0x80] [0x80 0x80] [0x80 0x80] [0x80 0x80] [0x80 0x80] [0x97 0x97] [0x97 0x97]
  Connection: 8
     0x18 0x19 0x1a 0x1b 0x1c 0x1d 0x14 0x15
Node 0x0c [Audio Mixer] wcaps 0x20010f: Stereo Amp-In Amp-Out
  Amp-In caps: ofs=0x00, nsteps=0x00, stepsize=0x00, mute=1
  Amp-In vals:  [0x00 0x00] [0x00 0x00]
  Amp-Out caps: ofs=0x1f, nsteps=0x1f, stepsize=0x05, mute=0
  Amp-Out vals:  [0x11 0x11]
  Connection: 2
     0x02 0x0b
Node 0x0d [Audio Mixer] wcaps 0x20010f: Stereo Amp-In Amp-Out
  Amp-In caps: ofs=0x00, nsteps=0x00, stepsize=0x00, mute=1
  Amp-In vals:  [0x00 0x00] [0x00 0x00]
  Amp-Out caps: ofs=0x1f, nsteps=0x1f, stepsize=0x05, mute=0
  Amp-Out vals:  [0x00 0x00]
  Connection: 2
     0x03 0x0b
Node 0x0e [Audio Mixer] wcaps 0x20010e: Mono Amp-In Amp-Out
  Amp-In caps: ofs=0x00, nsteps=0x00, stepsize=0x00, mute=1
  Amp-In vals:  [0x00] [0x00]
  Amp-Out caps: ofs=0x1f, nsteps=0x1f, stepsize=0x05, mute=0
  Amp-Out vals:  [0x00]
  Connection: 2
     0x02 0x0b
Node 0x0f [Vendor Defined Widget] wcaps 0xf00000: Mono
Node 0x10 [Vendor Defined Widget] wcaps 0xf00000: Mono
Node 0x11 [Vendor Defined Widget] wcaps 0xf00000: Mono
Node 0x12 [Vendor Defined Widget] wcaps 0xf00000: Mono
Node 0x13 [Vendor Defined Widget] wcaps 0xf00000: Mono
Node 0x14 [Pin Complex] wcaps 0x40018f: Stereo Amp-In Amp-Out
  Amp-In caps: ofs=0x00, nsteps=0x03, stepsize=0x27, mute=0
  Amp-In vals:  [0x00 0x00]
  Amp-Out caps: ofs=0x00, nsteps=0x00, stepsize=0x00, mute=1
  Amp-Out vals:  [0x00 0x00]
  Pincap 0x0000003e: IN OUT HP Detect Trigger
  Pin Default 0x90170110: [Fixed] Speaker at Int N/A
    Conn = Analog, Color = Unknown
    DefAssociation = 0x1, Sequence = 0x0
    Misc = NO_PRESENCE
  Pin-ctls: 0x40: OUT
  Unsolicited: tag=00, enabled=0
  Connection: 2
     0x0c* 0x0d
Node 0x15 [Pin Complex] wcaps 0x40018f: Stereo Amp-In Amp-Out
  Amp-In caps: ofs=0x00, nsteps=0x03, stepsize=0x27, mute=0
  Amp-In vals:  [0x00 0x00]
  Amp-Out caps: ofs=0x00, nsteps=0x00, stepsize=0x00, mute=1
  Amp-Out vals:  [0x00 0x00]
  Pincap 0x0000003e: IN OUT HP Detect Trigger
  Pin Default 0x0421101f: [Jack] HP Out at Ext Right
    Conn = 1/8, Color = Black
    DefAssociation = 0x1, Sequence = 0xf
  Pin-ctls: 0xc0: OUT HP
  Unsolicited: tag=00, enabled=0
  Connection: 2
     0x0c* 0x0d
Node 0x16 [Pin Complex] wcaps 0x40010c: Mono Amp-Out
  Amp-Out caps: ofs=0x00, nsteps=0x00, stepsize=0x00, mute=1
  Amp-Out vals:  [0x80]
  Pincap 0x00000010: OUT
  Pin Default 0x411111f0: [N/A] Speaker at Ext Rear
    Conn = 1/8, Color = Black
    DefAssociation = 0xf, Sequence = 0x0
    Misc = NO_PRESENCE
  Pin-ctls: 0x40: OUT
  Connection: 1
     0x0e
Node 0x17 [Vendor Defined Widget] wcaps 0xf00000: Mono
Node 0x18 [Pin Complex] wcaps 0x40018f: Stereo Amp-In Amp-Out
  Amp-In caps: ofs=0x00, nsteps=0x03, stepsize=0x27, mute=0
  Amp-In vals:  [0x00 0x00]
  Amp-Out caps: ofs=0x00, nsteps=0x00, stepsize=0x00, mute=1
  Amp-Out vals:  [0x80 0x80]
  Pincap 0x0000173e: IN OUT HP Detect Trigger
    Vref caps: HIZ 50 GRD 80
  Pin Default 0x04a15020: [Jack] Mic at Ext Right
    Conn = 1/8, Color = Red
    DefAssociation = 0x2, Sequence = 0x0
  Pin-ctls: 0x24: IN VREF_80
  Unsolicited: tag=00, enabled=0
  Connection: 2
     0x0c* 0x0d
Node 0x19 [Pin Complex] wcaps 0x40018f: Stereo Amp-In Amp-Out
  Amp-In caps: ofs=0x00, nsteps=0x03, stepsize=0x27, mute=0
  Amp-In vals:  [0x00 0x00]
  Amp-Out caps: ofs=0x00, nsteps=0x00, stepsize=0x00, mute=1
  Amp-Out vals:  [0x80 0x80]
  Pincap 0x0000173e: IN OUT HP Detect Trigger
    Vref caps: HIZ 50 GRD 80
  Pin Default 0x411111f0: [N/A] Speaker at Ext Rear
    Conn = 1/8, Color = Black
    DefAssociation = 0xf, Sequence = 0x0
    Misc = NO_PRESENCE
  Pin-ctls: 0x20: IN VREF_HIZ
  Unsolicited: tag=00, enabled=0
  Connection: 2
     0x0c* 0x0d
Node 0x1a [Pin Complex] wcaps 0x40018f: Stereo Amp-In Amp-Out
  Amp-In caps: ofs=0x00, nsteps=0x03, stepsize=0x27, mute=0
  Amp-In vals:  [0x00 0x00]
  Amp-Out caps: ofs=0x00, nsteps=0x00, stepsize=0x00, mute=1
  Amp-Out vals:  [0x80 0x80]
  Pincap 0x0000173e: IN OUT HP Detect Trigger
    Vref caps: HIZ 50 GRD 80
  Pin Default 0x411111f0: [N/A] Speaker at Ext Rear
    Conn = 1/8, Color = Black
    DefAssociation = 0xf, Sequence = 0x0
    Misc = NO_PRESENCE
  Pin-ctls: 0x20: IN VREF_HIZ
  Unsolicited: tag=00, enabled=0
  Connection: 2
     0x0c* 0x0d
Node 0x1b [Pin Complex] wcaps 0x40018f: Stereo Amp-In Amp-Out
  Amp-In caps: ofs=0x00, nsteps=0x03, stepsize=0x27, mute=0
  Amp-In vals:  [0x00 0x00]
  Amp-Out caps: ofs=0x00, nsteps=0x00, stepsize=0x00, mute=1
  Amp-Out vals:  [0x80 0x80]
  Pincap 0x0000173e: IN OUT HP Detect Trigger
    Vref caps: HIZ 50 GRD 80
  Pin Default 0x411111f0: [N/A] Speaker at Ext Rear
    Conn = 1/8, Color = Black
    DefAssociation = 0xf, Sequence = 0x0
    Misc = NO_PRESENCE
  Pin-ctls: 0x20: IN VREF_HIZ
  Unsolicited: tag=00, enabled=0
  Connection: 2
     0x0c* 0x0d
Node 0x1c [Pin Complex] wcaps 0x400001: Stereo
  Pincap 0x00000020: IN
  Pin Default 0x411111f0: [N/A] Speaker at Ext Rear
    Conn = 1/8, Color = Black
    DefAssociation = 0xf, Sequence = 0x0
    Misc = NO_PRESENCE
  Pin-ctls: 0x00:
Node 0x1d [Pin Complex] wcaps 0x400000: Mono
  Pincap 0x00000020: IN
  Pin Default 0x411111f0: [N/A] Speaker at Ext Rear
    Conn = 1/8, Color = Black
    DefAssociation = 0xf, Sequence = 0x0
    Misc = NO_PRESENCE
  Pin-ctls: 0x00:
Node 0x1e [Pin Complex] wcaps 0x400380: Mono Digital
  Pincap 0x00000010: OUT
  Pin Default 0x411111f0: [N/A] Speaker at Ext Rear
    Conn = 1/8, Color = Black
    DefAssociation = 0xf, Sequence = 0x0
    Misc = NO_PRESENCE
  Pin-ctls: 0x00:
  Unsolicited: tag=00, enabled=0
  Connection: 1
     0x06
Node 0x1f [Pin Complex] wcaps 0x400280: Mono Digital
  Pincap 0x00000020: IN
  Pin Default 0x411111f0: [N/A] Speaker at Ext Rear
    Conn = 1/8, Color = Black
    DefAssociation = 0xf, Sequence = 0x0
    Misc = NO_PRESENCE
  Pin-ctls: 0x00:
  Unsolicited: tag=00, enabled=0
Node 0x20 [Vendor Defined Widget] wcaps 0xf00040: Mono
  Processing caps: benign=0, ncoeff=17
  Processing Coefficient: 0x00
  Coefficient Index: 0x0c
Node 0x21 [Volume Knob Widget] wcaps 0x600080: Mono
  Volume-Knob: delta=0, steps=32, direct=0, val=0
  Unsolicited: tag=00, enabled=0
  Connection: 0
Node 0x22 [Audio Mixer] wcaps 0x20010f: Stereo Amp-In Amp-Out
  Amp-In caps: ofs=0x00, nsteps=0x00, stepsize=0x00, mute=1
  Amp-In vals:  [0x00 0x00] [0x80 0x80] [0x80 0x80] [0x80 0x80] [0x80 0x80] [0x80 0x80] [0x80 0x80] [0x80 0x80] [0x80 0x80]
  Amp-Out caps: N/A
  Amp-Out vals:  [0x00 0x00]
  Connection: 9
     0x18 0x19 0x1a 0x1b 0x1c 0x1d 0x14 0x15 0x0b
Node 0x23 [Audio Mixer] wcaps 0x20010f: Stereo Amp-In Amp-Out
  Amp-In caps: ofs=0x00, nsteps=0x00, stepsize=0x00, mute=1
  Amp-In vals:  [0x00 0x00] [0x80 0x80] [0x80 0x80] [0x80 0x80] [0x80 0x80] [0x80 0x80] [0x80 0x80] [0x80 0x80] [0x80 0x80]
  Amp-Out caps: N/A
  Amp-Out vals:  [0x00 0x00]
  Connection: 9
     0x18 0x19 0x1a 0x1b 0x1c 0x1d 0x14 0x15 0x0b
Node 0x24 [Audio Mixer] wcaps 0x20010f: Stereo Amp-In Amp-Out
  Amp-In caps: ofs=0x00, nsteps=0x00, stepsize=0x00, mute=1
  Amp-In vals:  [0x00 0x00] [0x80 0x80] [0x80 0x80] [0x80 0x80] [0x80 0x80] [0x80 0x80] [0x80 0x80] [0x80 0x80] [0x80 0x80]
  Amp-Out caps: N/A
  Amp-Out vals:  [0x00 0x00]
  Connection: 9
     0x18 0x19 0x1a 0x1b 0x1c 0x1d 0x14 0x15 0x0b
Codec: Conexant ID 2c06
Address: 1
Vendor Id: 0x14f12c06
Subsystem Id: 0x104d1700
Revision Id: 0x100000
Modem Function Group: 0x2
--endcollapse--


!!ALSA Device nodes
!!-----------------

crw-rw----  1 root audio 116,  0 févr. 26  2009 /dev/snd/controlC0
crw-rw----  1 root audio 116,  4 févr. 26  2009 /dev/snd/hwC0D0
crw-rw----  1 root audio 116,  5 févr. 26  2009 /dev/snd/hwC0D1
crw-rw----  1 root audio 116, 24 févr. 26 11:26 /dev/snd/pcmC0D0c
crw-rw----  1 root audio 116, 16 févr. 26 11:26 /dev/snd/pcmC0D0p
crw-rw----  1 root audio 116,  1 févr. 26  2009 /dev/snd/seq
crw-rw----  1 root audio 116, 33 févr. 26  2009 /dev/snd/timer


!!ALSA configuration files
!!------------------------

!!System wide config file (/etc/asound.conf)

# PulseAudio plugin configuration

# Let's create a virtual device "pulse" for mixer and PCM

pcm.pulse {
    type pulse
    hint {
        description "PulseAudio Sound Server"
    }
}

ctl.pulse {
    type pulse
    hint {
        description "PulseAudio Sound Server"
    }
}

# Let's make it the default!

pcm.!default {
    type pulse
    hint {
        description "Default"
    }
}

ctl.!default {
    type pulse
    hint {
        description "Default"
    }
}



!!Aplay/Arecord output
!!------------

APLAY

**** List of PLAYBACK Hardware Devices ****
card 0: Intel [HDA Intel], device 0: ALC262 Analog [ALC262 Analog]
  Subdevices: 1/1
  Subdevice #0: subdevice #0

ARECORD

**** List of CAPTURE Hardware Devices ****
card 0: Intel [HDA Intel], device 0: ALC262 Analog [ALC262 Analog]
  Subdevices: 1/1
  Subdevice #0: subdevice #0

!!Amixer output
!!-------------

!!-------Mixer controls for card 0 [Intel]

Card hw:0 'Intel'/'HDA Intel at 0xfc300000 irq 22'
  Mixer name	: 'Realtek ALC262'
  Components	: 'HDA:10ec0262,104d2800,00100100 HDA:14f12c06,104d1700,00100000'
  Controls      : 18
  Simple ctrls  : 12
Simple mixer control 'Master',0
  Capabilities: pvolume pvolume-joined pswitch pswitch-joined
  Playback channels: Mono
  Limits: Playback 0 - 31
  Mono: Playback 31 [100%] [0.00dB] [on]
Simple mixer control 'Headphone',0
  Capabilities: pswitch
  Playback channels: Front Left - Front Right
  Mono:
  Front Left: Playback [on]
  Front Right: Playback [on]
Simple mixer control 'PCM',0
  Capabilities: pvolume
  Playback channels: Front Left - Front Right
  Limits: Playback 0 - 255
  Mono:
  Front Left: Playback 255 [100%] [0.00dB]
  Front Right: Playback 255 [100%] [0.00dB]
Simple mixer control 'Front',0
  Capabilities: pvolume pswitch
  Playback channels: Front Left - Front Right
  Limits: Playback 0 - 31
  Mono:
  Front Left: Playback 17 [55%] [-21.00dB] [on]
  Front Right: Playback 17 [55%] [-21.00dB] [on]
Simple mixer control 'Mic',0
  Capabilities: pvolume pswitch
  Playback channels: Front Left - Front Right
  Limits: Playback 0 - 31
  Mono:
  Front Left: Playback 31 [100%] [12.00dB] [on]
  Front Right: Playback 31 [100%] [12.00dB] [on]
Simple mixer control 'Mic Boost',0
  Capabilities: volume
  Playback channels: Front Left - Front Right
  Capture channels: Front Left - Front Right
  Limits: 0 - 3
  Front Left: 0 [0%]
  Front Right: 0 [0%]
Simple mixer control 'Capture',0
  Capabilities: cvolume cswitch
  Capture channels: Front Left - Front Right
  Limits: Capture 0 - 31
  Front Left: Capture 21 [68%] [19.50dB] [on]
  Front Right: Capture 21 [68%] [19.50dB] [on]
Simple mixer control 'Capture',1
  Capabilities: cvolume cswitch
  Capture channels: Front Left - Front Right
  Limits: Capture 0 - 31
  Front Left: Capture 0 [0%] [-12.00dB] [on]
  Front Right: Capture 0 [0%] [-12.00dB] [on]
Simple mixer control 'Capture',2
  Capabilities: cvolume cswitch
  Capture channels: Front Left - Front Right
  Limits: Capture 0 - 31
  Front Left: Capture 0 [0%] [-12.00dB] [on]
  Front Right: Capture 0 [0%] [-12.00dB] [on]
Simple mixer control 'Input Source',0
  Capabilities: cenum
  Items: 'Mic'
  Item0: 'Mic'
Simple mixer control 'Input Source',1
  Capabilities: cenum
  Items: 'Mic'
  Item0: 'Mic'
Simple mixer control 'Input Source',2
  Capabilities: cenum
  Items: 'Mic'
  Item0: 'Mic'


!!Alsactl output
!!-------------

--startcollapse--
state.Intel {
	control.1 {
		comment.access 'read write'
		comment.type INTEGER
		comment.count 2
		comment.range '0 - 31'
		comment.dbmin -4650
		comment.dbmax 0
		iface MIXER
		name 'Front Playback Volume'
		value.0 17
		value.1 17
	}
	control.2 {
		comment.access 'read write'
		comment.type BOOLEAN
		comment.count 2
		iface MIXER
		name 'Front Playback Switch'
		value.0 true
		value.1 true
	}
	control.3 {
		comment.access 'read write'
		comment.type BOOLEAN
		comment.count 2
		iface MIXER
		name 'Headphone Playback Switch'
		value.0 true
		value.1 true
	}
	control.4 {
		comment.access 'read write'
		comment.type INTEGER
		comment.count 2
		comment.range '0 - 31'
		comment.dbmin -3450
		comment.dbmax 1200
		iface MIXER
		name 'Mic Playback Volume'
		value.0 31
		value.1 31
	}
	control.5 {
		comment.access 'read write'
		comment.type BOOLEAN
		comment.count 2
		iface MIXER
		name 'Mic Playback Switch'
		value.0 true
		value.1 true
	}
	control.6 {
		comment.access 'read write'
		comment.type INTEGER
		comment.count 2
		comment.range '0 - 3'
		comment.dbmin 0
		comment.dbmax 3000
		iface MIXER
		name 'Mic Boost'
		value.0 0
		value.1 0
	}
	control.7 {
		comment.access 'read write'
		comment.type BOOLEAN
		comment.count 2
		iface MIXER
		name 'Capture Switch'
		value.0 true
		value.1 true
	}
	control.8 {
		comment.access 'read write'
		comment.type BOOLEAN
		comment.count 2
		iface MIXER
		name 'Capture Switch'
		index 1
		value.0 true
		value.1 true
	}
	control.9 {
		comment.access 'read write'
		comment.type BOOLEAN
		comment.count 2
		iface MIXER
		name 'Capture Switch'
		index 2
		value.0 true
		value.1 true
	}
	control.10 {
		comment.access 'read write'
		comment.type INTEGER
		comment.count 2
		comment.range '0 - 31'
		comment.dbmin -1200
		comment.dbmax 3450
		iface MIXER
		name 'Capture Volume'
		value.0 21
		value.1 21
	}
	control.11 {
		comment.access 'read write'
		comment.type INTEGER
		comment.count 2
		comment.range '0 - 31'
		comment.dbmin -1200
		comment.dbmax 3450
		iface MIXER
		name 'Capture Volume'
		index 1
		value.0 0
		value.1 0
	}
	control.12 {
		comment.access 'read write'
		comment.type INTEGER
		comment.count 2
		comment.range '0 - 31'
		comment.dbmin -1200
		comment.dbmax 3450
		iface MIXER
		name 'Capture Volume'
		index 2
		value.0 0
		value.1 0
	}
	control.13 {
		comment.access 'read write'
		comment.type ENUMERATED
		comment.count 1
		comment.item.0 Mic
		iface MIXER
		name 'Input Source'
		value Mic
	}
	control.14 {
		comment.access 'read write'
		comment.type ENUMERATED
		comment.count 1
		comment.item.0 Mic
		iface MIXER
		name 'Input Source'
		index 1
		value Mic
	}
	control.15 {
		comment.access 'read write'
		comment.type ENUMERATED
		comment.count 1
		comment.item.0 Mic
		iface MIXER
		name 'Input Source'
		index 2
		value Mic
	}
	control.16 {
		comment.access 'read write'
		comment.type INTEGER
		comment.count 1
		comment.range '0 - 31'
		comment.dbmin -4650
		comment.dbmax 0
		iface MIXER
		name 'Master Playback Volume'
		value 31
	}
	control.17 {
		comment.access 'read write'
		comment.type BOOLEAN
		comment.count 1
		iface MIXER
		name 'Master Playback Switch'
		value true
	}
	control.18 {
		comment.access 'read write user'
		comment.type INTEGER
		comment.count 2
		comment.range '0 - 255'
		comment.tlv '0000000100000008ffffec1400000014'
		comment.dbmin -5100
		comment.dbmax 0
		iface MIXER
		name 'PCM Playback Volume'
		value.0 255
		value.1 255
	}
}
--endcollapse--


!!All Loaded Modules
!!------------------

Module
wlan_wep
wlan_tkip
wlan_ccmp
ipv6
microcode
af_packet
acpi_cpufreq
cpufreq_powersave
cpufreq_userspace
fuse
mmc_block
snd_hda_intel
snd_seq_dummy
snd_seq_oss
snd_seq_midi_event
snd_seq
snd_seq_device
snd_pcm_oss
snd_mixer_oss
tifm_ms
memstick
snd_pcm
tifm_sd
mmc_core
wlan_scan_sta
pcmcia
ath_rate_sample
rtc_cmos
rtc_core
firmware_class
rtc_lib
snd_timer
serio_raw
snd_page_alloc
joydev
i915
iTCO_wdt
thermal
snd_hwdep
sony_laptop
drm
i2c_i801
iTCO_vendor_support
ath_pci
tifm_7xx1
sg
yenta_socket
video
battery
rsrc_nonstatic
button
tifm_core
output
snd
processor
pcmcia_core
intel_agp
ac
wlan
i2c_algo_bit
sky2
agpgart
ath_hal
i2c_core
soundcore
ext3
jbd
mbcache
sr_mod
cdrom
sd_mod
usb_storage
usbhid
hid
ff_memless
ahci
ata_piix
ohci1394
ieee1394
uhci_hcd
pata_acpi
ata_generic
libata
scsi_mod
dock
ehci_hcd
usbcore


