upload=true&script=true&cardinfo=
!!################################
!!ALSA Information Script v 0.4.59
!!################################

!!Script ran on: Mon Mar 15 11:54:22 UTC 2010


!!Linux Distribution
!!------------------

Debian GNU/Linux squeeze/sid \n \l


!!DMI Information
!!---------------

Manufacturer:      Acer
Product Name:      Aspire 9300


!!Kernel Information
!!------------------

Kernel release:    2.6.33-0.slh.16-sidux-amd64
Operating System:  GNU/Linux
Architecture:      x86_64
Processor:         unknown
SMP Enabled:       Yes


!!ALSA Version
!!------------

Driver version:     1.0.21
Library version:    1.0.22
Utilities version:  1.0.22


!!Loaded ALSA modules
!!-------------------

snd_hda_intel


!!Sound Servers on this system
!!----------------------------

aRts:
      Installed - Yes (/usr/bin/artsd)
      Running - No


!!Soundcards recognised by ALSA
!!-----------------------------

 0 [NVidia         ]: HDA-Intel - HDA NVidia
                      HDA NVidia at 0xc0000000 irq 18


!!PCI Soundcards installed in the system
!!--------------------------------------

00:10.1 Audio device: nVidia Corporation MCP51 High Definition Audio (rev a2)
04:06.2 Mass storage controller: Texas Instruments 5-in-1 Multimedia Card Reader (SD/MMC/MS/MS PRO/xD)


!!Advanced information - PCI Vendor/Device/Susbsystem ID's
!!--------------------------------------------------------

00:10.1 0403: 10de:026c (rev a2)
	Subsystem: 1025:0112


!!Modprobe options (Sound related)
!!--------------------------------

snd-atiixp-modem: index=-2
snd-intel8x0m: index=-2
snd-via82xx-modem: index=-2
snd-pcsp: index=-2
snd-hda-intel: enable_msi=0
snd-atiixp-modem: index=-2
snd-intel8x0m: index=-2
snd-via82xx-modem: index=-2
snd-pcsp: index=-2
snd-hda-intel: enable_msi=0


!!Loaded sound module options
!!--------------------------

!!Module: snd_hda_intel
	bdl_pos_adj : 32,-1,-1,-1,-1,-1,-1,-1,-1,-1,-1,-1,-1,-1,-1,-1,-1,-1,-1,-1,-1,-1,-1,-1,-1,-1,-1,-1,-1,-1,-1,-1
	beep_mode : 0,0,0,0,0,0,0,0,0,0,0,0,0,0,0,0,0,0,0,0,0,0,0,0,0,0,0,0,0,0,0,0
	enable : Y,Y,Y,Y,Y,Y,Y,Y,Y,Y,Y,Y,Y,Y,Y,Y,Y,Y,Y,Y,Y,Y,Y,Y,Y,Y,Y,Y,Y,Y,Y,Y
	enable_msi : 0
	id : (null),(null),(null),(null),(null),(null),(null),(null),(null),(null),(null),(null),(null),(null),(null),(null),(null),(null),(null),(null),(null),(null),(null),(null),(null),(null),(null),(null),(null),(null),(null),(null)
	index : -1,-1,-1,-1,-1,-1,-1,-1,-1,-1,-1,-1,-1,-1,-1,-1,-1,-1,-1,-1,-1,-1,-1,-1,-1,-1,-1,-1,-1,-1,-1,-1
	model : (null),(null),(null),(null),(null),(null),(null),(null),(null),(null),(null),(null),(null),(null),(null),(null),(null),(null),(null),(null),(null),(null),(null),(null),(null),(null),(null),(null),(null),(null),(null),(null)
	patch : (null),(null),(null),(null),(null),(null),(null),(null),(null),(null),(null),(null),(null),(null),(null),(null),(null),(null),(null),(null),(null),(null),(null),(null),(null),(null),(null),(null),(null),(null),(null),(null)
	position_fix : 0,0,0,0,0,0,0,0,0,0,0,0,0,0,0,0,0,0,0,0,0,0,0,0,0,0,0,0,0,0,0,0
	power_save : 0
	power_save_controller : Y
	probe_mask : -1,-1,-1,-1,-1,-1,-1,-1,-1,-1,-1,-1,-1,-1,-1,-1,-1,-1,-1,-1,-1,-1,-1,-1,-1,-1,-1,-1,-1,-1,-1,-1
	probe_only : N,N,N,N,N,N,N,N,N,N,N,N,N,N,N,N,N,N,N,N,N,N,N,N,N,N,N,N,N,N,N,N
	single_cmd : N


!!HDA-Intel Codec information
!!---------------------------
--startcollapse--

Codec: Realtek ALC883
Address: 0
Function Id: 0x1
Vendor Id: 0x10ec0883
Subsystem Id: 0x10250000
Revision Id: 0x100002
No Modem Function Group found
Default PCM:
    rates [0x560]: 44100 48000 96000 192000
    bits [0xe]: 16 20 24
    formats [0x1]: PCM
Default Amp-In caps: N/A
Default Amp-Out caps: N/A
GPIO: io=2, o=0, i=0, unsolicited=1, wake=0
  IO[0]: enable=0, dir=0, wake=0, sticky=0, data=0, unsol=0
  IO[1]: enable=0, dir=0, wake=0, sticky=0, data=0, unsol=0
Node 0x02 [Audio Output] wcaps 0x11: Stereo
  Device: name="ALC883 Analog", type="Audio", device=0
  Converter: stream=0, channel=0
  PCM:
    rates [0x560]: 44100 48000 96000 192000
    bits [0xe]: 16 20 24
    formats [0x1]: PCM
Node 0x03 [Audio Output] wcaps 0x11: Stereo
  Converter: stream=0, channel=0
  PCM:
    rates [0x560]: 44100 48000 96000 192000
    bits [0xe]: 16 20 24
    formats [0x1]: PCM
Node 0x04 [Audio Output] wcaps 0x11: Stereo
  Converter: stream=0, channel=0
  PCM:
    rates [0x560]: 44100 48000 96000 192000
    bits [0xe]: 16 20 24
    formats [0x1]: PCM
Node 0x05 [Audio Output] wcaps 0x11: Stereo
  Converter: stream=0, channel=0
  PCM:
    rates [0x560]: 44100 48000 96000 192000
    bits [0xe]: 16 20 24
    formats [0x1]: PCM
Node 0x06 [Audio Output] wcaps 0x211: Stereo Digital
  Control: name="IEC958 Playback Con Mask", index=0, device=0
  Control: name="IEC958 Playback Pro Mask", index=0, device=0
  Control: name="IEC958 Playback Default", index=0, device=0
  Control: name="IEC958 Playback Switch", index=0, device=0
  Control: name="IEC958 Default PCM Playback Switch", index=0, device=0
  Device: name="ALC883 Digital", type="SPDIF", device=1
  Converter: stream=0, channel=0
  Digital: Enabled
  Digital category: 0x0
  PCM:
    rates [0x560]: 44100 48000 96000 192000
    bits [0x1e]: 16 20 24 32
    formats [0x1]: PCM
Node 0x07 [Vendor Defined Widget] wcaps 0xf00000: Mono
Node 0x08 [Audio Input] wcaps 0x10011b: Stereo Amp-In
  Device: name="ALC883 Analog", type="Audio", device=0
  Amp-In caps: ofs=0x08, nsteps=0x1f, stepsize=0x05, mute=1
  Amp-In vals:  [0x07 0x07]
  Converter: stream=0, channel=0
  SDI-Select: 0
  PCM:
    rates [0x160]: 44100 48000 96000
    bits [0x6]: 16 20
    formats [0x1]: PCM
  Connection: 1
     0x23
Node 0x09 [Audio Input] wcaps 0x10011b: Stereo Amp-In
  Device: name="ALC883 Analog", type="Audio", device=2
  Amp-In caps: ofs=0x08, nsteps=0x1f, stepsize=0x05, mute=1
  Amp-In vals:  [0x00 0x00]
  Converter: stream=0, channel=0
  SDI-Select: 0
  PCM:
    rates [0x160]: 44100 48000 96000
    bits [0x6]: 16 20
    formats [0x1]: PCM
  Connection: 1
     0x22
Node 0x0a [Audio Input] wcaps 0x100391: Stereo Digital
  Converter: stream=0, channel=0
  SDI-Select: 0
  Digital:
  Digital category: 0x0
  PCM:
    rates [0x560]: 44100 48000 96000 192000
    bits [0x1e]: 16 20 24 32
    formats [0x1]: PCM
  Unsolicited: tag=00, enabled=0
  Connection: 1
     0x1f
Node 0x0b [Audio Mixer] wcaps 0x20010b: Stereo Amp-In
  Control: name="Line Playback Volume", index=0, device=0
  Control: name="Line Playback Switch", index=0, device=0
  Control: name="Mic Playback Volume", index=0, device=0
  Control: name="Mic Playback Switch", index=0, device=0
  Control: name="Beep Playback Volume", index=0, device=0
  Control: name="Beep Playback Switch", index=0, device=0
  Amp-In caps: ofs=0x17, nsteps=0x1f, stepsize=0x05, mute=1
  Amp-In vals:  [0x15 0x15] [0x80 0x80] [0x1f 0x1f] [0x80 0x80] [0x80 0x80] [0x00 0x00] [0x80 0x80] [0x80 0x80] [0x80 0x80] [0x80 0x80]
  Connection: 10
     0x18 0x19 0x1a 0x1b 0x1c 0x1d 0x14 0x15 0x16 0x17
Node 0x0c [Audio Mixer] wcaps 0x20010f: Stereo Amp-In Amp-Out
  Control: name="Front Playback Volume", index=0, device=0
  Amp-In caps: ofs=0x00, nsteps=0x00, stepsize=0x00, mute=1
  Amp-In vals:  [0x00 0x00] [0x00 0x00]
  Amp-Out caps: ofs=0x1f, nsteps=0x1f, stepsize=0x05, mute=0
  Amp-Out vals:  [0x0a 0x0a]
  Connection: 2
     0x02 0x0b
Node 0x0d [Audio Mixer] wcaps 0x20010f: Stereo Amp-In Amp-Out
  Amp-In caps: ofs=0x00, nsteps=0x00, stepsize=0x00, mute=1
  Amp-In vals:  [0x80 0x80] [0x80 0x80]
  Amp-Out caps: ofs=0x1f, nsteps=0x1f, stepsize=0x05, mute=0
  Amp-Out vals:  [0x00 0x00]
  Connection: 2
     0x03 0x0b
Node 0x0e [Audio Mixer] wcaps 0x20010f: Stereo Amp-In Amp-Out
  Amp-In caps: ofs=0x00, nsteps=0x00, stepsize=0x00, mute=1
  Amp-In vals:  [0x80 0x80] [0x80 0x80]
  Amp-Out caps: ofs=0x1f, nsteps=0x1f, stepsize=0x05, mute=0
  Amp-Out vals:  [0x00 0x00]
  Connection: 2
     0x04 0x0b
Node 0x0f [Audio Mixer] wcaps 0x20010f: Stereo Amp-In Amp-Out
  Amp-In caps: ofs=0x00, nsteps=0x00, stepsize=0x00, mute=1
  Amp-In vals:  [0x80 0x80] [0x80 0x80]
  Amp-Out caps: ofs=0x1f, nsteps=0x1f, stepsize=0x05, mute=0
  Amp-Out vals:  [0x00 0x00]
  Connection: 2
     0x05 0x0b
Node 0x10 [Vendor Defined Widget] wcaps 0xf00000: Mono
Node 0x11 [Vendor Defined Widget] wcaps 0xf00000: Mono
Node 0x12 [Vendor Defined Widget] wcaps 0xf00000: Mono
Node 0x13 [Vendor Defined Widget] wcaps 0xf00000: Mono
Node 0x14 [Pin Complex] wcaps 0x40018f: Stereo Amp-In Amp-Out
  Control: name="Headphone Playback Switch", index=0, device=0
  Amp-In caps: ofs=0x00, nsteps=0x03, stepsize=0x27, mute=0
  Amp-In vals:  [0x00 0x00]
  Amp-Out caps: ofs=0x00, nsteps=0x00, stepsize=0x00, mute=1
  Amp-Out vals:  [0x00 0x00]
  Pincap 0x0000003e: IN OUT HP Detect Trigger
  Pin Default 0x0121101f: [Jack] HP Out at Ext Rear
    Conn = 1/8, Color = Black
    DefAssociation = 0x1, Sequence = 0xf
  Pin-ctls: 0xc0: OUT HP
  Unsolicited: tag=04, enabled=1
  Connection: 5
     0x0c* 0x0d 0x0e 0x0f 0x26
Node 0x15 [Pin Complex] wcaps 0x40018f: Stereo Amp-In Amp-Out
  Amp-In caps: ofs=0x00, nsteps=0x03, stepsize=0x27, mute=0
  Amp-In vals:  [0x00 0x00]
  Amp-Out caps: ofs=0x00, nsteps=0x00, stepsize=0x00, mute=1
  Amp-Out vals:  [0x00 0x00]
  Pincap 0x0000003e: IN OUT HP Detect Trigger
  Pin Default 0x99130110: [Fixed] Speaker at Int ATAPI
    Conn = ATAPI, Color = Unknown
    DefAssociation = 0x1, Sequence = 0x0
    Misc = NO_PRESENCE
  Pin-ctls: 0x40: OUT
  Unsolicited: tag=00, enabled=0
  Connection: 5
     0x0c* 0x0d 0x0e 0x0f 0x26
Node 0x16 [Pin Complex] wcaps 0x40018f: Stereo Amp-In Amp-Out
  Amp-In caps: ofs=0x00, nsteps=0x03, stepsize=0x27, mute=0
  Amp-In vals:  [0x00 0x00]
  Amp-Out caps: ofs=0x00, nsteps=0x00, stepsize=0x00, mute=1
  Amp-Out vals:  [0x00 0x00]
  Pincap 0x0000003e: IN OUT HP Detect Trigger
  Pin Default 0x411111f0: [N/A] Speaker at Ext Rear
    Conn = 1/8, Color = Black
    DefAssociation = 0xf, Sequence = 0x0
    Misc = NO_PRESENCE
  Pin-ctls: 0x40: OUT
  Unsolicited: tag=00, enabled=0
  Connection: 5
     0x0c* 0x0d 0x0e 0x0f 0x26
Node 0x17 [Pin Complex] wcaps 0x40018f: Stereo Amp-In Amp-Out
  Amp-In caps: ofs=0x00, nsteps=0x03, stepsize=0x27, mute=0
  Amp-In vals:  [0x00 0x00]
  Amp-Out caps: ofs=0x00, nsteps=0x00, stepsize=0x00, mute=1
  Amp-Out vals:  [0x00 0x00]
  Pincap 0x0000003e: IN OUT HP Detect Trigger
  Pin Default 0x411111f0: [N/A] Speaker at Ext Rear
    Conn = 1/8, Color = Black
    DefAssociation = 0xf, Sequence = 0x0
    Misc = NO_PRESENCE
  Pin-ctls: 0x40: OUT
  Unsolicited: tag=00, enabled=0
  Connection: 5
     0x0c 0x0d 0x0e 0x0f* 0x26
Node 0x18 [Pin Complex] wcaps 0x40018f: Stereo Amp-In Amp-Out
  Control: name="Mic Boost", index=0, device=0
  Amp-In caps: ofs=0x00, nsteps=0x03, stepsize=0x27, mute=0
  Amp-In vals:  [0x02 0x02]
  Amp-Out caps: ofs=0x00, nsteps=0x00, stepsize=0x00, mute=1
  Amp-Out vals:  [0x80 0x80]
  Pincap 0x0000173e: IN OUT HP Detect Trigger
    Vref caps: HIZ 50 GRD 80
  Pin Default 0x01a19830: [Jack] Mic at Ext Rear
    Conn = 1/8, Color = Pink
    DefAssociation = 0x3, Sequence = 0x0
  Pin-ctls: 0x24: IN VREF_80
  Unsolicited: tag=00, enabled=0
  Connection: 5
     0x0c* 0x0d 0x0e 0x0f 0x26
Node 0x19 [Pin Complex] wcaps 0x40018f: Stereo Amp-In Amp-Out
  Amp-In caps: ofs=0x00, nsteps=0x03, stepsize=0x27, mute=0
  Amp-In vals:  [0x00 0x00]
  Amp-Out caps: ofs=0x00, nsteps=0x00, stepsize=0x00, mute=1
  Amp-Out vals:  [0x80 0x80]
  Pincap 0x0000173e: IN OUT HP Detect Trigger
    Vref caps: HIZ 50 GRD 80
  Pin Default 0x99a30131: [Fixed] Mic at Int ATAPI
    Conn = ATAPI, Color = Unknown
    DefAssociation = 0x3, Sequence = 0x1
    Misc = NO_PRESENCE
  Pin-ctls: 0x24: IN VREF_80
  Unsolicited: tag=00, enabled=0
  Connection: 5
     0x0c* 0x0d 0x0e 0x0f 0x26
Node 0x1a [Pin Complex] wcaps 0x40018f: Stereo Amp-In Amp-Out
  Amp-In caps: ofs=0x00, nsteps=0x03, stepsize=0x27, mute=0
  Amp-In vals:  [0x00 0x00]
  Amp-Out caps: ofs=0x00, nsteps=0x00, stepsize=0x00, mute=1
  Amp-Out vals:  [0x80 0x80]
  Pincap 0x0000173e: IN OUT HP Detect Trigger
    Vref caps: HIZ 50 GRD 80
  Pin Default 0x0181303f: [Jack] Line In at Ext Rear
    Conn = 1/8, Color = Blue
    DefAssociation = 0x3, Sequence = 0xf
  Pin-ctls: 0x20: IN VREF_HIZ
  Unsolicited: tag=00, enabled=0
  Connection: 5
     0x0c* 0x0d 0x0e 0x0f 0x26
Node 0x1b [Pin Complex] wcaps 0x40018f: Stereo Amp-In Amp-Out
  Amp-In caps: ofs=0x00, nsteps=0x03, stepsize=0x27, mute=0
  Amp-In vals:  [0x00 0x00]
  Amp-Out caps: ofs=0x00, nsteps=0x00, stepsize=0x00, mute=1
  Amp-Out vals:  [0x00 0x00]
  Pincap 0x0000173e: IN OUT HP Detect Trigger
    Vref caps: HIZ 50 GRD 80
  Pin Default 0x411111f0: [N/A] Speaker at Ext Rear
    Conn = 1/8, Color = Black
    DefAssociation = 0xf, Sequence = 0x0
    Misc = NO_PRESENCE
  Pin-ctls: 0xc0: OUT HP VREF_HIZ
  Unsolicited: tag=00, enabled=0
  Connection: 5
     0x0c* 0x0d 0x0e 0x0f 0x26
Node 0x1c [Pin Complex] wcaps 0x400001: Stereo
  Pincap 0x00000020: IN
  Pin Default 0x411111f0: [N/A] Speaker at Ext Rear
    Conn = 1/8, Color = Black
    DefAssociation = 0xf, Sequence = 0x0
    Misc = NO_PRESENCE
  Pin-ctls: 0x00:
Node 0x1d [Pin Complex] wcaps 0x400000: Mono
  Pincap 0x00000020: IN
  Pin Default 0x411111f0: [N/A] Speaker at Ext Rear
    Conn = 1/8, Color = Black
    DefAssociation = 0xf, Sequence = 0x0
    Misc = NO_PRESENCE
  Pin-ctls: 0x00:
Node 0x1e [Pin Complex] wcaps 0x400300: Mono Digital
  Pincap 0x00000010: OUT
  Pin Default 0x01451120: [Jack] SPDIF Out at Ext Rear
    Conn = Optical, Color = Black
    DefAssociation = 0x2, Sequence = 0x0
    Misc = NO_PRESENCE
  Pin-ctls: 0x00:
  Connection: 1
     0x06
Node 0x1f [Pin Complex] wcaps 0x400200: Mono Digital
  Pincap 0x00000020: IN
  Pin Default 0x411111f0: [N/A] Speaker at Ext Rear
    Conn = 1/8, Color = Black
    DefAssociation = 0xf, Sequence = 0x0
    Misc = NO_PRESENCE
  Pin-ctls: 0x00:
Node 0x20 [Vendor Defined Widget] wcaps 0xf00040: Mono
  Processing caps: benign=0, ncoeff=17
  Processing Coefficient: 0x6000
  Coefficient Index: 0x09
Node 0x21 [Vendor Defined Widget] wcaps 0xf00000: Mono
Node 0x22 [Audio Mixer] wcaps 0x20010f: Stereo Amp-In Amp-Out
  Amp-In caps: ofs=0x00, nsteps=0x00, stepsize=0x00, mute=1
  Amp-In vals:  [0x00 0x00] [0x80 0x80] [0x80 0x80] [0x80 0x80] [0x80 0x80] [0x80 0x80] [0x80 0x80] [0x80 0x80] [0x80 0x80] [0x80 0x80] [0x80 0x80]
  Amp-Out caps: N/A
  Amp-Out vals:  [0x00 0x00]
  Connection: 11
     0x18 0x19 0x1a 0x1b 0x1c 0x1d 0x14 0x15 0x16 0x17 0x0b
Node 0x23 [Audio Mixer] wcaps 0x20010f: Stereo Amp-In Amp-Out
  Amp-In caps: ofs=0x00, nsteps=0x00, stepsize=0x00, mute=1
  Amp-In vals:  [0x00 0x00] [0x80 0x80] [0x80 0x80] [0x80 0x80] [0x80 0x80] [0x80 0x80] [0x80 0x80] [0x80 0x80] [0x80 0x80] [0x80 0x80] [0x80 0x80]
  Amp-Out caps: N/A
  Amp-Out vals:  [0x00 0x00]
  Connection: 11
     0x18 0x19 0x1a 0x1b 0x1c 0x1d 0x14 0x15 0x16 0x17 0x0b
Node 0x24 [Vendor Defined Widget] wcaps 0xf00000: Mono
Node 0x25 [Audio Output] wcaps 0x11: Stereo
  Converter: stream=0, channel=0
  PCM:
    rates [0x560]: 44100 48000 96000 192000
    bits [0xe]: 16 20 24
    formats [0x1]: PCM
Node 0x26 [Audio Mixer] wcaps 0x20010f: Stereo Amp-In Amp-Out
  Amp-In caps: ofs=0x00, nsteps=0x00, stepsize=0x00, mute=1
  Amp-In vals:  [0x00 0x00] [0x80 0x80]
  Amp-Out caps: ofs=0x1f, nsteps=0x1f, stepsize=0x05, mute=0
  Amp-Out vals:  [0x00 0x00]
  Connection: 2
     0x25 0x0b
Codec: Conexant ID 2c06
Address: 1
Function Id: 0x2
Vendor Id: 0x14f12c06
Subsystem Id: 0x10250093
Revision Id: 0x100000
Modem Function Group: 0x2
--endcollapse--


!!ALSA Device nodes
!!-----------------

crw-rw----+ 1 root audio 116, 10 Mar 15 12:12 /dev/snd/controlC0
crw-rw----+ 1 root audio 116,  9 Mar 15 12:12 /dev/snd/hwC0D0
crw-rw----+ 1 root audio 116,  8 Mar 15 12:12 /dev/snd/hwC0D1
crw-rw----+ 1 root audio 116,  7 Mar 15 12:12 /dev/snd/pcmC0D0c
crw-rw----+ 1 root audio 116,  6 Mar 15 12:12 /dev/snd/pcmC0D0p
crw-rw----+ 1 root audio 116,  5 Mar 15 12:12 /dev/snd/pcmC0D1p
crw-rw----+ 1 root audio 116,  4 Mar 15 12:12 /dev/snd/pcmC0D2c
crw-rw----+ 1 root audio 116,  3 Mar 15 12:12 /dev/snd/seq
crw-rw----+ 1 root audio 116,  2 Mar 15 12:12 /dev/snd/timer

/dev/snd/by-path:
total 0
drwxr-xr-x 2 root root  60 Mar 15 12:12 .
drwxr-xr-x 3 root root 240 Mar 15 12:12 ..
lrwxrwxrwx 1 root root  12 Mar 15 12:12 pci-0000:00:10.1 -> ../controlC0


!!Aplay/Arecord output
!!------------

APLAY

**** List of PLAYBACK Hardware Devices ****
card 0: NVidia [HDA NVidia], device 0: ALC883 Analog [ALC883 Analog]
  Subdevices: 1/1
  Subdevice #0: subdevice #0
card 0: NVidia [HDA NVidia], device 1: ALC883 Digital [ALC883 Digital]
  Subdevices: 1/1
  Subdevice #0: subdevice #0

ARECORD

**** List of CAPTURE Hardware Devices ****
card 0: NVidia [HDA NVidia], device 0: ALC883 Analog [ALC883 Analog]
  Subdevices: 1/1
  Subdevice #0: subdevice #0
card 0: NVidia [HDA NVidia], device 2: ALC883 Analog [ALC883 Analog]
  Subdevices: 1/1
  Subdevice #0: subdevice #0

!!Amixer output
!!-------------

!!-------Mixer controls for card 0 [NVidia]

Card hw:0 'NVidia'/'HDA NVidia at 0xc0000000 irq 18'
  Mixer name	: 'Realtek ALC883'
  Components	: 'HDA:10ec0883,10250000,00100002 HDA:14f12c06,10250093,00100000'
  Controls      : 25
  Simple ctrls  : 15
Simple mixer control 'Master',0
  Capabilities: pvolume pvolume-joined pswitch pswitch-joined penum
  Playback channels: Mono
  Limits: Playback 0 - 31
  Mono: Playback 31 [100%] [0.00dB] [on]
Simple mixer control 'Headphone',0
  Capabilities: pswitch penum
  Playback channels: Front Left - Front Right
  Mono:
  Front Left: Playback [on]
  Front Right: Playback [on]
Simple mixer control 'PCM',0
  Capabilities: pvolume penum
  Playback channels: Front Left - Front Right
  Limits: Playback 0 - 255
  Mono:
  Front Left: Playback 255 [100%] [0.00dB]
  Front Right: Playback 255 [100%] [0.00dB]
Simple mixer control 'Front',0
  Capabilities: pvolume pswitch penum
  Playback channels: Front Left - Front Right
  Limits: Playback 0 - 31
  Mono:
  Front Left: Playback 10 [32%] [-31.50dB] [on]
  Front Right: Playback 10 [32%] [-31.50dB] [on]
Simple mixer control 'Line',0
  Capabilities: pvolume pswitch penum
  Playback channels: Front Left - Front Right
  Limits: Playback 0 - 31
  Mono:
  Front Left: Playback 31 [100%] [12.00dB] [on]
  Front Right: Playback 31 [100%] [12.00dB] [on]
Simple mixer control 'Mic',0
  Capabilities: pvolume pswitch penum
  Playback channels: Front Left - Front Right
  Limits: Playback 0 - 31
  Mono:
  Front Left: Playback 21 [68%] [-3.00dB] [on]
  Front Right: Playback 21 [68%] [-3.00dB] [on]
Simple mixer control 'Mic Boost',0
  Capabilities: volume penum
  Playback channels: Front Left - Front Right
  Capture channels: Front Left - Front Right
  Limits: 0 - 3
  Front Left: 2 [67%]
  Front Right: 2 [67%]
Simple mixer control 'IEC958',0
  Capabilities: pswitch pswitch-joined penum
  Playback channels: Mono
  Mono: Playback [on]
Simple mixer control 'IEC958 Default PCM',0
  Capabilities: pswitch pswitch-joined penum
  Playback channels: Mono
  Mono: Playback [on]
Simple mixer control 'Beep',0
  Capabilities: pvolume pswitch penum
  Playback channels: Front Left - Front Right
  Limits: Playback 0 - 31
  Mono:
  Front Left: Playback 0 [0%] [-34.50dB] [on]
  Front Right: Playback 0 [0%] [-34.50dB] [on]
Simple mixer control 'Capture',0
  Capabilities: cvolume cswitch penum
  Capture channels: Front Left - Front Right
  Limits: Capture 0 - 31
  Front Left: Capture 7 [23%] [-1.50dB] [on]
  Front Right: Capture 7 [23%] [-1.50dB] [on]
Simple mixer control 'Capture',1
  Capabilities: cvolume cswitch penum
  Capture channels: Front Left - Front Right
  Limits: Capture 0 - 31
  Front Left: Capture 0 [0%] [-12.00dB] [on]
  Front Right: Capture 0 [0%] [-12.00dB] [on]
Simple mixer control 'Digital',0
  Capabilities: cvolume penum
  Capture channels: Front Left - Front Right
  Limits: Capture 0 - 120
  Front Left: Capture 120 [100%] [30.00dB]
  Front Right: Capture 120 [100%] [30.00dB]
Simple mixer control 'Input Source',0
  Capabilities: cenum
  Items: 'Mic' 'Front Mic' 'Line' 'CD'
  Item0: 'Mic'
Simple mixer control 'Input Source',1
  Capabilities: cenum
  Items: 'Mic' 'Front Mic' 'Line' 'CD'
  Item0: 'Mic'


!!Alsactl output
!!-------------

--startcollapse--
state.NVidia {
	control.1 {
		comment.access 'read write'
		comment.type INTEGER
		comment.count 2
		comment.range '0 - 31'
		comment.dbmin -4650
		comment.dbmax 0
		iface MIXER
		name 'Front Playback Volume'
		value.0 10
		value.1 10
	}
	control.2 {
		comment.access 'read write'
		comment.type BOOLEAN
		comment.count 2
		iface MIXER
		name 'Front Playback Switch'
		value.0 true
		value.1 true
	}
	control.3 {
		comment.access 'read write'
		comment.type BOOLEAN
		comment.count 2
		iface MIXER
		name 'Headphone Playback Switch'
		value.0 true
		value.1 true
	}
	control.4 {
		comment.access 'read write'
		comment.type INTEGER
		comment.count 2
		comment.range '0 - 31'
		comment.dbmin -3450
		comment.dbmax 1200
		iface MIXER
		name 'Line Playback Volume'
		value.0 31
		value.1 31
	}
	control.5 {
		comment.access 'read write'
		comment.type BOOLEAN
		comment.count 2
		iface MIXER
		name 'Line Playback Switch'
		value.0 true
		value.1 true
	}
	control.6 {
		comment.access 'read write'
		comment.type INTEGER
		comment.count 2
		comment.range '0 - 31'
		comment.dbmin -3450
		comment.dbmax 1200
		iface MIXER
		name 'Mic Playback Volume'
		value.0 21
		value.1 21
	}
	control.7 {
		comment.access 'read write'
		comment.type INTEGER
		comment.count 2
		comment.range '0 - 3'
		comment.dbmin 0
		comment.dbmax 3000
		iface MIXER
		name 'Mic Boost'
		value.0 2
		value.1 2
	}
	control.8 {
		comment.access 'read write'
		comment.type BOOLEAN
		comment.count 2
		iface MIXER
		name 'Mic Playback Switch'
		value.0 true
		value.1 true
	}
	control.9 {
		comment.access 'read write'
		comment.type BOOLEAN
		comment.count 2
		iface MIXER
		name 'Capture Switch'
		value.0 true
		value.1 true
	}
	control.10 {
		comment.access 'read write'
		comment.type BOOLEAN
		comment.count 2
		iface MIXER
		name 'Capture Switch'
		index 1
		value.0 true
		value.1 true
	}
	control.11 {
		comment.access 'read write'
		comment.type INTEGER
		comment.count 2
		comment.range '0 - 31'
		comment.dbmin -1200
		comment.dbmax 3450
		iface MIXER
		name 'Capture Volume'
		value.0 7
		value.1 7
	}
	control.12 {
		comment.access 'read write'
		comment.type INTEGER
		comment.count 2
		comment.range '0 - 31'
		comment.dbmin -1200
		comment.dbmax 3450
		iface MIXER
		name 'Capture Volume'
		index 1
		value.0 0
		value.1 0
	}
	control.13 {
		comment.access 'read write'
		comment.type ENUMERATED
		comment.count 1
		comment.item.0 Mic
		comment.item.1 'Front Mic'
		comment.item.2 Line
		comment.item.3 CD
		iface MIXER
		name 'Input Source'
		value Mic
	}
	control.14 {
		comment.access 'read write'
		comment.type ENUMERATED
		comment.count 1
		comment.item.0 Mic
		comment.item.1 'Front Mic'
		comment.item.2 Line
		comment.item.3 CD
		iface MIXER
		name 'Input Source'
		index 1
		value Mic
	}
	control.15 {
		comment.access read
		comment.type IEC958
		comment.count 1
		iface MIXER
		name 'IEC958 Playback Con Mask'
		value '0fff000000000000000000000000000000000000000000000000000000000000000000000000000000000000000000000000000000000000000000000000000000000000000000000000000000000000000000000000000000000000000000000000000000000000000000000000000000000000000000000000000000000000000000000000000000000000000000000000000000000000000000000000000000000000000000000000000000000000'
	}
	control.16 {
		comment.access read
		comment.type IEC958
		comment.count 1
		iface MIXER
		name 'IEC958 Playback Pro Mask'
		value '0f00000000000000000000000000000000000000000000000000000000000000000000000000000000000000000000000000000000000000000000000000000000000000000000000000000000000000000000000000000000000000000000000000000000000000000000000000000000000000000000000000000000000000000000000000000000000000000000000000000000000000000000000000000000000000000000000000000000000000'
	}
	control.17 {
		comment.access 'read write'
		comment.type IEC958
		comment.count 1
		iface MIXER
		name 'IEC958 Playback Default'
		value '0400000000000000000000000000000000000000000000000000000000000000000000000000000000000000000000000000000000000000000000000000000000000000000000000000000000000000000000000000000000000000000000000000000000000000000000000000000000000000000000000000000000000000000000000000000000000000000000000000000000000000000000000000000000000000000000000000000000000000'
	}
	control.18 {
		comment.access 'read write'
		comment.type BOOLEAN
		comment.count 1
		iface MIXER
		name 'IEC958 Playback Switch'
		value true
	}
	control.19 {
		comment.access 'read write'
		comment.type BOOLEAN
		comment.count 1
		iface MIXER
		name 'IEC958 Default PCM Playback Switch'
		value true
	}
	control.20 {
		comment.access 'read write'
		comment.type INTEGER
		comment.count 2
		comment.range '0 - 31'
		comment.dbmin -3450
		comment.dbmax 1200
		iface MIXER
		name 'Beep Playback Volume'
		value.0 0
		value.1 0
	}
	control.21 {
		comment.access 'read write'
		comment.type BOOLEAN
		comment.count 2
		iface MIXER
		name 'Beep Playback Switch'
		value.0 true
		value.1 true
	}
	control.22 {
		comment.access 'read write'
		comment.type INTEGER
		comment.count 1
		comment.range '0 - 31'
		comment.dbmin -4650
		comment.dbmax 0
		iface MIXER
		name 'Master Playback Volume'
		value 31
	}
	control.23 {
		comment.access 'read write'
		comment.type BOOLEAN
		comment.count 1
		iface MIXER
		name 'Master Playback Switch'
		value true
	}
	control.24 {
		comment.access 'read write user'
		comment.type INTEGER
		comment.count 2
		comment.range '0 - 255'
		comment.tlv '0000000100000008ffffec1400000014'
		comment.dbmin -5100
		comment.dbmax 0
		iface MIXER
		name 'PCM Playback Volume'
		value.0 255
		value.1 255
	}
	control.25 {
		comment.access 'read write user'
		comment.type INTEGER
		comment.count 2
		comment.range '0 - 120'
		comment.tlv '0000000100000008fffff44800000032'
		comment.dbmin -3000
		comment.dbmax 3000
		iface MIXER
		name 'Digital Capture Volume'
		value.0 120
		value.1 120
	}
}
--endcollapse--


!!All Loaded Modules
!!------------------

Module
usbhid
hid
ppdev
lp
parport
powernow_k8
cpufreq_powersave
cpufreq_ondemand
cpufreq_stats
freq_table
cpufreq_performance
cpufreq_conservative
ipv6
af_packet
fuse
nls_utf8
nls_cp437
vfat
fat
dm_crypt
snd_hda_codec_realtek
snd_hda_intel
snd_hda_codec
snd_hwdep
snd_pcm_oss
snd_mixer_oss
snd_pcm
snd_seq_dummy
snd_seq_oss
snd_seq_midi
snd_rawmidi
snd_seq_midi_event
snd_seq
snd_timer
arc4
ecb
snd_seq_device
snd
uvcvideo
b43
videodev
v4l1_compat
v4l2_compat_ioctl32
i2c_nforce2
rng_core
yenta_socket
rsrc_nonstatic
i2c_core
tifm_7xx1
soundcore
mac80211
tifm_core
joydev
k8temp
snd_page_alloc
tpm_tis
tpm
tpm_bios
cfg80211
acer_wmi
pcspkr
psmouse
rtc_cmos
rtc_core
edac_core
rfkill
edac_mce_amd
wmi
rtc_lib
serio_raw
evdev
battery
processor
led_class
ac
ext3
jbd
mbcache
dm_mod
sd_mod
sg
usb_storage
sr_mod
cdrom
ata_generic
pata_acpi
ohci_hcd
sata_nv
ssb
pata_amd
mmc_core
ehci_hcd
pcmcia
libata
forcedeth
pcmcia_core
scsi_mod
video
output
usbcore
nls_base
button
thermal
fan


!!Sysfs Files
!!-----------

/sys/class/sound/hwC0D0/init_pin_configs:
0x14 0x0121101f
0x15 0x99130110
0x16 0x411111f0
0x17 0x411111f0
0x18 0x01a19830
0x19 0x99a30131
0x1a 0x0181303f
0x1b 0x411111f0
0x1c 0x411111f0
0x1d 0x411111f0
0x1e 0x01451120
0x1f 0x411111f0

/sys/class/sound/hwC0D0/driver_pin_configs:

/sys/class/sound/hwC0D0/user_pin_configs:

/sys/class/sound/hwC0D0/init_verbs:

/sys/class/sound/hwC0D1/init_pin_configs:
0x73 0x016a10f0

/sys/class/sound/hwC0D1/driver_pin_configs:

/sys/class/sound/hwC0D1/user_pin_configs:

/sys/class/sound/hwC0D1/init_verbs:


!!ALSA/HDA dmesg
!!------------------

[   14.583040] Broadcom 43xx driver loaded [ Features: PMLS, Firmware-ID: FW13 ]
[   16.028603] HDA Intel 0000:00:10.1: power state changed by ACPI to D0
[   16.040767] ACPI: PCI Interrupt Link [LAZA] enabled at IRQ 18
--
[   16.052535]   alloc kstat_irqs on node 0
[   16.052547] HDA Intel 0000:00:10.1: PCI INT B -> Link[LAZA] -> GSI 18 (level, high) -> IRQ 18
[   16.064520] HDA Intel 0000:00:10.1: setting latency timer to 64
[   19.554766] EXT3-fs (sdb1): using internal journal


