upload=true&script=true&cardinfo=
!!################################
!!ALSA Information Script v 0.4.58
!!################################

!!Script ran on: Mon Nov 23 21:27:59 UTC 2009


!!Linux Distribution
!!------------------

Welcome to openSUSE 11.2 "Emerald" - Kernel \r (\l). openSUSE 11.2 (x86_64) LSB_VERSION="core-2.0-noarch:core-3.2-noarch:core-4.0-noarch:core-2.0-x86_64:core-3.2-x86_64:core-4.0-x86_64"


!!DMI Information
!!---------------

Manufacturer:      FUJITSU SIEMENS
Product Name:      AMILO Pi 1505


!!Kernel Information
!!------------------

Kernel release:    2.6.31.5-0.1-desktop
Operating System:  GNU/Linux
Architecture:      x86_64
Processor:         x86_64
SMP Enabled:       Yes


!!ALSA Version
!!------------

Driver version:     1.0.20
Library version:    
Utilities version:  1.0.21


!!Loaded ALSA modules
!!-------------------

snd_hda_intel


!!Sound Servers on this system
!!----------------------------

ESound Daemon:
      Installed - Yes (/usr/bin/esd)
      Running - No

Jack:
      Installed - Yes (/usr/bin/jackd)
      Running - No


!!Soundcards recognised by ALSA
!!-----------------------------

 0 [Intel          ]: HDA-Intel - HDA Intel
                      HDA Intel at 0xf0000000 irq 22


!!PCI Soundcards installed in the system
!!--------------------------------------

00:1b.0 Audio device: Intel Corporation 82801G (ICH7 Family) High Definition Audio Controller (rev 02)


!!Advanced information - PCI Vendor/Device/Susbsystem ID's
!!--------------------------------------------------------

00:1b.0 0403: 8086:27d8 (rev 02)
	Subsystem: 1734:10c7


!!Modprobe options (Sound related)
!!--------------------------------

snd-hda-intel: model=toshiba


!!Loaded sound module options
!!--------------------------

!!Module: snd_hda_intel
	bdl_pos_adj : 1,-1,-1,-1,-1,-1,-1,-1,-1,-1,-1,-1,-1,-1,-1,-1,-1,-1,-1,-1,-1,-1,-1,-1,-1,-1,-1,-1,-1,-1,-1,-1
	enable : Y,Y,Y,Y,Y,Y,Y,Y,Y,Y,Y,Y,Y,Y,Y,Y,Y,Y,Y,Y,Y,Y,Y,Y,Y,Y,Y,Y,Y,Y,Y,Y
	enable_msi : 0
	id : <NULL>,<NULL>,<NULL>,<NULL>,<NULL>,<NULL>,<NULL>,<NULL>,<NULL>,<NULL>,<NULL>,<NULL>,<NULL>,<NULL>,<NULL>,<NULL>,<NULL>,<NULL>,<NULL>,<NULL>,<NULL>,<NULL>,<NULL>,<NULL>,<NULL>,<NULL>,<NULL>,<NULL>,<NULL>,<NULL>,<NULL>,<NULL>
	index : -1,-1,-1,-1,-1,-1,-1,-1,-1,-1,-1,-1,-1,-1,-1,-1,-1,-1,-1,-1,-1,-1,-1,-1,-1,-1,-1,-1,-1,-1,-1,-1
	model : toshiba,<NULL>,<NULL>,<NULL>,<NULL>,<NULL>,<NULL>,<NULL>,<NULL>,<NULL>,<NULL>,<NULL>,<NULL>,<NULL>,<NULL>,<NULL>,<NULL>,<NULL>,<NULL>,<NULL>,<NULL>,<NULL>,<NULL>,<NULL>,<NULL>,<NULL>,<NULL>,<NULL>,<NULL>,<NULL>,<NULL>,<NULL>
	patch : <NULL>,<NULL>,<NULL>,<NULL>,<NULL>,<NULL>,<NULL>,<NULL>,<NULL>,<NULL>,<NULL>,<NULL>,<NULL>,<NULL>,<NULL>,<NULL>,<NULL>,<NULL>,<NULL>,<NULL>,<NULL>,<NULL>,<NULL>,<NULL>,<NULL>,<NULL>,<NULL>,<NULL>,<NULL>,<NULL>,<NULL>,<NULL>
	position_fix : 0,0,0,0,0,0,0,0,0,0,0,0,0,0,0,0,0,0,0,0,0,0,0,0,0,0,0,0,0,0,0,0
	power_save : 0
	power_save_controller : Y
	probe_mask : -1,-1,-1,-1,-1,-1,-1,-1,-1,-1,-1,-1,-1,-1,-1,-1,-1,-1,-1,-1,-1,-1,-1,-1,-1,-1,-1,-1,-1,-1,-1,-1
	probe_only : N,N,N,N,N,N,N,N,N,N,N,N,N,N,N,N,N,N,N,N,N,N,N,N,N,N,N,N,N,N,N,N
	single_cmd : N


!!HDA-Intel Codec information
!!---------------------------
--startcollapse--

Codec: Motorola Si3054
Address: 0
Function Id: 0x2
Vendor Id: 0x10573055
Subsystem Id: 0x10573055
Revision Id: 0x100700
Modem Function Group: 0x1
Codec: Realtek ALC861
Address: 1
Function Id: 0x1
Vendor Id: 0x10ec0861
Subsystem Id: 0x15840000
Revision Id: 0x100300
No Modem Function Group found
Default PCM:
    rates [0x140]: 48000 96000
    bits [0xe]: 16 20 24
    formats [0x1]: PCM
Default Amp-In caps: N/A
Default Amp-Out caps: ofs=0x00, nsteps=0x00, stepsize=0x00, mute=1
GPIO: io=0, o=0, i=0, unsolicited=0, wake=0
Node 0x03 [Audio Output] wcaps 0x405: Stereo Amp-Out
  Amp-Out caps: N/A
  Amp-Out vals:  [0x00 0x00]
  Converter: stream=0, channel=0
  Power: setting=D0, actual=D0
Node 0x04 [Audio Output] wcaps 0x405: Stereo Amp-Out
  Amp-Out caps: N/A
  Amp-Out vals:  [0x00 0x00]
  Converter: stream=0, channel=0
  Power: setting=D0, actual=D0
Node 0x05 [Audio Output] wcaps 0x405: Stereo Amp-Out
  Amp-Out caps: N/A
  Amp-Out vals:  [0x00 0x00]
  Converter: stream=0, channel=0
  Power: setting=D0, actual=D0
Node 0x06 [Audio Output] wcaps 0x405: Stereo Amp-Out
  Amp-Out caps: N/A
  Amp-Out vals:  [0x00 0x00]
  Converter: stream=0, channel=0
  Power: setting=D0, actual=D0
Node 0x07 [Audio Output] wcaps 0x605: Stereo Digital Amp-Out
  Amp-Out caps: N/A
  Amp-Out vals:  [0x00 0x00]
  Converter: stream=0, channel=0
  Digital:
  Digital category: 0x0
  Power: setting=D0, actual=D0
Node 0x08 [Audio Input] wcaps 0x10051b: Stereo Amp-In
  Amp-In caps: ofs=0x02, nsteps=0x0d, stepsize=0x0b, mute=1
  Amp-In vals:  [0x00 0x00] [0x00 0x00] [0x00 0x00] [0x00 0x00] [0x00 0x00] [0x00 0x00]
  Converter: stream=0, channel=0
  SDI-Select: 0
  PCM:
    rates [0x140]: 48000 96000
    bits [0x2]: 16
    formats [0x1]: PCM
  Power: setting=D0, actual=D0
  Connection: 6
     0x0d* 0x0c 0x0f 0x10 0x11 0x15
Node 0x09 [Vendor Defined Widget] wcaps 0xf00000: Mono
Node 0x0a [Vendor Defined Widget] wcaps 0xf00000: Mono
Node 0x0b [Pin Complex] wcaps 0x400581: Stereo
  Pincap 0x0000001f: OUT HP Detect Trigger ImpSense
  Pin Default 0x01014110: [Jack] Line Out at Ext Rear
    Conn = 1/8, Color = Green
    DefAssociation = 0x1, Sequence = 0x0
    Misc = NO_PRESENCE
  Pin-ctls: 0x40: OUT
  Unsolicited: tag=00, enabled=0
  Power: setting=D0, actual=D0
  Connection: 1
     0x16
Node 0x0c [Pin Complex] wcaps 0x400581: Stereo
  Pincap 0x00000037: IN OUT Detect Trigger ImpSense
  Pin Default 0x411111f0: [N/A] Speaker at Ext Rear
    Conn = 1/8, Color = Black
    DefAssociation = 0xf, Sequence = 0x0
    Misc = NO_PRESENCE
  Pin-ctls: 0x20: IN
  Unsolicited: tag=00, enabled=0
  Power: setting=D0, actual=D0
  Connection: 1
     0x19
Node 0x0d [Pin Complex] wcaps 0x400581: Stereo
  Pincap 0x00000337: IN OUT Detect Trigger ImpSense
    Vref caps: HIZ 50
  Pin Default 0x411111f0: [N/A] Speaker at Ext Rear
    Conn = 1/8, Color = Black
    DefAssociation = 0xf, Sequence = 0x0
    Misc = NO_PRESENCE
  Pin-ctls: 0x24: IN VREF_80
  Unsolicited: tag=00, enabled=0
  Power: setting=D0, actual=D0
  Connection: 1
     0x18
Node 0x0e [Pin Complex] wcaps 0x400581: Stereo
  Pincap 0x00000017: OUT Detect Trigger ImpSense
  Pin Default 0x99030120: [Fixed] Line Out at Int ATAPI
    Conn = ATAPI, Color = Unknown
    DefAssociation = 0x2, Sequence = 0x0
    Misc = NO_PRESENCE
  Pin-ctls: 0x40: OUT
  Unsolicited: tag=00, enabled=0
  Power: setting=D0, actual=D0
  Connection: 1
     0x19
Node 0x0f [Pin Complex] wcaps 0x400581: Stereo
  Pincap 0x0000033f: IN OUT HP Detect Trigger ImpSense
    Vref caps: HIZ 50
  Pin Default 0x411111f0: [N/A] Speaker at Ext Rear
    Conn = 1/8, Color = Black
    DefAssociation = 0xf, Sequence = 0x0
    Misc = NO_PRESENCE
  Pin-ctls: 0xc0: OUT HP VREF_HIZ
  Unsolicited: tag=04, enabled=1
  Power: setting=D0, actual=D0
  Connection: 1
     0x1a
Node 0x10 [Pin Complex] wcaps 0x400581: Stereo
  Pincap 0x0000033f: IN OUT HP Detect Trigger ImpSense
    Vref caps: HIZ 50
  Pin Default 0x01a1994e: [Jack] Mic at Ext Rear
    Conn = 1/8, Color = Pink
    DefAssociation = 0x4, Sequence = 0xe
    Misc = NO_PRESENCE
  Pin-ctls: 0x24: IN VREF_80
  Unsolicited: tag=00, enabled=0
  Power: setting=D0, actual=D0
  Connection: 1
     0x1b
Node 0x11 [Pin Complex] wcaps 0x400001: Stereo
  Pincap 0x00000063: IN Balanced Trigger ImpSense
  Pin Default 0x99330140: [Fixed] CD at Int ATAPI
    Conn = ATAPI, Color = Unknown
    DefAssociation = 0x4, Sequence = 0x0
    Misc = NO_PRESENCE
  Pin-ctls: 0x00:
Node 0x12 [Pin Complex] wcaps 0x400301: Stereo Digital
  Pincap 0x00000010: OUT
  Pin Default 0x01454130: [Jack] SPDIF Out at Ext Rear
    Conn = Optical, Color = Green
    DefAssociation = 0x3, Sequence = 0x0
    Misc = NO_PRESENCE
  Pin-ctls: 0x40: OUT
  Connection: 1
     0x07
Node 0x13 [Vendor Defined Widget] wcaps 0xf00000: Mono
Node 0x14 [Audio Mixer] wcaps 0x20010b: Stereo Amp-In
  Amp-In caps: ofs=0x00, nsteps=0x00, stepsize=0x00, mute=1
  Amp-In vals:  [0x00 0x00] [0x00 0x00]
  Connection: 2
     0x0d 0x10
Node 0x15 [Audio Mixer] wcaps 0x20050f: Stereo Amp-In Amp-Out
  Amp-In caps: ofs=0x0c, nsteps=0x17, stepsize=0x0b, mute=1
  Amp-In vals:  [0x00 0x00] [0x8e 0x8e] [0x00 0x00]
  Amp-Out caps: ofs=0x0c, nsteps=0x0c, stepsize=0x0b, mute=1
  Amp-Out vals:  [0x0c 0x0c]
  Power: setting=D0, actual=D0
  Connection: 3
     0x11 0x14 0x1c
Node 0x16 [Audio Mixer] wcaps 0x20010b: Stereo Amp-In
  Amp-In caps: ofs=0x00, nsteps=0x00, stepsize=0x00, mute=1
  Amp-In vals:  [0x00 0x00] [0x00 0x00]
  Connection: 2
     0x03 0x15
Node 0x17 [Audio Mixer] wcaps 0x20010b: Stereo Amp-In
  Amp-In caps: ofs=0x00, nsteps=0x00, stepsize=0x00, mute=1
  Amp-In vals:  [0x00 0x00] [0x00 0x00]
  Connection: 2
     0x04 0x15
Node 0x18 [Audio Mixer] wcaps 0x20010b: Stereo Amp-In
  Amp-In caps: ofs=0x00, nsteps=0x00, stepsize=0x00, mute=1
  Amp-In vals:  [0x00 0x00] [0x00 0x00]
  Connection: 2
     0x05 0x15
Node 0x19 [Audio Mixer] wcaps 0x20010b: Stereo Amp-In
  Amp-In caps: ofs=0x00, nsteps=0x00, stepsize=0x00, mute=1
  Amp-In vals:  [0x00 0x00] [0x00 0x00]
  Connection: 2
     0x06 0x15
Node 0x1a [Audio Mixer] wcaps 0x20010b: Stereo Amp-In
  Amp-In caps: ofs=0x00, nsteps=0x00, stepsize=0x00, mute=1
  Amp-In vals:  [0x80 0x80] [0x80 0x80] [0x00 0x00] [0x80 0x80]
  Connection: 4
     0x04 0x06 0x15 0x03
Node 0x1b [Audio Mixer] wcaps 0x20010b: Stereo Amp-In
  Amp-In caps: ofs=0x00, nsteps=0x00, stepsize=0x00, mute=1
  Amp-In vals:  [0x80 0x80] [0x80 0x80] [0x80 0x80] [0x80 0x80]
  Connection: 4
     0x04 0x06 0x15 0x03
Node 0x1c [Audio Mixer] wcaps 0x20010b: Stereo Amp-In
  Amp-In caps: ofs=0x00, nsteps=0x00, stepsize=0x00, mute=1
  Amp-In vals:  [0x00 0x00] [0x00 0x00]
  Connection: 2
     0x0c 0x0f
Node 0x1d [Vendor Defined Widget] wcaps 0xf00000: Mono
Node 0x1e [Vendor Defined Widget] wcaps 0xf00000: Mono
Node 0x1f [Pin Complex] wcaps 0x400581: Stereo
  Pincap 0x00000017: OUT Detect Trigger ImpSense
  Pin Default 0x411111f0: [N/A] Speaker at Ext Rear
    Conn = 1/8, Color = Black
    DefAssociation = 0xf, Sequence = 0x0
    Misc = NO_PRESENCE
  Pin-ctls: 0x40: OUT
  Unsolicited: tag=00, enabled=0
  Power: setting=D0, actual=D0
  Connection: 1
     0x18
Node 0x20 [Pin Complex] wcaps 0x400581: Stereo
  Pincap 0x00000017: OUT Detect Trigger ImpSense
  Pin Default 0x411111f0: [N/A] Speaker at Ext Rear
    Conn = 1/8, Color = Black
    DefAssociation = 0xf, Sequence = 0x0
    Misc = NO_PRESENCE
  Pin-ctls: 0x40: OUT
  Unsolicited: tag=00, enabled=0
  Power: setting=D0, actual=D0
  Connection: 1
     0x17
  Processing Coefficient: 0x00
  Coefficient Index: 0x00
Node 0x21 [Vendor Defined Widget] wcaps 0xf00000: Mono
Node 0x22 [Vendor Defined Widget] wcaps 0xf00000: Mono
Node 0x23 [Beep Generator Widget] wcaps 0x70000c: Mono Amp-Out
  Amp-Out caps: ofs=0x0f, nsteps=0x0f, stepsize=0x0b, mute=1
  Amp-Out vals:  [0x0b]
--endcollapse--


!!ALSA Device nodes
!!-----------------

crw-rw----+ 1 root audio 116,  9 Nov 23 22:22 /dev/snd/controlC0
crw-rw----+ 1 root audio 116,  8 Nov 23 22:22 /dev/snd/hwC0D0
crw-rw----+ 1 root audio 116,  7 Nov 23 22:22 /dev/snd/hwC0D1
crw-rw----+ 1 root audio 116,  4 Nov 23 22:22 /dev/snd/pcmC0D0c
crw-rw----+ 1 root audio 116,  3 Nov 23 22:22 /dev/snd/pcmC0D0p
crw-rw----+ 1 root audio 116,  6 Nov 23 22:22 /dev/snd/pcmC0D6c
crw-rw----+ 1 root audio 116,  5 Nov 23 22:22 /dev/snd/pcmC0D6p
crw-rw----+ 1 root audio 116, 10 Nov 23 22:22 /dev/snd/seq
crw-rw----+ 1 root audio 116,  2 Nov 23 22:22 /dev/snd/timer

/dev/snd/by-path:
total 0
drwxr-xr-x 2 root root  60 Nov 23 22:22 .
drwxr-xr-x 3 root root 240 Nov 23 22:22 ..
lrwxrwxrwx 1 root root  12 Nov 23 22:22 pci-0000:00:1b.0 -> ../controlC0


!!Aplay/Arecord output
!!------------

APLAY

**** List of PLAYBACK Hardware Devices ****
card 0: Intel [HDA Intel], device 0: ALC861 Analog [ALC861 Analog]
  Subdevices: 1/1
  Subdevice #0: subdevice #0
card 0: Intel [HDA Intel], device 6: Si3054 Modem [Si3054 Modem]
  Subdevices: 1/1
  Subdevice #0: subdevice #0

ARECORD

**** List of CAPTURE Hardware Devices ****
card 0: Intel [HDA Intel], device 0: ALC861 Analog [ALC861 Analog]
  Subdevices: 1/1
  Subdevice #0: subdevice #0
card 0: Intel [HDA Intel], device 6: Si3054 Modem [Si3054 Modem]
  Subdevices: 1/1
  Subdevice #0: subdevice #0

!!Amixer output
!!-------------

!!-------Mixer controls for card 0 [Intel]

Card hw:0 'Intel'/'HDA Intel at 0xf0000000 irq 22'
  Mixer name	: 'Realtek ALC861'
  Components	: 'HDA:10573055,10573055,00100700 HDA:10ec0861,15840000,00100300'
  Controls      : 9
  Simple ctrls  : 7
Simple mixer control 'Master',0
  Capabilities: pswitch
  Playback channels: Front Left - Front Right
  Mono:
  Front Left: Playback [on]
  Front Right: Playback [on]
Simple mixer control 'PCM',0
  Capabilities: pvolume
  Playback channels: Front Left - Front Right
  Limits: Playback 0 - 255
  Mono:
  Front Left: Playback 255 [100%] [0.00dB]
  Front Right: Playback 255 [100%] [0.00dB]
Simple mixer control 'Mic',0
  Capabilities: pvolume pswitch
  Playback channels: Front Left - Front Right
  Limits: Playback 0 - 23
  Mono:
  Front Left: Playback 14 [61%] [6.00dB] [off]
  Front Right: Playback 14 [61%] [6.00dB] [off]
Simple mixer control 'Beep',0
  Capabilities: pvolume pswitch
  Playback channels: Front Left - Front Right
  Limits: Playback 0 - 15
  Mono:
  Front Left: Playback 11 [73%] [-12.00dB] [on]
  Front Right: Playback 11 [73%] [-12.00dB] [on]
Simple mixer control 'Caller ID',0
  Capabilities: pswitch pswitch-joined
  Playback channels: Mono
  Mono: Playback [on]
Simple mixer control 'Digital',0
  Capabilities: cvolume
  Capture channels: Front Left - Front Right
  Limits: Capture 0 - 120
  Front Left: Capture 60 [50%] [0.00dB]
  Front Right: Capture 60 [50%] [0.00dB]
Simple mixer control 'Off-hook',0
  Capabilities: pswitch pswitch-joined
  Playback channels: Mono
  Mono: Playback [on]


!!Alsactl output
!!-------------

--startcollapse--
state.Intel {
	control.1 {
		comment.access 'read write'
		comment.type BOOLEAN
		comment.count 1
		iface MIXER
		name 'Off-hook Switch'
		value true
	}
	control.2 {
		comment.access 'read write'
		comment.type BOOLEAN
		comment.count 1
		iface MIXER
		name 'Caller ID Switch'
		value true
	}
	control.3 {
		comment.access 'read write'
		comment.type BOOLEAN
		comment.count 2
		iface MIXER
		name 'Master Playback Switch'
		value.0 true
		value.1 true
	}
	control.4 {
		comment.access 'read write'
		comment.type INTEGER
		comment.count 2
		comment.range '0 - 23'
		comment.dbmin -3600
		comment.dbmax 3300
		iface MIXER
		name 'Mic Playback Volume'
		value.0 14
		value.1 14
	}
	control.5 {
		comment.access 'read write'
		comment.type BOOLEAN
		comment.count 2
		iface MIXER
		name 'Mic Playback Switch'
		value.0 false
		value.1 false
	}
	control.6 {
		comment.access 'read write'
		comment.type INTEGER
		comment.count 2
		comment.range '0 - 15'
		comment.dbmin -4500
		comment.dbmax 0
		iface MIXER
		name 'Beep Playback Volume'
		value.0 11
		value.1 11
	}
	control.7 {
		comment.access 'read write'
		comment.type BOOLEAN
		comment.count 2
		iface MIXER
		name 'Beep Playback Switch'
		value.0 true
		value.1 true
	}
	control.8 {
		comment.access 'read write user'
		comment.type INTEGER
		comment.count 2
		comment.range '0 - 255'
		comment.tlv '0000000100000008ffffec1400000014'
		comment.dbmin -5100
		comment.dbmax 0
		iface MIXER
		name 'PCM Playback Volume'
		value.0 255
		value.1 255
	}
	control.9 {
		comment.access 'read write user'
		comment.type INTEGER
		comment.count 2
		comment.range '0 - 120'
		comment.tlv '0000000100000008fffff44800000032'
		comment.dbmin -3000
		comment.dbmax 3000
		iface MIXER
		name 'Digital Capture Volume'
		value.0 60
		value.1 60
	}
}
--endcollapse--


!!All Loaded Modules
!!------------------

Module
nfs
lockd
fscache
nfs_acl
auth_rpcgss
sunrpc
af_packet
ip6t_LOG
xt_tcpudp
xt_pkttype
ipt_LOG
xt_limit
snd_pcm_oss
snd_mixer_oss
snd_seq
snd_seq_device
edd
i915
drm
i2c_algo_bit
cpufreq_conservative
cpufreq_userspace
cpufreq_powersave
acpi_cpufreq
microcode
ip6t_REJECT
nf_conntrack_ipv6
ip6table_raw
xt_NOTRACK
ipt_REJECT
xt_state
iptable_raw
iptable_filter
ip6table_mangle
nf_conntrack_netbios_ns
nf_conntrack_ipv4
nf_conntrack
nf_defrag_ipv4
ip_tables
ip6table_filter
ip6_tables
x_tables
fuse
loop
dm_mod
arc4
ecb
cryptomgr
aead
pcompress
snd_hda_codec_realtek
crypto_blkcipher
snd_hda_codec_si3054
crypto_hash
crypto_algapi
snd_hda_intel
epl
snd_hda_codec
snd_hwdep
iwl3945
snd_pcm
ohci1394
8139too
sdhci_pci
sdhci
iwlcore
usblp
snd_timer
i2c_i801
sr_mod
joydev
cdrom
ieee1394
8139cp
serio_raw
pcspkr
mmc_core
sg
mac80211
iTCO_wdt
iTCO_vendor_support
video
ac
battery
snd
button
snd_page_alloc
cfg80211
rfkill
intel_agp
ext4
jbd2
crc16
fan
processor
piix
ide_core
thermal
thermal_sys


!!Sysfs Files
!!-----------

/sys/class/sound/hwC0D0/init_pin_configs:

/sys/class/sound/hwC0D0/driver_pin_configs:

/sys/class/sound/hwC0D0/user_pin_configs:

/sys/class/sound/hwC0D0/init_verbs:

/sys/class/sound/hwC0D1/init_pin_configs:
0x0b 0x01014110
0x0c 0x411111f0
0x0d 0x411111f0
0x0e 0x99030120
0x0f 0x411111f0
0x10 0x01a1994e
0x11 0x99330140
0x12 0x01454130
0x1f 0x411111f0
0x20 0x411111f0

/sys/class/sound/hwC0D1/driver_pin_configs:

/sys/class/sound/hwC0D1/user_pin_configs:

/sys/class/sound/hwC0D1/init_verbs:


!!ALSA/HDA dmesg
!!------------------

[    7.795080]   alloc kstat_irqs on node 0
[    7.795093] HDA Intel 0000:00:1b.0: PCI INT A -> GSI 22 (level, low) -> IRQ 22
[    7.795159] HDA Intel 0000:00:1b.0: setting latency timer to 64
[    8.166425] ALSA /usr/src/packages/BUILD/kernel-desktop-2.6.31.5/linux-2.6.31/sound/pci/hda/hda_codec.c:3056: hda_codec: model 'toshiba' is selected
[    8.166512] input: HDA Digital PCBeep as /devices/pci0000:00/0000:00:1b.0/input/input11
[    8.442786] phy0: Selected rate control algorithm 'iwl-3945-rs'


