upload=true&script=true&cardinfo=
!!################################
!!ALSA Information Script v 0.4.60
!!################################

!!Script ran on: Wed Jan 25 16:48:24 UTC 2012


!!Linux Distribution
!!------------------

Debian GNU/Linux wheezy/sid \n \l


!!DMI Information
!!---------------

Manufacturer:      
Product Name:      
Product Version:   


!!Kernel Information
!!------------------

Kernel release:    3.2.0-rc1-haier
Operating System:  GNU/Linux
Architecture:      i686
Processor:         unknown
SMP Enabled:       Yes


!!ALSA Version
!!------------

Driver version:     1.0.24
Library version:    1.0.24.1
Utilities version:  1.0.24.2


!!Loaded ALSA modules
!!-------------------



!!Sound Servers on this system
!!----------------------------

Pulseaudio:
      Installed - Yes (/usr/bin/pulseaudio)
      Running - No


!!Soundcards recognised by ALSA
!!-----------------------------

 0 [SB             ]: HDA-Intel - HDA ATI SB
                      HDA ATI SB at 0xc0400000 irq 42


!!PCI Soundcards installed in the system
!!--------------------------------------

00:14.2 Audio device: ATI Technologies Inc IXP SB4x0 High Definition Audio Controller (rev 01)


!!Advanced information - PCI Vendor/Device/Subsystem ID's
!!--------------------------------------------------------

00:14.2 0403: 1002:437b (rev 01)
	Subsystem: 1584:2b01


!!Modprobe options (Sound related)
!!--------------------------------

snd-atiixp-modem: index=-2
snd-intel8x0m: index=-2
snd-via82xx-modem: index=-2
snd-pcsp: index=-2
snd-usb-audio: index=-2


!!Loaded sound module options
!!--------------------------


!!HDA-Intel Codec information
!!---------------------------
--startcollapse--

Codec: Realtek ALC861
Address: 0
AFG Function Id: 0x1 (unsol 0)
Vendor Id: 0x10ec0861
Subsystem Id: 0x15840000
Revision Id: 0x100300
No Modem Function Group found
Default PCM:
    rates [0x140]: 48000 96000
    bits [0xe]: 16 20 24
    formats [0x1]: PCM
Default Amp-In caps: N/A
Default Amp-Out caps: ofs=0x00, nsteps=0x00, stepsize=0x00, mute=1
GPIO: io=0, o=0, i=0, unsolicited=0, wake=0
Node 0x03 [Audio Output] wcaps 0x405: Stereo Amp-Out
  Device: name="ALC861 Analog", type="Audio", device=0
  Amp-Out caps: N/A
  Amp-Out vals:  [0x00 0x00]
  Converter: stream=0, channel=0
  Power states:  D0 D1 D2 D3
  Power: setting=D0, actual=D0
Node 0x04 [Audio Output] wcaps 0x405: Stereo Amp-Out
  Amp-Out caps: N/A
  Amp-Out vals:  [0x80 0x80]
  Converter: stream=0, channel=0
  Power states:  D0 D1 D2 D3
  Power: setting=D0, actual=D0
Node 0x05 [Audio Output] wcaps 0x405: Stereo Amp-Out
  Amp-Out caps: N/A
  Amp-Out vals:  [0x80 0x80]
  Converter: stream=0, channel=0
  Power states:  D0 D1 D2 D3
  Power: setting=D0, actual=D0
Node 0x06 [Audio Output] wcaps 0x405: Stereo Amp-Out
  Amp-Out caps: N/A
  Amp-Out vals:  [0x80 0x80]
  Converter: stream=0, channel=0
  Power states:  D0 D1 D2 D3
  Power: setting=D0, actual=D0
Node 0x07 [Audio Output] wcaps 0x605: Stereo Digital Amp-Out
  Control: name="IEC958 Playback Con Mask", index=0, device=0
  Control: name="IEC958 Playback Pro Mask", index=0, device=0
  Control: name="IEC958 Playback Default", index=0, device=0
  Control: name="IEC958 Playback Switch", index=0, device=0
  Control: name="IEC958 Default PCM Playback Switch", index=0, device=0
  Device: name="ALC861 Digital", type="SPDIF", device=1
  Amp-Out caps: N/A
  Amp-Out vals:  [0x00 0x00]
  Converter: stream=0, channel=0
  Digital:
  Digital category: 0x0
  Power states:  D0 D1 D2 D3
  Power: setting=D0, actual=D0
Node 0x08 [Audio Input] wcaps 0x10051b: Stereo Amp-In
  Control: name="Input Source", index=0, device=0
  Control: name="Capture Switch", index=0, device=0
  Control: name="Capture Volume", index=0, device=0
  Device: name="ALC861 Analog", type="Audio", device=0
  Amp-In caps: ofs=0x02, nsteps=0x0d, stepsize=0x0b, mute=1
  Amp-In vals:  [0x06 0x06] [0x06 0x06] [0x06 0x06] [0x06 0x06] [0x06 0x06] [0x06 0x06]
  Converter: stream=0, channel=0
  SDI-Select: 0
  PCM:
    rates [0x140]: 48000 96000
    bits [0x2]: 16
    formats [0x1]: PCM
  Power states:  D0 D1 D2 D3
  Power: setting=D0, actual=D0
  Connection: 6
     0x0d* 0x0c 0x0f 0x10 0x11 0x15
Node 0x09 [Vendor Defined Widget] wcaps 0xf00000: Mono
Node 0x0a [Vendor Defined Widget] wcaps 0xf00000: Mono
Node 0x0b [Pin Complex] wcaps 0x400581: Stereo
  Pincap 0x0000001f: OUT HP Detect Trigger ImpSense
  Pin Default 0x01014110: [Jack] Line Out at Ext Rear
    Conn = 1/8, Color = Green
    DefAssociation = 0x1, Sequence = 0x0
    Misc = NO_PRESENCE
  Pin-ctls: 0x40: OUT
  Unsolicited: tag=00, enabled=0
  Power states:  D0 D1 D2 D3
  Power: setting=D0, actual=D0
  Connection: 1
     0x16
Node 0x0c [Pin Complex] wcaps 0x400581: Stereo
  Pincap 0x00000037: IN OUT Detect Trigger ImpSense
  Pin Default 0x0181313e: [Jack] Line In at Ext Rear
    Conn = 1/8, Color = Blue
    DefAssociation = 0x3, Sequence = 0xe
    Misc = NO_PRESENCE
  Pin-ctls: 0x20: IN
  Unsolicited: tag=00, enabled=0
  Power states:  D0 D1 D2 D3
  Power: setting=D0, actual=D0
  Connection: 1
     0x19
Node 0x0d [Pin Complex] wcaps 0x400581: Stereo
  Pincap 0x00000337: IN OUT Detect Trigger ImpSense
    Vref caps: HIZ 50
  Pin Default 0x01a19930: [Jack] Mic at Ext Rear
    Conn = 1/8, Color = Pink
    DefAssociation = 0x3, Sequence = 0x0
    Misc = NO_PRESENCE
  Pin-ctls: 0x21: IN VREF_50
  Unsolicited: tag=00, enabled=0
  Power states:  D0 D1 D2 D3
  Power: setting=D0, actual=D0
  Connection: 1
     0x18
Node 0x0e [Pin Complex] wcaps 0x400581: Stereo
  Pincap 0x00000017: OUT Detect Trigger ImpSense
  Pin Default 0x411111f0: [N/A] Speaker at Ext Rear
    Conn = 1/8, Color = Black
    DefAssociation = 0xf, Sequence = 0x0
    Misc = NO_PRESENCE
  Pin-ctls: 0x40: OUT
  Unsolicited: tag=00, enabled=0
  Power states:  D0 D1 D2 D3
  Power: setting=D0, actual=D0
  Connection: 1
     0x19
Node 0x0f [Pin Complex] wcaps 0x400581: Stereo
  Pincap 0x0000033f: IN OUT HP Detect Trigger ImpSense
    Vref caps: HIZ 50
  Pin Default 0x411111f0: [N/A] Speaker at Ext Rear
    Conn = 1/8, Color = Black
    DefAssociation = 0xf, Sequence = 0x0
    Misc = NO_PRESENCE
  Pin-ctls: 0x40: OUT VREF_HIZ
  Unsolicited: tag=00, enabled=0
  Power states:  D0 D1 D2 D3
  Power: setting=D0, actual=D0
  Connection: 1
     0x1a
Node 0x10 [Pin Complex] wcaps 0x400581: Stereo
  Pincap 0x0000033f: IN OUT HP Detect Trigger ImpSense
    Vref caps: HIZ 50
  Pin Default 0x411111f0: [N/A] Speaker at Ext Rear
    Conn = 1/8, Color = Black
    DefAssociation = 0xf, Sequence = 0x0
    Misc = NO_PRESENCE
  Pin-ctls: 0x20: IN VREF_HIZ
  Unsolicited: tag=00, enabled=0
  Power states:  D0 D1 D2 D3
  Power: setting=D0, actual=D0
  Connection: 1
     0x1b
Node 0x11 [Pin Complex] wcaps 0x400001: Stereo
  Pincap 0x00000063: IN Balanced Trigger ImpSense
  Pin Default 0x99330131: [Fixed] CD at Int ATAPI
    Conn = ATAPI, Color = Unknown
    DefAssociation = 0x3, Sequence = 0x1
    Misc = NO_PRESENCE
  Pin-ctls: 0x00:
Node 0x12 [Pin Complex] wcaps 0x400301: Stereo Digital
  Pincap 0x00000010: OUT
  Pin Default 0x01454120: [Jack] SPDIF Out at Ext Rear
    Conn = Optical, Color = Green
    DefAssociation = 0x2, Sequence = 0x0
    Misc = NO_PRESENCE
  Pin-ctls: 0x40: OUT
  Connection: 1
     0x07
Node 0x13 [Vendor Defined Widget] wcaps 0xf00000: Mono
Node 0x14 [Audio Mixer] wcaps 0x20010b: Stereo Amp-In
  Amp-In caps: ofs=0x00, nsteps=0x00, stepsize=0x00, mute=1
  Amp-In vals:  [0x00 0x00] [0x80 0x80]
  Connection: 2
     0x0d 0x10
Node 0x15 [Audio Mixer] wcaps 0x20050f: Stereo Amp-In Amp-Out
  Control: name="CD Playback Volume", index=0, device=0
    ControlAmp: chs=3, dir=In, idx=0, ofs=0
  Control: name="CD Playback Switch", index=0, device=0
    ControlAmp: chs=3, dir=In, idx=0, ofs=0
  Amp-In caps: ofs=0x0c, nsteps=0x17, stepsize=0x0b, mute=1
  Amp-In vals:  [0x81 0x81] [0x80 0x80] [0x80 0x80]
  Amp-Out caps: ofs=0x0c, nsteps=0x0c, stepsize=0x0b, mute=1
  Amp-Out vals:  [0x8c 0x8c]
  Power states:  D0 D1 D2 D3
  Power: setting=D0, actual=D0
  Connection: 3
     0x11 0x14 0x1c
Node 0x16 [Audio Mixer] wcaps 0x20010b: Stereo Amp-In
  Control: name="Front Playback Switch", index=0, device=0
    ControlAmp: chs=3, dir=In, idx=2, ofs=0
  Amp-In caps: ofs=0x00, nsteps=0x00, stepsize=0x00, mute=1
  Amp-In vals:  [0x00 0x00] [0x00 0x00]
  Connection: 2
     0x03 0x15
Node 0x17 [Audio Mixer] wcaps 0x20010b: Stereo Amp-In
  Amp-In caps: ofs=0x00, nsteps=0x00, stepsize=0x00, mute=1
  Amp-In vals:  [0x80 0x80] [0x80 0x80]
  Connection: 2
     0x04 0x15
Node 0x18 [Audio Mixer] wcaps 0x20010b: Stereo Amp-In
  Control: name="Center Playback Switch", index=0, device=0
    ControlAmp: chs=1, dir=In, idx=2, ofs=0
  Control: name="LFE Playback Switch", index=0, device=0
    ControlAmp: chs=2, dir=In, idx=2, ofs=0
  Amp-In caps: ofs=0x00, nsteps=0x00, stepsize=0x00, mute=1
  Amp-In vals:  [0x80 0x80] [0x80 0x80]
  Connection: 2
     0x05 0x15
Node 0x19 [Audio Mixer] wcaps 0x20010b: Stereo Amp-In
  Control: name="Surround Playback Switch", index=0, device=0
    ControlAmp: chs=3, dir=In, idx=2, ofs=0
  Amp-In caps: ofs=0x00, nsteps=0x00, stepsize=0x00, mute=1
  Amp-In vals:  [0x80 0x80] [0x80 0x80]
  Connection: 2
     0x06 0x15
Node 0x1a [Audio Mixer] wcaps 0x20010b: Stereo Amp-In
  Amp-In caps: ofs=0x00, nsteps=0x00, stepsize=0x00, mute=1
  Amp-In vals:  [0x80 0x80] [0x80 0x80] [0x80 0x80] [0x80 0x80]
  Connection: 4
     0x04 0x06 0x15 0x03
Node 0x1b [Audio Mixer] wcaps 0x20010b: Stereo Amp-In
  Amp-In caps: ofs=0x00, nsteps=0x00, stepsize=0x00, mute=1
  Amp-In vals:  [0x80 0x80] [0x80 0x80] [0x80 0x80] [0x80 0x80]
  Connection: 4
     0x04 0x06 0x15 0x03
Node 0x1c [Audio Mixer] wcaps 0x20010b: Stereo Amp-In
  Amp-In caps: ofs=0x00, nsteps=0x00, stepsize=0x00, mute=1
  Amp-In vals:  [0x00 0x00] [0x80 0x80]
  Connection: 2
     0x0c 0x0f
Node 0x1d [Vendor Defined Widget] wcaps 0xf00000: Mono
Node 0x1e [Vendor Defined Widget] wcaps 0xf00000: Mono
Node 0x1f [Pin Complex] wcaps 0x400581: Stereo
  Pincap 0x00000017: OUT Detect Trigger ImpSense
  Pin Default 0x411111f0: [N/A] Speaker at Ext Rear
    Conn = 1/8, Color = Black
    DefAssociation = 0xf, Sequence = 0x0
    Misc = NO_PRESENCE
  Pin-ctls: 0x40: OUT
  Unsolicited: tag=00, enabled=0
  Power states:  D0 D1 D2 D3
  Power: setting=D0, actual=D0
  Connection: 1
     0x18
Node 0x20 [Pin Complex] wcaps 0x400581: Stereo
  Pincap 0x00000017: OUT Detect Trigger ImpSense
  Pin Default 0x411111f0: [N/A] Speaker at Ext Rear
    Conn = 1/8, Color = Black
    DefAssociation = 0xf, Sequence = 0x0
    Misc = NO_PRESENCE
  Pin-ctls: 0x40: OUT
  Unsolicited: tag=00, enabled=0
  Power states:  D0 D1 D2 D3
  Power: setting=D0, actual=D0
  Connection: 1
     0x17
Node 0x21 [Vendor Defined Widget] wcaps 0xf00000: Mono
Node 0x22 [Vendor Defined Widget] wcaps 0xf00000: Mono
Node 0x23 [Beep Generator Widget] wcaps 0x70000c: Mono Amp-Out
  Amp-Out caps: ofs=0x0f, nsteps=0x0f, stepsize=0x0b, mute=1
  Amp-Out vals:  [0x8f]
--endcollapse--


!!ALSA Device nodes
!!-----------------

crw-rw---- 1 root audio 116,  5 Jan 25 17:47 /dev/snd/controlC0
crw-rw---- 1 root audio 116,  4 Jan 25 17:47 /dev/snd/pcmC0D0c
crw-rw---- 1 root audio 116,  3 Jan 25 17:47 /dev/snd/pcmC0D0p
crw-rw---- 1 root audio 116,  2 Jan 25 17:47 /dev/snd/pcmC0D1p
crw-rw---- 1 root audio 116,  1 Jan 25 17:47 /dev/snd/seq
crw-rw---- 1 root audio 116, 33 Jan 25 17:47 /dev/snd/timer

/dev/snd/by-path:
total 0
drwxr-xr-x 2 root root  60 Jan 25 17:47 .
drwxr-xr-x 3 root root 180 Jan 25 17:47 ..
lrwxrwxrwx 1 root root  12 Jan 25 17:47 pci-0000:00:14.2 -> ../controlC0


!!Aplay/Arecord output
!!------------

APLAY

**** List of PLAYBACK Hardware Devices ****
card 0: SB [HDA ATI SB], device 0: ALC861 Analog [ALC861 Analog]
  Subdevices: 1/1
  Subdevice #0: subdevice #0
card 0: SB [HDA ATI SB], device 1: ALC861 Digital [ALC861 Digital]
  Subdevices: 1/1
  Subdevice #0: subdevice #0

ARECORD

**** List of CAPTURE Hardware Devices ****
card 0: SB [HDA ATI SB], device 0: ALC861 Analog [ALC861 Analog]
  Subdevices: 1/1
  Subdevice #0: subdevice #0

!!Amixer output
!!-------------

!!-------Mixer controls for card 0 [SB]

Card hw:0 'SB'/'HDA ATI SB at 0xc0400000 irq 42'
  Mixer name	: 'Realtek ALC861'
  Components	: 'HDA:10ec0861,15840000,00100300'
  Controls      : 17
  Simple ctrls  : 12
Simple mixer control 'Master',0
  Capabilities: pswitch pswitch-joined penum
  Playback channels: Mono
  Mono: Playback [on]
Simple mixer control 'PCM',0
  Capabilities: pvolume penum
  Playback channels: Front Left - Front Right
  Limits: Playback 0 - 255
  Mono:
  Front Left: Playback 86 [34%] [-33.80dB]
  Front Right: Playback 86 [34%] [-33.80dB]
Simple mixer control 'Front',0
  Capabilities: pswitch penum
  Playback channels: Front Left - Front Right
  Mono:
  Front Left: Playback [on]
  Front Right: Playback [on]
Simple mixer control 'Surround',0
  Capabilities: pswitch penum
  Playback channels: Front Left - Front Right
  Mono:
  Front Left: Playback [off]
  Front Right: Playback [off]
Simple mixer control 'Center',0
  Capabilities: pswitch pswitch-joined penum
  Playback channels: Mono
  Mono: Playback [off]
Simple mixer control 'LFE',0
  Capabilities: pswitch pswitch-joined penum
  Playback channels: Mono
  Mono: Playback [off]
Simple mixer control 'CD',0
  Capabilities: pvolume pswitch penum
  Playback channels: Front Left - Front Right
  Limits: Playback 0 - 23
  Mono:
  Front Left: Playback 1 [4%] [-33.00dB] [off]
  Front Right: Playback 1 [4%] [-33.00dB] [off]
Simple mixer control 'IEC958',0
  Capabilities: pswitch pswitch-joined penum
  Playback channels: Mono
  Mono: Playback [off]
Simple mixer control 'IEC958 Default PCM',0
  Capabilities: pswitch pswitch-joined penum
  Playback channels: Mono
  Mono: Playback [off]
Simple mixer control 'Capture',0
  Capabilities: cvolume cswitch penum
  Capture channels: Front Left - Front Right
  Limits: Capture 0 - 13
  Front Left: Capture 6 [46%] [12.00dB] [on]
  Front Right: Capture 6 [46%] [12.00dB] [on]
Simple mixer control 'Channel Mode',0
  Capabilities: enum
  Items: '2ch' '4ch' '6ch'
  Item0: '2ch'
Simple mixer control 'Input Source',0
  Capabilities: cenum
  Items: 'Mic' 'Line' 'CD'
  Item0: 'Mic'


!!Alsactl output
!!-------------

--startcollapse--
state.SB {
	control.1 {
		iface MIXER
		name 'Channel Mode'
		value '2ch'
		comment {
			access 'read write'
			type ENUMERATED
			count 1
			item.0 '2ch'
			item.1 '4ch'
			item.2 '6ch'
		}
	}
	control.2 {
		iface MIXER
		name 'Front Playback Switch'
		value.0 true
		value.1 true
		comment {
			access 'read write'
			type BOOLEAN
			count 2
		}
	}
	control.3 {
		iface MIXER
		name 'Surround Playback Switch'
		value.0 false
		value.1 false
		comment {
			access 'read write'
			type BOOLEAN
			count 2
		}
	}
	control.4 {
		iface MIXER
		name 'Center Playback Switch'
		value false
		comment {
			access 'read write'
			type BOOLEAN
			count 1
		}
	}
	control.5 {
		iface MIXER
		name 'LFE Playback Switch'
		value false
		comment {
			access 'read write'
			type BOOLEAN
			count 1
		}
	}
	control.6 {
		iface MIXER
		name 'CD Playback Volume'
		value.0 1
		value.1 1
		comment {
			access 'read write'
			type INTEGER
			count 2
			range '0 - 23'
			dbmin -3600
			dbmax 3300
			dbvalue.0 -3300
			dbvalue.1 -3300
		}
	}
	control.7 {
		iface MIXER
		name 'CD Playback Switch'
		value.0 false
		value.1 false
		comment {
			access 'read write'
			type BOOLEAN
			count 2
		}
	}
	control.8 {
		iface MIXER
		name 'Capture Switch'
		value.0 true
		value.1 true
		comment {
			access 'read write'
			type BOOLEAN
			count 2
		}
	}
	control.9 {
		iface MIXER
		name 'Capture Volume'
		value.0 6
		value.1 6
		comment {
			access 'read write'
			type INTEGER
			count 2
			range '0 - 13'
			dbmin -600
			dbmax 3300
			dbvalue.0 1200
			dbvalue.1 1200
		}
	}
	control.10 {
		iface MIXER
		name 'Input Source'
		value Mic
		comment {
			access 'read write'
			type ENUMERATED
			count 1
			item.0 Mic
			item.1 Line
			item.2 CD
		}
	}
	control.11 {
		iface MIXER
		name 'IEC958 Playback Con Mask'
		value '0fff000000000000000000000000000000000000000000000000000000000000000000000000000000000000000000000000000000000000000000000000000000000000000000000000000000000000000000000000000000000000000000000000000000000000000000000000000000000000000000000000000000000000000000000000000000000000000000000000000000000000000000000000000000000000000000000000000000000000'
		comment {
			access read
			type IEC958
			count 1
		}
	}
	control.12 {
		iface MIXER
		name 'IEC958 Playback Pro Mask'
		value '0f00000000000000000000000000000000000000000000000000000000000000000000000000000000000000000000000000000000000000000000000000000000000000000000000000000000000000000000000000000000000000000000000000000000000000000000000000000000000000000000000000000000000000000000000000000000000000000000000000000000000000000000000000000000000000000000000000000000000000'
		comment {
			access read
			type IEC958
			count 1
		}
	}
	control.13 {
		iface MIXER
		name 'IEC958 Playback Default'
		value '0400000000000000000000000000000000000000000000000000000000000000000000000000000000000000000000000000000000000000000000000000000000000000000000000000000000000000000000000000000000000000000000000000000000000000000000000000000000000000000000000000000000000000000000000000000000000000000000000000000000000000000000000000000000000000000000000000000000000000'
		comment {
			access 'read write'
			type IEC958
			count 1
		}
	}
	control.14 {
		iface MIXER
		name 'IEC958 Playback Switch'
		value false
		comment {
			access 'read write'
			type BOOLEAN
			count 1
		}
	}
	control.15 {
		iface MIXER
		name 'IEC958 Default PCM Playback Switch'
		value false
		comment {
			access 'read write'
			type BOOLEAN
			count 1
		}
	}
	control.16 {
		iface MIXER
		name 'Master Playback Switch'
		value true
		comment {
			access 'read write'
			type BOOLEAN
			count 1
		}
	}
	control.17 {
		iface MIXER
		name 'PCM Playback Volume'
		value.0 86
		value.1 86
		comment {
			access 'read write user'
			type INTEGER
			count 2
			range '0 - 255'
			tlv '0000000100000008ffffec1400000014'
			dbmin -5100
			dbmax 0
			dbvalue.0 -3380
			dbvalue.1 -3380
		}
	}
}
--endcollapse--


!!All Loaded Modules
!!------------------

Module
rt73usb
crc_itu_t
rt2x00usb
rt2x00lib
radeon
mac80211
cfg80211
ttm
drm_kms_helper
drm
ide_cd_mod
backlight
cdrom
i2c_algo_bit
cfbcopyarea
cfbimgblt
cfbfillrect
i2c_piix4


!!ALSA/HDA dmesg
!!------------------

usbhid: USB HID core driver
snd_hda_intel 0000:00:14.2: PCI INT A -> GSI 16 (level, low) -> IRQ 16
snd_hda_intel 0000:00:14.2: irq 42 for MSI/MSI-X
ALSA device list:
  #0: HDA ATI SB at 0xc0400000 irq 42
TCP cubic registered


