upload=true&script=true&cardinfo=
!!################################
!!ALSA Information Script v 0.4.59
!!################################

!!Script ran on: Tue Apr  6 17:05:31 UTC 2010


!!Linux Distribution
!!------------------

Ubuntu 9.10 \n \l DISTRIB_ID=Ubuntu DISTRIB_DESCRIPTION="Ubuntu 9.10"


!!DMI Information
!!---------------

Manufacturer:      MEDION
Product Name:      WIM2160


!!Kernel Information
!!------------------

Kernel release:    2.6.33
Operating System:  GNU/Linux
Architecture:      i686
Processor:         unknown
SMP Enabled:       Yes


!!ALSA Version
!!------------

Driver version:     1.0.21
Library version:    1.0.20
Utilities version:  1.0.20


!!Loaded ALSA modules
!!-------------------



!!Sound Servers on this system
!!----------------------------

Pulseaudio:
      Installed - Yes (/usr/bin/pulseaudio)
      Running - Yes

ESound Daemon:
      Installed - Yes (/usr/bin/esd)
      Running - No


!!Soundcards recognised by ALSA
!!-----------------------------

 0 [Intel          ]: HDA-Intel - HDA Intel
                      HDA Intel at 0xd8440000 irq 29


!!PCI Soundcards installed in the system
!!--------------------------------------

00:1b.0 Audio device: Intel Corporation 82801G (ICH7 Family) High Definition Audio Controller (rev 02)


!!Advanced information - PCI Vendor/Device/Susbsystem ID's
!!--------------------------------------------------------

00:1b.0 0403: 8086:27d8 (rev 02)
	Subsystem: 17c0:4071


!!Modprobe options (Sound related)
!!--------------------------------

snd-atiixp-modem: index=-2
snd-intel8x0m: index=-2
snd-via82xx-modem: index=-2
snd-usb-audio: index=-2
snd-usb-us122l: index=-2
snd-usb-usx2y: index=-2
snd-usb-caiaq: index=-2
snd-cmipci: mpu_port=0x330 fm_port=0x388
snd-pcsp: index=-2
snd-hda-intel: power_save=10 power_save_controller=N
snd-hda-intel: model=medion-wim2160


!!Loaded sound module options
!!--------------------------


!!HDA-Intel Codec information
!!---------------------------
--startcollapse--

Codec: Realtek ALC883
Address: 0
Function Id: 0x1
Vendor Id: 0x10ec0883
Subsystem Id: 0x17c04080
Revision Id: 0x100002
No Modem Function Group found
Default PCM:
    rates [0x560]: 44100 48000 96000 192000
    bits [0xe]: 16 20 24
    formats [0x1]: PCM
Default Amp-In caps: N/A
Default Amp-Out caps: N/A
GPIO: io=2, o=0, i=0, unsolicited=1, wake=0
  IO[0]: enable=0, dir=0, wake=0, sticky=0, data=0, unsol=0
  IO[1]: enable=0, dir=0, wake=0, sticky=0, data=0, unsol=0
Node 0x02 [Audio Output] wcaps 0x11: Stereo
  Device: name="ALC883 Analog", type="Audio", device=0
  Converter: stream=5, channel=0
  PCM:
    rates [0x560]: 44100 48000 96000 192000
    bits [0xe]: 16 20 24
    formats [0x1]: PCM
Node 0x03 [Audio Output] wcaps 0x11: Stereo
  Converter: stream=5, channel=0
  PCM:
    rates [0x560]: 44100 48000 96000 192000
    bits [0xe]: 16 20 24
    formats [0x1]: PCM
Node 0x04 [Audio Output] wcaps 0x11: Stereo
  Converter: stream=5, channel=0
  PCM:
    rates [0x560]: 44100 48000 96000 192000
    bits [0xe]: 16 20 24
    formats [0x1]: PCM
Node 0x05 [Audio Output] wcaps 0x11: Stereo
  Converter: stream=5, channel=0
  PCM:
    rates [0x560]: 44100 48000 96000 192000
    bits [0xe]: 16 20 24
    formats [0x1]: PCM
Node 0x06 [Audio Output] wcaps 0x211: Stereo Digital
  Control: name="IEC958 Playback Con Mask", index=0, device=0
  Control: name="IEC958 Playback Pro Mask", index=0, device=0
  Control: name="IEC958 Playback Default", index=0, device=0
  Control: name="IEC958 Playback Switch", index=0, device=0
  Control: name="IEC958 Default PCM Playback Switch", index=0, device=0
  Device: name="ALC883 Digital", type="SPDIF", device=1
  Converter: stream=5, channel=0
  Digital:
  Digital category: 0x0
  PCM:
    rates [0x560]: 44100 48000 96000 192000
    bits [0x1e]: 16 20 24 32
    formats [0x1]: PCM
Node 0x07 [Vendor Defined Widget] wcaps 0xf00000: Mono
Node 0x08 [Audio Input] wcaps 0x10011b: Stereo Amp-In
  Control: name="Line Playback Volume", index=0, device=0
  Control: name="Line Playback Switch", index=0, device=0
  Device: name="ALC883 Analog", type="Audio", device=0
  Amp-In caps: ofs=0x08, nsteps=0x1f, stepsize=0x05, mute=1
  Amp-In vals:  [0x15 0x15]
  Converter: stream=0, channel=0
  SDI-Select: 0
  PCM:
    rates [0x160]: 44100 48000 96000
    bits [0x6]: 16 20
    formats [0x1]: PCM
  Connection: 1
     0x23
Node 0x09 [Audio Input] wcaps 0x10011b: Stereo Amp-In
  Device: name="ALC883 Analog", type="Audio", device=2
  Amp-In caps: ofs=0x08, nsteps=0x1f, stepsize=0x05, mute=1
  Amp-In vals:  [0x80 0x80]
  Converter: stream=0, channel=0
  SDI-Select: 0
  PCM:
    rates [0x160]: 44100 48000 96000
    bits [0x6]: 16 20
    formats [0x1]: PCM
  Connection: 1
     0x22
Node 0x0a [Audio Input] wcaps 0x100391: Stereo Digital
  Converter: stream=0, channel=0
  SDI-Select: 0
  Digital:
  Digital category: 0x0
  PCM:
    rates [0x560]: 44100 48000 96000 192000
    bits [0x1e]: 16 20 24 32
    formats [0x1]: PCM
  Unsolicited: tag=00, enabled=0
  Connection: 1
     0x1f
Node 0x0b [Audio Mixer] wcaps 0x20010b: Stereo Amp-In
  Control: name="Beep Playback Volume", index=0, device=0
  Control: name="Beep Playback Switch", index=0, device=0
  Amp-In caps: ofs=0x17, nsteps=0x1f, stepsize=0x05, mute=1
  Amp-In vals:  [0x80 0x80] [0x80 0x80] [0x80 0x80] [0x80 0x80] [0x80 0x80] [0x80 0x80] [0x80 0x80] [0x80 0x80] [0x80 0x80] [0x80 0x80]
  Connection: 10
     0x18 0x19 0x1a 0x1b 0x1c 0x1d 0x14 0x15 0x16 0x17
Node 0x0c [Audio Mixer] wcaps 0x20010f: Stereo Amp-In Amp-Out
  Control: name="Front Playback Volume", index=0, device=0
  Amp-In caps: ofs=0x00, nsteps=0x00, stepsize=0x00, mute=1
  Amp-In vals:  [0x00 0x00] [0x00 0x00]
  Amp-Out caps: ofs=0x1f, nsteps=0x1f, stepsize=0x05, mute=0
  Amp-Out vals:  [0x0d 0x0d]
  Connection: 2
     0x02 0x0b
Node 0x0d [Audio Mixer] wcaps 0x20010f: Stereo Amp-In Amp-Out
  Amp-In caps: ofs=0x00, nsteps=0x00, stepsize=0x00, mute=1
  Amp-In vals:  [0x80 0x80] [0x80 0x80]
  Amp-Out caps: ofs=0x1f, nsteps=0x1f, stepsize=0x05, mute=0
  Amp-Out vals:  [0x00 0x00]
  Connection: 2
     0x03 0x0b
Node 0x0e [Audio Mixer] wcaps 0x20010f: Stereo Amp-In Amp-Out
  Amp-In caps: ofs=0x00, nsteps=0x00, stepsize=0x00, mute=1
  Amp-In vals:  [0x80 0x80] [0x80 0x80]
  Amp-Out caps: ofs=0x1f, nsteps=0x1f, stepsize=0x05, mute=0
  Amp-Out vals:  [0x00 0x00]
  Connection: 2
     0x04 0x0b
Node 0x0f [Audio Mixer] wcaps 0x20010f: Stereo Amp-In Amp-Out
  Amp-In caps: ofs=0x00, nsteps=0x00, stepsize=0x00, mute=1
  Amp-In vals:  [0x80 0x80] [0x80 0x80]
  Amp-Out caps: ofs=0x1f, nsteps=0x1f, stepsize=0x05, mute=0
  Amp-Out vals:  [0x00 0x00]
  Connection: 2
     0x05 0x0b
Node 0x10 [Vendor Defined Widget] wcaps 0xf00000: Mono
Node 0x11 [Vendor Defined Widget] wcaps 0xf00000: Mono
Node 0x12 [Vendor Defined Widget] wcaps 0xf00000: Mono
Node 0x13 [Vendor Defined Widget] wcaps 0xf00000: Mono
Node 0x14 [Pin Complex] wcaps 0x40018f: Stereo Amp-In Amp-Out
  Amp-In caps: ofs=0x00, nsteps=0x03, stepsize=0x27, mute=0
  Amp-In vals:  [0x00 0x00]
  Amp-Out caps: ofs=0x00, nsteps=0x00, stepsize=0x00, mute=1
  Amp-Out vals:  [0x00 0x00]
  Pincap 0x0000003e: IN OUT HP Detect Trigger
  Pin Default 0x0121101f: [Jack] HP Out at Ext Rear
    Conn = 1/8, Color = Black
    DefAssociation = 0x1, Sequence = 0xf
  Pin-ctls: 0x40: OUT
  Unsolicited: tag=00, enabled=0
  Connection: 5
     0x0c* 0x0d 0x0e 0x0f 0x26
Node 0x15 [Pin Complex] wcaps 0x40018f: Stereo Amp-In Amp-Out
  Control: name="Speaker Playback Switch", index=0, device=0
  Amp-In caps: ofs=0x00, nsteps=0x03, stepsize=0x27, mute=0
  Amp-In vals:  [0x00 0x00]
  Amp-Out caps: ofs=0x00, nsteps=0x00, stepsize=0x00, mute=1
  Amp-Out vals:  [0x00 0x00]
  Pincap 0x0000003e: IN OUT HP Detect Trigger
  Pin Default 0x99130110: [Fixed] Speaker at Int ATAPI
    Conn = ATAPI, Color = Unknown
    DefAssociation = 0x1, Sequence = 0x0
    Misc = NO_PRESENCE
  Pin-ctls: 0x40: OUT
  Unsolicited: tag=00, enabled=0
  Connection: 5
     0x0c* 0x0d 0x0e 0x0f 0x26
Node 0x16 [Pin Complex] wcaps 0x40018f: Stereo Amp-In Amp-Out
  Amp-In caps: ofs=0x00, nsteps=0x03, stepsize=0x27, mute=0
  Amp-In vals:  [0x00 0x00]
  Amp-Out caps: ofs=0x00, nsteps=0x00, stepsize=0x00, mute=1
  Amp-Out vals:  [0x00 0x00]
  Pincap 0x0000003e: IN OUT HP Detect Trigger
  Pin Default 0x411111f0: [N/A] Speaker at Ext Rear
    Conn = 1/8, Color = Black
    DefAssociation = 0xf, Sequence = 0x0
    Misc = NO_PRESENCE
  Pin-ctls: 0x40: OUT
  Unsolicited: tag=00, enabled=0
  Connection: 5
     0x0c 0x0d 0x0e* 0x0f 0x26
Node 0x17 [Pin Complex] wcaps 0x40018f: Stereo Amp-In Amp-Out
  Amp-In caps: ofs=0x00, nsteps=0x03, stepsize=0x27, mute=0
  Amp-In vals:  [0x00 0x00]
  Amp-Out caps: ofs=0x00, nsteps=0x00, stepsize=0x00, mute=1
  Amp-Out vals:  [0x00 0x00]
  Pincap 0x0000003e: IN OUT HP Detect Trigger
  Pin Default 0x411111f0: [N/A] Speaker at Ext Rear
    Conn = 1/8, Color = Black
    DefAssociation = 0xf, Sequence = 0x0
    Misc = NO_PRESENCE
  Pin-ctls: 0x40: OUT
  Unsolicited: tag=00, enabled=0
  Connection: 5
     0x0c 0x0d 0x0e 0x0f* 0x26
Node 0x18 [Pin Complex] wcaps 0x40018f: Stereo Amp-In Amp-Out
  Amp-In caps: ofs=0x00, nsteps=0x03, stepsize=0x27, mute=0
  Amp-In vals:  [0x00 0x00]
  Amp-Out caps: ofs=0x00, nsteps=0x00, stepsize=0x00, mute=1
  Amp-Out vals:  [0x80 0x80]
  Pincap 0x0000173e: IN OUT HP Detect Trigger
    Vref caps: HIZ 50 GRD 80
  Pin Default 0x01a15c30: [Jack] Mic at Ext Rear
    Conn = 1/8, Color = Red
    DefAssociation = 0x3, Sequence = 0x0
  Pin-ctls: 0x24: IN VREF_80
  Unsolicited: tag=00, enabled=0
  Connection: 5
     0x0c* 0x0d 0x0e 0x0f 0x26
Node 0x19 [Pin Complex] wcaps 0x40018f: Stereo Amp-In Amp-Out
  Amp-In caps: ofs=0x00, nsteps=0x03, stepsize=0x27, mute=0
  Amp-In vals:  [0x00 0x00]
  Amp-Out caps: ofs=0x00, nsteps=0x00, stepsize=0x00, mute=1
  Amp-Out vals:  [0x80 0x80]
  Pincap 0x0000173e: IN OUT HP Detect Trigger
    Vref caps: HIZ 50 GRD 80
  Pin Default 0x411111f0: [N/A] Speaker at Ext Rear
    Conn = 1/8, Color = Black
    DefAssociation = 0xf, Sequence = 0x0
    Misc = NO_PRESENCE
  Pin-ctls: 0x24: IN VREF_80
  Unsolicited: tag=00, enabled=0
  Connection: 5
     0x0c* 0x0d 0x0e 0x0f 0x26
Node 0x1a [Pin Complex] wcaps 0x40018f: Stereo Amp-In Amp-Out
  Control: name="Headphone Playback Switch", index=0, device=0
  Amp-In caps: ofs=0x00, nsteps=0x03, stepsize=0x27, mute=0
  Amp-In vals:  [0x00 0x00]
  Amp-Out caps: ofs=0x00, nsteps=0x00, stepsize=0x00, mute=1
  Amp-Out vals:  [0x00 0x00]
  Pincap 0x0000173e: IN OUT HP Detect Trigger
    Vref caps: HIZ 50 GRD 80
  Pin Default 0x0181343f: [Jack] Line In at Ext Rear
    Conn = 1/8, Color = Blue
    DefAssociation = 0x3, Sequence = 0xf
  Pin-ctls: 0xc0: OUT HP VREF_HIZ
  Unsolicited: tag=04, enabled=1
  Connection: 5
     0x0c* 0x0d 0x0e 0x0f 0x26
Node 0x1b [Pin Complex] wcaps 0x40018f: Stereo Amp-In Amp-Out
  Amp-In caps: ofs=0x00, nsteps=0x03, stepsize=0x27, mute=0
  Amp-In vals:  [0x00 0x00]
  Amp-Out caps: ofs=0x00, nsteps=0x00, stepsize=0x00, mute=1
  Amp-Out vals:  [0x00 0x00]
  Pincap 0x0000173e: IN OUT HP Detect Trigger
    Vref caps: HIZ 50 GRD 80
  Pin Default 0x411111f0: [N/A] Speaker at Ext Rear
    Conn = 1/8, Color = Black
    DefAssociation = 0xf, Sequence = 0x0
    Misc = NO_PRESENCE
  Pin-ctls: 0xc0: OUT HP VREF_HIZ
  Unsolicited: tag=00, enabled=0
  Connection: 5
     0x0c* 0x0d 0x0e 0x0f 0x26
Node 0x1c [Pin Complex] wcaps 0x400001: Stereo
  Pincap 0x00000020: IN
  Pin Default 0x411111f0: [N/A] Speaker at Ext Rear
    Conn = 1/8, Color = Black
    DefAssociation = 0xf, Sequence = 0x0
    Misc = NO_PRESENCE
  Pin-ctls: 0x00:
Node 0x1d [Pin Complex] wcaps 0x400000: Mono
  Pincap 0x00000020: IN
  Pin Default 0x40159505: [N/A] Speaker at Ext N/A
    Conn = Optical, Color = Pink
    DefAssociation = 0x0, Sequence = 0x5
    Misc = NO_PRESENCE
  Pin-ctls: 0x00:
Node 0x1e [Pin Complex] wcaps 0x400300: Mono Digital
  Pincap 0x00000010: OUT
  Pin Default 0x01451120: [Jack] SPDIF Out at Ext Rear
    Conn = Optical, Color = Black
    DefAssociation = 0x2, Sequence = 0x0
    Misc = NO_PRESENCE
  Pin-ctls: 0x00:
  Connection: 1
     0x06
Node 0x1f [Pin Complex] wcaps 0x400200: Mono Digital
  Pincap 0x00000020: IN
  Pin Default 0x411111f0: [N/A] Speaker at Ext Rear
    Conn = 1/8, Color = Black
    DefAssociation = 0xf, Sequence = 0x0
    Misc = NO_PRESENCE
  Pin-ctls: 0x00:
Node 0x20 [Vendor Defined Widget] wcaps 0xf00040: Mono
  Processing caps: benign=0, ncoeff=17
  Processing Coefficient: 0x2c00
  Coefficient Index: 0x0d
Node 0x21 [Vendor Defined Widget] wcaps 0xf00000: Mono
Node 0x22 [Audio Mixer] wcaps 0x20010f: Stereo Amp-In Amp-Out
  Amp-In caps: ofs=0x00, nsteps=0x00, stepsize=0x00, mute=1
  Amp-In vals:  [0x00 0x00] [0x80 0x80] [0x80 0x80] [0x80 0x80] [0x80 0x80] [0x80 0x80] [0x80 0x80] [0x80 0x80] [0x80 0x80] [0x80 0x80] [0x80 0x80]
  Amp-Out caps: N/A
  Amp-Out vals:  [0x00 0x00]
  Connection: 11
     0x18 0x19 0x1a 0x1b 0x1c 0x1d 0x14 0x15 0x16 0x17 0x0b
Node 0x23 [Audio Mixer] wcaps 0x20010f: Stereo Amp-In Amp-Out
  Amp-In caps: ofs=0x00, nsteps=0x00, stepsize=0x00, mute=1
  Amp-In vals:  [0x00 0x00] [0x80 0x80] [0x80 0x80] [0x80 0x80] [0x80 0x80] [0x80 0x80] [0x80 0x80] [0x80 0x80] [0x80 0x80] [0x80 0x80] [0x80 0x80]
  Amp-Out caps: N/A
  Amp-Out vals:  [0x00 0x00]
  Connection: 11
     0x18 0x19 0x1a 0x1b 0x1c 0x1d 0x14 0x15 0x16 0x17 0x0b
Node 0x24 [Vendor Defined Widget] wcaps 0xf00000: Mono
Node 0x25 [Audio Output] wcaps 0x11: Stereo
  Converter: stream=0, channel=0
  PCM:
    rates [0x560]: 44100 48000 96000 192000
    bits [0xe]: 16 20 24
    formats [0x1]: PCM
Node 0x26 [Audio Mixer] wcaps 0x20010f: Stereo Amp-In Amp-Out
  Amp-In caps: ofs=0x00, nsteps=0x00, stepsize=0x00, mute=1
  Amp-In vals:  [0x00 0x00] [0x80 0x80]
  Amp-Out caps: ofs=0x1f, nsteps=0x1f, stepsize=0x05, mute=0
  Amp-Out vals:  [0x00 0x00]
  Connection: 2
     0x25 0x0b
Codec: Motorola ID 3055
Address: 1
Function Id: 0x2
Vendor Id: 0x10573055
Subsystem Id: 0x10573055
Revision Id: 0x100700
Modem Function Group: 0x1
--endcollapse--


!!ALSA Device nodes
!!-----------------

crw-rw----+ 1 root audio 116, 10 Apr  6 18:24 /dev/snd/controlC0
crw-rw----+ 1 root audio 116,  9 Apr  6 18:24 /dev/snd/hwC0D0
crw-rw----+ 1 root audio 116,  8 Apr  6 18:24 /dev/snd/hwC0D1
crw-rw----+ 1 root audio 116,  7 Apr  6 18:26 /dev/snd/pcmC0D0c
crw-rw----+ 1 root audio 116,  6 Apr  6 18:26 /dev/snd/pcmC0D0p
crw-rw----+ 1 root audio 116,  5 Apr  6 18:25 /dev/snd/pcmC0D1p
crw-rw----+ 1 root audio 116,  4 Apr  6 18:24 /dev/snd/pcmC0D2c
crw-rw----+ 1 root audio 116,  3 Apr  6  2010 /dev/snd/seq
crw-rw----+ 1 root audio 116,  2 Apr  6  2010 /dev/snd/timer

/dev/snd/by-path:
total 0
drwxr-xr-x 2 root root  60 Apr  6 18:24 .
drwxr-xr-x 3 root root 240 Apr  6 18:24 ..
lrwxrwxrwx 1 root root  12 Apr  6 18:24 pci-0000:00:1b.0 -> ../controlC0


!!Aplay/Arecord output
!!------------

APLAY

**** List of PLAYBACK Hardware Devices ****
card 0: Intel [HDA Intel], device 0: ALC883 Analog [ALC883 Analog]
  Subdevices: 0/1
  Subdevice #0: subdevice #0
card 0: Intel [HDA Intel], device 1: ALC883 Digital [ALC883 Digital]
  Subdevices: 1/1
  Subdevice #0: subdevice #0

ARECORD

**** List of CAPTURE Hardware Devices ****
card 0: Intel [HDA Intel], device 0: ALC883 Analog [ALC883 Analog]
  Subdevices: 1/1
  Subdevice #0: subdevice #0
card 0: Intel [HDA Intel], device 2: ALC883 Analog [ALC883 Analog]
  Subdevices: 1/1
  Subdevice #0: subdevice #0

!!Amixer output
!!-------------

!!-------Mixer controls for card 0 [Intel]

Card hw:0 'Intel'/'HDA Intel at 0xd8440000 irq 29'
  Mixer name	: 'Realtek ALC883'
  Components	: 'HDA:10ec0883,17c04080,00100002 HDA:10573055,10573055,00100700'
  Controls      : 22
  Simple ctrls  : 13
Simple mixer control 'Master',0
  Capabilities: pvolume pvolume-joined pswitch pswitch-joined
  Playback channels: Mono
  Limits: Playback 0 - 31
  Mono: Playback 13 [42%] [-27.00dB] [on]
Simple mixer control 'Headphone',0
  Capabilities: pswitch
  Playback channels: Front Left - Front Right
  Mono:
  Front Left: Playback [on]
  Front Right: Playback [on]
Simple mixer control 'PCM',0
  Capabilities: pvolume
  Playback channels: Front Left - Front Right
  Limits: Playback 0 - 255
  Mono:
  Front Left: Playback 249 [98%] [-1.20dB]
  Front Right: Playback 249 [98%] [-1.20dB]
Simple mixer control 'Front',0
  Capabilities: pvolume pswitch
  Playback channels: Front Left - Front Right
  Limits: Playback 0 - 31
  Mono:
  Front Left: Playback 31 [100%] [0.00dB] [on]
  Front Right: Playback 31 [100%] [0.00dB] [on]
Simple mixer control 'Line',0
  Capabilities: pvolume pswitch
  Playback channels: Front Left - Front Right
  Limits: Playback 0 - 31
  Mono:
  Front Left: Playback 21 [68%] [19.50dB] [on]
  Front Right: Playback 21 [68%] [19.50dB] [on]
Simple mixer control 'IEC958',0
  Capabilities: pswitch pswitch-joined
  Playback channels: Mono
  Mono: Playback [off]
Simple mixer control 'IEC958 Default PCM',0
  Capabilities: pswitch pswitch-joined
  Playback channels: Mono
  Mono: Playback [on]
Simple mixer control 'Capture',0
  Capabilities: cvolume cswitch
  Capture channels: Front Left - Front Right
  Limits: Capture 0 - 31
  Front Left: Capture 21 [68%] [19.50dB] [on]
  Front Right: Capture 21 [68%] [19.50dB] [on]
Simple mixer control 'Capture',1
  Capabilities: cvolume cswitch
  Capture channels: Front Left - Front Right
  Limits: Capture 0 - 31
  Front Left: Capture 0 [0%] [-12.00dB] [off]
  Front Right: Capture 0 [0%] [-12.00dB] [off]
Simple mixer control 'Beep',0
  Capabilities: pvolume pswitch
  Playback channels: Front Left - Front Right
  Limits: Playback 0 - 31
  Mono:
  Front Left: Playback 0 [0%] [-34.50dB] [off]
  Front Right: Playback 0 [0%] [-34.50dB] [off]
Simple mixer control 'Input Source',0
  Capabilities: cenum
  Items: 'Mic' 'Front Mic' 'Line' 'CD'
  Item0: 'Mic'
Simple mixer control 'Input Source',1
  Capabilities: cenum
  Items: 'Mic' 'Front Mic' 'Line' 'CD'
  Item0: 'Mic'
Simple mixer control 'Speaker',0
  Capabilities: pswitch
  Playback channels: Front Left - Front Right
  Mono:
  Front Left: Playback [on]
  Front Right: Playback [on]


!!Alsactl output
!!-------------

--startcollapse--
state.Intel {
	control.1 {
		comment.access 'read write'
		comment.type INTEGER
		comment.count 2
		comment.range '0 - 31'
		comment.dbmin -4650
		comment.dbmax 0
		iface MIXER
		name 'Front Playback Volume'
		value.0 31
		value.1 31
	}
	control.2 {
		comment.access 'read write'
		comment.type BOOLEAN
		comment.count 2
		iface MIXER
		name 'Front Playback Switch'
		value.0 true
		value.1 true
	}
	control.3 {
		comment.access 'read write'
		comment.type BOOLEAN
		comment.count 2
		iface MIXER
		name 'Speaker Playback Switch'
		value.0 true
		value.1 true
	}
	control.4 {
		comment.access 'read write'
		comment.type BOOLEAN
		comment.count 2
		iface MIXER
		name 'Headphone Playback Switch'
		value.0 true
		value.1 true
	}
	control.5 {
		comment.access 'read write'
		comment.type INTEGER
		comment.count 2
		comment.range '0 - 31'
		comment.dbmin -1200
		comment.dbmax 3450
		iface MIXER
		name 'Line Playback Volume'
		value.0 21
		value.1 21
	}
	control.6 {
		comment.access 'read write'
		comment.type BOOLEAN
		comment.count 2
		iface MIXER
		name 'Line Playback Switch'
		value.0 true
		value.1 true
	}
	control.7 {
		comment.access 'read write'
		comment.type BOOLEAN
		comment.count 2
		iface MIXER
		name 'Capture Switch'
		value.0 true
		value.1 true
	}
	control.8 {
		comment.access 'read write'
		comment.type BOOLEAN
		comment.count 2
		iface MIXER
		name 'Capture Switch'
		index 1
		value.0 false
		value.1 false
	}
	control.9 {
		comment.access 'read write'
		comment.type INTEGER
		comment.count 2
		comment.range '0 - 31'
		comment.dbmin -1200
		comment.dbmax 3450
		iface MIXER
		name 'Capture Volume'
		value.0 21
		value.1 21
	}
	control.10 {
		comment.access 'read write'
		comment.type INTEGER
		comment.count 2
		comment.range '0 - 31'
		comment.dbmin -1200
		comment.dbmax 3450
		iface MIXER
		name 'Capture Volume'
		index 1
		value.0 0
		value.1 0
	}
	control.11 {
		comment.access 'read write'
		comment.type ENUMERATED
		comment.count 1
		comment.item.0 Mic
		comment.item.1 'Front Mic'
		comment.item.2 Line
		comment.item.3 CD
		iface MIXER
		name 'Input Source'
		value Mic
	}
	control.12 {
		comment.access 'read write'
		comment.type ENUMERATED
		comment.count 1
		comment.item.0 Mic
		comment.item.1 'Front Mic'
		comment.item.2 Line
		comment.item.3 CD
		iface MIXER
		name 'Input Source'
		index 1
		value Mic
	}
	control.13 {
		comment.access read
		comment.type IEC958
		comment.count 1
		iface MIXER
		name 'IEC958 Playback Con Mask'
		value '0fff000000000000000000000000000000000000000000000000000000000000000000000000000000000000000000000000000000000000000000000000000000000000000000000000000000000000000000000000000000000000000000000000000000000000000000000000000000000000000000000000000000000000000000000000000000000000000000000000000000000000000000000000000000000000000000000000000000000000'
	}
	control.14 {
		comment.access read
		comment.type IEC958
		comment.count 1
		iface MIXER
		name 'IEC958 Playback Pro Mask'
		value '0f00000000000000000000000000000000000000000000000000000000000000000000000000000000000000000000000000000000000000000000000000000000000000000000000000000000000000000000000000000000000000000000000000000000000000000000000000000000000000000000000000000000000000000000000000000000000000000000000000000000000000000000000000000000000000000000000000000000000000'
	}
	control.15 {
		comment.access 'read write'
		comment.type IEC958
		comment.count 1
		iface MIXER
		name 'IEC958 Playback Default'
		value '0400000000000000000000000000000000000000000000000000000000000000000000000000000000000000000000000000000000000000000000000000000000000000000000000000000000000000000000000000000000000000000000000000000000000000000000000000000000000000000000000000000000000000000000000000000000000000000000000000000000000000000000000000000000000000000000000000000000000000'
	}
	control.16 {
		comment.access 'read write'
		comment.type BOOLEAN
		comment.count 1
		iface MIXER
		name 'IEC958 Playback Switch'
		value false
	}
	control.17 {
		comment.access 'read write'
		comment.type BOOLEAN
		comment.count 1
		iface MIXER
		name 'IEC958 Default PCM Playback Switch'
		value true
	}
	control.18 {
		comment.access 'read write'
		comment.type INTEGER
		comment.count 2
		comment.range '0 - 31'
		comment.dbmin -3450
		comment.dbmax 1200
		iface MIXER
		name 'Beep Playback Volume'
		value.0 0
		value.1 0
	}
	control.19 {
		comment.access 'read write'
		comment.type BOOLEAN
		comment.count 2
		iface MIXER
		name 'Beep Playback Switch'
		value.0 false
		value.1 false
	}
	control.20 {
		comment.access 'read write'
		comment.type INTEGER
		comment.count 1
		comment.range '0 - 31'
		comment.dbmin -4650
		comment.dbmax 0
		iface MIXER
		name 'Master Playback Volume'
		value 13
	}
	control.21 {
		comment.access 'read write'
		comment.type BOOLEAN
		comment.count 1
		iface MIXER
		name 'Master Playback Switch'
		value true
	}
	control.22 {
		comment.access 'read write user'
		comment.type INTEGER
		comment.count 2
		comment.range '0 - 255'
		comment.tlv '0000000100000008ffffec1400000014'
		comment.dbmin -5100
		comment.dbmax 0
		iface MIXER
		name 'PCM Playback Volume'
		value.0 249
		value.1 249
	}
}
--endcollapse--


!!All Loaded Modules
!!------------------

Module
snd_hda_codec_realtek
snd_hda_intel
acer_wmi
snd_hda_codec
wmi
snd_hwdep
usbhid


!!Sysfs Files
!!-----------

/sys/class/sound/hwC0D0/init_pin_configs:
0x14 0x0121101f
0x15 0x99130110
0x16 0x411111f0
0x17 0x411111f0
0x18 0x01a15c30
0x19 0x411111f0
0x1a 0x0181343f
0x1b 0x411111f0
0x1c 0x411111f0
0x1d 0x40159505
0x1e 0x01451120
0x1f 0x411111f0

/sys/class/sound/hwC0D0/driver_pin_configs:

/sys/class/sound/hwC0D0/user_pin_configs:

/sys/class/sound/hwC0D0/init_verbs:

/sys/class/sound/hwC0D1/init_pin_configs:

/sys/class/sound/hwC0D1/driver_pin_configs:

/sys/class/sound/hwC0D1/user_pin_configs:

/sys/class/sound/hwC0D1/init_verbs:


!!ALSA/HDA dmesg
!!------------------

[    0.000000] Built 1 zonelists in Zone order, mobility grouping on.  Total pages: 517681
[    0.000000] Kernel command line: BOOT_IMAGE=/boot/vmlinuz-2.6.33 root=UUID=4707d263-224a-43c8-be3a-b1dc95ed85ce ro quiet splash snd-hda-intel.model=medion-wim2160
[    0.000000] PID hash table entries: 4096 (order: 2, 16384 bytes)
--
[    1.439219] ricoh-mmc: Controller is now disabled.
[    1.442023] ALSA device list:
[    1.442026]   No soundcards found.
[    1.442093] Netfilter messages via NETLINK v0.30.
--
[    9.321703] acer-wmi: Acer Laptop ACPI-WMI Extras
[    9.373998] HDA Intel 0000:00:1b.0: power state changed by ACPI to D0
[    9.374036]   alloc irq_desc for 21 on node -1
[    9.374038]   alloc kstat_irqs on node -1
[    9.374048] HDA Intel 0000:00:1b.0: PCI INT A -> GSI 21 (level, low) -> IRQ 21
[    9.374889]   alloc irq_desc for 29 on node -1
[    9.374893]   alloc kstat_irqs on node -1
[    9.374909] HDA Intel 0000:00:1b.0: irq 29 for MSI/MSI-X
[    9.374953] HDA Intel 0000:00:1b.0: setting latency timer to 64
[    9.466032] input: HDA Digital PCBeep as /devices/pci0000:00/0000:00:1b.0/input/input7
[    9.726479] usb 1-1:1.0: uevent


