Codec: Realtek ALC880
Address: 0
Vendor Id: 0x10ec0880
Subsystem Id: 0x0
Revision Id: 0x70400
Default PCM: rates 0x560, bits 0x0e, types 0x1
Default Amp-In caps: N/A
Default Amp-Out caps: N/A
Node 0x02 [Audio Output] wcaps 0x411: Stereo
  PCM: rates 0x560, bits 0x0e, types 0x1
Node 0x03 [Audio Output] wcaps 0x411: Stereo
  PCM: rates 0x560, bits 0x0e, types 0x1
Node 0x04 [Audio Output] wcaps 0x411: Stereo
  PCM: rates 0x160, bits 0x0e, types 0x1
Node 0x05 [Audio Output] wcaps 0x411: Stereo
  PCM: rates 0x160, bits 0x0e, types 0x1
Node 0x06 [Audio Output] wcaps 0x211: Stereo Digital
  PCM: rates 0x160, bits 0x1e, types 0x1
Node 0x07 [Audio Input] wcaps 0x10051b: Stereo Amp-In
  Amp-In caps: ofs=0x00, nsteps=0x23, stepsize=0x03, mute=1
  Amp-In vals: 0x00 0x00
  PCM: rates 0x160, bits 0x06, types 0x1
  Connection: 7
     0x18 0x19 0x1a* 0x1b 0x1c 0x14 0x15
Node 0x08 [Audio Input] wcaps 0x10051b: Stereo Amp-In
  Amp-In caps: ofs=0x00, nsteps=0x23, stepsize=0x03, mute=1
  Amp-In vals: 0x00 0x00
  PCM: rates 0x160, bits 0x06, types 0x1
  Connection: 7
     0x18 0x19 0x1a* 0x1b 0x1c 0x14 0x15
Node 0x09 [Audio Input] wcaps 0x10051b: Stereo Amp-In
  Amp-In caps: ofs=0x00, nsteps=0x23, stepsize=0x03, mute=1
  Amp-In vals: 0x00 0x00
  PCM: rates 0x160, bits 0x06, types 0x1
  Connection: 10
     0x18 0x19 0x1a 0x1b 0x1c* 0x0b 0x14 0x15 0x16 0x17
Node 0x0a [Audio Input] wcaps 0x100391: Stereo Digital
  PCM: rates 0x160, bits 0x1e, types 0x1
  Connection: 1
     0x1f
Node 0x0b [Audio Mixer] wcaps 0x20010b: Stereo Amp-In
  Amp-In caps: ofs=0x23, nsteps=0x41, stepsize=0x03, mute=1
  Amp-In vals: 0x00 0x00
  Connection: 8
     0x18 0x19 0x1a 0x1b 0x1c 0x1d 0x14 0x15
Node 0x0c [Audio Mixer] wcaps 0x20010f: Stereo Amp-In Amp-Out
  Amp-In caps: ofs=0x00, nsteps=0x00, stepsize=0x00, mute=1
  Amp-In vals: 0x00 0x00
  Amp-Out caps: ofs=0x40, nsteps=0x40, stepsize=0x03, mute=0
  Amp-Out vals: 0x00 0x00
  Connection: 2
     0x02 0x0b
Node 0x0d [Audio Mixer] wcaps 0x20010f: Stereo Amp-In Amp-Out
  Amp-In caps: ofs=0x00, nsteps=0x00, stepsize=0x00, mute=1
  Amp-In vals: 0x00 0x00
  Amp-Out caps: ofs=0x40, nsteps=0x40, stepsize=0x03, mute=0
  Amp-Out vals: 0x00 0x00
  Connection: 2
     0x03 0x0b
Node 0x0e [Audio Mixer] wcaps 0x20010f: Stereo Amp-In Amp-Out
  Amp-In caps: ofs=0x00, nsteps=0x00, stepsize=0x00, mute=1
  Amp-In vals: 0x00 0x00
  Amp-Out caps: ofs=0x40, nsteps=0x40, stepsize=0x03, mute=0
  Amp-Out vals: 0x00 0x00
  Connection: 2
     0x04 0x0b
Node 0x0f [Audio Mixer] wcaps 0x20010f: Stereo Amp-In Amp-Out
  Amp-In caps: ofs=0x00, nsteps=0x00, stepsize=0x00, mute=1
  Amp-In vals: 0x00 0x00
  Amp-Out caps: ofs=0x40, nsteps=0x40, stepsize=0x03, mute=0
  Amp-Out vals: 0x00 0x00
  Connection: 2
     0x05 0x0b
Node 0x10 [Audio Selector] wcaps 0x300101: Stereo
  Connection: 4
     0x0c* 0x0d 0x0e 0x0f
Node 0x11 [Audio Selector] wcaps 0x300101: Stereo
  Connection: 4
     0x0c 0x0d* 0x0e 0x0f
Node 0x12 [Audio Selector] wcaps 0x300101: Stereo
  Connection: 4
     0x0c* 0x0d 0x0e 0x0f
Node 0x13 [Audio Selector] wcaps 0x300101: Stereo
  Connection: 4
     0x0c* 0x0d 0x0e 0x0f
Node 0x14 [Pin Complex] wcaps 0x40018d: Stereo Amp-Out
  Amp-Out caps: ofs=0x00, nsteps=0x00, stepsize=0x00, mute=1
  Amp-Out vals: 0x80 0x80
  Pincap 0x083f: IN OUT HP
  Pin Default 0x01014010: [Jack] Line Out at Ext Rear
    Conn = 1/8, Color = Green
  Pin-ctls: 0x40: OUT
  Connection: 1
     0x0c
Node 0x15 [Pin Complex] wcaps 0x40018d: Stereo Amp-Out
  Amp-Out caps: ofs=0x00, nsteps=0x00, stepsize=0x00, mute=1
  Amp-Out vals: 0x80 0x80
  Pincap 0x083f: IN OUT HP
  Pin Default 0x01012012: [Jack] Line Out at Ext Rear
    Conn = 1/8, Color = Grey
  Pin-ctls: 0x40: OUT
  Connection: 1
     0x0d
Node 0x16 [Pin Complex] wcaps 0x40018d: Stereo Amp-Out
  Amp-Out caps: ofs=0x00, nsteps=0x00, stepsize=0x00, mute=1
  Amp-Out vals: 0x80 0x80
  Pincap 0x083f: IN OUT HP
  Pin Default 0x01016011: [Jack] Line Out at Ext Rear
    Conn = 1/8, Color = Orange
  Pin-ctls: 0x40: OUT
  Connection: 1
     0x0e
Node 0x17 [Pin Complex] wcaps 0x40018d: Stereo Amp-Out
  Amp-Out caps: ofs=0x00, nsteps=0x00, stepsize=0x00, mute=1
  Amp-Out vals: 0x80 0x80
  Pincap 0x083f: IN OUT HP
  Pin Default 0x01011013: [Jack] Line Out at Ext Rear
    Conn = 1/8, Color = Black
  Pin-ctls: 0x40: OUT
  Connection: 1
     0x0f
Node 0x18 [Pin Complex] wcaps 0x40018d: Stereo Amp-Out
  Amp-Out caps: ofs=0x00, nsteps=0x00, stepsize=0x00, mute=1
  Amp-Out vals: 0x80 0x80
  Pincap 0x08133f: IN OUT HP
  Pin Default 0x01a19040: [Jack] Mic at Ext Rear
    Conn = 1/8, Color = Pink
  Pin-ctls: 0x24: IN
  Connection: 1
     0x10
Node 0x19 [Pin Complex] wcaps 0x40018d: Stereo Amp-Out
  Amp-Out caps: ofs=0x00, nsteps=0x00, stepsize=0x00, mute=1
  Amp-Out vals: 0x80 0x80
  Pincap 0x08133f: IN OUT HP
  Pin Default 0x42a19150: [N/A] Mic at Ext Front
    Conn = 1/8, Color = Pink
  Pin-ctls: 0x40: OUT
  Connection: 1
     0x11
Node 0x1a [Pin Complex] wcaps 0x40018d: Stereo Amp-Out
  Amp-Out caps: ofs=0x00, nsteps=0x00, stepsize=0x00, mute=1
  Amp-Out vals: 0x80 0x80
  Pincap 0x08133f: IN OUT HP
  Pin Default 0x01813041: [Jack] Line In at Ext Rear
    Conn = 1/8, Color = Blue
  Pin-ctls: 0x20: IN
  Connection: 1
     0x12
Node 0x1b [Pin Complex] wcaps 0x40018d: Stereo Amp-Out
  Amp-Out caps: ofs=0x00, nsteps=0x00, stepsize=0x00, mute=1
  Amp-Out vals: 0x80 0x80
  Pincap 0x08133f: IN OUT HP
  Pin Default 0x02214120: [Jack] HP Out at Ext Front
    Conn = 1/8, Color = Green
  Pin-ctls: 0x24: IN
  Connection: 1
     0x13
Node 0x1c [Pin Complex] wcaps 0x400001: Stereo
  Pincap 0x0820: IN
  Pin Default 0x99331000: [Fixed] CD at Int ATAPI
    Conn = ATAPI, Color = Black
  Pin-ctls: 0x00:
Node 0x1d [Pin Complex] wcaps 0x400000: Mono
  Pincap 0x0820: IN
  Pin Default 0x907f1000: [Fixed] Modem Hand at Int N/A
    Conn = Other, Color = Black
  Pin-ctls: 0x00:
Node 0x1e [Pin Complex] wcaps 0x400300: Mono Digital
  Pincap 0x0810: OUT
  Pin Default 0x01446130: [Jack] SPDIF Out at Ext Rear
    Conn = RCA, Color = Orange
  Pin-ctls: 0x00:
  Connection: 1
     0x06
Node 0x1f [Pin Complex] wcaps 0x400200: Mono Digital
  Pincap 0x0820: IN
  Pin Default 0x01c42160: [Jack] SPDIF In at Ext Rear
    Conn = RCA, Color = Grey
  Pin-ctls: 0x00:
Node 0x20 [Vendor Defined Widget] wcaps 0xf00040: Mono
Node 0x21 [Volume Knob Widget] wcaps 0x600080: Mono
