upload=true&script=true&cardinfo=
!!################################
!!ALSA Information Script v 0.4.52
!!################################

!!Script ran on: Fri Jun 18 03:01:22 CDT 2010


!!Linux Distribution
!!------------------




!!Kernel Information
!!------------------

Kernel release:    2.6.31.6-17.10.moblin2-htse
Operating System:  GNU/Linux
Architecture:      i686
Processor:         i686
SMP Enabled:       Yes


!!ALSA Version
!!------------

Driver version:     1.0.20
Library version:    1.0.20
Utilities version:  1.0.20


!!Loaded ALSA modules
!!-------------------



!!Soundcards recognised by ALSA
!!-----------------------------

 0 [MID            ]: HDA-Intel - HDA Intel MID
                      HDA Intel MID at 0xdfb5c000 irq 16


!!PCI Soundcards installed in the system
!!--------------------------------------

00:1b.0 Audio device: Intel Corporation System Controller Hub (SCH Poulsbo) HD Audio Controller (rev 07)


!!Advanced information - PCI Vendor/Device/Susbsystem ID's
!!--------------------------------------------------------

00:1b.0 0403: 8086:811b (rev 07)
	Subsystem: 8086:8119


!!Modprobe options (Sound related)
!!--------------------------------

snd_hda_intel: probe_mask=0x01


!!Loaded sound module options
!!--------------------------


!!HDA-Intel Codec information
!!---------------------------
--startcollapse--

Codec: Cirrus Logic CS4207
Address: 0
Function Id: 0x1
Vendor Id: 0x10134207
Subsystem Id: 0x10134206
Revision Id: 0x100301
No Modem Function Group found
Default PCM:
    rates [0x7f0]: 32000 44100 48000 88200 96000 176400 192000
    bits [0x1e]: 16 20 24 32
    formats [0x1]: PCM
Default Amp-In caps: N/A
Default Amp-Out caps: N/A
GPIO: io=4, o=0, i=0, unsolicited=0, wake=0
  IO[0]: enable=0, dir=0, wake=0, sticky=0, data=0, unsol=0
  IO[1]: enable=0, dir=0, wake=0, sticky=0, data=0, unsol=0
  IO[2]: enable=0, dir=0, wake=0, sticky=0, data=0, unsol=0
  IO[3]: enable=0, dir=0, wake=0, sticky=0, data=0, unsol=0
Node 0x02 [Audio Output] wcaps 0xd041d: Stereo Amp-Out
  Amp-Out caps: ofs=0x73, nsteps=0x7f, stepsize=0x01, mute=1
  Amp-Out vals:  [0x71 0x71]
  Converter: stream=3, channel=0
  PCM:
    rates [0x7f0]: 32000 44100 48000 88200 96000 176400 192000
    bits [0x1e]: 16 20 24 32
    formats [0x1]: PCM
  Power: setting=D0, actual=D0
  Delay: 13 samples
Node 0x03 [Audio Output] wcaps 0xd041d: Stereo Amp-Out
  Amp-Out caps: ofs=0x73, nsteps=0x7f, stepsize=0x01, mute=1
  Amp-Out vals:  [0x36 0x36]
  Converter: stream=3, channel=0
  PCM:
    rates [0x7f0]: 32000 44100 48000 88200 96000 176400 192000
    bits [0x1e]: 16 20 24 32
    formats [0x1]: PCM
  Power: setting=D0, actual=D0
  Delay: 13 samples
Node 0x04 [Audio Output] wcaps 0xd041d: Stereo Amp-Out
  Amp-Out caps: ofs=0x73, nsteps=0x7f, stepsize=0x01, mute=1
  Amp-Out vals:  [0x71 0x71]
  Converter: stream=3, channel=0
  PCM:
    rates [0x7f0]: 32000 44100 48000 88200 96000 176400 192000
    bits [0x1e]: 16 20 24 32
    formats [0x1]: PCM
  Power: setting=D0, actual=D0
  Delay: 13 samples
Node 0x05 [Audio Input] wcaps 0x18051b: Stereo Amp-In
  Amp-In caps: ofs=0x33, nsteps=0x3f, stepsize=0x03, mute=1
  Amp-In vals:  [0x3f 0x3f] [0x3f 0x3f]
  Converter: stream=0, channel=0
  SDI-Select: 0
  PCM:
    rates [0x1f5]: 8000 16000 32000 44100 48000 88200 96000
    bits [0x1e]: 16 20 24 32
    formats [0x1]: PCM
  Power: setting=D0, actual=D0
  Delay: 8 samples
  Connection: 2
     0x0c* 0x12
Node 0x06 [Audio Input] wcaps 0x18051b: Stereo Amp-In
  Amp-In caps: ofs=0x33, nsteps=0x3f, stepsize=0x03, mute=1
  Amp-In vals:  [0x3f 0x3f] [0x3f 0x3f]
  Converter: stream=0, channel=0
  SDI-Select: 0
  PCM:
    rates [0x1f5]: 8000 16000 32000 44100 48000 88200 96000
    bits [0x1e]: 16 20 24 32
    formats [0x1]: PCM
  Power: setting=D0, actual=D0
  Delay: 8 samples
  Connection: 2
     0x0d* 0x0e
Node 0x07 [Audio Input] wcaps 0x180791: Stereo Digital
  Converter: stream=0, channel=0
  SDI-Select: 0
  Digital:
  Digital category: 0x0
  PCM:
    rates [0x570]: 32000 44100 48000 96000 192000
    bits [0x1e]: 16 20 24 32
    formats [0x5]: PCM AC3
  Unsolicited: tag=00, enabled=0
  Power: setting=D0, actual=D0
  Delay: 8 samples
  Connection: 1
     0x0f
Node 0x08 [Audio Output] wcaps 0x40611: Stereo Digital
  Converter: stream=3, channel=0
  Digital: Enabled
  Digital category: 0x0
  PCM:
    rates [0x7f0]: 32000 44100 48000 88200 96000 176400 192000
    bits [0x1e]: 16 20 24 32
    formats [0x5]: PCM AC3
  Power: setting=D0, actual=D0
  Delay: 4 samples
Node 0x09 [Pin Complex] wcaps 0x410581: Stereo
  Pincap 0x0000001c: OUT HP Detect
  Pin Default 0x022140f0: [Jack] HP Out at Ext Front
    Conn = 1/8, Color = Green
    DefAssociation = 0xf, Sequence = 0x0
  Pin-ctls: 0xc0: OUT HP
  Unsolicited: tag=01, enabled=1
  Power: setting=D0, actual=D0
  Delay: 1 samples
  Connection: 1
     0x02
Node 0x0a [Pin Complex] wcaps 0x410581: Stereo
  Pincap 0x00000054: OUT Detect Balanced
  Pin Default 0x010140f0: [Jack] Line Out at Ext Rear
    Conn = 1/8, Color = Green
    DefAssociation = 0xf, Sequence = 0x0
  Pin-ctls: 0x40: OUT
  Unsolicited: tag=00, enabled=0
  Power: setting=D0, actual=D0
  Delay: 1 samples
  Connection: 1
     0x03
Node 0x0b [Pin Complex] wcaps 0x410101: Stereo
  Pincap 0x00000050: OUT Balanced
  Pin Default 0x901700f0: [Fixed] Speaker at Int N/A
    Conn = Analog, Color = Unknown
    DefAssociation = 0xf, Sequence = 0x0
  Pin-ctls: 0x00:
  Delay: 1 samples
  Connection: 1
     0x04
Node 0x0c [Pin Complex] wcaps 0x41048b: Stereo Amp-In
  Amp-In caps: ofs=0x00, nsteps=0x03, stepsize=0x27, mute=0
  Amp-In vals:  [0x03 0x03]
  Pincap 0x00000024: IN Detect
  Pin Default 0x01813051: [Jack] Line In at Ext Rear
    Conn = 1/8, Color = Blue
    DefAssociation = 0x5, Sequence = 0x1
  Pin-ctls: 0x20: IN
  Unsolicited: tag=00, enabled=0
  Power: setting=D0, actual=D0
  Delay: 1 samples
Node 0x0d [Pin Complex] wcaps 0x41048b: Stereo Amp-In
  Amp-In caps: ofs=0x00, nsteps=0x03, stepsize=0x27, mute=0
  Amp-In vals:  [0x00 0x00]
  Pincap 0x00001764: IN Detect Balanced
    Vref caps: HIZ 50 GRD 80
  Pin Default 0x01a19031: [Jack] Mic at Ext Rear
    Conn = 1/8, Color = Pink
    DefAssociation = 0x3, Sequence = 0x1
  Pin-ctls: 0x24: IN VREF_80
  Unsolicited: tag=00, enabled=0
  Power: setting=D0, actual=D0
  Delay: 1 samples
Node 0x0e [Pin Complex] wcaps 0x41000b: Stereo Amp-In
  Amp-In caps: ofs=0x00, nsteps=0x02, stepsize=0x27, mute=0
  Amp-In vals:  [0x00 0x00]
  Pincap 0x00000020: IN
  Pin Default 0xb7d6003e: [Fixed] Digitial In at Oth Mobile-In
    Conn = Digital, Color = Unknown
    DefAssociation = 0x3, Sequence = 0xe
  Pin-ctls: 0x00:
  Delay: 1 samples
Node 0x0f [Pin Complex] wcaps 0x410681: Stereo Digital
  Pincap 0x00000024: IN Detect
  Pin Default 0x02c4e0f0: [Jack] SPDIF In at Ext Front
    Conn = RCA, Color = White
    DefAssociation = 0xf, Sequence = 0x0
  Pin-ctls: 0x00:
  Unsolicited: tag=00, enabled=0
  Power: setting=D0, actual=D0
  Delay: 1 samples
Node 0x10 [Pin Complex] wcaps 0x410301: Stereo Digital
  Pincap 0x00000010: OUT
  Pin Default 0x014460f0: [Jack] SPDIF Out at Ext Rear
    Conn = RCA, Color = Orange
    DefAssociation = 0xf, Sequence = 0x0
  Pin-ctls: 0x00:
  Delay: 1 samples
  Connection: 1
     0x08
Node 0x11 [Vendor Defined Widget] wcaps 0xf00040: Mono
  Processing caps: benign=0, ncoeff=22
Node 0x12 [Pin Complex] wcaps 0x41000b: Stereo Amp-In
  Amp-In caps: ofs=0x00, nsteps=0x02, stepsize=0x27, mute=0
  Amp-In vals:  [0x02 0x02]
  Pincap 0x00000020: IN
  Pinx Default 0xb7d6005e: [Fixed] Digitial In at Oth Mobile-In
  Pin Default 0x01a19032: [Fixed] Digitial In at Oth Mobile-In
    Conn = Digital, Color = Unknown
    DefAssociation = 0x5, Sequence = 0xe
  Pin-ctls: 0x20: IN
  Delay: 1 samples
Node 0x13 [Beep Generator Widget] wcaps 0x700000: Mono
Node 0x14 [Audio Output] wcaps 0x40611: Stereo Digital
  Converter: stream=3, channel=0
  Digital: Enabled
  Digital category: 0x0
  PCM:
    rates [0x7f0]: 32000 44100 48000 88200 96000 176400 192000
    bits [0x1e]: 16 20 24 32
    formats [0x5]: PCM AC3
  Power: setting=D0, actual=D0
  Delay: 4 samples
Node 0x15 [Pin Complex] wcaps 0x410301: Stereo Digital
  Pincap 0x00000010: OUT
  Pin Default 0x014510f0: [Jack] SPDIF Out at Ext Rear
    Conn = Optical, Color = Black
    DefAssociation = 0xf, Sequence = 0x0
  Pin-ctls: 0x00:
  Delay: 1 samples
  Connection: 1
     0x14
--endcollapse--


!!ALSA Device nodes
!!-----------------

crw-rw---- 1 root audio 116,  0 2010-06-17 10:26 /dev/snd/controlC0
crw-rw---- 1 root audio 116,  4 2010-06-17 10:26 /dev/snd/hwC0D0
crw-rw---- 1 root audio 116, 24 2010-06-17 13:02 /dev/snd/pcmC0D0c
crw-rw---- 1 root audio 116, 16 2010-06-17 13:03 /dev/snd/pcmC0D0p
crw-rw---- 1 root audio 116, 25 2010-06-17 13:03 /dev/snd/pcmC0D1c
crw-rw---- 1 root audio 116, 17 2010-06-17 11:35 /dev/snd/pcmC0D1p
crw-rw---- 1 root audio 116,  1 2010-06-17 10:26 /dev/snd/seq
crw-rw---- 1 root audio 116, 33 2010-06-17 10:26 /dev/snd/timer

/dev/snd/by-path:
total 0
drwxr-xr-x 2 root root  60 2010-06-17 10:26 .
drwxr-xr-x 3 root root 220 2010-06-17 10:26 ..
lrwxrwxrwx 1 root root  12 2010-06-17 10:26 pci-0000:00:1b.0 -> ../controlC0


!!ALSA configuration files
!!------------------------

!!System wide config file (/etc/asound.conf)

#
# Place your global alsa-lib configuration here...
#

pcm.card0 {
	type hw
	card 0
}

ctl.card0 {
	type hw
	card 0
}

@hooks [
	{
		func load
		files [
			"/etc/alsa/pulse-default.conf"
		]
		errors false
	}
]


!!Aplay/Arecord output
!!------------

APLAY

**** List of PLAYBACK Hardware Devices ****
card 0: MID [HDA Intel MID], device 0: Cirrus Analog [Cirrus Analog]
  Subdevices: 0/1
  Subdevice #0: subdevice #0
card 0: MID [HDA Intel MID], device 1: Cirrus Digital [Cirrus Digital]
  Subdevices: 1/1
  Subdevice #0: subdevice #0

ARECORD

**** List of CAPTURE Hardware Devices ****
card 0: MID [HDA Intel MID], device 0: Cirrus Analog [Cirrus Analog]
  Subdevices: 1/1
  Subdevice #0: subdevice #0
card 0: MID [HDA Intel MID], device 1: Cirrus Digital [Cirrus Digital]
  Subdevices: 1/1
  Subdevice #0: subdevice #0

!!Amixer output
!!-------------

!!-------Mixer controls for card 0 [MID]

Card hw:0 'MID'/'HDA Intel MID at 0xdfb5c000 irq 16'
  Mixer name	: 'Cirrus Logic CS4207'
  Components	: 'HDA:10134207,10134206,00100301'
  Controls      : 20
  Simple ctrls  : 11
Simple mixer control 'Master',0
  Capabilities: pvolume pvolume-joined pswitch pswitch-joined
  Playback channels: Mono
  Limits: Playback 0 - 115
  Mono: Playback 113 [98%] [-1.00dB] [on]
Simple mixer control 'Headphone',0
  Capabilities: pvolume pswitch
  Playback channels: Front Left - Front Right
  Limits: Playback 0 - 115
  Mono:
  Front Left: Playback 115 [100%] [0.00dB] [on]
  Front Right: Playback 115 [100%] [0.00dB] [on]
Simple mixer control 'PCM',0
  Capabilities: pvolume
  Playback channels: Front Left - Front Right
  Limits: Playback 0 - 255
  Mono:
  Front Left: Playback 255 [100%] [0.00dB]
  Front Right: Playback 255 [100%] [0.00dB]
Simple mixer control 'Line',0
  Capabilities: cswitch cswitch-joined cswitch-exclusive
  Capture exclusive group: 0
  Capture channels: Mono
  Mono: Capture [off]
Simple mixer control 'Line-Out',0
  Capabilities: pvolume pswitch
  Playback channels: Front Left - Front Right
  Limits: Playback 0 - 115
  Mono:
  Front Left: Playback 56 [49%] [-29.50dB] [on]
  Front Right: Playback 56 [49%] [-29.50dB] [on]
Simple mixer control 'Mic',0
  Capabilities: cswitch cswitch-joined cswitch-exclusive
  Capture exclusive group: 0
  Capture channels: Mono
  Mono: Capture [on]
Simple mixer control 'IEC958',0
  Capabilities: pswitch pswitch-joined cswitch cswitch-joined
  Playback channels: Mono
  Capture channels: Mono
  Mono: Playback [on] Capture [on]
Simple mixer control 'IEC958 Default PCM',0
  Capabilities: pswitch pswitch-joined
  Playback channels: Mono
  Mono: Playback [on]
Simple mixer control 'Capture',0
  Capabilities: cvolume cswitch
  Capture channels: Front Left - Front Right
  Limits: Capture 0 - 63
  Front Left: Capture 63 [100%] [12.00dB] [on]
  Front Right: Capture 63 [100%] [12.00dB] [on]
Simple mixer control 'Digital',0
  Capabilities: cvolume
  Capture channels: Front Left - Front Right
  Limits: Capture 0 - 120
  Front Left: Capture 120 [100%] [30.00dB]
  Front Right: Capture 120 [100%] [30.00dB]
Simple mixer control 'Speaker',0
  Capabilities: pvolume pswitch
  Playback channels: Front Left - Front Right
  Limits: Playback 0 - 115
  Mono:
  Front Left: Playback 115 [100%] [0.00dB] [on]
  Front Right: Playback 115 [100%] [0.00dB] [on]


!!Alsactl output
!!-------------

--startcollapse--
state.MID {
	control.1 {
		comment.access 'read write'
		comment.type BOOLEAN
		comment.count 1
		iface MIXER
		name 'Master Playback Switch'
		value true
	}
	control.2 {
		comment.access 'read write'
		comment.type INTEGER
		comment.count 1
		comment.range '0 - 115'
		comment.dbmin -5750
		comment.dbmax 0
		iface MIXER
		name 'Master Playback Volume'
		value 113
	}
	control.3 {
		comment.access 'read write'
		comment.type BOOLEAN
		comment.count 2
		iface MIXER
		name 'Line-Out Playback Switch'
		value.0 true
		value.1 true
	}
	control.4 {
		comment.access 'read write'
		comment.type INTEGER
		comment.count 2
		comment.range '0 - 115'
		comment.dbmin -5750
		comment.dbmax 0
		iface MIXER
		name 'Line-Out Playback Volume'
		value.0 56
		value.1 56
	}
	control.5 {
		comment.access 'read write'
		comment.type BOOLEAN
		comment.count 2
		iface MIXER
		name 'Headphone Playback Switch'
		value.0 true
		value.1 true
	}
	control.6 {
		comment.access 'read write'
		comment.type INTEGER
		comment.count 2
		comment.range '0 - 115'
		comment.dbmin -5750
		comment.dbmax 0
		iface MIXER
		name 'Headphone Playback Volume'
		value.0 115
		value.1 115
	}
	control.7 {
		comment.access 'read write'
		comment.type BOOLEAN
		comment.count 2
		iface MIXER
		name 'Speaker Playback Switch'
		value.0 true
		value.1 true
	}
	control.8 {
		comment.access 'read write'
		comment.type INTEGER
		comment.count 2
		comment.range '0 - 115'
		comment.dbmin -5750
		comment.dbmax 0
		iface MIXER
		name 'Speaker Playback Volume'
		value.0 115
		value.1 115
	}
	control.9 {
		comment.access 'read write'
		comment.type BOOLEAN
		comment.count 2
		iface MIXER
		name 'Capture Switch'
		value.0 true
		value.1 true
	}
	control.10 {
		comment.access 'read write'
		comment.type INTEGER
		comment.count 2
		comment.range '0 - 63'
		comment.dbmin -5100
		comment.dbmax 1200
		iface MIXER
		name 'Capture Volume'
		value.0 63
		value.1 63
	}
	control.11 {
		comment.access 'read write'
		comment.type ENUMERATED
		comment.count 1
		comment.item.0 Mic
		comment.item.1 Line
		iface MIXER
		name 'Capture Source'
		value Mic
	}
	control.12 {
		comment.access read
		comment.type IEC958
		comment.count 1
		iface MIXER
		name 'IEC958 Playback Con Mask'
		value '0fff000000000000000000000000000000000000000000000000000000000000000000000000000000000000000000000000000000000000000000000000000000000000000000000000000000000000000000000000000000000000000000000000000000000000000000000000000000000000000000000000000000000000000000000000000000000000000000000000000000000000000000000000000000000000000000000000000000000000'
	}
	control.13 {
		comment.access read
		comment.type IEC958
		comment.count 1
		iface MIXER
		name 'IEC958 Playback Pro Mask'
		value '0f00000000000000000000000000000000000000000000000000000000000000000000000000000000000000000000000000000000000000000000000000000000000000000000000000000000000000000000000000000000000000000000000000000000000000000000000000000000000000000000000000000000000000000000000000000000000000000000000000000000000000000000000000000000000000000000000000000000000000'
	}
	control.14 {
		comment.access 'read write'
		comment.type IEC958
		comment.count 1
		iface MIXER
		name 'IEC958 Playback Default'
		value '0400000000000000000000000000000000000000000000000000000000000000000000000000000000000000000000000000000000000000000000000000000000000000000000000000000000000000000000000000000000000000000000000000000000000000000000000000000000000000000000000000000000000000000000000000000000000000000000000000000000000000000000000000000000000000000000000000000000000000'
	}
	control.15 {
		comment.access 'read write'
		comment.type BOOLEAN
		comment.count 1
		iface MIXER
		name 'IEC958 Playback Switch'
		value true
	}
	control.16 {
		comment.access 'read write'
		comment.type BOOLEAN
		comment.count 1
		iface MIXER
		name 'IEC958 Default PCM Playback Switch'
		value true
	}
	control.17 {
		comment.access 'read write'
		comment.type BOOLEAN
		comment.count 1
		iface MIXER
		name 'IEC958 Capture Switch'
		value true
	}
	control.18 {
		comment.access read
		comment.type IEC958
		comment.count 1
		iface MIXER
		name 'IEC958 Capture Default'
		value '0400000000000000000000000000000000000000000000000000000000000000000000000000000000000000000000000000000000000000000000000000000000000000000000000000000000000000000000000000000000000000000000000000000000000000000000000000000000000000000000000000000000000000000000000000000000000000000000000000000000000000000000000000000000000000000000000000000000000000'
	}
	control.19 {
		comment.access 'read write user'
		comment.type INTEGER
		comment.count 2
		comment.range '0 - 255'
		comment.tlv '0000000100000008ffffec1400000014'
		comment.dbmin -5100
		comment.dbmax 0
		iface MIXER
		name 'PCM Playback Volume'
		value.0 255
		value.1 255
	}
	control.20 {
		comment.access 'read write user'
		comment.type INTEGER
		comment.count 2
		comment.range '0 - 120'
		comment.tlv '0000000100000008fffff44800000032'
		comment.dbmin -3000
		comment.dbmax 3000
		iface MIXER
		name 'Digital Capture Volume'
		value.0 120
		value.1 120
	}
}
--endcollapse--


!!All Loaded Modules
!!------------------

Module
nfsd
exportfs
htse_gs2970
htse_spi
htse_nameplate
htse_isl29020
htse_fpga
htse_ck540
htse_bl
htse_adxl345
htse_adt7462
htse_core
snd_hda_codec_cirrus
snd_hda_intel
snd_hda_codec
iegd_mod
snd_hwdep


