
!!################################
!!ALSA Information Script v 0.4.56
!!################################

!!Script ran on: Sat Jun 27 00:31:42 UTC 2009


!!Linux Distribution
!!------------------

Gentoo Base System release 2.0.1


!!DMI Information
!!---------------

Manufacturer:      
Product Name:      


!!Kernel Information
!!------------------

Kernel release:    2.6.30
Operating System:  GNU/Linux
Architecture:      x86_64
Processor:         Intel(R) Core(TM)2 Duo CPU P7550 @ 2.26GHz
SMP Enabled:       Yes


!!ALSA Version
!!------------

Driver version:     1.0.20
Library version:    1.0.20
Utilities version:  1.0.20


!!Loaded ALSA modules
!!-------------------

snd_hda_intel


!!Sound Servers on this system
!!----------------------------

No sound servers found.


!!Soundcards recognised by ALSA
!!-----------------------------

 0 [NVidia         ]: HDA-Intel - HDA NVidia
                      HDA NVidia at 0xd3480000 irq 23


!!PCI Soundcards installed in the system
!!--------------------------------------

00:08.0 Audio device: nVidia Corporation MCP79 High Definition Audio (rev b1)


!!Advanced information - PCI Vendor/Device/Susbsystem ID's
!!--------------------------------------------------------

00:08.0 0403: 10de:0ac0 (rev b1)
	Subsystem: 10de:cb79


!!Loaded sound module options
!!--------------------------

!!Module: snd_hda_intel
bdl_pos_adj : 32,-1,-1,-1,-1,-1,-1,-1
enable : Y,Y,Y,Y,Y,Y,Y,Y
enable_msi : 0
id : <NULL>,<NULL>,<NULL>,<NULL>,<NULL>,<NULL>,<NULL>,<NULL>
index : -1,-1,-1,-1,-1,-1,-1,-1
model : <NULL>,<NULL>,<NULL>,<NULL>,<NULL>,<NULL>,<NULL>,<NULL>
patch : <NULL>,<NULL>,<NULL>,<NULL>,<NULL>,<NULL>,<NULL>,<NULL>
position_fix : 0,0,0,0,0,0,0,0
power_save : 0
power_save_controller : Y
probe_mask : -1,-1,-1,-1,-1,-1,-1,-1
probe_only : N,N,N,N,N,N,N,N
single_cmd : N


!!HDA-Intel Codec information
!!---------------------------
--startcollapse--

Codec: Generic 1013 ID 4206
Address: 0
Function Id: 0x1
Vendor Id: 0x10134206
Subsystem Id: 0x106b4d00
Revision Id: 0x100301
No Modem Function Group found
Default PCM:
    rates [0x7f0]: 32000 44100 48000 88200 96000 176400 192000
    bits [0x1e]: 16 20 24 32
    formats [0x3]: PCM FLOAT
Default Amp-In caps: N/A
Default Amp-Out caps: N/A
GPIO: io=4, o=0, i=0, unsolicited=0, wake=0
  IO[0]: enable=0, dir=0, wake=0, sticky=0, data=0, unsol=0
  IO[1]: enable=0, dir=0, wake=0, sticky=0, data=0, unsol=0
  IO[2]: enable=0, dir=0, wake=0, sticky=0, data=0, unsol=0
  IO[3]: enable=1, dir=1, wake=0, sticky=0, data=0, unsol=0
Node 0x02 [Audio Output] wcaps 0xd041d: Stereo Amp-Out
  Amp-Out caps: ofs=0x73, nsteps=0x7f, stepsize=0x01, mute=1
  Amp-Out vals:  [0xf3 0xf3]
  Converter: stream=0, channel=0
  PCM:
    rates [0x7f0]: 32000 44100 48000 88200 96000 176400 192000
    bits [0x1e]: 16 20 24 32
    formats [0x3]: PCM FLOAT
  Power: setting=D0, actual=D0
  Delay: 13 samples
Node 0x03 [Audio Output] wcaps 0xd041d: Stereo Amp-Out
  Amp-Out caps: ofs=0x73, nsteps=0x7f, stepsize=0x01, mute=1
  Amp-Out vals:  [0x7f 0x7f]
  Converter: stream=0, channel=0
  PCM:
    rates [0x7f0]: 32000 44100 48000 88200 96000 176400 192000
    bits [0x1e]: 16 20 24 32
    formats [0x3]: PCM FLOAT
  Power: setting=D0, actual=D0
  Delay: 13 samples
Node 0x04 [Audio Output] wcaps 0xd041d: Stereo Amp-Out
  Amp-Out caps: ofs=0x73, nsteps=0x7f, stepsize=0x01, mute=1
  Amp-Out vals:  [0xf3 0xf3]
  Converter: stream=0, channel=0
  PCM:
    rates [0x7f0]: 32000 44100 48000 88200 96000 176400 192000
    bits [0x1e]: 16 20 24 32
    formats [0x3]: PCM FLOAT
  Power: setting=D0, actual=D0
  Delay: 13 samples
Node 0x05 [Audio Input] wcaps 0x18051b: Stereo Amp-In
  Amp-In caps: ofs=0x33, nsteps=0x3f, stepsize=0x03, mute=1
  Amp-In vals:  [0x0c 0x0c] [0x0c 0x0c]
  Converter: stream=0, channel=0
  SDI-Select: 0
  PCM:
    rates [0x1f5]: 8000 16000 32000 44100 48000 88200 96000
    bits [0x1e]: 16 20 24 32
    formats [0x3]: PCM FLOAT
  Power: setting=D0, actual=D0
  Delay: 8 samples
  Connection: 2
     0x0c* 0x12
Node 0x06 [Audio Input] wcaps 0x18051b: Stereo Amp-In
  Amp-In caps: ofs=0x33, nsteps=0x3f, stepsize=0x03, mute=1
  Amp-In vals:  [0x3f 0x3f] [0x3f 0x3f]
  Converter: stream=0, channel=0
  SDI-Select: 0
  PCM:
    rates [0x1f5]: 8000 16000 32000 44100 48000 88200 96000
    bits [0x1e]: 16 20 24 32
    formats [0x3]: PCM FLOAT
  Power: setting=D0, actual=D0
  Delay: 8 samples
  Connection: 2
     0x0d* 0x0e
Node 0x07 [Audio Input] wcaps 0x180791: Stereo Digital
  Converter: stream=0, channel=0
  SDI-Select: 0
  Digital: Preemphasis Copyright
  Digital category: 0x0
  PCM:
    rates [0x570]: 32000 44100 48000 96000 192000
    bits [0x1e]: 16 20 24 32
    formats [0x7]: PCM FLOAT AC3
  Unsolicited: tag=00, enabled=0
  Power: setting=D0, actual=D0
  Delay: 8 samples
  Connection: 1
     0x0f
Node 0x08 [Audio Output] wcaps 0x40611: Stereo Digital
  Converter: stream=0, channel=0
  Digital:
  Digital category: 0x0
  PCM:
    rates [0x7f0]: 32000 44100 48000 88200 96000 176400 192000
    bits [0x1e]: 16 20 24 32
    formats [0x7]: PCM FLOAT AC3
  Power: setting=D0, actual=D0
  Delay: 4 samples
Node 0x09 [Pin Complex] wcaps 0x410581: Stereo
  Pincap 0x0000001c: OUT HP Detect
  Pin Default 0x012b4030: [Jack] HP Out at Ext Rear
    Conn = Comb, Color = Green
    DefAssociation = 0x3, Sequence = 0x0
  Pin-ctls: 0x00:
  Unsolicited: tag=00, enabled=0
  Power: setting=D0, actual=D0
  Delay: 1 samples
  Connection: 1
     0x02
Node 0x0a [Pin Complex] wcaps 0x410581: Stereo
  Pincap 0x00000054: OUT Detect Balanced
  Pin Default 0x90100121: [Fixed] Speaker at Int N/A
    Conn = Unknown, Color = Unknown
    DefAssociation = 0x2, Sequence = 0x1
    Misc = NO_PRESENCE
  Pin-ctls: 0x40: OUT
  Unsolicited: tag=00, enabled=0
  Power: setting=D0, actual=D0
  Delay: 1 samples
  Connection: 1
     0x03
Node 0x0b [Pin Complex] wcaps 0x410101: Stereo
  Pincap 0x00000050: OUT Balanced
  Pin Default 0x90100120: [Fixed] Speaker at Int N/A
    Conn = Unknown, Color = Unknown
    DefAssociation = 0x2, Sequence = 0x0
    Misc = NO_PRESENCE
  Pin-ctls: 0x00:
  Delay: 1 samples
  Connection: 1
     0x04
Node 0x0c [Pin Complex] wcaps 0x41048b: Stereo Amp-In
  Amp-In caps: ofs=0x00, nsteps=0x03, stepsize=0x27, mute=0
  Amp-In vals:  [0x00 0x00]
  Pincap 0x00000024: IN Detect
  Pin Default 0x400000f0: [N/A] Line Out at Ext N/A
    Conn = Unknown, Color = Unknown
    DefAssociation = 0xf, Sequence = 0x0
  Pin-ctls: 0x00:
  Unsolicited: tag=00, enabled=0
  Power: setting=D0, actual=D0
  Delay: 1 samples
Node 0x0d [Pin Complex] wcaps 0x41048b: Stereo Amp-In
  Amp-In caps: ofs=0x00, nsteps=0x03, stepsize=0x27, mute=0
  Amp-In vals:  [0x03 0x03]
  Pincap 0x00001764: IN Detect Balanced
    Vref caps: HIZ 50 GRD 80
  Pin Default 0x90a00110: [Fixed] Mic at Int N/A
    Conn = Unknown, Color = Unknown
    DefAssociation = 0x1, Sequence = 0x0
    Misc = NO_PRESENCE
  Pin-ctls: 0x24: IN VREF_80
  Unsolicited: tag=00, enabled=0
  Power: setting=D0, actual=D0
  Delay: 1 samples
Node 0x0e [Pin Complex] wcaps 0x41000b: Stereo Amp-In
  Amp-In caps: ofs=0x00, nsteps=0x02, stepsize=0x27, mute=0
  Amp-In vals:  [0x00 0x00]
  Pincap 0x00000020: IN
  Pin Default 0x400000f0: [N/A] Line Out at Ext N/A
    Conn = Unknown, Color = Unknown
    DefAssociation = 0xf, Sequence = 0x0
  Pin-ctls: 0x00:
  Delay: 1 samples
Node 0x0f [Pin Complex] wcaps 0x410681: Stereo Digital
  Pincap 0x00000024: IN Detect
  Pin Default 0x400000f0: [N/A] Line Out at Ext N/A
    Conn = Unknown, Color = Unknown
    DefAssociation = 0xf, Sequence = 0x0
  Pin-ctls: 0x00:
  Unsolicited: tag=00, enabled=0
  Power: setting=D0, actual=D0
  Delay: 1 samples
Node 0x10 [Pin Complex] wcaps 0x410301: Stereo Digital
  Pincap 0x00000010: OUT
  Pin Default 0x014be040: [Jack] SPDIF Out at Ext Rear
    Conn = Comb, Color = White
    DefAssociation = 0x4, Sequence = 0x0
  Pin-ctls: 0x00:
  Delay: 1 samples
  Connection: 1
     0x08
Node 0x11 [Vendor Defined Widget] wcaps 0xf00040: Mono
  Processing caps: benign=0, ncoeff=22
Node 0x12 [Pin Complex] wcaps 0x41000b: Stereo Amp-In
  Amp-In caps: ofs=0x00, nsteps=0x02, stepsize=0x27, mute=0
  Amp-In vals:  [0x00 0x00]
  Pincap 0x00000020: IN
  Pin Default 0x400000f0: [N/A] Line Out at Ext N/A
    Conn = Unknown, Color = Unknown
    DefAssociation = 0xf, Sequence = 0x0
  Pin-ctls: 0x00:
  Delay: 1 samples
Node 0x13 [Beep Generator Widget] wcaps 0x700000: Mono
Node 0x14 [Audio Output] wcaps 0x40611: Stereo Digital
  Converter: stream=0, channel=0
  Digital:
  Digital category: 0x0
  PCM:
    rates [0x7f0]: 32000 44100 48000 88200 96000 176400 192000
    bits [0x1e]: 16 20 24 32
    formats [0x7]: PCM FLOAT AC3
  Power: setting=D0, actual=D0
  Delay: 4 samples
Node 0x15 [Pin Complex] wcaps 0x410301: Stereo Digital
  Pincap 0x00000010: OUT
  Pin Default 0x400000f0: [N/A] Line Out at Ext N/A
    Conn = Unknown, Color = Unknown
    DefAssociation = 0xf, Sequence = 0x0
  Pin-ctls: 0x00:
  Delay: 1 samples
  Connection: 1
     0x14
--endcollapse--


!!ALSA Device nodes
!!-----------------

crw-rw---- 1 root audio 116,  0 Jun 27 02:05 /dev/snd/controlC0
crw-rw---- 1 root audio 116,  4 Jun 27 02:05 /dev/snd/hwC0D0
crw-rw---- 1 root audio 116, 24 Jun 27 02:05 /dev/snd/pcmC0D0c
crw-rw---- 1 root audio 116, 16 Jun 27 02:12 /dev/snd/pcmC0D0p
crw-rw---- 1 root audio 116, 33 Jun 27 02:05 /dev/snd/timer


!!ALSA configuration files
!!------------------------

!!User specific config file (~/.asoundrc)



!!Aplay/Arecord output
!!------------

APLAY

**** List of PLAYBACK Hardware Devices ****
card 0: NVidia [HDA NVidia], device 0: HDA Generic [HDA Generic]
  Subdevices: 1/1
  Subdevice #0: subdevice #0

ARECORD

**** List of CAPTURE Hardware Devices ****
card 0: NVidia [HDA NVidia], device 0: HDA Generic [HDA Generic]
  Subdevices: 1/1
  Subdevice #0: subdevice #0

!!Amixer output
!!-------------

!!-------Mixer controls for card 0 [NVidia]

Card hw:0 'NVidia'/'HDA NVidia at 0xd3480000 irq 23'
  Mixer name	: 'Generic 1013 ID 4206'
  Components	: 'HDA:10134206,106b4d00,00100301'
  Controls      : 5
  Simple ctrls  : 3
Simple mixer control 'Master',0
  Capabilities: pvolume pswitch
  Playback channels: Front Left - Front Right
  Limits: Playback 0 - 127
  Mono:
  Front Left: Playback 127 [100%] [6.00dB] [on]
  Front Right: Playback 127 [100%] [6.00dB] [on]
Simple mixer control 'PCM',0
  Capabilities: pvolume
  Playback channels: Front Left - Front Right
  Limits: Playback 0 - 255
  Mono:
  Front Left: Playback 255 [100%] [0.00dB]
  Front Right: Playback 255 [100%] [0.00dB]
Simple mixer control 'Capture',0
  Capabilities: cvolume cswitch
  Capture channels: Front Left - Front Right
  Limits: Capture 0 - 63
  Front Left: Capture 63 [100%] [12.00dB] [on]
  Front Right: Capture 63 [100%] [12.00dB] [on]


!!Alsactl output
!!-------------

--startcollapse--
state.NVidia {
	control.1 {
		comment.access 'read write'
		comment.type BOOLEAN
		comment.count 2
		iface MIXER
		name 'Capture Switch'
		value.0 true
		value.1 true
	}
	control.2 {
		comment.access 'read write'
		comment.type INTEGER
		comment.count 2
		comment.range '0 - 63'
		comment.dbmin -5100
		comment.dbmax 1200
		iface MIXER
		name 'Capture Volume'
		value.0 63
		value.1 63
	}
	control.3 {
		comment.access 'read write'
		comment.type BOOLEAN
		comment.count 2
		iface MIXER
		name 'Master Playback Switch'
		value.0 true
		value.1 true
	}
	control.4 {
		comment.access 'read write'
		comment.type INTEGER
		comment.count 2
		comment.range '0 - 127'
		comment.dbmin -5750
		comment.dbmax 600
		iface MIXER
		name 'Master Playback Volume'
		value.0 127
		value.1 127
	}
	control.5 {
		comment.access 'read write user'
		comment.type INTEGER
		comment.count 2
		comment.range '0 - 255'
		comment.tlv '0000000100000008ffffec1400000014'
		comment.dbmin -5100
		comment.dbmax 0
		iface MIXER
		name 'PCM Playback Volume'
		value.0 255
		value.1 255
	}
}
--endcollapse--


!!All Loaded Modules
!!------------------

Module
nvidia
snd_hda_intel
snd_hda_codec
wl
snd_hwdep
snd_pcm
snd_timer
snd
btusb
snd_page_alloc
lib80211


