upload=true&script=true&cardinfo=
!!################################
!!ALSA Information Script v 0.4.60
!!################################

!!Script ran on: Mon May 23 16:58:33 UTC 2011


!!Linux Distribution
!!------------------

Linux Mint Xfce Edition \n \l DISTRIB_ID=LinuxMint DISTRIB_CODENAME=debian DISTRIB_DESCRIPTION="Linux Mint Xfce Edition"


!!DMI Information
!!---------------

Manufacturer:      LENOVO
Product Name:      0873                            
Product Version:   Lenovo G555                     


!!Kernel Information
!!------------------

Kernel release:    2.6.38-2-amd64
Operating System:  GNU/Linux
Architecture:      x86_64
Processor:         unknown
SMP Enabled:       Yes


!!ALSA Version
!!------------

Driver version:     1.0.24
Library version:    1.0.24.1
Utilities version:  1.0.24.2


!!Loaded ALSA modules
!!-------------------

snd_hda_intel


!!Sound Servers on this system
!!----------------------------

Pulseaudio:
      Installed - Yes (/usr/bin/pulseaudio)
      Running - Yes

ESound Daemon:
      Installed - Yes (/usr/bin/esd)
      Running - No


!!Soundcards recognised by ALSA
!!-----------------------------

 0 [SB             ]: HDA-Intel - HDA ATI SB
                      HDA ATI SB at 0x92400000 irq 16


!!PCI Soundcards installed in the system
!!--------------------------------------

00:14.2 Audio device: ATI Technologies Inc SBx00 Azalia (Intel HDA)


!!Advanced information - PCI Vendor/Device/Subsystem ID's
!!--------------------------------------------------------

00:14.2 0403: 1002:4383
	Subsystem: 17aa:3938


!!Modprobe options (Sound related)
!!--------------------------------

snd-hda-intel: model=auto


!!Loaded sound module options
!!--------------------------

!!Module: snd_hda_intel
	bdl_pos_adj : 32,-1,-1,-1,-1,-1,-1,-1,-1,-1,-1,-1,-1,-1,-1,-1,-1,-1,-1,-1,-1,-1,-1,-1,-1,-1,-1,-1,-1,-1,-1,-1
	beep_mode : 1,1,1,1,1,1,1,1,1,1,1,1,1,1,1,1,1,1,1,1,1,1,1,1,1,1,1,1,1,1,1,1
	enable : Y,Y,Y,Y,Y,Y,Y,Y,Y,Y,Y,Y,Y,Y,Y,Y,Y,Y,Y,Y,Y,Y,Y,Y,Y,Y,Y,Y,Y,Y,Y,Y
	enable_msi : -1
	id : (null),(null),(null),(null),(null),(null),(null),(null),(null),(null),(null),(null),(null),(null),(null),(null),(null),(null),(null),(null),(null),(null),(null),(null),(null),(null),(null),(null),(null),(null),(null),(null)
	index : -1,-1,-1,-1,-1,-1,-1,-1,-1,-1,-1,-1,-1,-1,-1,-1,-1,-1,-1,-1,-1,-1,-1,-1,-1,-1,-1,-1,-1,-1,-1,-1
	model : auto,(null),(null),(null),(null),(null),(null),(null),(null),(null),(null),(null),(null),(null),(null),(null),(null),(null),(null),(null),(null),(null),(null),(null),(null),(null),(null),(null),(null),(null),(null),(null)
	patch : (null),(null),(null),(null),(null),(null),(null),(null),(null),(null),(null),(null),(null),(null),(null),(null),(null),(null),(null),(null),(null),(null),(null),(null),(null),(null),(null),(null),(null),(null),(null),(null)
	position_fix : 0,0,0,0,0,0,0,0,0,0,0,0,0,0,0,0,0,0,0,0,0,0,0,0,0,0,0,0,0,0,0,0
	power_save : 10
	power_save_controller : N
	probe_mask : -1,-1,-1,-1,-1,-1,-1,-1,-1,-1,-1,-1,-1,-1,-1,-1,-1,-1,-1,-1,-1,-1,-1,-1,-1,-1,-1,-1,-1,-1,-1,-1
	probe_only : 0,0,0,0,0,0,0,0,0,0,0,0,0,0,0,0,0,0,0,0,0,0,0,0,0,0,0,0,0,0,0,0
	single_cmd : N


!!HDA-Intel Codec information
!!---------------------------
--startcollapse--

Codec: Conexant CX20585
Address: 0
AFG Function Id: 0x1 (unsol 1)
Vendor Id: 0x14f15069
Subsystem Id: 0x17aac007
Revision Id: 0x100302
No Modem Function Group found
Default PCM:
    rates [0x160]: 44100 48000 96000
    bits [0xe]: 16 20 24
    formats [0x1]: PCM
Default Amp-In caps: N/A
Default Amp-Out caps: N/A
GPIO: io=4, o=0, i=0, unsolicited=1, wake=0
  IO[0]: enable=0, dir=0, wake=0, sticky=0, data=0, unsol=0
  IO[1]: enable=0, dir=0, wake=0, sticky=0, data=0, unsol=0
  IO[2]: enable=0, dir=0, wake=0, sticky=0, data=0, unsol=0
  IO[3]: enable=0, dir=0, wake=0, sticky=0, data=0, unsol=0
Node 0x10 [Audio Output] wcaps 0xc1d: Stereo Amp-Out R/L
  Control: name="Speaker Playback Volume", index=0, device=0
    ControlAmp: chs=3, dir=Out, idx=0, ofs=0
  Control: name="Speaker Playback Switch", index=0, device=0
    ControlAmp: chs=3, dir=Out, idx=0, ofs=0
  Device: name="CONEXANT Analog", type="Audio", device=0
  Amp-Out caps: ofs=0x4a, nsteps=0x4a, stepsize=0x03, mute=1
  Amp-Out vals:  [0x3f 0x3f]
  Converter: stream=5, channel=0
  PCM:
    rates [0x560]: 44100 48000 96000 192000
    bits [0xe]: 16 20 24
    formats [0x1]: PCM
  Power states:  D0 D1 D2 D3 D3cold
  Power: setting=D0, actual=D0
Node 0x11 [Audio Output] wcaps 0xc1d: Stereo Amp-Out R/L
  Control: name="Headphone Playback Volume", index=0, device=0
    ControlAmp: chs=3, dir=Out, idx=0, ofs=0
  Control: name="Headphone Playback Switch", index=0, device=0
    ControlAmp: chs=3, dir=Out, idx=0, ofs=0
  Amp-Out caps: ofs=0x4a, nsteps=0x4a, stepsize=0x03, mute=1
  Amp-Out vals:  [0x3f 0x3f]
  Converter: stream=5, channel=0
  PCM:
    rates [0x560]: 44100 48000 96000 192000
    bits [0xe]: 16 20 24
    formats [0x1]: PCM
  Power states:  D0 D1 D2 D3 D3cold
  Power: setting=D0, actual=D0
Node 0x12 [Audio Output] wcaps 0x611: Stereo Digital
  Converter: stream=0, channel=0
  Digital:
  Digital category: 0x0
  PCM:
    rates [0x160]: 44100 48000 96000
    bits [0xe]: 16 20 24
    formats [0x5]: PCM AC3
  Power states:  D0 D1 D2 D3 D3cold
  Power: setting=D0, actual=D0
Node 0x13 [Beep Generator Widget] wcaps 0x70000c: Mono Amp-Out
  Control: name="Beep Playback Volume", index=0, device=0
    ControlAmp: chs=1, dir=Out, idx=0, ofs=0
  Control: name="Beep Playback Switch", index=0, device=0
    ControlAmp: chs=1, dir=Out, idx=0, ofs=0
  Amp-Out caps: ofs=0x07, nsteps=0x07, stepsize=0x0f, mute=0
  Amp-Out vals:  [0x00]
Node 0x14 [Audio Input] wcaps 0x100d1b: Stereo Amp-In R/L
  Control: name="Capture Volume", index=0, device=0
    ControlAmp: chs=3, dir=In, idx=0, ofs=0
  Control: name="Capture Switch", index=0, device=0
    ControlAmp: chs=3, dir=In, idx=0, ofs=0
  Device: name="CONEXANT Analog", type="Audio", device=0
  Amp-In caps: ofs=0x4a, nsteps=0x50, stepsize=0x03, mute=1
  Amp-In vals:  [0x4d 0x4d] [0x80 0x80] [0x4d 0x4d] [0x80 0x80]
  Converter: stream=0, channel=0
  SDI-Select: 0
  PCM:
    rates [0x160]: 44100 48000 96000
    bits [0xe]: 16 20 24
    formats [0x1]: PCM
  Power states:  D0 D1 D2 D3 D3cold
  Power: setting=D0, actual=D0
  Connection: 4
     0x17 0x18 0x23* 0x24
Node 0x15 [Audio Input] wcaps 0x100d1b: Stereo Amp-In R/L
  Amp-In caps: ofs=0x4a, nsteps=0x50, stepsize=0x03, mute=1
  Amp-In vals:  [0x80 0x80] [0x4a 0x4a] [0x4a 0x4a] [0x4a 0x4a]
  Converter: stream=0, channel=0
  SDI-Select: 0
  PCM:
    rates [0x160]: 44100 48000 96000
    bits [0xe]: 16 20 24
    formats [0x1]: PCM
  Power states:  D0 D1 D2 D3 D3cold
  Power: setting=D0, actual=D0
  Connection: 4
     0x17* 0x18 0x23 0x24
Node 0x16 [Audio Input] wcaps 0x100d1b: Stereo Amp-In R/L
  Amp-In caps: ofs=0x4a, nsteps=0x50, stepsize=0x03, mute=1
  Amp-In vals:  [0x80 0x80] [0x4a 0x4a] [0x4a 0x4a] [0x4a 0x4a]
  Converter: stream=0, channel=0
  SDI-Select: 0
  PCM:
    rates [0x160]: 44100 48000 96000
    bits [0xe]: 16 20 24
    formats [0x1]: PCM
  Power states:  D0 D1 D2 D3 D3cold
  Power: setting=D0, actual=D0
  Connection: 4
     0x17* 0x18 0x23 0x24
Node 0x17 [Audio Selector] wcaps 0x30050d: Stereo Amp-Out
  Control: name="Internal Mic Boost Volume", index=0, device=0
    ControlAmp: chs=3, dir=Out, idx=0, ofs=0
  Amp-Out caps: ofs=0x00, nsteps=0x04, stepsize=0x27, mute=0
  Amp-Out vals:  [0x04 0x04]
  Power states:  D0 D1 D2 D3 D3cold
  Power: setting=D0, actual=D0
  Connection: 4
     0x1a 0x1b* 0x1d 0x1e
Node 0x18 [Audio Selector] wcaps 0x30050d: Stereo Amp-Out
  Amp-Out caps: ofs=0x00, nsteps=0x04, stepsize=0x27, mute=0
  Amp-Out vals:  [0x00 0x00]
  Power states:  D0 D1 D2 D3 D3cold
  Power: setting=D0, actual=D0
  Connection: 4
     0x1a* 0x1b 0x1d 0x1e
Node 0x19 [Pin Complex] wcaps 0x400581: Stereo
  Pincap 0x0000001c: OUT HP Detect
  Pin Default 0x022110f0: [Jack] HP Out at Ext Front
    Conn = 1/8, Color = Black
    DefAssociation = 0xf, Sequence = 0x0
  Pin-ctls: 0xc0: OUT HP
  Unsolicited: tag=37, enabled=1
  Power states:  D0 D1 D2 D3 D3cold
  Power: setting=D0, actual=D0
  Connection: 2
     0x10 0x11*
Node 0x1a [Pin Complex] wcaps 0x400481: Stereo
  Pincap 0x00001324: IN Detect
    Vref caps: HIZ 50 80
  Pin Default 0x95a701f0: [Fixed] Mic at Int Top
    Conn = Analog, Color = Unknown
    DefAssociation = 0xf, Sequence = 0x0
    Misc = NO_PRESENCE
  Pin-ctls: 0x24: IN VREF_80
  Unsolicited: tag=00, enabled=0
  Power states:  D0 D1 D2 D3 D3cold
  Power: setting=D0, actual=D0
Node 0x1b [Pin Complex] wcaps 0x400581: Stereo
  Pincap 0x00011334: IN OUT EAPD Detect
    Vref caps: HIZ 50 80
  EAPD 0x2: EAPD
  Pin Default 0x02a110f0: [Jack] Mic at Ext Front
    Conn = 1/8, Color = Black
    DefAssociation = 0xf, Sequence = 0x0
  Pin-ctls: 0x24: IN VREF_80
  Unsolicited: tag=38, enabled=1
  Power states:  D0 D1 D2 D3 D3cold
  Power: setting=D0, actual=D0
  Connection: 2
     0x10* 0x11
Node 0x1c [Pin Complex] wcaps 0x400581: Stereo
  Pincap 0x00000014: OUT Detect
  Pin Default 0x400001f0: [N/A] Line Out at Ext N/A
    Conn = Unknown, Color = Unknown
    DefAssociation = 0xf, Sequence = 0x0
    Misc = NO_PRESENCE
  Pin-ctls: 0x00:
  Unsolicited: tag=00, enabled=0
  Power states:  D0 D1 D2 D3 D3cold
  Power: setting=D0, actual=D0
  Connection: 2
     0x10* 0x11
Node 0x1d [Pin Complex] wcaps 0x400581: Stereo
  Pincap 0x00010034: IN OUT EAPD Detect
  EAPD 0x2: EAPD
  Pin Default 0x400001f0: [N/A] Line Out at Ext N/A
    Conn = Unknown, Color = Unknown
    DefAssociation = 0xf, Sequence = 0x0
    Misc = NO_PRESENCE
  Pin-ctls: 0x00:
  Unsolicited: tag=00, enabled=0
  Power states:  D0 D1 D2 D3 D3cold
  Power: setting=D0, actual=D0
  Connection: 2
     0x10* 0x11
Node 0x1e [Pin Complex] wcaps 0x400481: Stereo
  Pincap 0x00000024: IN Detect
  Pin Default 0x400001f0: [N/A] Line Out at Ext N/A
    Conn = Unknown, Color = Unknown
    DefAssociation = 0xf, Sequence = 0x0
    Misc = NO_PRESENCE
  Pin-ctls: 0x00:
  Unsolicited: tag=00, enabled=0
  Power states:  D0 D1 D2 D3 D3cold
  Power: setting=D0, actual=D0
Node 0x1f [Pin Complex] wcaps 0x400501: Stereo
  Pincap 0x00000010: OUT
  Pin Default 0x921701f0: [Fixed] Speaker at Int Front
    Conn = Analog, Color = Unknown
    DefAssociation = 0xf, Sequence = 0x0
    Misc = NO_PRESENCE
  Pin-ctls: 0x40: OUT
  Power states:  D0 D1 D2 D3 D3cold
  Power: setting=D0, actual=D0
  Connection: 2
     0x10* 0x11
Node 0x20 [Pin Complex] wcaps 0x400781: Stereo Digital
  Pincap 0x00000010: OUT
  Pin Default 0x400001f0: [N/A] Line Out at Ext N/A
    Conn = Unknown, Color = Unknown
    DefAssociation = 0xf, Sequence = 0x0
    Misc = NO_PRESENCE
  Pin-ctls: 0x00:
  Unsolicited: tag=00, enabled=0
  Power states:  D0 D1 D2 D3 D3cold
  Power: setting=D0, actual=D0
  Connection: 1
     0x12
Node 0x21 [Audio Output] wcaps 0x611: Stereo Digital
  Converter: stream=0, channel=0
  Digital:
  Digital category: 0x0
  PCM:
    rates [0x160]: 44100 48000 96000
    bits [0xe]: 16 20 24
    formats [0x5]: PCM AC3
  Power states:  D0 D1 D2 D3 D3cold
  Power: setting=D0, actual=D0
Node 0x22 [Pin Complex] wcaps 0x400781: Stereo Digital
  Pincap 0x00000010: OUT
  Pin Default 0x400001f0: [N/A] Line Out at Ext N/A
    Conn = Unknown, Color = Unknown
    DefAssociation = 0xf, Sequence = 0x0
    Misc = NO_PRESENCE
  Pin-ctls: 0x00:
  Unsolicited: tag=00, enabled=0
  Power states:  D0 D1 D2 D3 D3cold
  Power: setting=D0, actual=D0
  Connection: 1
     0x21
Node 0x23 [Pin Complex] wcaps 0x40040b: Stereo Amp-In
  Amp-In caps: ofs=0x00, nsteps=0x04, stepsize=0x2f, mute=0
  Amp-In vals:  [0x02 0x02]
  Pincap 0x00000020: IN
  Pin Default 0x400001f0: [N/A] Line Out at Ext N/A
    Conn = Unknown, Color = Unknown
    DefAssociation = 0xf, Sequence = 0x0
    Misc = NO_PRESENCE
  Pin-ctls: 0x00:
  Power states:  D0 D1 D2 D3 D3cold
  Power: setting=D0, actual=D0
Node 0x24 [Audio Mixer] wcaps 0x20050b: Stereo Amp-In
  Amp-In caps: ofs=0x4a, nsteps=0x4a, stepsize=0x03, mute=1
  Amp-In vals:  [0x00 0x00] [0x00 0x00]
  Power states:  D0 D1 D2 D3 D3cold
  Power: setting=D0, actual=D0
  Connection: 2
     0x10 0x11
Node 0x25 [Vendor Defined Widget] wcaps 0xf00000: Mono
--endcollapse--


!!Aplay/Arecord output
!!------------

APLAY

**** List of PLAYBACK Hardware Devices ****
card 0: SB [HDA ATI SB], device 0: CONEXANT Analog [CONEXANT Analog]
  Subdevices: 1/1
  Subdevice #0: subdevice #0

ARECORD

**** List of CAPTURE Hardware Devices ****
card 0: SB [HDA ATI SB], device 0: CONEXANT Analog [CONEXANT Analog]
  Subdevices: 1/1
  Subdevice #0: subdevice #0

!!Amixer output
!!-------------

!!-------Mixer controls for card 0 [SB]

Card hw:0 'SB'/'HDA ATI SB at 0x92400000 irq 16'
  Mixer name	: 'Conexant CX20585'
  Components	: 'HDA:14f15069,17aac007,00100302'
  Controls      : 13
  Simple ctrls  : 8
Simple mixer control 'Master',0
  Capabilities: pvolume pvolume-joined pswitch pswitch-joined penum
  Playback channels: Mono
  Limits: Playback 0 - 74
  Mono: Playback 63 [85%] [-11.00dB] [on]
Simple mixer control 'Headphone',0
  Capabilities: pvolume pswitch penum
  Playback channels: Front Left - Front Right
  Limits: Playback 0 - 74
  Mono:
  Front Left: Playback 74 [100%] [0.00dB] [on]
  Front Right: Playback 74 [100%] [0.00dB] [on]
Simple mixer control 'Speaker',0
  Capabilities: pvolume pswitch penum
  Playback channels: Front Left - Front Right
  Limits: Playback 0 - 74
  Mono:
  Front Left: Playback 74 [100%] [0.00dB] [on]
  Front Right: Playback 74 [100%] [0.00dB] [on]
Simple mixer control 'PCM',0
  Capabilities: pvolume penum
  Playback channels: Front Left - Front Right
  Limits: Playback 0 - 255
  Mono:
  Front Left: Playback 252 [99%] [0.60dB]
  Front Right: Playback 252 [99%] [0.60dB]
Simple mixer control 'Beep',0
  Capabilities: pvolume pvolume-joined pswitch pswitch-joined penum
  Playback channels: Mono
  Limits: Playback 0 - 7
  Mono: Playback 0 [0%] [-28.00dB] [off]
Simple mixer control 'Capture',0
  Capabilities: cvolume cswitch penum
  Capture channels: Front Left - Front Right
  Limits: Capture 0 - 80
  Front Left: Capture 77 [96%] [3.00dB] [on]
  Front Right: Capture 77 [96%] [3.00dB] [on]
Simple mixer control 'Auto-Mute Mode',0
  Capabilities: enum
  Items: 'Disabled' 'Enabled'
  Item0: 'Enabled'
Simple mixer control 'Internal Mic Boost',0
  Capabilities: volume penum
  Playback channels: Front Left - Front Right
  Capture channels: Front Left - Front Right
  Limits: 0 - 4
  Front Left: 4 [100%] [40.00dB]
  Front Right: 4 [100%] [40.00dB]


!!Alsactl output
!!-------------

--startcollapse--
state.SB {
	control.1 {
		iface MIXER
		name 'Speaker Playback Volume'
		value.0 74
		value.1 74
		comment {
			access 'read write'
			type INTEGER
			count 2
			range '0 - 74'
			dbmin -7400
			dbmax 0
			dbvalue.0 0
			dbvalue.1 0
		}
	}
	control.2 {
		iface MIXER
		name 'Speaker Playback Switch'
		value.0 true
		value.1 true
		comment {
			access 'read write'
			type BOOLEAN
			count 2
		}
	}
	control.3 {
		iface MIXER
		name 'Headphone Playback Volume'
		value.0 74
		value.1 74
		comment {
			access 'read write'
			type INTEGER
			count 2
			range '0 - 74'
			dbmin -7400
			dbmax 0
			dbvalue.0 0
			dbvalue.1 0
		}
	}
	control.4 {
		iface MIXER
		name 'Headphone Playback Switch'
		value.0 true
		value.1 true
		comment {
			access 'read write'
			type BOOLEAN
			count 2
		}
	}
	control.5 {
		iface MIXER
		name 'Auto-Mute Mode'
		value Enabled
		comment {
			access 'read write'
			type ENUMERATED
			count 1
			item.0 Disabled
			item.1 Enabled
		}
	}
	control.6 {
		iface MIXER
		name 'Internal Mic Boost Volume'
		value.0 4
		value.1 4
		comment {
			access 'read write'
			type INTEGER
			count 2
			range '0 - 4'
			dbmin 0
			dbmax 4000
			dbvalue.0 4000
			dbvalue.1 4000
		}
	}
	control.7 {
		iface MIXER
		name 'Capture Volume'
		value.0 77
		value.1 77
		comment {
			access 'read write'
			type INTEGER
			count 2
			range '0 - 80'
			dbmin -7400
			dbmax 600
			dbvalue.0 300
			dbvalue.1 300
		}
	}
	control.8 {
		iface MIXER
		name 'Capture Switch'
		value.0 true
		value.1 true
		comment {
			access 'read write'
			type BOOLEAN
			count 2
		}
	}
	control.9 {
		iface MIXER
		name 'Master Playback Volume'
		value 63
		comment {
			access 'read write'
			type INTEGER
			count 1
			range '0 - 74'
			dbmin -7400
			dbmax 0
			dbvalue.0 -1100
		}
	}
	control.10 {
		iface MIXER
		name 'Master Playback Switch'
		value true
		comment {
			access 'read write'
			type BOOLEAN
			count 1
		}
	}
	control.11 {
		iface MIXER
		name 'Beep Playback Volume'
		value 0
		comment {
			access 'read write'
			type INTEGER
			count 1
			range '0 - 7'
			dbmin -2800
			dbmax 0
			dbvalue.0 -2800
		}
	}
	control.12 {
		iface MIXER
		name 'Beep Playback Switch'
		value false
		comment {
			access 'read write'
			type BOOLEAN
			count 1
		}
	}
	control.13 {
		iface MIXER
		name 'PCM Playback Volume'
		value.0 252
		value.1 252
		comment {
			access 'read write user'
			type INTEGER
			count 2
			range '0 - 255'
			tlv '0000000100000008ffffec1400000014'
			dbmin -5100
			dbmax 0
			dbvalue.0 -60
			dbvalue.1 -60
		}
	}
}
--endcollapse--


!!ALSA configuration files
!!------------------------

!!System wide config file (/etc/asound.conf)

pcm.pulse {
    type pulse
}
ctl.pulse {
    type pulse
}
pcm.!default {
    type pulse
}
ctl.!default {
    type pulse
}


!!ALSA Device nodes
!!-----------------

crw-rw----+ 1 root audio 116,  5 May 23 17:55 /dev/snd/controlC0
crw-rw----+ 1 root audio 116,  4 May 23 17:55 /dev/snd/hwC0D0
crw-rw----+ 1 root audio 116,  3 May 23 17:57 /dev/snd/pcmC0D0c
crw-rw----+ 1 root audio 116,  2 May 23 17:58 /dev/snd/pcmC0D0p
crw-------  1 root root  116,  1 May 23 17:55 /dev/snd/seq
crw-rw----+ 1 root audio 116, 33 May 23 17:55 /dev/snd/timer

/dev/snd/by-path:
total 0
drwxr-xr-x 2 root root  60 May 23 17:55 .
drwxr-xr-x 3 root root 180 May 23 17:55 ..
lrwxrwxrwx 1 root root  12 May 23 17:55 pci-0000:00:14.2 -> ../controlC0


!!ALSA/HDA dmesg
!!------------------

[   38.198903] [drm] Loading RS780 Microcode
[   38.454532] HDA Intel 0000:00:14.2: PCI INT A -> GSI 16 (level, low) -> IRQ 16
[   38.454573] HDA Intel 0000:00:14.2: setting latency timer to 64
[   38.484262] ALSA hda_intel.c:1463: Enable sync_write for AMD chipset
[   38.613501] radeon 0000:01:05.0: WB enabled
--
[   38.646724] [drm]     LCD1: INTERNAL_KLDSCP_LVTMA
[   38.648238] hda_codec: CX20585: BIOS auto-probing.
[   38.648977] input: HDA Digital PCBeep as /devices/pci0000:00/0000:00:14.2/input/input10
[   38.710023] [drm] radeon: power management initialized


