
!!################################
!!ALSA Information Script v 0.4.60
!!################################

!!Script ran on: Tue Jun 21 10:40:15 UTC 2011


!!Linux Distribution
!!------------------

Ubuntu 11.04 \n \l DISTRIB_ID=Ubuntu DISTRIB_DESCRIPTION="Ubuntu 11.04"


!!DMI Information
!!---------------

Manufacturer:      Acer
Product Name:      Aspire 3830TG
Product Version:   V1.03


!!Kernel Information
!!------------------

Kernel release:    2.6.39-0-generic
Operating System:  GNU/Linux
Architecture:      x86_64
Processor:         x86_64
SMP Enabled:       Yes


!!ALSA Version
!!------------

Driver version:     1.0.24
Library version:    1.0.24.1
Utilities version:  1.0.24.2


!!Loaded ALSA modules
!!-------------------

snd_hda_intel


!!Sound Servers on this system
!!----------------------------

Pulseaudio:
      Installed - Yes (/usr/bin/pulseaudio)
      Running - Yes

ESound Daemon:
      Installed - Yes (/usr/bin/esd)
      Running - No


!!Soundcards recognised by ALSA
!!-----------------------------

 0 [PCH            ]: HDA-Intel - HDA Intel PCH
                      HDA Intel PCH at 0xb0800000 irq 48


!!PCI Soundcards installed in the system
!!--------------------------------------

00:1b.0 Audio device: Intel Corporation 6 Series Chipset Family High Definition Audio Controller (rev 04)


!!Advanced information - PCI Vendor/Device/Subsystem ID's
!!--------------------------------------------------------

00:1b.0 0403: 8086:1c20 (rev 04)
	Subsystem: 1025:054c


!!Modprobe options (Sound related)
!!--------------------------------

snd-atiixp-modem: index=-2
snd-intel8x0m: index=-2
snd-via82xx-modem: index=-2
snd-usb-audio: index=-2
snd-usb-caiaq: index=-2
snd-usb-ua101: index=-2
snd-usb-us122l: index=-2
snd-usb-usx2y: index=-2
snd-cmipci: mpu_port=0x330 fm_port=0x388
snd-pcsp: index=-2
snd-usb-audio: index=-2


!!Loaded sound module options
!!--------------------------

!!Module: snd_hda_intel
	bdl_pos_adj : 1,-1,-1,-1,-1,-1,-1,-1,-1,-1,-1,-1,-1,-1,-1,-1,-1,-1,-1,-1,-1,-1,-1,-1,-1,-1,-1,-1,-1,-1,-1,-1
	beep_mode : 0,0,0,0,0,0,0,0,0,0,0,0,0,0,0,0,0,0,0,0,0,0,0,0,0,0,0,0,0,0,0,0
	enable : Y,Y,Y,Y,Y,Y,Y,Y,Y,Y,Y,Y,Y,Y,Y,Y,Y,Y,Y,Y,Y,Y,Y,Y,Y,Y,Y,Y,Y,Y,Y,Y
	enable_msi : -1
	id : (null),(null),(null),(null),(null),(null),(null),(null),(null),(null),(null),(null),(null),(null),(null),(null),(null),(null),(null),(null),(null),(null),(null),(null),(null),(null),(null),(null),(null),(null),(null),(null)
	index : -1,-1,-1,-1,-1,-1,-1,-1,-1,-1,-1,-1,-1,-1,-1,-1,-1,-1,-1,-1,-1,-1,-1,-1,-1,-1,-1,-1,-1,-1,-1,-1
	model : (null),(null),(null),(null),(null),(null),(null),(null),(null),(null),(null),(null),(null),(null),(null),(null),(null),(null),(null),(null),(null),(null),(null),(null),(null),(null),(null),(null),(null),(null),(null),(null)
	patch : (null),(null),(null),(null),(null),(null),(null),(null),(null),(null),(null),(null),(null),(null),(null),(null),(null),(null),(null),(null),(null),(null),(null),(null),(null),(null),(null),(null),(null),(null),(null),(null)
	position_fix : 0,0,0,0,0,0,0,0,0,0,0,0,0,0,0,0,0,0,0,0,0,0,0,0,0,0,0,0,0,0,0,0
	power_save : 1
	power_save_controller : Y
	probe_mask : -1,-1,-1,-1,-1,-1,-1,-1,-1,-1,-1,-1,-1,-1,-1,-1,-1,-1,-1,-1,-1,-1,-1,-1,-1,-1,-1,-1,-1,-1,-1,-1
	probe_only : 0,0,0,0,0,0,0,0,0,0,0,0,0,0,0,0,0,0,0,0,0,0,0,0,0,0,0,0,0,0,0,0
	single_cmd : N


!!HDA-Intel Codec information
!!---------------------------
--startcollapse--

Codec: Conexant ID 506c
Address: 0
AFG Function Id: 0x1 (unsol 1)
Vendor Id: 0x14f1506c
Subsystem Id: 0x1025054c
Revision Id: 0x100000
No Modem Function Group found
Default PCM:
    rates [0x160]: 44100 48000 96000
    bits [0xe]: 16 20 24
    formats [0x1]: PCM
Default Amp-In caps: N/A
Default Amp-Out caps: N/A
GPIO: io=4, o=0, i=0, unsolicited=1, wake=0
  IO[0]: enable=0, dir=0, wake=0, sticky=0, data=0, unsol=0
  IO[1]: enable=0, dir=0, wake=0, sticky=0, data=0, unsol=0
  IO[2]: enable=0, dir=0, wake=0, sticky=0, data=0, unsol=0
  IO[3]: enable=0, dir=0, wake=0, sticky=0, data=0, unsol=0
Node 0x10 [Audio Output] wcaps 0xc1d: Stereo Amp-Out R/L
  Control: name="Master Playback Switch", index=0, device=0
    ControlAmp: chs=3, dir=Out, idx=0, ofs=0
  Control: name="Master Playback Volume", index=0, device=0
    ControlAmp: chs=3, dir=Out, idx=0, ofs=0
  Device: name="HDA Generic", type="Audio", device=0
  Amp-Out caps: ofs=0x4a, nsteps=0x4a, stepsize=0x03, mute=1
  Amp-Out vals:  [0x3c 0x3c]
  Converter: stream=0, channel=0
  PCM:
    rates [0x560]: 44100 48000 96000 192000
    bits [0xe]: 16 20 24
    formats [0x1]: PCM
  Power states:  D0 D1 D2 D3 D3cold EPSS
  Power: setting=D0, actual=D0
Node 0x11 [Audio Output] wcaps 0xc1d: Stereo Amp-Out R/L
  Amp-Out caps: ofs=0x4a, nsteps=0x4a, stepsize=0x03, mute=1
  Amp-Out vals:  [0x3c 0x3c]
  Converter: stream=0, channel=0
  PCM:
    rates [0x560]: 44100 48000 96000 192000
    bits [0xe]: 16 20 24
    formats [0x1]: PCM
  Power states:  D0 D1 D2 D3 D3cold EPSS
  Power: setting=D0, actual=D0
Node 0x12 [Audio Output] wcaps 0x611: Stereo Digital
  Converter: stream=0, channel=0
  Digital:
  Digital category: 0x0
  PCM:
    rates [0x160]: 44100 48000 96000
    bits [0xe]: 16 20 24
    formats [0x5]: PCM AC3
  Power states:  D0 D1 D2 D3 D3cold EPSS
  Power: setting=D0, actual=D0
Node 0x13 [Beep Generator Widget] wcaps 0x70000c: Mono Amp-Out
  Amp-Out caps: ofs=0x07, nsteps=0x07, stepsize=0x0f, mute=0
  Amp-Out vals:  [0x00]
Node 0x14 [Audio Input] wcaps 0x100d1b: Stereo Amp-In R/L
  Control: name="Capture Source", index=0, device=0
  Control: name="Mic Capture Volume", index=0, device=0
    ControlAmp: chs=3, dir=In, idx=2, ofs=0
  Control: name="Mic 1 Capture Volume", index=0, device=0
    ControlAmp: chs=3, dir=In, idx=0, ofs=0
  Device: name="HDA Generic", type="Audio", device=0
  Amp-In caps: ofs=0x4a, nsteps=0x50, stepsize=0x03, mute=1
  Amp-In vals:  [0x06 0x06] [0x4a 0x4a] [0x08 0x08] [0x4a 0x4a]
  Converter: stream=0, channel=0
  SDI-Select: 0
  PCM:
    rates [0x160]: 44100 48000 96000
    bits [0xe]: 16 20 24
    formats [0x1]: PCM
  Power states:  D0 D1 D2 D3 D3cold EPSS
  Power: setting=D0, actual=D0
  Connection: 4
     0x17 0x18 0x23* 0x24
Node 0x15 [Audio Input] wcaps 0x100d1b: Stereo Amp-In R/L
  Amp-In caps: ofs=0x4a, nsteps=0x50, stepsize=0x03, mute=1
  Amp-In vals:  [0x4a 0x4a] [0x4a 0x4a] [0x4a 0x4a] [0x4a 0x4a]
  Converter: stream=0, channel=0
  SDI-Select: 0
  PCM:
    rates [0x160]: 44100 48000 96000
    bits [0xe]: 16 20 24
    formats [0x1]: PCM
  Power states:  D0 D1 D2 D3 D3cold EPSS
  Power: setting=D0, actual=D0
  Connection: 4
     0x17* 0x18 0x23 0x24
Node 0x16 [Audio Input] wcaps 0x100d1b: Stereo Amp-In R/L
  Amp-In caps: ofs=0x4a, nsteps=0x50, stepsize=0x03, mute=1
  Amp-In vals:  [0x4a 0x4a] [0x4a 0x4a] [0x4a 0x4a] [0x4a 0x4a]
  Converter: stream=0, channel=0
  SDI-Select: 0
  PCM:
    rates [0x160]: 44100 48000 96000
    bits [0xe]: 16 20 24
    formats [0x1]: PCM
  Power states:  D0 D1 D2 D3 D3cold EPSS
  Power: setting=D0, actual=D0
  Connection: 4
     0x17* 0x18 0x23 0x24
Node 0x17 [Audio Selector] wcaps 0x30050d: Stereo Amp-Out
  Amp-Out caps: ofs=0x00, nsteps=0x04, stepsize=0x27, mute=0
  Amp-Out vals:  [0x04 0x04]
  Power states:  D0 D1 D2 D3 D3cold EPSS
  Power: setting=D0, actual=D0
  Connection: 4
     0x1a 0x1b* 0x1d 0x1e
Node 0x18 [Audio Selector] wcaps 0x30050d: Stereo Amp-Out
  Amp-Out caps: ofs=0x00, nsteps=0x04, stepsize=0x27, mute=0
  Amp-Out vals:  [0x00 0x00]
  Power states:  D0 D1 D2 D3 D3cold EPSS
  Power: setting=D0, actual=D0
  Connection: 4
     0x1a* 0x1b 0x1d 0x1e
Node 0x19 [Pin Complex] wcaps 0x400581: Stereo
  Pincap 0x0000001c: OUT HP Detect
  Pin Default 0x04211040: [Jack] HP Out at Ext Right
    Conn = 1/8, Color = Black
    DefAssociation = 0x4, Sequence = 0x0
  Pin-ctls: 0xc0: OUT HP
  Unsolicited: tag=00, enabled=0
  Power states:  D0 D1 D2 D3 D3cold EPSS
  Power: setting=D0, actual=D0
  Connection: 2
     0x10* 0x11
Node 0x1a [Pin Complex] wcaps 0x400481: Stereo
  Pincap 0x00001324: IN Detect
    Vref caps: HIZ 50 80
  Pin Default 0x400001f0: [N/A] Line Out at Ext N/A
    Conn = Unknown, Color = Unknown
    DefAssociation = 0xf, Sequence = 0x0
    Misc = NO_PRESENCE
  Pin-ctls: 0x00: VREF_HIZ
  Unsolicited: tag=00, enabled=0
  Power states:  D0 D1 D2 D3 D3cold EPSS
  Power: setting=D0, actual=D0
Node 0x1b [Pin Complex] wcaps 0x400581: Stereo
  Pincap 0x00011334: IN OUT EAPD Detect
    Vref caps: HIZ 50 80
  EAPD 0x0:
  Pin Default 0x04a11030: [Jack] Mic at Ext Right
    Conn = 1/8, Color = Black
    DefAssociation = 0x3, Sequence = 0x0
  Pin-ctls: 0x24: IN VREF_80
  Unsolicited: tag=00, enabled=0
  Power states:  D0 D1 D2 D3 D3cold EPSS
  Power: setting=D0, actual=D0
  Connection: 2
     0x10* 0x11
Node 0x1c [Pin Complex] wcaps 0x400581: Stereo
  Pincap 0x00000014: OUT Detect
  Pin Default 0x400001f0: [N/A] Line Out at Ext N/A
    Conn = Unknown, Color = Unknown
    DefAssociation = 0xf, Sequence = 0x0
    Misc = NO_PRESENCE
  Pin-ctls: 0x40: OUT
  Unsolicited: tag=00, enabled=0
  Power states:  D0 D1 D2 D3 D3cold EPSS
  Power: setting=D0, actual=D0
  Connection: 2
     0x10* 0x11
Node 0x1d [Pin Complex] wcaps 0x400581: Stereo
  Pincap 0x00010034: IN OUT EAPD Detect
  EAPD 0x0:
  Pin Default 0x400001f0: [N/A] Line Out at Ext N/A
    Conn = Unknown, Color = Unknown
    DefAssociation = 0xf, Sequence = 0x0
    Misc = NO_PRESENCE
  Pin-ctls: 0x40: OUT
  Unsolicited: tag=00, enabled=0
  Power states:  D0 D1 D2 D3 D3cold EPSS
  Power: setting=D0, actual=D0
  Connection: 2
     0x10* 0x11
Node 0x1e [Pin Complex] wcaps 0x400481: Stereo
  Pincap 0x00000024: IN Detect
  Pin Default 0x400001f0: [N/A] Line Out at Ext N/A
    Conn = Unknown, Color = Unknown
    DefAssociation = 0xf, Sequence = 0x0
    Misc = NO_PRESENCE
  Pin-ctls: 0x00:
  Unsolicited: tag=00, enabled=0
  Power states:  D0 D1 D2 D3 D3cold EPSS
  Power: setting=D0, actual=D0
Node 0x1f [Pin Complex] wcaps 0x400501: Stereo
  Pincap 0x00000010: OUT
  Pin Default 0x92170110: [Fixed] Speaker at Int Front
    Conn = Analog, Color = Unknown
    DefAssociation = 0x1, Sequence = 0x0
    Misc = NO_PRESENCE
  Pin-ctls: 0x40: OUT
  Power states:  D0 D1 D2 D3 D3cold EPSS
  Power: setting=D0, actual=D0
  Connection: 2
     0x10* 0x11
Node 0x20 [Pin Complex] wcaps 0x400781: Stereo Digital
  Pincap 0x00000010: OUT
  Pin Default 0x044511f0: [Jack] SPDIF Out at Ext Right
    Conn = Optical, Color = Black
    DefAssociation = 0xf, Sequence = 0x0
    Misc = NO_PRESENCE
  Pin-ctls: 0x00:
  Unsolicited: tag=00, enabled=0
  Power states:  D0 D1 D2 D3 D3cold EPSS
  Power: setting=D0, actual=D0
  Connection: 1
     0x12
Node 0x21 [Audio Output] wcaps 0x611: Stereo Digital
  Converter: stream=0, channel=0
  Digital:
  Digital category: 0x0
  PCM:
    rates [0x160]: 44100 48000 96000
    bits [0xe]: 16 20 24
    formats [0x5]: PCM AC3
  Power states:  D0 D1 D2 D3 D3cold EPSS
  Power: setting=D0, actual=D0
Node 0x22 [Pin Complex] wcaps 0x400781: Stereo Digital
  Pincap 0x00000010: OUT
  Pin Default 0x400001f0: [N/A] Line Out at Ext N/A
    Conn = Unknown, Color = Unknown
    DefAssociation = 0xf, Sequence = 0x0
    Misc = NO_PRESENCE
  Pin-ctls: 0x00:
  Unsolicited: tag=00, enabled=0
  Power states:  D0 D1 D2 D3 D3cold EPSS
  Power: setting=D0, actual=D0
  Connection: 1
     0x21
Node 0x23 [Pin Complex] wcaps 0x40040b: Stereo Amp-In
  Amp-In caps: ofs=0x00, nsteps=0x04, stepsize=0x2f, mute=0
  Amp-In vals:  [0x04 0x04]
  Pincap 0x00000020: IN
  Pin Default 0x95a60150: [Fixed] Mic at Int Top
    Conn = Digital, Color = Unknown
    DefAssociation = 0x5, Sequence = 0x0
    Misc = NO_PRESENCE
  Pin-ctls: 0x20: IN
  Power states:  D0 D1 D2 D3 D3cold EPSS
  Power: setting=D0, actual=D0
Node 0x24 [Audio Mixer] wcaps 0x20050b: Stereo Amp-In
  Amp-In caps: ofs=0x4a, nsteps=0x4a, stepsize=0x03, mute=1
  Amp-In vals:  [0x00 0x00] [0x00 0x00]
  Power states:  D0 D1 D2 D3 D3cold EPSS
  Power: setting=D0, actual=D0
  Connection: 2
     0x10 0x11
Node 0x25 [Vendor Defined Widget] wcaps 0xf00000: Mono
Codec: Intel CougarPoint HDMI
Address: 3
AFG Function Id: 0x1 (unsol 0)
Vendor Id: 0x80862805
Subsystem Id: 0x80860101
Revision Id: 0x100000
No Modem Function Group found
Default PCM:
    rates [0x0]:
    bits [0x0]:
    formats [0x0]:
Default Amp-In caps: N/A
Default Amp-Out caps: N/A
GPIO: io=0, o=0, i=0, unsolicited=0, wake=0
Node 0x02 [Audio Output] wcaps 0x6611: 8-Channels Digital
  Control: name="IEC958 Playback Con Mask", index=0, device=0
  Control: name="IEC958 Playback Pro Mask", index=0, device=0
  Control: name="IEC958 Playback Default", index=0, device=0
  Control: name="IEC958 Playback Switch", index=0, device=0
  Device: name="HDMI 0", type="HDMI", device=3
  Converter: stream=0, channel=0
  Digital: Enabled
  Digital category: 0x0
  PCM:
    rates [0x7f0]: 32000 44100 48000 88200 96000 176400 192000
    bits [0x1e]: 16 20 24 32
    formats [0x5]: PCM AC3
  Power states:  D0 D3 EPSS
  Power: setting=D0, actual=D0
Node 0x03 [Audio Output] wcaps 0x6611: 8-Channels Digital
  Converter: stream=0, channel=0
  Digital: Enabled
  Digital category: 0x0
  PCM:
    rates [0x7f0]: 32000 44100 48000 88200 96000 176400 192000
    bits [0x1e]: 16 20 24 32
    formats [0x5]: PCM AC3
  Power states:  D0 D3 EPSS
  Power: setting=D0, actual=D0
Node 0x04 [Audio Output] wcaps 0x6611: 8-Channels Digital
  Converter: stream=0, channel=0
  Digital: Enabled
  Digital category: 0x0
  PCM:
    rates [0x7f0]: 32000 44100 48000 88200 96000 176400 192000
    bits [0x1e]: 16 20 24 32
    formats [0x5]: PCM AC3
  Power states:  D0 D3 EPSS
  Power: setting=D0, actual=D0
Node 0x05 [Pin Complex] wcaps 0x40778d: 8-Channels Digital Amp-Out CP
  Amp-Out caps: ofs=0x00, nsteps=0x00, stepsize=0x00, mute=1
  Amp-Out vals:  [0x00 0x00]
  Pincap 0x09000094: OUT Detect HBR HDMI DP
  Pin Default 0x18560010: [Jack] Digital Out at Int HDMI
    Conn = Digital, Color = Unknown
    DefAssociation = 0x1, Sequence = 0x0
  Pin-ctls: 0x40: OUT
  Unsolicited: tag=05, enabled=1
  Power states:  D0 D3 EPSS
  Power: setting=D0, actual=D0
  Connection: 1
     0x02
Node 0x06 [Pin Complex] wcaps 0x40778d: 8-Channels Digital Amp-Out CP
  Amp-Out caps: ofs=0x00, nsteps=0x00, stepsize=0x00, mute=1
  Amp-Out vals:  [0x00 0x80]
  Pincap 0x09000094: OUT Detect HBR HDMI DP
  Pin Default 0x58560020: [N/A] Digital Out at Int HDMI
    Conn = Digital, Color = Unknown
    DefAssociation = 0x2, Sequence = 0x0
  Pin-ctls: 0x40: OUT
  Unsolicited: tag=00, enabled=0
  Power states:  D0 D3 EPSS
  Power: setting=D0, actual=D0
  Connection: 1
     0x03
Node 0x07 [Pin Complex] wcaps 0x40778d: 8-Channels Digital Amp-Out CP
  Amp-Out caps: ofs=0x00, nsteps=0x00, stepsize=0x00, mute=1
  Amp-Out vals:  [0x00 0x80]
  Pincap 0x09000094: OUT Detect HBR HDMI DP
  Pin Default 0x58560030: [N/A] Digital Out at Int HDMI
    Conn = Digital, Color = Unknown
    DefAssociation = 0x3, Sequence = 0x0
  Pin-ctls: 0x40: OUT
  Unsolicited: tag=00, enabled=0
  Power states:  D0 D3 EPSS
  Power: setting=D0, actual=D0
  Connection: 1
     0x04
Node 0x08 [Vendor Defined Widget] wcaps 0xf00000: Mono
--endcollapse--


!!ALSA Device nodes
!!-----------------

crw-rw----  1 root audio 116,  7 Jun 21 11:38 /dev/snd/controlC0
crw-rw----  1 root audio 116,  6 Jun 21 11:38 /dev/snd/hwC0D0
crw-rw----  1 root audio 116,  5 Jun 21 11:38 /dev/snd/hwC0D3
crw-rw----  1 root audio 116,  4 Jun 21 12:17 /dev/snd/pcmC0D0c
crw-rw----  1 root audio 116,  3 Jun 21 11:38 /dev/snd/pcmC0D0p
crw-rw----  1 root audio 116,  2 Jun 21 12:17 /dev/snd/pcmC0D3p
crw-rw----  1 root audio 116,  1 Jun 21 11:38 /dev/snd/seq
crw-rw----  1 root audio 116, 33 Jun 21 11:38 /dev/snd/timer

/dev/snd/by-path:
total 0
drwxr-xr-x 2 root root  60 Jun 21 11:38 .
drwxr-xr-x 3 root root 220 Jun 21 11:38 ..
lrwxrwxrwx 1 root root  12 Jun 21 11:38 pci-0000:00:1b.0 -> ../controlC0


!!Aplay/Arecord output
!!------------

APLAY

**** List of PLAYBACK Hardware Devices ****
card 0: PCH [HDA Intel PCH], device 0: HDA Generic [HDA Generic]
  Subdevices: 1/1
  Subdevice #0: subdevice #0
card 0: PCH [HDA Intel PCH], device 3: HDMI 0 [HDMI 0]
  Subdevices: 1/1
  Subdevice #0: subdevice #0

ARECORD

**** List of CAPTURE Hardware Devices ****
card 0: PCH [HDA Intel PCH], device 0: HDA Generic [HDA Generic]
  Subdevices: 1/1
  Subdevice #0: subdevice #0

!!Amixer output
!!-------------

!!-------Mixer controls for card 0 [PCH]

Card hw:0 'PCH'/'HDA Intel PCH at 0xb0800000 irq 48'
  Mixer name	: 'Intel CougarPoint HDMI'
  Components	: 'HDA:14f1506c,1025054c,00100000 HDA:80862805,80860101,00100000'
  Controls      : 10
  Simple ctrls  : 5
Simple mixer control 'Master',0
  Capabilities: pvolume pswitch penum
  Playback channels: Front Left - Front Right
  Limits: Playback 0 - 74
  Mono:
  Front Left: Playback 60 [81%] [-14.00dB] [on]
  Front Right: Playback 60 [81%] [-14.00dB] [on]
Simple mixer control 'PCM',0
  Capabilities: pvolume penum
  Playback channels: Front Left - Front Right
  Limits: Playback 0 - 255
  Mono:
  Front Left: Playback 255 [100%] [0.00dB]
  Front Right: Playback 255 [100%] [0.00dB]
Simple mixer control 'Mic',0
  Capabilities: cvolume cswitch cswitch-joined cswitch-exclusive penum
  Capture exclusive group: 0
  Capture channels: Front Left - Front Right
  Limits: Capture 0 - 80
  Front Left: Capture 8 [10%] [-66.00dB] [on]
  Front Right: Capture 8 [10%] [-66.00dB] [on]
Simple mixer control 'Mic 1',0
  Capabilities: cvolume cswitch cswitch-joined cswitch-exclusive penum
  Capture exclusive group: 0
  Capture channels: Front Left - Front Right
  Limits: Capture 0 - 80
  Front Left: Capture 6 [8%] [-68.00dB] [off]
  Front Right: Capture 6 [8%] [-68.00dB] [off]
Simple mixer control 'IEC958',0
  Capabilities: pswitch pswitch-joined penum
  Playback channels: Mono
  Mono: Playback [on]


!!Alsactl output
!!-------------

--startcollapse--
state.PCH {
	control.1 {
		iface MIXER
		name 'Capture Source'
		value Mic
		comment {
			access 'read write'
			type ENUMERATED
			count 1
			item.0 Mic
			item.1 'Mic 1'
		}
	}
	control.2 {
		iface MIXER
		name 'Mic Capture Volume'
		value.0 8
		value.1 8
		comment {
			access 'read write'
			type INTEGER
			count 2
			range '0 - 80'
			dbmin -7400
			dbmax 600
			dbvalue.0 -6600
			dbvalue.1 -6600
		}
	}
	control.3 {
		iface MIXER
		name 'Mic 1 Capture Volume'
		value.0 6
		value.1 6
		comment {
			access 'read write'
			type INTEGER
			count 2
			range '0 - 80'
			dbmin -7400
			dbmax 600
			dbvalue.0 -6800
			dbvalue.1 -6800
		}
	}
	control.4 {
		iface MIXER
		name 'Master Playback Switch'
		value.0 true
		value.1 true
		comment {
			access 'read write'
			type BOOLEAN
			count 2
		}
	}
	control.5 {
		iface MIXER
		name 'Master Playback Volume'
		value.0 60
		value.1 60
		comment {
			access 'read write'
			type INTEGER
			count 2
			range '0 - 74'
			dbmin -7400
			dbmax 0
			dbvalue.0 -1400
			dbvalue.1 -1400
		}
	}
	control.6 {
		iface MIXER
		name 'IEC958 Playback Con Mask'
		value '0fff000000000000000000000000000000000000000000000000000000000000000000000000000000000000000000000000000000000000000000000000000000000000000000000000000000000000000000000000000000000000000000000000000000000000000000000000000000000000000000000000000000000000000000000000000000000000000000000000000000000000000000000000000000000000000000000000000000000000'
		comment {
			access read
			type IEC958
			count 1
		}
	}
	control.7 {
		iface MIXER
		name 'IEC958 Playback Pro Mask'
		value '0f00000000000000000000000000000000000000000000000000000000000000000000000000000000000000000000000000000000000000000000000000000000000000000000000000000000000000000000000000000000000000000000000000000000000000000000000000000000000000000000000000000000000000000000000000000000000000000000000000000000000000000000000000000000000000000000000000000000000000'
		comment {
			access read
			type IEC958
			count 1
		}
	}
	control.8 {
		iface MIXER
		name 'IEC958 Playback Default'
		value '0400000000000000000000000000000000000000000000000000000000000000000000000000000000000000000000000000000000000000000000000000000000000000000000000000000000000000000000000000000000000000000000000000000000000000000000000000000000000000000000000000000000000000000000000000000000000000000000000000000000000000000000000000000000000000000000000000000000000000'
		comment {
			access 'read write'
			type IEC958
			count 1
		}
	}
	control.9 {
		iface MIXER
		name 'IEC958 Playback Switch'
		value true
		comment {
			access 'read write'
			type BOOLEAN
			count 1
		}
	}
	control.10 {
		iface MIXER
		name 'PCM Playback Volume'
		value.0 255
		value.1 255
		comment {
			access 'read write user'
			type INTEGER
			count 2
			range '0 - 255'
			tlv '0000000100000008ffffec1400000014'
			dbmin -5100
			dbmax 0
			dbvalue.0 0
			dbvalue.1 0
		}
	}
}
--endcollapse--


!!All Loaded Modules
!!------------------

Module
joydev
parport_pc
ppdev
snd_hda_codec_hdmi
binfmt_misc
arc4
ath9k
mac80211
snd_hda_intel
snd_hda_codec
ath9k_common
ath9k_hw
ath
snd_hwdep
snd_pcm
snd_seq_midi
snd_rawmidi
snd_seq_midi_event
sparse_keymap
snd_seq
snd_timer
snd_seq_device
i915
snd
drm_kms_helper
psmouse
serio_raw
xhci_hcd
soundcore
cfg80211
drm
snd_page_alloc
rts_pstor
i2c_algo_bit
uvcvideo
videodev
v4l2_compat_ioctl32
video
lp
parport
ahci
libahci
atl1c


!!Sysfs Files
!!-----------

/sys/class/sound/hwC0D0/init_pin_configs:
0x19 0x04211040
0x1a 0x400001f0
0x1b 0x04a11030
0x1c 0x400001f0
0x1d 0x400001f0
0x1e 0x400001f0
0x1f 0x92170110
0x20 0x044511f0
0x22 0x400001f0
0x23 0x95a60150

/sys/class/sound/hwC0D0/driver_pin_configs:

/sys/class/sound/hwC0D0/user_pin_configs:

/sys/class/sound/hwC0D0/init_verbs:

/sys/class/sound/hwC0D3/init_pin_configs:
0x05 0x18560010
0x06 0x58560020
0x07 0x58560030

/sys/class/sound/hwC0D3/driver_pin_configs:

/sys/class/sound/hwC0D3/user_pin_configs:

/sys/class/sound/hwC0D3/init_verbs:


!!ALSA/HDA dmesg
!!------------------

[    4.126636] [drm] Initialized i915 1.6.0 20080730 for 0000:00:02.0 on minor 0
[    4.126767] HDA Intel 0000:00:1b.0: PCI INT A -> GSI 22 (level, low) -> IRQ 22
[    4.126863] HDA Intel 0000:00:1b.0: irq 48 for MSI/MSI-X
[    4.126911] HDA Intel 0000:00:1b.0: setting latency timer to 64
[    4.265865] rts_pstor: device scan complete


