upload=true&script=true&cardinfo=
!!################################
!!ALSA Information Script v 0.4.60
!!################################

!!Script ran on: Sun Feb 19 09:28:21 UTC 2012


!!Linux Distribution
!!------------------

Welcome to openSUSE 12.1 "Asparagus" - Kernel \r (\l). openSUSE 12.1 (x86_64) NAME=openSUSE PRETTY_NAME="openSUSE 12.1 (Asparagus) (x86_64)" ID=opensuse


!!DMI Information
!!---------------

Manufacturer:      LENOVO
Product Name:      3626W15
Product Version:   ThinkPad X201


!!Kernel Information
!!------------------

Kernel release:    3.1.9-1.4-desktop
Operating System:  GNU/Linux
Architecture:      x86_64
Processor:         x86_64
SMP Enabled:       Yes


!!ALSA Version
!!------------

Driver version:     1.0.24
Library version:    
Utilities version:  1.0.24.2


!!Loaded ALSA modules
!!-------------------

snd_hda_intel
thinkpad_acpi


!!Sound Servers on this system
!!----------------------------

Pulseaudio:
      Installed - Yes (/usr/bin/pulseaudio)
      Running - Yes


!!Soundcards recognised by ALSA
!!-----------------------------

 0 [Intel          ]: HDA-Intel - HDA Intel
                      HDA Intel at 0xf2520000 irq 44
29 [ThinkPadEC     ]: ThinkPad EC - ThinkPad Console Audio Control
                      ThinkPad Console Audio Control at EC reg 0x30, fw 6QHT33WW-1.14


!!PCI Soundcards installed in the system
!!--------------------------------------

00:1b.0 Audio device: Intel Corporation 5 Series/3400 Series Chipset High Definition Audio (rev 06)


!!Advanced information - PCI Vendor/Device/Subsystem ID's
!!--------------------------------------------------------

00:1b.0 0403: 8086:3b56 (rev 06)
	Subsystem: 17aa:215e


!!Loaded sound module options
!!--------------------------

!!Module: snd_hda_intel
	bdl_pos_adj : 1,-1,-1,-1,-1,-1,-1,-1,-1,-1,-1,-1,-1,-1,-1,-1,-1,-1,-1,-1,-1,-1,-1,-1,-1,-1,-1,-1,-1,-1,-1,-1
	beep_mode : 2,2,2,2,2,2,2,2,2,2,2,2,2,2,2,2,2,2,2,2,2,2,2,2,2,2,2,2,2,2,2,2
	enable : Y,Y,Y,Y,Y,Y,Y,Y,Y,Y,Y,Y,Y,Y,Y,Y,Y,Y,Y,Y,Y,Y,Y,Y,Y,Y,Y,Y,Y,Y,Y,Y
	enable_msi : -1
	id : (null),(null),(null),(null),(null),(null),(null),(null),(null),(null),(null),(null),(null),(null),(null),(null),(null),(null),(null),(null),(null),(null),(null),(null),(null),(null),(null),(null),(null),(null),(null),(null)
	index : -1,-1,-1,-1,-1,-1,-1,-1,-1,-1,-1,-1,-1,-1,-1,-1,-1,-1,-1,-1,-1,-1,-1,-1,-1,-1,-1,-1,-1,-1,-1,-1
	model : (null),(null),(null),(null),(null),(null),(null),(null),(null),(null),(null),(null),(null),(null),(null),(null),(null),(null),(null),(null),(null),(null),(null),(null),(null),(null),(null),(null),(null),(null),(null),(null)
	patch : (null),(null),(null),(null),(null),(null),(null),(null),(null),(null),(null),(null),(null),(null),(null),(null),(null),(null),(null),(null),(null),(null),(null),(null),(null),(null),(null),(null),(null),(null),(null),(null)
	position_fix : 0,0,0,0,0,0,0,0,0,0,0,0,0,0,0,0,0,0,0,0,0,0,0,0,0,0,0,0,0,0,0,0
	power_save : 0
	power_save_controller : Y
	probe_mask : -1,-1,-1,-1,-1,-1,-1,-1,-1,-1,-1,-1,-1,-1,-1,-1,-1,-1,-1,-1,-1,-1,-1,-1,-1,-1,-1,-1,-1,-1,-1,-1
	probe_only : 0,0,0,0,0,0,0,0,0,0,0,0,0,0,0,0,0,0,0,0,0,0,0,0,0,0,0,0,0,0,0,0
	single_cmd : N

!!Module: thinkpad_acpi
	brightness_enable : 2
	brightness_mode : 4
	enable : Y
	experimental : 1
	fan_control : N
	force_load : N
	hotkey_report_mode : 0
	id : ThinkPadEC
	index : -536870912
	volume_capabilities : 0
	volume_control : N
	volume_mode : 3


!!HDA-Intel Codec information
!!---------------------------
--startcollapse--

Codec: Conexant CX20585
Address: 0
AFG Function Id: 0x1 (unsol 1)
Vendor Id: 0x14f15069
Subsystem Id: 0x17aa2155
Revision Id: 0x100302
No Modem Function Group found
Default PCM:
    rates [0x160]: 44100 48000 96000
    bits [0xe]: 16 20 24
    formats [0x1]: PCM
Default Amp-In caps: N/A
Default Amp-Out caps: N/A
GPIO: io=4, o=0, i=0, unsolicited=1, wake=0
  IO[0]: enable=0, dir=0, wake=0, sticky=0, data=0, unsol=0
  IO[1]: enable=0, dir=0, wake=0, sticky=0, data=0, unsol=0
  IO[2]: enable=0, dir=0, wake=0, sticky=0, data=0, unsol=0
  IO[3]: enable=0, dir=0, wake=0, sticky=0, data=0, unsol=0
Node 0x10 [Audio Output] wcaps 0xc1d: Stereo Amp-Out R/L
  Control: name="Master Playback Volume", index=0, device=0
    ControlAmp: chs=3, dir=Out, idx=0, ofs=0
  Device: name="CONEXANT Analog", type="Audio", device=0
  Amp-Out caps: ofs=0x4a, nsteps=0x4a, stepsize=0x03, mute=1
  Amp-Out vals:  [0x32 0x32]
  Converter: stream=5, channel=0
  PCM:
    rates [0x560]: 44100 48000 96000 192000
    bits [0xe]: 16 20 24
    formats [0x1]: PCM
  Power states:  D0 D1 D2 D3 D3cold
  Power: setting=D0, actual=D0
Node 0x11 [Audio Output] wcaps 0xc1d: Stereo Amp-Out R/L
  Amp-Out caps: ofs=0x4a, nsteps=0x4a, stepsize=0x03, mute=1
  Amp-Out vals:  [0x3a 0x3a]
  Converter: stream=0, channel=0
  PCM:
    rates [0x560]: 44100 48000 96000 192000
    bits [0xe]: 16 20 24
    formats [0x1]: PCM
  Power states:  D0 D1 D2 D3 D3cold
  Power: setting=D0, actual=D0
Node 0x12 [Audio Output] wcaps 0x611: Stereo Digital
  Converter: stream=0, channel=0
  Digital:
  Digital category: 0x0
  PCM:
    rates [0x160]: 44100 48000 96000
    bits [0xe]: 16 20 24
    formats [0x5]: PCM AC3
  Power states:  D0 D1 D2 D3 D3cold
  Power: setting=D0, actual=D0
Node 0x13 [Beep Generator Widget] wcaps 0x70000c: Mono Amp-Out
  Control: name="Beep Playback Volume", index=0, device=0
    ControlAmp: chs=1, dir=Out, idx=0, ofs=0
  Control: name="Beep Playback Switch", index=0, device=0
    ControlAmp: chs=1, dir=Out, idx=0, ofs=0
  Amp-Out caps: ofs=0x07, nsteps=0x07, stepsize=0x0f, mute=0
  Amp-Out vals:  [0x00]
Node 0x14 [Audio Input] wcaps 0x100d1b: Stereo Amp-In R/L
  Device: name="CONEXANT Analog", type="Audio", device=0
  Amp-In caps: ofs=0x4a, nsteps=0x50, stepsize=0x03, mute=1
  Amp-In vals:  [0x50 0x50] [0x80 0x80] [0x50 0x50] [0x80 0x80]
  Converter: stream=1, channel=0
  SDI-Select: 0
  PCM:
    rates [0x160]: 44100 48000 96000
    bits [0xe]: 16 20 24
    formats [0x1]: PCM
  Power states:  D0 D1 D2 D3 D3cold
  Power: setting=D0, actual=D0
  Connection: 4
     0x17 0x18 0x23* 0x24
Node 0x15 [Audio Input] wcaps 0x100d1b: Stereo Amp-In R/L
  Amp-In caps: ofs=0x4a, nsteps=0x50, stepsize=0x03, mute=1
  Amp-In vals:  [0x80 0x80] [0x4a 0x4a] [0x4a 0x4a] [0x4a 0x4a]
  Converter: stream=0, channel=0
  SDI-Select: 0
  PCM:
    rates [0x160]: 44100 48000 96000
    bits [0xe]: 16 20 24
    formats [0x1]: PCM
  Power states:  D0 D1 D2 D3 D3cold
  Power: setting=D0, actual=D0
  Connection: 4
     0x17* 0x18 0x23 0x24
Node 0x16 [Audio Input] wcaps 0x100d1b: Stereo Amp-In R/L
  Amp-In caps: ofs=0x4a, nsteps=0x50, stepsize=0x03, mute=1
  Amp-In vals:  [0x80 0x80] [0x4a 0x4a] [0x4a 0x4a] [0x4a 0x4a]
  Converter: stream=0, channel=0
  SDI-Select: 0
  PCM:
    rates [0x160]: 44100 48000 96000
    bits [0xe]: 16 20 24
    formats [0x1]: PCM
  Power states:  D0 D1 D2 D3 D3cold
  Power: setting=D0, actual=D0
  Connection: 4
     0x17* 0x18 0x23 0x24
Node 0x17 [Audio Selector] wcaps 0x30050d: Stereo Amp-Out
  Amp-Out caps: ofs=0x00, nsteps=0x04, stepsize=0x27, mute=0
  Amp-Out vals:  [0x02 0x02]
  Power states:  D0 D1 D2 D3 D3cold
  Power: setting=D0, actual=D0
  Connection: 4
     0x1a 0x1b* 0x1d 0x1e
Node 0x18 [Audio Selector] wcaps 0x30050d: Stereo Amp-Out
  Amp-Out caps: ofs=0x00, nsteps=0x04, stepsize=0x27, mute=0
  Amp-Out vals:  [0x00 0x00]
  Power states:  D0 D1 D2 D3 D3cold
  Power: setting=D0, actual=D0
  Connection: 4
     0x1a* 0x1b 0x1d 0x1e
Node 0x19 [Pin Complex] wcaps 0x400581: Stereo
  Pincap 0x0000001c: OUT HP Detect
  Pin Default 0x042140f0: [Jack] HP Out at Ext Right
    Conn = 1/8, Color = Green
    DefAssociation = 0xf, Sequence = 0x0
  Pin-ctls: 0x00:
  Unsolicited: tag=37, enabled=1
  Power states:  D0 D1 D2 D3 D3cold
  Power: setting=D0, actual=D0
  Connection: 2
     0x10* 0x11
Node 0x1a [Pin Complex] wcaps 0x400481: Stereo
  Pincap 0x00001324: IN Detect
    Vref caps: HIZ 50 80
  Pin Default 0x61a190f0: [N/A] Mic at Sep Rear
    Conn = 1/8, Color = Pink
    DefAssociation = 0xf, Sequence = 0x0
  Pin-ctls: 0x00: VREF_HIZ
  Unsolicited: tag=38, enabled=1
  Power states:  D0 D1 D2 D3 D3cold
  Power: setting=D0, actual=D0
Node 0x1b [Pin Complex] wcaps 0x400581: Stereo
  Pincap 0x00011334: IN OUT EAPD Detect
    Vref caps: HIZ 50 80
  EAPD 0x2: EAPD
  Pin Default 0x04a190f0: [Jack] Mic at Ext Right
    Conn = 1/8, Color = Pink
    DefAssociation = 0xf, Sequence = 0x0
  Pin-ctls: 0x00: VREF_HIZ
  Unsolicited: tag=38, enabled=1
  Power states:  D0 D1 D2 D3 D3cold
  Power: setting=D0, actual=D0
  Connection: 2
     0x10* 0x11
Node 0x1c [Pin Complex] wcaps 0x400581: Stereo
  Pincap 0x00000014: OUT Detect
  Pin Default 0x612140f0: [N/A] HP Out at Sep Rear
    Conn = 1/8, Color = Green
    DefAssociation = 0xf, Sequence = 0x0
  Pin-ctls: 0x40: OUT
  Unsolicited: tag=37, enabled=1
  Power states:  D0 D1 D2 D3 D3cold
  Power: setting=D0, actual=D0
  Connection: 2
     0x10* 0x11
Node 0x1d [Pin Complex] wcaps 0x400581: Stereo
  Pincap 0x00010034: IN OUT EAPD Detect
  EAPD 0x2: EAPD
  Pin Default 0x601700f0: [N/A] Speaker at Sep N/A
    Conn = Analog, Color = Unknown
    DefAssociation = 0xf, Sequence = 0x0
  Pin-ctls: 0x20: IN
  Unsolicited: tag=00, enabled=0
  Power states:  D0 D1 D2 D3 D3cold
  Power: setting=D0, actual=D0
  Connection: 2
     0x10* 0x11
Node 0x1e [Pin Complex] wcaps 0x400481: Stereo
  Pincap 0x00000024: IN Detect
  Pin Default 0x40f001f0: [N/A] Other at Ext N/A
    Conn = Unknown, Color = Unknown
    DefAssociation = 0xf, Sequence = 0x0
    Misc = NO_PRESENCE
  Pin-ctls: 0x20: IN
  Unsolicited: tag=00, enabled=0
  Power states:  D0 D1 D2 D3 D3cold
  Power: setting=D0, actual=D0
Node 0x1f [Pin Complex] wcaps 0x400501: Stereo
  Pincap 0x00000010: OUT
  Pin Default 0x901701f0: [Fixed] Speaker at Int N/A
    Conn = Analog, Color = Unknown
    DefAssociation = 0xf, Sequence = 0x0
    Misc = NO_PRESENCE
  Pin-ctls: 0x00:
  Power states:  D0 D1 D2 D3 D3cold
  Power: setting=D0, actual=D0
  Connection: 2
     0x10* 0x11
Node 0x20 [Pin Complex] wcaps 0x400781: Stereo Digital
  Pincap 0x00000010: OUT
  Pin Default 0x40f001f0: [N/A] Other at Ext N/A
    Conn = Unknown, Color = Unknown
    DefAssociation = 0xf, Sequence = 0x0
    Misc = NO_PRESENCE
  Pin-ctls: 0x40: OUT
  Unsolicited: tag=00, enabled=0
  Power states:  D0 D1 D2 D3 D3cold
  Power: setting=D0, actual=D0
  Connection: 1
     0x12
Node 0x21 [Audio Output] wcaps 0x611: Stereo Digital
  Converter: stream=0, channel=0
  Digital:
  Digital category: 0x0
  PCM:
    rates [0x160]: 44100 48000 96000
    bits [0xe]: 16 20 24
    formats [0x5]: PCM AC3
  Power states:  D0 D1 D2 D3 D3cold
  Power: setting=D0, actual=D0
Node 0x22 [Pin Complex] wcaps 0x400781: Stereo Digital
  Pincap 0x00000010: OUT
  Pin Default 0x40f001f0: [N/A] Other at Ext N/A
    Conn = Unknown, Color = Unknown
    DefAssociation = 0xf, Sequence = 0x0
    Misc = NO_PRESENCE
  Pin-ctls: 0x40: OUT
  Unsolicited: tag=00, enabled=0
  Power states:  D0 D1 D2 D3 D3cold
  Power: setting=D0, actual=D0
  Connection: 1
     0x21
Node 0x23 [Pin Complex] wcaps 0x40040b: Stereo Amp-In
  Amp-In caps: ofs=0x00, nsteps=0x04, stepsize=0x2f, mute=0
  Amp-In vals:  [0x02 0x02]
  Pincap 0x00000020: IN
  Pin Default 0x90a601f0: [Fixed] Mic at Int N/A
    Conn = Digital, Color = Unknown
    DefAssociation = 0xf, Sequence = 0x0
    Misc = NO_PRESENCE
  Pin-ctls: 0x20: IN
  Power states:  D0 D1 D2 D3 D3cold
  Power: setting=D0, actual=D0
Node 0x24 [Audio Mixer] wcaps 0x20050b: Stereo Amp-In
  Amp-In caps: ofs=0x4a, nsteps=0x4a, stepsize=0x03, mute=1
  Amp-In vals:  [0x00 0x00] [0x00 0x00]
  Power states:  D0 D1 D2 D3 D3cold
  Power: setting=D0, actual=D0
  Connection: 2
     0x10 0x11
Node 0x25 [Vendor Defined Widget] wcaps 0xf00000: Mono
Codec: Intel IbexPeak HDMI
Address: 3
AFG Function Id: 0x1 (unsol 0)
Vendor Id: 0x80862804
Subsystem Id: 0x17aa21b5
Revision Id: 0x100000
No Modem Function Group found
Default PCM:
    rates [0x0]:
    bits [0x0]:
    formats [0x0]:
Default Amp-In caps: N/A
Default Amp-Out caps: N/A
GPIO: io=0, o=0, i=0, unsolicited=0, wake=0
Node 0x02 [Audio Output] wcaps 0x6611: 8-Channels Digital
  Converter: stream=8, channel=0
  Digital: Enabled GenLevel
  Digital category: 0x2
  PCM:
    rates [0x7f0]: 32000 44100 48000 88200 96000 176400 192000
    bits [0x1e]: 16 20 24 32
    formats [0x5]: PCM AC3
  Power states:  D0 D3
  Power: setting=D0, actual=D0
Node 0x03 [Audio Output] wcaps 0x6611: 8-Channels Digital
  Converter: stream=0, channel=0
  Digital: Enabled
  Digital category: 0x0
  PCM:
    rates [0x7f0]: 32000 44100 48000 88200 96000 176400 192000
    bits [0x1e]: 16 20 24 32
    formats [0x5]: PCM AC3
  Power states:  D0 D3
  Power: setting=D0, actual=D0
Node 0x04 [Pin Complex] wcaps 0x40778d: 8-Channels Digital Amp-Out CP
  Amp-Out caps: ofs=0x00, nsteps=0x00, stepsize=0x00, mute=1
  Amp-Out vals:  [0x00 0x80]
  Pincap 0x09000094: OUT Detect HBR HDMI DP
  Pin Default 0x58560010: [N/A] Digital Out at Int HDMI
    Conn = Digital, Color = Unknown
    DefAssociation = 0x1, Sequence = 0x0
  Pin-ctls: 0x40: OUT
  Unsolicited: tag=00, enabled=0
  Power states:  D0 D3
  Power: setting=D0, actual=D0
  Connection: 2
     0x02* 0x03
Node 0x05 [Pin Complex] wcaps 0x40778d: 8-Channels Digital Amp-Out CP
  Control: name="IEC958 Playback Con Mask", index=0, device=0
  Control: name="IEC958 Playback Pro Mask", index=0, device=0
  Control: name="IEC958 Playback Default", index=0, device=0
  Control: name="IEC958 Playback Switch", index=0, device=0
  Amp-Out caps: ofs=0x00, nsteps=0x00, stepsize=0x00, mute=1
  Amp-Out vals:  [0x00 0x00]
  Pincap 0x09000094: OUT Detect HBR HDMI DP
  Pin Default 0x18560020: [Jack] Digital Out at Int HDMI
    Conn = Digital, Color = Unknown
    DefAssociation = 0x2, Sequence = 0x0
  Pin-ctls: 0x00:
  Unsolicited: tag=05, enabled=1
  Power states:  D0 D3
  Power: setting=D0, actual=D0
  Connection: 2
     0x02* 0x03
Node 0x06 [Pin Complex] wcaps 0x40778d: 8-Channels Digital Amp-Out CP
  Amp-Out caps: ofs=0x00, nsteps=0x00, stepsize=0x00, mute=1
  Amp-Out vals:  [0x00 0x80]
  Pincap 0x09000094: OUT Detect HBR HDMI DP
  Pin Default 0x58560030: [N/A] Digital Out at Int HDMI
    Conn = Digital, Color = Unknown
    DefAssociation = 0x3, Sequence = 0x0
  Pin-ctls: 0x40: OUT
  Unsolicited: tag=00, enabled=0
  Power states:  D0 D3
  Power: setting=D0, actual=D0
  Connection: 2
     0x02* 0x03
Node 0x07 [Vendor Defined Widget] wcaps 0xf00000: Mono
--endcollapse--


!!ALSA Device nodes
!!-----------------

crw-rw----+ 1 root audio 116,  8 Feb 19 10:26 /dev/snd/controlC0
crw-rw----+ 1 root audio 116,  2 Feb 19 10:26 /dev/snd/controlC29
crw-rw----+ 1 root audio 116,  7 Feb 19 10:26 /dev/snd/hwC0D0
crw-rw----+ 1 root audio 116,  6 Feb 19 10:26 /dev/snd/hwC0D3
crw-rw----+ 1 root audio 116,  5 Feb 19 10:26 /dev/snd/pcmC0D0c
crw-rw----+ 1 root audio 116,  4 Feb 19 10:28 /dev/snd/pcmC0D0p
crw-rw----+ 1 root audio 116,  3 Feb 19 10:26 /dev/snd/pcmC0D3p
crw-rw----  1 root audio 116,  1 Feb 19 10:26 /dev/snd/seq
crw-rw----+ 1 root audio 116, 33 Feb 19 10:26 /dev/snd/timer

/dev/snd/by-path:
total 0
drwxr-xr-x 2 root root  80 Feb 19 10:26 .
drwxr-xr-x 3 root root 240 Feb 19 10:26 ..
lrwxrwxrwx 1 root root  12 Feb 19 10:26 pci-0000:00:1b.0 -> ../controlC0
lrwxrwxrwx 1 root root  13 Feb 19 10:26 platform-thinkpad_acpi -> ../controlC29


!!Aplay/Arecord output
!!------------

APLAY

**** List of PLAYBACK Hardware Devices ****
card 0: Intel [HDA Intel], device 0: CONEXANT Analog [CONEXANT Analog]
  Subdevices: 0/1
  Subdevice #0: subdevice #0
card 0: Intel [HDA Intel], device 3: HDMI 0 [HDMI 0]
  Subdevices: 1/1
  Subdevice #0: subdevice #0

ARECORD

**** List of CAPTURE Hardware Devices ****
card 0: Intel [HDA Intel], device 0: CONEXANT Analog [CONEXANT Analog]
  Subdevices: 1/1
  Subdevice #0: subdevice #0

!!Amixer output
!!-------------

!!-------Mixer controls for card 0 [Intel]

Card hw:0 'Intel'/'HDA Intel at 0xf2520000 irq 44'
  Mixer name	: 'Intel IbexPeak HDMI'
  Components	: 'HDA:14f15069,17aa2155,00100302 HDA:80862804,17aa21b5,00100000'
  Controls      : 12
  Simple ctrls  : 6
Simple mixer control 'Master',0
  Capabilities: pvolume pswitch pswitch-joined penum
  Playback channels: Front Left - Front Right
  Limits: Playback 0 - 74
  Mono:
  Front Left: Playback 50 [68%] [-24.00dB] [on]
  Front Right: Playback 50 [68%] [-24.00dB] [on]
Simple mixer control 'PCM',0
  Capabilities: pvolume penum
  Playback channels: Front Left - Front Right
  Limits: Playback 0 - 255
  Mono:
  Front Left: Playback 255 [100%] [0.00dB]
  Front Right: Playback 255 [100%] [0.00dB]
Simple mixer control 'IEC958',0
  Capabilities: pswitch pswitch-joined penum
  Playback channels: Mono
  Mono: Playback [on]
Simple mixer control 'Beep',0
  Capabilities: pvolume pvolume-joined pswitch pswitch-joined penum
  Playback channels: Mono
  Limits: Playback 0 - 7
  Mono: Playback 0 [0%] [-28.00dB] [on]
Simple mixer control 'Capture',0
  Capabilities: cvolume cswitch penum
  Capture channels: Front Left - Front Right
  Limits: Capture 0 - 80
  Front Left: Capture 80 [100%] [6.00dB] [on]
  Front Right: Capture 80 [100%] [6.00dB] [on]
Simple mixer control 'Analog Mic Boost',0
  Capabilities: cenum
  Items: '0dB' '10dB' '20dB' '30dB' '40dB'
  Item0: '20dB'

!!-------Mixer controls for card 29 [ThinkPadEC]

Card hw:29 'ThinkPadEC'/'ThinkPad Console Audio Control at EC reg 0x30, fw 6QHT33WW-1.14'
  Mixer name	: 'ThinkPad EC 6QHT33WW-1.14'
  Components	: ''
  Controls      : 1
  Simple ctrls  : 1
Simple mixer control 'Console',0
  Capabilities: pswitch pswitch-joined penum
  Playback channels: Mono
  Mono: Playback [on]


!!Alsactl output
!!-------------

--startcollapse--
state.Intel {
	control.1 {
		iface MIXER
		name 'Master Playback Volume'
		value.0 50
		value.1 50
		comment {
			access 'read write'
			type INTEGER
			count 2
			range '0 - 74'
			dbmin -7400
			dbmax 0
			dbvalue.0 -2400
			dbvalue.1 -2400
		}
	}
	control.2 {
		iface MIXER
		name 'Master Playback Switch'
		value true
		comment {
			access 'read write'
			type BOOLEAN
			count 1
		}
	}
	control.3 {
		iface MIXER
		name 'Analog Mic Boost Capture Enum'
		value '20dB'
		comment {
			access 'read write'
			type ENUMERATED
			count 1
			item.0 '0dB'
			item.1 '10dB'
			item.2 '20dB'
			item.3 '30dB'
			item.4 '40dB'
		}
	}
	control.4 {
		iface MIXER
		name 'Capture Volume'
		value.0 80
		value.1 80
		comment {
			access 'read write'
			type INTEGER
			count 2
			range '0 - 80'
			dbmin -7400
			dbmax 600
			dbvalue.0 600
			dbvalue.1 600
		}
	}
	control.5 {
		iface MIXER
		name 'Capture Switch'
		value.0 true
		value.1 true
		comment {
			access 'read write'
			type BOOLEAN
			count 2
		}
	}
	control.6 {
		iface MIXER
		name 'Beep Playback Volume'
		value 0
		comment {
			access 'read write'
			type INTEGER
			count 1
			range '0 - 7'
			dbmin -2800
			dbmax 0
			dbvalue.0 -2800
		}
	}
	control.7 {
		iface MIXER
		name 'Beep Playback Switch'
		value true
		comment {
			access 'read write'
			type BOOLEAN
			count 1
		}
	}
	control.8 {
		iface MIXER
		name 'IEC958 Playback Con Mask'
		value '0fff000000000000000000000000000000000000000000000000000000000000000000000000000000000000000000000000000000000000000000000000000000000000000000000000000000000000000000000000000000000000000000000000000000000000000000000000000000000000000000000000000000000000000000000000000000000000000000000000000000000000000000000000000000000000000000000000000000000000'
		comment {
			access read
			type IEC958
			count 1
		}
	}
	control.9 {
		iface MIXER
		name 'IEC958 Playback Pro Mask'
		value '0f00000000000000000000000000000000000000000000000000000000000000000000000000000000000000000000000000000000000000000000000000000000000000000000000000000000000000000000000000000000000000000000000000000000000000000000000000000000000000000000000000000000000000000000000000000000000000000000000000000000000000000000000000000000000000000000000000000000000000'
		comment {
			access read
			type IEC958
			count 1
		}
	}
	control.10 {
		iface MIXER
		name 'IEC958 Playback Default'
		value '0400000000000000000000000000000000000000000000000000000000000000000000000000000000000000000000000000000000000000000000000000000000000000000000000000000000000000000000000000000000000000000000000000000000000000000000000000000000000000000000000000000000000000000000000000000000000000000000000000000000000000000000000000000000000000000000000000000000000000'
		comment {
			access 'read write'
			type IEC958
			count 1
		}
	}
	control.11 {
		iface MIXER
		name 'IEC958 Playback Switch'
		value true
		comment {
			access 'read write'
			type BOOLEAN
			count 1
		}
	}
	control.12 {
		iface MIXER
		name 'PCM Playback Volume'
		value.0 255
		value.1 255
		comment {
			access 'read write user'
			type INTEGER
			count 2
			range '0 - 255'
			tlv '0000000100000008ffffec1400000014'
			dbmin -5100
			dbmax 0
			dbvalue.0 0
			dbvalue.1 0
		}
	}
}
state.ThinkPadEC {
	control.1 {
		iface MIXER
		name 'Console Playback Switch'
		value true
		comment {
			access read
			type BOOLEAN
			count 1
		}
	}
}
--endcollapse--


!!All Loaded Modules
!!------------------

Module
ip6t_LOG
af_packet
xt_tcpudp
xt_pkttype
ipt_LOG
xt_limit
vboxpci
vboxnetadp
vboxnetflt
vmsync
vmblock
vboxdrv
ip6t_REJECT
nf_conntrack_ipv6
nf_defrag_ipv6
ip6table_raw
xt_NOTRACK
ipt_REJECT
iptable_raw
iptable_filter
ip6table_mangle
nf_conntrack_netbios_ns
nf_conntrack_broadcast
nf_conntrack_ipv4
nf_defrag_ipv4
ip_tables
xt_conntrack
nf_conntrack
ip6table_filter
ip6_tables
x_tables
cpufreq_conservative
cpufreq_userspace
cpufreq_powersave
acpi_cpufreq
mperf
microcode
xts
gf128mul
dm_crypt
dm_mod
snd_hda_codec_hdmi
snd_hda_codec_conexant
arc4
sg
snd_hda_intel
joydev
iwlagn
snd_hda_codec
pcspkr
snd_hwdep
snd_pcm
mac80211
snd_timer
cfg80211
acpiphp
pci_hotplug
thinkpad_acpi
iTCO_wdt
snd
intel_ips
i2c_i801
soundcore
iTCO_vendor_support
rfkill
snd_page_alloc
ac
battery
wmi
mei
e1000e
autofs4
i915
thermal
drm_kms_helper
drm
i2c_algo_bit
processor
button
video
thermal_sys


!!Sysfs Files
!!-----------

/sys/class/sound/hwC0D0/init_pin_configs:
0x19 0x042140f0
0x1a 0x61a190f0
0x1b 0x04a190f0
0x1c 0x612140f0
0x1d 0x601700f0
0x1e 0x40f001f0
0x1f 0x901701f0
0x20 0x40f001f0
0x22 0x40f001f0
0x23 0x90a601f0

/sys/class/sound/hwC0D0/driver_pin_configs:

/sys/class/sound/hwC0D0/user_pin_configs:

/sys/class/sound/hwC0D0/init_verbs:

/sys/class/sound/hwC0D3/init_pin_configs:
0x04 0x58560010
0x05 0x18560020
0x06 0x58560030

/sys/class/sound/hwC0D3/driver_pin_configs:

/sys/class/sound/hwC0D3/user_pin_configs:

/sys/class/sound/hwC0D3/init_verbs:


!!ALSA/HDA dmesg
!!------------------

[    4.383440] intel ips 0000:00:1f.6: IPS driver initialized, MCP temp limit 90
[    4.383719] snd_hda_intel 0000:00:1b.0: PCI INT B -> GSI 17 (level, low) -> IRQ 17
[    4.383781] snd_hda_intel 0000:00:1b.0: irq 44 for MSI/MSI-X
[    4.383809] snd_hda_intel 0000:00:1b.0: setting latency timer to 64
[    4.408646] HDMI status: Codec=3 Pin=5 Presence_Detect=0 ELD_Valid=0
[    4.411771] input: HDA Intel HDMI/DP as /devices/pci0000:00/0000:00:1b.0/sound/card0/input9
[    4.416235] device-mapper: uevent: version 1.0.3
--
[    4.422745] ifup[690]: Service network not started and mode 'auto' -> skipping
[    4.427359] input: HDA Digital PCBeep as /devices/pci0000:00/0000:00:1b.0/input/input10
[    4.518995] bootsplash: status on console 0 changed to on
--
[   18.172314] boot.lvm[798]: ..done
[   18.255143] alsactl[811]: Found hardware: "HDA-Intel" "Intel IbexPeak HDMI" "HDA:14f15069,17aa2155,00100302 HDA:80862804,17aa21b5,00100000" "0x17aa" "0x215e"
[   18.255149] alsactl[811]: Hardware is initialized using a generic method


