Codec: Conexant CX20551 (Waikiki)
Address: 0
Vendor Id: 0x14f15047
Subsystem Id: 0x103c30a5
Revision Id: 0x100000
Modem Function Group: 0x2
Default PCM:
    rates [0x40]: 48000
    bits [0x2]: 16
    formats [0x1]: PCM
Default Amp-In caps: N/A
Default Amp-Out caps: N/A
GPIO: io=0, o=0, i=0, unsolicited=0, wake=0
Node 0x10 [Audio Output] wcaps 0x41d: Stereo Amp-Out
  Amp-Out caps: ofs=0x17, nsteps=0x1e, stepsize=0x05, mute=1
  Amp-Out vals:  [0x1b 0x1b]
  Converter: stream=0, channel=0
  PCM:
    rates [0x40]: 48000
    bits [0x2]: 16
    formats [0x1]: PCM
  Power: setting=D0, actual=D0
Node 0x11 [Audio Output] wcaps 0x611: Stereo Digital
  Converter: stream=0, channel=0
  Digital:
  Digital category: 0x0
  PCM:
    rates [0x40]: 48000
    bits [0x2]: 16
    formats [0x1]: PCM
  Power: setting=D0, actual=D0
Node 0x12 [Audio Input] wcaps 0x100d1b: Stereo Amp-In R/L
  Amp-In caps: ofs=0x00, nsteps=0x0e, stepsize=0x05, mute=1
  Amp-In vals:  [0x80 0x80] [0x80 0x80] [0x80 0x80] [0x00 0x00] [0x80 0x80] [0x80 0x80]
  Converter: stream=0, channel=0
  SDI-Select: 0
  PCM:
    rates [0x40]: 48000
    bits [0x2]: 16
    formats [0x1]: PCM
  Power: setting=D0, actual=D0
  Connection: 6
     0x19 0x14 0x15 0x1a* 0x16 0x10
Node 0x13 [Pin Complex] wcaps 0x40058d: Stereo Amp-Out
  Amp-Out caps: ofs=0x1f, nsteps=0x1e, stepsize=0x05, mute=1
  Amp-Out vals:  [0x0c 0x0c]
  Pincap 0x081001c: OUT HP EAPD Detect
  EAPD 0x2: EAPD
  Pin Default 0x92170110: [Fixed] Speaker at Int Front
    Conn = Analog, Color = Unknown
    DefAssociation = 0x1, Sequence = 0x0
    Misc = NO_PRESENCE
  Pin-ctls: 0x40: OUT
  Unsolicited: tag=37, enabled=1
  Power: setting=D0, actual=D0
  Connection: 3
     0x19* 0x10 0x16
Node 0x14 [Pin Complex] wcaps 0x40058d: Stereo Amp-Out
  Amp-Out caps: ofs=0x1f, nsteps=0x1e, stepsize=0x05, mute=1
  Amp-Out vals:  [0x1f 0x1f]
  Pincap 0x0833c: IN OUT HP Detect
    Vref caps: HIZ 50
  Pin Default 0x0221101f: [Jack] HP Out at Ext Front
    Conn = 1/8, Color = Black
    DefAssociation = 0x1, Sequence = 0xf
  Pin-ctls: 0x20: IN VREF_HIZ
  Unsolicited: tag=00, enabled=0
  Power: setting=D0, actual=D0
  Connection: 2
     0x19* 0x16
Node 0x15 [Pin Complex] wcaps 0x40058d: Stereo Amp-Out
  Amp-Out caps: ofs=0x1f, nsteps=0x1e, stepsize=0x05, mute=1
  Amp-Out vals:  [0x1f 0x1f]
  Pincap 0x0833c: IN OUT HP Detect
    Vref caps: HIZ 50
  Pin Default 0x02a1102e: [Jack] Mic at Ext Front
    Conn = 1/8, Color = Black
    DefAssociation = 0x2, Sequence = 0xe
  Pin-ctls: 0x21: IN VREF_50
  Unsolicited: tag=38, enabled=1
  Power: setting=D0, actual=D0
  Connection: 3
     0x1c 0x19* 0x16
Node 0x16 [Pin Complex] wcaps 0x400401: Stereo
  Pincap 0x0860: IN Balanced
  Pin Default 0x94330121: [Fixed] CD at Int Right
    Conn = ATAPI, Color = Unknown
    DefAssociation = 0x2, Sequence = 0x1
    Misc = NO_PRESENCE
  Pin-ctls: 0x20: IN
  Power: setting=D0, actual=D0
Node 0x17 [Pin Complex] wcaps 0x400481: Stereo
  Pincap 0x08324: IN Detect
    Vref caps: HIZ 50
  Pin Default 0x95a70122: [Fixed] Mic at Int Top
    Conn = Analog, Color = Unknown
    DefAssociation = 0x2, Sequence = 0x2
    Misc = NO_PRESENCE
  Pin-ctls: 0x21: IN VREF_50
  Unsolicited: tag=00, enabled=0
  Power: setting=D0, actual=D0
Node 0x18 [Pin Complex] wcaps 0x400701: Stereo Digital
  Pincap 0x0810: OUT
  Pin Default 0x04440131: [Jack] SPDIF Out at Ext Right
    Conn = RCA, Color = Unknown
    DefAssociation = 0x3, Sequence = 0x1
    Misc = NO_PRESENCE
  Pin-ctls: 0x00:
  Power: setting=D0, actual=D0
  Connection: 1
     0x11
Node 0x19 [Audio Mixer] wcaps 0x20050b: Stereo Amp-In
  Amp-In caps: ofs=0x17, nsteps=0x1e, stepsize=0x05, mute=1
  Amp-In vals:  [0x17 0x17] [0x80 0x80] [0x00 0x00] [0x17 0x17]
  Power: setting=D0, actual=D0
  Connection: 4
     0x10 0x1b 0x1a 0x16
Node 0x1a [Audio Selector] wcaps 0x30050d: Stereo Amp-Out
  Amp-Out caps: ofs=0x00, nsteps=0x03, stepsize=0x1f, mute=0
  Amp-Out vals:  [0x03 0x03]
  Power: setting=D0, actual=D0
  Connection: 3
     0x15 0x14 0x17*
Node 0x1b [Audio Selector] wcaps 0x300501: Stereo
  Power: setting=D0, actual=D0
  Connection: 2
     0x14* 0x15
Node 0x1c [Audio Output] wcaps 0x41d: Stereo Amp-Out
  Amp-Out caps: ofs=0x17, nsteps=0x1e, stepsize=0x05, mute=1
  Amp-Out vals:  [0x80 0x80]
  Converter: stream=0, channel=0
  PCM:
    rates [0x40]: 48000
    bits [0x2]: 16
    formats [0x1]: PCM
  Power: setting=D0, actual=D0
Node 0x1d [Pin Complex] wcaps 0x40058d: Stereo Amp-Out
  Amp-Out caps: ofs=0x1f, nsteps=0x1e, stepsize=0x05, mute=1
  Amp-Out vals:  [0x9f 0x9f]
  Pincap 0x08314: OUT Detect
    Vref caps: HIZ 50
  Pin Default 0x40100180: [N/A] Speaker at Ext N/A
    Conn = Unknown, Color = Unknown
    DefAssociation = 0x8, Sequence = 0x0
    Misc = NO_PRESENCE
  Pin-ctls: 0x40: OUT VREF_HIZ
  Unsolicited: tag=00, enabled=0
  Power: setting=D0, actual=D0
  Connection: 3
     0x1c 0x19* 0x16
Node 0x1e [Vendor Defined Widget] wcaps 0xf00000: Mono
