upload=true&script=true&cardinfo=
!!################################
!!ALSA Information Script v 0.4.58
!!################################

!!Script ran on: Wed Nov 11 19:24:24 UTC 2009


!!Linux Distribution
!!------------------

Arch Linux \r (\n) (\l)


!!DMI Information
!!---------------

Manufacturer:      Hewlett-Packard
Product Name:      HP Pavilion dv7 Notebook PC


!!Kernel Information
!!------------------

Kernel release:    2.6.31-ARCH
Operating System:  GNU/Linux
Architecture:      x86_64
Processor:         Intel(R) Core(TM)2 Duo CPU P8600 @ 2.40GHz
SMP Enabled:       Yes


!!ALSA Version
!!------------

Driver version:     1.0.21
Library version:    1.0.21a
Utilities version:  1.0.21


!!Loaded ALSA modules
!!-------------------

snd_hda_intel


!!Sound Servers on this system
!!----------------------------

Jack:
      Installed - Yes (/usr/bin/jackd)
      Running - No


!!Soundcards recognised by ALSA
!!-----------------------------

 0 [Intel          ]: HDA-Intel - HDA Intel
                      HDA Intel at 0xdf000000 irq 33


!!PCI Soundcards installed in the system
!!--------------------------------------

00:1b.0 Audio device: Intel Corporation 82801I (ICH9 Family) HD Audio Controller (rev 03)


!!Advanced information - PCI Vendor/Device/Susbsystem ID's
!!--------------------------------------------------------

00:1b.0 0403: 8086:293e (rev 03)
	Subsystem: 103c:30f4


!!Loaded sound module options
!!--------------------------

!!Module: snd_hda_intel
	bdl_pos_adj : 1,-1,-1,-1,-1,-1,-1,-1
	enable : Y,Y,Y,Y,Y,Y,Y,Y
	enable_msi : -1
	id : <NULL>,<NULL>,<NULL>,<NULL>,<NULL>,<NULL>,<NULL>,<NULL>
	index : -1,-1,-1,-1,-1,-1,-1,-1
	model : <NULL>,<NULL>,<NULL>,<NULL>,<NULL>,<NULL>,<NULL>,<NULL>
	patch : <NULL>,<NULL>,<NULL>,<NULL>,<NULL>,<NULL>,<NULL>,<NULL>
	position_fix : 0,0,0,0,0,0,0,0
	power_save : 0
	power_save_controller : Y
	probe_mask : -1,-1,-1,-1,-1,-1,-1,-1
	probe_only : N,N,N,N,N,N,N,N
	single_cmd : N


!!HDA-Intel Codec information
!!---------------------------
--startcollapse--

Codec: IDT 92HD71B7X
Address: 0
Function Id: 0x1
Vendor Id: 0x111d76b2
Subsystem Id: 0x103c30f6
Revision Id: 0x100302
No Modem Function Group found
Default PCM:
    rates [0x7e0]: 44100 48000 88200 96000 176400 192000
    bits [0xe]: 16 20 24
    formats [0x1]: PCM
Default Amp-In caps: ofs=0x00, nsteps=0x00, stepsize=0x00, mute=1
Default Amp-Out caps: ofs=0x7f, nsteps=0x7f, stepsize=0x02, mute=1
GPIO: io=8, o=0, i=0, unsolicited=1, wake=1
  IO[0]: enable=1, dir=1, wake=0, sticky=0, data=1, unsol=0
  IO[1]: enable=0, dir=0, wake=0, sticky=0, data=0, unsol=0
  IO[2]: enable=0, dir=0, wake=0, sticky=0, data=0, unsol=0
  IO[3]: enable=0, dir=0, wake=0, sticky=0, data=0, unsol=0
  IO[4]: enable=0, dir=0, wake=0, sticky=0, data=0, unsol=0
  IO[5]: enable=0, dir=0, wake=0, sticky=0, data=0, unsol=0
  IO[6]: enable=0, dir=0, wake=0, sticky=0, data=0, unsol=0
  IO[7]: enable=0, dir=0, wake=0, sticky=0, data=0, unsol=0
Power-Map: 0x01
Analog Loopback: 0x00
Node 0x0a [Pin Complex] wcaps 0x400181: Stereo
  Pincap 0x0000001c: OUT HP Detect
  Pin Default 0x0221401f: [Jack] HP Out at Ext Front
    Conn = 1/8, Color = Green
    DefAssociation = 0x1, Sequence = 0xf
  Pin-ctls: 0x00:
  Unsolicited: tag=01, enabled=1
  Connection: 3
     0x10 0x11* 0x17
Node 0x0b [Pin Complex] wcaps 0x400081: Stereo
  Pincap 0x00001724: IN Detect
    Vref caps: HIZ 50 GRD 80
  Pin Default 0x02a19020: [Jack] Mic at Ext Front
    Conn = 1/8, Color = Pink
    DefAssociation = 0x2, Sequence = 0x0
  Pin-ctls: 0x24: IN VREF_80
  Unsolicited: tag=02, enabled=1
Node 0x0c [Pin Complex] wcaps 0x400081: Stereo
  Pincap 0x00001724: IN Detect
    Vref caps: HIZ 50 GRD 80
  Pin Default 0x40f100f0: [N/A] Other at Ext N/A
    Conn = 1/8, Color = Unknown
    DefAssociation = 0xf, Sequence = 0x0
  Pin-ctls: 0x00: VREF_HIZ
  Unsolicited: tag=00, enabled=0
Node 0x0d [Pin Complex] wcaps 0x400181: Stereo
  Pincap 0x00000014: OUT Detect
  Pin Default 0x90170010: [Fixed] Speaker at Int N/A
    Conn = Analog, Color = Unknown
    DefAssociation = 0x1, Sequence = 0x0
  Pin-ctls: 0x40: OUT
  Unsolicited: tag=00, enabled=0
  Connection: 3
     0x10* 0x11 0x17
Node 0x0e [Pin Complex] wcaps 0x400081: Stereo
  Pincap 0x00001724: IN Detect
    Vref caps: HIZ 50 GRD 80
  Pin Default 0x40f100f2: [N/A] Other at Ext N/A
    Conn = 1/8, Color = Unknown
    DefAssociation = 0xf, Sequence = 0x2
  Pin-ctls: 0x00: VREF_HIZ
  Unsolicited: tag=00, enabled=0
Node 0x0f [Pin Complex] wcaps 0x400181: Stereo
  Pincap 0x00000014: OUT Detect
  Pin Default 0x40f100f7: [N/A] Other at Ext N/A
    Conn = 1/8, Color = Unknown
    DefAssociation = 0xf, Sequence = 0x7
  Pin-ctls: 0x00:
  Unsolicited: tag=00, enabled=0
  Connection: 3
     0x10* 0x11 0x17
Node 0x10 [Audio Output] wcaps 0xd0c05: Stereo Amp-Out R/L
  Amp-Out caps: N/A
  Amp-Out vals:  [0x63 0x63]
  Device: name="STAC92xx Analog", type="Audio", device=0, substream=0
  Converter: stream=0, channel=0
  Power: setting=D0, actual=D0
  Delay: 13 samples
Node 0x11 [Audio Output] wcaps 0xd0c05: Stereo Amp-Out R/L
  Amp-Out caps: N/A
  Amp-Out vals:  [0x63 0x63]
  Converter: stream=0, channel=0
  Power: setting=D0, actual=D0
  Delay: 13 samples
Node 0x12 [Audio Input] wcaps 0x1d0541: Stereo
  Device: name="STAC92xx Analog", type="Audio", device=0, substream=0
  Converter: stream=0, channel=0
  SDI-Select: 0
  Power: setting=D3, actual=D3
  Delay: 13 samples
  Connection: 1
     0x1c
  Processing caps: benign=0, ncoeff=0
Node 0x13 [Audio Input] wcaps 0x1d0541: Stereo
  Converter: stream=0, channel=0
  SDI-Select: 0
  Power: setting=D0, actual=D0
  Delay: 13 samples
  Connection: 1
     0x1d
  Processing caps: benign=0, ncoeff=0
Node 0x14 [Pin Complex] wcaps 0x400100: Mono
  Pincap 0x00000010: OUT
  Pin Default 0x40f100f3: [N/A] Other at Ext N/A
    Conn = 1/8, Color = Unknown
    DefAssociation = 0xf, Sequence = 0x3
  Pin-ctls: 0x00:
  Connection: 1
     0x16
Node 0x15 [Audio Selector] wcaps 0x300101: Stereo
  Connection: 3
     0x10* 0x11 0x17
Node 0x16 [Audio Mixer] wcaps 0x200100: Mono
  Connection: 1
     0x15
Node 0x17 [Audio Mixer] wcaps 0x20010b: Stereo Amp-In
  Amp-In caps: ofs=0x17, nsteps=0x1f, stepsize=0x05, mute=1
  Amp-In vals:  [0x97 0x97] [0x97 0x97] [0x97 0x97] [0x97 0x97] [0x97 0x97]
  Connection: 5
     0x10 0x11 0x27 0x1a 0x1b
Node 0x18 [Pin Complex] wcaps 0x40000d: Stereo Amp-Out
  Amp-Out caps: ofs=0x00, nsteps=0x03, stepsize=0x27, mute=0
  Amp-Out vals:  [0x00 0x00]
  Pincap 0x00000020: IN
  Pin Default 0x85a61150: [Fixed] Mic at Ext Top
    Conn = Digital, Color = Black
    DefAssociation = 0x5, Sequence = 0x0
    Misc = NO_PRESENCE
  Pin-ctls: 0x20: IN
Node 0x19 [Pin Complex] wcaps 0x40000d: Stereo Amp-Out
  Amp-Out caps: ofs=0x00, nsteps=0x03, stepsize=0x27, mute=0
  Amp-Out vals:  [0x00 0x00]
  Pincap 0x00000020: IN
  Pin Default 0x40f100f4: [N/A] Other at Ext N/A
    Conn = 1/8, Color = Unknown
    DefAssociation = 0xf, Sequence = 0x4
  Pin-ctls: 0x00:
Node 0x1a [Audio Selector] wcaps 0x30010d: Stereo Amp-Out
  Amp-Out caps: ofs=0x00, nsteps=0x03, stepsize=0x27, mute=0
  Amp-Out vals:  [0x00 0x00]
  Connection: 3
     0x0b* 0x0c 0x0e
Node 0x1b [Audio Selector] wcaps 0x30010d: Stereo Amp-Out
  Amp-Out caps: ofs=0x00, nsteps=0x03, stepsize=0x27, mute=0
  Amp-Out vals:  [0x00 0x00]
  Connection: 3
     0x0b* 0x0c 0x0e
Node 0x1c [Audio Selector] wcaps 0x30090d: Stereo Amp-Out R/L
  Amp-Out caps: ofs=0x00, nsteps=0x0f, stepsize=0x05, mute=1
  Amp-Out vals:  [0x09 0x09]
  Connection: 4
     0x1a 0x17 0x18* 0x19
Node 0x1d [Audio Selector] wcaps 0x30090d: Stereo Amp-Out R/L
  Amp-Out caps: ofs=0x00, nsteps=0x0f, stepsize=0x05, mute=1
  Amp-Out vals:  [0x80 0x80]
  Connection: 4
     0x1b* 0x17 0x18 0x19
Node 0x1e [Pin Complex] wcaps 0x400301: Stereo Digital
  Pincap 0x00000010: OUT
  Pin Default 0x014411a0: [Jack] SPDIF Out at Ext Rear
    Conn = RCA, Color = Black
    DefAssociation = 0xa, Sequence = 0x0
    Misc = NO_PRESENCE
  Pin-ctls: 0x40: OUT
  Connection: 1
     0x24
Node 0x1f [Pin Complex] wcaps 0x400701: Stereo Digital
  Pincap 0x00010010: OUT EAPD
  EAPD 0x0:
  Pin Default 0x40f100f5: [N/A] Other at Ext N/A
    Conn = 1/8, Color = Unknown
    DefAssociation = 0xf, Sequence = 0x5
  Pin-ctls: 0x00:
  Power: setting=D0, actual=D0
  Connection: 2
     0x24* 0x25
Node 0x20 [Pin Complex] wcaps 0x400301: Stereo Digital
  Pincap 0x00000010: OUT
  Pin Default 0x40f100f6: [N/A] Other at Ext N/A
    Conn = 1/8, Color = Unknown
    DefAssociation = 0xf, Sequence = 0x6
  Pin-ctls: 0x00:
  Connection: 1
     0x25
Node 0x21 [Audio Output] wcaps 0x40211: Stereo Digital
  Device: name="STAC92xx Digital", type="SPDIF", device=1, substream=0
  Converter: stream=0, channel=0
  Digital: Enabled
  Digital category: 0x0
  PCM:
    rates [0x7e0]: 44100 48000 88200 96000 176400 192000
    bits [0xe]: 16 20 24
    formats [0x5]: PCM AC3
  Delay: 4 samples
Node 0x22 [Audio Output] wcaps 0x40211: Stereo Digital
  Converter: stream=0, channel=0
  Digital: Enabled
  Digital category: 0x0
  PCM:
    rates [0x7e0]: 44100 48000 88200 96000 176400 192000
    bits [0xe]: 16 20 24
    formats [0x5]: PCM AC3
  Delay: 4 samples
Node 0x23 [Vendor Defined Widget] wcaps 0xf00000: Mono
Node 0x24 [Audio Selector] wcaps 0x300101: Stereo
  Connection: 3
     0x21* 0x1c 0x1d
Node 0x25 [Audio Selector] wcaps 0x300101: Stereo
  Connection: 3
     0x22* 0x1c 0x1d
Node 0x26 [Beep Generator Widget] wcaps 0x70000c: Mono Amp-Out
  Amp-Out caps: ofs=0x03, nsteps=0x03, stepsize=0x17, mute=1
  Amp-Out vals:  [0x00]
Node 0x27 [Pin Complex] wcaps 0x400000: Mono
  Pincap 0x00000020: IN
  Pin Default 0x40f100f8: [N/A] Other at Ext N/A
    Conn = 1/8, Color = Unknown
    DefAssociation = 0xf, Sequence = 0x8
  Pin-ctls: 0x00:
Node 0x28 [Volume Knob Widget] wcaps 0x600000: Mono
  Volume-Knob: delta=1, steps=127, direct=1, val=127
  Connection: 2
     0x10 0x11
Codec: Nvidia MCP78 HDMI
Address: 2
Function Id: 0x1
Vendor Id: 0x10de0006
Subsystem Id: 0x10de0101
Revision Id: 0x100000
No Modem Function Group found
Default PCM:
    rates [0x0]:
    bits [0x0]:
    formats [0x0]:
Default Amp-In caps: N/A
Default Amp-Out caps: N/A
GPIO: io=0, o=0, i=0, unsolicited=0, wake=0
Node 0x04 [Audio Output] wcaps 0x211: Stereo Digital
  Device: name="NVIDIA HDMI", type="HDMI", device=3, substream=0
  Converter: stream=0, channel=0
  Digital: Enabled
  Digital category: 0x0
  PCM:
    rates [0xc0]: 48000 88200
    bits [0xf]: 8 16 20 24
    formats [0x1]: PCM
Node 0x05 [Pin Complex] wcaps 0x400381: Stereo Digital
  Pincap 0x00000014: OUT Detect
  Pin Default 0x18560110: [Jack] Digital Out at Int HDMI
    Conn = Digital, Color = Unknown
    DefAssociation = 0x1, Sequence = 0x0
    Misc = NO_PRESENCE
  Pin-ctls: 0x40: OUT
  Unsolicited: tag=00, enabled=0
  Connection: 1
     0x04
Node 0x06 [Audio Output] wcaps 0x211: Stereo Digital
  Converter: stream=0, channel=0
  Digital:
  Digital category: 0x0
  PCM:
    rates [0xc0]: 48000 88200
    bits [0xf]: 8 16 20 24
    formats [0x1]: PCM
Node 0x07 [Pin Complex] wcaps 0x400381: Stereo Digital
  Pincap 0x00000014: OUT Detect
  Pin Default 0x58560121: [N/A] Digital Out at Int HDMI
    Conn = Digital, Color = Unknown
    DefAssociation = 0x2, Sequence = 0x1
    Misc = NO_PRESENCE
  Pin-ctls: 0x40: OUT
  Unsolicited: tag=00, enabled=0
  Connection: 1
     0x06
Node 0x08 [Audio Output] wcaps 0x211: Stereo Digital
  Converter: stream=0, channel=0
  Digital:
  Digital category: 0x0
  PCM:
    rates [0xc0]: 48000 88200
    bits [0xf]: 8 16 20 24
    formats [0x1]: PCM
Node 0x09 [Pin Complex] wcaps 0x400381: Stereo Digital
  Pincap 0x00000014: OUT Detect
  Pin Default 0x58560122: [N/A] Digital Out at Int HDMI
    Conn = Digital, Color = Unknown
    DefAssociation = 0x2, Sequence = 0x2
    Misc = NO_PRESENCE
  Pin-ctls: 0x40: OUT
  Unsolicited: tag=00, enabled=0
  Connection: 1
     0x08
Node 0x0a [Audio Output] wcaps 0x211: Stereo Digital
  Converter: stream=0, channel=0
  Digital:
  Digital category: 0x0
  PCM:
    rates [0xc0]: 48000 88200
    bits [0xf]: 8 16 20 24
    formats [0x1]: PCM
Node 0x0b [Pin Complex] wcaps 0x400381: Stereo Digital
  Pincap 0x00000014: OUT Detect
  Pin Default 0x58560123: [N/A] Digital Out at Int HDMI
    Conn = Digital, Color = Unknown
    DefAssociation = 0x2, Sequence = 0x3
    Misc = NO_PRESENCE
  Pin-ctls: 0x40: OUT
  Unsolicited: tag=00, enabled=0
  Connection: 1
     0x0a
Node 0x0c [Audio Output] wcaps 0x211: Stereo Digital
  Converter: stream=0, channel=0
  Digital:
  Digital category: 0x0
  PCM:
    rates [0xc0]: 48000 88200
    bits [0xf]: 8 16 20 24
    formats [0x1]: PCM
Node 0x0d [Pin Complex] wcaps 0x400381: Stereo Digital
  Pincap 0x00000014: OUT Detect
  Pin Default 0x58560124: [N/A] Digital Out at Int HDMI
    Conn = Digital, Color = Unknown
    DefAssociation = 0x2, Sequence = 0x4
    Misc = NO_PRESENCE
  Pin-ctls: 0x40: OUT
  Unsolicited: tag=00, enabled=0
  Connection: 1
     0x0c
--endcollapse--


!!ALSA Device nodes
!!-----------------

crw-rw---- 1 root audio 116,  0 Nov 11 20:23 /dev/snd/controlC0
crw-rw---- 1 root audio 116,  4 Nov 11 20:23 /dev/snd/hwC0D0
crw-rw---- 1 root audio 116,  6 Nov 11 20:23 /dev/snd/hwC0D2
crw-rw---- 1 root audio 116, 24 Nov 11 20:23 /dev/snd/pcmC0D0c
crw-rw---- 1 root audio 116, 16 Nov 11 20:24 /dev/snd/pcmC0D0p
crw-rw---- 1 root audio 116, 17 Nov 11 20:23 /dev/snd/pcmC0D1p
crw-rw---- 1 root audio 116, 19 Nov 11 20:23 /dev/snd/pcmC0D3p
crw-rw---- 1 root audio 116,  1 Nov 11 20:23 /dev/snd/seq
crw-rw---- 1 root audio 116, 33 Nov 11 20:23 /dev/snd/timer

/dev/snd/by-path:
total 0
drwxr-xr-x 2 root root  60 Nov 11 20:23 .
drwxr-xr-x 3 root root 240 Nov 11 20:23 ..
lrwxrwxrwx 1 root root  12 Nov 11 20:23 pci-0000:00:1b.0 -> ../controlC0


!!Aplay/Arecord output
!!------------

APLAY

**** List of PLAYBACK Hardware Devices ****
card 0: Intel [HDA Intel], device 0: STAC92xx Analog [STAC92xx Analog]
  Subdevices: 1/1
  Subdevice #0: subdevice #0
card 0: Intel [HDA Intel], device 1: STAC92xx Digital [STAC92xx Digital]
  Subdevices: 1/1
  Subdevice #0: subdevice #0
card 0: Intel [HDA Intel], device 3: NVIDIA HDMI [NVIDIA HDMI]
  Subdevices: 1/1
  Subdevice #0: subdevice #0

ARECORD

**** List of CAPTURE Hardware Devices ****
card 0: Intel [HDA Intel], device 0: STAC92xx Analog [STAC92xx Analog]
  Subdevices: 1/1
  Subdevice #0: subdevice #0

!!Amixer output
!!-------------

!!-------Mixer controls for card 0 [Intel]

Card hw:0 'Intel'/'HDA Intel at 0xdf000000 irq 33'
  Mixer name	: 'Nvidia MCP78 HDMI'
  Components	: 'HDA:111d76b2,103c30f6,00100302 HDA:10de0006,10de0101,00100000'
  Controls      : 25
  Simple ctrls  : 14
Simple mixer control 'Master',0
  Capabilities: pvolume pvolume-joined pswitch pswitch-joined
  Playback channels: Mono
  Limits: Playback 0 - 64
  Mono: Playback 36 [56%] [-21.00dB] [on]
Simple mixer control 'Headphone',0
  Capabilities: pvolume pswitch
  Playback channels: Front Left - Front Right
  Limits: Playback 0 - 64
  Mono:
  Front Left: Playback 64 [100%] [0.00dB] [on]
  Front Right: Playback 64 [100%] [0.00dB] [on]
Simple mixer control 'Speaker',0
  Capabilities: pvolume pswitch
  Playback channels: Front Left - Front Right
  Limits: Playback 0 - 64
  Mono:
  Front Left: Playback 64 [100%] [0.00dB] [on]
  Front Right: Playback 64 [100%] [0.00dB] [on]
Simple mixer control 'PCM',0
  Capabilities: pvolume
  Playback channels: Front Left - Front Right
  Limits: Playback 0 - 255
  Mono:
  Front Left: Playback 255 [100%] [0.00dB]
  Front Right: Playback 255 [100%] [0.00dB]
Simple mixer control 'Mic Jack Mode',0
  Capabilities: enum
  Items: 'Mic In' 'Line In'
  Item0: 'Mic In'
Simple mixer control 'IEC958',0
  Capabilities: pswitch pswitch-joined
  Playback channels: Mono
  Mono: Playback [on]
Simple mixer control 'IEC958 Default PCM',0
  Capabilities: pswitch pswitch-joined
  Playback channels: Mono
  Mono: Playback [on]
Simple mixer control 'IEC958 Playback Source',0
  Capabilities: enum
  Items: 'Digital Playback' 'Analog Mux 1' 'Analog Mux 2'
  Item0: 'Digital Playback'
Simple mixer control 'IEC958',1
  Capabilities: pswitch pswitch-joined
  Playback channels: Mono
  Mono: Playback [on]
Simple mixer control 'Beep',0
  Capabilities: pvolume pvolume-joined pswitch pswitch-joined
  Playback channels: Mono
  Limits: Playback 0 - 3
  Mono: Playback 0 [0%] [-18.00dB] [on]
Simple mixer control 'Capture',0
  Capabilities: cvolume cswitch
  Capture channels: Front Left - Front Right
  Limits: Capture 0 - 15
  Front Left: Capture 9 [60%] [13.50dB] [on]
  Front Right: Capture 9 [60%] [13.50dB] [on]
Simple mixer control 'Digital',0
  Capabilities: cvolume
  Capture channels: Front Left - Front Right
  Limits: Capture 0 - 120
  Front Left: Capture 60 [50%] [0.00dB]
  Front Right: Capture 60 [50%] [0.00dB]
Simple mixer control 'Digital Mic',0
  Capabilities: cvolume
  Capture channels: Front Left - Front Right
  Limits: Capture 0 - 3
  Front Left: Capture 0 [0%] [0.00dB]
  Front Right: Capture 0 [0%] [0.00dB]
Simple mixer control 'Mux',0
  Capabilities: cvolume
  Capture channels: Front Left - Front Right
  Limits: Capture 0 - 3
  Front Left: Capture 0 [0%] [0.00dB]
  Front Right: Capture 0 [0%] [0.00dB]


!!Alsactl output
!!-------------

--startcollapse--
state.Intel {
	control.1 {
		comment.access 'read write'
		comment.type INTEGER
		comment.count 2
		comment.range '0 - 64'
		comment.dbmin -4800
		comment.dbmax 0
		iface MIXER
		name 'Speaker Playback Volume'
		value.0 64
		value.1 64
	}
	control.2 {
		comment.access 'read write'
		comment.type BOOLEAN
		comment.count 2
		iface MIXER
		name 'Speaker Playback Switch'
		value.0 true
		value.1 true
	}
	control.3 {
		comment.access 'read write'
		comment.type ENUMERATED
		comment.count 1
		comment.item.0 'Mic In'
		comment.item.1 'Line In'
		iface MIXER
		name 'Mic Jack Mode'
		value 'Mic In'
	}
	control.4 {
		comment.access 'read write'
		comment.type BOOLEAN
		comment.count 1
		iface MIXER
		name 'Beep Playback Switch'
		value true
	}
	control.5 {
		comment.access 'read write'
		comment.type INTEGER
		comment.count 1
		comment.range '0 - 3'
		comment.dbmin -1800
		comment.dbmax 0
		iface MIXER
		name 'Beep Playback Volume'
		value 0
	}
	control.6 {
		comment.access 'read write'
		comment.type INTEGER
		comment.count 2
		comment.range '0 - 64'
		comment.dbmin -4800
		comment.dbmax 0
		iface MIXER
		name 'Headphone Playback Volume'
		value.0 64
		value.1 64
	}
	control.7 {
		comment.access 'read write'
		comment.type BOOLEAN
		comment.count 2
		iface MIXER
		name 'Headphone Playback Switch'
		value.0 true
		value.1 true
	}
	control.8 {
		comment.access 'read write'
		comment.type INTEGER
		comment.count 2
		comment.range '0 - 15'
		comment.dbmin 0
		comment.dbmax 2250
		iface MIXER
		name 'Capture Volume'
		value.0 9
		value.1 9
	}
	control.9 {
		comment.access 'read write'
		comment.type BOOLEAN
		comment.count 2
		iface MIXER
		name 'Capture Switch'
		value.0 true
		value.1 true
	}
	control.10 {
		comment.access 'read write'
		comment.type INTEGER
		comment.count 2
		comment.range '0 - 3'
		comment.dbmin 0
		comment.dbmax 3000
		iface MIXER
		name 'Digital Mic Capture Volume'
		value.0 0
		value.1 0
	}
	control.11 {
		comment.access 'read write'
		comment.type INTEGER
		comment.count 2
		comment.range '0 - 3'
		comment.dbmin 0
		comment.dbmax 3000
		iface MIXER
		name 'Mux Capture Volume'
		value.0 0
		value.1 0
	}
	control.12 {
		comment.access 'read write'
		comment.type ENUMERATED
		comment.count 1
		comment.item.0 'Digital Playback'
		comment.item.1 'Analog Mux 1'
		comment.item.2 'Analog Mux 2'
		iface MIXER
		name 'IEC958 Playback Source'
		value 'Digital Playback'
	}
	control.13 {
		comment.access read
		comment.type IEC958
		comment.count 1
		iface MIXER
		name 'IEC958 Playback Con Mask'
		value '0fff000000000000000000000000000000000000000000000000000000000000000000000000000000000000000000000000000000000000000000000000000000000000000000000000000000000000000000000000000000000000000000000000000000000000000000000000000000000000000000000000000000000000000000000000000000000000000000000000000000000000000000000000000000000000000000000000000000000000'
	}
	control.14 {
		comment.access read
		comment.type IEC958
		comment.count 1
		iface MIXER
		name 'IEC958 Playback Pro Mask'
		value '0f00000000000000000000000000000000000000000000000000000000000000000000000000000000000000000000000000000000000000000000000000000000000000000000000000000000000000000000000000000000000000000000000000000000000000000000000000000000000000000000000000000000000000000000000000000000000000000000000000000000000000000000000000000000000000000000000000000000000000'
	}
	control.15 {
		comment.access 'read write'
		comment.type IEC958
		comment.count 1
		iface MIXER
		name 'IEC958 Playback Default'
		value '0400000000000000000000000000000000000000000000000000000000000000000000000000000000000000000000000000000000000000000000000000000000000000000000000000000000000000000000000000000000000000000000000000000000000000000000000000000000000000000000000000000000000000000000000000000000000000000000000000000000000000000000000000000000000000000000000000000000000000'
	}
	control.16 {
		comment.access 'read write'
		comment.type BOOLEAN
		comment.count 1
		iface MIXER
		name 'IEC958 Playback Switch'
		value true
	}
	control.17 {
		comment.access 'read write'
		comment.type BOOLEAN
		comment.count 1
		iface MIXER
		name 'IEC958 Default PCM Playback Switch'
		value true
	}
	control.18 {
		comment.access 'read write'
		comment.type INTEGER
		comment.count 1
		comment.range '0 - 64'
		comment.dbmin -4800
		comment.dbmax 0
		iface MIXER
		name 'Master Playback Volume'
		value 36
	}
	control.19 {
		comment.access 'read write'
		comment.type BOOLEAN
		comment.count 1
		iface MIXER
		name 'Master Playback Switch'
		value true
	}
	control.20 {
		comment.access read
		comment.type IEC958
		comment.count 1
		iface MIXER
		name 'IEC958 Playback Con Mask'
		index 1
		value '0fff000000000000000000000000000000000000000000000000000000000000000000000000000000000000000000000000000000000000000000000000000000000000000000000000000000000000000000000000000000000000000000000000000000000000000000000000000000000000000000000000000000000000000000000000000000000000000000000000000000000000000000000000000000000000000000000000000000000000'
	}
	control.21 {
		comment.access read
		comment.type IEC958
		comment.count 1
		iface MIXER
		name 'IEC958 Playback Pro Mask'
		index 1
		value '0f00000000000000000000000000000000000000000000000000000000000000000000000000000000000000000000000000000000000000000000000000000000000000000000000000000000000000000000000000000000000000000000000000000000000000000000000000000000000000000000000000000000000000000000000000000000000000000000000000000000000000000000000000000000000000000000000000000000000000'
	}
	control.22 {
		comment.access 'read write'
		comment.type IEC958
		comment.count 1
		iface MIXER
		name 'IEC958 Playback Default'
		index 1
		value '0400000000000000000000000000000000000000000000000000000000000000000000000000000000000000000000000000000000000000000000000000000000000000000000000000000000000000000000000000000000000000000000000000000000000000000000000000000000000000000000000000000000000000000000000000000000000000000000000000000000000000000000000000000000000000000000000000000000000000'
	}
	control.23 {
		comment.access 'read write'
		comment.type BOOLEAN
		comment.count 1
		iface MIXER
		name 'IEC958 Playback Switch'
		index 1
		value true
	}
	control.24 {
		comment.access 'read write user'
		comment.type INTEGER
		comment.count 2
		comment.range '0 - 255'
		comment.tlv '0000000100000008ffffec1400000014'
		comment.dbmin -5100
		comment.dbmax 0
		iface MIXER
		name 'PCM Playback Volume'
		value.0 255
		value.1 255
	}
	control.25 {
		comment.access 'read write user'
		comment.type INTEGER
		comment.count 2
		comment.range '0 - 120'
		comment.tlv '0000000100000008fffff44800000032'
		comment.dbmin -3000
		comment.dbmax 3000
		iface MIXER
		name 'Digital Capture Volume'
		value.0 60
		value.1 60
	}
}
--endcollapse--


!!All Loaded Modules
!!------------------

Module
ipv6
ext3
jbd
usbhid
hid
snd_seq_dummy
snd_seq_oss
snd_seq_midi_event
snd_seq
snd_seq_device
snd_pcm_oss
snd_mixer_oss
snd_hda_codec_nvhdmi
snd_hda_codec_idt
joydev
fan
snd_hda_intel
snd_hda_codec
snd_hwdep
snd_pcm
uvcvideo
videodev
v4l1_compat
v4l2_compat_ioctl32
sdhci_pci
hp_accel
lis3lv02d
video
output
snd_timer
snd
soundcore
snd_page_alloc
sdhci
nvidia
input_polldev
wmi
psmouse
thermal
battery
mmc_core
led_class
r8169
mii
button
ac
iTCO_wdt
iTCO_vendor_support
serio_raw
rt3070sta
ohci1394
sg
i2c_i801
i2c_core
ieee1394
jmb38x_ms
memstick
sr_mod
cdrom
intel_agp
evdev
uhci_hcd
ehci_hcd
usbcore
acpi_cpufreq
freq_table
processor
rtc_cmos
rtc_core
rtc_lib
ext4
mbcache
jbd2
crc16
raid0
raid1
md_mod
uvesafb
cn
sd_mod
ahci
libata
scsi_mod


!!Sysfs Files
!!-----------

/sys/class/sound/hwC0D0/init_pin_configs:
0x0a 0x0221401f
0x0b 0x02a19020
0x0c 0x40f100f0
0x0d 0x90171110
0x0e 0x40f100f2
0x0f 0x40f100f7
0x14 0x40f100f3
0x18 0x85a61150
0x19 0x40f100f4
0x1e 0x014411a0
0x1f 0x40f100f5
0x20 0x40f100f6
0x27 0x40f100f8

/sys/class/sound/hwC0D0/driver_pin_configs:
0x0d 0x90170010

/sys/class/sound/hwC0D0/user_pin_configs:

/sys/class/sound/hwC0D0/init_verbs:

/sys/class/sound/hwC0D2/init_pin_configs:
0x05 0x18560110
0x07 0x58560121
0x09 0x58560122
0x0b 0x58560123
0x0d 0x58560124

/sys/class/sound/hwC0D2/driver_pin_configs:

/sys/class/sound/hwC0D2/user_pin_configs:

/sys/class/sound/hwC0D2/init_verbs:


!!ALSA/HDA dmesg
!!------------------

lis3lv02d driver loaded.
HDA Intel 0000:00:1b.0: power state changed by ACPI to D0
HDA Intel 0000:00:1b.0: PCI INT B -> GSI 22 (level, low) -> IRQ 22
HDA Intel 0000:00:1b.0: irq 33 for MSI/MSI-X
HDA Intel 0000:00:1b.0: setting latency timer to 64
fan PNP0C0B:00: registered as cooling_device3
--
NVRM: loading NVIDIA UNIX x86_64 Kernel Module  190.42  Tue Oct 20 20:25:42 PDT 2009
input: HDA Digital PCBeep as /devices/pci0000:00/0000:00:1b.0/input/input9
input: HDA Intel Mic at Ext Front Jack as /devices/pci0000:00/0000:00:1b.0/sound/card0/input10
input: HDA Intel HP Out at Ext Front Jack as /devices/pci0000:00/0000:00:1b.0/sound/card0/input11
ieee1394: Host added: ID:BUS[0-00:1023]  GUID[913f020087f640d9]


