upload=true&script=true&cardinfo=
!!################################
!!ALSA Information Script v 0.4.58
!!################################

!!Script ran on: Fri Mar 11 20:39:21 UTC 2011


!!Linux Distribution
!!------------------

Welcome to openSUSE 11.3 "Teal" - Kernel \r (\l). openSUSE 11.3 (x86_64)


!!DMI Information
!!---------------

Manufacturer:      AMD
Product Name:      To Be Filled By O.E.M.


!!Kernel Information
!!------------------

Kernel release:    2.6.38-rc2test+
Operating System:  GNU/Linux
Architecture:      x86_64
Processor:         x86_64
SMP Enabled:       Yes


!!ALSA Version
!!------------

Driver version:     1.0.24
Library version:    1.0.23
Utilities version:  1.0.23


!!Loaded ALSA modules
!!-------------------

snd_hda_intel
snd_hda_intel


!!Sound Servers on this system
!!----------------------------

Pulseaudio:
      Installed - Yes (/usr/bin/pulseaudio)
      Running - Yes

ESound Daemon:
      Installed - Yes (/usr/bin/esd)
      Running - No


!!Soundcards recognised by ALSA
!!-----------------------------

 0 [SB             ]: HDA-Intel - HDA ATI SB
                      HDA ATI SB at 0xfe6f8000 irq 16
 1 [HDMI           ]: HDA-Intel - HDA ATI HDMI
                      HDA ATI HDMI at 0xfe8e8000 irq 19


!!PCI Soundcards installed in the system
!!--------------------------------------

00:14.2 Audio device: ATI Technologies Inc SBx00 Azalia (Intel HDA) (rev 40)
01:05.1 Audio device: ATI Technologies Inc RS880 Audio Device [Radeon HD 4200]


!!Advanced information - PCI Vendor/Device/Susbsystem ID's
!!--------------------------------------------------------

00:14.2 0403: 1002:4383 (rev 40)
	Subsystem: 1002:4383
--
01:05.1 0403: 1002:970f
	Subsystem: 1002:970f


!!Loaded sound module options
!!--------------------------

!!Module: snd_hda_intel
	bdl_pos_adj : 32,32,-1,-1,-1,-1,-1,-1,-1,-1,-1,-1,-1,-1,-1,-1,-1,-1,-1,-1,-1,-1,-1,-1,-1,-1,-1,-1,-1,-1,-1,-1
	beep_mode : 2,2,2,2,2,2,2,2,2,2,2,2,2,2,2,2,2,2,2,2,2,2,2,2,2,2,2,2,2,2,2,2
	enable : Y,Y,Y,Y,Y,Y,Y,Y,Y,Y,Y,Y,Y,Y,Y,Y,Y,Y,Y,Y,Y,Y,Y,Y,Y,Y,Y,Y,Y,Y,Y,Y
	enable_msi : -1
	id : (null),(null),(null),(null),(null),(null),(null),(null),(null),(null),(null),(null),(null),(null),(null),(null),(null),(null),(null),(null),(null),(null),(null),(null),(null),(null),(null),(null),(null),(null),(null),(null)
	index : -1,-1,-1,-1,-1,-1,-1,-1,-1,-1,-1,-1,-1,-1,-1,-1,-1,-1,-1,-1,-1,-1,-1,-1,-1,-1,-1,-1,-1,-1,-1,-1
	model : (null),(null),(null),(null),(null),(null),(null),(null),(null),(null),(null),(null),(null),(null),(null),(null),(null),(null),(null),(null),(null),(null),(null),(null),(null),(null),(null),(null),(null),(null),(null),(null)
	patch : (null),(null),(null),(null),(null),(null),(null),(null),(null),(null),(null),(null),(null),(null),(null),(null),(null),(null),(null),(null),(null),(null),(null),(null),(null),(null),(null),(null),(null),(null),(null),(null)
	position_fix : 0,0,0,0,0,0,0,0,0,0,0,0,0,0,0,0,0,0,0,0,0,0,0,0,0,0,0,0,0,0,0,0
	power_save : 0
	power_save_controller : Y
	probe_mask : -1,-1,-1,-1,-1,-1,-1,-1,-1,-1,-1,-1,-1,-1,-1,-1,-1,-1,-1,-1,-1,-1,-1,-1,-1,-1,-1,-1,-1,-1,-1,-1
	probe_only : 0,0,0,0,0,0,0,0,0,0,0,0,0,0,0,0,0,0,0,0,0,0,0,0,0,0,0,0,0,0,0,0
	single_cmd : N

!!Module: snd_hda_intel
	bdl_pos_adj : 32,32,-1,-1,-1,-1,-1,-1,-1,-1,-1,-1,-1,-1,-1,-1,-1,-1,-1,-1,-1,-1,-1,-1,-1,-1,-1,-1,-1,-1,-1,-1
	beep_mode : 2,2,2,2,2,2,2,2,2,2,2,2,2,2,2,2,2,2,2,2,2,2,2,2,2,2,2,2,2,2,2,2
	enable : Y,Y,Y,Y,Y,Y,Y,Y,Y,Y,Y,Y,Y,Y,Y,Y,Y,Y,Y,Y,Y,Y,Y,Y,Y,Y,Y,Y,Y,Y,Y,Y
	enable_msi : -1
	id : (null),(null),(null),(null),(null),(null),(null),(null),(null),(null),(null),(null),(null),(null),(null),(null),(null),(null),(null),(null),(null),(null),(null),(null),(null),(null),(null),(null),(null),(null),(null),(null)
	index : -1,-1,-1,-1,-1,-1,-1,-1,-1,-1,-1,-1,-1,-1,-1,-1,-1,-1,-1,-1,-1,-1,-1,-1,-1,-1,-1,-1,-1,-1,-1,-1
	model : (null),(null),(null),(null),(null),(null),(null),(null),(null),(null),(null),(null),(null),(null),(null),(null),(null),(null),(null),(null),(null),(null),(null),(null),(null),(null),(null),(null),(null),(null),(null),(null)
	patch : (null),(null),(null),(null),(null),(null),(null),(null),(null),(null),(null),(null),(null),(null),(null),(null),(null),(null),(null),(null),(null),(null),(null),(null),(null),(null),(null),(null),(null),(null),(null),(null)
	position_fix : 0,0,0,0,0,0,0,0,0,0,0,0,0,0,0,0,0,0,0,0,0,0,0,0,0,0,0,0,0,0,0,0
	power_save : 0
	power_save_controller : Y
	probe_mask : -1,-1,-1,-1,-1,-1,-1,-1,-1,-1,-1,-1,-1,-1,-1,-1,-1,-1,-1,-1,-1,-1,-1,-1,-1,-1,-1,-1,-1,-1,-1,-1
	probe_only : 0,0,0,0,0,0,0,0,0,0,0,0,0,0,0,0,0,0,0,0,0,0,0,0,0,0,0,0,0,0,0,0
	single_cmd : N


!!HDA-Intel Codec information
!!---------------------------
--startcollapse--

Codec: IDT 92HD75B3X5
Address: 0
AFG Function Id: 0x1 (unsol 1)
Vendor Id: 0x111d7603
Subsystem Id: 0x00000100
Revision Id: 0x100101
No Modem Function Group found
Default PCM:
    rates [0x7e0]: 44100 48000 88200 96000 176400 192000
    bits [0xe]: 16 20 24
    formats [0x1]: PCM
Default Amp-In caps: ofs=0x00, nsteps=0x00, stepsize=0x00, mute=1
Default Amp-Out caps: ofs=0x7f, nsteps=0x7f, stepsize=0x02, mute=1
GPIO: io=8, o=0, i=0, unsolicited=1, wake=1
  IO[0]: enable=1, dir=1, wake=0, sticky=0, data=1, unsol=0
  IO[1]: enable=0, dir=0, wake=0, sticky=0, data=0, unsol=0
  IO[2]: enable=0, dir=0, wake=0, sticky=0, data=0, unsol=0
  IO[3]: enable=0, dir=0, wake=0, sticky=0, data=0, unsol=0
  IO[4]: enable=0, dir=0, wake=0, sticky=0, data=0, unsol=0
  IO[5]: enable=0, dir=0, wake=0, sticky=0, data=0, unsol=0
  IO[6]: enable=0, dir=0, wake=0, sticky=0, data=0, unsol=0
  IO[7]: enable=0, dir=0, wake=0, sticky=0, data=0, unsol=0
Power-Map: 0x00
Analog Loopback: 0x00
Node 0x0a [Pin Complex] wcaps 0x400181: Stereo
  Pincap 0x0000001c: OUT HP Detect
  Pin Default 0x02214030: [Jack] HP Out at Ext Front
    Conn = 1/8, Color = Green
    DefAssociation = 0x3, Sequence = 0x0
  Pin-ctls: 0x00:
  Unsolicited: tag=01, enabled=1
  Connection: 3
     0x10 0x11* 0x17
Node 0x0b [Pin Complex] wcaps 0x400081: Stereo
  Control: name="Front Mic Jack Mode", index=0, device=0
    ControlAmp: chs=0, dir=In, idx=0, ofs=0
  Pincap 0x00001724: IN Detect
    Vref caps: HIZ 50 GRD 80
  Pin Default 0x02a19040: [Jack] Mic at Ext Front
    Conn = 1/8, Color = Pink
    DefAssociation = 0x4, Sequence = 0x0
  Pin-ctls: 0x24: IN VREF_80
  Unsolicited: tag=02, enabled=1
Node 0x0c [Pin Complex] wcaps 0x400081: Stereo
  Control: name="Rear Mic Jack Mode", index=0, device=0
    ControlAmp: chs=0, dir=In, idx=0, ofs=0
  Pincap 0x00001724: IN Detect
    Vref caps: HIZ 50 GRD 80
  Pin Default 0x01a19020: [Jack] Mic at Ext Rear
    Conn = 1/8, Color = Pink
    DefAssociation = 0x2, Sequence = 0x0
  Pin-ctls: 0x24: IN VREF_80
  Unsolicited: tag=03, enabled=1
Node 0x0d [Pin Complex] wcaps 0x400181: Stereo
  Pincap 0x00000014: OUT Detect
  Pin Default 0x01014010: [Jack] Line Out at Ext Rear
    Conn = 1/8, Color = Green
    DefAssociation = 0x1, Sequence = 0x0
  Pin-ctls: 0x40: OUT
  Unsolicited: tag=00, enabled=0
  Connection: 3
     0x10* 0x11 0x17
Node 0x0e [Pin Complex] wcaps 0x400081: Stereo
  Control: name="Line Jack Mode", index=0, device=0
    ControlAmp: chs=0, dir=In, idx=0, ofs=0
  Pincap 0x00001724: IN Detect
    Vref caps: HIZ 50 GRD 80
  Pin Default 0x0181302e: [Jack] Line In at Ext Rear
    Conn = 1/8, Color = Blue
    DefAssociation = 0x2, Sequence = 0xe
  Pin-ctls: 0x20: IN VREF_HIZ
  Unsolicited: tag=04, enabled=1
Node 0x0f [Pin Complex] wcaps 0x400181: Stereo
  Pincap 0x00000014: OUT Detect
  Pin Default 0x40f000f0: [N/A] Other at Ext N/A
    Conn = Unknown, Color = Unknown
    DefAssociation = 0xf, Sequence = 0x0
  Pin-ctls: 0x00:
  Unsolicited: tag=00, enabled=0
  Connection: 3
     0x10* 0x11 0x17
Node 0x10 [Audio Output] wcaps 0xd0c05: Stereo Amp-Out R/L
  Control: name="Front Playback Volume", index=0, device=0
    ControlAmp: chs=3, dir=Out, idx=0, ofs=63
  Control: name="Front Playback Switch", index=0, device=0
    ControlAmp: chs=3, dir=Out, idx=0, ofs=0
  Device: name="STAC92xx Analog", type="Audio", device=0
  Amp-Out caps: N/A
  Amp-Out vals:  [0x80 0x80]
  Converter: stream=5, channel=0
  Power: setting=D0, actual=D0
  Delay: 13 samples
Node 0x11 [Audio Output] wcaps 0xd0c05: Stereo Amp-Out R/L
  Control: name="Headphone Playback Volume", index=0, device=0
    ControlAmp: chs=3, dir=Out, idx=0, ofs=63
  Control: name="Headphone Playback Switch", index=0, device=0
    ControlAmp: chs=3, dir=Out, idx=0, ofs=0
  Amp-Out caps: N/A
  Amp-Out vals:  [0x80 0x80]
  Converter: stream=5, channel=0
  Power: setting=D0, actual=D0
  Delay: 13 samples
Node 0x12 [Audio Input] wcaps 0x1d0541: Stereo
  Device: name="STAC92xx Analog", type="Audio", device=0
  Converter: stream=1, channel=0
  SDI-Select: 0
  Power: setting=D3, actual=D3
  Delay: 13 samples
  Connection: 1
     0x1c
  Processing caps: benign=0, ncoeff=0
Node 0x13 [Audio Input] wcaps 0x1d0541: Stereo
  Converter: stream=0, channel=0
  SDI-Select: 0
  Power: setting=D3, actual=D3
  Delay: 13 samples
  Connection: 1
     0x1d
  Processing caps: benign=0, ncoeff=0
Node 0x14 [Pin Complex] wcaps 0x400100: Mono
  Pincap 0x00000030: IN OUT
  Pin Default 0x40f000f0: [N/A] Other at Ext N/A
    Conn = Unknown, Color = Unknown
    DefAssociation = 0xf, Sequence = 0x0
  Pin-ctls: 0x00:
  Connection: 1
     0x16
Node 0x15 [Audio Selector] wcaps 0x300101: Stereo
  Connection: 3
     0x10* 0x11 0x17
Node 0x16 [Audio Mixer] wcaps 0x200100: Mono
  Connection: 1
     0x15
Node 0x17 [Audio Mixer] wcaps 0x20010b: Stereo Amp-In
  Amp-In caps: ofs=0x17, nsteps=0x1f, stepsize=0x05, mute=1
  Amp-In vals:  [0x97 0x97] [0x97 0x97] [0x97 0x97] [0x97 0x97] [0x97 0x97]
  Connection: 5
     0x10 0x11 0x14 0x1a 0x1b
Node 0x18 [Pin Complex] wcaps 0x40000b: Stereo Amp-In
  Control: name="Internal Mic Capture Volume", index=0, device=0
    ControlAmp: chs=3, dir=In, idx=0, ofs=0
  Amp-In caps: ofs=0x00, nsteps=0x03, stepsize=0x27, mute=0
  Amp-In vals:  [0x03 0x03]
  Pincap 0x00000020: IN
  Pin Default 0x90a70141: [Fixed] Mic at Int N/A
    Conn = Analog, Color = Unknown
    DefAssociation = 0x4, Sequence = 0x1
    Misc = NO_PRESENCE
  Pin-ctls: 0x20: IN
Node 0x19 [Pin Complex] wcaps 0x40000b: Stereo Amp-In
  Control: name="Internal Mic Capture Volume", index=1, device=0
    ControlAmp: chs=3, dir=In, idx=0, ofs=0
  Amp-In caps: ofs=0x00, nsteps=0x03, stepsize=0x27, mute=0
  Amp-In vals:  [0x00 0x00]
  Pincap 0x00000020: IN
  Pin Default 0x90a70142: [Fixed] Mic at Int N/A
    Conn = Analog, Color = Unknown
    DefAssociation = 0x4, Sequence = 0x2
    Misc = NO_PRESENCE
  Pin-ctls: 0x20: IN
Node 0x1a [Audio Selector] wcaps 0x30010d: Stereo Amp-Out
  Control: name="Mux Capture Volume", index=0, device=0
    ControlAmp: chs=3, dir=Out, idx=0, ofs=0
  Amp-Out caps: ofs=0x00, nsteps=0x03, stepsize=0x27, mute=0
  Amp-Out vals:  [0x00 0x00]
  Connection: 3
     0x0b 0x0c 0x0e*
Node 0x1b [Audio Selector] wcaps 0x30010d: Stereo Amp-Out
  Control: name="Mux Capture Volume", index=1, device=0
    ControlAmp: chs=3, dir=Out, idx=0, ofs=0
  Amp-Out caps: ofs=0x00, nsteps=0x03, stepsize=0x27, mute=0
  Amp-Out vals:  [0x00 0x00]
  Connection: 3
     0x0b* 0x0c 0x0e
Node 0x1c [Audio Selector] wcaps 0x30090d: Stereo Amp-Out R/L
  Control: name="Capture Volume", index=0, device=0
    ControlAmp: chs=3, dir=Out, idx=0, ofs=0
  Control: name="Capture Switch", index=0, device=0
    ControlAmp: chs=3, dir=Out, idx=0, ofs=0
  Amp-Out caps: ofs=0x00, nsteps=0x0f, stepsize=0x05, mute=1
  Amp-Out vals:  [0x01 0x01]
  Connection: 4
     0x1a* 0x17 0x18 0x19
Node 0x1d [Audio Selector] wcaps 0x30090d: Stereo Amp-Out R/L
  Control: name="Capture Volume", index=1, device=0
    ControlAmp: chs=3, dir=Out, idx=0, ofs=0
  Control: name="Capture Switch", index=1, device=0
    ControlAmp: chs=3, dir=Out, idx=0, ofs=0
  Amp-Out caps: ofs=0x00, nsteps=0x0f, stepsize=0x05, mute=1
  Amp-Out vals:  [0x80 0x80]
  Connection: 4
     0x1b* 0x17 0x18 0x19
Node 0x1e [Pin Complex] wcaps 0x400301: Stereo Digital
  Pincap 0x00000010: OUT
  Pin Default 0x01452050: [Jack] SPDIF Out at Ext Rear
    Conn = Optical, Color = Grey
    DefAssociation = 0x5, Sequence = 0x0
  Pin-ctls: 0x40: OUT
  Connection: 1
     0x24
Node 0x1f [Pin Complex] wcaps 0x400701: Stereo Digital
  Pincap 0x00010010: OUT EAPD
  EAPD 0x0:
  Pin Default 0x98560060: [Fixed] Digital Out at Int HDMI
    Conn = Digital, Color = Unknown
    DefAssociation = 0x6, Sequence = 0x0
  Pin-ctls: 0x00:
  Power: setting=D0, actual=D0
  Connection: 2
     0x24* 0x25
Node 0x20 [Pin Complex] wcaps 0x400301: Stereo Digital
  Pincap 0x00000010: OUT
  Pin Default 0x40f000f0: [N/A] Other at Ext N/A
    Conn = Unknown, Color = Unknown
    DefAssociation = 0xf, Sequence = 0x0
  Pin-ctls: 0x00:
  Connection: 1
     0x25
Node 0x21 [Audio Output] wcaps 0x40211: Stereo Digital
  Control: name="IEC958 Playback Con Mask", index=0, device=0
  Control: name="IEC958 Playback Pro Mask", index=0, device=0
  Control: name="IEC958 Playback Default", index=0, device=0
  Control: name="IEC958 Playback Switch", index=0, device=0
  Control: name="IEC958 Default PCM Playback Switch", index=0, device=0
  Device: name="STAC92xx Digital", type="SPDIF", device=1
  Converter: stream=5, channel=0
  Digital:
  Digital category: 0x0
  PCM:
    rates [0x7e0]: 44100 48000 88200 96000 176400 192000
    bits [0xe]: 16 20 24
    formats [0x5]: PCM AC3
  Delay: 4 samples
Node 0x22 [Audio Output] wcaps 0x40211: Stereo Digital
  Converter: stream=5, channel=0
  Digital:
  Digital category: 0x0
  PCM:
    rates [0x7e0]: 44100 48000 88200 96000 176400 192000
    bits [0xe]: 16 20 24
    formats [0x5]: PCM AC3
  Delay: 4 samples
Node 0x23 [Vendor Defined Widget] wcaps 0xf00000: Mono
Node 0x24 [Audio Selector] wcaps 0x300101: Stereo
  Connection: 3
     0x21* 0x1c 0x1d
Node 0x25 [Audio Selector] wcaps 0x300101: Stereo
  Connection: 3
     0x22* 0x1c 0x1d
Node 0x26 [Beep Generator Widget] wcaps 0x70000c: Mono Amp-Out
  Control: name="Beep Playback Switch", index=0, device=0
    ControlAmp: chs=1, dir=Out, idx=0, ofs=0
  Control: name="Beep Playback Volume", index=0, device=0
    ControlAmp: chs=1, dir=Out, idx=0, ofs=0
  Amp-Out caps: ofs=0x03, nsteps=0x03, stepsize=0x17, mute=1
  Amp-Out vals:  [0x00]
Node 0x27 [Volume Knob Widget] wcaps 0x600000: Mono
  Volume-Knob: delta=1, steps=127, direct=0, val=127
  Connection: 2
     0x10 0x11
Codec: Realtek ALC889
Address: 3
AFG Function Id: 0x1 (unsol 1)
Vendor Id: 0x10ec0889
Subsystem Id: 0x10ec0889
Revision Id: 0x100004
No Modem Function Group found
Default PCM:
    rates [0x5f0]: 32000 44100 48000 88200 96000 192000
    bits [0xe]: 16 20 24
    formats [0x1]: PCM
Default Amp-In caps: N/A
Default Amp-Out caps: N/A
GPIO: io=2, o=0, i=0, unsolicited=1, wake=1
  IO[0]: enable=1, dir=1, wake=0, sticky=0, data=1, unsol=0
  IO[1]: enable=0, dir=0, wake=0, sticky=0, data=0, unsol=0
Node 0x02 [Audio Output] wcaps 0x11: Stereo
  Converter: stream=0, channel=0
  PCM:
    rates [0x5e0]: 44100 48000 88200 96000 192000
    bits [0xe]: 16 20 24
    formats [0x1]: PCM
Node 0x03 [Audio Output] wcaps 0x11: Stereo
  Converter: stream=0, channel=0
  PCM:
    rates [0x5e0]: 44100 48000 88200 96000 192000
    bits [0xe]: 16 20 24
    formats [0x1]: PCM
Node 0x04 [Audio Output] wcaps 0x11: Stereo
  Converter: stream=0, channel=0
  PCM:
    rates [0x5e0]: 44100 48000 88200 96000 192000
    bits [0xe]: 16 20 24
    formats [0x1]: PCM
Node 0x05 [Audio Output] wcaps 0x11: Stereo
  Converter: stream=0, channel=0
  PCM:
    rates [0x5e0]: 44100 48000 88200 96000 192000
    bits [0xe]: 16 20 24
    formats [0x1]: PCM
Node 0x06 [Audio Output] wcaps 0x211: Stereo Digital
  Converter: stream=0, channel=0
  Digital:
  Digital category: 0x0
  PCM:
    rates [0x5f0]: 32000 44100 48000 88200 96000 192000
    bits [0xe]: 16 20 24
    formats [0x1]: PCM
Node 0x07 [Audio Input] wcaps 0x10011b: Stereo Amp-In
  Amp-In caps: ofs=0x10, nsteps=0x2e, stepsize=0x03, mute=1
  Amp-In vals:  [0x80 0x80]
  Converter: stream=0, channel=0
  SDI-Select: 0
  PCM:
    rates [0x5e0]: 44100 48000 88200 96000 192000
    bits [0xe]: 16 20 24
    formats [0x1]: PCM
  Connection: 1
     0x24
Node 0x08 [Audio Input] wcaps 0x10011b: Stereo Amp-In
  Amp-In caps: ofs=0x10, nsteps=0x2e, stepsize=0x03, mute=1
  Amp-In vals:  [0x00 0x00]
  Converter: stream=0, channel=0
  SDI-Select: 0
  PCM:
    rates [0x5e0]: 44100 48000 88200 96000 192000
    bits [0xe]: 16 20 24
    formats [0x1]: PCM
  Connection: 1
     0x23
Node 0x09 [Audio Input] wcaps 0x10011b: Stereo Amp-In
  Amp-In caps: ofs=0x10, nsteps=0x2e, stepsize=0x03, mute=1
  Amp-In vals:  [0x00 0x00]
  Converter: stream=0, channel=0
  SDI-Select: 0
  PCM:
    rates [0x5e0]: 44100 48000 88200 96000 192000
    bits [0xe]: 16 20 24
    formats [0x1]: PCM
  Connection: 1
     0x22
Node 0x0a [Audio Input] wcaps 0x100391: Stereo Digital
  Converter: stream=0, channel=0
  SDI-Select: 0
  Digital:
  Digital category: 0x0
  PCM:
    rates [0x570]: 32000 44100 48000 96000 192000
    bits [0xe]: 16 20 24
    formats [0x1]: PCM
  Unsolicited: tag=00, enabled=0
  Connection: 1
     0x1f
Node 0x0b [Audio Mixer] wcaps 0x20010b: Stereo Amp-In
  Amp-In caps: ofs=0x17, nsteps=0x1f, stepsize=0x05, mute=1
  Amp-In vals:  [0x97 0x97] [0x97 0x97] [0x97 0x97] [0x97 0x97] [0x97 0x97] [0x97 0x97] [0x97 0x97] [0x97 0x97] [0x97 0x97] [0x97 0x97]
  Connection: 10
     0x18 0x19 0x1a 0x1b 0x1c 0x1d 0x14 0x15 0x16 0x17
Node 0x0c [Audio Mixer] wcaps 0x20010f: Stereo Amp-In Amp-Out
  Amp-In caps: ofs=0x00, nsteps=0x00, stepsize=0x00, mute=1
  Amp-In vals:  [0x00 0x00] [0x00 0x00]
  Amp-Out caps: ofs=0x3e, nsteps=0x40, stepsize=0x03, mute=0
  Amp-Out vals:  [0x00 0x00]
  Connection: 2
     0x02 0x0b
Node 0x0d [Audio Mixer] wcaps 0x20010f: Stereo Amp-In Amp-Out
  Amp-In caps: ofs=0x00, nsteps=0x00, stepsize=0x00, mute=1
  Amp-In vals:  [0x00 0x00] [0x00 0x00]
  Amp-Out caps: ofs=0x3e, nsteps=0x40, stepsize=0x03, mute=0
  Amp-Out vals:  [0x00 0x00]
  Connection: 2
     0x03 0x0b
Node 0x0e [Audio Mixer] wcaps 0x20010f: Stereo Amp-In Amp-Out
  Amp-In caps: ofs=0x00, nsteps=0x00, stepsize=0x00, mute=1
  Amp-In vals:  [0x00 0x00] [0x00 0x00]
  Amp-Out caps: ofs=0x3e, nsteps=0x40, stepsize=0x03, mute=0
  Amp-Out vals:  [0x00 0x00]
  Connection: 2
     0x04 0x0b
Node 0x0f [Audio Mixer] wcaps 0x20010f: Stereo Amp-In Amp-Out
  Amp-In caps: ofs=0x00, nsteps=0x00, stepsize=0x00, mute=1
  Amp-In vals:  [0x00 0x00] [0x00 0x00]
  Amp-Out caps: ofs=0x3e, nsteps=0x40, stepsize=0x03, mute=0
  Amp-Out vals:  [0x00 0x00]
  Connection: 2
     0x05 0x0b
Node 0x10 [Audio Output] wcaps 0x211: Stereo Digital
  Converter: stream=0, channel=0
  Digital:
  Digital category: 0x0
  PCM:
    rates [0x5f0]: 32000 44100 48000 88200 96000 192000
    bits [0xe]: 16 20 24
    formats [0x1]: PCM
Node 0x11 [Pin Complex] wcaps 0x400300: Mono Digital
  Pincap 0x00000010: OUT
  Pin Default 0x414471f0: [N/A] SPDIF Out at Ext Rear
    Conn = RCA, Color = Yellow
    DefAssociation = 0xf, Sequence = 0x0
    Misc = NO_PRESENCE
  Pin-ctls: 0x00:
  Connection: 1
     0x10
Node 0x12 [Pin Complex] wcaps 0x400001: Stereo
  Pincap 0x00000020: IN
  Pin Default 0x59a3112e: [N/A] Mic at Int ATAPI
    Conn = ATAPI, Color = Black
    DefAssociation = 0x2, Sequence = 0xe
    Misc = NO_PRESENCE
  Pin-ctls: 0x00:
Node 0x13 [Vendor Defined Widget] wcaps 0xf00000: Mono
Node 0x14 [Pin Complex] wcaps 0x40018d: Stereo Amp-Out
  Amp-Out caps: ofs=0x00, nsteps=0x00, stepsize=0x00, mute=1
  Amp-Out vals:  [0x00 0x00]
  Pincap 0x0001003c: IN OUT HP EAPD Detect
  EAPD 0x0:
  Pin Default 0x01014010: [Jack] Line Out at Ext Rear
    Conn = 1/8, Color = Green
    DefAssociation = 0x1, Sequence = 0x0
  Pin-ctls: 0x00:
  Unsolicited: tag=00, enabled=0
  Connection: 5
     0x0c* 0x0d 0x0e 0x0f 0x26
Node 0x15 [Pin Complex] wcaps 0x40018d: Stereo Amp-Out
  Amp-Out caps: ofs=0x00, nsteps=0x00, stepsize=0x00, mute=1
  Amp-Out vals:  [0x00 0x00]
  Pincap 0x0001003c: IN OUT HP EAPD Detect
  EAPD 0x0:
  Pin Default 0x01011014: [Jack] Line Out at Ext Rear
    Conn = 1/8, Color = Black
    DefAssociation = 0x1, Sequence = 0x4
  Pin-ctls: 0x00:
  Unsolicited: tag=00, enabled=0
  Connection: 5
     0x0c 0x0d* 0x0e 0x0f 0x26
Node 0x16 [Pin Complex] wcaps 0x40018d: Stereo Amp-Out
  Amp-Out caps: ofs=0x00, nsteps=0x00, stepsize=0x00, mute=1
  Amp-Out vals:  [0x00 0x00]
  Pincap 0x00000034: IN OUT Detect
  Pin Default 0x01016011: [Jack] Line Out at Ext Rear
    Conn = 1/8, Color = Orange
    DefAssociation = 0x1, Sequence = 0x1
  Pin-ctls: 0x00:
  Unsolicited: tag=00, enabled=0
  Connection: 5
     0x0c 0x0d 0x0e* 0x0f 0x26
Node 0x17 [Pin Complex] wcaps 0x40018d: Stereo Amp-Out
  Amp-Out caps: ofs=0x00, nsteps=0x00, stepsize=0x00, mute=1
  Amp-Out vals:  [0x00 0x00]
  Pincap 0x00000034: IN OUT Detect
  Pin Default 0x01012012: [Jack] Line Out at Ext Rear
    Conn = 1/8, Color = Grey
    DefAssociation = 0x1, Sequence = 0x2
  Pin-ctls: 0x00:
  Unsolicited: tag=00, enabled=0
  Connection: 5
     0x0c 0x0d 0x0e 0x0f* 0x26
Node 0x18 [Pin Complex] wcaps 0x40018f: Stereo Amp-In Amp-Out
  Amp-In caps: ofs=0x00, nsteps=0x03, stepsize=0x27, mute=0
  Amp-In vals:  [0x00 0x00]
  Amp-Out caps: ofs=0x00, nsteps=0x00, stepsize=0x00, mute=1
  Amp-Out vals:  [0x80 0x80]
  Pincap 0x0000373c: IN OUT HP Detect
    Vref caps: HIZ 50 GRD 80 100
  Pin Default 0x01a19030: [Jack] Mic at Ext Rear
    Conn = 1/8, Color = Pink
    DefAssociation = 0x3, Sequence = 0x0
  Pin-ctls: 0x00: VREF_HIZ
  Unsolicited: tag=00, enabled=0
  Connection: 5
     0x0c 0x0d 0x0e 0x0f 0x26*
Node 0x19 [Pin Complex] wcaps 0x40018f: Stereo Amp-In Amp-Out
  Amp-In caps: ofs=0x00, nsteps=0x03, stepsize=0x27, mute=0
  Amp-In vals:  [0x00 0x00]
  Amp-Out caps: ofs=0x00, nsteps=0x00, stepsize=0x00, mute=1
  Amp-Out vals:  [0x80 0x80]
  Pincap 0x0000373c: IN OUT HP Detect
    Vref caps: HIZ 50 GRD 80 100
  Pin Default 0x02a19020: [Jack] Mic at Ext Front
    Conn = 1/8, Color = Pink
    DefAssociation = 0x2, Sequence = 0x0
  Pin-ctls: 0x00: VREF_HIZ
  Unsolicited: tag=00, enabled=0
  Connection: 5
     0x0c 0x0d 0x0e 0x0f 0x26*
Node 0x1a [Pin Complex] wcaps 0x40018f: Stereo Amp-In Amp-Out
  Amp-In caps: ofs=0x00, nsteps=0x03, stepsize=0x27, mute=0
  Amp-In vals:  [0x00 0x00]
  Amp-Out caps: ofs=0x00, nsteps=0x00, stepsize=0x00, mute=1
  Amp-Out vals:  [0x80 0x80]
  Pincap 0x0000373c: IN OUT HP Detect
    Vref caps: HIZ 50 GRD 80 100
  Pin Default 0x01813040: [Jack] Line In at Ext Rear
    Conn = 1/8, Color = Blue
    DefAssociation = 0x4, Sequence = 0x0
  Pin-ctls: 0x00: VREF_HIZ
  Unsolicited: tag=00, enabled=0
  Connection: 5
     0x0c 0x0d 0x0e 0x0f 0x26*
Node 0x1b [Pin Complex] wcaps 0x40018f: Stereo Amp-In Amp-Out
  Amp-In caps: ofs=0x00, nsteps=0x03, stepsize=0x27, mute=0
  Amp-In vals:  [0x00 0x00]
  Amp-Out caps: ofs=0x00, nsteps=0x00, stepsize=0x00, mute=1
  Amp-Out vals:  [0x00 0x00]
  Pincap 0x0000373c: IN OUT HP Detect
    Vref caps: HIZ 50 GRD 80 100
  Pin Default 0x02214050: [Jack] HP Out at Ext Front
    Conn = 1/8, Color = Green
    DefAssociation = 0x5, Sequence = 0x0
  Pin-ctls: 0x00: VREF_HIZ
  Unsolicited: tag=00, enabled=0
  Connection: 5
     0x0c* 0x0d 0x0e 0x0f 0x26
Node 0x1c [Pin Complex] wcaps 0x400081: Stereo
  Pincap 0x00000024: IN Detect
  Pin Default 0x9993114f: [Fixed] Aux at Int ATAPI
    Conn = ATAPI, Color = Black
    DefAssociation = 0x4, Sequence = 0xf
    Misc = NO_PRESENCE
  Pin-ctls: 0x00:
  Unsolicited: tag=00, enabled=0
Node 0x1d [Pin Complex] wcaps 0x400000: Mono
  Pincap 0x00000020: IN
  Pin Default 0x59f00190: [N/A] Other at Int ATAPI
    Conn = Unknown, Color = Unknown
    DefAssociation = 0x9, Sequence = 0x0
    Misc = NO_PRESENCE
  Pin-ctls: 0x00:
Node 0x1e [Pin Complex] wcaps 0x400300: Mono Digital
  Pincap 0x00000010: OUT
  Pin Default 0x014471f0: [Jack] SPDIF Out at Ext Rear
    Conn = RCA, Color = Yellow
    DefAssociation = 0xf, Sequence = 0x0
    Misc = NO_PRESENCE
  Pin-ctls: 0x00:
  Connection: 1
     0x06
Node 0x1f [Pin Complex] wcaps 0x400280: Mono Digital
  Pincap 0x00000020: IN
  Pin Default 0x41c451f0: [N/A] SPDIF In at Ext Rear
    Conn = RCA, Color = Red
    DefAssociation = 0xf, Sequence = 0x0
    Misc = NO_PRESENCE
  Pin-ctls: 0x00:
  Unsolicited: tag=00, enabled=0
Node 0x20 [Vendor Defined Widget] wcaps 0xf00040: Mono
  Processing caps: benign=0, ncoeff=28
Node 0x21 [Vendor Defined Widget] wcaps 0xf00000: Mono
Node 0x22 [Audio Mixer] wcaps 0x20010b: Stereo Amp-In
  Amp-In caps: ofs=0x00, nsteps=0x00, stepsize=0x00, mute=1
  Amp-In vals:  [0x00 0x00] [0x80 0x80] [0x80 0x80] [0x80 0x80] [0x80 0x80] [0x80 0x80] [0x80 0x80] [0x80 0x80] [0x80 0x80] [0x80 0x80] [0x80 0x80]
  Connection: 11
     0x18 0x19 0x1a 0x1b 0x1c 0x1d 0x14 0x15 0x16 0x17 0x0b
Node 0x23 [Audio Mixer] wcaps 0x20010b: Stereo Amp-In
  Amp-In caps: ofs=0x00, nsteps=0x00, stepsize=0x00, mute=1
  Amp-In vals:  [0x00 0x00] [0x80 0x80] [0x80 0x80] [0x80 0x80] [0x80 0x80] [0x80 0x80] [0x80 0x80] [0x80 0x80] [0x80 0x80] [0x80 0x80] [0x80 0x80]
  Connection: 11
     0x18 0x19 0x1a 0x1b 0x1c 0x1d 0x14 0x15 0x16 0x17 0x0b
Node 0x24 [Audio Selector] wcaps 0x300101: Stereo
  Connection: 12
     0x18* 0x19 0x1a 0x1b 0x1c 0x1d 0x14 0x15 0x16 0x17 0x0b 0x12
Node 0x25 [Audio Output] wcaps 0x11: Stereo
  Converter: stream=0, channel=0
  PCM:
    rates [0x5e0]: 44100 48000 88200 96000 192000
    bits [0xe]: 16 20 24
    formats [0x1]: PCM
Node 0x26 [Audio Mixer] wcaps 0x20010f: Stereo Amp-In Amp-Out
  Amp-In caps: ofs=0x00, nsteps=0x00, stepsize=0x00, mute=1
  Amp-In vals:  [0x00 0x00] [0x00 0x00]
  Amp-Out caps: ofs=0x3e, nsteps=0x40, stepsize=0x03, mute=0
  Amp-Out vals:  [0x3e 0x3e]
  Connection: 2
     0x25 0x0b
Codec: ATI RS690/780 HDMI
Address: 0
AFG Function Id: 0x1 (unsol 0)
Vendor Id: 0x1002791a
Subsystem Id: 0x00791a00
Revision Id: 0x100000
No Modem Function Group found
Default PCM:
    rates [0x40]: 48000
    bits [0x2]: 16
    formats [0x1]: PCM
Default Amp-In caps: N/A
Default Amp-Out caps: N/A
GPIO: io=0, o=0, i=0, unsolicited=0, wake=0
Node 0x02 [Audio Output] wcaps 0x201: Stereo Digital
  Control: name="IEC958 Playback Con Mask", index=0, device=0
  Control: name="IEC958 Playback Pro Mask", index=0, device=0
  Control: name="IEC958 Playback Default", index=0, device=0
  Control: name="IEC958 Playback Switch", index=0, device=0
  Device: name="HDMI 0", type="HDMI", device=3
  Converter: stream=0, channel=0
  Digital: Enabled GenLevel
  Digital category: 0x2
Node 0x03 [Pin Complex] wcaps 0x400381: Stereo Digital
  Pincap 0x00000094: OUT Detect HDMI
  Pin Default 0x18560010: [Jack] Digital Out at Int HDMI
    Conn = Digital, Color = Unknown
    DefAssociation = 0x1, Sequence = 0x0
  Pin-ctls: 0x40: OUT
  Unsolicited: tag=00, enabled=0
  Connection: 1
     0x02
--endcollapse--


!!ALSA Device nodes
!!-----------------

crw-rw----+ 1 root audio 116,  7 Mar 11 14:35 /dev/snd/controlC0
crw-rw----+ 1 root audio 116, 10 Mar 11 14:35 /dev/snd/controlC1
crw-rw----+ 1 root audio 116,  6 Mar 11 14:35 /dev/snd/hwC0D0
crw-rw----+ 1 root audio 116,  5 Mar 11 14:35 /dev/snd/hwC0D3
crw-rw----+ 1 root audio 116,  9 Mar 11 14:35 /dev/snd/hwC1D0
crw-rw----+ 1 root audio 116,  4 Mar 11 14:36 /dev/snd/pcmC0D0c
crw-rw----+ 1 root audio 116,  3 Mar 11 14:36 /dev/snd/pcmC0D0p
crw-rw----+ 1 root audio 116,  2 Mar 11 14:35 /dev/snd/pcmC0D1p
crw-rw----+ 1 root audio 116,  8 Mar 11 14:35 /dev/snd/pcmC1D3p
crw-rw----+ 1 root audio 116,  1 Mar 11 14:36 /dev/snd/seq
crw-rw----+ 1 root audio 116, 33 Mar 11 14:35 /dev/snd/timer

/dev/snd/by-path:
total 0
drwxr-xr-x 2 root root  80 Mar 11 14:35 .
drwxr-xr-x 3 root root 280 Mar 11 14:35 ..
lrwxrwxrwx 1 root root  12 Mar 11 14:35 pci-0000:00:14.2 -> ../controlC0
lrwxrwxrwx 1 root root  12 Mar 11 14:35 pci-0000:01:05.1 -> ../controlC1


!!Aplay/Arecord output
!!------------

APLAY

**** List of PLAYBACK Hardware Devices ****
card 0: SB [HDA ATI SB], device 0: STAC92xx Analog [STAC92xx Analog]
  Subdevices: 1/1
  Subdevice #0: subdevice #0
card 0: SB [HDA ATI SB], device 1: STAC92xx Digital [STAC92xx Digital]
  Subdevices: 1/1
  Subdevice #0: subdevice #0
card 1: HDMI [HDA ATI HDMI], device 3: HDMI 0 [HDMI 0]
  Subdevices: 1/1
  Subdevice #0: subdevice #0

ARECORD

**** List of CAPTURE Hardware Devices ****
card 0: SB [HDA ATI SB], device 0: STAC92xx Analog [STAC92xx Analog]
  Subdevices: 2/2
  Subdevice #0: subdevice #0
  Subdevice #1: subdevice #1

!!Amixer output
!!-------------

!!-------Mixer controls for card 0 [SB]

Card hw:0 'SB'/'HDA ATI SB at 0xfe6f8000 irq 16'
  Mixer name	: 'Realtek ALC889'
  Components	: 'HDA:111d7603,00000100,00100101 HDA:10ec0889,10ec0889,00100004'
  Controls      : 29
  Simple ctrls  : 20
Simple mixer control 'Master',0
  Capabilities: pvolume pvolume-joined pswitch pswitch-joined penum
  Playback channels: Mono
  Limits: Playback 0 - 64
  Mono: Playback 0 [0%] [-99999.99dB] [off]
Simple mixer control 'Headphone',0
  Capabilities: pvolume pswitch penum
  Playback channels: Front Left - Front Right
  Limits: Playback 0 - 64
  Mono:
  Front Left: Playback 64 [100%] [0.00dB] [off]
  Front Right: Playback 64 [100%] [0.00dB] [off]
Simple mixer control 'PCM',0
  Capabilities: pvolume penum
  Playback channels: Front Left - Front Right
  Limits: Playback 0 - 255
  Mono:
  Front Left: Playback 0 [0%] [-51.00dB]
  Front Right: Playback 0 [0%] [-51.00dB]
Simple mixer control 'Front',0
  Capabilities: pvolume pswitch penum
  Playback channels: Front Left - Front Right
  Limits: Playback 0 - 64
  Mono:
  Front Left: Playback 0 [0%] [-48.00dB] [off]
  Front Right: Playback 0 [0%] [-48.00dB] [off]
Simple mixer control 'Front Mic Jack Mode',0
  Capabilities: enum
  Items: 'Mic In' 'Line In'
  Item0: 'Mic In'
Simple mixer control 'Line Jack Mode',0
  Capabilities: enum
  Items: 'Mic In' 'Line In'
  Item0: 'Line In'
Simple mixer control 'IEC958',0
  Capabilities: pswitch pswitch-joined penum
  Playback channels: Mono
  Mono: Playback [off]
Simple mixer control 'IEC958 Default PCM',0
  Capabilities: pswitch pswitch-joined penum
  Playback channels: Mono
  Mono: Playback [on]
Simple mixer control 'IEC958 Playback Source',0
  Capabilities: enum
  Items: 'Digital Playback' 'Analog Mux 1' 'Analog Mux 2'
  Item0: 'Digital Playback'
Simple mixer control 'IEC958 Playback Source',1
  Capabilities: enum
  Items: 'Digital Playback' 'Analog Mux 1' 'Analog Mux 2'
  Item0: 'Digital Playback'
Simple mixer control 'Beep',0
  Capabilities: pvolume pvolume-joined pswitch pswitch-joined penum
  Playback channels: Mono
  Limits: Playback 0 - 3
  Mono: Playback 0 [0%] [-18.00dB] [off]
Simple mixer control 'Capture',0
  Capabilities: cvolume cswitch penum
  Capture channels: Front Left - Front Right
  Limits: Capture 0 - 15
  Front Left: Capture 1 [7%] [1.50dB] [on]
  Front Right: Capture 1 [7%] [1.50dB] [on]
Simple mixer control 'Capture',1
  Capabilities: cvolume cswitch penum
  Capture channels: Front Left - Front Right
  Limits: Capture 0 - 15
  Front Left: Capture 0 [0%] [0.00dB] [off]
  Front Right: Capture 0 [0%] [0.00dB] [off]
Simple mixer control 'Input Source',0
  Capabilities: cenum
  Items: 'Front Mic' 'Rear Mic' 'Line' 'Internal Mic' 'Internal Mic 1'
  Item0: 'Line'
Simple mixer control 'Input Source',1
  Capabilities: cenum
  Items: 'Front Mic' 'Rear Mic' 'Line' 'Internal Mic' 'Internal Mic 1'
  Item0: 'Front Mic'
Simple mixer control 'Internal Mic',0
  Capabilities: cvolume penum
  Capture channels: Front Left - Front Right
  Limits: Capture 0 - 3
  Front Left: Capture 3 [100%] [30.00dB]
  Front Right: Capture 3 [100%] [30.00dB]
Simple mixer control 'Internal Mic',1
  Capabilities: cvolume penum
  Capture channels: Front Left - Front Right
  Limits: Capture 0 - 3
  Front Left: Capture 0 [0%] [0.00dB]
  Front Right: Capture 0 [0%] [0.00dB]
Simple mixer control 'Mux',0
  Capabilities: cvolume penum
  Capture channels: Front Left - Front Right
  Limits: Capture 0 - 3
  Front Left: Capture 0 [0%] [0.00dB]
  Front Right: Capture 0 [0%] [0.00dB]
Simple mixer control 'Mux',1
  Capabilities: cvolume penum
  Capture channels: Front Left - Front Right
  Limits: Capture 0 - 3
  Front Left: Capture 0 [0%] [0.00dB]
  Front Right: Capture 0 [0%] [0.00dB]
Simple mixer control 'Rear Mic Jack Mode',0
  Capabilities: enum
  Items: 'Mic In' 'Line In'
  Item0: 'Mic In'

!!-------Mixer controls for card 1 [HDMI]

Card hw:1 'HDMI'/'HDA ATI HDMI at 0xfe8e8000 irq 19'
  Mixer name	: 'ATI RS690/780 HDMI'
  Components	: 'HDA:1002791a,00791a00,00100000'
  Controls      : 4
  Simple ctrls  : 1
Simple mixer control 'IEC958',0
  Capabilities: pswitch pswitch-joined penum
  Playback channels: Mono
  Mono: Playback [on]


!!Alsactl output
!!-------------

--startcollapse--
state.SB {
	control.1 {
		comment.access 'read write'
		comment.type INTEGER
		comment.count 2
		comment.range '0 - 64'
		comment.dbmin -4800
		comment.dbmax 0
		iface MIXER
		name 'Front Playback Volume'
		value.0 0
		value.1 0
	}
	control.2 {
		comment.access 'read write'
		comment.type BOOLEAN
		comment.count 2
		iface MIXER
		name 'Front Playback Switch'
		value.0 false
		value.1 false
	}
	control.3 {
		comment.access 'read write'
		comment.type ENUMERATED
		comment.count 1
		comment.item.0 'Mic In'
		comment.item.1 'Line In'
		iface MIXER
		name 'Front Mic Jack Mode'
		value 'Mic In'
	}
	control.4 {
		comment.access 'read write'
		comment.type ENUMERATED
		comment.count 1
		comment.item.0 'Mic In'
		comment.item.1 'Line In'
		iface MIXER
		name 'Rear Mic Jack Mode'
		value 'Mic In'
	}
	control.5 {
		comment.access 'read write'
		comment.type ENUMERATED
		comment.count 1
		comment.item.0 'Mic In'
		comment.item.1 'Line In'
		iface MIXER
		name 'Line Jack Mode'
		value 2
	}
	control.6 {
		comment.access 'read write'
		comment.type BOOLEAN
		comment.count 1
		iface MIXER
		name 'Beep Playback Switch'
		value false
	}
	control.7 {
		comment.access 'read write'
		comment.type INTEGER
		comment.count 1
		comment.range '0 - 3'
		comment.dbmin -1800
		comment.dbmax 0
		iface MIXER
		name 'Beep Playback Volume'
		value 0
	}
	control.8 {
		comment.access 'read write'
		comment.type INTEGER
		comment.count 2
		comment.range '0 - 64'
		comment.dbmin -4800
		comment.dbmax 0
		iface MIXER
		name 'Headphone Playback Volume'
		value.0 64
		value.1 64
	}
	control.9 {
		comment.access 'read write'
		comment.type BOOLEAN
		comment.count 2
		iface MIXER
		name 'Headphone Playback Switch'
		value.0 false
		value.1 false
	}
	control.10 {
		comment.access 'read write'
		comment.type INTEGER
		comment.count 2
		comment.range '0 - 15'
		comment.dbmin 0
		comment.dbmax 2250
		iface MIXER
		name 'Capture Volume'
		value.0 1
		value.1 1
	}
	control.11 {
		comment.access 'read write'
		comment.type BOOLEAN
		comment.count 2
		iface MIXER
		name 'Capture Switch'
		value.0 true
		value.1 true
	}
	control.12 {
		comment.access 'read write'
		comment.type INTEGER
		comment.count 2
		comment.range '0 - 15'
		comment.dbmin 0
		comment.dbmax 2250
		iface MIXER
		name 'Capture Volume'
		index 1
		value.0 0
		value.1 0
	}
	control.13 {
		comment.access 'read write'
		comment.type BOOLEAN
		comment.count 2
		iface MIXER
		name 'Capture Switch'
		index 1
		value.0 false
		value.1 false
	}
	control.14 {
		comment.access 'read write'
		comment.type INTEGER
		comment.count 2
		comment.range '0 - 3'
		comment.dbmin 0
		comment.dbmax 3000
		iface MIXER
		name 'Internal Mic Capture Volume'
		value.0 3
		value.1 3
	}
	control.15 {
		comment.access 'read write'
		comment.type INTEGER
		comment.count 2
		comment.range '0 - 3'
		comment.dbmin 0
		comment.dbmax 3000
		iface MIXER
		name 'Internal Mic Capture Volume'
		index 1
		value.0 0
		value.1 0
	}
	control.16 {
		comment.access 'read write'
		comment.type INTEGER
		comment.count 2
		comment.range '0 - 3'
		comment.dbmin 0
		comment.dbmax 3000
		iface MIXER
		name 'Mux Capture Volume'
		value.0 0
		value.1 0
	}
	control.17 {
		comment.access 'read write'
		comment.type INTEGER
		comment.count 2
		comment.range '0 - 3'
		comment.dbmin 0
		comment.dbmax 3000
		iface MIXER
		name 'Mux Capture Volume'
		index 1
		value.0 0
		value.1 0
	}
	control.18 {
		comment.access 'read write'
		comment.type ENUMERATED
		comment.count 1
		comment.item.0 'Front Mic'
		comment.item.1 'Rear Mic'
		comment.item.2 Line
		comment.item.3 'Internal Mic'
		comment.item.4 'Internal Mic 1'
		iface MIXER
		name 'Input Source'
		value Line
	}
	control.19 {
		comment.access 'read write'
		comment.type ENUMERATED
		comment.count 1
		comment.item.0 'Front Mic'
		comment.item.1 'Rear Mic'
		comment.item.2 Line
		comment.item.3 'Internal Mic'
		comment.item.4 'Internal Mic 1'
		iface MIXER
		name 'Input Source'
		index 1
		value 'Front Mic'
	}
	control.20 {
		comment.access 'read write'
		comment.type ENUMERATED
		comment.count 1
		comment.item.0 'Digital Playback'
		comment.item.1 'Analog Mux 1'
		comment.item.2 'Analog Mux 2'
		iface MIXER
		name 'IEC958 Playback Source'
		value 'Digital Playback'
	}
	control.21 {
		comment.access 'read write'
		comment.type ENUMERATED
		comment.count 1
		comment.item.0 'Digital Playback'
		comment.item.1 'Analog Mux 1'
		comment.item.2 'Analog Mux 2'
		iface MIXER
		name 'IEC958 Playback Source'
		index 1
		value 'Digital Playback'
	}
	control.22 {
		comment.access read
		comment.type IEC958
		comment.count 1
		iface MIXER
		name 'IEC958 Playback Con Mask'
		value '0fff000000000000000000000000000000000000000000000000000000000000000000000000000000000000000000000000000000000000000000000000000000000000000000000000000000000000000000000000000000000000000000000000000000000000000000000000000000000000000000000000000000000000000000000000000000000000000000000000000000000000000000000000000000000000000000000000000000000000'
	}
	control.23 {
		comment.access read
		comment.type IEC958
		comment.count 1
		iface MIXER
		name 'IEC958 Playback Pro Mask'
		value '0f00000000000000000000000000000000000000000000000000000000000000000000000000000000000000000000000000000000000000000000000000000000000000000000000000000000000000000000000000000000000000000000000000000000000000000000000000000000000000000000000000000000000000000000000000000000000000000000000000000000000000000000000000000000000000000000000000000000000000'
	}
	control.24 {
		comment.access 'read write'
		comment.type IEC958
		comment.count 1
		iface MIXER
		name 'IEC958 Playback Default'
		value '0400000000000000000000000000000000000000000000000000000000000000000000000000000000000000000000000000000000000000000000000000000000000000000000000000000000000000000000000000000000000000000000000000000000000000000000000000000000000000000000000000000000000000000000000000000000000000000000000000000000000000000000000000000000000000000000000000000000000000'
	}
	control.25 {
		comment.access 'read write'
		comment.type BOOLEAN
		comment.count 1
		iface MIXER
		name 'IEC958 Playback Switch'
		value false
	}
	control.26 {
		comment.access 'read write'
		comment.type BOOLEAN
		comment.count 1
		iface MIXER
		name 'IEC958 Default PCM Playback Switch'
		value true
	}
	control.27 {
		comment.access 'read write'
		comment.type INTEGER
		comment.count 1
		comment.range '0 - 64'
		comment.dbmin -4800
		comment.dbmax 0
		iface MIXER
		name 'Master Playback Volume'
		value 0
	}
	control.28 {
		comment.access 'read write'
		comment.type BOOLEAN
		comment.count 1
		iface MIXER
		name 'Master Playback Switch'
		value false
	}
	control.63 {
		comment.access 'read write user'
		comment.type INTEGER
		comment.count 2
		comment.range '0 - 255'
		comment.tlv '0000000100000008ffffec1400000014'
		comment.dbmin -5100
		comment.dbmax 0
		iface MIXER
		name 'PCM Playback Volume'
		value.0 0
		value.1 0
	}
}
state.HDMI {
	control.1 {
		comment.access read
		comment.type IEC958
		comment.count 1
		iface MIXER
		name 'IEC958 Playback Con Mask'
		value '0fff000000000000000000000000000000000000000000000000000000000000000000000000000000000000000000000000000000000000000000000000000000000000000000000000000000000000000000000000000000000000000000000000000000000000000000000000000000000000000000000000000000000000000000000000000000000000000000000000000000000000000000000000000000000000000000000000000000000000'
	}
	control.2 {
		comment.access read
		comment.type IEC958
		comment.count 1
		iface MIXER
		name 'IEC958 Playback Pro Mask'
		value '0f00000000000000000000000000000000000000000000000000000000000000000000000000000000000000000000000000000000000000000000000000000000000000000000000000000000000000000000000000000000000000000000000000000000000000000000000000000000000000000000000000000000000000000000000000000000000000000000000000000000000000000000000000000000000000000000000000000000000000'
	}
	control.3 {
		comment.access 'read write'
		comment.type IEC958
		comment.count 1
		iface MIXER
		name 'IEC958 Playback Default'
		value '0482000200000000000000000000000000000000000000000000000000000000000000000000000000000000000000000000000000000000000000000000000000000000000000000000000000000000000000000000000000000000000000000000000000000000000000000000000000000000000000000000000000000000000000000000000000000000000000000000000000000000000000000000000000000000000000000000000000000000'
	}
	control.4 {
		comment.access 'read write'
		comment.type BOOLEAN
		comment.count 1
		iface MIXER
		name 'IEC958 Playback Switch'
		value true
	}
}
--endcollapse--


!!All Loaded Modules
!!------------------

Module
snd_pcm_oss
snd_mixer_oss
snd_seq
snd_seq_device
edd
fuse
af_packet
cpufreq_conservative
cpufreq_userspace
cpufreq_powersave
powernow_k8
mperf
loop
snd_hda_codec_hdmi
snd_hda_codec_realtek
snd_hda_codec_idt
tpm_infineon
snd_hda_intel
snd_hda_codec
snd_hwdep
snd_pcm
snd_timer
snd
shpchp
soundcore
pl2303
sr_mod
usbserial
cdrom
tg3
pci_hotplug
edac_core
tpm_tis
tpm
tpm_bios
button
snd_page_alloc
k10temp
edac_mce_amd
wmi
pcspkr
sg
i2c_piix4
radeon
ttm
drm_kms_helper
sd_mod
drm
i2c_algo_bit
fan
processor
ata_generic
pata_atiixp
ahci
libahci
libata
scsi_mod
thermal
thermal_sys


!!Sysfs Files
!!-----------

/sys/class/sound/hwC0D0/init_pin_configs:
0x0a 0x02214030
0x0b 0x02a19040
0x0c 0x01a19020
0x0d 0x01014010
0x0e 0x0181302e
0x0f 0x40f000f0
0x14 0x40f000f0
0x18 0x90a70141
0x19 0x90a70142
0x1e 0x01452050
0x1f 0x98560060
0x20 0x40f000f0

/sys/class/sound/hwC0D0/driver_pin_configs:

/sys/class/sound/hwC0D0/user_pin_configs:

/sys/class/sound/hwC0D0/init_verbs:

/sys/class/sound/hwC0D3/init_pin_configs:
0x11 0x414471f0
0x12 0x59a3112e
0x14 0x01014010
0x15 0x01011014
0x16 0x01016011
0x17 0x01012012
0x18 0x01a19030
0x19 0x02a19020
0x1a 0x01813040
0x1b 0x02214050
0x1c 0x9993114f
0x1d 0x59f00190
0x1e 0x014471f0
0x1f 0x41c451f0

/sys/class/sound/hwC0D3/driver_pin_configs:

/sys/class/sound/hwC0D3/user_pin_configs:

/sys/class/sound/hwC0D3/init_verbs:

/sys/class/sound/hwC1D0/init_pin_configs:
0x03 0x18560010

/sys/class/sound/hwC1D0/driver_pin_configs:

/sys/class/sound/hwC1D0/user_pin_configs:

/sys/class/sound/hwC1D0/init_verbs:


!!ALSA/HDA dmesg
!!------------------

[    2.413098] [drm] Connector 1:
[    2.413099] [drm]   HDMI-A
[    2.413099] [drm]   HPD3
--
[    7.572766]  (Note that use of the override may cause unknown side effects.)
[    7.934678] HDA Intel 0000:00:14.2: PCI INT A -> GSI 16 (level, low) -> IRQ 16
[    7.972852] ALSA sound/pci/hda/hda_codec.c:4634: autoconfig: line_outs=1 (0xd/0x0/0x0/0x0/0x0)
[    7.972855] ALSA sound/pci/hda/hda_codec.c:4638:    speaker_outs=0 (0x0/0x0/0x0/0x0/0x0)
[    7.972857] ALSA sound/pci/hda/hda_codec.c:4642:    hp_outs=1 (0xa/0x0/0x0/0x0/0x0)
[    7.972859] ALSA sound/pci/hda/hda_codec.c:4643:    mono: mono_out=0x0
[    7.972861] ALSA sound/pci/hda/hda_codec.c:4646:    dig-out=0x1e/0x1f
[    7.972866] ALSA sound/pci/hda/hda_codec.c:4647:    inputs:
[    7.972868] ALSA sound/pci/hda/hda_codec.c:4653: 
[    7.973199] ALSA sound/pci/hda/patch_sigmatel.c:3036: stac92xx: dac_nids=1 (0x10/0x0/0x0/0x0/0x0)
[    8.026637] hda_codec: ALC889: BIOS auto-probing.
[    8.026639] ALSA sound/pci/hda/patch_realtek.c:1456: SKU: Nid=0x0 sku_cfg=0x00000889
[    8.026641] ALSA sound/pci/hda/patch_realtek.c:1458: SKU: port_connectivity=0x0
[    8.026643] ALSA sound/pci/hda/patch_realtek.c:1459: SKU: enable_pcbeep=0x1
[    8.026645] ALSA sound/pci/hda/patch_realtek.c:1460: SKU: check_sum=0x00000000
[    8.026646] ALSA sound/pci/hda/patch_realtek.c:1461: SKU: customization=0x00000000
[    8.026647] ALSA sound/pci/hda/patch_realtek.c:1462: SKU: external_amp=0x1
[    8.026649] ALSA sound/pci/hda/patch_realtek.c:1463: SKU: platform_type=0x0
[    8.026650] ALSA sound/pci/hda/patch_realtek.c:1464: SKU: swap=0x0
[    8.026652] ALSA sound/pci/hda/patch_realtek.c:1465: SKU: override=0x1
[    8.026655] ALSA sound/pci/hda/hda_codec.c:4634: autoconfig: line_outs=4 (0x14/0x17/0x16/0x15/0x0)
[    8.026657] ALSA sound/pci/hda/hda_codec.c:4638:    speaker_outs=0 (0x0/0x0/0x0/0x0/0x0)
[    8.026659] ALSA sound/pci/hda/hda_codec.c:4642:    hp_outs=1 (0x1b/0x0/0x0/0x0/0x0)
[    8.026661] ALSA sound/pci/hda/hda_codec.c:4643:    mono: mono_out=0x0
[    8.026662] ALSA sound/pci/hda/hda_codec.c:4646:    dig-out=0x1e/0x0
[    8.026664] ALSA sound/pci/hda/hda_codec.c:4647:    inputs:
[    8.026665] ALSA sound/pci/hda/hda_codec.c:4653: 
[    8.028278] ALSA sound/pci/hda/patch_realtek.c:1529: realtek: Enabling init ASM_ID=0x0889 CODEC_ID=10ec0889
[    8.029755] ALSA sound/pci/hda/hda_codec.c:3569: Too many SPDIF devices
[    8.034657] ALSA sound/core/control.c:343: control 2:0:0:Front Playback Volume:0 is already present
[    8.034885] ALSA sound/core/control.c:343: control 2:0:0:Front Playback Switch:0 is already present
[    8.035098] ALSA sound/core/control.c:343: control 2:0:0:Headphone Playback Switch:0 is already present
[    8.035303] ALSA sound/core/control.c:343: control 2:0:0:Capture Switch:0 is already present
[    8.035483] ALSA sound/core/control.c:343: control 2:0:0:Capture Volume:0 is already present
[    8.035662] ALSA sound/core/control.c:343: control 2:0:0:Input Source:0 is already present
[    8.035889] ALSA sound/core/control.c:343: control 2:0:0:IEC958 Default PCM Playback Switch:0 is already present
[    8.036110] hda_codec: cannot build controls for #3 (error -16)
[    8.036989] input: HDA ATI SB Line In at Ext Rear Jack as /devices/pci0000:00/0000:00:14.2/sound/card0/input5
[    8.037063] input: HDA ATI SB Mic at Ext Rear Jack as /devices/pci0000:00/0000:00:14.2/sound/card0/input6
[    8.037104] input: HDA ATI SB Mic at Ext Front Jack as /devices/pci0000:00/0000:00:14.2/sound/card0/input7
[    8.037145] input: HDA ATI SB Line Out at Ext Rear Jack as /devices/pci0000:00/0000:00:14.2/sound/card0/input8
[    8.037187] input: HDA ATI SB HP Out at Ext Front Jack as /devices/pci0000:00/0000:00:14.2/sound/card0/input9
[    8.037407] HDA Intel 0000:01:05.1: PCI INT B -> GSI 19 (level, low) -> IRQ 19
[    8.037450] HDA Intel 0000:01:05.1: setting latency timer to 64
[    8.250149] Adding 2104476k swap on /dev/sda1.  Priority:-1 extents:1 across:2104476k 


