
!!################################
!!ALSA Information Script v 0.4.53
!!################################

!!Script ran on: Thu Jan 22 10:46:23 UTC 2009


!!Linux Distribution
!!------------------

Ubuntu 8.10 \n \l DISTRIB_ID=Ubuntu DISTRIB_DESCRIPTION="Ubuntu 8.10"


!!Kernel Information
!!------------------

Kernel release:    2.6.28
Operating System:  GNU/Linux
Architecture:      x86_64
Processor:         unknown
SMP Enabled:       Yes


!!ALSA Version
!!------------

Driver version:     1.0.18rc3
Library version:    1.0.17a
Utilities version:  1.0.17


!!Loaded ALSA modules
!!-------------------

snd_hda_intel


!!Sound Servers on this system
!!----------------------------

No sound servers found.


!!Soundcards recognised by ALSA
!!-----------------------------

 0 [Intel          ]: HDA-Intel - HDA Intel
                      HDA Intel at 0xdf300000 irq 310


!!PCI Soundcards installed in the system
!!--------------------------------------

00:1b.0 Audio device: Intel Corporation 82801I (ICH9 Family) HD Audio Controller (rev 03)


!!Advanced information - PCI Vendor/Device/Susbsystem ID's
!!--------------------------------------------------------

00:1b.0 0403: 8086:293e (rev 03)
	Subsystem: 103c:30f7


!!Modprobe options (Sound related)
!!--------------------------------

snd-atiixp-modem: index=-2
snd-intel8x0m: index=-2
snd-via82xx-modem: index=-2
snd-usb-audio: index=-2
snd-usb-usx2y: index=-2
snd-usb-caiaq: index=-2
snd-cmipci: mpu_port=0x330 fm_port=0x388
snd-pcsp: index=-2
snd-hda-intel: model=hp-dv5 enable-msi=1


!!Loaded sound module options
!!--------------------------

!!Module: snd_hda_intel
bdl_pos_adj : 1,-1,-1,-1,-1,-1,-1,-1,-1,-1,-1,-1,-1,-1,-1,-1,-1,-1,-1,-1,-1,-1,-1,-1,-1,-1,-1,-1,-1,-1,-1,-1
enable : Y,Y,Y,Y,Y,Y,Y,Y,Y,Y,Y,Y,Y,Y,Y,Y,Y,Y,Y,Y,Y,Y,Y,Y,Y,Y,Y,Y,Y,Y,Y,Y
enable_msi : 1
id : <NULL>,<NULL>,<NULL>,<NULL>,<NULL>,<NULL>,<NULL>,<NULL>,<NULL>,<NULL>,<NULL>,<NULL>,<NULL>,<NULL>,<NULL>,<NULL>,<NULL>,<NULL>,<NULL>,<NULL>,<NULL>,<NULL>,<NULL>,<NULL>,<NULL>,<NULL>,<NULL>,<NULL>,<NULL>,<NULL>,<NULL>,<NULL>
index : -1,-1,-1,-1,-1,-1,-1,-1,-1,-1,-1,-1,-1,-1,-1,-1,-1,-1,-1,-1,-1,-1,-1,-1,-1,-1,-1,-1,-1,-1,-1,-1
model : hp-dv5,<NULL>,<NULL>,<NULL>,<NULL>,<NULL>,<NULL>,<NULL>,<NULL>,<NULL>,<NULL>,<NULL>,<NULL>,<NULL>,<NULL>,<NULL>,<NULL>,<NULL>,<NULL>,<NULL>,<NULL>,<NULL>,<NULL>,<NULL>,<NULL>,<NULL>,<NULL>,<NULL>,<NULL>,<NULL>,<NULL>,<NULL>
position_fix : 0,0,0,0,0,0,0,0,0,0,0,0,0,0,0,0,0,0,0,0,0,0,0,0,0,0,0,0,0,0,0,0
power_save : 0
power_save_controller : Y
probe_mask : -1,-1,-1,-1,-1,-1,-1,-1,-1,-1,-1,-1,-1,-1,-1,-1,-1,-1,-1,-1,-1,-1,-1,-1,-1,-1,-1,-1,-1,-1,-1,-1
single_cmd : N


!!HDA-Intel Codec information
!!---------------------------
--startcollapse--

Codec: IDT 92HD71B7X
Address: 0
Vendor Id: 0x111d76b2
Subsystem Id: 0x103c30f7
Revision Id: 0x100302
No Modem Function Group found
Default PCM:
    rates [0x7e0]: 44100 48000 88200 96000 176400 192000
    bits [0xe]: 16 20 24
    formats [0x1]: PCM
Default Amp-In caps: ofs=0x00, nsteps=0x00, stepsize=0x00, mute=1
Default Amp-Out caps: ofs=0x7f, nsteps=0x7f, stepsize=0x02, mute=1
GPIO: io=8, o=0, i=0, unsolicited=1, wake=1
  IO[0]: enable=1, dir=1, wake=0, sticky=0, data=1
  IO[1]: enable=0, dir=0, wake=0, sticky=0, data=0
  IO[2]: enable=0, dir=0, wake=0, sticky=0, data=0
  IO[3]: enable=0, dir=0, wake=0, sticky=0, data=0
  IO[4]: enable=0, dir=0, wake=0, sticky=0, data=0
  IO[5]: enable=0, dir=0, wake=0, sticky=0, data=0
  IO[6]: enable=0, dir=0, wake=0, sticky=0, data=0
  IO[7]: enable=0, dir=0, wake=0, sticky=0, data=0
Node 0x0a [Pin Complex] wcaps 0x400181: Stereo
  Pincap 0x0000001c: OUT HP Detect
  Pin Default 0x0221201f: [Jack] HP Out at Ext Front
    Conn = 1/8, Color = Grey
    DefAssociation = 0x1, Sequence = 0xf
  Pin-ctls: 0x00:
  Unsolicited: tag=30, enabled=1
  Connection: 3
     0x10 0x11* 0x17
Node 0x0b [Pin Complex] wcaps 0x400081: Stereo
  Pincap 0x00001724: IN Detect
    Vref caps: HIZ 50 GRD 80
  Pin Default 0x02a12020: [Jack] Mic at Ext Front
    Conn = 1/8, Color = Grey
    DefAssociation = 0x2, Sequence = 0x0
  Pin-ctls: 0x24: IN VREF_80
  Unsolicited: tag=00, enabled=0
Node 0x0c [Pin Complex] wcaps 0x400081: Stereo
  Pincap 0x00001724: IN Detect
    Vref caps: HIZ 50 GRD 80
  Pin Default 0x40f100f8: [N/A] Other at Ext N/A
    Conn = 1/8, Color = Unknown
    DefAssociation = 0xf, Sequence = 0x8
  Pin-ctls: 0x00: VREF_HIZ
  Unsolicited: tag=00, enabled=0
Node 0x0d [Pin Complex] wcaps 0x400181: Stereo
  Pincap 0x00000014: OUT Detect
  Pin Default 0x90170110: [Fixed] Speaker at Int N/A
    Conn = Analog, Color = Unknown
    DefAssociation = 0x1, Sequence = 0x0
    Misc = NO_PRESENCE
  Pin-ctls: 0x40: OUT
  Unsolicited: tag=00, enabled=0
  Connection: 3
     0x10* 0x11 0x17
Node 0x0e [Pin Complex] wcaps 0x400081: Stereo
  Pincap 0x00001724: IN Detect
    Vref caps: HIZ 50 GRD 80
  Pin Default 0x40f100f1: [N/A] Other at Ext N/A
    Conn = 1/8, Color = Unknown
    DefAssociation = 0xf, Sequence = 0x1
  Pin-ctls: 0x00: VREF_HIZ
  Unsolicited: tag=00, enabled=0
Node 0x0f [Pin Complex] wcaps 0x400181: Stereo
  Pincap 0x00000014: OUT Detect
  Pin Default 0x40f100f0: [N/A] Other at Ext N/A
    Conn = 1/8, Color = Unknown
    DefAssociation = 0xf, Sequence = 0x0
  Pin-ctls: 0x00:
  Unsolicited: tag=00, enabled=0
  Connection: 3
     0x10 0x11 0x17*
Node 0x10 [Audio Output] wcaps 0xd0c05: Stereo Amp-Out R/L
  Amp-Out caps: N/A
  Amp-Out vals:  [0x61 0x61]
  Converter: stream=0, channel=0
  Power: setting=D0, actual=D0
  Delay: 13 samples
Node 0x11 [Audio Output] wcaps 0xd0c05: Stereo Amp-Out R/L
  Amp-Out caps: N/A
  Amp-Out vals:  [0x5d 0x5d]
  Converter: stream=0, channel=0
  Power: setting=D0, actual=D0
  Delay: 13 samples
Node 0x12 [Audio Input] wcaps 0x1d0541: Stereo
  Converter: stream=0, channel=0
  SDI-Select: 0
  Power: setting=D3, actual=D3
  Delay: 13 samples
  Connection: 1
     0x1c
  Processing caps: benign=0, ncoeff=0
Node 0x13 [Audio Input] wcaps 0x1d0541: Stereo
  Converter: stream=0, channel=0
  SDI-Select: 0
  Power: setting=D3, actual=D3
  Delay: 13 samples
  Connection: 1
     0x1d
  Processing caps: benign=0, ncoeff=0
Node 0x14 [Pin Complex] wcaps 0x400100: Mono
  Pincap 0x00000010: OUT
  Pin Default 0x40f100f2: [N/A] Other at Ext N/A
    Conn = 1/8, Color = Unknown
    DefAssociation = 0xf, Sequence = 0x2
  Pin-ctls: 0x00:
  Connection: 1
     0x16
Node 0x15 [Audio Selector] wcaps 0x300101: Stereo
  Connection: 3
     0x10* 0x11 0x17
Node 0x16 [Audio Mixer] wcaps 0x200100: Mono
  Connection: 1
     0x15
Node 0x17 [Audio Mixer] wcaps 0x20010b: Stereo Amp-In
  Amp-In caps: ofs=0x17, nsteps=0x1f, stepsize=0x05, mute=1
  Amp-In vals:  [0x9a 0x9a] [0x99 0x99] [0x97 0x97] [0x97 0x97] [0x1f 0x1f]
  Connection: 5
     0x10 0x11 0x27 0x1a 0x1b
Node 0x18 [Pin Complex] wcaps 0x40000d: Stereo Amp-Out
  Amp-Out caps: ofs=0x00, nsteps=0x03, stepsize=0x27, mute=0
  Amp-Out vals:  [0x00 0x00]
  Pincap 0x00000020: IN
  Pin Default 0x95a6912e: [Fixed] Mic at Int Top
    Conn = Digital, Color = Pink
    DefAssociation = 0x2, Sequence = 0xe
    Misc = NO_PRESENCE
  Pin-ctls: 0x20: IN
Node 0x19 [Pin Complex] wcaps 0x40000d: Stereo Amp-Out
  Amp-Out caps: ofs=0x00, nsteps=0x03, stepsize=0x27, mute=0
  Amp-Out vals:  [0x00 0x00]
  Pincap 0x00000020: IN
  Pin Default 0x40f000f5: [N/A] Other at Ext N/A
    Conn = Unknown, Color = Unknown
    DefAssociation = 0xf, Sequence = 0x5
  Pin-ctls: 0x20: IN
Node 0x1a [Audio Selector] wcaps 0x30010d: Stereo Amp-Out
  Amp-Out caps: ofs=0x00, nsteps=0x03, stepsize=0x27, mute=0
  Amp-Out vals:  [0x00 0x00]
  Connection: 3
     0x0b* 0x0c 0x0e
Node 0x1b [Audio Selector] wcaps 0x30010d: Stereo Amp-Out
  Amp-Out caps: ofs=0x00, nsteps=0x03, stepsize=0x27, mute=0
  Amp-Out vals:  [0x00 0x00]
  Connection: 3
     0x0b* 0x0c 0x0e
Node 0x1c [Audio Selector] wcaps 0x30090d: Stereo Amp-Out R/L
  Amp-Out caps: ofs=0x00, nsteps=0x0f, stepsize=0x05, mute=1
  Amp-Out vals:  [0x0f 0x0f]
  Connection: 4
     0x1a* 0x17 0x18 0x19
Node 0x1d [Audio Selector] wcaps 0x30090d: Stereo Amp-Out R/L
  Amp-Out caps: ofs=0x00, nsteps=0x0f, stepsize=0x05, mute=1
  Amp-Out vals:  [0x0c 0x0c]
  Connection: 4
     0x1b* 0x17 0x18 0x19
Node 0x1e [Pin Complex] wcaps 0x400301: Stereo Digital
  Pincap 0x00000010: OUT
  Pin Default 0x40f000f3: [N/A] Other at Ext N/A
    Conn = Unknown, Color = Unknown
    DefAssociation = 0xf, Sequence = 0x3
  Pin-ctls: 0x00:
  Connection: 1
     0x24
Node 0x1f [Pin Complex] wcaps 0x400701: Stereo Digital
  Pincap 0x00010010: OUT EAPD
  EAPD 0x0:
  Pin Default 0x40f000f6: [N/A] Other at Ext N/A
    Conn = Unknown, Color = Unknown
    DefAssociation = 0xf, Sequence = 0x6
  Pin-ctls: 0x00:
  Power: setting=D0, actual=D0
  Connection: 2
     0x24* 0x25
Node 0x20 [Pin Complex] wcaps 0x400301: Stereo Digital
  Pincap 0x00000010: OUT
  Pin Default 0x40f000f7: [N/A] Other at Ext N/A
    Conn = Unknown, Color = Unknown
    DefAssociation = 0xf, Sequence = 0x7
  Pin-ctls: 0x00:
  Connection: 1
     0x25
Node 0x21 [Audio Output] wcaps 0x40211: Stereo Digital
  Converter: stream=0, channel=0
  Digital:
  Digital category: 0x0
  PCM:
    rates [0x7e0]: 44100 48000 88200 96000 176400 192000
    bits [0xe]: 16 20 24
    formats [0x5]: PCM AC3
  Delay: 4 samples
Node 0x22 [Audio Output] wcaps 0x40211: Stereo Digital
  Converter: stream=0, channel=0
  Digital:
  Digital category: 0x0
  PCM:
    rates [0x7e0]: 44100 48000 88200 96000 176400 192000
    bits [0xe]: 16 20 24
    formats [0x5]: PCM AC3
  Delay: 4 samples
Node 0x23 [Vendor Defined Widget] wcaps 0xf00000: Mono
Node 0x24 [Audio Selector] wcaps 0x300101: Stereo
  Connection: 3
     0x21* 0x1c 0x1d
Node 0x25 [Audio Selector] wcaps 0x300101: Stereo
  Connection: 3
     0x22* 0x1c 0x1d
Node 0x26 [Beep Generator Widget] wcaps 0x70000c: Mono Amp-Out
  Amp-Out caps: ofs=0x03, nsteps=0x03, stepsize=0x17, mute=1
  Amp-Out vals:  [0x00]
Node 0x27 [Pin Complex] wcaps 0x400000: Mono
  Pincap 0x00000020: IN
  Pin Default 0x40f000f0: [N/A] Other at Ext N/A
    Conn = Unknown, Color = Unknown
    DefAssociation = 0xf, Sequence = 0x0
  Pin-ctls: 0x00:
Node 0x28 [Volume Knob Widget] wcaps 0x600000: Mono
  Volume-Knob: delta=1, steps=127, direct=1, val=127
  Connection: 2
     0x10* 0x11
Codec: Generic 10de ID 3
Address: 2
Vendor Id: 0x10de0003
Subsystem Id: 0x10de0101
Revision Id: 0x100000
No Modem Function Group found
Default PCM:
    rates [0x0]:
    bits [0x0]:
    formats [0x0]:
Default Amp-In caps: N/A
Default Amp-Out caps: N/A
GPIO: io=0, o=0, i=0, unsolicited=0, wake=0
Node 0x04 [Audio Output] wcaps 0x211: Stereo Digital
  Converter: stream=0, channel=0
  Digital:
  Digital category: 0x0
  PCM:
    rates [0xc0]: 48000 88200
    bits [0xf]: 8 16 20 24
    formats [0x1]: PCM
Node 0x05 [Pin Complex] wcaps 0x400381: Stereo Digital
  Pincap 0x00000014: OUT Detect
  Pin Default 0x18560110: [Jack] Digital Out at Int HDMI
    Conn = Digital, Color = Unknown
    DefAssociation = 0x1, Sequence = 0x0
    Misc = NO_PRESENCE
  Pin-ctls: 0x00:
  Unsolicited: tag=00, enabled=0
  Connection: 1
     0x04
Node 0x06 [Audio Output] wcaps 0x211: Stereo Digital
  Converter: stream=0, channel=0
  Digital:
  Digital category: 0x0
  PCM:
    rates [0xc0]: 48000 88200
    bits [0xf]: 8 16 20 24
    formats [0x1]: PCM
Node 0x07 [Pin Complex] wcaps 0x400381: Stereo Digital
  Pincap 0x00000014: OUT Detect
  Pin Default 0x58560121: [N/A] Digital Out at Int HDMI
    Conn = Digital, Color = Unknown
    DefAssociation = 0x2, Sequence = 0x1
    Misc = NO_PRESENCE
  Pin-ctls: 0x00:
  Unsolicited: tag=00, enabled=0
  Connection: 1
     0x06
Node 0x08 [Audio Output] wcaps 0x211: Stereo Digital
  Converter: stream=0, channel=0
  Digital:
  Digital category: 0x0
  PCM:
    rates [0xc0]: 48000 88200
    bits [0xf]: 8 16 20 24
    formats [0x1]: PCM
Node 0x09 [Pin Complex] wcaps 0x400381: Stereo Digital
  Pincap 0x00000014: OUT Detect
  Pin Default 0x58560122: [N/A] Digital Out at Int HDMI
    Conn = Digital, Color = Unknown
    DefAssociation = 0x2, Sequence = 0x2
    Misc = NO_PRESENCE
  Pin-ctls: 0x00:
  Unsolicited: tag=00, enabled=0
  Connection: 1
     0x08
Node 0x0a [Audio Output] wcaps 0x211: Stereo Digital
  Converter: stream=0, channel=0
  Digital:
  Digital category: 0x0
  PCM:
    rates [0xc0]: 48000 88200
    bits [0xf]: 8 16 20 24
    formats [0x1]: PCM
Node 0x0b [Pin Complex] wcaps 0x400381: Stereo Digital
  Pincap 0x00000014: OUT Detect
  Pin Default 0x58560123: [N/A] Digital Out at Int HDMI
    Conn = Digital, Color = Unknown
    DefAssociation = 0x2, Sequence = 0x3
    Misc = NO_PRESENCE
  Pin-ctls: 0x00:
  Unsolicited: tag=00, enabled=0
  Connection: 1
     0x0a
Node 0x0c [Audio Output] wcaps 0x211: Stereo Digital
  Converter: stream=0, channel=0
  Digital:
  Digital category: 0x0
  PCM:
    rates [0xc0]: 48000 88200
    bits [0xf]: 8 16 20 24
    formats [0x1]: PCM
Node 0x0d [Pin Complex] wcaps 0x400381: Stereo Digital
  Pincap 0x00000014: OUT Detect
  Pin Default 0x58560124: [N/A] Digital Out at Int HDMI
    Conn = Digital, Color = Unknown
    DefAssociation = 0x2, Sequence = 0x4
    Misc = NO_PRESENCE
  Pin-ctls: 0x00:
  Unsolicited: tag=00, enabled=0
  Connection: 1
     0x0c
--endcollapse--


!!ALSA Device nodes
!!-----------------

crw-rw----  1 root audio 116, 6 Jan 22 11:36 /dev/snd/controlC0
crw-rw----  1 root audio 116, 5 Jan 22 11:37 /dev/snd/pcmC0D0c
crw-rw----  1 root audio 116, 4 Jan 22 11:37 /dev/snd/pcmC0D0p
crw-rw----  1 root audio 116, 3 Jan 22 11:36 /dev/snd/seq
crw-rw----  1 root audio 116, 2 Jan 22 11:36 /dev/snd/timer


!!Aplay/Arecord output
!!------------

APLAY

**** List of PLAYBACK Hardware Devices ****
card 0: Intel [HDA Intel], device 0: STAC92xx Analog [STAC92xx Analog]
  Subdevices: 1/1
  Subdevice #0: subdevice #0

ARECORD

**** List of CAPTURE Hardware Devices ****
card 0: Intel [HDA Intel], device 0: STAC92xx Analog [STAC92xx Analog]
  Subdevices: 2/2
  Subdevice #0: subdevice #0
  Subdevice #1: subdevice #1

!!Amixer output
!!-------------

!!-------Mixer controls for card 0 [Intel]

Card hw:0 'Intel'/'HDA Intel at 0xdf300000 irq 310'
  Mixer name	: 'Generic 10de ID 3'
  Components	: 'HDA:111d76b2,103c30f7,00100302 HDA:10de0003,10de0101,00100000'
  Controls      : 30
  Simple ctrls  : 21
Simple mixer control 'Master',0
  Capabilities: pvolume pvolume-joined pswitch pswitch-joined
  Playback channels: Mono
  Limits: Playback 0 - 127
  Mono: Playback 122 [96%] [-3.75dB] [on]
Simple mixer control 'Headphone',0
  Capabilities: pvolume pswitch
  Playback channels: Front Left - Front Right
  Limits: Playback 0 - 127
  Mono:
  Front Left: Playback 103 [81%] [-18.00dB] [on]
  Front Right: Playback 103 [81%] [-18.00dB] [on]
Simple mixer control 'PCM',0
  Capabilities: pvolume
  Playback channels: Front Left - Front Right
  Limits: Playback 0 - 255
  Mono:
  Front Left: Playback 255 [100%] [0.00dB]
  Front Right: Playback 255 [100%] [0.00dB]
Simple mixer control 'Front',0
  Capabilities: pvolume pswitch
  Playback channels: Front Left - Front Right
  Limits: Playback 0 - 127
  Mono:
  Front Left: Playback 102 [80%] [-18.75dB] [on]
  Front Right: Playback 102 [80%] [-18.75dB] [on]
Simple mixer control 'IEC958 Playback Source',0
  Capabilities: enum
  Items: 'Digital Playback' 'Analog Mux 1' 'Analog Mux 2'
  Item0: 'Digital Playback'
Simple mixer control 'IEC958 Playback Source',1
  Capabilities: enum
  Items: 'Digital Playback' 'Analog Mux 1' 'Analog Mux 2'
  Item0: 'Digital Playback'
Simple mixer control 'Capture',0
  Capabilities: cvolume cswitch
  Capture channels: Front Left - Front Right
  Limits: Capture 0 - 15
  Front Left: Capture 15 [100%] [22.50dB] [on]
  Front Right: Capture 15 [100%] [22.50dB] [on]
Simple mixer control 'Capture',1
  Capabilities: cvolume cswitch
  Capture channels: Front Left - Front Right
  Limits: Capture 0 - 15
  Front Left: Capture 12 [80%] [18.00dB] [on]
  Front Right: Capture 12 [80%] [18.00dB] [on]
Simple mixer control 'Analog Loopback',0
  Capabilities: pswitch pswitch-joined
  Playback channels: Mono
  Mono: Playback [off]
Simple mixer control 'Analog Loopback',1
  Capabilities: pswitch pswitch-joined
  Playback channels: Mono
  Mono: Playback [off]
Simple mixer control 'DAC0',0
  Capabilities: cvolume cswitch
  Capture channels: Front Left - Front Right
  Limits: Capture 0 - 31
  Front Left: Capture 23 [74%] [0.00dB] [off]
  Front Right: Capture 23 [74%] [0.00dB] [off]
Simple mixer control 'DAC1',0
  Capabilities: cvolume cswitch
  Capture channels: Front Left - Front Right
  Limits: Capture 0 - 31
  Front Left: Capture 31 [100%] [12.00dB] [on]
  Front Right: Capture 31 [100%] [12.00dB] [on]
Simple mixer control 'Digital',0
  Capabilities: cvolume
  Capture channels: Front Left - Front Right
  Limits: Capture 0 - 120
  Front Left: Capture 0 [0%] [-30.00dB]
  Front Right: Capture 107 [89%] [23.50dB]
Simple mixer control 'Digital Input Source',0
  Capabilities: enum
  Items: 'Analog Inputs' 'Mixer' 'Digital Mic 1' 'Digital Mic 2'
  Item0: 'Analog Inputs'
Simple mixer control 'Digital Input Source',1
  Capabilities: enum
  Items: 'Analog Inputs' 'Mixer' 'Digital Mic 1' 'Digital Mic 2'
  Item0: 'Analog Inputs'
Simple mixer control 'Import0 Mux',0
  Capabilities: cvolume cswitch
  Capture channels: Front Left - Front Right
  Limits: Capture 0 - 31
  Front Left: Capture 26 [84%] [4.50dB] [off]
  Front Right: Capture 26 [84%] [4.50dB] [off]
Simple mixer control 'Import1 Mux',0
  Capabilities: cvolume cswitch
  Capture channels: Front Left - Front Right
  Limits: Capture 0 - 31
  Front Left: Capture 25 [81%] [3.00dB] [off]
  Front Right: Capture 25 [81%] [3.00dB] [off]
Simple mixer control 'Input Source',0
  Capabilities: cenum
  Items: 'Mic'
  Item0: 'Mic'
Simple mixer control 'Input Source',1
  Capabilities: cenum
  Items: 'Mic'
  Item0: 'Mic'
Simple mixer control 'Mux',0
  Capabilities: cvolume
  Capture channels: Front Left - Front Right
  Limits: Capture 0 - 3
  Front Left: Capture 0 [0%] [0.00dB]
  Front Right: Capture 0 [0%] [0.00dB]
Simple mixer control 'Mux',1
  Capabilities: cvolume
  Capture channels: Front Left - Front Right
  Limits: Capture 0 - 3
  Front Left: Capture 0 [0%] [0.00dB]
  Front Right: Capture 0 [0%] [0.00dB]


!!Alsactl output
!!-------------

--startcollapse--
state.Intel {
	control.1 {
		comment.access 'read write'
		comment.type ENUMERATED
		comment.count 1
		comment.item.0 Mic
		iface MIXER
		name 'Input Source'
		value Mic
	}
	control.2 {
		comment.access 'read write'
		comment.type ENUMERATED
		comment.count 1
		comment.item.0 Mic
		iface MIXER
		name 'Input Source'
		index 1
		value Mic
	}
	control.3 {
		comment.access 'read write'
		comment.type BOOLEAN
		comment.count 1
		iface MIXER
		name 'Analog Loopback'
		value false
	}
	control.4 {
		comment.access 'read write'
		comment.type BOOLEAN
		comment.count 1
		iface MIXER
		name 'Analog Loopback'
		index 1
		value false
	}
	control.5 {
		comment.access 'read write'
		comment.type INTEGER
		comment.count 2
		comment.range '0 - 15'
		comment.dbmin 0
		comment.dbmax 2250
		iface MIXER
		name 'Capture Volume'
		value.0 15
		value.1 15
	}
	control.6 {
		comment.access 'read write'
		comment.type BOOLEAN
		comment.count 2
		iface MIXER
		name 'Capture Switch'
		value.0 true
		value.1 true
	}
	control.7 {
		comment.access 'read write'
		comment.type INTEGER
		comment.count 2
		comment.range '0 - 15'
		comment.dbmin 0
		comment.dbmax 2250
		iface MIXER
		name 'Capture Volume'
		index 1
		value.0 12
		value.1 12
	}
	control.8 {
		comment.access 'read write'
		comment.type BOOLEAN
		comment.count 2
		iface MIXER
		name 'Capture Switch'
		index 1
		value.0 true
		value.1 true
	}
	control.9 {
		comment.access 'read write'
		comment.type BOOLEAN
		comment.count 2
		iface MIXER
		name 'Import0 Mux Capture Switch'
		value.0 false
		value.1 false
	}
	control.10 {
		comment.access 'read write'
		comment.type INTEGER
		comment.count 2
		comment.range '0 - 31'
		comment.dbmin -3450
		comment.dbmax 1200
		iface MIXER
		name 'Import0 Mux Capture Volume'
		value.0 26
		value.1 26
	}
	control.11 {
		comment.access 'read write'
		comment.type BOOLEAN
		comment.count 2
		iface MIXER
		name 'Import1 Mux Capture Switch'
		value.0 false
		value.1 false
	}
	control.12 {
		comment.access 'read write'
		comment.type INTEGER
		comment.count 2
		comment.range '0 - 31'
		comment.dbmin -3450
		comment.dbmax 1200
		iface MIXER
		name 'Import1 Mux Capture Volume'
		value.0 25
		value.1 25
	}
	control.13 {
		comment.access 'read write'
		comment.type BOOLEAN
		comment.count 2
		iface MIXER
		name 'DAC0 Capture Switch'
		value.0 false
		value.1 false
	}
	control.14 {
		comment.access 'read write'
		comment.type INTEGER
		comment.count 2
		comment.range '0 - 31'
		comment.dbmin -3450
		comment.dbmax 1200
		iface MIXER
		name 'DAC0 Capture Volume'
		value.0 23
		value.1 23
	}
	control.15 {
		comment.access 'read write'
		comment.type BOOLEAN
		comment.count 2
		iface MIXER
		name 'DAC1 Capture Switch'
		value.0 true
		value.1 true
	}
	control.16 {
		comment.access 'read write'
		comment.type INTEGER
		comment.count 2
		comment.range '0 - 31'
		comment.dbmin -3450
		comment.dbmax 1200
		iface MIXER
		name 'DAC1 Capture Volume'
		value.0 31
		value.1 31
	}
	control.17 {
		comment.access 'read write'
		comment.type INTEGER
		comment.count 2
		comment.range '0 - 127'
		comment.dbmin -9525
		comment.dbmax 0
		iface MIXER
		name 'Front Playback Volume'
		value.0 102
		value.1 102
	}
	control.18 {
		comment.access 'read write'
		comment.type BOOLEAN
		comment.count 2
		iface MIXER
		name 'Front Playback Switch'
		value.0 true
		value.1 true
	}
	control.19 {
		comment.access 'read write'
		comment.type INTEGER
		comment.count 2
		comment.range '0 - 127'
		comment.dbmin -9525
		comment.dbmax 0
		iface MIXER
		name 'Headphone Playback Volume'
		value.0 103
		value.1 103
	}
	control.20 {
		comment.access 'read write'
		comment.type BOOLEAN
		comment.count 2
		iface MIXER
		name 'Headphone Playback Switch'
		value.0 true
		value.1 true
	}
	control.21 {
		comment.access 'read write'
		comment.type INTEGER
		comment.count 2
		comment.range '0 - 3'
		comment.dbmin 0
		comment.dbmax 3000
		iface MIXER
		name 'Mux Capture Volume'
		value.0 0
		value.1 0
	}
	control.22 {
		comment.access 'read write'
		comment.type INTEGER
		comment.count 2
		comment.range '0 - 3'
		comment.dbmin 0
		comment.dbmax 3000
		iface MIXER
		name 'Mux Capture Volume'
		index 1
		value.0 0
		value.1 0
	}
	control.23 {
		comment.access 'read write'
		comment.type ENUMERATED
		comment.count 1
		comment.item.0 'Analog Inputs'
		comment.item.1 Mixer
		comment.item.2 'Digital Mic 1'
		comment.item.3 'Digital Mic 2'
		iface MIXER
		name 'Digital Input Source'
		value 'Analog Inputs'
	}
	control.24 {
		comment.access 'read write'
		comment.type ENUMERATED
		comment.count 1
		comment.item.0 'Analog Inputs'
		comment.item.1 Mixer
		comment.item.2 'Digital Mic 1'
		comment.item.3 'Digital Mic 2'
		iface MIXER
		name 'Digital Input Source'
		index 1
		value 'Analog Inputs'
	}
	control.25 {
		comment.access 'read write'
		comment.type ENUMERATED
		comment.count 1
		comment.item.0 'Digital Playback'
		comment.item.1 'Analog Mux 1'
		comment.item.2 'Analog Mux 2'
		iface MIXER
		name 'IEC958 Playback Source'
		value 'Digital Playback'
	}
	control.26 {
		comment.access 'read write'
		comment.type ENUMERATED
		comment.count 1
		comment.item.0 'Digital Playback'
		comment.item.1 'Analog Mux 1'
		comment.item.2 'Analog Mux 2'
		iface MIXER
		name 'IEC958 Playback Source'
		index 1
		value 'Digital Playback'
	}
	control.27 {
		comment.access 'read write'
		comment.type INTEGER
		comment.count 1
		comment.range '0 - 127'
		comment.dbmin -9525
		comment.dbmax 0
		iface MIXER
		name 'Master Playback Volume'
		value 122
	}
	control.28 {
		comment.access 'read write'
		comment.type BOOLEAN
		comment.count 1
		iface MIXER
		name 'Master Playback Switch'
		value true
	}
	control.29 {
		comment.access 'read write user'
		comment.type INTEGER
		comment.count 2
		comment.range '0 - 255'
		comment.tlv '0000000100000008ffffec1400000014'
		comment.dbmin -5100
		comment.dbmax 0
		iface MIXER
		name 'PCM Playback Volume'
		value.0 255
		value.1 255
	}
	control.30 {
		comment.access 'read write user'
		comment.type INTEGER
		comment.count 2
		comment.range '0 - 120'
		comment.tlv '0000000100000008fffff44800000032'
		comment.dbmin -3000
		comment.dbmax 3000
		iface MIXER
		name 'Digital Capture Volume'
		value.0 0
		value.1 107
	}
}
--endcollapse--


!!All Loaded Modules
!!------------------

Module
af_packet
binfmt_misc
ppdev
vmnet
vmblock
vmci
vmmon
acpi_cpufreq
cpufreq_powersave
container
cpufreq_stats
sbs
cpufreq_userspace
pci_slot
cpufreq_ondemand
sbshc
cpufreq_conservative
freq_table
iptable_filter
ip_tables
x_tables
parport_pc
lp
parport
loop
joydev
arc4
ecb
iwlagn
iwlcore
zd1211rw
rfkill
mac80211
uvcvideo
compat_ioctl32
jmb38x_ms
videodev
v4l1_compat
sdhci_pci
sdhci
evdev
pcspkr
cfg80211
psmouse
serio_raw
memstick
mmc_core
nvidia
i2c_core
snd_hda_intel
snd_pcm_oss
snd_mixer_oss
video
snd_pcm
output
leds_hp_disk
snd_seq_dummy
led_class
snd_seq_oss
snd_seq_midi
snd_rawmidi
snd_seq_midi_event
ac
snd_seq
wmi
battery
iTCO_wdt
iTCO_vendor_support
button
snd_timer
snd_seq_device
snd
soundcore
snd_page_alloc
shpchp
pci_hotplug
intel_agp
reiserfs
sr_mod
cdrom
sd_mod
sg
ahci
libata
scsi_mod
r8169
mii
ehci_hcd
uhci_hcd
usbcore
thermal
processor
fan
fuse


