
!!################################
!!ALSA Information Script v 0.4.54
!!################################

!!Script ran on: Mon Feb 16 20:09:14 UTC 2009


!!Linux Distribution
!!------------------

Ubuntu 8.10 \n \l DISTRIB_ID=Ubuntu DISTRIB_DESCRIPTION="Ubuntu 8.10"


!!Kernel Information
!!------------------

Kernel release:    2.6.29-rc4
Operating System:  GNU/Linux
Architecture:      i686
Processor:         unknown
SMP Enabled:       Yes


!!ALSA Version
!!------------

Driver version:     1.0.19
Library version:    1.0.19
Utilities version:  1.0.19


!!Loaded ALSA modules
!!-------------------

snd_hda_intel


!!Sound Servers on this system
!!----------------------------

Pulseaudio:
      Installed - Yes (/usr/bin/pulseaudio)
      Running - No

ESound Daemon:
      Installed - Yes (/usr/bin/esd)
      Running - No


!!Soundcards recognised by ALSA
!!-----------------------------

 0 [Intel          ]: HDA-Intel - HDA Intel
                      HDA Intel at 0xd8300000 irq 16


!!PCI Soundcards installed in the system
!!--------------------------------------

00:1b.0 Audio device: Intel Corporation 82801FB/FBM/FR/FW/FRW (ICH6 Family) High Definition Audio Controller (rev 03)


!!Advanced information - PCI Vendor/Device/Susbsystem ID's
!!--------------------------------------------------------

00:1b.0 0403: 8086:2668 (rev 03)
	Subsystem: 15bd:3101


!!Modprobe options (Sound related)
!!--------------------------------

snd-atiixp-modem: index=-2
snd-intel8x0m: index=-2
snd-via82xx-modem: index=-2
snd-usb-audio: index=-2
snd-usb-usx2y: index=-2
snd-usb-caiaq: index=-2
snd-cmipci: mpu_port=0x330 fm_port=0x388
snd-pcsp: index=-2
snd-hda-intel: model=dell-s14


!!Loaded sound module options
!!--------------------------

!!Module: snd_hda_intel
bdl_pos_adj : 1,-1,-1,-1,-1,-1,-1,-1
enable : Y,Y,Y,Y,Y,Y,Y,Y
enable_msi : 0
id : <NULL>,<NULL>,<NULL>,<NULL>,<NULL>,<NULL>,<NULL>,<NULL>
index : -1,-1,-1,-1,-1,-1,-1,-1
model : dell-s14,<NULL>,<NULL>,<NULL>,<NULL>,<NULL>,<NULL>,<NULL>
position_fix : 0,0,0,0,0,0,0,0
probe_mask : -1,-1,-1,-1,-1,-1,-1,-1
probe_only : N,N,N,N,N,N,N,N
single_cmd : N


!!HDA-Intel Codec information
!!---------------------------
--startcollapse--

Codec: IDT 92HD83C1X5
Address: 2
Vendor Id: 0x111d7604
Subsystem Id: 0x100
Revision Id: 0x100302
No Modem Function Group found
Default PCM:
    rates [0x5e0]: 44100 48000 88200 96000 192000
    bits [0xe]: 16 20 24
    formats [0x1]: PCM
Default Amp-In caps: ofs=0x00, nsteps=0x03, stepsize=0x27, mute=0
Default Amp-Out caps: ofs=0x7f, nsteps=0x7f, stepsize=0x02, mute=1
GPIO: io=3, o=0, i=0, unsolicited=1, wake=1
  IO[0]: enable=0, dir=0, wake=0, sticky=0, data=0, unsol=0
  IO[1]: enable=0, dir=0, wake=0, sticky=0, data=0, unsol=0
  IO[2]: enable=0, dir=0, wake=0, sticky=0, data=0, unsol=0
Power-Map: 0x00
Node 0x0a [Pin Complex] wcaps 0x400581: Stereo
  Pincap 0x0001001c: OUT HP EAPD Detect
  EAPD 0x2: EAPD
  Pin Default 0x02214030: [Jack] HP Out at Ext Front
    Conn = 1/8, Color = Green
    DefAssociation = 0x3, Sequence = 0x0
  Pin-ctls: 0x00:
  Unsolicited: tag=02, enabled=1
  Power: setting=D0, actual=D0
  Connection: 4
     0x13 0x14* 0x1c 0x22
Node 0x0b [Pin Complex] wcaps 0x400581: Stereo
  Pincap 0x0001001c: OUT HP EAPD Detect
  EAPD 0x2: EAPD
  Pin Default 0x02211010: [Jack] HP Out at Ext Front
    Conn = 1/8, Color = Black
    DefAssociation = 0x1, Sequence = 0x0
  Pin-ctls: 0x00:
  Unsolicited: tag=01, enabled=1
  Power: setting=D0, actual=D0
  Connection: 4
     0x13 0x14* 0x1c 0x22
Node 0x0c [Pin Complex] wcaps 0x400583: Stereo Amp-In
  Amp-In caps: N/A
  Amp-In vals:  [0x00 0x00]
  Pincap 0x00011734: IN OUT EAPD Detect
    Vref caps: HIZ 50 GRD 80
  EAPD 0x2: EAPD
  Pin Default 0x02a19020: [Jack] Mic at Ext Front
    Conn = 1/8, Color = Pink
    DefAssociation = 0x2, Sequence = 0x0
  Pin-ctls: 0x24: IN VREF_80
  Unsolicited: tag=03, enabled=1
  Power: setting=D0, actual=D0
  Connection: 4
     0x13 0x14 0x1c 0x22*
Node 0x0d [Pin Complex] wcaps 0x400501: Stereo
  Pincap 0x00010050: OUT EAPD Balanced
  EAPD 0x2: EAPD
  Pin Default 0x01014050: [Jack] Line Out at Ext Rear
    Conn = 1/8, Color = Green
    DefAssociation = 0x5, Sequence = 0x0
  Pin-ctls: 0x40: OUT
  Power: setting=D0, actual=D0
  Connection: 4
     0x13* 0x14 0x1c 0x22
Node 0x0e [Pin Complex] wcaps 0x400583: Stereo Amp-In
  Amp-In caps: N/A
  Amp-In vals:  [0x00 0x00]
  Pincap 0x00010034: IN OUT EAPD Detect
  EAPD 0x2: EAPD
  Pin Default 0x40f000f0: [N/A] Other at Ext N/A
    Conn = Unknown, Color = Unknown
    DefAssociation = 0xf, Sequence = 0x0
  Pin-ctls: 0x40: OUT
  Unsolicited: tag=00, enabled=0
  Power: setting=D0, actual=D0
  Connection: 4
     0x13 0x14 0x1c 0x22*
Node 0x0f [Pin Complex] wcaps 0x400583: Stereo Amp-In
  Amp-In caps: N/A
  Amp-In vals:  [0x00 0x00]
  Pincap 0x00011734: IN OUT EAPD Detect
    Vref caps: HIZ 50 GRD 80
  EAPD 0x2: EAPD
  Pin Default 0x01819040: [Jack] Line In at Ext Rear
    Conn = 1/8, Color = Pink
    DefAssociation = 0x4, Sequence = 0x0
  Pin-ctls: 0x60: IN OUT VREF_HIZ
  Unsolicited: tag=04, enabled=1
  Power: setting=D0, actual=D0
  Connection: 4
     0x13 0x14 0x1c 0x22*
Node 0x10 [Pin Complex] wcaps 0x400500: Mono
  Pincap 0x00000010: OUT
  Pin Default 0x40f000f0: [N/A] Other at Ext N/A
    Conn = Unknown, Color = Unknown
    DefAssociation = 0xf, Sequence = 0x0
  Pin-ctls: 0x40: OUT
  Power: setting=D0, actual=D0
  Connection: 1
     0x1a
Node 0x11 [Pin Complex] wcaps 0x400483: Stereo Amp-In
  Amp-In caps: N/A
  Amp-In vals:  [0x00 0x00]
  Pincap 0x00000024: IN Detect
  Pin Default 0x90a60160: [Fixed] Mic at Int N/A
    Conn = Digital, Color = Unknown
    DefAssociation = 0x6, Sequence = 0x0
    Misc = NO_PRESENCE
  Pin-ctls: 0x20: IN
  Unsolicited: tag=00, enabled=0
  Power: setting=D0, actual=D0
Node 0x12 [Vendor Defined Widget] wcaps 0xf00503: Stereo Amp-In
  Amp-In caps: N/A
  Amp-In vals:  [0x00 0x00]
  Power: setting=D0, actual=D0
  Connection: 1
     0x20
Node 0x13 [Audio Output] wcaps 0xd0c05: Stereo Amp-Out R/L
  Amp-Out caps: N/A
  Amp-Out vals:  [0x60 0x60]
  Converter: stream=0, channel=0
  Power: setting=D0, actual=D0
  Delay: 13 samples
Node 0x14 [Audio Output] wcaps 0xd0c05: Stereo Amp-Out R/L
  Amp-Out caps: N/A
  Amp-Out vals:  [0x5a 0x5a]
  Converter: stream=0, channel=0
  Power: setting=D0, actual=D0
  Delay: 13 samples
Node 0x15 [Audio Input] wcaps 0x1d0541: Stereo
  Converter: stream=0, channel=0
  SDI-Select: 0
  Power: setting=D0, actual=D0
  Delay: 13 samples
  Connection: 1
     0x17
  Processing caps: benign=0, ncoeff=0
Node 0x16 [Audio Input] wcaps 0x1d0541: Stereo
  Converter: stream=0, channel=0
  SDI-Select: 0
  Power: setting=D0, actual=D0
  Delay: 13 samples
  Connection: 1
     0x18
  Processing caps: benign=0, ncoeff=0
Node 0x17 [Audio Selector] wcaps 0x300d0d: Stereo Amp-Out R/L
  Amp-Out caps: ofs=0x00, nsteps=0x0f, stepsize=0x05, mute=1
  Amp-Out vals:  [0x08 0x08]
  Power: setting=D0, actual=D0
  Connection: 6
     0x0c* 0x0e 0x0f 0x1b 0x11 0x12
Node 0x18 [Audio Selector] wcaps 0x300d0d: Stereo Amp-Out R/L
  Amp-Out caps: ofs=0x00, nsteps=0x0f, stepsize=0x05, mute=1
  Amp-Out vals:  [0x80 0x80]
  Power: setting=D0, actual=D0
  Connection: 6
     0x0c* 0x0e 0x0f 0x1b 0x11 0x12
Node 0x19 [Audio Selector] wcaps 0x300501: Stereo
  Power: setting=D0, actual=D0
  Connection: 4
     0x13* 0x14 0x1c 0x22
Node 0x1a [Audio Mixer] wcaps 0x200500: Mono
  Power: setting=D0, actual=D0
  Connection: 1
     0x19
Node 0x1b [Audio Mixer] wcaps 0x20050b: Stereo Amp-In
  Amp-In caps: ofs=0x17, nsteps=0x1f, stepsize=0x05, mute=1
  Amp-In vals:  [0x97 0x97] [0x97 0x97] [0x97 0x97] [0x97 0x97] [0x97 0x97]
  Power: setting=D0, actual=D0
  Connection: 5
     0x0c 0x0e 0x0f 0x13 0x14
Node 0x1c [Audio Selector] wcaps 0x30050d: Stereo Amp-Out
  Amp-Out caps: ofs=0x1f, nsteps=0x1f, stepsize=0x05, mute=1
  Amp-Out vals:  [0x9f 0x9f]
  Power: setting=D0, actual=D0
  Connection: 1
     0x1b
Node 0x1d [Audio Output] wcaps 0x4061d: Stereo Digital Amp-Out
  Amp-Out caps: ofs=0x00, nsteps=0x00, stepsize=0x00, mute=1
  Amp-Out vals:  [0x00 0x00]
  Converter: stream=0, channel=0
  Digital:
  Digital category: 0x0
  PCM:
    rates [0x5e0]: 44100 48000 88200 96000 192000
    bits [0xe]: 16 20 24
    formats [0x5]: PCM AC3
  Power: setting=D0, actual=D0
  Delay: 4 samples
Node 0x1e [Audio Output] wcaps 0x4061d: Stereo Digital Amp-Out
  Amp-Out caps: ofs=0x00, nsteps=0x00, stepsize=0x00, mute=1
  Amp-Out vals:  [0x00 0x00]
  Converter: stream=0, channel=0
  Digital:
  Digital category: 0x0
  PCM:
    rates [0x5e0]: 44100 48000 88200 96000 192000
    bits [0xe]: 16 20 24
    formats [0x5]: PCM AC3
  Power: setting=D0, actual=D0
  Delay: 4 samples
Node 0x1f [Pin Complex] wcaps 0x400781: Stereo Digital
  Pincap 0x00000014: OUT Detect
  Pin Default 0x40f000f0: [N/A] Other at Ext N/A
    Conn = Unknown, Color = Unknown
    DefAssociation = 0xf, Sequence = 0x0
  Pin-ctls: 0x00:
  Unsolicited: tag=00, enabled=0
  Power: setting=D0, actual=D0
  Connection: 1
     0x1d
Node 0x20 [Pin Complex] wcaps 0x400781: Stereo Digital
  Pincap 0x00000034: IN OUT Detect
  Pin Default 0x40f000f0: [N/A] Other at Ext N/A
    Conn = Unknown, Color = Unknown
    DefAssociation = 0xf, Sequence = 0x0
  Pin-ctls: 0x40: OUT
  Unsolicited: tag=00, enabled=0
  Power: setting=D0, actual=D0
  Connection: 1
     0x1e
Node 0x21 [Beep Generator Widget] wcaps 0x70000c: Mono Amp-Out
  Amp-Out caps: ofs=0x03, nsteps=0x03, stepsize=0x17, mute=1
  Amp-Out vals:  [0x00]
Node 0x22 [Audio Output] wcaps 0xd0c05: Stereo Amp-Out R/L
  Amp-Out caps: N/A
  Amp-Out vals:  [0x80 0x80]
  Converter: stream=0, channel=0
  Power: setting=D0, actual=D0
  Delay: 13 samples
--endcollapse--


!!ALSA Device nodes
!!-----------------

crw-rw---- 1 root audio 116,  0 Feb 16 15:07 /dev/snd/controlC0
crw-rw---- 1 root audio 116, 24 Feb 16 15:07 /dev/snd/pcmC0D0c
crw-rw---- 1 root audio 116, 16 Feb 16 15:06 /dev/snd/pcmC0D0p
crw-rw---- 1 root audio 116, 33 Feb 16 15:07 /dev/snd/timer


!!Aplay/Arecord output
!!------------

APLAY

**** List of PLAYBACK Hardware Devices ****
card 0: Intel [HDA Intel], device 0: STAC92xx Analog [STAC92xx Analog]
  Subdevices: 1/1
  Subdevice #0: subdevice #0

ARECORD

**** List of CAPTURE Hardware Devices ****
card 0: Intel [HDA Intel], device 0: STAC92xx Analog [STAC92xx Analog]
  Subdevices: 2/2
  Subdevice #0: subdevice #0
  Subdevice #1: subdevice #1

!!Amixer output
!!-------------

!!-------Mixer controls for card 0 [Intel]

Card hw:0 'Intel'/'HDA Intel at 0xd8300000 irq 16'
  Mixer name	: 'IDT 92HD83C1X5'
  Components	: 'HDA:111d7604,00000100,00100302'
  Controls      : 28
  Simple ctrls  : 18
Simple mixer control 'Master',0
  Capabilities: pvolume pvolume-joined pswitch pswitch-joined
  Playback channels: Mono
  Limits: Playback 0 - 64
  Mono: Playback 54 [84%] [-7.50dB] [on]
Simple mixer control 'Headphone',0
  Capabilities: pvolume pswitch
  Playback channels: Front Left - Front Right
  Limits: Playback 0 - 64
  Mono:
  Front Left: Playback 53 [83%] [-8.25dB] [on]
  Front Right: Playback 53 [83%] [-8.25dB] [on]
Simple mixer control 'Headphone as Line Out',0
  Capabilities: pswitch pswitch-joined
  Playback channels: Mono
  Mono: Playback [off]
Simple mixer control 'PCM',0
  Capabilities: pvolume
  Playback channels: Front Left - Front Right
  Limits: Playback 0 - 255
  Mono:
  Front Left: Playback 255 [100%] [0.00dB]
  Front Right: Playback 255 [100%] [0.00dB]
Simple mixer control 'Front',0
  Capabilities: pvolume pswitch
  Playback channels: Front Left - Front Right
  Limits: Playback 0 - 64
  Mono:
  Front Left: Playback 37 [58%] [-20.25dB] [on]
  Front Right: Playback 37 [58%] [-20.25dB] [on]
Simple mixer control 'Front Mic',0
  Capabilities: cvolume cswitch
  Capture channels: Front Left - Front Right
  Limits: Capture 0 - 31
  Front Left: Capture 23 [74%] [0.00dB] [off]
  Front Right: Capture 23 [74%] [0.00dB] [off]
Simple mixer control 'Surround',0
  Capabilities: pvolume pswitch
  Playback channels: Front Left - Front Right
  Limits: Playback 0 - 64
  Mono:
  Front Left: Playback 0 [0%] [-48.00dB] [off]
  Front Right: Playback 0 [0%] [-48.00dB] [off]
Simple mixer control 'Line In',0
  Capabilities: cvolume cswitch
  Capture channels: Front Left - Front Right
  Limits: Capture 0 - 31
  Front Left: Capture 23 [74%] [0.00dB] [off]
  Front Right: Capture 23 [74%] [0.00dB] [off]
Simple mixer control 'Line In as Output',0
  Capabilities: pswitch pswitch-joined
  Playback channels: Mono
  Mono: Playback [off]
Simple mixer control 'Mic as Output',0
  Capabilities: pswitch pswitch-joined
  Playback channels: Mono
  Mono: Playback [off]
Simple mixer control 'Mono Mux',0
  Capabilities: enum
  Items: 'DAC0' 'DAC1' 'Mixer' 'DAC2'
  Item0: 'DAC0'
Simple mixer control 'Capture',0
  Capabilities: cvolume cswitch
  Capture channels: Front Left - Front Right
  Limits: Capture 0 - 15
  Front Left: Capture 8 [53%] [12.00dB] [on]
  Front Right: Capture 8 [53%] [12.00dB] [on]
Simple mixer control 'Capture',1
  Capabilities: cvolume cswitch
  Capture channels: Front Left - Front Right
  Limits: Capture 0 - 15
  Front Left: Capture 0 [0%] [0.00dB] [off]
  Front Right: Capture 0 [0%] [0.00dB] [off]
Simple mixer control 'Amp',0
  Capabilities: cvolume
  Capture channels: Front Left - Front Right
  Limits: Capture 0 - 3
  Front Left: Capture 0 [0%] [0.00dB]
  Front Right: Capture 0 [0%] [0.00dB]
Simple mixer control 'DAC0',0
  Capabilities: cvolume cswitch
  Capture channels: Front Left - Front Right
  Limits: Capture 0 - 31
  Front Left: Capture 23 [74%] [0.00dB] [off]
  Front Right: Capture 23 [74%] [0.00dB] [off]
Simple mixer control 'DAC1',0
  Capabilities: cvolume cswitch
  Capture channels: Front Left - Front Right
  Limits: Capture 0 - 31
  Front Left: Capture 23 [74%] [0.00dB] [off]
  Front Right: Capture 23 [74%] [0.00dB] [off]
Simple mixer control 'Digital Input Source',0
  Capabilities: enum
  Items: 'Analog Inputs' 'Digital Mic 1' 'Digital Mic 2'
  Item0: 'Analog Inputs'
Simple mixer control 'Digital Input Source',1
  Capabilities: enum
  Items: 'Analog Inputs' 'Digital Mic 1' 'Digital Mic 2'
  Item0: 'Analog Inputs'


!!Alsactl output
!!-------------

--startcollapse--
state.Intel {
	control.1 {
		comment.access 'read write'
		comment.type INTEGER
		comment.count 2
		comment.range '0 - 15'
		comment.dbmin 0
		comment.dbmax 2250
		iface MIXER
		name 'Capture Volume'
		value.0 8
		value.1 8
	}
	control.2 {
		comment.access 'read write'
		comment.type BOOLEAN
		comment.count 2
		iface MIXER
		name 'Capture Switch'
		value.0 true
		value.1 true
	}
	control.3 {
		comment.access 'read write'
		comment.type INTEGER
		comment.count 2
		comment.range '0 - 15'
		comment.dbmin 0
		comment.dbmax 2250
		iface MIXER
		name 'Capture Volume'
		index 1
		value.0 0
		value.1 0
	}
	control.4 {
		comment.access 'read write'
		comment.type BOOLEAN
		comment.count 2
		iface MIXER
		name 'Capture Switch'
		index 1
		value.0 false
		value.1 false
	}
	control.5 {
		comment.access 'read write'
		comment.type INTEGER
		comment.count 2
		comment.range '0 - 31'
		comment.dbmin -3450
		comment.dbmax 1200
		iface MIXER
		name 'DAC0 Capture Volume'
		value.0 23
		value.1 23
	}
	control.6 {
		comment.access 'read write'
		comment.type BOOLEAN
		comment.count 2
		iface MIXER
		name 'DAC0 Capture Switch'
		value.0 false
		value.1 false
	}
	control.7 {
		comment.access 'read write'
		comment.type INTEGER
		comment.count 2
		comment.range '0 - 31'
		comment.dbmin -3450
		comment.dbmax 1200
		iface MIXER
		name 'DAC1 Capture Volume'
		value.0 23
		value.1 23
	}
	control.8 {
		comment.access 'read write'
		comment.type BOOLEAN
		comment.count 2
		iface MIXER
		name 'DAC1 Capture Switch'
		value.0 false
		value.1 false
	}
	control.9 {
		comment.access 'read write'
		comment.type INTEGER
		comment.count 2
		comment.range '0 - 31'
		comment.dbmin -3450
		comment.dbmax 1200
		iface MIXER
		name 'Front Mic Capture Volume'
		value.0 23
		value.1 23
	}
	control.10 {
		comment.access 'read write'
		comment.type BOOLEAN
		comment.count 2
		iface MIXER
		name 'Front Mic Capture Switch'
		value.0 false
		value.1 false
	}
	control.11 {
		comment.access 'read write'
		comment.type INTEGER
		comment.count 2
		comment.range '0 - 31'
		comment.dbmin -3450
		comment.dbmax 1200
		iface MIXER
		name 'Line In Capture Volume'
		value.0 23
		value.1 23
	}
	control.12 {
		comment.access 'read write'
		comment.type BOOLEAN
		comment.count 2
		iface MIXER
		name 'Line In Capture Switch'
		value.0 false
		value.1 false
	}
	control.13 {
		comment.access 'read write'
		comment.type INTEGER
		comment.count 2
		comment.range '0 - 64'
		comment.dbmin -4800
		comment.dbmax 0
		iface MIXER
		name 'Headphone Playback Volume'
		value.0 53
		value.1 53
	}
	control.14 {
		comment.access 'read write'
		comment.type BOOLEAN
		comment.count 2
		iface MIXER
		name 'Headphone Playback Switch'
		value.0 true
		value.1 true
	}
	control.15 {
		comment.access 'read write'
		comment.type INTEGER
		comment.count 2
		comment.range '0 - 64'
		comment.dbmin -4800
		comment.dbmax 0
		iface MIXER
		name 'Front Playback Volume'
		value.0 37
		value.1 37
	}
	control.16 {
		comment.access 'read write'
		comment.type BOOLEAN
		comment.count 2
		iface MIXER
		name 'Front Playback Switch'
		value.0 true
		value.1 true
	}
	control.17 {
		comment.access 'read write'
		comment.type INTEGER
		comment.count 2
		comment.range '0 - 64'
		comment.dbmin -4800
		comment.dbmax 0
		iface MIXER
		name 'Surround Playback Volume'
		value.0 0
		value.1 0
	}
	control.18 {
		comment.access 'read write'
		comment.type BOOLEAN
		comment.count 2
		iface MIXER
		name 'Surround Playback Switch'
		value.0 false
		value.1 false
	}
	control.19 {
		comment.access 'read write'
		comment.type BOOLEAN
		comment.count 1
		iface MIXER
		name 'Headphone as Line Out Switch'
		value false
	}
	control.20 {
		comment.access 'read write'
		comment.type BOOLEAN
		comment.count 1
		iface MIXER
		name 'Line In as Output Switch'
		value false
	}
	control.21 {
		comment.access 'read write'
		comment.type BOOLEAN
		comment.count 1
		iface MIXER
		name 'Mic as Output Switch'
		value false
	}
	control.22 {
		comment.access 'read write'
		comment.type ENUMERATED
		comment.count 1
		comment.item.0 DAC0
		comment.item.1 DAC1
		comment.item.2 Mixer
		comment.item.3 DAC2
		iface MIXER
		name 'Mono Mux'
		value DAC0
	}
	control.23 {
		comment.access 'read write'
		comment.type INTEGER
		comment.count 2
		comment.range '0 - 3'
		comment.dbmin 0
		comment.dbmax 3000
		iface MIXER
		name 'Amp Capture Volume'
		value.0 0
		value.1 0
	}
	control.24 {
		comment.access 'read write'
		comment.type ENUMERATED
		comment.count 1
		comment.item.0 'Analog Inputs'
		comment.item.1 'Digital Mic 1'
		comment.item.2 'Digital Mic 2'
		iface MIXER
		name 'Digital Input Source'
		value 'Analog Inputs'
	}
	control.25 {
		comment.access 'read write'
		comment.type ENUMERATED
		comment.count 1
		comment.item.0 'Analog Inputs'
		comment.item.1 'Digital Mic 1'
		comment.item.2 'Digital Mic 2'
		iface MIXER
		name 'Digital Input Source'
		index 1
		value 'Analog Inputs'
	}
	control.26 {
		comment.access 'read write'
		comment.type INTEGER
		comment.count 1
		comment.range '0 - 64'
		comment.dbmin -4800
		comment.dbmax 0
		iface MIXER
		name 'Master Playback Volume'
		value 54
	}
	control.27 {
		comment.access 'read write'
		comment.type BOOLEAN
		comment.count 1
		iface MIXER
		name 'Master Playback Switch'
		value true
	}
	control.28 {
		comment.access 'read write user'
		comment.type INTEGER
		comment.count 2
		comment.range '0 - 255'
		comment.tlv '0000000100000008ffffec1400000014'
		comment.dbmin -5100
		comment.dbmax 0
		iface MIXER
		name 'PCM Playback Volume'
		value.0 255
		value.1 255
	}
}
--endcollapse--


!!All Loaded Modules
!!------------------

Module
af_packet
radeon
drm
i2c_core
rfcomm
bridge
stp
bnep
sco
l2cap
bluetooth
ppdev
speedstep_lib
cpufreq_stats
cpufreq_conservative
cpufreq_powersave
cpufreq_ondemand
freq_table
cpufreq_userspace
container
sbs
sbshc
video
output
battery
ipv6
iptable_filter
ip_tables
x_tables
ac
sbp2
parport_pc
lp
parport
snd_hda_codec_idt
serio_raw
snd_hda_intel
snd_hda_codec
iTCO_wdt
iTCO_vendor_support
snd_pcm
pcspkr
snd_timer
intel_agp
button
agpgart
shpchp
pci_hotplug
snd
soundcore
snd_page_alloc
evdev
joydev
ext3
jbd
mbcache
sg
sd_mod
sr_mod
cdrom
pata_acpi
ata_generic
usbhid
hid
ata_piix
libata
ohci1394
scsi_mod
skge
ieee1394
ehci_hcd
sky2
uhci_hcd
usbcore
thermal
processor
fan
thermal_sys
fuse


