upload=true&script=true&cardinfo=
!!################################
!!ALSA Information Script v 0.4.51
!!################################

!!Script ran on: Wed Nov 19 18:36:46 CET 2008


!!Linux Distribution
!!------------------

Welcome to openSUSE 11.1 Beta 5 - Kernel \r (\l). LSB_VERSION="core-2.0-noarch:core-3.2-noarch:core-2.0-ia32:core-3.2-ia32" openSUSE 11.1 Beta 5 (i586)


!!Kernel Information
!!------------------

Kernel release:    2.6.27.6-HEAD_20081118175713-default
Operating System:  GNU/Linux
Architecture:      i686
Processor:         i686
SMP Enabled:       Yes


!!ALSA Version
!!------------

Driver version:     1.0.17
Library version:    
Utilities version:  1.0.18


!!Loaded ALSA modules
!!-------------------

snd_hda_intel
snd_hda_intel


!!Soundcards recognised by ALSA
!!-----------------------------

 0 [Intel          ]: HDA-Intel - HDA Intel
                      HDA Intel at 0xfc400000 irq 22
 1 [HDMI           ]: HDA-Intel - HDA ATI HDMI
                      HDA ATI HDMI at 0xcfeec000 irq 17


!!PCI Soundcards installed in the system
!!--------------------------------------

00:1b.0 Audio device: Intel Corporation 82801I (ICH9 Family) HD Audio Controller (rev 03)
01:00.1 Audio device: ATI Technologies Inc RV620 Audio device [Radeon HD 34xx Series]


!!Advanced information - PCI Vendor/Device/Susbsystem ID's
!!--------------------------------------------------------

00:1b.0 0403: 8086:293e (rev 03)
	Subsystem: 1028:029f
--
01:00.1 0403: 1002:aa28
	Subsystem: 1028:029f


!!Modprobe options (Sound related)
!!--------------------------------

snd-hda-intel: model=dell-m6
snd-hda-intel: model=dell-m6


!!Loaded sound module options
!!--------------------------

!!Module: snd_hda_intel
bdl_pos_adj : 1,32,-1,-1,-1,-1,-1,-1,-1,-1,-1,-1,-1,-1,-1,-1,-1,-1,-1,-1,-1,-1,-1,-1,-1,-1,-1,-1,-1,-1,-1,-1
enable : Y,Y,Y,Y,Y,Y,Y,Y,Y,Y,Y,Y,Y,Y,Y,Y,Y,Y,Y,Y,Y,Y,Y,Y,Y,Y,Y,Y,Y,Y,Y,Y
enable_msi : 0
id : <NULL>,<NULL>,<NULL>,<NULL>,<NULL>,<NULL>,<NULL>,<NULL>,<NULL>,<NULL>,<NULL>,<NULL>,<NULL>,<NULL>,<NULL>,<NULL>,<NULL>,<NULL>,<NULL>,<NULL>,<NULL>,<NULL>,<NULL>,<NULL>,<NULL>,<NULL>,<NULL>,<NULL>,<NULL>,<NULL>,<NULL>,<NULL>
index : -1,-1,-1,-1,-1,-1,-1,-1,-1,-1,-1,-1,-1,-1,-1,-1,-1,-1,-1,-1,-1,-1,-1,-1,-1,-1,-1,-1,-1,-1,-1,-1
model : dell-m6,<NULL>,<NULL>,<NULL>,<NULL>,<NULL>,<NULL>,<NULL>,<NULL>,<NULL>,<NULL>,<NULL>,<NULL>,<NULL>,<NULL>,<NULL>,<NULL>,<NULL>,<NULL>,<NULL>,<NULL>,<NULL>,<NULL>,<NULL>,<NULL>,<NULL>,<NULL>,<NULL>,<NULL>,<NULL>,<NULL>,<NULL>
position_fix : 0,0,0,0,0,0,0,0,0,0,0,0,0,0,0,0,0,0,0,0,0,0,0,0,0,0,0,0,0,0,0,0
power_save : 0
power_save_controller : Y
probe_mask : -1,-1,-1,-1,-1,-1,-1,-1,-1,-1,-1,-1,-1,-1,-1,-1,-1,-1,-1,-1,-1,-1,-1,-1,-1,-1,-1,-1,-1,-1,-1,-1
single_cmd : N

!!Module: snd_hda_intel
bdl_pos_adj : 1,32,-1,-1,-1,-1,-1,-1,-1,-1,-1,-1,-1,-1,-1,-1,-1,-1,-1,-1,-1,-1,-1,-1,-1,-1,-1,-1,-1,-1,-1,-1
enable : Y,Y,Y,Y,Y,Y,Y,Y,Y,Y,Y,Y,Y,Y,Y,Y,Y,Y,Y,Y,Y,Y,Y,Y,Y,Y,Y,Y,Y,Y,Y,Y
enable_msi : 0
id : <NULL>,<NULL>,<NULL>,<NULL>,<NULL>,<NULL>,<NULL>,<NULL>,<NULL>,<NULL>,<NULL>,<NULL>,<NULL>,<NULL>,<NULL>,<NULL>,<NULL>,<NULL>,<NULL>,<NULL>,<NULL>,<NULL>,<NULL>,<NULL>,<NULL>,<NULL>,<NULL>,<NULL>,<NULL>,<NULL>,<NULL>,<NULL>
index : -1,-1,-1,-1,-1,-1,-1,-1,-1,-1,-1,-1,-1,-1,-1,-1,-1,-1,-1,-1,-1,-1,-1,-1,-1,-1,-1,-1,-1,-1,-1,-1
model : dell-m6,<NULL>,<NULL>,<NULL>,<NULL>,<NULL>,<NULL>,<NULL>,<NULL>,<NULL>,<NULL>,<NULL>,<NULL>,<NULL>,<NULL>,<NULL>,<NULL>,<NULL>,<NULL>,<NULL>,<NULL>,<NULL>,<NULL>,<NULL>,<NULL>,<NULL>,<NULL>,<NULL>,<NULL>,<NULL>,<NULL>,<NULL>
position_fix : 0,0,0,0,0,0,0,0,0,0,0,0,0,0,0,0,0,0,0,0,0,0,0,0,0,0,0,0,0,0,0,0
power_save : 0
power_save_controller : Y
probe_mask : -1,-1,-1,-1,-1,-1,-1,-1,-1,-1,-1,-1,-1,-1,-1,-1,-1,-1,-1,-1,-1,-1,-1,-1,-1,-1,-1,-1,-1,-1,-1,-1
single_cmd : N


!!HDA-Intel Codec information
!!---------------------------
--startcollapse--

Codec: IDT 92HD73C1X5
Address: 0
Vendor Id: 0x111d7675
Subsystem Id: 0x1028029f
Revision Id: 0x100103
No Modem Function Group found
Default PCM:
    rates [0x5e0]: 44100 48000 88200 96000 192000
    bits [0xe]: 16 20 24
    formats [0x1]: PCM
Default Amp-In caps: ofs=0x00, nsteps=0x03, stepsize=0x27, mute=0
Default Amp-Out caps: ofs=0x7f, nsteps=0x7f, stepsize=0x02, mute=1
GPIO: io=8, o=0, i=0, unsolicited=1, wake=1
  IO[0]: enable=1, dir=1, wake=0, sticky=0, data=1
  IO[1]: enable=0, dir=0, wake=0, sticky=0, data=0
  IO[2]: enable=0, dir=0, wake=0, sticky=0, data=0
  IO[3]: enable=0, dir=0, wake=0, sticky=0, data=0
  IO[4]: enable=0, dir=0, wake=0, sticky=0, data=0
  IO[5]: enable=0, dir=0, wake=0, sticky=0, data=0
  IO[6]: enable=0, dir=0, wake=0, sticky=0, data=0
  IO[7]: enable=0, dir=0, wake=0, sticky=0, data=0
Node 0x0a [Pin Complex] wcaps 0x400183: Stereo Amp-In
  Amp-In caps: N/A
  Amp-In vals:  [0x00 0x00]
  Pincap 0x0000173f: IN OUT HP Detect Trigger ImpSense
    Vref caps: HIZ 50 GRD 80
  Pin Default 0x0321101f: [Jack] HP Out at Ext Left
    Conn = 1/8, Color = Black
    DefAssociation = 0x1, Sequence = 0xf
  Pin-ctls: 0x00: VREF_HIZ
  Unsolicited: tag=30, enabled=1
  Connection: 4
     0x15* 0x16 0x17 0x1e
Node 0x0b [Pin Complex] wcaps 0x400183: Stereo Amp-In
  Amp-In caps: N/A
  Amp-In vals:  [0x00 0x00]
  Pincap 0x0000173f: IN OUT HP Detect Trigger ImpSense
    Vref caps: HIZ 50 GRD 80
  Pin Default 0x4f00000f: [N/A] Line Out at Ext UNKNOWN
    Conn = Unknown, Color = Unknown
    DefAssociation = 0x0, Sequence = 0xf
  Pin-ctls: 0x00: VREF_HIZ
  Unsolicited: tag=00, enabled=0
  Connection: 4
     0x15* 0x16 0x17 0x1e
Node 0x0c [Pin Complex] wcaps 0x400183: Stereo Amp-In
  Amp-In caps: N/A
  Amp-In vals:  [0x00 0x00]
  Pincap 0x00001737: IN OUT Detect Trigger ImpSense
    Vref caps: HIZ 50 GRD 80
  Pin Default 0x4f0000f0: [N/A] Line Out at Ext UNKNOWN
    Conn = Unknown, Color = Unknown
    DefAssociation = 0xf, Sequence = 0x0
  Pin-ctls: 0x00: VREF_HIZ
  Unsolicited: tag=00, enabled=0
  Connection: 4
     0x15* 0x16 0x17 0x1e
Node 0x0d [Pin Complex] wcaps 0x400183: Stereo Amp-In
  Amp-In caps: N/A
  Amp-In vals:  [0x00 0x00]
  Pincap 0x0000003f: IN OUT HP Detect Trigger ImpSense
  Pin Default 0x90170110: [Fixed] Speaker at Int N/A
    Conn = Analog, Color = Unknown
    DefAssociation = 0x1, Sequence = 0x0
    Misc = NO_PRESENCE
  Pin-ctls: 0x40: OUT
  Unsolicited: tag=00, enabled=0
  Connection: 4
     0x15* 0x16 0x17 0x1e
Node 0x0e [Pin Complex] wcaps 0x400183: Stereo Amp-In
  Amp-In caps: N/A
  Amp-In vals:  [0x00 0x00]
  Pincap 0x00001737: IN OUT Detect Trigger ImpSense
    Vref caps: HIZ 50 GRD 80
  Pin Default 0x03a11020: [Jack] Mic at Ext Left
    Conn = 1/8, Color = Black
    DefAssociation = 0x2, Sequence = 0x0
  Pin-ctls: 0x24: IN VREF_80
  Unsolicited: tag=00, enabled=0
  Connection: 4
     0x15* 0x16 0x17 0x1e
Node 0x0f [Pin Complex] wcaps 0x400183: Stereo Amp-In
  Amp-In caps: N/A
  Amp-In vals:  [0x00 0x00]
  Pincap 0x00000037: IN OUT Detect Trigger ImpSense
  Pin Default 0x0321101f: [Jack] HP Out at Ext Left
    Conn = 1/8, Color = Black
    DefAssociation = 0x1, Sequence = 0xf
  Pin-ctls: 0x40: OUT
  Unsolicited: tag=35, enabled=1
  Connection: 4
     0x15* 0x16 0x17 0x1e
Node 0x10 [Pin Complex] wcaps 0x400183: Stereo Amp-In
  Amp-In caps: N/A
  Amp-In vals:  [0x00 0x00]
  Pincap 0x00000037: IN OUT Detect Trigger ImpSense
  Pin Default 0x4f0000f0: [N/A] Line Out at Ext UNKNOWN
    Conn = Unknown, Color = Unknown
    DefAssociation = 0xf, Sequence = 0x0
  Pin-ctls: 0x40: OUT
  Unsolicited: tag=00, enabled=0
  Connection: 4
     0x15 0x16* 0x17 0x1e
Node 0x11 [Pin Complex] wcaps 0x400183: Stereo Amp-In
  Amp-In caps: N/A
  Amp-In vals:  [0x00 0x00]
  Pincap 0x00000037: IN OUT Detect Trigger ImpSense
  Pin Default 0x4f0000f0: [N/A] Line Out at Ext UNKNOWN
    Conn = Unknown, Color = Unknown
    DefAssociation = 0xf, Sequence = 0x0
  Pin-ctls: 0x40: OUT
  Unsolicited: tag=00, enabled=0
  Connection: 4
     0x15 0x16 0x17* 0x1e
Node 0x12 [Pin Complex] wcaps 0x400081: Stereo
  Pincap 0x00000024: IN Detect
  Pin Default 0x4f0000f0: [N/A] Line Out at Ext UNKNOWN
    Conn = Unknown, Color = Unknown
    DefAssociation = 0xf, Sequence = 0x0
  Pin-ctls: 0x00:
  Unsolicited: tag=00, enabled=0
Node 0x13 [Pin Complex] wcaps 0x400003: Stereo Amp-In
  Amp-In caps: N/A
  Amp-In vals:  [0x00 0x00]
  Pincap 0x00000020: IN
  Pin Default 0x90a60160: [Fixed] Mic at Int N/A
    Conn = Digital, Color = Unknown
    DefAssociation = 0x6, Sequence = 0x0
    Misc = NO_PRESENCE
  Pin-ctls: 0x00:
Node 0x14 [Pin Complex] wcaps 0x400003: Stereo Amp-In
  Amp-In caps: N/A
  Amp-In vals:  [0x00 0x00]
  Pincap 0x00000020: IN
  Pin Default 0x4f0000f0: [N/A] Line Out at Ext UNKNOWN
    Conn = Unknown, Color = Unknown
    DefAssociation = 0xf, Sequence = 0x0
  Pin-ctls: 0x00:
Node 0x15 [Audio Output] wcaps 0xd0c05: Stereo Amp-Out R/L
  Amp-Out caps: N/A
  Amp-Out vals:  [0x78 0x78]
  Converter: stream=0, channel=0
  Power: setting=D0, actual=D0
  Delay: 13 samples
Node 0x16 [Audio Output] wcaps 0xd0c05: Stereo Amp-Out R/L
  Amp-Out caps: N/A
  Amp-Out vals:  [0x62 0x62]
  Converter: stream=0, channel=0
  Power: setting=D0, actual=D0
  Delay: 13 samples
Node 0x17 [Audio Output] wcaps 0xd0c05: Stereo Amp-Out R/L
  Amp-Out caps: N/A
  Amp-Out vals:  [0xff 0xff]
  Converter: stream=0, channel=0
  Power: setting=D0, actual=D0
  Delay: 13 samples
Node 0x18 [Vendor Defined Widget] wcaps 0xfd0c05: Stereo Amp-Out R/L
  Amp-Out caps: N/A
  Amp-Out vals:  [0xff 0xff]
  Power: setting=D0, actual=D3
  Delay: 13 samples
Node 0x19 [Vendor Defined Widget] wcaps 0xfd0c05: Stereo Amp-Out R/L
  Amp-Out caps: N/A
  Amp-Out vals:  [0xff 0xff]
  Power: setting=D0, actual=D3
  Delay: 13 samples
Node 0x1a [Audio Input] wcaps 0x1d0541: Stereo
  Converter: stream=0, channel=0
  SDI-Select: 0
  Power: setting=D0, actual=D0
  Delay: 13 samples
  Connection: 1
     0x20
  Processing caps: benign=0, ncoeff=0
Node 0x1b [Audio Input] wcaps 0x1d0541: Stereo
  Converter: stream=0, channel=0
  SDI-Select: 0
  Power: setting=D0, actual=D0
  Delay: 13 samples
  Connection: 1
     0x21
  Processing caps: benign=0, ncoeff=0
Node 0x1c [Beep Generator Widget] wcaps 0x70000c: Mono Amp-Out
  Amp-Out caps: ofs=0x03, nsteps=0x03, stepsize=0x17, mute=1
  Amp-Out vals:  [0x00]
Node 0x1d [Audio Mixer] wcaps 0x20010b: Stereo Amp-In
  Amp-In caps: ofs=0x17, nsteps=0x1f, stepsize=0x05, mute=1
  Amp-In vals:  [0x97 0x97] [0x97 0x97] [0x97 0x97] [0x9f 0x9f] [0x97 0x97]
  Connection: 5
     0x28 0x29 0x2a 0x2b 0x12
Node 0x1e [Audio Selector] wcaps 0x30010d: Stereo Amp-Out
  Amp-Out caps: ofs=0x1f, nsteps=0x1f, stepsize=0x05, mute=1
  Amp-Out vals:  [0x9f 0x9f]
  Connection: 1
     0x1d
Node 0x1f [Volume Knob Widget] wcaps 0x600000: Mono
  Volume-Knob: delta=1, steps=127, direct=1, val=127
  Connection: 3
     0x15* 0x16 0x17
Node 0x20 [Audio Selector] wcaps 0x30090d: Stereo Amp-Out R/L
  Amp-Out caps: ofs=0x00, nsteps=0x0f, stepsize=0x05, mute=1
  Amp-Out vals:  [0x0d 0x0d]
  Connection: 12
     0x0a 0x0b 0x0c 0x0d 0x0e 0x0f 0x10 0x11 0x12 0x13 0x14 0x1d*
Node 0x21 [Audio Selector] wcaps 0x30090d: Stereo Amp-Out R/L
  Amp-Out caps: ofs=0x00, nsteps=0x0f, stepsize=0x05, mute=1
  Amp-Out vals:  [0x80 0x80]
  Connection: 12
     0x0a 0x0b 0x0c 0x0d 0x0e 0x0f 0x10 0x11 0x12 0x13 0x14 0x1d*
Node 0x22 [Pin Complex] wcaps 0x400301: Stereo Digital
  Pincap 0x00000010: OUT
  Pin Default 0x4f0000f0: [N/A] Line Out at Ext UNKNOWN
    Conn = Unknown, Color = Unknown
    DefAssociation = 0xf, Sequence = 0x0
  Pin-ctls: 0x00:
  Connection: 3
     0x25* 0x20 0x21
Node 0x23 [Pin Complex] wcaps 0x400301: Stereo Digital
  Pincap 0x00000010: OUT
  Pin Default 0x4f0000f0: [N/A] Line Out at Ext UNKNOWN
    Conn = Unknown, Color = Unknown
    DefAssociation = 0xf, Sequence = 0x0
  Pin-ctls: 0x00:
  Connection: 3
     0x26* 0x20 0x21
Node 0x24 [Pin Complex] wcaps 0x400681: Stereo Digital
  Pincap 0x00010024: IN EAPD Detect
  EAPD 0x0:
  Pin Default 0x4f00000f: [N/A] Line Out at Ext UNKNOWN
    Conn = Unknown, Color = Unknown
    DefAssociation = 0x0, Sequence = 0xf
  Pin-ctls: 0x00:
  Unsolicited: tag=00, enabled=0
  Power: setting=D0, actual=D0
Node 0x25 [Audio Output] wcaps 0x4021d: Stereo Digital Amp-Out
  Amp-Out caps: ofs=0x00, nsteps=0x00, stepsize=0x00, mute=1
  Amp-Out vals:  [0x00 0x00]
  Converter: stream=0, channel=0
  Digital:
  Digital category: 0x0
  PCM:
    rates [0x5e0]: 44100 48000 88200 96000 192000
    bits [0xe]: 16 20 24
    formats [0x5]: PCM AC3
  Delay: 4 samples
Node 0x26 [Audio Output] wcaps 0x4021d: Stereo Digital Amp-Out
  Amp-Out caps: ofs=0x00, nsteps=0x00, stepsize=0x00, mute=1
  Amp-Out vals:  [0x00 0x00]
  Converter: stream=0, channel=0
  Digital:
  Digital category: 0x0
  PCM:
    rates [0x5e0]: 44100 48000 88200 96000 192000
    bits [0xe]: 16 20 24
    formats [0x5]: PCM AC3
  Delay: 4 samples
Node 0x27 [Audio Input] wcaps 0x14031b: Stereo Digital Amp-In
  Amp-In caps: ofs=0x00, nsteps=0x00, stepsize=0x00, mute=1
  Amp-In vals:  [0x00 0x00]
  Converter: stream=0, channel=0
  SDI-Select: 0
  Digital:
  Digital category: 0x0
  PCM:
    rates [0x160]: 44100 48000 96000
    bits [0xe]: 16 20 24
    formats [0x5]: PCM AC3
  Delay: 4 samples
  Connection: 1
     0x24
Node 0x28 [Audio Selector] wcaps 0x300101: Stereo
  Connection: 4
     0x0a 0x0b* 0x0d 0x0f
Node 0x29 [Audio Selector] wcaps 0x300101: Stereo
  Connection: 4
     0x0a 0x0e* 0x10 0x11
Node 0x2a [Audio Selector] wcaps 0x300101: Stereo
  Connection: 4
     0x0b 0x0c* 0x10 0x11
Node 0x2b [Audio Selector] wcaps 0x300101: Stereo
  Connection: 3
     0x15* 0x16 0x17
Codec: ATI ATI R6xx HDMI
Address: 0
Vendor Id: 0x1002aa01
Subsystem Id: 0xaa0100
Revision Id: 0x100000
No Modem Function Group found
Default PCM:
    rates [0x40]: 48000
    bits [0x6]: 16 20
    formats [0x1]: PCM
Default Amp-In caps: N/A
Default Amp-Out caps: N/A
GPIO: io=0, o=0, i=0, unsolicited=0, wake=0
Node 0x02 [Audio Output] wcaps 0x201: Stereo Digital
  Converter: stream=0, channel=0
  Digital:
  Digital category: 0x0
Node 0x03 [Pin Complex] wcaps 0x400381: Stereo Digital
  Pincap 0x00000094: OUT Detect HDMI
  Pin Default 0x18560010: [Jack] Digital Out at Int HDMI
    Conn = Digital, Color = Unknown
    DefAssociation = 0x1, Sequence = 0x0
  Pin-ctls: 0x40: OUT
  Unsolicited: tag=00, enabled=0
  Connection: 1
     0x02
--endcollapse--


!!ALSA Device nodes
!!-----------------

crw-rw----+ 1 root audio 116,  6 2008-11-19 18:34 /dev/snd/controlC0
crw-rw----+ 1 root audio 116,  9 2008-11-19 18:34 /dev/snd/controlC1
crw-rw----+ 1 root audio 116,  5 2008-11-19 18:34 /dev/snd/hwC0D0
crw-rw----+ 1 root audio 116,  8 2008-11-19 18:34 /dev/snd/hwC1D0
crw-rw----+ 1 root audio 116,  4 2008-11-19 18:34 /dev/snd/pcmC0D0c
crw-rw----+ 1 root audio 116,  3 2008-11-19 18:35 /dev/snd/pcmC0D0p
crw-rw----+ 1 root audio 116,  7 2008-11-19 18:34 /dev/snd/pcmC1D3p
crw-rw----+ 1 root audio 116, 10 2008-11-19 18:34 /dev/snd/seq
crw-rw----+ 1 root audio 116,  2 2008-11-19 18:34 /dev/snd/timer


!!Aplay/Arecord output
!!------------

APLAY

**** List of PLAYBACK Hardware Devices ****
card 0: Intel [HDA Intel], device 0: STAC92xx Analog [STAC92xx Analog]
  Subdevices: 1/1
  Subdevice #0: subdevice #0
card 1: HDMI [HDA ATI HDMI], device 3: ATI HDMI [ATI HDMI]
  Subdevices: 1/1
  Subdevice #0: subdevice #0

ARECORD

**** List of CAPTURE Hardware Devices ****
card 0: Intel [HDA Intel], device 0: STAC92xx Analog [STAC92xx Analog]
  Subdevices: 2/2
  Subdevice #0: subdevice #0
  Subdevice #1: subdevice #1

!!Amixer output
!!-------------

!!-------Mixer controls for card 0 [Intel]

Card hw:0 'Intel'/'HDA Intel at 0xfc400000 irq 22'
  Mixer name	: 'IDT 92HD73C1X5'
  Components	: 'HDA:111d7675'
  Controls      : 26
  Simple ctrls  : 17
Simple mixer control 'Master',0
  Capabilities: pvolume pvolume-joined pswitch pswitch-joined
  Playback channels: Mono
  Limits: Playback 0 - 127
  Mono: Playback 120 [94%] [-5.25dB] [on]
Simple mixer control 'Headphone',0
  Capabilities: pvolume pswitch
  Playback channels: Front Left - Front Right
  Limits: Playback 0 - 127
  Mono:
  Front Left: Playback 112 [88%] [-11.25dB] [on]
  Front Right: Playback 112 [88%] [-11.25dB] [on]
Simple mixer control 'Headphone as Line Out',0
  Capabilities: pswitch pswitch-joined
  Playback channels: Mono
  Mono: Playback [on]
Simple mixer control 'PCM',0
  Capabilities: pvolume
  Playback channels: Front Left - Front Right
  Limits: Playback 0 - 255
  Mono:
  Front Left: Playback 255 [100%] [0.00dB]
  Front Right: Playback 255 [100%] [0.00dB]
Simple mixer control 'Front',0
  Capabilities: pvolume pswitch
  Playback channels: Front Left - Front Right
  Limits: Playback 0 - 127
  Mono:
  Front Left: Playback 127 [100%] [0.00dB] [on]
  Front Right: Playback 127 [100%] [0.00dB] [on]
Simple mixer control 'Surround',0
  Capabilities: pvolume pswitch
  Playback channels: Front Left - Front Right
  Limits: Playback 0 - 127
  Mono:
  Front Left: Playback 0 [0%] [-95.25dB] [on]
  Front Right: Playback 0 [0%] [-95.25dB] [on]
Simple mixer control 'Mic Mixer',0
  Capabilities: cvolume cswitch
  Capture channels: Front Left - Front Right
  Limits: Capture 0 - 31
  Front Left: Capture 23 [74%] [0.00dB] [off]
  Front Right: Capture 23 [74%] [0.00dB] [off]
Simple mixer control 'Capture',0
  Capabilities: cvolume cswitch
  Capture channels: Front Left - Front Right
  Limits: Capture 0 - 15
  Front Left: Capture 13 [87%] [19.50dB] [on]
  Front Right: Capture 13 [87%] [19.50dB] [on]
Simple mixer control 'Capture',1
  Capabilities: cvolume cswitch
  Capture channels: Front Left - Front Right
  Limits: Capture 0 - 15
  Front Left: Capture 0 [0%] [0.00dB] [off]
  Front Right: Capture 0 [0%] [0.00dB] [off]
Simple mixer control 'Amp',0
  Capabilities: cvolume
  Capture channels: Front Left - Front Right
  Limits: Capture 0 - 3
  Front Left: Capture 0 [0%] [0.00dB]
  Front Right: Capture 0 [0%] [0.00dB]
Simple mixer control 'Analog Loopback',0
  Capabilities: pswitch pswitch-joined
  Playback channels: Mono
  Mono: Playback [off]
Simple mixer control 'Analog Loopback',1
  Capabilities: pswitch pswitch-joined
  Playback channels: Mono
  Mono: Playback [off]
Simple mixer control 'Analog Loopback',2
  Capabilities: pswitch pswitch-joined
  Playback channels: Mono
  Mono: Playback [off]
Simple mixer control 'DAC Mixer',0
  Capabilities: cvolume cswitch
  Capture channels: Front Left - Front Right
  Limits: Capture 0 - 31
  Front Left: Capture 31 [100%] [12.00dB] [off]
  Front Right: Capture 31 [100%] [12.00dB] [off]
Simple mixer control 'Digital Input Source',0
  Capabilities: enum
  Items: 'Analog Inputs' 'Digital Mic 1' 'Digital Mic 2' 'CD'
  Item0: 'Analog Inputs'
Simple mixer control 'Digital Input Source',1
  Capabilities: enum
  Items: 'Analog Inputs' 'Digital Mic 1' 'Digital Mic 2' 'CD'
  Item0: 'Analog Inputs'
Simple mixer control 'PC Beep',0
  Capabilities: pvolume pvolume-joined pswitch pswitch-joined
  Playback channels: Mono
  Limits: Playback 0 - 3
  Mono: Playback 1 [33%] [-12.00dB] [on]

!!-------Mixer controls for card 1 [HDMI]

Card hw:1 'HDMI'/'HDA ATI HDMI at 0xcfeec000 irq 17'
  Mixer name	: 'ATI ATI R6xx HDMI'
  Components	: 'HDA:1002aa01'
  Controls      : 4
  Simple ctrls  : 1
Simple mixer control 'IEC958',0
  Capabilities: pswitch pswitch-joined
  Playback channels: Mono
  Mono: Playback [off]


!!Alsactl output
!!-------------

--startcollapse--
state.Intel {
	control.1 {
		comment.access 'read write'
		comment.type INTEGER
		comment.count 2
		comment.range '0 - 31'
		comment.dbmin -3450
		comment.dbmax 1200
		iface MIXER
		name 'Mic Mixer Capture Volume'
		value.0 23
		value.1 23
	}
	control.2 {
		comment.access 'read write'
		comment.type BOOLEAN
		comment.count 2
		iface MIXER
		name 'Mic Mixer Capture Switch'
		value.0 false
		value.1 false
	}
	control.3 {
		comment.access 'read write'
		comment.type INTEGER
		comment.count 2
		comment.range '0 - 31'
		comment.dbmin -3450
		comment.dbmax 1200
		iface MIXER
		name 'DAC Mixer Capture Volume'
		value.0 31
		value.1 31
	}
	control.4 {
		comment.access 'read write'
		comment.type BOOLEAN
		comment.count 2
		iface MIXER
		name 'DAC Mixer Capture Switch'
		value.0 false
		value.1 false
	}
	control.5 {
		comment.access 'read write'
		comment.type BOOLEAN
		comment.count 1
		iface MIXER
		name 'Analog Loopback'
		value false
	}
	control.6 {
		comment.access 'read write'
		comment.type BOOLEAN
		comment.count 1
		iface MIXER
		name 'Analog Loopback'
		index 1
		value false
	}
	control.7 {
		comment.access 'read write'
		comment.type BOOLEAN
		comment.count 1
		iface MIXER
		name 'Analog Loopback'
		index 2
		value false
	}
	control.8 {
		comment.access 'read write'
		comment.type INTEGER
		comment.count 2
		comment.range '0 - 15'
		comment.dbmin 0
		comment.dbmax 2250
		iface MIXER
		name 'Capture Volume'
		value.0 13
		value.1 13
	}
	control.9 {
		comment.access 'read write'
		comment.type BOOLEAN
		comment.count 2
		iface MIXER
		name 'Capture Switch'
		value.0 true
		value.1 true
	}
	control.10 {
		comment.access 'read write'
		comment.type INTEGER
		comment.count 2
		comment.range '0 - 15'
		comment.dbmin 0
		comment.dbmax 2250
		iface MIXER
		name 'Capture Volume'
		index 1
		value.0 0
		value.1 0
	}
	control.11 {
		comment.access 'read write'
		comment.type BOOLEAN
		comment.count 2
		iface MIXER
		name 'Capture Switch'
		index 1
		value.0 false
		value.1 false
	}
	control.12 {
		comment.access 'read write'
		comment.type INTEGER
		comment.count 2
		comment.range '0 - 127'
		comment.dbmin -9525
		comment.dbmax 0
		iface MIXER
		name 'Front Playback Volume'
		value.0 127
		value.1 127
	}
	control.13 {
		comment.access 'read write'
		comment.type BOOLEAN
		comment.count 2
		iface MIXER
		name 'Front Playback Switch'
		value.0 true
		value.1 true
	}
	control.14 {
		comment.access 'read write'
		comment.type INTEGER
		comment.count 2
		comment.range '0 - 127'
		comment.dbmin -9525
		comment.dbmax 0
		iface MIXER
		name 'Surround Playback Volume'
		value.0 0
		value.1 0
	}
	control.15 {
		comment.access 'read write'
		comment.type BOOLEAN
		comment.count 2
		iface MIXER
		name 'Surround Playback Switch'
		value.0 true
		value.1 true
	}
	control.16 {
		comment.access 'read write'
		comment.type BOOLEAN
		comment.count 1
		iface MIXER
		name 'Headphone as Line Out Switch'
		value true
	}
	control.17 {
		comment.access 'read write'
		comment.type BOOLEAN
		comment.count 1
		iface MIXER
		name 'PC Beep Playback Switch'
		value true
	}
	control.18 {
		comment.access 'read write'
		comment.type INTEGER
		comment.count 1
		comment.range '0 - 3'
		comment.dbmin -1800
		comment.dbmax 0
		iface MIXER
		name 'PC Beep Playback Volume'
		value 1
	}
	control.19 {
		comment.access 'read write'
		comment.type INTEGER
		comment.count 2
		comment.range '0 - 127'
		comment.dbmin -9525
		comment.dbmax 0
		iface MIXER
		name 'Headphone Playback Volume'
		value.0 112
		value.1 112
	}
	control.20 {
		comment.access 'read write'
		comment.type BOOLEAN
		comment.count 2
		iface MIXER
		name 'Headphone Playback Switch'
		value.0 true
		value.1 true
	}
	control.21 {
		comment.access 'read write'
		comment.type INTEGER
		comment.count 2
		comment.range '0 - 3'
		comment.dbmin 0
		comment.dbmax 3000
		iface MIXER
		name 'Amp Capture Volume'
		value.0 0
		value.1 0
	}
	control.22 {
		comment.access 'read write'
		comment.type ENUMERATED
		comment.count 1
		comment.item.0 'Analog Inputs'
		comment.item.1 'Digital Mic 1'
		comment.item.2 'Digital Mic 2'
		comment.item.3 CD
		iface MIXER
		name 'Digital Input Source'
		value 'Analog Inputs'
	}
	control.23 {
		comment.access 'read write'
		comment.type ENUMERATED
		comment.count 1
		comment.item.0 'Analog Inputs'
		comment.item.1 'Digital Mic 1'
		comment.item.2 'Digital Mic 2'
		comment.item.3 CD
		iface MIXER
		name 'Digital Input Source'
		index 1
		value 'Analog Inputs'
	}
	control.24 {
		comment.access 'read write'
		comment.type INTEGER
		comment.count 1
		comment.range '0 - 127'
		comment.dbmin -9525
		comment.dbmax 0
		iface MIXER
		name 'Master Playback Volume'
		value 120
	}
	control.25 {
		comment.access 'read write'
		comment.type BOOLEAN
		comment.count 1
		iface MIXER
		name 'Master Playback Switch'
		value true
	}
	control.26 {
		comment.access 'read write user'
		comment.type INTEGER
		comment.count 2
		comment.range '0 - 255'
		comment.tlv '0000000100000008ffffec1400000014'
		comment.dbmin -5100
		comment.dbmax 0
		iface MIXER
		name 'PCM Playback Volume'
		value.0 255
		value.1 255
	}
}
state.HDMI {
	control.1 {
		comment.access read
		comment.type IEC958
		comment.count 1
		iface MIXER
		name 'IEC958 Playback Con Mask'
		value '0fff000000000000000000000000000000000000000000000000000000000000000000000000000000000000000000000000000000000000000000000000000000000000000000000000000000000000000000000000000000000000000000000000000000000000000000000000000000000000000000000000000000000000000000000000000000000000000000000000000000000000000000000000000000000000000000000000000000000000'
	}
	control.2 {
		comment.access read
		comment.type IEC958
		comment.count 1
		iface MIXER
		name 'IEC958 Playback Pro Mask'
		value '0f00000000000000000000000000000000000000000000000000000000000000000000000000000000000000000000000000000000000000000000000000000000000000000000000000000000000000000000000000000000000000000000000000000000000000000000000000000000000000000000000000000000000000000000000000000000000000000000000000000000000000000000000000000000000000000000000000000000000000'
	}
	control.3 {
		comment.access 'read write'
		comment.type IEC958
		comment.count 1
		iface MIXER
		name 'IEC958 Playback Default'
		value '0400000000000000000000000000000000000000000000000000000000000000000000000000000000000000000000000000000000000000000000000000000000000000000000000000000000000000000000000000000000000000000000000000000000000000000000000000000000000000000000000000000000000000000000000000000000000000000000000000000000000000000000000000000000000000000000000000000000000000'
	}
	control.4 {
		comment.access 'read write'
		comment.type BOOLEAN
		comment.count 1
		iface MIXER
		name 'IEC958 Playback Switch'
		value false
	}
}
--endcollapse--


!!All Loaded Modules
!!------------------

Module
snd_pcm_oss
snd_mixer_oss
snd_seq
snd_seq_device
snd_hda_intel
snd_pcm
snd_timer
snd_page_alloc
snd_hwdep
snd
ip6t_LOG
xt_tcpudp
xt_pkttype
ipt_LOG
xt_limit
af_packet
binfmt_misc
ip6t_REJECT
nf_conntrack_ipv6
ip6table_raw
xt_NOTRACK
ipt_REJECT
xt_state
iptable_raw
iptable_filter
ip6table_mangle
nf_conntrack_netbios_ns
nf_conntrack_ipv4
nf_conntrack
ip_tables
ip6table_filter
ip6_tables
x_tables
ipv6
cpufreq_conservative
cpufreq_userspace
cpufreq_powersave
acpi_cpufreq
speedstep_lib
fuse
loop
dm_mod
arc4
ecb
crypto_blkcipher
iwlagn
iwlcore
uvcvideo
rfkill
led_class
sdhci_pci
compat_ioctl32
sdhci
ohci1394
mac80211
dcdbas
intel_agp
ieee1394
tg3
videodev
video
output
i2c_i801
ricoh_mmc
mmc_core
rtc_cmos
sr_mod
button
wmi
ac
cfg80211
v4l1_compat
rtc_core
i2c_core
cdrom
pcspkr
libphy
battery
agpgart
rtc_lib
sg
soundcore
joydev
usbhid
hid
ff_memless
sd_mod
crc_t10dif
uhci_hcd
ehci_hcd
usbcore
edd
ahci
libata
scsi_mod
dock
ext3
mbcache
jbd
fan
thermal
processor
thermal_sys
hwmon


