upload=true&script=true&cardinfo=
!!################################
!!ALSA Information Script v 0.4.60
!!################################

!!Script ran on: Fri Apr 29 21:09:06 UTC 2011


!!Linux Distribution
!!------------------

Gentoo Base System release 2.0.2


!!DMI Information
!!---------------

Manufacturer:      Hewlett-Packard
Product Name:      HP EliteBook 8740w
Product Version:    


!!Kernel Information
!!------------------

Kernel release:    2.6.38-gentoo-r3
Operating System:  GNU/Linux
Architecture:      x86_64
Processor:         Intel(R) Core(TM) i5 CPU M 540 @ 2.53GHz
SMP Enabled:       Yes


!!ALSA Version
!!------------

Driver version:     1.0.23
Library version:    1.0.24.1
Utilities version:  1.0.24.2


!!Loaded ALSA modules
!!-------------------



!!Sound Servers on this system
!!----------------------------

Jack:
      Installed - Yes (/usr/bin/jackd)
      Running - No


!!Soundcards recognised by ALSA
!!-----------------------------

 0 [Intel          ]: HDA-Intel - HDA Intel
                      HDA Intel at 0xd3420000 irq 50


!!PCI Soundcards installed in the system
!!--------------------------------------

00:1b.0 Audio device: Intel Corporation 5 Series/3400 Series Chipset High Definition Audio (rev 06)


!!Advanced information - PCI Vendor/Device/Subsystem ID's
!!--------------------------------------------------------

00:1b.0 0403: 8086:3b56 (rev 06)
	Subsystem: 103c:1520


!!Modprobe options (Sound related)
!!--------------------------------

snd-hda-indel: index=0
snd-aloop: index=1


!!Loaded sound module options
!!--------------------------


!!HDA-Intel Codec information
!!---------------------------
--startcollapse--

Codec: IDT 92HD75B3X5
Address: 0
AFG Function Id: 0x1 (unsol 1)
Vendor Id: 0x111d7603
Subsystem Id: 0x103c1520
Revision Id: 0x100202
No Modem Function Group found
Default PCM:
    rates [0x7e0]: 44100 48000 88200 96000 176400 192000
    bits [0xe]: 16 20 24
    formats [0x1]: PCM
Default Amp-In caps: ofs=0x00, nsteps=0x00, stepsize=0x00, mute=1
Default Amp-Out caps: ofs=0x7f, nsteps=0x7f, stepsize=0x02, mute=1
GPIO: io=8, o=0, i=0, unsolicited=1, wake=1
  IO[0]: enable=1, dir=1, wake=0, sticky=0, data=1, unsol=0
  IO[1]: enable=0, dir=0, wake=0, sticky=0, data=0, unsol=0
  IO[2]: enable=0, dir=0, wake=0, sticky=0, data=0, unsol=0
  IO[3]: enable=1, dir=1, wake=0, sticky=0, data=0, unsol=0
  IO[4]: enable=0, dir=0, wake=0, sticky=0, data=0, unsol=0
  IO[5]: enable=0, dir=0, wake=0, sticky=0, data=0, unsol=0
  IO[6]: enable=0, dir=0, wake=0, sticky=0, data=0, unsol=0
  IO[7]: enable=0, dir=0, wake=0, sticky=0, data=0, unsol=0
Power-Map: 0x00
Analog Loopback: 0x00
Node 0x0a [Pin Complex] wcaps 0x400181: Stereo
  Pincap 0x0000001c: OUT HP Detect
  Pin Default 0x2121101f: [Jack] HP Out at Sep Rear
    Conn = 1/8, Color = Black
    DefAssociation = 0x1, Sequence = 0xf
  Pin-ctls: 0xc0: OUT HP
  Unsolicited: tag=01, enabled=1
  Connection: 3
     0x10 0x11* 0x17
Node 0x0b [Pin Complex] wcaps 0x400081: Stereo
  Control: name="Front Mic Jack Mode", index=0, device=0
    ControlAmp: chs=0, dir=In, idx=0, ofs=0
  Pincap 0x00001724: IN Detect
    Vref caps: HIZ 50 GRD 80
  Pin Default 0x02a1102e: [Jack] Mic at Ext Front
    Conn = 1/8, Color = Black
    DefAssociation = 0x2, Sequence = 0xe
  Pin-ctls: 0x24: IN VREF_80
  Unsolicited: tag=03, enabled=1
Node 0x0c [Pin Complex] wcaps 0x400081: Stereo
  Pincap 0x00001724: IN Detect
    Vref caps: HIZ 50 GRD 80
  Pin Default 0x90a70120: [Fixed] Mic at Int N/A
    Conn = Analog, Color = Unknown
    DefAssociation = 0x2, Sequence = 0x0
    Misc = NO_PRESENCE
  Pin-ctls: 0x24: IN VREF_80
  Unsolicited: tag=00, enabled=0
Node 0x0d [Pin Complex] wcaps 0x400181: Stereo
  Pincap 0x00000014: OUT Detect
  Pin Default 0x90170110: [Fixed] Speaker at Int N/A
    Conn = Analog, Color = Unknown
    DefAssociation = 0x1, Sequence = 0x0
    Misc = NO_PRESENCE
  Pin-ctls: 0x00:
  Unsolicited: tag=00, enabled=0
  Connection: 3
     0x10* 0x11 0x17
Node 0x0e [Pin Complex] wcaps 0x400081: Stereo
  Control: name="Dock Line Jack Mode", index=0, device=0
    ControlAmp: chs=0, dir=In, idx=0, ofs=0
  Pincap 0x00001724: IN Detect
    Vref caps: HIZ 50 GRD 80
  Pin Default 0x21811021: [Jack] Line In at Sep Rear
    Conn = 1/8, Color = Black
    DefAssociation = 0x2, Sequence = 0x1
  Pin-ctls: 0x20: IN VREF_HIZ
  Unsolicited: tag=04, enabled=1
Node 0x0f [Pin Complex] wcaps 0x400181: Stereo
  Pincap 0x00000014: OUT Detect
  Pin Default 0x0221101f: [Jack] HP Out at Ext Front
    Conn = 1/8, Color = Black
    DefAssociation = 0x1, Sequence = 0xf
  Pin-ctls: 0x40: OUT
  Unsolicited: tag=02, enabled=1
  Connection: 3
     0x10* 0x11 0x17
Node 0x10 [Audio Output] wcaps 0xd0c05: Stereo Amp-Out R/L
  Control: name="Speaker Playback Volume", index=0, device=0
    ControlAmp: chs=3, dir=Out, idx=0, ofs=63
  Control: name="Speaker Playback Switch", index=0, device=0
    ControlAmp: chs=3, dir=Out, idx=0, ofs=0
  Device: name="STAC92xx Analog", type="Audio", device=0
  Amp-Out caps: N/A
  Amp-Out vals:  [0x60 0x60]
  Converter: stream=5, channel=0
  Power: setting=D0, actual=D0
  Delay: 13 samples
Node 0x11 [Audio Output] wcaps 0xd0c05: Stereo Amp-Out R/L
  Control: name="Headphone Playback Volume", index=0, device=0
    ControlAmp: chs=3, dir=Out, idx=0, ofs=63
  Control: name="Headphone Playback Switch", index=0, device=0
    ControlAmp: chs=3, dir=Out, idx=0, ofs=0
  Amp-Out caps: N/A
  Amp-Out vals:  [0x60 0x60]
  Converter: stream=5, channel=0
  Power: setting=D0, actual=D0
  Delay: 13 samples
Node 0x12 [Audio Input] wcaps 0x1d0541: Stereo
  Device: name="STAC92xx Analog", type="Audio", device=0
  Converter: stream=0, channel=0
  SDI-Select: 0
  Power: setting=D3, actual=D3
  Delay: 13 samples
  Connection: 1
     0x1c
  Processing caps: benign=0, ncoeff=0
Node 0x13 [Audio Input] wcaps 0x1d0541: Stereo
  Converter: stream=0, channel=0
  SDI-Select: 0
  Power: setting=D3, actual=D3
  Delay: 13 samples
  Connection: 1
     0x1d
  Processing caps: benign=0, ncoeff=0
Node 0x14 [Pin Complex] wcaps 0x400100: Mono
  Pincap 0x00000030: IN OUT
  Pin Default 0x40f000f0: [N/A] Other at Ext N/A
    Conn = Unknown, Color = Unknown
    DefAssociation = 0xf, Sequence = 0x0
  Pin-ctls: 0x00:
  Connection: 1
     0x16
Node 0x15 [Audio Selector] wcaps 0x300101: Stereo
  Connection: 3
     0x10 0x11 0x17*
Node 0x16 [Audio Mixer] wcaps 0x200100: Mono
  Connection: 1
     0x15
Node 0x17 [Audio Mixer] wcaps 0x20010b: Stereo Amp-In
  Amp-In caps: ofs=0x17, nsteps=0x1f, stepsize=0x05, mute=1
  Amp-In vals:  [0x97 0x97] [0x97 0x97] [0x97 0x97] [0x97 0x97] [0x97 0x97]
  Connection: 5
     0x10 0x11 0x14 0x1a 0x1b
Node 0x18 [Pin Complex] wcaps 0x40000b: Stereo Amp-In
  Amp-In caps: ofs=0x00, nsteps=0x03, stepsize=0x27, mute=0
  Amp-In vals:  [0x00 0x00]
  Pincap 0x00000020: IN
  Pin Default 0x40f000f0: [N/A] Other at Ext N/A
    Conn = Unknown, Color = Unknown
    DefAssociation = 0xf, Sequence = 0x0
  Pin-ctls: 0x00:
Node 0x19 [Pin Complex] wcaps 0x40000b: Stereo Amp-In
  Amp-In caps: ofs=0x00, nsteps=0x03, stepsize=0x27, mute=0
  Amp-In vals:  [0x00 0x00]
  Pincap 0x00000020: IN
  Pin Default 0x40f000f0: [N/A] Other at Ext N/A
    Conn = Unknown, Color = Unknown
    DefAssociation = 0xf, Sequence = 0x0
  Pin-ctls: 0x00:
Node 0x1a [Audio Selector] wcaps 0x30010d: Stereo Amp-Out
  Control: name="Mux Capture Volume", index=0, device=0
    ControlAmp: chs=3, dir=Out, idx=0, ofs=0
  Amp-Out caps: ofs=0x00, nsteps=0x03, stepsize=0x27, mute=0
  Amp-Out vals:  [0x00 0x00]
  Connection: 3
     0x0b 0x0c* 0x0e
Node 0x1b [Audio Selector] wcaps 0x30010d: Stereo Amp-Out
  Control: name="Mux Capture Volume", index=1, device=0
    ControlAmp: chs=3, dir=Out, idx=0, ofs=0
  Amp-Out caps: ofs=0x00, nsteps=0x03, stepsize=0x27, mute=0
  Amp-Out vals:  [0x00 0x00]
  Connection: 3
     0x0b* 0x0c 0x0e
Node 0x1c [Audio Selector] wcaps 0x30090d: Stereo Amp-Out R/L
  Control: name="Capture Volume", index=0, device=0
    ControlAmp: chs=3, dir=Out, idx=0, ofs=0
  Control: name="Capture Switch", index=0, device=0
    ControlAmp: chs=3, dir=Out, idx=0, ofs=0
  Amp-Out caps: ofs=0x00, nsteps=0x0f, stepsize=0x05, mute=1
  Amp-Out vals:  [0x80 0x80]
  Connection: 4
     0x1a* 0x17 0x18 0x19
Node 0x1d [Audio Selector] wcaps 0x30090d: Stereo Amp-Out R/L
  Control: name="Capture Volume", index=1, device=0
    ControlAmp: chs=3, dir=Out, idx=0, ofs=0
  Control: name="Capture Switch", index=1, device=0
    ControlAmp: chs=3, dir=Out, idx=0, ofs=0
  Amp-Out caps: ofs=0x00, nsteps=0x0f, stepsize=0x05, mute=1
  Amp-Out vals:  [0x80 0x80]
  Connection: 4
     0x1b* 0x17 0x18 0x19
Node 0x1e [Pin Complex] wcaps 0x400301: Stereo Digital
  Pincap 0x00000010: OUT
  Pin Default 0x40f000f0: [N/A] Other at Ext N/A
    Conn = Unknown, Color = Unknown
    DefAssociation = 0xf, Sequence = 0x0
  Pin-ctls: 0x00:
  Connection: 1
     0x24
Node 0x1f [Pin Complex] wcaps 0x400701: Stereo Digital
  Pincap 0x00010010: OUT EAPD
  EAPD 0x0:
  Pin Default 0x40f000f0: [N/A] Other at Ext N/A
    Conn = Unknown, Color = Unknown
    DefAssociation = 0xf, Sequence = 0x0
  Pin-ctls: 0x00:
  Power: setting=D0, actual=D0
  Connection: 2
     0x24* 0x25
Node 0x20 [Pin Complex] wcaps 0x400301: Stereo Digital
  Pincap 0x00000010: OUT
  Pin Default 0x40f000f0: [N/A] Other at Ext N/A
    Conn = Unknown, Color = Unknown
    DefAssociation = 0xf, Sequence = 0x0
  Pin-ctls: 0x00:
  Connection: 1
     0x25
Node 0x21 [Audio Output] wcaps 0x40211: Stereo Digital
  Converter: stream=0, channel=0
  Digital:
  Digital category: 0x0
  PCM:
    rates [0x7e0]: 44100 48000 88200 96000 176400 192000
    bits [0xe]: 16 20 24
    formats [0x5]: PCM AC3
  Delay: 4 samples
Node 0x22 [Audio Output] wcaps 0x40211: Stereo Digital
  Converter: stream=0, channel=0
  Digital:
  Digital category: 0x0
  PCM:
    rates [0x7e0]: 44100 48000 88200 96000 176400 192000
    bits [0xe]: 16 20 24
    formats [0x5]: PCM AC3
  Delay: 4 samples
Node 0x23 [Vendor Defined Widget] wcaps 0xf00000: Mono
Node 0x24 [Audio Selector] wcaps 0x300101: Stereo
  Connection: 3
     0x21* 0x1c 0x1d
Node 0x25 [Audio Selector] wcaps 0x300101: Stereo
  Connection: 3
     0x22* 0x1c 0x1d
Node 0x26 [Beep Generator Widget] wcaps 0x70000c: Mono Amp-Out
  Amp-Out caps: ofs=0x03, nsteps=0x03, stepsize=0x17, mute=1
  Amp-Out vals:  [0x00]
Node 0x27 [Volume Knob Widget] wcaps 0x600000: Mono
  Volume-Knob: delta=1, steps=127, direct=0, val=127
  Connection: 2
     0x10 0x11
--endcollapse--


!!ALSA Device nodes
!!-----------------

crw-rw---- 1 root audio 116,  5 Apr 29 23:07 /dev/snd/controlC0
crw-rw---- 1 root audio 116,  4 Apr 29 23:07 /dev/snd/hwC0D0
crw-rw---- 1 root audio 116,  3 Apr 29 23:07 /dev/snd/pcmC0D0c
crw-rw---- 1 root audio 116,  2 Apr 29 23:08 /dev/snd/pcmC0D0p
crw-rw---- 1 root audio 116,  1 Apr 29 23:07 /dev/snd/seq
crw-rw---- 1 root audio 116, 33 Apr 29 23:07 /dev/snd/timer

/dev/snd/by-path:
total 0
drwxr-xr-x 2 root root  60 Apr 29 23:07 .
drwxr-xr-x 3 root root 180 Apr 29 23:07 ..
lrwxrwxrwx 1 root root  12 Apr 29 23:07 pci-0000:00:1b.0 -> ../controlC0


!!ALSA configuration files
!!------------------------

!!System wide config file (/etc/asound.conf)

#pcm.!default {
#	type plug
#		slave {
#			pcm "spdif"
#				rate 48000
#				format S16_LE
#		}
#}

pcm.eq { 
	type plug 
		slave.pcm "eql"; 
} 

pcm.eql { 
	type ladspa 
		slave.pcm "plughw:0,0"; 
	path "/usr/lib/ladspa"; 
	playback_plugins [ 
	{ 
		label Parametric1 
			input { 
				controls [ 1 -3 1 20 0.8 5  1 110 0.7 -9  0 0 0 0  1 18000 2 2 ] 
			} 
	} 
	] 
}

pcm.copy {
	type plug
		slave {
			pcm hw
		}
	route_policy copy
}


!!Aplay/Arecord output
!!------------

APLAY

**** List of PLAYBACK Hardware Devices ****
card 0: Intel [HDA Intel], device 0: STAC92xx Analog [STAC92xx Analog]
  Subdevices: 0/1
  Subdevice #0: subdevice #0

ARECORD

**** List of CAPTURE Hardware Devices ****
card 0: Intel [HDA Intel], device 0: STAC92xx Analog [STAC92xx Analog]
  Subdevices: 2/2
  Subdevice #0: subdevice #0
  Subdevice #1: subdevice #1

!!Amixer output
!!-------------

!!-------Mixer controls for card 0 [Intel]

Card hw:0 'Intel'/'HDA Intel at 0xd3420000 irq 50'
  Mixer name	: 'IDT 92HD75B3X5'
  Components	: 'HDA:111d7603,103c1520,00100202'
  Controls      : 17
  Simple ctrls  : 12
Simple mixer control 'Master',0
  Capabilities: pvolume pvolume-joined pswitch pswitch-joined penum
  Playback channels: Mono
  Limits: Playback 0 - 64
  Mono: Playback 33 [52%] [-23.25dB] [on]
Simple mixer control 'Headphone',0
  Capabilities: pvolume pswitch penum
  Playback channels: Front Left - Front Right
  Limits: Playback 0 - 64
  Mono:
  Front Left: Playback 64 [100%] [0.00dB] [on]
  Front Right: Playback 64 [100%] [0.00dB] [on]
Simple mixer control 'Speaker',0
  Capabilities: pvolume pswitch penum
  Playback channels: Front Left - Front Right
  Limits: Playback 0 - 64
  Mono:
  Front Left: Playback 64 [100%] [0.00dB] [on]
  Front Right: Playback 64 [100%] [0.00dB] [on]
Simple mixer control 'PCM',0
  Capabilities: pvolume penum
  Playback channels: Front Left - Front Right
  Limits: Playback 0 - 255
  Mono:
  Front Left: Playback 255 [100%] [0.00dB]
  Front Right: Playback 255 [100%] [0.00dB]
Simple mixer control 'Front Mic Jack Mode',0
  Capabilities: enum
  Items: 'Mic In' 'Line In'
  Item0: 'Mic In'
Simple mixer control 'Capture',0
  Capabilities: cvolume cswitch penum
  Capture channels: Front Left - Front Right
  Limits: Capture 0 - 15
  Front Left: Capture 0 [0%] [0.00dB] [off]
  Front Right: Capture 0 [0%] [0.00dB] [off]
Simple mixer control 'Capture',1
  Capabilities: cvolume cswitch penum
  Capture channels: Front Left - Front Right
  Limits: Capture 0 - 15
  Front Left: Capture 0 [0%] [0.00dB] [off]
  Front Right: Capture 0 [0%] [0.00dB] [off]
Simple mixer control 'Dock Line Jack Mode',0
  Capabilities: enum
  Items: 'Mic In' 'Line In'
  Item0: 'Line In'
Simple mixer control 'Input Source',0
  Capabilities: cenum
  Items: 'Mic' 'Internal Mic' 'Line'
  Item0: 'Internal Mic'
Simple mixer control 'Input Source',1
  Capabilities: cenum
  Items: 'Mic' 'Internal Mic' 'Line'
  Item0: 'Mic'
Simple mixer control 'Mux',0
  Capabilities: cvolume penum
  Capture channels: Front Left - Front Right
  Limits: Capture 0 - 3
  Front Left: Capture 0 [0%] [0.00dB]
  Front Right: Capture 0 [0%] [0.00dB]
Simple mixer control 'Mux',1
  Capabilities: cvolume penum
  Capture channels: Front Left - Front Right
  Limits: Capture 0 - 3
  Front Left: Capture 0 [0%] [0.00dB]
  Front Right: Capture 0 [0%] [0.00dB]


!!Alsactl output
!!-------------

--startcollapse--
state.Intel {
	control.1 {
		iface MIXER
		name 'Speaker Playback Volume'
		value.0 64
		value.1 64
		comment {
			access 'read write'
			type INTEGER
			count 2
			range '0 - 64'
			dbmin -4800
			dbmax 0
			dbvalue.0 0
			dbvalue.1 0
		}
	}
	control.2 {
		iface MIXER
		name 'Speaker Playback Switch'
		value.0 true
		value.1 true
		comment {
			access 'read write'
			type BOOLEAN
			count 2
		}
	}
	control.3 {
		iface MIXER
		name 'Front Mic Jack Mode'
		value 'Mic In'
		comment {
			access 'read write'
			type ENUMERATED
			count 1
			item.0 'Mic In'
			item.1 'Line In'
		}
	}
	control.4 {
		iface MIXER
		name 'Dock Line Jack Mode'
		value 2
		comment {
			access 'read write'
			type ENUMERATED
			count 1
			item.0 'Mic In'
			item.1 'Line In'
		}
	}
	control.5 {
		iface MIXER
		name 'Headphone Playback Volume'
		value.0 64
		value.1 64
		comment {
			access 'read write'
			type INTEGER
			count 2
			range '0 - 64'
			dbmin -4800
			dbmax 0
			dbvalue.0 0
			dbvalue.1 0
		}
	}
	control.6 {
		iface MIXER
		name 'Headphone Playback Switch'
		value.0 true
		value.1 true
		comment {
			access 'read write'
			type BOOLEAN
			count 2
		}
	}
	control.7 {
		iface MIXER
		name 'Capture Volume'
		value.0 0
		value.1 0
		comment {
			access 'read write'
			type INTEGER
			count 2
			range '0 - 15'
			dbmin 0
			dbmax 2250
			dbvalue.0 0
			dbvalue.1 0
		}
	}
	control.8 {
		iface MIXER
		name 'Capture Switch'
		value.0 false
		value.1 false
		comment {
			access 'read write'
			type BOOLEAN
			count 2
		}
	}
	control.9 {
		iface MIXER
		name 'Capture Volume'
		index 1
		value.0 0
		value.1 0
		comment {
			access 'read write'
			type INTEGER
			count 2
			range '0 - 15'
			dbmin 0
			dbmax 2250
			dbvalue.0 0
			dbvalue.1 0
		}
	}
	control.10 {
		iface MIXER
		name 'Capture Switch'
		index 1
		value.0 false
		value.1 false
		comment {
			access 'read write'
			type BOOLEAN
			count 2
		}
	}
	control.11 {
		iface MIXER
		name 'Mux Capture Volume'
		value.0 0
		value.1 0
		comment {
			access 'read write'
			type INTEGER
			count 2
			range '0 - 3'
			dbmin 0
			dbmax 3000
			dbvalue.0 0
			dbvalue.1 0
		}
	}
	control.12 {
		iface MIXER
		name 'Mux Capture Volume'
		index 1
		value.0 0
		value.1 0
		comment {
			access 'read write'
			type INTEGER
			count 2
			range '0 - 3'
			dbmin 0
			dbmax 3000
			dbvalue.0 0
			dbvalue.1 0
		}
	}
	control.13 {
		iface MIXER
		name 'Input Source'
		value 'Internal Mic'
		comment {
			access 'read write'
			type ENUMERATED
			count 1
			item.0 Mic
			item.1 'Internal Mic'
			item.2 Line
		}
	}
	control.14 {
		iface MIXER
		name 'Input Source'
		index 1
		value Mic
		comment {
			access 'read write'
			type ENUMERATED
			count 1
			item.0 Mic
			item.1 'Internal Mic'
			item.2 Line
		}
	}
	control.15 {
		iface MIXER
		name 'Master Playback Volume'
		value 33
		comment {
			access 'read write'
			type INTEGER
			count 1
			range '0 - 64'
			dbmin -9999999
			dbmax 0
			dbvalue.0 -2325
		}
	}
	control.16 {
		iface MIXER
		name 'Master Playback Switch'
		value true
		comment {
			access 'read write'
			type BOOLEAN
			count 1
		}
	}
	control.17 {
		iface MIXER
		name 'PCM Playback Volume'
		value.0 255
		value.1 255
		comment {
			access 'read write user'
			type INTEGER
			count 2
			range '0 - 255'
			tlv '0000000100000008ffffec1400000014'
			dbmin -5100
			dbmax 0
			dbvalue.0 0
			dbvalue.1 0
		}
	}
}
--endcollapse--


!!All Loaded Modules
!!------------------

Module
nvidia
uvcvideo
snd_hda_codec_idt
snd_hda_intel
snd_hda_codec
snd_hwdep


!!Sysfs Files
!!-----------

/sys/class/sound/hwC0D0/init_pin_configs:
0x0a 0x2121101f
0x0b 0x02a1102e
0x0c 0x90a70120
0x0d 0x90170110
0x0e 0x21811021
0x0f 0x02011030
0x14 0x40f000f0
0x18 0x40f000f0
0x19 0x40f000f0
0x1e 0x40f000f0
0x1f 0x40f000f0
0x20 0x40f000f0

/sys/class/sound/hwC0D0/driver_pin_configs:
0x0f 0x0221101f

/sys/class/sound/hwC0D0/user_pin_configs:

/sys/class/sound/hwC0D0/init_verbs:


!!ALSA/HDA dmesg
!!------------------

[    1.557867] sd 0:0:0:0: [sda] 976773168 512-byte logical blocks: (500 GB/465 GiB)
[    1.557905] ALSA device list:
[    1.557907]   No soundcards found.
[    1.557919] sd 0:0:0:0: [sda] Write Protect is off
--
[    6.107624] ieee80211 phy0: Selected rate control algorithm 'iwl-agn-rs'
[    6.181873] HDA Intel 0000:00:1b.0: power state changed by ACPI to D0
[    6.181882] HDA Intel 0000:00:1b.0: power state changed by ACPI to D0
[    6.181898] HDA Intel 0000:00:1b.0: PCI INT A -> GSI 16 (level, low) -> IRQ 16
[    6.181966] HDA Intel 0000:00:1b.0: irq 50 for MSI/MSI-X
[    6.181995] HDA Intel 0000:00:1b.0: setting latency timer to 64
[    6.251607] uvcvideo: Found UVC 1.00 device HP Webcam [2 MP Macro] (04f2:b15e)
--
[   18.652657] ADDRCONF(NETDEV_CHANGE): eth0: link becomes ready
[   19.622781] hda-intel: IRQ timing workaround is activated for card #0. Suggest a bigger bdl_pos_adj.
[   28.438643] ioremap error for 0xbf7fc000-0xbf7fd000, requested 0x10, got 0x0