upload=true&script=true&cardinfo=
!!################################
!!ALSA Information Script v 0.4.60
!!################################

!!Script ran on: Wed Nov  9 14:20:22 UTC 2011


!!Linux Distribution
!!------------------

Ubuntu 11.10 \n \l DISTRIB_ID=Ubuntu DISTRIB_DESCRIPTION="Ubuntu 11.10"


!!DMI Information
!!---------------

Manufacturer:      Hewlett-Packard
Product Name:      HP ProBook 4520s
Product Version:    


!!Kernel Information
!!------------------

Kernel release:    3.0.0-12-generic
Operating System:  GNU/Linux
Architecture:      x86_64
Processor:         x86_64
SMP Enabled:       Yes


!!ALSA Version
!!------------

Driver version:     1.0.24
Library version:    1.0.24.1
Utilities version:  1.0.24.2


!!Loaded ALSA modules
!!-------------------

snd_hda_intel


!!Sound Servers on this system
!!----------------------------

Pulseaudio:
      Installed - Yes (/usr/bin/pulseaudio)
      Running - Yes

ESound Daemon:
      Installed - Yes (/usr/bin/esd)
      Running - No


!!Soundcards recognised by ALSA
!!-----------------------------

 0 [Intel          ]: HDA-Intel - HDA Intel
                      HDA Intel at 0xd4900000 irq 47


!!PCI Soundcards installed in the system
!!--------------------------------------

00:1b.0 Audio device: Intel Corporation 5 Series/3400 Series Chipset High Definition Audio (rev 05)


!!Advanced information - PCI Vendor/Device/Subsystem ID's
!!--------------------------------------------------------

00:1b.0 0403: 8086:3b56 (rev 05)
	Subsystem: 103c:1413


!!Modprobe options (Sound related)
!!--------------------------------

snd-atiixp-modem: index=-2
snd-intel8x0m: index=-2
snd-via82xx-modem: index=-2
snd-usb-audio: index=-2
snd-usb-caiaq: index=-2
snd-usb-ua101: index=-2
snd-usb-us122l: index=-2
snd-usb-usx2y: index=-2
snd-cmipci: mpu_port=0x330 fm_port=0x388
snd-pcsp: index=-2
snd-usb-audio: index=-2


!!Loaded sound module options
!!--------------------------

!!Module: snd_hda_intel
	bdl_pos_adj : 1,-1,-1,-1,-1,-1,-1,-1,-1,-1,-1,-1,-1,-1,-1,-1,-1,-1,-1,-1,-1,-1,-1,-1,-1,-1,-1,-1,-1,-1,-1,-1
	beep_mode : 0,0,0,0,0,0,0,0,0,0,0,0,0,0,0,0,0,0,0,0,0,0,0,0,0,0,0,0,0,0,0,0
	enable : Y,Y,Y,Y,Y,Y,Y,Y,Y,Y,Y,Y,Y,Y,Y,Y,Y,Y,Y,Y,Y,Y,Y,Y,Y,Y,Y,Y,Y,Y,Y,Y
	enable_msi : -1
	id : (null),(null),(null),(null),(null),(null),(null),(null),(null),(null),(null),(null),(null),(null),(null),(null),(null),(null),(null),(null),(null),(null),(null),(null),(null),(null),(null),(null),(null),(null),(null),(null)
	index : -1,-1,-1,-1,-1,-1,-1,-1,-1,-1,-1,-1,-1,-1,-1,-1,-1,-1,-1,-1,-1,-1,-1,-1,-1,-1,-1,-1,-1,-1,-1,-1
	model : (null),(null),(null),(null),(null),(null),(null),(null),(null),(null),(null),(null),(null),(null),(null),(null),(null),(null),(null),(null),(null),(null),(null),(null),(null),(null),(null),(null),(null),(null),(null),(null)
	patch : (null),(null),(null),(null),(null),(null),(null),(null),(null),(null),(null),(null),(null),(null),(null),(null),(null),(null),(null),(null),(null),(null),(null),(null),(null),(null),(null),(null),(null),(null),(null),(null)
	position_fix : 0,0,0,0,0,0,0,0,0,0,0,0,0,0,0,0,0,0,0,0,0,0,0,0,0,0,0,0,0,0,0,0
	power_save : 0
	power_save_controller : Y
	probe_mask : -1,-1,-1,-1,-1,-1,-1,-1,-1,-1,-1,-1,-1,-1,-1,-1,-1,-1,-1,-1,-1,-1,-1,-1,-1,-1,-1,-1,-1,-1,-1,-1
	probe_only : 0,0,0,0,0,0,0,0,0,0,0,0,0,0,0,0,0,0,0,0,0,0,0,0,0,0,0,0,0,0,0,0
	single_cmd : N


!!HDA-Intel Codec information
!!---------------------------
--startcollapse--

Codec: IDT 92HD81B1X5
Address: 0
AFG Function Id: 0x1 (unsol 1)
Vendor Id: 0x111d7605
Subsystem Id: 0x103c1413
Revision Id: 0x100402
No Modem Function Group found
Default PCM:
    rates [0x5e0]: 44100 48000 88200 96000 192000
    bits [0xe]: 16 20 24
    formats [0x1]: PCM
Default Amp-In caps: ofs=0x00, nsteps=0x03, stepsize=0x27, mute=0
Default Amp-Out caps: ofs=0x7f, nsteps=0x7f, stepsize=0x02, mute=1
GPIO: io=3, o=0, i=0, unsolicited=1, wake=1
  IO[0]: enable=1, dir=1, wake=0, sticky=0, data=1, unsol=0
  IO[1]: enable=0, dir=0, wake=0, sticky=0, data=0, unsol=0
  IO[2]: enable=0, dir=0, wake=0, sticky=0, data=0, unsol=0
Power-Map: 0x00
Node 0x0a [Pin Complex] wcaps 0x400583: Stereo Amp-In
  Control: name="Mic Jack Mode", index=0, device=0
    ControlAmp: chs=0, dir=In, idx=0, ofs=0
  Control: name="Mic Capture Volume", index=0, device=0
    ControlAmp: chs=3, dir=In, idx=0, ofs=0
  Amp-In caps: N/A
  Amp-In vals:  [0x03 0x03]
  Pincap 0x0001173c: IN OUT HP EAPD Detect
    Vref caps: HIZ 50 GRD 80
  EAPD 0x2: EAPD
  Pin Default 0x03a19020: [Jack] Mic at Ext Left
    Conn = 1/8, Color = Pink
    DefAssociation = 0x2, Sequence = 0x0
  Pin-ctls: 0x24: IN VREF_80
  Unsolicited: tag=02, enabled=1
  Power: setting=D0, actual=D0
  Connection: 3
     0x13* 0x14 0x1c
Node 0x0b [Pin Complex] wcaps 0x400581: Stereo
  Pincap 0x0001001c: OUT HP EAPD Detect
  EAPD 0x2: EAPD
  Pin Default 0x0321401f: [Jack] HP Out at Ext Left
    Conn = 1/8, Color = Green
    DefAssociation = 0x1, Sequence = 0xf
  Pin-ctls: 0x40: OUT
  Unsolicited: tag=01, enabled=1
  Power: setting=D0, actual=D0
  Connection: 3
     0x13 0x14* 0x1c
Node 0x0c [Pin Complex] wcaps 0x400583: Stereo Amp-In
  Amp-In caps: N/A
  Amp-In vals:  [0x00 0x00]
  Pincap 0x00011734: IN OUT EAPD Detect
    Vref caps: HIZ 50 GRD 80
  EAPD 0x2: EAPD
  Pin Default 0x40f000f0: [N/A] Other at Ext N/A
    Conn = Unknown, Color = Unknown
    DefAssociation = 0xf, Sequence = 0x0
  Pin-ctls: 0x00: VREF_HIZ
  Unsolicited: tag=00, enabled=0
  Power: setting=D0, actual=D0
  Connection: 3
     0x13* 0x14 0x1c
Node 0x0d [Pin Complex] wcaps 0x400501: Stereo
  Pincap 0x00010050: OUT EAPD Balanced
  EAPD 0x2: EAPD
  Pin Default 0x90170110: [Fixed] Speaker at Int N/A
    Conn = Analog, Color = Unknown
    DefAssociation = 0x1, Sequence = 0x0
    Misc = NO_PRESENCE
  Pin-ctls: 0x40: OUT
  Power: setting=D0, actual=D0
  Connection: 3
     0x13* 0x14 0x1c
Node 0x0e [Pin Complex] wcaps 0x400583: Stereo Amp-In
  Amp-In caps: N/A
  Amp-In vals:  [0x00 0x00]
  Pincap 0x00010034: IN OUT EAPD Detect
  EAPD 0x2: EAPD
  Pin Default 0x40f000f0: [N/A] Other at Ext N/A
    Conn = Unknown, Color = Unknown
    DefAssociation = 0xf, Sequence = 0x0
  Pin-ctls: 0x00:
  Unsolicited: tag=00, enabled=0
  Power: setting=D0, actual=D0
  Connection: 3
     0x13 0x14* 0x1c
Node 0x0f [Pin Complex] wcaps 0x400583: Stereo Amp-In
  Amp-In caps: N/A
  Amp-In vals:  [0x00 0x00]
  Pincap 0x00010034: IN OUT EAPD Detect
  EAPD 0x2: EAPD
  Pin Default 0x40f000f0: [N/A] Other at Ext N/A
    Conn = Unknown, Color = Unknown
    DefAssociation = 0xf, Sequence = 0x0
  Pin-ctls: 0x00:
  Unsolicited: tag=00, enabled=0
  Power: setting=D0, actual=D0
  Connection: 3
     0x13 0x14* 0x1c
Node 0x10 [Pin Complex] wcaps 0x400500: Mono
  Pincap 0x00000010: OUT
  Pin Default 0x40f000f0: [N/A] Other at Ext N/A
    Conn = Unknown, Color = Unknown
    DefAssociation = 0xf, Sequence = 0x0
  Pin-ctls: 0x00:
  Power: setting=D0, actual=D0
  Connection: 1
     0x1a
Node 0x11 [Pin Complex] wcaps 0x400483: Stereo Amp-In
  Control: name="Internal Mic Capture Volume", index=0, device=0
    ControlAmp: chs=3, dir=In, idx=0, ofs=0
  Amp-In caps: N/A
  Amp-In vals:  [0x00 0x00]
  Pincap 0x00000024: IN Detect
  Pin Default 0x90a60130: [Fixed] Mic at Int N/A
    Conn = Digital, Color = Unknown
    DefAssociation = 0x3, Sequence = 0x0
    Misc = NO_PRESENCE
  Pin-ctls: 0x20: IN
  Unsolicited: tag=00, enabled=0
  Power: setting=D0, actual=D0
Node 0x12 [Vendor Defined Widget] wcaps 0xf00503: Stereo Amp-In
  Amp-In caps: N/A
  Amp-In vals:  [0x00 0x00]
  Power: setting=D0, actual=D0
  Connection: 1
     0x20
Node 0x13 [Audio Output] wcaps 0xd0c05: Stereo Amp-Out R/L
  Control: name="Speaker Playback Volume", index=0, device=0
    ControlAmp: chs=3, dir=Out, idx=0, ofs=63
  Control: name="Speaker Playback Switch", index=0, device=0
    ControlAmp: chs=3, dir=Out, idx=0, ofs=0
  Device: name="STAC92xx Analog", type="Audio", device=0
  Amp-Out caps: N/A
  Amp-Out vals:  [0xdd 0xdd]
  Converter: stream=0, channel=0
  Power: setting=D0, actual=D0
  Delay: 13 samples
Node 0x14 [Audio Output] wcaps 0xd0c05: Stereo Amp-Out R/L
  Control: name="Headphone Playback Volume", index=0, device=0
    ControlAmp: chs=3, dir=Out, idx=0, ofs=63
  Control: name="Headphone Playback Switch", index=0, device=0
    ControlAmp: chs=3, dir=Out, idx=0, ofs=0
  Amp-Out caps: N/A
  Amp-Out vals:  [0xdd 0xdd]
  Converter: stream=0, channel=0
  Power: setting=D0, actual=D0
  Delay: 13 samples
Node 0x15 [Audio Input] wcaps 0x1d0541: Stereo
  Device: name="STAC92xx Analog", type="Audio", device=0
  Converter: stream=0, channel=0
  SDI-Select: 0
  Power: setting=D0, actual=D0
  Delay: 13 samples
  Connection: 1
     0x17
  Processing caps: benign=0, ncoeff=0
Node 0x16 [Audio Input] wcaps 0x1d0541: Stereo
  Converter: stream=0, channel=0
  SDI-Select: 0
  Power: setting=D0, actual=D0
  Delay: 13 samples
  Connection: 1
     0x18
  Processing caps: benign=0, ncoeff=0
Node 0x17 [Audio Selector] wcaps 0x300d0d: Stereo Amp-Out R/L
  Control: name="Capture Volume", index=0, device=0
    ControlAmp: chs=3, dir=Out, idx=0, ofs=0
  Control: name="Capture Switch", index=0, device=0
    ControlAmp: chs=3, dir=Out, idx=0, ofs=0
  Amp-Out caps: ofs=0x00, nsteps=0x0f, stepsize=0x05, mute=1
  Amp-Out vals:  [0x8f 0x8f]
  Power: setting=D0, actual=D0
  Connection: 7
     0x0c 0x0e 0x0f 0x1b 0x11* 0x12 0x0a
Node 0x18 [Audio Selector] wcaps 0x300d0d: Stereo Amp-Out R/L
  Amp-Out caps: ofs=0x00, nsteps=0x0f, stepsize=0x05, mute=1
  Amp-Out vals:  [0x80 0x80]
  Power: setting=D0, actual=D0
  Connection: 7
     0x0c* 0x0e 0x0f 0x1b 0x11 0x12 0x0a
Node 0x19 [Audio Selector] wcaps 0x300501: Stereo
  Power: setting=D0, actual=D0
  Connection: 3
     0x13* 0x14 0x1c
Node 0x1a [Audio Mixer] wcaps 0x200500: Mono
  Power: setting=D0, actual=D0
  Connection: 1
     0x19
Node 0x1b [Audio Mixer] wcaps 0x20050b: Stereo Amp-In
  Amp-In caps: ofs=0x17, nsteps=0x1f, stepsize=0x05, mute=1
  Amp-In vals:  [0x97 0x97] [0x97 0x97] [0x97 0x97] [0x97 0x97] [0x97 0x97] [0x97 0x97]
  Power: setting=D0, actual=D0
  Connection: 6
     0x0c 0x0e 0x0f 0x13 0x14 0x0a
Node 0x1c [Audio Selector] wcaps 0x30050d: Stereo Amp-Out
  Amp-Out caps: ofs=0x1f, nsteps=0x1f, stepsize=0x05, mute=1
  Amp-Out vals:  [0x9f 0x9f]
  Power: setting=D0, actual=D0
  Connection: 1
     0x1b
Node 0x1d [Audio Output] wcaps 0x4061d: Stereo Digital Amp-Out
  Amp-Out caps: ofs=0x00, nsteps=0x00, stepsize=0x00, mute=1
  Amp-Out vals:  [0x00 0x00]
  Converter: stream=0, channel=0
  Digital:
  Digital category: 0x0
  PCM:
    rates [0x5e0]: 44100 48000 88200 96000 192000
    bits [0xe]: 16 20 24
    formats [0x5]: PCM AC3
  Power: setting=D0, actual=D0
  Delay: 4 samples
Node 0x1e [Audio Output] wcaps 0x4061d: Stereo Digital Amp-Out
  Amp-Out caps: ofs=0x00, nsteps=0x00, stepsize=0x00, mute=1
  Amp-Out vals:  [0x00 0x00]
  Converter: stream=0, channel=0
  Digital:
  Digital category: 0x0
  PCM:
    rates [0x5e0]: 44100 48000 88200 96000 192000
    bits [0xe]: 16 20 24
    formats [0x5]: PCM AC3
  Power: setting=D0, actual=D0
  Delay: 4 samples
Node 0x1f [Pin Complex] wcaps 0x400781: Stereo Digital
  Pincap 0x00000014: OUT Detect
  Pin Default 0x40f000f0: [N/A] Other at Ext N/A
    Conn = Unknown, Color = Unknown
    DefAssociation = 0xf, Sequence = 0x0
  Pin-ctls: 0x00:
  Unsolicited: tag=00, enabled=0
  Power: setting=D0, actual=D0
  Connection: 1
     0x1d
Node 0x20 [Pin Complex] wcaps 0x400781: Stereo Digital
  Pincap 0x00000034: IN OUT Detect
  Pin Default 0x40f000f0: [N/A] Other at Ext N/A
    Conn = Unknown, Color = Unknown
    DefAssociation = 0xf, Sequence = 0x0
  Pin-ctls: 0x00:
  Unsolicited: tag=00, enabled=0
  Power: setting=D0, actual=D0
  Connection: 1
     0x1e
Node 0x21 [Beep Generator Widget] wcaps 0x70000c: Mono Amp-Out
  Control: name="Beep Playback Switch", index=0, device=0
    ControlAmp: chs=1, dir=Out, idx=0, ofs=0
  Control: name="Beep Playback Volume", index=0, device=0
    ControlAmp: chs=1, dir=Out, idx=0, ofs=0
  Amp-Out caps: ofs=0x03, nsteps=0x03, stepsize=0x17, mute=1
  Amp-Out vals:  [0x00]
Node 0x22 [Vendor Defined Widget] wcaps 0xf00000: Mono
Codec: Intel IbexPeak HDMI
Address: 3
AFG Function Id: 0x1 (unsol 0)
Vendor Id: 0x80862804
Subsystem Id: 0x80860101
Revision Id: 0x100000
No Modem Function Group found
Default PCM:
    rates [0x0]:
    bits [0x0]:
    formats [0x0]:
Default Amp-In caps: N/A
Default Amp-Out caps: N/A
GPIO: io=0, o=0, i=0, unsolicited=0, wake=0
Node 0x02 [Audio Output] wcaps 0x6611: 8-Channels Digital
  Control: name="IEC958 Playback Con Mask", index=0, device=0
  Control: name="IEC958 Playback Pro Mask", index=0, device=0
  Control: name="IEC958 Playback Default", index=0, device=0
  Control: name="IEC958 Playback Switch", index=0, device=0
  Device: name="HDMI 0", type="HDMI", device=3
  Converter: stream=0, channel=0
  Digital: Enabled GenLevel
  Digital category: 0x2
  PCM:
    rates [0x7f0]: 32000 44100 48000 88200 96000 176400 192000
    bits [0x1e]: 16 20 24 32
    formats [0x5]: PCM AC3
  Power states:  D0 D3
  Power: setting=D0, actual=D0
Node 0x03 [Audio Output] wcaps 0x6611: 8-Channels Digital
  Converter: stream=0, channel=0
  Digital: Enabled
  Digital category: 0x0
  PCM:
    rates [0x7f0]: 32000 44100 48000 88200 96000 176400 192000
    bits [0x1e]: 16 20 24 32
    formats [0x5]: PCM AC3
  Power states:  D0 D3
  Power: setting=D0, actual=D0
Node 0x04 [Pin Complex] wcaps 0x40778d: 8-Channels Digital Amp-Out CP
  Amp-Out caps: ofs=0x00, nsteps=0x00, stepsize=0x00, mute=1
  Amp-Out vals:  [0x00 0x80]
  Pincap 0x09000094: OUT Detect HBR HDMI DP
  Pin Default 0x58560010: [N/A] Digital Out at Int HDMI
    Conn = Digital, Color = Unknown
    DefAssociation = 0x1, Sequence = 0x0
  Pin-ctls: 0x40: OUT
  Unsolicited: tag=00, enabled=0
  Power states:  D0 D3
  Power: setting=D0, actual=D0
  Connection: 2
     0x02* 0x03
Node 0x05 [Pin Complex] wcaps 0x40778d: 8-Channels Digital Amp-Out CP
  Amp-Out caps: ofs=0x00, nsteps=0x00, stepsize=0x00, mute=1
  Amp-Out vals:  [0x00 0x80]
  Pincap 0x09000094: OUT Detect HBR HDMI DP
  Pin Default 0x58560020: [N/A] Digital Out at Int HDMI
    Conn = Digital, Color = Unknown
    DefAssociation = 0x2, Sequence = 0x0
  Pin-ctls: 0x40: OUT
  Unsolicited: tag=00, enabled=0
  Power states:  D0 D3
  Power: setting=D0, actual=D0
  Connection: 2
     0x02* 0x03
Node 0x06 [Pin Complex] wcaps 0x40778d: 8-Channels Digital Amp-Out CP
  Amp-Out caps: ofs=0x00, nsteps=0x00, stepsize=0x00, mute=1
  Amp-Out vals:  [0x00 0x00]
  Pincap 0x09000094: OUT Detect HBR HDMI DP
  Pin Default 0x18560030: [Jack] Digital Out at Int HDMI
    Conn = Digital, Color = Unknown
    DefAssociation = 0x3, Sequence = 0x0
  Pin-ctls: 0x40: OUT
  Unsolicited: tag=06, enabled=1
  Power states:  D0 D3
  Power: setting=D0, actual=D0
  Connection: 2
     0x02* 0x03
Node 0x07 [Vendor Defined Widget] wcaps 0xf00000: Mono
--endcollapse--


!!ALSA Device nodes
!!-----------------

crw-rw----+ 1 root audio 116,  7 Nov  8 21:48 /dev/snd/controlC0
crw-rw----+ 1 root audio 116,  6 Nov  8 21:48 /dev/snd/hwC0D0
crw-rw----+ 1 root audio 116,  5 Nov  8 21:48 /dev/snd/hwC0D3
crw-rw----+ 1 root audio 116,  4 Nov  8 22:08 /dev/snd/pcmC0D0c
crw-rw----+ 1 root audio 116,  3 Nov  8 22:08 /dev/snd/pcmC0D0p
crw-rw----+ 1 root audio 116,  2 Nov  8 22:08 /dev/snd/pcmC0D3p
crw-rw----+ 1 root audio 116,  1 Nov  8 21:48 /dev/snd/seq
crw-rw----+ 1 root audio 116, 33 Nov  8 21:48 /dev/snd/timer

/dev/snd/by-path:
total 0
drwxr-xr-x 2 root root  60 Nov  8 21:48 .
drwxr-xr-x 3 root root 220 Nov  8 21:48 ..
lrwxrwxrwx 1 root root  12 Nov  8 21:48 pci-0000:00:1b.0 -> ../controlC0


!!Aplay/Arecord output
!!------------

APLAY

**** List of PLAYBACK Hardware Devices ****
card 0: Intel [HDA Intel], device 0: STAC92xx Analog [STAC92xx Analog]
  Subdevices: 1/1
  Subdevice #0: subdevice #0
card 0: Intel [HDA Intel], device 3: HDMI 0 [HDMI 0]
  Subdevices: 1/1
  Subdevice #0: subdevice #0

ARECORD

**** List of CAPTURE Hardware Devices ****
card 0: Intel [HDA Intel], device 0: STAC92xx Analog [STAC92xx Analog]
  Subdevices: 1/1
  Subdevice #0: subdevice #0

!!Amixer output
!!-------------

!!-------Mixer controls for card 0 [Intel]

Card hw:0 'Intel'/'HDA Intel at 0xd4900000 irq 47'
  Mixer name	: 'Intel IbexPeak HDMI'
  Components	: 'HDA:111d7605,103c1413,00100402 HDA:80862804,80860101,00100000'
  Controls      : 18
  Simple ctrls  : 10
Simple mixer control 'Master',0
  Capabilities: pvolume pvolume-joined pswitch pswitch-joined penum
  Playback channels: Mono
  Limits: Playback 0 - 64
  Mono: Playback 30 [47%] [-25.50dB] [off]
Simple mixer control 'Headphone',0
  Capabilities: pvolume pswitch penum
  Playback channels: Front Left - Front Right
  Limits: Playback 0 - 64
  Mono:
  Front Left: Playback 64 [100%] [0.00dB] [off]
  Front Right: Playback 64 [100%] [0.00dB] [off]
Simple mixer control 'Speaker',0
  Capabilities: pvolume pswitch penum
  Playback channels: Front Left - Front Right
  Limits: Playback 0 - 64
  Mono:
  Front Left: Playback 64 [100%] [0.00dB] [off]
  Front Right: Playback 64 [100%] [0.00dB] [off]
Simple mixer control 'PCM',0
  Capabilities: pvolume penum
  Playback channels: Front Left - Front Right
  Limits: Playback 0 - 255
  Mono:
  Front Left: Playback 255 [100%] [0.00dB]
  Front Right: Playback 255 [100%] [0.00dB]
Simple mixer control 'Mic',0
  Capabilities: cvolume penum
  Capture channels: Front Left - Front Right
  Limits: Capture 0 - 3
  Front Left: Capture 3 [100%] [30.00dB]
  Front Right: Capture 3 [100%] [30.00dB]
Simple mixer control 'Mic Jack Mode',0
  Capabilities: enum
  Items: 'Mic In' 'Line In'
  Item0: 'Mic In'
Simple mixer control 'IEC958',0
  Capabilities: pswitch pswitch-joined penum
  Playback channels: Mono
  Mono: Playback [on]
Simple mixer control 'Beep',0
  Capabilities: pvolume pvolume-joined pswitch pswitch-joined penum
  Playback channels: Mono
  Limits: Playback 0 - 3
  Mono: Playback 1 [33%] [-12.00dB] [on]
Simple mixer control 'Capture',0
  Capabilities: cvolume cswitch penum
  Capture channels: Front Left - Front Right
  Limits: Capture 0 - 15
  Front Left: Capture 15 [100%] [22.50dB] [off]
  Front Right: Capture 15 [100%] [22.50dB] [off]
Simple mixer control 'Internal Mic',0
  Capabilities: cvolume penum
  Capture channels: Front Left - Front Right
  Limits: Capture 0 - 3
  Front Left: Capture 0 [0%] [0.00dB]
  Front Right: Capture 0 [0%] [0.00dB]


!!Alsactl output
!!-------------

--startcollapse--
state.Intel {
	control.1 {
		iface MIXER
		name 'Speaker Playback Volume'
		value.0 64
		value.1 64
		comment {
			access 'read write'
			type INTEGER
			count 2
			range '0 - 64'
			dbmin -4800
			dbmax 0
			dbvalue.0 0
			dbvalue.1 0
		}
	}
	control.2 {
		iface MIXER
		name 'Speaker Playback Switch'
		value.0 false
		value.1 false
		comment {
			access 'read write'
			type BOOLEAN
			count 2
		}
	}
	control.3 {
		iface MIXER
		name 'Mic Jack Mode'
		value 'Mic In'
		comment {
			access 'read write'
			type ENUMERATED
			count 1
			item.0 'Mic In'
			item.1 'Line In'
		}
	}
	control.4 {
		iface MIXER
		name 'Beep Playback Switch'
		value true
		comment {
			access 'read write'
			type BOOLEAN
			count 1
		}
	}
	control.5 {
		iface MIXER
		name 'Beep Playback Volume'
		value 1
		comment {
			access 'read write'
			type INTEGER
			count 1
			range '0 - 3'
			dbmin -1800
			dbmax 0
			dbvalue.0 -1200
		}
	}
	control.6 {
		iface MIXER
		name 'Headphone Playback Volume'
		value.0 64
		value.1 64
		comment {
			access 'read write'
			type INTEGER
			count 2
			range '0 - 64'
			dbmin -4800
			dbmax 0
			dbvalue.0 0
			dbvalue.1 0
		}
	}
	control.7 {
		iface MIXER
		name 'Headphone Playback Switch'
		value.0 false
		value.1 false
		comment {
			access 'read write'
			type BOOLEAN
			count 2
		}
	}
	control.8 {
		iface MIXER
		name 'Capture Volume'
		value.0 15
		value.1 15
		comment {
			access 'read write'
			type INTEGER
			count 2
			range '0 - 15'
			dbmin 0
			dbmax 2250
			dbvalue.0 2250
			dbvalue.1 2250
		}
	}
	control.9 {
		iface MIXER
		name 'Capture Switch'
		value.0 false
		value.1 false
		comment {
			access 'read write'
			type BOOLEAN
			count 2
		}
	}
	control.10 {
		iface MIXER
		name 'Mic Capture Volume'
		value.0 3
		value.1 3
		comment {
			access 'read write'
			type INTEGER
			count 2
			range '0 - 3'
			dbmin 0
			dbmax 3000
			dbvalue.0 3000
			dbvalue.1 3000
		}
	}
	control.11 {
		iface MIXER
		name 'Internal Mic Capture Volume'
		value.0 0
		value.1 0
		comment {
			access 'read write'
			type INTEGER
			count 2
			range '0 - 3'
			dbmin 0
			dbmax 3000
			dbvalue.0 0
			dbvalue.1 0
		}
	}
	control.12 {
		iface MIXER
		name 'Master Playback Volume'
		value 30
		comment {
			access 'read write'
			type INTEGER
			count 1
			range '0 - 64'
			dbmin -9999999
			dbmax 0
			dbvalue.0 -2550
		}
	}
	control.13 {
		iface MIXER
		name 'Master Playback Switch'
		value false
		comment {
			access 'read write'
			type BOOLEAN
			count 1
		}
	}
	control.14 {
		iface MIXER
		name 'IEC958 Playback Con Mask'
		value '0fff000000000000000000000000000000000000000000000000000000000000000000000000000000000000000000000000000000000000000000000000000000000000000000000000000000000000000000000000000000000000000000000000000000000000000000000000000000000000000000000000000000000000000000000000000000000000000000000000000000000000000000000000000000000000000000000000000000000000'
		comment {
			access read
			type IEC958
			count 1
		}
	}
	control.15 {
		iface MIXER
		name 'IEC958 Playback Pro Mask'
		value '0f00000000000000000000000000000000000000000000000000000000000000000000000000000000000000000000000000000000000000000000000000000000000000000000000000000000000000000000000000000000000000000000000000000000000000000000000000000000000000000000000000000000000000000000000000000000000000000000000000000000000000000000000000000000000000000000000000000000000000'
		comment {
			access read
			type IEC958
			count 1
		}
	}
	control.16 {
		iface MIXER
		name 'IEC958 Playback Default'
		value '0482000200000000000000000000000000000000000000000000000000000000000000000000000000000000000000000000000000000000000000000000000000000000000000000000000000000000000000000000000000000000000000000000000000000000000000000000000000000000000000000000000000000000000000000000000000000000000000000000000000000000000000000000000000000000000000000000000000000000'
		comment {
			access 'read write'
			type IEC958
			count 1
		}
	}
	control.17 {
		iface MIXER
		name 'IEC958 Playback Switch'
		value true
		comment {
			access 'read write'
			type BOOLEAN
			count 1
		}
	}
	control.18 {
		iface MIXER
		name 'PCM Playback Volume'
		value.0 255
		value.1 255
		comment {
			access 'read write user'
			type INTEGER
			count 2
			range '0 - 255'
			tlv '0000000100000008ffffec1400000014'
			dbmin -5100
			dbmax 0
			dbvalue.0 0
			dbvalue.1 0
		}
	}
}
--endcollapse--


!!All Loaded Modules
!!------------------

Module
ums_realtek
usb_storage
uas
parport_pc
ppdev
dm_crypt
bnep
rfcomm
bluetooth
joydev
hp_wmi
sparse_keymap
snd_hda_codec_hdmi
snd_hda_codec_idt
binfmt_misc
arc4
uvcvideo
videodev
v4l2_compat_ioctl32
snd_hda_intel
snd_hda_codec
snd_hwdep
snd_pcm
snd_seq_midi
snd_rawmidi
snd_seq_midi_event
snd_seq
ath9k
snd_timer
snd_seq_device
mac80211
ath9k_common
psmouse
serio_raw
intel_ips
ath9k_hw
ath
snd
cfg80211
soundcore
snd_page_alloc
hp_accel
lis3lv02d
input_polldev
mei
lp
parport
ahci
libahci
r8169
i915
wmi
drm_kms_helper
drm
i2c_algo_bit
video


!!Sysfs Files
!!-----------

/sys/class/sound/hwC0D0/init_pin_configs:
0x0a 0x03a19020
0x0b 0x0321401f
0x0c 0x40f000f0
0x0d 0x90170110
0x0e 0x40f000f0
0x0f 0x40f000f0
0x10 0x40f000f0
0x11 0x90a60130
0x1f 0x40f000f0
0x20 0x40f000f0

/sys/class/sound/hwC0D0/driver_pin_configs:

/sys/class/sound/hwC0D0/user_pin_configs:

/sys/class/sound/hwC0D0/init_verbs:

/sys/class/sound/hwC0D3/init_pin_configs:
0x04 0x58560010
0x05 0x58560020
0x06 0x18560030

/sys/class/sound/hwC0D3/driver_pin_configs:

/sys/class/sound/hwC0D3/user_pin_configs:

/sys/class/sound/hwC0D3/init_verbs:


!!ALSA/HDA dmesg
!!------------------

[   14.471686] uvcvideo: Found UVC 1.00 device HP Webcam [2 MP Fixed] (04f2:b1ac)
[   14.472400] HDA Intel 0000:00:1b.0: power state changed by ACPI to D0
[   14.472410] HDA Intel 0000:00:1b.0: power state changed by ACPI to D0
[   14.472424] HDA Intel 0000:00:1b.0: PCI INT A -> GSI 17 (level, low) -> IRQ 17
[   14.472512] HDA Intel 0000:00:1b.0: irq 47 for MSI/MSI-X
[   14.472551] HDA Intel 0000:00:1b.0: setting latency timer to 64
[   14.481170] ath: EEPROM regdomain: 0x60
--
[   14.559563] init: failsafe main process (763) killed by TERM signal
[   14.563746] HDMI status: Pin=6 Presence_Detect=0 ELD_Valid=0
[   14.563974] input: HDA Intel HDMI/DP,pcm=3 as /devices/pci0000:00/0000:00:1b.0/sound/card0/input7
[   14.564099] input: HDA Intel Mic at Ext Left Jack as /devices/pci0000:00/0000:00:1b.0/sound/card0/input8
[   14.564188] input: HDA Intel HP Out at Ext Left Jack as /devices/pci0000:00/0000:00:1b.0/sound/card0/input9
[   14.627166] cfg80211: Ignoring regulatory request Set by core since the driver uses its own custom regulatory domain 
--
[ 4591.309659] pciehp 0000:00:1c.1:pcie04: pciehp_suspend ENTRY
[ 4591.309770] HDA Intel 0000:00:1b.0: PCI INT A disabled
[ 4591.324732] ehci_hcd 0000:00:1a.0: PCI INT A disabled
[ 4591.329218] HDA Intel 0000:00:1b.0: power state changed by ACPI to D3
[ 4591.364615] ehci_hcd 0000:00:1d.0: PCI INT A disabled
--
[ 4593.525881] ehci_hcd 0000:00:1a.0: restoring config space at offset 0x1 (was 0x2900000, writing 0x2900002)
[ 4593.525934] HDA Intel 0000:00:1b.0: restoring config space at offset 0x1 (was 0x100000, writing 0x100002)
[ 4593.525970] pcieport 0000:00:1c.0: restoring config space at offset 0xf (was 0x100, writing 0x105)
--
[ 4593.529439] sd 0:0:0:0: [sda] Starting disk
[ 4593.581223] HDA Intel 0000:00:1b.0: power state changed by ACPI to D0
[ 4593.581267] HDA Intel 0000:00:1b.0: power state changed by ACPI to D0
[ 4593.581277] HDA Intel 0000:00:1b.0: power state changed by ACPI to D0
[ 4593.581283] HDA Intel 0000:00:1b.0: power state changed by ACPI to D0
[ 4593.581291] HDA Intel 0000:00:1b.0: PCI INT A -> GSI 17 (level, low) -> IRQ 17
[ 4593.581299] HDA Intel 0000:00:1b.0: setting latency timer to 64
[ 4593.581357] HDA Intel 0000:00:1b.0: irq 47 for MSI/MSI-X
[ 4593.688381] Extended CMOS year: 2000


