upload=true&script=true&cardinfo=
!!################################
!!ALSA Information Script v 0.4.58
!!################################

!!Script ran on: Fri Nov 27 11:05:42 UTC 2009


!!Linux Distribution
!!------------------

Welcome to openSUSE 11.2 "Emerald" - Kernel \r (\l). openSUSE 11.2 (x86_64) LSB_VERSION="core-2.0-noarch:core-3.2-noarch:core-4.0-noarch:core-2.0-x86_64:core-3.2-x86_64:core-4.0-x86_64"


!!DMI Information
!!---------------

Manufacturer:      To Be Filled By O.E.M.
Product Name:      To Be Filled By O.E.M.


!!Kernel Information
!!------------------

Kernel release:    2.6.32-rc8-mm1_64
Operating System:  GNU/Linux
Architecture:      x86_64
Processor:         x86_64
SMP Enabled:       Yes


!!ALSA Version
!!------------

Driver version:     1.0.21
Library version:    
Utilities version:  1.0.21


!!Loaded ALSA modules
!!-------------------



!!Sound Servers on this system
!!----------------------------

Pulseaudio:
      Installed - Yes (/usr/bin/pulseaudio)
      Running - Yes

ESound Daemon:
      Installed - Yes (/usr/bin/esd)
      Running - No

aRts:
      Installed - Yes (/opt/kde3/bin/artsd)
      Running - No


!!Soundcards recognised by ALSA
!!-----------------------------

 0 [Intel          ]: HDA-Intel - HDA Intel
                      HDA Intel at 0xffa74000 irq 29


!!PCI Soundcards installed in the system
!!--------------------------------------

00:1b.0 Audio device: Intel Corporation 82801I (ICH9 Family) HD Audio Controller (rev 02)


!!Advanced information - PCI Vendor/Device/Susbsystem ID's
!!--------------------------------------------------------

00:1b.0 0403: 8086:293e (rev 02)
	Subsystem: 8086:293e


!!Loaded sound module options
!!--------------------------


!!HDA-Intel Codec information
!!---------------------------
--startcollapse--

Codec: SigmaTel STAC9274D
Address: 2
Function Id: 0x1
Vendor Id: 0x83847621
Subsystem Id: 0x00000100
Revision Id: 0x100201
No Modem Function Group found
Default PCM:
    rates [0x7e0]: 44100 48000 88200 96000 176400 192000
    bits [0xe]: 16 20 24
    formats [0x1]: PCM
Default Amp-In caps: ofs=0x00, nsteps=0x0e, stepsize=0x05, mute=0
Default Amp-Out caps: ofs=0x7f, nsteps=0x7f, stepsize=0x02, mute=1
GPIO: io=3, o=0, i=0, unsolicited=1, wake=1
  IO[0]: enable=1, dir=1, wake=0, sticky=0, data=0, unsol=0
  IO[1]: enable=0, dir=0, wake=0, sticky=0, data=0, unsol=0
  IO[2]: enable=0, dir=0, wake=0, sticky=0, data=0, unsol=0
Analog Loopback: 0x00
Node 0x02 [Audio Output] wcaps 0xd0c05: Stereo Amp-Out R/L
  Control: name="Front Playback Volume", index=0, device=0
  Control: name="Front Playback Switch", index=0, device=0
  Device: name="STAC92xx Analog", type="Audio", device=0
  Amp-Out caps: N/A
  Amp-Out vals:  [0x67 0x67]
  Converter: stream=5, channel=0
  Power: setting=D0, actual=D0
  Delay: 13 samples
Node 0x03 [Audio Output] wcaps 0xd0c05: Stereo Amp-Out R/L
  Control: name="Side Playback Volume", index=0, device=0
  Control: name="Side Playback Switch", index=0, device=0
  Amp-Out caps: N/A
  Amp-Out vals:  [0x67 0x67]
  Converter: stream=5, channel=0
  Power: setting=D0, actual=D0
  Delay: 13 samples
Node 0x04 [Audio Output] wcaps 0xd0c05: Stereo Amp-Out R/L
  Control: name="Center Playback Volume", index=0, device=0
  Control: name="Center Playback Switch", index=0, device=0
  Control: name="LFE Playback Volume", index=0, device=0
  Control: name="LFE Playback Switch", index=0, device=0
  Control: name="Swap Center/LFE Playback Switch", index=0, device=0
  Amp-Out caps: N/A
  Amp-Out vals:  [0x67 0x67]
  Converter: stream=5, channel=4
  Power: setting=D0, actual=D0
  Delay: 13 samples
Node 0x05 [Audio Output] wcaps 0xd0c05: Stereo Amp-Out R/L
  Control: name="Surround Playback Volume", index=0, device=0
  Control: name="Surround Playback Switch", index=0, device=0
  Amp-Out caps: N/A
  Amp-Out vals:  [0x67 0x67]
  Converter: stream=5, channel=2
  Power: setting=D0, actual=D0
  Delay: 13 samples
Node 0x06 [Audio Output] wcaps 0xd0c05: Stereo Amp-Out R/L
  Control: name="Headphone Playback Volume", index=0, device=0
  Control: name="Headphone Playback Switch", index=0, device=0
  Amp-Out caps: N/A
  Amp-Out vals:  [0x67 0x67]
  Converter: stream=5, channel=0
  Power: setting=D0, actual=D0
  Delay: 13 samples
Node 0x07 [Audio Input] wcaps 0x1d0541: Stereo
  Device: name="STAC92xx Analog", type="Audio", device=0
  Converter: stream=0, channel=0
  SDI-Select: 0
  Power: setting=D0, actual=D0
  Delay: 13 samples
  Connection: 1
     0x1b
  Processing caps: benign=0, ncoeff=0
Node 0x08 [Audio Input] wcaps 0x1d0541: Stereo
  Converter: stream=0, channel=0
  SDI-Select: 0
  Power: setting=D0, actual=D0
  Delay: 13 samples
  Connection: 1
     0x1c
  Processing caps: benign=0, ncoeff=0
Node 0x09 [Audio Input] wcaps 0x1d0541: Stereo
  Converter: stream=0, channel=0
  SDI-Select: 0
  Power: setting=D0, actual=D0
  Delay: 13 samples
  Connection: 1
     0x1d
  Processing caps: benign=0, ncoeff=0
Node 0x0a [Pin Complex] wcaps 0x400181: Stereo
  Pincap 0x0000173f: IN OUT HP Detect Trigger ImpSense
    Vref caps: HIZ 50 GRD 80
  Pin Default 0x02214020: [Jack] HP Out at Ext Front
    Conn = 1/8, Color = Green
    DefAssociation = 0x2, Sequence = 0x0
  Pin-ctls: 0x00: VREF_HIZ
  Unsolicited: tag=01, enabled=1
  Connection: 3
     0x02 0x03 0x06*
Node 0x0b [Pin Complex] wcaps 0x400181: Stereo
  Control: name="Front Mic Jack Mode", index=0, device=0
  Pincap 0x0000173f: IN OUT HP Detect Trigger ImpSense
    Vref caps: HIZ 50 GRD 80
  Pin Default 0x02a19080: [Jack] Mic at Ext Front
    Conn = 1/8, Color = Pink
    DefAssociation = 0x8, Sequence = 0x0
  Pin-ctls: 0x24: IN VREF_80
  Unsolicited: tag=03, enabled=1
  Connection: 3
     0x02* 0x03 0x06
Node 0x0c [Pin Complex] wcaps 0x400181: Stereo
  Control: name="Line Jack Mode", index=0, device=0
  Pincap 0x00001737: IN OUT Detect Trigger ImpSense
    Vref caps: HIZ 50 GRD 80
  Pin Default 0x0181304e: [Jack] Line In at Ext Rear
    Conn = 1/8, Color = Blue
    DefAssociation = 0x4, Sequence = 0xe
  Pin-ctls: 0x20: IN VREF_HIZ
  Unsolicited: tag=04, enabled=1
  Connection: 1
     0x03
Node 0x0d [Pin Complex] wcaps 0x400181: Stereo
  Pincap 0x0000173f: IN OUT HP Detect Trigger ImpSense
    Vref caps: HIZ 50 GRD 80
  Pin Default 0x01014010: [Jack] Line Out at Ext Rear
    Conn = 1/8, Color = Green
    DefAssociation = 0x1, Sequence = 0x0
  Pin-ctls: 0x40: OUT VREF_HIZ
  Unsolicited: tag=00, enabled=0
  Connection: 1
     0x02
Node 0x0e [Pin Complex] wcaps 0x400181: Stereo
  Control: name="Mic Jack Mode", index=0, device=0
  Pincap 0x00001737: IN OUT Detect Trigger ImpSense
    Vref caps: HIZ 50 GRD 80
  Pin Default 0x01a19040: [Jack] Mic at Ext Rear
    Conn = 1/8, Color = Pink
    DefAssociation = 0x4, Sequence = 0x0
  Pin-ctls: 0x24: IN VREF_80
  Unsolicited: tag=02, enabled=1
  Connection: 1
     0x04
Node 0x0f [Pin Complex] wcaps 0x400181: Stereo
  Pincap 0x00001737: IN OUT Detect Trigger ImpSense
    Vref caps: HIZ 50 GRD 80
  Pin Default 0x01011012: [Jack] Line Out at Ext Rear
    Conn = 1/8, Color = Black
    DefAssociation = 0x1, Sequence = 0x2
  Pin-ctls: 0x40: OUT VREF_HIZ
  Unsolicited: tag=00, enabled=0
  Connection: 1
     0x05
Node 0x10 [Pin Complex] wcaps 0x400181: Stereo
  Pincap 0x00000037: IN OUT Detect Trigger ImpSense
  Pin Default 0x01016011: [Jack] Line Out at Ext Rear
    Conn = 1/8, Color = Orange
    DefAssociation = 0x1, Sequence = 0x1
  Pin-ctls: 0x40: OUT
  Unsolicited: tag=00, enabled=0
  Connection: 1
     0x04
Node 0x11 [Pin Complex] wcaps 0x400181: Stereo
  Pincap 0x00000037: IN OUT Detect Trigger ImpSense
  Pin Default 0x01012014: [Jack] Line Out at Ext Rear
    Conn = 1/8, Color = Grey
    DefAssociation = 0x1, Sequence = 0x4
  Pin-ctls: 0x40: OUT
  Unsolicited: tag=00, enabled=0
  Connection: 1
     0x03
Node 0x12 [Pin Complex] wcaps 0x400001: Stereo
  Pincap 0x00000020: IN
  Pin Default 0x503301f0: [N/A] CD at Int N/A
    Conn = ATAPI, Color = Unknown
    DefAssociation = 0xf, Sequence = 0x0
    Misc = NO_PRESENCE
  Pin-ctls: 0x00:
Node 0x13 [Pin Complex] wcaps 0x400001: Stereo
  Pincap 0x00000020: IN
  Pin Default 0x50a001f0: [N/A] Mic at Int N/A
    Conn = Unknown, Color = Unknown
    DefAssociation = 0xf, Sequence = 0x0
    Misc = NO_PRESENCE
  Pin-ctls: 0x00:
Node 0x14 [Pin Complex] wcaps 0x400001: Stereo
  Pincap 0x00000020: IN
  Pin Default 0x50a001f0: [N/A] Mic at Int N/A
    Conn = Unknown, Color = Unknown
    DefAssociation = 0xf, Sequence = 0x0
    Misc = NO_PRESENCE
  Pin-ctls: 0x00:
Node 0x15 [Audio Selector] wcaps 0x30010d: Stereo Amp-Out
  Control: name="Mux Capture Volume", index=0, device=0
  Amp-Out caps: ofs=0x00, nsteps=0x04, stepsize=0x27, mute=0
  Amp-Out vals:  [0x00 0x00]
  Connection: 9
     0x0e* 0x12 0x0f 0x0b 0x0c 0x0d 0x0a 0x10 0x11
Node 0x16 [Audio Selector] wcaps 0x30010d: Stereo Amp-Out
  Control: name="Mux Capture Volume", index=1, device=0
  Amp-Out caps: ofs=0x00, nsteps=0x04, stepsize=0x27, mute=0
  Amp-Out vals:  [0x00 0x00]
  Connection: 9
     0x0e* 0x12 0x0f 0x0b 0x0c 0x0d 0x0a 0x10 0x11
Node 0x17 [Audio Selector] wcaps 0x30010d: Stereo Amp-Out
  Control: name="Mux Capture Volume", index=2, device=0
  Amp-Out caps: ofs=0x00, nsteps=0x04, stepsize=0x27, mute=0
  Amp-Out vals:  [0x00 0x00]
  Connection: 9
     0x0e* 0x12 0x0f 0x0b 0x0c 0x0d 0x0a 0x10 0x11
Node 0x18 [Audio Selector] wcaps 0x300103: Stereo Amp-In
  Control: name="Capture Volume", index=0, device=0
  Amp-In caps: N/A
  Amp-In vals:  [0x08 0x08]
  Connection: 1
     0x15
Node 0x19 [Audio Selector] wcaps 0x300103: Stereo Amp-In
  Control: name="Capture Volume", index=1, device=0
  Amp-In caps: N/A
  Amp-In vals:  [0x00 0x00]
  Connection: 1
     0x16
Node 0x1a [Audio Selector] wcaps 0x300103: Stereo Amp-In
  Control: name="Capture Volume", index=2, device=0
  Amp-In caps: N/A
  Amp-In vals:  [0x00 0x00]
  Connection: 1
     0x17
Node 0x1b [Audio Selector] wcaps 0x30090d: Stereo Amp-Out R/L
  Control: name="Capture Switch", index=0, device=0
  Amp-Out caps: ofs=0x00, nsteps=0x00, stepsize=0x00, mute=1
  Amp-Out vals:  [0x00 0x00]
  Connection: 3
     0x18* 0x13 0x14
Node 0x1c [Audio Selector] wcaps 0x30090d: Stereo Amp-Out R/L
  Control: name="Capture Switch", index=1, device=0
  Amp-Out caps: ofs=0x00, nsteps=0x00, stepsize=0x00, mute=1
  Amp-Out vals:  [0x80 0x80]
  Connection: 3
     0x19* 0x13 0x14
Node 0x1d [Audio Selector] wcaps 0x30090d: Stereo Amp-Out R/L
  Control: name="Capture Switch", index=2, device=0
  Amp-Out caps: ofs=0x00, nsteps=0x00, stepsize=0x00, mute=1
  Amp-Out vals:  [0x80 0x80]
  Connection: 3
     0x1a* 0x13 0x14
Node 0x1e [Audio Output] wcaps 0x40211: Stereo Digital
  Control: name="IEC958 Playback Con Mask", index=0, device=0
  Control: name="IEC958 Playback Pro Mask", index=0, device=0
  Control: name="IEC958 Playback Default", index=0, device=0
  Control: name="IEC958 Playback Switch", index=0, device=0
  Control: name="IEC958 Default PCM Playback Switch", index=0, device=0
  Device: name="STAC92xx Digital", type="SPDIF", device=1
  Converter: stream=0, channel=0
  Digital:
  Digital category: 0x0
  PCM:
    rates [0x7e0]: 44100 48000 88200 96000 176400 192000
    bits [0xe]: 16 20 24
    formats [0x5]: PCM AC3
  Delay: 4 samples
Node 0x1f [Vendor Defined Widget] wcaps 0xf30201: Stereo Digital
  Delay: 3 samples
Node 0x20 [Audio Input] wcaps 0x140311: Stereo Digital
  Device: name="STAC92xx Digital", type="SPDIF", device=1
  Converter: stream=0, channel=0
  SDI-Select: 0
  Digital:
  Digital category: 0x0
  PCM:
    rates [0x160]: 44100 48000 96000
    bits [0xe]: 16 20 24
    formats [0x5]: PCM AC3
  Delay: 4 samples
  Connection: 1
     0x22
Node 0x21 [Pin Complex] wcaps 0x400301: Stereo Digital
  Pincap 0x00000010: OUT
  Pin Default 0x01442170: [Jack] SPDIF Out at Ext Rear
    Conn = RCA, Color = Grey
    DefAssociation = 0x7, Sequence = 0x0
    Misc = NO_PRESENCE
  Pin-ctls: 0x40: OUT
  Connection: 5
     0x1e* 0x1f 0x1b 0x1c 0x1d
Node 0x22 [Pin Complex] wcaps 0x430681: Stereo Digital
  Pincap 0x00010024: IN EAPD Detect
  EAPD 0x0:
  Pin Default 0x81c42090: [Fixed] SPDIF In at Ext Rear
    Conn = RCA, Color = Grey
    DefAssociation = 0x9, Sequence = 0x0
  Pin-ctls: 0x20: IN
  Unsolicited: tag=00, enabled=0
  Power: setting=D0, actual=D0
  Delay: 3 samples
Node 0x23 [Beep Generator Widget] wcaps 0x70000c: Mono Amp-Out
  Amp-Out caps: ofs=0x03, nsteps=0x03, stepsize=0x17, mute=0
  Amp-Out vals:  [0x00]
Node 0x24 [Volume Knob Widget] wcaps 0x600000: Mono
  Volume-Knob: delta=1, steps=127, direct=1, val=127
  Connection: 5
     0x02 0x03 0x04 0x05 0x06
--endcollapse--


!!ALSA Device nodes
!!-----------------

crw-rw----+ 1 root audio 116,  0 Nov 27 12:03 /dev/snd/controlC0
crw-rw----+ 1 root audio 116, 24 Nov 27 12:03 /dev/snd/pcmC0D0c
crw-rw----+ 1 root audio 116, 16 Nov 27 12:03 /dev/snd/pcmC0D0p
crw-rw----+ 1 root audio 116, 25 Nov 27 12:03 /dev/snd/pcmC0D1c
crw-rw----+ 1 root audio 116, 17 Nov 27 12:03 /dev/snd/pcmC0D1p
crw-rw----+ 1 root audio 116,  1 Nov 27 12:03 /dev/snd/seq
crw-rw----+ 1 root audio 116, 33 Nov 27 12:03 /dev/snd/timer

/dev/snd/by-path:
total 0
drwxr-xr-x 2 root root  60 Nov 27 12:03 .
drwxr-xr-x 3 root root 200 Nov 27 12:03 ..
lrwxrwxrwx 1 root root  12 Nov 27 12:03 pci-0000:00:1b.0 -> ../controlC0


!!Aplay/Arecord output
!!------------

APLAY

**** List of PLAYBACK Hardware Devices ****
card 0: Intel [HDA Intel], device 0: STAC92xx Analog [STAC92xx Analog]
  Subdevices: 0/1
  Subdevice #0: subdevice #0
card 0: Intel [HDA Intel], device 1: STAC92xx Digital [STAC92xx Digital]
  Subdevices: 1/1
  Subdevice #0: subdevice #0

ARECORD

**** List of CAPTURE Hardware Devices ****
card 0: Intel [HDA Intel], device 0: STAC92xx Analog [STAC92xx Analog]
  Subdevices: 3/3
  Subdevice #0: subdevice #0
  Subdevice #1: subdevice #1
  Subdevice #2: subdevice #2
card 0: Intel [HDA Intel], device 1: STAC92xx Digital [STAC92xx Digital]
  Subdevices: 1/1
  Subdevice #0: subdevice #0

!!Amixer output
!!-------------

!!-------Mixer controls for card 0 [Intel]

Card hw:0 'Intel'/'HDA Intel at 0xffa74000 irq 29'
  Mixer name	: 'SigmaTel STAC9274D'
  Components	: 'HDA:83847621,00000100,00100201'
  Controls      : 37
  Simple ctrls  : 24
Simple mixer control 'Master',0
  Capabilities: pvolume pvolume-joined pswitch pswitch-joined
  Playback channels: Mono
  Limits: Playback 0 - 64
  Mono: Playback 40 [62%] [-18.00dB] [on]
Simple mixer control 'Headphone',0
  Capabilities: pvolume pswitch
  Playback channels: Front Left - Front Right
  Limits: Playback 0 - 64
  Mono:
  Front Left: Playback 64 [100%] [0.00dB] [on]
  Front Right: Playback 64 [100%] [0.00dB] [on]
Simple mixer control 'PCM',0
  Capabilities: pvolume
  Playback channels: Front Left - Front Right
  Limits: Playback 0 - 255
  Mono:
  Front Left: Playback 254 [100%] [0.20dB]
  Front Right: Playback 254 [100%] [0.20dB]
Simple mixer control 'Front',0
  Capabilities: pvolume pswitch
  Playback channels: Front Left - Front Right
  Limits: Playback 0 - 64
  Mono:
  Front Left: Playback 64 [100%] [0.00dB] [on]
  Front Right: Playback 64 [100%] [0.00dB] [on]
Simple mixer control 'Front Mic Jack Mode',0
  Capabilities: enum
  Items: 'Mic In' 'Line In'
  Item0: 'Mic In'
Simple mixer control 'Surround',0
  Capabilities: pvolume pswitch
  Playback channels: Front Left - Front Right
  Limits: Playback 0 - 64
  Mono:
  Front Left: Playback 64 [100%] [0.00dB] [on]
  Front Right: Playback 64 [100%] [0.00dB] [on]
Simple mixer control 'Center',0
  Capabilities: pvolume pvolume-joined pswitch pswitch-joined
  Playback channels: Mono
  Limits: Playback 0 - 64
  Mono: Playback 64 [100%] [0.00dB] [on]
Simple mixer control 'LFE',0
  Capabilities: pvolume pvolume-joined pswitch pswitch-joined
  Playback channels: Mono
  Limits: Playback 0 - 64
  Mono: Playback 64 [100%] [0.00dB] [on]
Simple mixer control 'Side',0
  Capabilities: pvolume pswitch
  Playback channels: Front Left - Front Right
  Limits: Playback 0 - 64
  Mono:
  Front Left: Playback 64 [100%] [0.00dB] [on]
  Front Right: Playback 64 [100%] [0.00dB] [on]
Simple mixer control 'Line Jack Mode',0
  Capabilities: enum
  Items: 'Mic In' 'Line In'
  Item0: 'Line In'
Simple mixer control 'Mic Jack Mode',0
  Capabilities: enum
  Items: 'Mic In' 'Line In'
  Item0: 'Mic In'
Simple mixer control 'IEC958',0
  Capabilities: pswitch pswitch-joined
  Playback channels: Mono
  Mono: Playback [off]
Simple mixer control 'IEC958 Default PCM',0
  Capabilities: pswitch pswitch-joined
  Playback channels: Mono
  Mono: Playback [on]
Simple mixer control 'IEC958 Playback Source',0
  Capabilities: enum
  Items: 'Digital Playback' 'ADAT' 'Analog Mux 1' 'Analog Mux 2' 'Analog Mux 3'
  Item0: 'Digital Playback'
Simple mixer control 'Capture',0
  Capabilities: cvolume cswitch
  Capture channels: Front Left - Front Right
  Limits: Capture 0 - 14
  Front Left: Capture 8 [57%] [12.00dB] [on]
  Front Right: Capture 8 [57%] [12.00dB] [on]
Simple mixer control 'Capture',1
  Capabilities: cvolume cswitch
  Capture channels: Front Left - Front Right
  Limits: Capture 0 - 14
  Front Left: Capture 0 [0%] [0.00dB] [off]
  Front Right: Capture 0 [0%] [0.00dB] [off]
Simple mixer control 'Capture',2
  Capabilities: cvolume cswitch
  Capture channels: Front Left - Front Right
  Limits: Capture 0 - 14
  Front Left: Capture 0 [0%] [0.00dB] [off]
  Front Right: Capture 0 [0%] [0.00dB] [off]
Simple mixer control 'Input Source',0
  Capabilities: cenum
  Items: 'Mic' 'Front Mic' 'Line'
  Item0: 'Mic'
Simple mixer control 'Input Source',1
  Capabilities: cenum
  Items: 'Mic' 'Front Mic' 'Line'
  Item0: 'Mic'
Simple mixer control 'Input Source',2
  Capabilities: cenum
  Items: 'Mic' 'Front Mic' 'Line'
  Item0: 'Mic'
Simple mixer control 'Mux',0
  Capabilities: cvolume
  Capture channels: Front Left - Front Right
  Limits: Capture 0 - 4
  Front Left: Capture 0 [0%] [0.00dB]
  Front Right: Capture 0 [0%] [0.00dB]
Simple mixer control 'Mux',1
  Capabilities: cvolume
  Capture channels: Front Left - Front Right
  Limits: Capture 0 - 4
  Front Left: Capture 0 [0%] [0.00dB]
  Front Right: Capture 0 [0%] [0.00dB]
Simple mixer control 'Mux',2
  Capabilities: cvolume
  Capture channels: Front Left - Front Right
  Limits: Capture 0 - 4
  Front Left: Capture 0 [0%] [0.00dB]
  Front Right: Capture 0 [0%] [0.00dB]
Simple mixer control 'Swap Center/LFE',0
  Capabilities: pswitch pswitch-joined
  Playback channels: Mono
  Mono: Playback [off]


!!Alsactl output
!!-------------

--startcollapse--
state.Intel {
	control.1 {
		comment.access 'read write'
		comment.type INTEGER
		comment.count 2
		comment.range '0 - 64'
		comment.dbmin -4800
		comment.dbmax 0
		iface MIXER
		name 'Front Playback Volume'
		value.0 64
		value.1 64
	}
	control.2 {
		comment.access 'read write'
		comment.type BOOLEAN
		comment.count 2
		iface MIXER
		name 'Front Playback Switch'
		value.0 true
		value.1 true
	}
	control.3 {
		comment.access 'read write'
		comment.type INTEGER
		comment.count 2
		comment.range '0 - 64'
		comment.dbmin -4800
		comment.dbmax 0
		iface MIXER
		name 'Surround Playback Volume'
		value.0 64
		value.1 64
	}
	control.4 {
		comment.access 'read write'
		comment.type BOOLEAN
		comment.count 2
		iface MIXER
		name 'Surround Playback Switch'
		value.0 true
		value.1 true
	}
	control.5 {
		comment.access 'read write'
		comment.type INTEGER
		comment.count 1
		comment.range '0 - 64'
		comment.dbmin -4800
		comment.dbmax 0
		iface MIXER
		name 'Center Playback Volume'
		value 64
	}
	control.6 {
		comment.access 'read write'
		comment.type BOOLEAN
		comment.count 1
		iface MIXER
		name 'Center Playback Switch'
		value true
	}
	control.7 {
		comment.access 'read write'
		comment.type INTEGER
		comment.count 1
		comment.range '0 - 64'
		comment.dbmin -4800
		comment.dbmax 0
		iface MIXER
		name 'LFE Playback Volume'
		value 64
	}
	control.8 {
		comment.access 'read write'
		comment.type BOOLEAN
		comment.count 1
		iface MIXER
		name 'LFE Playback Switch'
		value true
	}
	control.9 {
		comment.access 'read write'
		comment.type BOOLEAN
		comment.count 1
		iface MIXER
		name 'Swap Center/LFE Playback Switch'
		value false
	}
	control.10 {
		comment.access 'read write'
		comment.type INTEGER
		comment.count 2
		comment.range '0 - 64'
		comment.dbmin -4800
		comment.dbmax 0
		iface MIXER
		name 'Side Playback Volume'
		value.0 64
		value.1 64
	}
	control.11 {
		comment.access 'read write'
		comment.type BOOLEAN
		comment.count 2
		iface MIXER
		name 'Side Playback Switch'
		value.0 true
		value.1 true
	}
	control.12 {
		comment.access 'read write'
		comment.type ENUMERATED
		comment.count 1
		comment.item.0 'Mic In'
		comment.item.1 'Line In'
		iface MIXER
		name 'Mic Jack Mode'
		value 'Mic In'
	}
	control.13 {
		comment.access 'read write'
		comment.type ENUMERATED
		comment.count 1
		comment.item.0 'Mic In'
		comment.item.1 'Line In'
		iface MIXER
		name 'Front Mic Jack Mode'
		value 'Mic In'
	}
	control.14 {
		comment.access 'read write'
		comment.type ENUMERATED
		comment.count 1
		comment.item.0 'Mic In'
		comment.item.1 'Line In'
		iface MIXER
		name 'Line Jack Mode'
		value 2
	}
	control.15 {
		comment.access 'read write'
		comment.type INTEGER
		comment.count 2
		comment.range '0 - 64'
		comment.dbmin -4800
		comment.dbmax 0
		iface MIXER
		name 'Headphone Playback Volume'
		value.0 64
		value.1 64
	}
	control.16 {
		comment.access 'read write'
		comment.type BOOLEAN
		comment.count 2
		iface MIXER
		name 'Headphone Playback Switch'
		value.0 true
		value.1 true
	}
	control.17 {
		comment.access 'read write'
		comment.type INTEGER
		comment.count 2
		comment.range '0 - 14'
		comment.dbmin 0
		comment.dbmax 2100
		iface MIXER
		name 'Capture Volume'
		value.0 8
		value.1 8
	}
	control.18 {
		comment.access 'read write'
		comment.type BOOLEAN
		comment.count 2
		iface MIXER
		name 'Capture Switch'
		value.0 true
		value.1 true
	}
	control.19 {
		comment.access 'read write'
		comment.type INTEGER
		comment.count 2
		comment.range '0 - 14'
		comment.dbmin 0
		comment.dbmax 2100
		iface MIXER
		name 'Capture Volume'
		index 1
		value.0 0
		value.1 0
	}
	control.20 {
		comment.access 'read write'
		comment.type BOOLEAN
		comment.count 2
		iface MIXER
		name 'Capture Switch'
		index 1
		value.0 false
		value.1 false
	}
	control.21 {
		comment.access 'read write'
		comment.type INTEGER
		comment.count 2
		comment.range '0 - 14'
		comment.dbmin 0
		comment.dbmax 2100
		iface MIXER
		name 'Capture Volume'
		index 2
		value.0 0
		value.1 0
	}
	control.22 {
		comment.access 'read write'
		comment.type BOOLEAN
		comment.count 2
		iface MIXER
		name 'Capture Switch'
		index 2
		value.0 false
		value.1 false
	}
	control.23 {
		comment.access 'read write'
		comment.type INTEGER
		comment.count 2
		comment.range '0 - 4'
		comment.dbmin 0
		comment.dbmax 4000
		iface MIXER
		name 'Mux Capture Volume'
		value.0 0
		value.1 0
	}
	control.24 {
		comment.access 'read write'
		comment.type INTEGER
		comment.count 2
		comment.range '0 - 4'
		comment.dbmin 0
		comment.dbmax 4000
		iface MIXER
		name 'Mux Capture Volume'
		index 1
		value.0 0
		value.1 0
	}
	control.25 {
		comment.access 'read write'
		comment.type INTEGER
		comment.count 2
		comment.range '0 - 4'
		comment.dbmin 0
		comment.dbmax 4000
		iface MIXER
		name 'Mux Capture Volume'
		index 2
		value.0 0
		value.1 0
	}
	control.26 {
		comment.access 'read write'
		comment.type ENUMERATED
		comment.count 1
		comment.item.0 Mic
		comment.item.1 'Front Mic'
		comment.item.2 Line
		iface MIXER
		name 'Input Source'
		value Mic
	}
	control.27 {
		comment.access 'read write'
		comment.type ENUMERATED
		comment.count 1
		comment.item.0 Mic
		comment.item.1 'Front Mic'
		comment.item.2 Line
		iface MIXER
		name 'Input Source'
		index 1
		value Mic
	}
	control.28 {
		comment.access 'read write'
		comment.type ENUMERATED
		comment.count 1
		comment.item.0 Mic
		comment.item.1 'Front Mic'
		comment.item.2 Line
		iface MIXER
		name 'Input Source'
		index 2
		value Mic
	}
	control.29 {
		comment.access 'read write'
		comment.type ENUMERATED
		comment.count 1
		comment.item.0 'Digital Playback'
		comment.item.1 ADAT
		comment.item.2 'Analog Mux 1'
		comment.item.3 'Analog Mux 2'
		comment.item.4 'Analog Mux 3'
		iface MIXER
		name 'IEC958 Playback Source'
		value 'Digital Playback'
	}
	control.30 {
		comment.access read
		comment.type IEC958
		comment.count 1
		iface MIXER
		name 'IEC958 Playback Con Mask'
		value '0fff000000000000000000000000000000000000000000000000000000000000000000000000000000000000000000000000000000000000000000000000000000000000000000000000000000000000000000000000000000000000000000000000000000000000000000000000000000000000000000000000000000000000000000000000000000000000000000000000000000000000000000000000000000000000000000000000000000000000'
	}
	control.31 {
		comment.access read
		comment.type IEC958
		comment.count 1
		iface MIXER
		name 'IEC958 Playback Pro Mask'
		value '0f00000000000000000000000000000000000000000000000000000000000000000000000000000000000000000000000000000000000000000000000000000000000000000000000000000000000000000000000000000000000000000000000000000000000000000000000000000000000000000000000000000000000000000000000000000000000000000000000000000000000000000000000000000000000000000000000000000000000000'
	}
	control.32 {
		comment.access 'read write'
		comment.type IEC958
		comment.count 1
		iface MIXER
		name 'IEC958 Playback Default'
		value '0400000000000000000000000000000000000000000000000000000000000000000000000000000000000000000000000000000000000000000000000000000000000000000000000000000000000000000000000000000000000000000000000000000000000000000000000000000000000000000000000000000000000000000000000000000000000000000000000000000000000000000000000000000000000000000000000000000000000000'
	}
	control.33 {
		comment.access 'read write'
		comment.type BOOLEAN
		comment.count 1
		iface MIXER
		name 'IEC958 Playback Switch'
		value false
	}
	control.34 {
		comment.access 'read write'
		comment.type BOOLEAN
		comment.count 1
		iface MIXER
		name 'IEC958 Default PCM Playback Switch'
		value true
	}
	control.35 {
		comment.access 'read write'
		comment.type INTEGER
		comment.count 1
		comment.range '0 - 64'
		comment.dbmin -4800
		comment.dbmax 0
		iface MIXER
		name 'Master Playback Volume'
		value 40
	}
	control.36 {
		comment.access 'read write'
		comment.type BOOLEAN
		comment.count 1
		iface MIXER
		name 'Master Playback Switch'
		value true
	}
	control.37 {
		comment.access 'read write user'
		comment.type INTEGER
		comment.count 2
		comment.range '0 - 255'
		comment.tlv '0000000100000008ffffec1400000014'
		comment.dbmin -5100
		comment.dbmax 0
		iface MIXER
		name 'PCM Playback Volume'
		value.0 254
		value.1 254
	}
}
--endcollapse--


!!All Loaded Modules
!!------------------

Module
fuse
ath5k
ath


!!ALSA/HDA dmesg
!!------------------

[    0.773909]   alloc kstat_irqs on node -1
[    0.773982] HDA Intel 0000:00:1b.0: PCI INT A -> GSI 22 (level, low) -> IRQ 22
[    0.774129]   alloc irq_desc for 29 on node -1
[    0.774202]   alloc kstat_irqs on node -1
[    0.774281] HDA Intel 0000:00:1b.0: irq 29 for MSI/MSI-X
[    0.774378] HDA Intel 0000:00:1b.0: setting latency timer to 64
[    0.901950] ata1: SATA link up 1.5 Gbps (SStatus 113 SControl 300)
--
[    0.969812] sd 0:0:0:0: [sda] Attached SCSI disk
[    1.120168] ALSA device list:
[    1.120242]   #0: HDA Intel at 0xffa74000 irq 29
[    1.120423] TCP cubic registered


