Codec: SigmaTel STAC9205 
Address: 0 
Vendor Id: 0x838476a0 
Subsystem Id: 0x10280229 
Revision Id: 0x100204 
No Modem Function Group found 
Default PCM: 
    rates [0x7e0]: 44100 48000 88200 96000 176400 192000 
    bits [0xe]: 16 20 24 
    formats [0x1]: PCM 
Default Amp-In caps: ofs=0x00, nsteps=0x0f, stepsize=0x05, mute=0 
Default Amp-Out caps: ofs=0x7f, nsteps=0x7f, stepsize=0x02, mute=1 
Node 0x0a [Pin Complex] wcaps 0x400181: Stereo 
  Pincap 0x08173f: IN OUT HP Detect 
  Pin Default 0x0321101f: [Jack] HP Out at Ext Left 
    Conn = 1/8, Color = Black 
  Pin-ctls: 0xc0: OUT HP 
  Connection: 2 
     0x10* 0x11 
Node 0x0b [Pin Complex] wcaps 0x400181: Stereo 
  Pincap 0x081737: IN OUT Detect 
  Pin Default 0x03811020: [Jack] Line In at Ext Left 
    Conn = 1/8, Color = Black 
  Pin-ctls: 0x40: OUT 
  Connection: 2 
     0x10 0x11* 
Node 0x0c [Pin Complex] wcaps 0x400181: Stereo 
  Pincap 0x081737: IN OUT Detect 
  Pin Default 0x40f000f0: [N/A] Other at Ext N/A 
    Conn = Unknown, Color = Unknown 
  Pin-ctls: 0x00: 
  Connection: 1 
     0x11 
Node 0x0d [Pin Complex] wcaps 0x400181: Stereo 
  Pincap 0x083f: IN OUT HP Detect 
  Pin Default 0x90170110: [Fixed] Speaker at Int N/A 
    Conn = Analog, Color = Unknown 
  Pin-ctls: 0x00: 
  Connection: 1 
     0x10 
Node 0x0e [Pin Complex] wcaps 0x400181: Stereo 
  Pincap 0x081737: IN OUT Detect 
  Pin Default 0x40f000f1: [N/A] Other at Ext N/A 
    Conn = Unknown, Color = Unknown 
  Pin-ctls: 0x00: 
  Connection: 1 
     0x10 
Node 0x0f [Pin Complex] wcaps 0x400181: Stereo 
  Pincap 0x081737: IN OUT Detect 
  Pin Default 0x40f000f2: [N/A] Other at Ext N/A 
    Conn = Unknown, Color = Unknown 
  Pin-ctls: 0x00: 
  Connection: 1 
     0x11 
Node 0x10 [Audio Output] wcaps 0xd0c05: Stereo Amp-Out 
  Amp-Out caps: N/A 
  Amp-Out vals:  [0x7f 0x7f] 
  Power: 0x0 
Node 0x11 [Audio Output] wcaps 0xd0c05: Stereo Amp-Out 
  Amp-Out caps: N/A 
  Amp-Out vals:  [0xef 0xef] 
  Power: 0x0 
Node 0x12 [Audio Input] wcaps 0x1d0541: Stereo 
  Power: 0x0 
  Connection: 1 
     0x1d 
Node 0x13 [Audio Input] wcaps 0x1d0541: Stereo 
  Power: 0x0 
  Connection: 1 
     0x1e 
Node 0x14 [Pin Complex] wcaps 0x40010c: Mono Amp-Out 
  Amp-Out caps: ofs=0x1f, nsteps=0x1f, stepsize=0x05, mute=1 
  Amp-Out vals:  [0x00] 
  Pincap 0x0810: OUT 
  Pin Default 0x40f000f3: [N/A] Other at Ext N/A 
    Conn = Unknown, Color = Unknown 
  Pin-ctls: 0x00: 
  Connection: 1 
     0x15 
Node 0x15 [Audio Mixer] wcaps 0x200100: Mono 
  Connection: 1 
     0x10 
Node 0x16 [Pin Complex] wcaps 0x400001: Stereo 
  Pincap 0x0820: IN 
  Pin Default 0x40f000f4: [N/A] Other at Ext N/A 
    Conn = Unknown, Color = Unknown 
  Pin-ctls: 0x00: 
Node 0x17 [Pin Complex] wcaps 0x400001: Stereo 
  Pincap 0x0820: IN 
  Pin Default 0x90a60030: [Fixed] Mic at Int N/A 
    Conn = Digital, Color = Unknown 
  Pin-ctls: 0x20: IN 
Node 0x18 [Pin Complex] wcaps 0x400001: Stereo 
  Pincap 0x0820: IN 
  Pin Default 0x40f000f5: [N/A] Other at Ext N/A 
    Conn = Unknown, Color = Unknown 
  Pin-ctls: 0x20: IN 
Node 0x19 [Audio Selector] wcaps 0x30010d: Stereo Amp-Out 
  Amp-Out caps: ofs=0x00, nsteps=0x04, stepsize=0x27, mute=0 
  Amp-Out vals:  [0x04 0x04] 
  Connection: 7 
     0x0e 0x16 0x0f 0x0b* 0x0c 0x0d 0x0a 
Node 0x1a [Audio Selector] wcaps 0x30010d: Stereo Amp-Out 
  Amp-Out caps: ofs=0x00, nsteps=0x04, stepsize=0x27, mute=0 
  Amp-Out vals:  [0x00 0x00] 
  Connection: 7 
     0x0e 0x16 0x0f 0x0b* 0x0c 0x0d 0x0a 
Node 0x1b [Audio Selector] wcaps 0x300103: Stereo Amp-In 
  Amp-In caps: N/A 
  Amp-In vals:  [0x0c 0x0c] 
  Connection: 1 
     0x19 
Node 0x1c [Audio Selector] wcaps 0x300103: Stereo Amp-In 
  Amp-In caps: N/A 
  Amp-In vals:  [0x00 0x00] 
  Connection: 1 
     0x1a 
Node 0x1d [Audio Selector] wcaps 0x30090d: Stereo Amp-Out 
  Amp-Out caps: ofs=0x00, nsteps=0x00, stepsize=0x00, mute=1 
  Amp-Out vals:  [0x00 0x00] 
  Connection: 3 
     0x1b 0x17* 0x18 
Node 0x1e [Audio Selector] wcaps 0x30090d: Stereo Amp-Out 
  Amp-Out caps: ofs=0x00, nsteps=0x00, stepsize=0x00, mute=1 
  Amp-Out vals:  [0x80 0x80] 
  Connection: 3 
     0x1c* 0x17 0x18 
Node 0x1f [Audio Output] wcaps 0x40211: Stereo Digital 
  PCM: 
    rates [0x5e0]: 44100 48000 88200 96000 192000 
    bits [0xe]: 16 20 24 
    formats [0x5]: PCM AC3 
Node 0x20 [Audio Input] wcaps 0x140311: Stereo Digital 
  PCM: 
    rates [0x160]: 44100 48000 96000 
    bits [0xe]: 16 20 24 
    formats [0x5]: PCM AC3 
  Connection: 1 
     0x22 
Node 0x21 [Pin Complex] wcaps 0x400301: Stereo Digital 
  Pincap 0x0810: OUT 
  Pin Default 0x40f000f6: [N/A] Other at Ext N/A 
    Conn = Unknown, Color = Unknown 
  Pin-ctls: 0x00: 
  Connection: 3 
     0x1f* 0x1d 0x1e 
Node 0x22 [Pin Complex] wcaps 0x430681: Stereo Digital 
  Pincap 0x0810024: IN EAPD Detect 
  Pin Default 0x40f000f7: [N/A] Other at Ext N/A 
    Conn = Unknown, Color = Unknown 
  Pin-ctls: 0x00: 
  Power: 0x0 
Node 0x23 [Beep Generator Widget] wcaps 0x70000c: Mono Amp-Out 
  Amp-Out caps: ofs=0x03, nsteps=0x03, stepsize=0x17, mute=0 
  Amp-Out vals:  [0x00] 
Node 0x24 [Volume Knob Widget] wcaps 0x600000: Mono 
Node 0x25 [Vendor Defined Widget] wcaps 0xf00001: Stereo
