
!!################################
!!ALSA Information Script v 0.4.58
!!################################

!!Script ran on: Sun Jan 24 21:56:12 UTC 2010


!!Linux Distribution
!!------------------

Ubuntu 9.10 \n \l DISTRIB_ID=Ubuntu DISTRIB_DESCRIPTION="Ubuntu 9.10"


!!DMI Information
!!---------------

Manufacturer:      System manufacturer
Product Name:      System Product Name


!!Kernel Information
!!------------------

Kernel release:    2.6.31-18-generic
Operating System:  GNU/Linux
Architecture:      x86_64
Processor:         unknown
SMP Enabled:       Yes


!!ALSA Version
!!------------

Driver version:     1.0.22.1
Library version:    1.0.22
Utilities version:  1.0.22


!!Loaded ALSA modules
!!-------------------

snd_hda_intel


!!Sound Servers on this system
!!----------------------------

Pulseaudio:
      Installed - Yes (/usr/bin/pulseaudio)
      Running - Yes

ESound Daemon:
      Installed - Yes (/usr/bin/esd)
      Running - No


!!Soundcards recognised by ALSA
!!-----------------------------

 0 [Intel          ]: HDA-Intel - HDA Intel
                      HDA Intel at 0xf9ff8000 irq 29


!!PCI Soundcards installed in the system
!!--------------------------------------

00:1b.0 Audio device: Intel Corporation 82801JI (ICH10 Family) HD Audio Controller


!!Advanced information - PCI Vendor/Device/Susbsystem ID's
!!--------------------------------------------------------

00:1b.0 0403: 8086:3a3e
	Subsystem: 1043:8334
--
01:00.0 0300: 10de:0401 (rev a1)
	Subsystem: 1462:0882


!!Modprobe options (Sound related)
!!--------------------------------

snd-atiixp-modem: index=-2
snd-intel8x0m: index=-2
snd-via82xx-modem: index=-2
snd-usb-audio: index=-2
snd-usb-us122l: index=-2
snd-usb-usx2y: index=-2
snd-usb-caiaq: index=-2
snd-cmipci: mpu_port=0x330 fm_port=0x388
snd-pcsp: index=-2


!!Loaded sound module options
!!--------------------------

!!Module: snd_hda_intel
	bdl_pos_adj : 1,-1,-1,-1,-1,-1,-1,-1
	beep_mode : 1,1,1,1,1,1,1,1
	enable : Y,Y,Y,Y,Y,Y,Y,Y
	enable_msi : -1
	id : <NULL>,<NULL>,<NULL>,<NULL>,<NULL>,<NULL>,<NULL>,<NULL>
	index : -1,-1,-1,-1,-1,-1,-1,-1
	model : <NULL>,<NULL>,<NULL>,<NULL>,<NULL>,<NULL>,<NULL>,<NULL>
	patch : <NULL>,<NULL>,<NULL>,<NULL>,<NULL>,<NULL>,<NULL>,<NULL>
	position_fix : 0,0,0,0,0,0,0,0
	power_save : 0
	power_save_controller : Y
	probe_mask : -1,-1,-1,-1,-1,-1,-1,-1
	probe_only : N,N,N,N,N,N,N,N
	single_cmd : N


!!HDA-Intel Codec information
!!---------------------------
--startcollapse--

Codec: VIA VT1718S
Address: 0
Function Id: 0x1
Vendor Id: 0x11060428
Subsystem Id: 0x104383b3
Revision Id: 0x100100
No Modem Function Group found
Default PCM:
    rates [0x0]:
    bits [0x0]:
    formats [0x0]:
Default Amp-In caps: N/A
Default Amp-Out caps: N/A
GPIO: io=1, o=0, i=0, unsolicited=1, wake=0
  IO[0]: enable=0, dir=0, wake=0, sticky=0, data=0, unsol=0
Node 0x08 [Audio Output] wcaps 0x41d: Stereo Amp-Out
  Control: name="Front Playback Volume", index=0, device=0
    ControlAmp: chs=3, dir=Out, idx=0, ofs=0
  Device: name="VT1718S Analog", type="Audio", device=0
  Amp-Out caps: ofs=0x2a, nsteps=0x2a, stepsize=0x05, mute=0
  Amp-Out vals:  [0x00 0x00]
  Converter: stream=0, channel=0
  PCM:
    rates [0x5e0]: 44100 48000 88200 96000 192000
    bits [0xe]: 16 20 24
    formats [0x1]: PCM
  Power states:  D0 D1 D2 D3
  Power: setting=D0, actual=D0
Node 0x09 [Audio Output] wcaps 0x41d: Stereo Amp-Out
  Control: name="Surround Playback Volume", index=0, device=0
    ControlAmp: chs=3, dir=Out, idx=0, ofs=0
  Amp-Out caps: ofs=0x2a, nsteps=0x2a, stepsize=0x05, mute=0
  Amp-Out vals:  [0x00 0x00]
  Converter: stream=0, channel=0
  PCM:
    rates [0x5e0]: 44100 48000 88200 96000 192000
    bits [0xe]: 16 20 24
    formats [0x1]: PCM
  Power states:  D0 D1 D2 D3
  Power: setting=D0, actual=D0
Node 0x0a [Audio Output] wcaps 0x41d: Stereo Amp-Out
  Control: name="Center Playback Volume", index=0, device=0
    ControlAmp: chs=1, dir=Out, idx=0, ofs=0
  Control: name="LFE Playback Volume", index=0, device=0
    ControlAmp: chs=2, dir=Out, idx=0, ofs=0
  Amp-Out caps: ofs=0x2a, nsteps=0x2a, stepsize=0x05, mute=0
  Amp-Out vals:  [0x00 0x00]
  Converter: stream=0, channel=0
  PCM:
    rates [0x5e0]: 44100 48000 88200 96000 192000
    bits [0xe]: 16 20 24
    formats [0x1]: PCM
  Power states:  D0 D1 D2 D3
  Power: setting=D3, actual=D3
Node 0x0b [Audio Output] wcaps 0x41d: Stereo Amp-Out
  Control: name="Side Playback Volume", index=0, device=0
    ControlAmp: chs=3, dir=Out, idx=0, ofs=0
  Amp-Out caps: ofs=0x2a, nsteps=0x2a, stepsize=0x05, mute=0
  Amp-Out vals:  [0x00 0x00]
  Converter: stream=0, channel=0
  PCM:
    rates [0x5e0]: 44100 48000 88200 96000 192000
    bits [0xe]: 16 20 24
    formats [0x1]: PCM
  Power states:  D0 D1 D2 D3
  Power: setting=D3, actual=D3
Node 0x0c [Audio Output] wcaps 0x41d: Stereo Amp-Out
  Control: name="Headphone Playback Volume", index=0, device=0
    ControlAmp: chs=3, dir=Out, idx=0, ofs=0
  Amp-Out caps: ofs=0x2a, nsteps=0x2a, stepsize=0x05, mute=0
  Amp-Out vals:  [0x2a 0x2a]
  Converter: stream=0, channel=0
  PCM:
    rates [0x5e0]: 44100 48000 88200 96000 192000
    bits [0xe]: 16 20 24
    formats [0x1]: PCM
  Power states:  D0 D1 D2 D3
  Power: setting=D0, actual=D0
Node 0x0d [Vendor Defined Widget] wcaps 0xf00000: Mono
Node 0x0e [Audio Output] wcaps 0x611: Stereo Digital
  Control: name="IEC958 Playback Con Mask", index=0, device=0
  Control: name="IEC958 Playback Pro Mask", index=0, device=0
  Control: name="IEC958 Playback Default", index=0, device=0
  Control: name="IEC958 Playback Switch", index=0, device=0
  Control: name="IEC958 Default PCM Playback Switch", index=0, device=0
  Device: name="VT1718S Digital", type="SPDIF", device=1
  Converter: stream=0, channel=0
  Digital:
  Digital category: 0x0
  PCM:
    rates [0x5e0]: 44100 48000 88200 96000 192000
    bits [0xe]: 16 20 24
    formats [0x1]: PCM
  Power states:  D0 D1 D2 D3
  Power: setting=D0, actual=D0
Node 0x0f [Audio Output] wcaps 0x611: Stereo Digital
  Converter: stream=0, channel=0
  Digital:
  Digital category: 0x0
  PCM:
    rates [0x5e0]: 44100 48000 88200 96000 192000
    bits [0xe]: 16 20 24
    formats [0x1]: PCM
  Power states:  D0 D1 D2 D3
  Power: setting=D0, actual=D0
Node 0x10 [Audio Input] wcaps 0x10051b: Stereo Amp-In
  Control: name="Capture Volume", index=0, device=0
    ControlAmp: chs=3, dir=In, idx=0, ofs=0
  Control: name="Capture Switch", index=0, device=0
    ControlAmp: chs=3, dir=In, idx=0, ofs=0
  Device: name="VT1718S Analog", type="Audio", device=0
  Amp-In caps: ofs=0x0b, nsteps=0x1f, stepsize=0x05, mute=1
  Amp-In vals:  [0x13 0x13]
  Converter: stream=0, channel=0
  SDI-Select: 0
  PCM:
    rates [0x560]: 44100 48000 96000 192000
    bits [0xe]: 16 20 24
    formats [0x1]: PCM
  Power states:  D0 D1 D2 D3
  Power: setting=D3, actual=D3
  Connection: 1
     0x1e
Node 0x11 [Audio Input] wcaps 0x10051b: Stereo Amp-In
  Control: name="Capture Volume", index=1, device=0
    ControlAmp: chs=3, dir=In, idx=0, ofs=0
  Control: name="Capture Switch", index=1, device=0
    ControlAmp: chs=3, dir=In, idx=0, ofs=0
  Amp-In caps: ofs=0x0b, nsteps=0x1f, stepsize=0x05, mute=1
  Amp-In vals:  [0x00 0x00]
  Converter: stream=0, channel=0
  SDI-Select: 0
  PCM:
    rates [0x560]: 44100 48000 96000 192000
    bits [0xe]: 16 20 24
    formats [0x1]: PCM
  Power states:  D0 D1 D2 D3
  Power: setting=D3, actual=D3
  Connection: 1
     0x1f
Node 0x12 [Vendor Defined Widget] wcaps 0xf00000: Mono
Node 0x13 [Audio Input] wcaps 0x100711: Stereo Digital
  Converter: stream=0, channel=0
  SDI-Select: 0
  Digital:
  Digital category: 0x0
  PCM:
    rates [0x1f0]: 32000 44100 48000 88200 96000
    bits [0xe]: 16 20 24
    formats [0x1]: PCM
  Power states:  D0 D1 D2 D3
  Power: setting=D0, actual=D0
  Connection: 1
     0x2f
Node 0x14 [Vendor Defined Widget] wcaps 0xf00000: Mono
Node 0x15 [Vendor Defined Widget] wcaps 0xf00000: Mono
Node 0x16 [Vendor Defined Widget] wcaps 0xf00000: Mono
Node 0x17 [Vendor Defined Widget] wcaps 0xf00000: Mono
Node 0x18 [Audio Mixer] wcaps 0x20050b: Stereo Amp-In
  Amp-In caps: ofs=0x00, nsteps=0x00, stepsize=0x00, mute=1
  Amp-In vals:  [0x00 0x00] [0x00 0x00]
  Power states:  D0 D1 D2 D3
  Power: setting=D0, actual=D0
  Connection: 2
     0x08 0x21
Node 0x19 [Audio Mixer] wcaps 0x20050b: Stereo Amp-In
  Amp-In caps: ofs=0x00, nsteps=0x00, stepsize=0x00, mute=1
  Amp-In vals:  [0x00 0x00] [0x80 0x80]
  Power states:  D0 D1 D2 D3
  Power: setting=D0, actual=D0
  Connection: 2
     0x09 0x21
Node 0x1a [Audio Mixer] wcaps 0x20050b: Stereo Amp-In
  Amp-In caps: ofs=0x00, nsteps=0x00, stepsize=0x00, mute=1
  Amp-In vals:  [0x00 0x00] [0x80 0x80]
  Power states:  D0 D1 D2 D3
  Power: setting=D3, actual=D3
  Connection: 2
     0x0b 0x21
Node 0x1b [Audio Mixer] wcaps 0x20050b: Stereo Amp-In
  Amp-In caps: ofs=0x00, nsteps=0x00, stepsize=0x00, mute=1
  Amp-In vals:  [0x00 0x00] [0x00 0x00]
  Power states:  D0 D1 D2 D3
  Power: setting=D0, actual=D0
  Connection: 2
     0x34 0x21
Node 0x1c [Audio Mixer] wcaps 0x20050b: Stereo Amp-In
  Amp-In caps: ofs=0x00, nsteps=0x00, stepsize=0x00, mute=1
  Amp-In vals:  [0x00 0x00] [0x80 0x80]
  Power states:  D0 D1 D2 D3
  Power: setting=D0, actual=D0
  Connection: 2
     0x35 0x21
Node 0x1d [Vendor Defined Widget] wcaps 0xf00000: Mono
Node 0x1e [Audio Selector] wcaps 0x300501: Stereo
  Control: name="Input Source", index=0, device=0
  Power states:  D0 D1 D2 D3
  Power: setting=D3, actual=D3
  Connection: 6
     0x2c 0x2b* 0x2a 0x29 0x28 0x21
Node 0x1f [Audio Selector] wcaps 0x300501: Stereo
  Control: name="Input Source", index=1, device=0
  Power states:  D0 D1 D2 D3
  Power: setting=D3, actual=D3
  Connection: 6
     0x2c 0x2b* 0x2a 0x29 0x28 0x21
Node 0x20 [Vendor Defined Widget] wcaps 0xf00000: Mono
Node 0x21 [Audio Mixer] wcaps 0x20050b: Stereo Amp-In
  Control: name="Mic Playback Volume", index=0, device=0
    ControlAmp: chs=3, dir=In, idx=1, ofs=0
  Control: name="Mic Playback Switch", index=0, device=0
    ControlAmp: chs=3, dir=In, idx=1, ofs=0
  Control: name="Front Mic Playback Volume", index=0, device=0
    ControlAmp: chs=3, dir=In, idx=3, ofs=0
  Control: name="Front Mic Playback Switch", index=0, device=0
    ControlAmp: chs=3, dir=In, idx=3, ofs=0
  Control: name="Line Playback Volume", index=0, device=0
    ControlAmp: chs=3, dir=In, idx=2, ofs=0
  Control: name="Line Playback Switch", index=0, device=0
    ControlAmp: chs=3, dir=In, idx=2, ofs=0
  Control: name="CD Playback Volume", index=0, device=0
    ControlAmp: chs=3, dir=In, idx=0, ofs=0
  Control: name="CD Playback Switch", index=0, device=0
    ControlAmp: chs=3, dir=In, idx=0, ofs=0
  Amp-In caps: ofs=0x17, nsteps=0x1f, stepsize=0x05, mute=1
  Amp-In vals:  [0x80 0x80] [0x80 0x80] [0x80 0x80] [0x80 0x80] [0x94 0x94]
  Power states:  D0 D1 D2 D3
  Power: setting=D0, actual=D0
  Connection: 5
     0x2c 0x2b 0x2a 0x29 0x28
Node 0x22 [Vendor Defined Widget] wcaps 0xf00000: Mono
Node 0x23 [Vendor Defined Widget] wcaps 0xf00000: Mono
Node 0x24 [Pin Complex] wcaps 0x40058d: Stereo Amp-Out
  Control: name="Front Playback Switch", index=0, device=0
    ControlAmp: chs=3, dir=Out, idx=0, ofs=0
  Amp-Out caps: ofs=0x00, nsteps=0x00, stepsize=0x00, mute=1
  Amp-Out vals:  [0x80 0x80]
  Pincap 0x0001001c: OUT HP EAPD Detect
  EAPD 0x2: EAPD
  Pin Default 0x01014010: [Jack] Line Out at Ext Rear
    Conn = 1/8, Color = Green
    DefAssociation = 0x1, Sequence = 0x0
  Pin-ctls: 0x40: OUT
  Unsolicited: tag=04, enabled=1
  Power states:  D0 D1 D2 D3
  Power: setting=D0, actual=D0
  Connection: 1
     0x18
Node 0x25 [Pin Complex] wcaps 0x40058d: Stereo Amp-Out
  Control: name="Surround Playback Switch", index=0, device=0
    ControlAmp: chs=3, dir=Out, idx=0, ofs=0
  Amp-Out caps: ofs=0x00, nsteps=0x00, stepsize=0x00, mute=1
  Amp-Out vals:  [0x80 0x80]
  Pincap 0x0000001c: OUT HP Detect
  Pin Default 0x01011012: [Jack] Line Out at Ext Rear
    Conn = 1/8, Color = Black
    DefAssociation = 0x1, Sequence = 0x2
  Pin-ctls: 0x40: OUT
  Unsolicited: tag=04, enabled=1
  Power states:  D0 D1 D2 D3
  Power: setting=D3, actual=D3
  Connection: 1
     0x19
Node 0x26 [Pin Complex] wcaps 0x40058d: Stereo Amp-Out
  Control: name="Center Playback Switch", index=0, device=0
    ControlAmp: chs=1, dir=Out, idx=0, ofs=0
  Control: name="LFE Playback Switch", index=0, device=0
    ControlAmp: chs=2, dir=Out, idx=0, ofs=0
  Amp-Out caps: ofs=0x00, nsteps=0x00, stepsize=0x00, mute=1
  Amp-Out vals:  [0x80 0x80]
  Pincap 0x00000014: OUT Detect
  Pin Default 0x01016011: [Jack] Line Out at Ext Rear
    Conn = 1/8, Color = Orange
    DefAssociation = 0x1, Sequence = 0x1
  Pin-ctls: 0x40: OUT
  Unsolicited: tag=04, enabled=1
  Power states:  D0 D1 D2 D3
  Power: setting=D3, actual=D3
  Connection: 1
     0x0a
Node 0x27 [Pin Complex] wcaps 0x40058d: Stereo Amp-Out
  Control: name="Side Playback Switch", index=0, device=0
    ControlAmp: chs=3, dir=Out, idx=0, ofs=0
  Amp-Out caps: ofs=0x00, nsteps=0x00, stepsize=0x00, mute=1
  Amp-Out vals:  [0x80 0x80]
  Pincap 0x00000014: OUT Detect
  Pin Default 0x01012014: [Jack] Line Out at Ext Rear
    Conn = 1/8, Color = Grey
    DefAssociation = 0x1, Sequence = 0x4
  Pin-ctls: 0x40: OUT
  Unsolicited: tag=04, enabled=1
  Power states:  D0 D1 D2 D3
  Power: setting=D3, actual=D3
  Connection: 1
     0x1a
Node 0x28 [Pin Complex] wcaps 0x40058d: Stereo Amp-Out
  Control: name="Headphone Playback Switch", index=0, device=0
    ControlAmp: chs=3, dir=Out, idx=0, ofs=0
  Amp-Out caps: ofs=0x00, nsteps=0x00, stepsize=0x00, mute=1
  Amp-Out vals:  [0x00 0x00]
  Pincap 0x0000233c: IN OUT HP Detect
    Vref caps: HIZ 50 100
  Pin Default 0x022140f0: [Jack] HP Out at Ext Front
    Conn = 1/8, Color = Green
    DefAssociation = 0xf, Sequence = 0x0
  Pin-ctls: 0xc0: OUT HP VREF_HIZ
  Unsolicited: tag=05, enabled=1
  Power states:  D0 D1 D2 D3
  Power: setting=D3, actual=D3
  Connection: 1
     0x1b
Node 0x29 [Pin Complex] wcaps 0x40058d: Stereo Amp-Out
  Control: name="Front Mic Boost Capture Volume", index=0, device=0
    ControlAmp: chs=3, dir=In, idx=0, ofs=0
  Amp-Out caps: ofs=0x00, nsteps=0x00, stepsize=0x00, mute=1
  Amp-Out vals:  [0x00 0x00]
  Pincap 0x0000233c: IN OUT HP Detect
    Vref caps: HIZ 50 100
  Pin Default 0x02a19037: [Jack] Mic at Ext Front
    Conn = 1/8, Color = Pink
    DefAssociation = 0x3, Sequence = 0x7
  Pin-ctls: 0x21: IN VREF_50
  Unsolicited: tag=04, enabled=1
  Power states:  D0 D1 D2 D3
  Power: setting=D3, actual=D3
  Connection: 1
     0x1c
Node 0x2a [Pin Complex] wcaps 0x40058d: Stereo Amp-Out
  Amp-Out caps: ofs=0x00, nsteps=0x00, stepsize=0x00, mute=1
  Amp-Out vals:  [0x00 0x00]
  Pincap 0x00002334: IN OUT Detect
    Vref caps: HIZ 50 100
  Pin Default 0x0181303e: [Jack] Line In at Ext Rear
    Conn = 1/8, Color = Blue
    DefAssociation = 0x3, Sequence = 0xe
  Pin-ctls: 0x20: IN VREF_HIZ
  Unsolicited: tag=04, enabled=1
  Power states:  D0 D1 D2 D3
  Power: setting=D3, actual=D3
  Connection: 2
     0x09* 0x0c
Node 0x2b [Pin Complex] wcaps 0x40058d: Stereo Amp-Out
  Control: name="Mic Boost Capture Volume", index=0, device=0
    ControlAmp: chs=3, dir=In, idx=0, ofs=0
  Amp-Out caps: ofs=0x00, nsteps=0x00, stepsize=0x00, mute=1
  Amp-Out vals:  [0x00 0x00]
  Pincap 0x00002334: IN OUT Detect
    Vref caps: HIZ 50 100
  Pin Default 0x01a19036: [Jack] Mic at Ext Rear
    Conn = 1/8, Color = Pink
    DefAssociation = 0x3, Sequence = 0x6
  Pin-ctls: 0x21: IN VREF_50
  Unsolicited: tag=04, enabled=1
  Power states:  D0 D1 D2 D3
  Power: setting=D3, actual=D3
  Connection: 2
     0x0a* 0x0c
Node 0x2c [Pin Complex] wcaps 0x400401: Stereo
  Pincap 0x00000020: IN
  Pin Default 0x90331138: [Fixed] CD at Int N/A
    Conn = ATAPI, Color = Black
    DefAssociation = 0x3, Sequence = 0x8
    Misc = NO_PRESENCE
  Pin-ctls: 0x20: IN
  Power states:  D0 D1 D2 D3
  Power: setting=D0, actual=D0
Node 0x2d [Pin Complex] wcaps 0x400701: Stereo Digital
  Pincap 0x00000010: OUT
  Pin Default 0x985601f0: [Fixed] Digital Out at Int HDMI
    Conn = Digital, Color = Unknown
    DefAssociation = 0xf, Sequence = 0x0
    Misc = NO_PRESENCE
  Pin-ctls: 0x40: OUT
  Power states:  D0 D1 D2 D3
  Power: setting=D0, actual=D0
  Connection: 1
     0x0e
Node 0x2e [Pin Complex] wcaps 0x400701: Stereo Digital
  Pincap 0x00000010: OUT
  Pin Default 0x074411f0: [Jack] SPDIF Out at Ext Rear Panel
    Conn = RCA, Color = Black
    DefAssociation = 0xf, Sequence = 0x0
    Misc = NO_PRESENCE
  Pin-ctls: 0x40: OUT
  Power states:  D0 D1 D2 D3
  Power: setting=D0, actual=D0
  Connection: 1
     0x0f
Node 0x2f [Pin Complex] wcaps 0x400601: Stereo Digital
  Pincap 0x00000030: IN OUT
  Pin Default 0x47c421f0: [N/A] SPDIF In at Ext Rear Panel
    Conn = RCA, Color = Grey
    DefAssociation = 0xf, Sequence = 0x0
    Misc = NO_PRESENCE
  Pin-ctls: 0x20: IN
  Power states:  D0 D1 D2 D3
  Power: setting=D0, actual=D0
Node 0x30 [Vendor Defined Widget] wcaps 0xf00000: Mono
Node 0x31 [Vendor Defined Widget] wcaps 0xf00000: Mono
Node 0x32 [Vendor Defined Widget] wcaps 0xf00000: Mono
Node 0x33 [Vendor Defined Widget] wcaps 0xf00000: Mono
Node 0x34 [Audio Selector] wcaps 0x300501: Stereo
  Power states:  D0 D1 D2 D3
  Power: setting=D0, actual=D0
  Connection: 3
     0x08 0x0b 0x0c*
Node 0x35 [Audio Selector] wcaps 0x300501: Stereo
  Power states:  D0 D1 D2 D3
  Power: setting=D0, actual=D0
  Connection: 3
     0x08 0x0b* 0x0c
--endcollapse--


!!ALSA Device nodes
!!-----------------

crw-rw----  1 root audio 116,  0 Jan 24 22:41 /dev/snd/controlC0
crw-rw----  1 root audio 116,  4 Jan 24 22:41 /dev/snd/hwC0D0
crw-rw----  1 root audio 116, 24 Jan 24 22:54 /dev/snd/pcmC0D0c
crw-rw----  1 root audio 116, 16 Jan 24 22:54 /dev/snd/pcmC0D0p
crw-rw----  1 root audio 116, 17 Jan 24 22:54 /dev/snd/pcmC0D1p
crw-rw----  1 root audio 116,  1 Jan 24 22:41 /dev/snd/seq
crw-rw----  1 root audio 116, 33 Jan 24 22:37 /dev/snd/timer

/dev/snd/by-path:
total 0
drwxr-xr-x 2 root root  60 Jan 24 22:41 .
drwxr-xr-x 3 root root 200 Jan 24 22:41 ..
lrwxrwxrwx 1 root root  12 Jan 24 22:41 pci-0000:00:1b.0 -> ../controlC0


!!Aplay/Arecord output
!!------------

APLAY

**** List of PLAYBACK Hardware Devices ****
card 0: Intel [HDA Intel], device 0: VT1718S Analog [VT1718S Analog]
  Subdevices: 2/2
  Subdevice #0: subdevice #0
  Subdevice #1: subdevice #1
card 0: Intel [HDA Intel], device 1: VT1718S Digital [VT1718S Digital]
  Subdevices: 2/2
  Subdevice #0: subdevice #0
  Subdevice #1: subdevice #1

ARECORD

**** List of CAPTURE Hardware Devices ****
card 0: Intel [HDA Intel], device 0: VT1718S Analog [VT1718S Analog]
  Subdevices: 2/2
  Subdevice #0: subdevice #0
  Subdevice #1: subdevice #1

!!Amixer output
!!-------------

!!-------Mixer controls for card 0 [Intel]

Card hw:0 'Intel'/'HDA Intel at 0xf9ff8000 irq 29'
  Mixer name	: 'VIA VT1718S'
  Components	: 'HDA:11060428,104383b3,00100100'
  Controls      : 36
  Simple ctrls  : 21
Simple mixer control 'PCM',0
  Capabilities: pvolume penum
  Playback channels: Front Left - Front Right
  Limits: Playback 0 - 255
  Mono:
  Front Left: Playback 255 [100%] [0.00dB]
  Front Right: Playback 255 [100%] [0.00dB]
Simple mixer control 'Front',0
  Capabilities: pvolume pswitch penum
  Playback channels: Front Left - Front Right
  Limits: Playback 0 - 42
  Mono:
  Front Left: Playback 0 [0%] [-63.00dB] [off]
  Front Right: Playback 0 [0%] [-63.00dB] [off]
Simple mixer control 'Front Mic',0
  Capabilities: pvolume pswitch penum
  Playback channels: Front Left - Front Right
  Limits: Playback 0 - 31
  Mono:
  Front Left: Playback 0 [0%] [-34.50dB] [off]
  Front Right: Playback 0 [0%] [-34.50dB] [off]
Simple mixer control 'Front Mic Boost',0
  Capabilities: cvolume penum
  Capture channels: Front Left - Front Right
  Limits: Capture 0 - 3
  Front Left: Capture 0 [0%] [0.00dB]
  Front Right: Capture 0 [0%] [0.00dB]
Simple mixer control 'Surround',0
  Capabilities: pvolume pswitch penum
  Playback channels: Front Left - Front Right
  Limits: Playback 0 - 42
  Mono:
  Front Left: Playback 0 [0%] [-63.00dB] [off]
  Front Right: Playback 0 [0%] [-63.00dB] [off]
Simple mixer control 'Center',0
  Capabilities: pvolume pvolume-joined pswitch pswitch-joined penum
  Playback channels: Mono
  Limits: Playback 0 - 42
  Mono: Playback 0 [0%] [-63.00dB] [off]
Simple mixer control 'LFE',0
  Capabilities: pvolume pvolume-joined pswitch pswitch-joined penum
  Playback channels: Mono
  Limits: Playback 0 - 42
  Mono: Playback 0 [0%] [-63.00dB] [off]
Simple mixer control 'Side',0
  Capabilities: pvolume pswitch penum
  Playback channels: Front Left - Front Right
  Limits: Playback 0 - 42
  Mono:
  Front Left: Playback 0 [0%] [-63.00dB] [off]
  Front Right: Playback 0 [0%] [-63.00dB] [off]
Simple mixer control 'Line',0
  Capabilities: pvolume pswitch penum
  Playback channels: Front Left - Front Right
  Limits: Playback 0 - 31
  Mono:
  Front Left: Playback 0 [0%] [-34.50dB] [off]
  Front Right: Playback 0 [0%] [-34.50dB] [off]
Simple mixer control 'CD',0
  Capabilities: pvolume pswitch penum
  Playback channels: Front Left - Front Right
  Limits: Playback 0 - 31
  Mono:
  Front Left: Playback 0 [0%] [-34.50dB] [off]
  Front Right: Playback 0 [0%] [-34.50dB] [off]
Simple mixer control 'Mic',0
  Capabilities: pvolume pswitch penum
  Playback channels: Front Left - Front Right
  Limits: Playback 0 - 31
  Mono:
  Front Left: Playback 0 [0%] [-34.50dB] [off]
  Front Right: Playback 0 [0%] [-34.50dB] [off]
Simple mixer control 'Mic Boost',0
  Capabilities: cvolume penum
  Capture channels: Front Left - Front Right
  Limits: Capture 0 - 3
  Front Left: Capture 0 [0%] [0.00dB]
  Front Right: Capture 0 [0%] [0.00dB]
Simple mixer control 'IEC958',0
  Capabilities: pswitch pswitch-joined penum
  Playback channels: Mono
  Mono: Playback [off]
Simple mixer control 'IEC958 Default PCM',0
  Capabilities: pswitch pswitch-joined penum
  Playback channels: Mono
  Mono: Playback [off]
Simple mixer control 'Capture',0
  Capabilities: cvolume cswitch penum
  Capture channels: Front Left - Front Right
  Limits: Capture 0 - 31
  Front Left: Capture 19 [61%] [12.00dB] [on]
  Front Right: Capture 19 [61%] [12.00dB] [on]
Simple mixer control 'Capture',1
  Capabilities: cvolume cswitch penum
  Capture channels: Front Left - Front Right
  Limits: Capture 0 - 31
  Front Left: Capture 0 [0%] [-16.50dB] [on]
  Front Right: Capture 0 [0%] [-16.50dB] [on]
Simple mixer control 'Independent HP',0
  Capabilities: enum
  Items: 'OFF' 'ON'
  Item0: 'OFF'
Simple mixer control 'Input Source',0
  Capabilities: cenum
  Items: 'Stereo Mixer' 'Mic' 'Front Mic' 'Line' 'CD'
  Item0: 'Mic'
Simple mixer control 'Input Source',1
  Capabilities: cenum
  Items: 'Stereo Mixer' 'Mic' 'Front Mic' 'Line' 'CD'
  Item0: 'Stereo Mixer'
Simple mixer control 'Smart 5.1',0
  Capabilities: pswitch pswitch-joined penum
  Playback channels: Mono
  Mono: Playback [off]


!!Alsactl output
!!-------------

--startcollapse--
state.Intel {
	control.1 {
		comment.access 'read write'
		comment.type INTEGER
		comment.count 2
		comment.range '0 - 42'
		comment.dbmin -6300
		comment.dbmax 0
		iface MIXER
		name 'Front Playback Volume'
		value.0 0
		value.1 0
	}
	control.2 {
		comment.access 'read write'
		comment.type BOOLEAN
		comment.count 2
		iface MIXER
		name 'Front Playback Switch'
		value.0 false
		value.1 false
	}
	control.3 {
		comment.access 'read write'
		comment.type INTEGER
		comment.count 2
		comment.range '0 - 42'
		comment.dbmin -6300
		comment.dbmax 0
		iface MIXER
		name 'Surround Playback Volume'
		value.0 0
		value.1 0
	}
	control.4 {
		comment.access 'read write'
		comment.type BOOLEAN
		comment.count 2
		iface MIXER
		name 'Surround Playback Switch'
		value.0 false
		value.1 false
	}
	control.5 {
		comment.access 'read write'
		comment.type INTEGER
		comment.count 1
		comment.range '0 - 42'
		comment.dbmin -6300
		comment.dbmax 0
		iface MIXER
		name 'Center Playback Volume'
		value 0
	}
	control.6 {
		comment.access 'read write'
		comment.type INTEGER
		comment.count 1
		comment.range '0 - 42'
		comment.dbmin -6300
		comment.dbmax 0
		iface MIXER
		name 'LFE Playback Volume'
		value 0
	}
	control.7 {
		comment.access 'read write'
		comment.type BOOLEAN
		comment.count 1
		iface MIXER
		name 'Center Playback Switch'
		value false
	}
	control.8 {
		comment.access 'read write'
		comment.type BOOLEAN
		comment.count 1
		iface MIXER
		name 'LFE Playback Switch'
		value false
	}
	control.9 {
		comment.access 'read write'
		comment.type INTEGER
		comment.count 2
		comment.range '0 - 42'
		comment.dbmin -6300
		comment.dbmax 0
		iface MIXER
		name 'Side Playback Volume'
		value.0 0
		value.1 0
	}
	control.10 {
		comment.access 'read write'
		comment.type BOOLEAN
		comment.count 2
		iface MIXER
		name 'Side Playback Switch'
		value.0 false
		value.1 false
	}
	control.13 {
		comment.access 'read write'
		comment.type INTEGER
		comment.count 2
		comment.range '0 - 31'
		comment.dbmin -3450
		comment.dbmax 1200
		iface MIXER
		name 'Mic Playback Volume'
		value.0 0
		value.1 0
	}
	control.14 {
		comment.access 'read write'
		comment.type BOOLEAN
		comment.count 2
		iface MIXER
		name 'Mic Playback Switch'
		value.0 false
		value.1 false
	}
	control.15 {
		comment.access 'read write'
		comment.type INTEGER
		comment.count 2
		comment.range '0 - 31'
		comment.dbmin -3450
		comment.dbmax 1200
		iface MIXER
		name 'Front Mic Playback Volume'
		value.0 0
		value.1 0
	}
	control.16 {
		comment.access 'read write'
		comment.type BOOLEAN
		comment.count 2
		iface MIXER
		name 'Front Mic Playback Switch'
		value.0 false
		value.1 false
	}
	control.17 {
		comment.access 'read write'
		comment.type INTEGER
		comment.count 2
		comment.range '0 - 31'
		comment.dbmin -3450
		comment.dbmax 1200
		iface MIXER
		name 'Line Playback Volume'
		value.0 0
		value.1 0
	}
	control.18 {
		comment.access 'read write'
		comment.type BOOLEAN
		comment.count 2
		iface MIXER
		name 'Line Playback Switch'
		value.0 false
		value.1 false
	}
	control.19 {
		comment.access 'read write'
		comment.type INTEGER
		comment.count 2
		comment.range '0 - 31'
		comment.dbmin -3450
		comment.dbmax 1200
		iface MIXER
		name 'CD Playback Volume'
		value.0 0
		value.1 0
	}
	control.20 {
		comment.access 'read write'
		comment.type BOOLEAN
		comment.count 2
		iface MIXER
		name 'CD Playback Switch'
		value.0 false
		value.1 false
	}
	control.21 {
		comment.access 'read write'
		comment.type ENUMERATED
		comment.count 1
		comment.item.0 OFF
		comment.item.1 ON
		iface MIXER
		name 'Independent HP'
		value OFF
	}
	control.22 {
		comment.access 'read write'
		comment.type BOOLEAN
		comment.count 1
		iface MIXER
		name 'Smart 5.1'
		value false
	}
	control.23 {
		comment.access 'read write'
		comment.type INTEGER
		comment.count 2
		comment.range '0 - 31'
		comment.dbmin -1650
		comment.dbmax 3000
		iface MIXER
		name 'Capture Volume'
		value.0 19
		value.1 19
	}
	control.24 {
		comment.access 'read write'
		comment.type BOOLEAN
		comment.count 2
		iface MIXER
		name 'Capture Switch'
		value.0 true
		value.1 true
	}
	control.25 {
		comment.access 'read write'
		comment.type INTEGER
		comment.count 2
		comment.range '0 - 31'
		comment.dbmin -1650
		comment.dbmax 3000
		iface MIXER
		name 'Capture Volume'
		index 1
		value.0 0
		value.1 0
	}
	control.26 {
		comment.access 'read write'
		comment.type BOOLEAN
		comment.count 2
		iface MIXER
		name 'Capture Switch'
		index 1
		value.0 true
		value.1 true
	}
	control.27 {
		comment.access 'read write'
		comment.type INTEGER
		comment.count 2
		comment.range '0 - 3'
		comment.dbmin 0
		comment.dbmax 3075
		iface MIXER
		name 'Mic Boost Capture Volume'
		value.0 0
		value.1 0
	}
	control.28 {
		comment.access 'read write'
		comment.type INTEGER
		comment.count 2
		comment.range '0 - 3'
		comment.dbmin 0
		comment.dbmax 3075
		iface MIXER
		name 'Front Mic Boost Capture Volume'
		value.0 0
		value.1 0
	}
	control.29 {
		comment.access 'read write'
		comment.type ENUMERATED
		comment.count 1
		comment.item.0 'Stereo Mixer'
		comment.item.1 Mic
		comment.item.2 'Front Mic'
		comment.item.3 Line
		comment.item.4 CD
		iface MIXER
		name 'Input Source'
		value Mic
	}
	control.30 {
		comment.access 'read write'
		comment.type ENUMERATED
		comment.count 1
		comment.item.0 'Stereo Mixer'
		comment.item.1 Mic
		comment.item.2 'Front Mic'
		comment.item.3 Line
		comment.item.4 CD
		iface MIXER
		name 'Input Source'
		index 1
		value 'Stereo Mixer'
	}
	control.31 {
		comment.access read
		comment.type IEC958
		comment.count 1
		iface MIXER
		name 'IEC958 Playback Con Mask'
		value '0fff000000000000000000000000000000000000000000000000000000000000000000000000000000000000000000000000000000000000000000000000000000000000000000000000000000000000000000000000000000000000000000000000000000000000000000000000000000000000000000000000000000000000000000000000000000000000000000000000000000000000000000000000000000000000000000000000000000000000'
	}
	control.32 {
		comment.access read
		comment.type IEC958
		comment.count 1
		iface MIXER
		name 'IEC958 Playback Pro Mask'
		value '0f00000000000000000000000000000000000000000000000000000000000000000000000000000000000000000000000000000000000000000000000000000000000000000000000000000000000000000000000000000000000000000000000000000000000000000000000000000000000000000000000000000000000000000000000000000000000000000000000000000000000000000000000000000000000000000000000000000000000000'
	}
	control.33 {
		comment.access 'read write'
		comment.type IEC958
		comment.count 1
		iface MIXER
		name 'IEC958 Playback Default'
		value '0400000000000000000000000000000000000000000000000000000000000000000000000000000000000000000000000000000000000000000000000000000000000000000000000000000000000000000000000000000000000000000000000000000000000000000000000000000000000000000000000000000000000000000000000000000000000000000000000000000000000000000000000000000000000000000000000000000000000000'
	}
	control.34 {
		comment.access 'read write'
		comment.type BOOLEAN
		comment.count 1
		iface MIXER
		name 'IEC958 Playback Switch'
		value false
	}
	control.35 {
		comment.access 'read write'
		comment.type BOOLEAN
		comment.count 1
		iface MIXER
		name 'IEC958 Default PCM Playback Switch'
		value false
	}
	control.36 {
		comment.access 'read write user'
		comment.type INTEGER
		comment.count 2
		comment.range '0 - 255'
		comment.tlv '0000000100000008ffffec1400000014'
		comment.dbmin -5100
		comment.dbmax 0
		iface MIXER
		name 'PCM Playback Volume'
		value.0 255
		value.1 255
	}
}
--endcollapse--


!!All Loaded Modules
!!------------------

Module
snd_seq_dummy
snd_seq_oss
snd_seq_midi
snd_rawmidi
snd_seq_midi_event
snd_seq
snd_seq_device
snd_pcm_oss
snd_mixer_oss
snd_hda_intel
snd_hda_codec_via
snd_hda_codec
snd_hwdep
snd_pcm
snd_page_alloc
snd_timer
snd
soundcore
nfs
lockd
nfs_acl
auth_rpcgss
sunrpc
binfmt_misc
ppdev
iptable_filter
ip_tables
x_tables
joydev
asus_atk0110
nvidia
lp
parport
hid_logitech
ff_memless
usbhid
ohci1394
ieee1394
r8169
mii
intel_agp


!!Sysfs Files
!!-----------

/sys/class/sound/hwC0D0/init_pin_configs:
0x24 0x01014010
0x25 0x01011012
0x26 0x01016011
0x27 0x01012014
0x28 0x022140f0
0x29 0x02a19037
0x2a 0x0181303e
0x2b 0x01a19036
0x2c 0x90331138
0x2d 0x985601f0
0x2e 0x074411f0
0x2f 0x47c421f0

/sys/class/sound/hwC0D0/driver_pin_configs:

/sys/class/sound/hwC0D0/user_pin_configs:

/sys/class/sound/hwC0D0/init_verbs:


!!ALSA/HDA dmesg
!!------------------

[   19.336953]   alloc kstat_irqs on node 0
[   19.336959] HDA Intel 0000:00:1b.0: PCI INT A -> GSI 22 (level, low) -> IRQ 22
[   19.336989]   alloc irq_desc for 29 on node 0
[   19.336990]   alloc kstat_irqs on node 0
[   19.336996] HDA Intel 0000:00:1b.0: irq 29 for MSI/MSI-X
[   19.337014] HDA Intel 0000:00:1b.0: setting latency timer to 64
[   19.658773] EXT4-fs (sda8): barriers enabled
--
[   30.563754] eth0: no IPv6 routers present
[  491.833474] HDA Intel 0000:00:1b.0: PCI INT A disabled
[  491.867853] HDA Intel 0000:00:1b.0: PCI INT A -> GSI 22 (level, low) -> IRQ 22
[  491.867892] HDA Intel 0000:00:1b.0: irq 29 for MSI/MSI-X
[  491.867910] HDA Intel 0000:00:1b.0: setting latency timer to 64
[  677.674124] HDA Intel 0000:00:1b.0: PCI INT A disabled
[  678.052040] HDA Intel 0000:00:1b.0: PCI INT A -> GSI 22 (level, low) -> IRQ 22
[  678.052087] HDA Intel 0000:00:1b.0: irq 29 for MSI/MSI-X
[  678.052104] HDA Intel 0000:00:1b.0: setting latency timer to 64
[  885.314188] HDA Intel 0000:00:1b.0: PCI INT A disabled
[  885.685582] HDA Intel 0000:00:1b.0: PCI INT A -> GSI 22 (level, low) -> IRQ 22
[  885.685624] HDA Intel 0000:00:1b.0: irq 29 for MSI/MSI-X
[  885.685642] HDA Intel 0000:00:1b.0: setting latency timer to 64


