!!################################
!!ALSA Information Script v 0.4.58
!!################################

!!Script ran on: Mon Jun 14 15:55:00 UTC 2010


!!Linux Distribution
!!------------------

Welcome to openSUSE 11.3 "Teal" Milestone 7 - Kernel \r (\l). openSUSE 11.3 Milestone 7 (x86_64)


!!DMI Information
!!---------------

Manufacturer:      ASUSTeK Computer INC.
Product Name:      P7H55-M SI


!!Kernel Information
!!------------------

Kernel release:    2.6.34-8-desktop
Operating System:  GNU/Linux
Architecture:      x86_64
Processor:         x86_64
SMP Enabled:       Yes


!!ALSA Version
!!------------

Driver version:     1.0.22.1
Library version:    
Utilities version:  1.0.23


!!Loaded ALSA modules
!!-------------------

snd_hda_intel


!!Sound Servers on this system
!!----------------------------

Pulseaudio:
      Installed - Yes (/usr/bin/pulseaudio)
      Running - Yes

ESound Daemon:
      Installed - Yes (/usr/bin/esd)
      Running - No


!!Soundcards recognised by ALSA
!!-----------------------------

 0 [Intel          ]: HDA-Intel - HDA Intel
                      HDA Intel at 0xf3ff8000 irq 34


!!PCI Soundcards installed in the system
!!--------------------------------------

00:1b.0 Audio device: Intel Corporation 5 Series/3400 Series Chipset High Definition Audio (rev 06)


!!Advanced information - PCI Vendor/Device/Susbsystem ID's
!!--------------------------------------------------------

00:1b.0 0403: 8086:3b56 (rev 06)
    Subsystem: 1043:8415


!!Loaded sound module options
!!--------------------------

!!Module: snd_hda_intel
    bdl_pos_adj : 1,-1,-1,-1,-1,-1,-1,-1,-1,-1,-1,-1,-1,-1,-1,-1,-1,-1,-1,-1,-1,-1,-1,-1,-1,-1,-1,-1,-1,-1,-1,-1
    beep_mode : 2,2,2,2,2,2,2,2,2,2,2,2,2,2,2,2,2,2,2,2,2,2,2,2,2,2,2,2,2,2,2,2
    enable : Y,Y,Y,Y,Y,Y,Y,Y,Y,Y,Y,Y,Y,Y,Y,Y,Y,Y,Y,Y,Y,Y,Y,Y,Y,Y,Y,Y,Y,Y,Y,Y
    enable_msi : -1
    id : (null),(null),(null),(null),(null),(null),(null),(null),(null),(null),(null),(null),(null),(null),(null),(null),(null),(null),(null),(null),(null),(null),(null),(null),(null),(null),(null),(null),(null),(null),(null),(null)
    index : -1,-1,-1,-1,-1,-1,-1,-1,-1,-1,-1,-1,-1,-1,-1,-1,-1,-1,-1,-1,-1,-1,-1,-1,-1,-1,-1,-1,-1,-1,-1,-1
    model : (null),(null),(null),(null),(null),(null),(null),(null),(null),(null),(null),(null),(null),(null),(null),(null),(null),(null),(null),(null),(null),(null),(null),(null),(null),(null),(null),(null),(null),(null),(null),(null)
    patch : (null),(null),(null),(null),(null),(null),(null),(null),(null),(null),(null),(null),(null),(null),(null),(null),(null),(null),(null),(null),(null),(null),(null),(null),(null),(null),(null),(null),(null),(null),(null),(null)
    position_fix : 0,0,0,0,0,0,0,0,0,0,0,0,0,0,0,0,0,0,0,0,0,0,0,0,0,0,0,0,0,0,0,0
    power_save : 0
    power_save_controller : Y
    probe_mask : -1,-1,-1,-1,-1,-1,-1,-1,-1,-1,-1,-1,-1,-1,-1,-1,-1,-1,-1,-1,-1,-1,-1,-1,-1,-1,-1,-1,-1,-1,-1,-1
    probe_only : N,N,N,N,N,N,N,N,N,N,N,N,N,N,N,N,N,N,N,N,N,N,N,N,N,N,N,N,N,N,N,N
    single_cmd : N


!!HDA-Intel Codec information
!!---------------------------
--startcollapse--

Codec: VIA VT1708S
Address: 0
Function Id: 0x1
Vendor Id: 0x11060397
Subsystem Id: 0x10438415
Revision Id: 0x100000
No Modem Function Group found
Default PCM:
    rates [0x0]:
    bits [0x0]:
    formats [0x0]:
Default Amp-In caps: N/A
Default Amp-Out caps: N/A
GPIO: io=1, o=0, i=0, unsolicited=1, wake=0
  IO[0]: enable=0, dir=0, wake=0, sticky=0, data=0, unsol=0
Node 0x10 [Audio Output] wcaps 0x41d: Stereo Amp-Out
  Control: name="Front Playback Volume", index=0, device=0
    ControlAmp: chs=3, dir=Out, idx=0, ofs=0
  Device: name="VT1708S Analog", type="Audio", device=0
  Amp-Out caps: ofs=0x2a, nsteps=0x2a, stepsize=0x05, mute=0
  Amp-Out vals:  [0x2a 0x2a]
  Converter: stream=0, channel=0
  PCM:
    rates [0x5e0]: 44100 48000 88200 96000 192000
    bits [0xe]: 16 20 24
    formats [0x1]: PCM
  Power states:  D0 D1 D2 D3
  Power: setting=D3, actual=D3
Node 0x11 [Audio Output] wcaps 0x41d: Stereo Amp-Out
  Amp-Out caps: ofs=0x2a, nsteps=0x2a, stepsize=0x05, mute=0
  Amp-Out vals:  [0x2a 0x2a]
  Converter: stream=0, channel=0
  PCM:
    rates [0x5e0]: 44100 48000 88200 96000 192000
    bits [0xe]: 16 20 24
    formats [0x1]: PCM
  Power states:  D0 D1 D2 D3
  Power: setting=D3, actual=D3
Node 0x12 [Audio Output] wcaps 0x611: Stereo Digital
  Control: name="IEC958 Playback Con Mask", index=0, device=0
  Control: name="IEC958 Playback Pro Mask", index=0, device=0
  Control: name="IEC958 Playback Default", index=0, device=0
  Control: name="IEC958 Playback Switch", index=0, device=0
  Control: name="IEC958 Default PCM Playback Switch", index=0, device=0
  Device: name="VT1708S Digital", type="SPDIF", device=1
  Converter: stream=0, channel=0
  Digital:
  Digital category: 0x0
  PCM:
    rates [0x5e0]: 44100 48000 88200 96000 192000
    bits [0xe]: 16 20 24
    formats [0x1]: PCM
  Power states:  D0 D1 D2 D3
  Power: setting=D0, actual=D0
Node 0x13 [Audio Input] wcaps 0x10051b: Stereo Amp-In
  Control: name="Capture Volume", index=0, device=0
    ControlAmp: chs=3, dir=In, idx=0, ofs=0
  Control: name="Capture Switch", index=0, device=0
    ControlAmp: chs=3, dir=In, idx=0, ofs=0
  Device: name="VT1708S Analog", type="Audio", device=0
  Amp-In caps: ofs=0x0b, nsteps=0x1f, stepsize=0x05, mute=1
  Amp-In vals:  [0x1f 0x1f]
  Converter: stream=0, channel=0
  SDI-Select: 0
  PCM:
    rates [0x560]: 44100 48000 96000 192000
    bits [0xe]: 16 20 24
    formats [0x1]: PCM
  Power states:  D0 D1 D2 D3
  Power: setting=D3, actual=D3
  Connection: 1
     0x17
Node 0x14 [Audio Input] wcaps 0x10051b: Stereo Amp-In
  Control: name="Capture Volume", index=1, device=0
    ControlAmp: chs=3, dir=In, idx=0, ofs=0
  Control: name="Capture Switch", index=1, device=0
    ControlAmp: chs=3, dir=In, idx=0, ofs=0
  Amp-In caps: ofs=0x0b, nsteps=0x1f, stepsize=0x05, mute=1
  Amp-In vals:  [0x00 0x00]
  Converter: stream=0, channel=0
  SDI-Select: 0
  PCM:
    rates [0x560]: 44100 48000 96000 192000
    bits [0xe]: 16 20 24
    formats [0x1]: PCM
  Power states:  D0 D1 D2 D3
  Power: setting=D3, actual=D3
  Connection: 1
     0x1e
Node 0x15 [Audio Output] wcaps 0x611: Stereo Digital
  Converter: stream=0, channel=0
  Digital:
  Digital category: 0x0
  PCM:
    rates [0x5e0]: 44100 48000 88200 96000 192000
    bits [0xe]: 16 20 24
    formats [0x1]: PCM
  Power states:  D0 D1 D2 D3
  Power: setting=D0, actual=D0
Node 0x16 [Audio Mixer] wcaps 0x20050b: Stereo Amp-In
  Control: name="Master Front Playback Volume", index=0, device=0
    ControlAmp: chs=3, dir=In, idx=0, ofs=0
  Control: name="Master Front Playback Switch", index=0, device=0
    ControlAmp: chs=3, dir=In, idx=0, ofs=0
  Control: name="Mic Playback Volume", index=0, device=0
    ControlAmp: chs=3, dir=In, idx=2, ofs=0
  Control: name="Mic Playback Switch", index=0, device=0
    ControlAmp: chs=3, dir=In, idx=2, ofs=0
  Control: name="Front Mic Playback Volume", index=0, device=0
    ControlAmp: chs=3, dir=In, idx=4, ofs=0
  Control: name="Front Mic Playback Switch", index=0, device=0
    ControlAmp: chs=3, dir=In, idx=4, ofs=0
  Control: name="Line Playback Volume", index=0, device=0
    ControlAmp: chs=3, dir=In, idx=3, ofs=0
  Control: name="Line Playback Switch", index=0, device=0
    ControlAmp: chs=3, dir=In, idx=3, ofs=0
  Amp-In caps: ofs=0x17, nsteps=0x1f, stepsize=0x05, mute=1
  Amp-In vals:  [0x1f 0x1f] [0x00 0x00] [0x1f 0x1f] [0x1f 0x1f] [0x1f 0x1f] [0x97 0x97] [0x80 0x80]
  Power states:  D0 D1 D2 D3
  Power: setting=D3, actual=D3
  Connection: 7
     0x10 0x1f 0x1a 0x1b 0x1e 0x1d 0x25
Node 0x17 [Audio Selector] wcaps 0x300501: Stereo
  Control: name="Input Source", index=0, device=0
  Power states:  D0 D1 D2 D3
  Power: setting=D3, actual=D3
  Connection: 6
     0x1f 0x1a* 0x1b 0x1e 0x1d 0x16
Node 0x18 [Audio Selector] wcaps 0x30050d: Stereo Amp-Out
  Amp-Out caps: ofs=0x00, nsteps=0x00, stepsize=0x00, mute=1
  Amp-Out vals:  [0x80 0x80]
  Power states:  D0 D1 D2 D3
  Power: setting=D3, actual=D3
  Connection: 1
     0x11
Node 0x19 [Pin Complex] wcaps 0x400581: Stereo
  Pincap 0x00000014: OUT Detect
  Pin Default 0x410110f0: [N/A] Line Out at Ext Rear
    Conn = 1/8, Color = Black
    DefAssociation = 0xf, Sequence = 0x0
  Pin-ctls: 0x00:
  Unsolicited: tag=04, enabled=1
  Power states:  D0 D1 D2 D3
  Power: setting=D3, actual=D3
  Connection: 1
     0x18
Node 0x1a [Pin Complex] wcaps 0x400581: Stereo
  Control: name="Mic Boost Capture Volume", index=0, device=0
    ControlAmp: chs=3, dir=In, idx=0, ofs=0
  Control: name="Smart 5.1", index=0, device=0
  Pincap 0x00002334: IN OUT Detect
    Vref caps: HIZ 50 100
  Pin Default 0x01a19036: [Jack] Mic at Ext Rear
    Conn = 1/8, Color = Pink
    DefAssociation = 0x3, Sequence = 0x6
  Pin-ctls: 0x21: IN VREF_50
  Unsolicited: tag=04, enabled=1
  Power states:  D0 D1 D2 D3
  Power: setting=D3, actual=D3
  Connection: 1
     0x26
Node 0x1b [Pin Complex] wcaps 0x400581: Stereo
  Control: name="Independent HP", index=0, device=0
  Control: name="Smart 5.1", index=0, device=0
  Pincap 0x00002334: IN OUT Detect
    Vref caps: HIZ 50 100
  Pin Default 0x0181303e: [Jack] Line In at Ext Rear
    Conn = 1/8, Color = Blue
    DefAssociation = 0x3, Sequence = 0xe
  Pin-ctls: 0x20: IN VREF_HIZ
  Unsolicited: tag=04, enabled=1
  Power states:  D0 D1 D2 D3
  Power: setting=D3, actual=D3
  Connection: 1
     0x18
Node 0x1c [Pin Complex] wcaps 0x40058d: Stereo Amp-Out
  Control: name="Front Playback Switch", index=0, device=0
    ControlAmp: chs=3, dir=Out, idx=0, ofs=0
  Amp-Out caps: ofs=0x00, nsteps=0x00, stepsize=0x00, mute=1
  Amp-Out vals:  [0x00 0x00]
  Pincap 0x0001001c: OUT HP EAPD Detect
  EAPD 0x2: EAPD
  Pin Default 0x01014010: [Jack] Line Out at Ext Rear
    Conn = 1/8, Color = Green
    DefAssociation = 0x1, Sequence = 0x0
  Pin-ctls: 0x40: OUT
  Unsolicited: tag=04, enabled=1
  Power states:  D0 D1 D2 D3
  Power: setting=D3, actual=D3
  Connection: 1
     0x16
Node 0x1d [Pin Complex] wcaps 0x40058d: Stereo Amp-Out
  Control: name="Headphone Playback Switch", index=0, device=0
    ControlAmp: chs=3, dir=Out, idx=0, ofs=0
  Control: name="Independent HP", index=0, device=0
  Amp-Out caps: ofs=0x00, nsteps=0x00, stepsize=0x00, mute=1
  Amp-Out vals:  [0x00 0x00]
  Pincap 0x0000233c: IN OUT HP Detect
    Vref caps: HIZ 50 100
  Pin Default 0x0221401f: [Jack] HP Out at Ext Front
    Conn = 1/8, Color = Green
    DefAssociation = 0x1, Sequence = 0xf
  Pin-ctls: 0xc0: OUT HP VREF_HIZ
  Unsolicited: tag=05, enabled=1
  Power states:  D0 D1 D2 D3
  Power: setting=D3, actual=D3
  Connection: 2
     0x16* 0x25
Node 0x1e [Pin Complex] wcaps 0x40058d: Stereo Amp-Out
  Control: name="Front Mic Boost Capture Volume", index=0, device=0
    ControlAmp: chs=3, dir=In, idx=0, ofs=0
  Control: name="Smart 5.1", index=0, device=0
  Amp-Out caps: ofs=0x00, nsteps=0x00, stepsize=0x00, mute=1
  Amp-Out vals:  [0x80 0x80]
  Pincap 0x0000233c: IN OUT HP Detect
    Vref caps: HIZ 50 100
  Pin Default 0x02a19037: [Jack] Mic at Ext Front
    Conn = 1/8, Color = Pink
    DefAssociation = 0x3, Sequence = 0x7
  Pin-ctls: 0x21: IN VREF_50
  Unsolicited: tag=04, enabled=1
  Power states:  D0 D1 D2 D3
  Power: setting=D3, actual=D3
  Connection: 2
     0x16* 0x25
Node 0x1f [Pin Complex] wcaps 0x400401: Stereo
  Pincap 0x00000020: IN
  Pin Default 0x503701f0: [N/A] CD at Int N/A
    Conn = Analog, Color = Unknown
    DefAssociation = 0xf, Sequence = 0x0
    Misc = NO_PRESENCE
  Pin-ctls: 0x00:
  Power states:  D0 D1 D2 D3
  Power: setting=D0, actual=D0
Node 0x20 [Pin Complex] wcaps 0x400701: Stereo Digital
  Pincap 0x00000010: OUT
  Pin Default 0x185600f0: [Jack] Digital Out at Int HDMI
    Conn = Digital, Color = Unknown
    DefAssociation = 0xf, Sequence = 0x0
  Pin-ctls: 0x40: OUT
  Power states:  D0 D1 D2 D3
  Power: setting=D0, actual=D0
  Connection: 1
     0x12
Node 0x21 [Pin Complex] wcaps 0x400701: Stereo Digital
  Pincap 0x00000010: OUT
  Pin Default 0x474411f0: [N/A] SPDIF Out at Ext Rear Panel
    Conn = RCA, Color = Black
    DefAssociation = 0xf, Sequence = 0x0
    Misc = NO_PRESENCE
  Pin-ctls: 0x40: OUT
  Power states:  D0 D1 D2 D3
  Power: setting=D0, actual=D0
  Connection: 1
     0x15
Node 0x22 [Pin Complex] wcaps 0x400581: Stereo
  Pincap 0x00000014: OUT Detect
  Pin Default 0x410160f0: [N/A] Line Out at Ext Rear
    Conn = 1/8, Color = Orange
    DefAssociation = 0xf, Sequence = 0x0
  Pin-ctls: 0x00:
  Unsolicited: tag=04, enabled=1
  Power states:  D0 D1 D2 D3
  Power: setting=D3, actual=D3
  Connection: 1
     0x26
Node 0x23 [Pin Complex] wcaps 0x400581: Stereo
  Pincap 0x00000014: OUT Detect
  Pin Default 0x410120f0: [N/A] Line Out at Ext Rear
    Conn = 1/8, Color = Grey
    DefAssociation = 0xf, Sequence = 0x0
  Pin-ctls: 0x00:
  Unsolicited: tag=04, enabled=1
  Power states:  D0 D1 D2 D3
  Power: setting=D3, actual=D3
  Connection: 1
     0x27
Node 0x24 [Audio Output] wcaps 0x41d: Stereo Amp-Out
  Amp-Out caps: ofs=0x2a, nsteps=0x2a, stepsize=0x05, mute=0
  Amp-Out vals:  [0x2a 0x2a]
  Converter: stream=0, channel=0
  PCM:
    rates [0x5e0]: 44100 48000 88200 96000 192000
    bits [0xe]: 16 20 24
    formats [0x1]: PCM
  Power states:  D0 D1 D2 D3
  Power: setting=D3, actual=D3
Node 0x25 [Audio Output] wcaps 0x41d: Stereo Amp-Out
  Control: name="Headphone Playback Volume", index=0, device=0
    ControlAmp: chs=3, dir=Out, idx=0, ofs=0
  Amp-Out caps: ofs=0x2a, nsteps=0x2a, stepsize=0x05, mute=0
  Amp-Out vals:  [0x2a 0x2a]
  Converter: stream=0, channel=0
  PCM:
    rates [0x5e0]: 44100 48000 88200 96000 192000
    bits [0xe]: 16 20 24
    formats [0x1]: PCM
  Power states:  D0 D1 D2 D3
  Power: setting=D3, actual=D3
Node 0x26 [Audio Selector] wcaps 0x30050d: Stereo Amp-Out
  Amp-Out caps: ofs=0x00, nsteps=0x00, stepsize=0x00, mute=1
  Amp-Out vals:  [0x80 0x80]
  Power states:  D0 D1 D2 D3
  Power: setting=D3, actual=D3
  Connection: 1
     0x24
Node 0x27 [Audio Selector] wcaps 0x30050d: Stereo Amp-Out
  Amp-Out caps: ofs=0x00, nsteps=0x00, stepsize=0x00, mute=1
  Amp-Out vals:  [0x80 0x80]
  Power states:  D0 D1 D2 D3
  Power: setting=D3, actual=D3
  Connection: 1
     0x25
--endcollapse--


!!ALSA Device nodes
!!-----------------

crw-rw----+ 1 root audio 116, 7 Jun 14 15:51 /dev/snd/controlC0
crw-rw----+ 1 root audio 116, 6 Jun 14 15:51 /dev/snd/hwC0D0
crw-rw----+ 1 root audio 116, 5 Jun 14 15:53 /dev/snd/pcmC0D0c
crw-rw----+ 1 root audio 116, 4 Jun 14 15:53 /dev/snd/pcmC0D0p
crw-rw----+ 1 root audio 116, 3 Jun 14 15:53 /dev/snd/pcmC0D1p
crw-rw----+ 1 root audio 116, 8 Jun 14 15:53 /dev/snd/seq
crw-rw----+ 1 root audio 116, 2 Jun 14 15:51 /dev/snd/timer

/dev/snd/by-path:
total 0
drwxr-xr-x 2 root root  60 Jun 14 15:51 .
drwxr-xr-x 3 root root 200 Jun 14 15:53 ..
lrwxrwxrwx 1 root root  12 Jun 14 15:51 pci-0000:00:1b.0 -» ../controlC0


!!Aplay/Arecord output
!!------------

APLAY

**** List of PLAYBACK Hardware Devices ****
card 0: Intel [HDA Intel], device 0: VT1708S Analog [VT1708S Analog]
  Subdevices: 2/2
  Subdevice #0: subdevice #0
  Subdevice #1: subdevice #1
card 0: Intel [HDA Intel], device 1: VT1708S Digital [VT1708S Digital]
  Subdevices: 1/1
  Subdevice #0: subdevice #0

ARECORD

**** List of CAPTURE Hardware Devices ****
card 0: Intel [HDA Intel], device 0: VT1708S Analog [VT1708S Analog]
  Subdevices: 2/2
  Subdevice #0: subdevice #0
  Subdevice #1: subdevice #1

!!Amixer output
!!-------------

!!-------Mixer controls for card 0 [Intel]

Card hw:0 'Intel'/'HDA Intel at 0xf3ff8000 irq 34'
  Mixer name    : 'VIA VT1708S'
  Components    : 'HDA:11060397,10438415,00100000'
  Controls      : 27
  Simple ctrls  : 16
Simple mixer control 'Master Front',0
  Capabilities: pvolume pswitch penum
  Playback channels: Front Left - Front Right
  Limits: Playback 0 - 31
  Mono:
  Front Left: Playback 31 [100%] [12.00dB] [on]
  Front Right: Playback 31 [100%] [12.00dB] [on]
Simple mixer control 'Headphone',0
  Capabilities: pvolume pswitch penum
  Playback channels: Front Left - Front Right
  Limits: Playback 0 - 42
  Mono:
  Front Left: Playback 42 [100%] [0.00dB] [on]
  Front Right: Playback 42 [100%] [0.00dB] [on]
Simple mixer control 'PCM',0
  Capabilities: pvolume penum
  Playback channels: Front Left - Front Right
  Limits: Playback 0 - 255
  Mono:
  Front Left: Playback 255 [100%] [0.00dB]
  Front Right: Playback 255 [100%] [0.00dB]
Simple mixer control 'Front',0
  Capabilities: pvolume pswitch penum
  Playback channels: Front Left - Front Right
  Limits: Playback 0 - 42
  Mono:
  Front Left: Playback 42 [100%] [0.00dB] [on]
  Front Right: Playback 42 [100%] [0.00dB] [on]
Simple mixer control 'Front Mic',0
  Capabilities: pvolume pswitch penum
  Playback channels: Front Left - Front Right
  Limits: Playback 0 - 31
  Mono:
  Front Left: Playback 31 [100%] [12.00dB] [on]
  Front Right: Playback 31 [100%] [12.00dB] [on]
Simple mixer control 'Front Mic Boost',0
  Capabilities: cvolume penum
  Capture channels: Front Left - Front Right
  Limits: Capture 0 - 3
  Front Left: Capture 3 [100%] [30.75dB]
  Front Right: Capture 3 [100%] [30.75dB]
Simple mixer control 'Line',0
  Capabilities: pvolume pswitch penum
  Playback channels: Front Left - Front Right
  Limits: Playback 0 - 31
  Mono:
  Front Left: Playback 31 [100%] [12.00dB] [on]
  Front Right: Playback 31 [100%] [12.00dB] [on]
Simple mixer control 'Mic',0
  Capabilities: pvolume pswitch penum
  Playback channels: Front Left - Front Right
  Limits: Playback 0 - 31
  Mono:
  Front Left: Playback 31 [100%] [12.00dB] [on]
  Front Right: Playback 31 [100%] [12.00dB] [on]
Simple mixer control 'Mic Boost',0
  Capabilities: cvolume penum
  Capture channels: Front Left - Front Right
  Limits: Capture 0 - 3
  Front Left: Capture 3 [100%] [30.75dB]
  Front Right: Capture 3 [100%] [30.75dB]
Simple mixer control 'IEC958',0
  Capabilities: pswitch pswitch-joined penum
  Playback channels: Mono
  Mono: Playback [off]
Simple mixer control 'IEC958 Default PCM',0
  Capabilities: pswitch pswitch-joined penum
  Playback channels: Mono
  Mono: Playback [on]
Simple mixer control 'Capture',0
  Capabilities: cvolume cswitch penum
  Capture channels: Front Left - Front Right
  Limits: Capture 0 - 31
  Front Left: Capture 31 [100%] [30.00dB] [on]
  Front Right: Capture 31 [100%] [30.00dB] [on]
Simple mixer control 'Capture',1
  Capabilities: cvolume cswitch penum
  Capture channels: Front Left - Front Right
  Limits: Capture 0 - 31
  Front Left: Capture 0 [0%] [-16.50dB] [on]
  Front Right: Capture 0 [0%] [-16.50dB] [on]
Simple mixer control 'Independent HP',0
  Capabilities: enum
  Items: 'OFF' 'ON'
  Item0: 'OFF'
Simple mixer control 'Input Source',0
  Capabilities: cenum
  Items: 'Stereo Mixer' 'Mic' 'Front Mic' 'Line'
  Item0: 'Mic'
Simple mixer control 'Smart 5.1',0
  Capabilities: pswitch pswitch-joined penum
  Playback channels: Mono
  Mono: Playback [off]


!!Alsactl output
!!-------------

--startcollapse--
state.Intel {
    control.1 {
        comment.access 'read write'
        comment.type INTEGER
        comment.count 2
        comment.range '0 - 31'
        comment.dbmin -3450
        comment.dbmax 1200
        iface MIXER
        name 'Master Front Playback Volume'
        value.0 31
        value.1 31
    }
    control.2 {
        comment.access 'read write'
        comment.type BOOLEAN
        comment.count 2
        iface MIXER
        name 'Master Front Playback Switch'
        value.0 true
        value.1 true
    }
    control.3 {
        comment.access 'read write'
        comment.type INTEGER
        comment.count 2
        comment.range '0 - 42'
        comment.dbmin -6300
        comment.dbmax 0
        iface MIXER
        name 'Front Playback Volume'
        value.0 42
        value.1 42
    }
    control.4 {
        comment.access 'read write'
        comment.type BOOLEAN
        comment.count 2
        iface MIXER
        name 'Front Playback Switch'
        value.0 true
        value.1 true
    }
    control.5 {
        comment.access 'read write'
        comment.type INTEGER
        comment.count 2
        comment.range '0 - 42'
        comment.dbmin -6300
        comment.dbmax 0
        iface MIXER
        name 'Headphone Playback Volume'
        value.0 42
        value.1 42
    }
    control.6 {
        comment.access 'read write'
        comment.type BOOLEAN
        comment.count 2
        iface MIXER
        name 'Headphone Playback Switch'
        value.0 true
        value.1 true
    }
    control.7 {
        comment.access 'read write'
        comment.type INTEGER
        comment.count 2
        comment.range '0 - 31'
        comment.dbmin -3450
        comment.dbmax 1200
        iface MIXER
        name 'Mic Playback Volume'
        value.0 31
        value.1 31
    }
    control.8 {
        comment.access 'read write'
        comment.type BOOLEAN
        comment.count 2
        iface MIXER
        name 'Mic Playback Switch'
        value.0 true
        value.1 true
    }
    control.9 {
        comment.access 'read write'
        comment.type INTEGER
        comment.count 2
        comment.range '0 - 31'
        comment.dbmin -3450
        comment.dbmax 1200
        iface MIXER
        name 'Front Mic Playback Volume'
        value.0 31
        value.1 31
    }
    control.10 {
        comment.access 'read write'
        comment.type BOOLEAN
        comment.count 2
        iface MIXER
        name 'Front Mic Playback Switch'
        value.0 true
        value.1 true
    }
    control.11 {
        comment.access 'read write'
        comment.type INTEGER
        comment.count 2
        comment.range '0 - 31'
        comment.dbmin -3450
        comment.dbmax 1200
        iface MIXER
        name 'Line Playback Volume'
        value.0 31
        value.1 31
    }
    control.12 {
        comment.access 'read write'
        comment.type BOOLEAN
        comment.count 2
        iface MIXER
        name 'Line Playback Switch'
        value.0 true
        value.1 true
    }
    control.13 {
        comment.access 'read write'
        comment.type ENUMERATED
        comment.count 1
        comment.item.0 OFF
        comment.item.1 ON
        iface MIXER
        name 'Independent HP'
        value OFF
    }
    control.14 {
        comment.access 'read write'
        comment.type BOOLEAN
        comment.count 1
        iface MIXER
        name 'Smart 5.1'
        value false
    }
    control.15 {
        comment.access 'read write'
        comment.type INTEGER
        comment.count 2
        comment.range '0 - 31'
        comment.dbmin -1650
        comment.dbmax 3000
        iface MIXER
        name 'Capture Volume'
        value.0 31
        value.1 31
    }
    control.16 {
        comment.access 'read write'
        comment.type BOOLEAN
        comment.count 2
        iface MIXER
        name 'Capture Switch'
        value.0 true
        value.1 true
    }
    control.17 {
        comment.access 'read write'
        comment.type INTEGER
        comment.count 2
        comment.range '0 - 31'
        comment.dbmin -1650
        comment.dbmax 3000
        iface MIXER
        name 'Capture Volume'
        index 1
        value.0 0
        value.1 0
    }
    control.18 {
        comment.access 'read write'
        comment.type BOOLEAN
        comment.count 2
        iface MIXER
        name 'Capture Switch'
        index 1
        value.0 true
        value.1 true
    }
    control.19 {
        comment.access 'read write'
        comment.type INTEGER
        comment.count 2
        comment.range '0 - 3'
        comment.dbmin 0
        comment.dbmax 3075
        iface MIXER
        name 'Mic Boost Capture Volume'
        value.0 3
        value.1 3
    }
    control.20 {
        comment.access 'read write'
        comment.type INTEGER
        comment.count 2
        comment.range '0 - 3'
        comment.dbmin 0
        comment.dbmax 3075
        iface MIXER
        name 'Front Mic Boost Capture Volume'
        value.0 3
        value.1 3
    }
    control.21 {
        comment.access 'read write'
        comment.type ENUMERATED
        comment.count 1
        comment.item.0 'Stereo Mixer'
        comment.item.1 Mic
        comment.item.2 'Front Mic'
        comment.item.3 Line
        iface MIXER
        name 'Input Source'
        value Mic
    }
    control.22 {
        comment.access read
        comment.type IEC958
        comment.count 1
        iface MIXER
        name 'IEC958 Playback Con Mask'
        value '0fff000000000000000000000000000000000000000000000000000000000000000000000000000000000000000000000000000000000000000000000000000000000000000000000000000000000000000000000000000000000000000000000000000000000000000000000000000000000000000000000000000000000000000000000000000000000000000000000000000000000000000000000000000000000000000000000000000000000000'
    }
    control.23 {
        comment.access read
        comment.type IEC958
        comment.count 1
        iface MIXER
        name 'IEC958 Playback Pro Mask'
        value '0f00000000000000000000000000000000000000000000000000000000000000000000000000000000000000000000000000000000000000000000000000000000000000000000000000000000000000000000000000000000000000000000000000000000000000000000000000000000000000000000000000000000000000000000000000000000000000000000000000000000000000000000000000000000000000000000000000000000000000'
    }
    control.24 {
        comment.access 'read write'
        comment.type IEC958
        comment.count 1
        iface MIXER
        name 'IEC958 Playback Default'
        value '0400000000000000000000000000000000000000000000000000000000000000000000000000000000000000000000000000000000000000000000000000000000000000000000000000000000000000000000000000000000000000000000000000000000000000000000000000000000000000000000000000000000000000000000000000000000000000000000000000000000000000000000000000000000000000000000000000000000000000'
    }
    control.25 {
        comment.access 'read write'
        comment.type BOOLEAN
        comment.count 1
        iface MIXER
        name 'IEC958 Playback Switch'
        value false
    }
    control.26 {
        comment.access 'read write'
        comment.type BOOLEAN
        comment.count 1
        iface MIXER
        name 'IEC958 Default PCM Playback Switch'
        value true
    }
    control.27 {
        comment.access 'read write user'
        comment.type INTEGER
        comment.count 2
        comment.range '0 - 255'
        comment.tlv '0000000100000008ffffec1400000014'
        comment.dbmin -5100
        comment.dbmax 0
        iface MIXER
        name 'PCM Playback Volume'
        value.0 255
        value.1 255
    }
}
--endcollapse--


!!All Loaded Modules
!!------------------

Module
snd_pcm_oss
snd_mixer_oss
snd_seq
snd_seq_device
snd_hda_codec_via
snd_hda_intel
snd_hda_codec
snd_hwdep
snd_pcm
snd_timer
snd_page_alloc
snd
soundcore
nfs
lockd
fscache
nfs_acl
auth_rpcgss
sunrpc
af_packet
vmsync
vmmemctl
vmblock
nouveau
ttm
drm_kms_helper
drm
i2c_algo_bit
cpufreq_conservative
cpufreq_userspace
cpufreq_powersave
acpi_cpufreq
iTCO_wdt
iTCO_vendor_support
i2c_i801
processor
r8169
serio_raw
pcspkr
asus_atk0110
thermal
joydev
thermal_sys
button
ext4
jbd2
crc16
loop
fuse
nls_utf8
st
dm_mod
edd
brd
usb_storage
sg
sr_mod
sd_mod
cdrom
ata_generic
ata_piix
ahci
parport_pc
pata_jmicron
parport
libata
scsi_mod


!!Sysfs Files
!!-----------

/sys/class/sound/hwC0D0/init_pin_configs:
0x19 0x410110f0
0x1a 0x01a19036
0x1b 0x0181303e
0x1c 0x01014010
0x1d 0x0221401f
0x1e 0x02a19037
0x1f 0x503701f0
0x20 0x185600f0
0x21 0x474411f0
0x22 0x410160f0
0x23 0x410120f0

/sys/class/sound/hwC0D0/driver_pin_configs:

/sys/class/sound/hwC0D0/user_pin_configs:

/sys/class/sound/hwC0D0/init_verbs:


!!ALSA/HDA dmesg
!!------------------

[   29.470986]   alloc kstat_irqs on node -1
[   29.470992] HDA Intel 0000:00:1b.0: PCI INT A -» GSI 22 (level, low) -» IRQ 22
[   29.471862]   alloc irq_desc for 34 on node -1
[   29.471863]   alloc kstat_irqs on node -1
[   29.471871] HDA Intel 0000:00:1b.0: irq 34 for MSI/MSI-X
[   29.471892] HDA Intel 0000:00:1b.0: setting latency timer to 64
[   30.044251] ALSA hda_codec.c:4358: autoconfig: line_outs=1 (0x1c/0x0/0x0/0x0/0x0)
[   30.044254] ALSA hda_codec.c:4362:    speaker_outs=0 (0x0/0x0/0x0/0x0/0x0)
[   30.044257] ALSA hda_codec.c:4366:    hp_outs=1 (0x1d/0x0/0x0/0x0/0x0)
[   30.044259] ALSA hda_codec.c:4367:    mono: mono_out=0x0
[   30.044260] ALSA hda_codec.c:4370:    dig-out=0x20/0x0
[   30.044262] ALSA hda_codec.c:4378:    inputs: mic=0x1a, fmic=0x1e, line=0x1b, fline=0x0, cd=0x0, aux=0x0
[   35.162448] type=1505 audit(1276529360.510:2): operation="profile_load" pid=2721 name=/bin/ping
--
[  362.276378] [drm] nouveau 0000:01:00.0: nouveau_channel_free: freeing fifo 4
[ 1368.002039] HDA Intel 0000:00:1b.0: PCI INT A disabled
[ 1368.075728] HDA Intel 0000:00:1b.0: PCI INT A -» GSI 22 (level, low) -» IRQ 22
[ 1368.075843] HDA Intel 0000:00:1b.0: irq 34 for MSI/MSI-X
[ 1368.075861] HDA Intel 0000:00:1b.0: setting latency timer to 64
[ 1368.089532] ALSA hda_codec.c:4358: autoconfig: line_outs=1 (0x1c/0x0/0x0/0x0/0x0)
[ 1368.089535] ALSA hda_codec.c:4362:    speaker_outs=0 (0x0/0x0/0x0/0x0/0x0)
[ 1368.089537] ALSA hda_codec.c:4366:    hp_outs=1 (0x1d/0x0/0x0/0x0/0x0)
[ 1368.089539] ALSA hda_codec.c:4367:    mono: mono_out=0x0
[ 1368.089540] ALSA hda_codec.c:4370:    dig-out=0x20/0x0
[ 1368.089542] ALSA hda_codec.c:4378:    inputs: mic=0x1a, fmic=0x1e, line=0x1b, fline=0x0, cd=0x0, aux=0x0
