Codec: VIA VIA VT1708B 8-Ch
Address: 0
Vendor Id: 0x1106e721
Subsystem Id: 0x10438345
Revision Id: 0x100100
No Modem Function Group found
Default PCM:
   rates [0x0]:
   bits [0x0]:
   formats [0x0]:
Default Amp-In caps: N/A
Default Amp-Out caps: N/A
GPIO: io=0, o=0, i=0, unsolicited=0, wake=0
Node 0x10 [Audio Output] wcaps 0x411: Stereo
 Converter: stream=0, channel=0
 PCM:
   rates [0x5e0]: 44100 48000 88200 96000 192000
   bits [0xa]: 16 24
   formats [0x1]: PCM
 Power: setting=D0, actual=D0
Node 0x11 [Audio Output] wcaps 0x411: Stereo
 Converter: stream=0, channel=0
 PCM:
   rates [0x5e0]: 44100 48000 88200 96000 192000
   bits [0xa]: 16 24
   formats [0x1]: PCM
 Power: setting=D0, actual=D0
Node 0x12 [Audio Output] wcaps 0x611: Stereo Digital
 Converter: stream=0, channel=0
 Digital:
 Digital category: 0x0
 PCM:
   rates [0x1e0]: 44100 48000 88200 96000
   bits [0xa]: 16 24
   formats [0x1]: PCM
 Power: setting=D0, actual=D0
Node 0x13 [Audio Input] wcaps 0x10051b: Stereo Amp-In
 Amp-In caps: ofs=0x00, nsteps=0x14, stepsize=0x06, mute=1
 Amp-In vals:  [0x00 0x00]
 Converter: stream=0, channel=0
 SDI-Select: 0
 PCM:
   rates [0x560]: 44100 48000 96000 192000
   bits [0xa]: 16 24
   formats [0x1]: PCM
 Power: setting=D0, actual=D0
 Connection: 1
    0x17
Node 0x14 [Audio Input] wcaps 0x10051b: Stereo Amp-In
 Amp-In caps: ofs=0x00, nsteps=0x14, stepsize=0x06, mute=1
 Amp-In vals:  [0x00 0x00]
 Converter: stream=0, channel=0
 SDI-Select: 0
 PCM:
   rates [0x560]: 44100 48000 96000 192000
   bits [0xa]: 16 24
   formats [0x1]: PCM
 Power: setting=D0, actual=D0
 Connection: 1
    0x1e
Node 0x15 [Audio Input] wcaps 0x100711: Stereo Digital
 Converter: stream=0, channel=0
 SDI-Select: 0
 Digital:
 Digital category: 0x0
 PCM:
   rates [0x1f0]: 32000 44100 48000 88200 96000
   bits [0xa]: 16 24
   formats [0x1]: PCM
 Power: setting=D0, actual=D0
 Connection: 1
    0x21
Node 0x16 [Audio Mixer] wcaps 0x20050b: Stereo Amp-In
 Amp-In caps: ofs=0x17, nsteps=0x1f, stepsize=0x06, mute=1
 Amp-In vals:  [0x00 0x00] [0x19 0x19] [0x80 0x80] [0x00 0x00] [0x00 0x00] [0x80 0x80]
 Power: setting=D0, actual=D0
 Connection: 6
    0x10 0x1f 0x1a 0x1b 0x1e 0x25
Node 0x17 [Audio Selector] wcaps 0x300501: Stereo
 Power: setting=D0, actual=D0
 Connection: 5
    0x16* 0x1f 0x1a 0x1b 0x1e
Node 0x18 [Audio Selector] wcaps 0x30050d: Stereo Amp-Out
 Amp-Out caps: ofs=0x1b, nsteps=0x1b, stepsize=0x06, mute=1
 Amp-Out vals:  [0x00 0x00]
 Power: setting=D0, actual=D0
 Connection: 1
    0x11
Node 0x19 [Pin Complex] wcaps 0x400581: Stereo
 Pincap 0x081c: OUT HP Detect
 Pin Default 0x01011012: [Jack] Line Out at Ext Rear
   Conn = 1/8, Color = Black
   DefAssociation = 0x1, Sequence = 0x2
 Pin-ctls: 0x40: OUT
 Unsolicited: tag=00, enabled=0
 Power: setting=D0, actual=D0
 Connection: 1
    0x18
Node 0x1a [Pin Complex] wcaps 0x400581: Stereo
 Pincap 0x082334: IN OUT Detect
   Vref caps: HIZ 50 100
 Pin Default 0x01a19036: [Jack] Mic at Ext Rear
   Conn = 1/8, Color = Pink
   DefAssociation = 0x3, Sequence = 0x6
 Pin-ctls: 0x21: IN VREF_50
 Unsolicited: tag=00, enabled=0
 Power: setting=D0, actual=D0
 Connection: 1
    0x26
Node 0x1b [Pin Complex] wcaps 0x400581: Stereo
 Pincap 0x082334: IN OUT Detect
   Vref caps: HIZ 50 100
 Pin Default 0x0181303e: [Jack] Line In at Ext Rear
   Conn = 1/8, Color = Blue
   DefAssociation = 0x3, Sequence = 0xe
 Pin-ctls: 0x20: IN VREF_HIZ
 Unsolicited: tag=00, enabled=0
 Power: setting=D0, actual=D0
 Connection: 1
    0x18
Node 0x1c [Pin Complex] wcaps 0x40058d: Stereo Amp-Out
 Amp-Out caps: ofs=0x1b, nsteps=0x1b, stepsize=0x06, mute=1
 Amp-Out vals:  [0x16 0x16]
 Pincap 0x081c: OUT HP Detect
 Pin Default 0x01014010: [Jack] Line Out at Ext Rear
   Conn = 1/8, Color = Green
   DefAssociation = 0x1, Sequence = 0x0
 Pin-ctls: 0x40: OUT
 Unsolicited: tag=00, enabled=0
 Power: setting=D0, actual=D0
 Connection: 1
    0x16
Node 0x1d [Pin Complex] wcaps 0x40058d: Stereo Amp-Out
 Amp-Out caps: ofs=0x1b, nsteps=0x1b, stepsize=0x06, mute=1
 Amp-Out vals:  [0x13 0x13]
 Pincap 0x081c: OUT HP Detect
 Pin Default 0x0221401f: [Jack] HP Out at Ext Front
   Conn = 1/8, Color = Green
   DefAssociation = 0x1, Sequence = 0xf
 Pin-ctls: 0xc0: OUT HP
 Unsolicited: tag=00, enabled=0
 Power: setting=D0, actual=D0
 Connection: 2
    0x16 0x25*
Node 0x1e [Pin Complex] wcaps 0x400581: Stereo
 Pincap 0x082334: IN OUT Detect
   Vref caps: HIZ 50 100
 Pin Default 0x02a19038: [Jack] Mic at Ext Front
   Conn = 1/8, Color = Pink
   DefAssociation = 0x3, Sequence = 0x8
 Pin-ctls: 0x21: IN VREF_50
 Unsolicited: tag=00, enabled=0
 Power: setting=D0, actual=D0
 Connection: 1
    0x27
Node 0x1f [Pin Complex] wcaps 0x400401: Stereo
 Pincap 0x0820: IN
 Pin Default 0x90370137: [Fixed] CD at Int N/A
   Conn = Analog, Color = Unknown
   DefAssociation = 0x3, Sequence = 0x7
   Misc = NO_PRESENCE
 Pin-ctls: 0x20: IN
 Power: setting=D0, actual=D0
Node 0x20 [Pin Complex] wcaps 0x400701: Stereo Digital
 Pincap 0x0810: OUT
 Pin Default 0x985601f0: [Fixed] Digital Out at Int HDMI
   Conn = Digital, Color = Unknown
   DefAssociation = 0xf, Sequence = 0x0
   Misc = NO_PRESENCE
 Pin-ctls: 0x40: OUT
 Power: setting=D0, actual=D0
 Connection: 1
    0x12
Node 0x21 [Pin Complex] wcaps 0x400601: Stereo Digital
 Pincap 0x0810030: IN OUT EAPD
 EAPD 0x2: EAPD
 Pin Default 0x47c421f0: [N/A] SPDIF In at Ext Rear Panel
   Conn = RCA, Color = Grey
   DefAssociation = 0xf, Sequence = 0x0
   Misc = NO_PRESENCE
 Pin-ctls: 0x40: OUT
 Power: setting=D0, actual=D0
Node 0x22 [Pin Complex] wcaps 0x400581: Stereo
 Pincap 0x0814: OUT Detect
 Pin Default 0x01016011: [Jack] Line Out at Ext Rear
   Conn = 1/8, Color = Orange
   DefAssociation = 0x1, Sequence = 0x1
 Pin-ctls: 0x40: OUT
 Unsolicited: tag=00, enabled=0
 Power: setting=D0, actual=D0
 Connection: 1
    0x26
Node 0x23 [Pin Complex] wcaps 0x400581: Stereo
 Pincap 0x0814: OUT Detect
 Pin Default 0x01012014: [Jack] Line Out at Ext Rear
   Conn = 1/8, Color = Grey
   DefAssociation = 0x1, Sequence = 0x4
 Pin-ctls: 0x40: OUT
 Unsolicited: tag=00, enabled=0
 Power: setting=D0, actual=D0
 Connection: 1
    0x27
Node 0x24 [Audio Output] wcaps 0x411: Stereo
 Converter: stream=0, channel=0
 PCM:
   rates [0x5e0]: 44100 48000 88200 96000 192000
   bits [0xa]: 16 24
   formats [0x1]: PCM
 Power: setting=D0, actual=D0
Node 0x25 [Audio Output] wcaps 0x411: Stereo
 Converter: stream=0, channel=0
 PCM:
   rates [0x5e0]: 44100 48000 88200 96000 192000
   bits [0xa]: 16 24
   formats [0x1]: PCM
 Power: setting=D0, actual=D0
Node 0x26 [Audio Selector] wcaps 0x30050d: Stereo Amp-Out
 Amp-Out caps: ofs=0x1b, nsteps=0x1b, stepsize=0x06, mute=1
 Amp-Out vals:  [0x00 0x00]
 Power: setting=D0, actual=D0
 Connection: 1
    0x24
Node 0x27 [Audio Selector] wcaps 0x30050d: Stereo Amp-Out
 Amp-Out caps: ofs=0x1b, nsteps=0x1b, stepsize=0x06, mute=1
 Amp-Out vals:  [0x00 0x00]
 Power: setting=D0, actual=D0
 Connection: 1
    0x25
