upload=true&script=true&cardinfo=
!!################################
!!ALSA Information Script v 0.4.60
!!################################

!!Script ran on: Mon Jan  9 14:50:51 UTC 2012


!!Linux Distribution
!!------------------

Welcome to openSUSE 12.1 "Asparagus" - Kernel \r (\l). openSUSE 12.1 (x86_64) LSB_VERSION="core-2.0-noarch:core-3.2-noarch:core-4.0-noarch:core-2.0-x86_64:core-3.2-x86_64:core-4.0-x86_64" NAME=openSUSE PRETTY_NAME="openSUSE 12.1 (Asparagus) (x86_64)" ID=opensuse


!!DMI Information
!!---------------

Manufacturer:      ASUSTeK Computer Inc.
Product Name:      U30Sd
Product Version:   1.0       


!!Kernel Information
!!------------------

Kernel release:    3.1.0-1.2-desktop
Operating System:  GNU/Linux
Architecture:      x86_64
Processor:         x86_64
SMP Enabled:       Yes


!!ALSA Version
!!------------

Driver version:     1.0.24
Library version:    1.0.24.1
Utilities version:  1.0.24.2


!!Loaded ALSA modules
!!-------------------

snd_hda_intel


!!Sound Servers on this system
!!----------------------------

ESound Daemon:
      Installed - Yes (/usr/bin/esd)
      Running - No

Jack:
      Installed - Yes (/usr/bin/jackd)
      Running - No


!!Soundcards recognised by ALSA
!!-----------------------------

 0 [PCH            ]: HDA-Intel - HDA Intel PCH
                      HDA Intel PCH at 0xdf600000 irq 43


!!PCI Soundcards installed in the system
!!--------------------------------------

00:1b.0 Audio device: Intel Corporation 6 Series/C200 Series Chipset Family High Definition Audio Controller (rev 05)


!!Advanced information - PCI Vendor/Device/Subsystem ID's
!!--------------------------------------------------------

00:1b.0 0403: 8086:1c20 (rev 05)
	Subsystem: 1043:1053


!!Loaded sound module options
!!--------------------------

!!Module: snd_hda_intel
	bdl_pos_adj : 1,-1,-1,-1,-1,-1,-1,-1,-1,-1,-1,-1,-1,-1,-1,-1,-1,-1,-1,-1,-1,-1,-1,-1,-1,-1,-1,-1,-1,-1,-1,-1
	beep_mode : 2,2,2,2,2,2,2,2,2,2,2,2,2,2,2,2,2,2,2,2,2,2,2,2,2,2,2,2,2,2,2,2
	enable : Y,Y,Y,Y,Y,Y,Y,Y,Y,Y,Y,Y,Y,Y,Y,Y,Y,Y,Y,Y,Y,Y,Y,Y,Y,Y,Y,Y,Y,Y,Y,Y
	enable_msi : -1
	id : (null),(null),(null),(null),(null),(null),(null),(null),(null),(null),(null),(null),(null),(null),(null),(null),(null),(null),(null),(null),(null),(null),(null),(null),(null),(null),(null),(null),(null),(null),(null),(null)
	index : -1,-1,-1,-1,-1,-1,-1,-1,-1,-1,-1,-1,-1,-1,-1,-1,-1,-1,-1,-1,-1,-1,-1,-1,-1,-1,-1,-1,-1,-1,-1,-1
	model : (null),(null),(null),(null),(null),(null),(null),(null),(null),(null),(null),(null),(null),(null),(null),(null),(null),(null),(null),(null),(null),(null),(null),(null),(null),(null),(null),(null),(null),(null),(null),(null)
	patch : (null),(null),(null),(null),(null),(null),(null),(null),(null),(null),(null),(null),(null),(null),(null),(null),(null),(null),(null),(null),(null),(null),(null),(null),(null),(null),(null),(null),(null),(null),(null),(null)
	position_fix : 0,0,0,0,0,0,0,0,0,0,0,0,0,0,0,0,0,0,0,0,0,0,0,0,0,0,0,0,0,0,0,0
	power_save : 0
	power_save_controller : Y
	probe_mask : -1,-1,-1,-1,-1,-1,-1,-1,-1,-1,-1,-1,-1,-1,-1,-1,-1,-1,-1,-1,-1,-1,-1,-1,-1,-1,-1,-1,-1,-1,-1,-1
	probe_only : 0,0,0,0,0,0,0,0,0,0,0,0,0,0,0,0,0,0,0,0,0,0,0,0,0,0,0,0,0,0,0,0
	single_cmd : N


!!HDA-Intel Codec information
!!---------------------------
--startcollapse--

Codec: VIA VT1802
Address: 0
AFG Function Id: 0x1 (unsol 0)
Vendor Id: 0x11068446
Subsystem Id: 0x10431053
Revision Id: 0x100000
No Modem Function Group found
Default PCM:
    rates [0x0]:
    bits [0x0]:
    formats [0x0]:
Default Amp-In caps: N/A
Default Amp-Out caps: N/A
GPIO: io=0, o=0, i=0, unsolicited=0, wake=0
Node 0x08 [Audio Output] wcaps 0x41d: Stereo Amp-Out
  Device: name="VT1802 Analog", type="Audio", device=0
  Amp-Out caps: ofs=0x2a, nsteps=0x2a, stepsize=0x05, mute=0
  Amp-Out vals:  [0x2a 0x2a]
  Converter: stream=5, channel=0
  PCM:
    rates [0x5e0]: 44100 48000 88200 96000 192000
    bits [0xe]: 16 20 24
    formats [0x1]: PCM
  Power states:  D0 D1 D2 D3 EPSS
  Power: setting=D0, actual=D0
Node 0x09 [Audio Output] wcaps 0x41d: Stereo Amp-Out
  Control: name="Headphone Playback Volume", index=0, device=0
    ControlAmp: chs=3, dir=Out, idx=0, ofs=0
  Device: name="VT1802 HP", type="Audio", device=2
  Amp-Out caps: ofs=0x2a, nsteps=0x2a, stepsize=0x05, mute=0
  Amp-Out vals:  [0x18 0x18]
  Converter: stream=5, channel=0
  PCM:
    rates [0x5e0]: 44100 48000 88200 96000 192000
    bits [0xe]: 16 20 24
    formats [0x1]: PCM
  Power states:  D0 D1 D2 D3 EPSS
  Power: setting=D0, actual=D0
Node 0x0a [Vendor Defined Widget] wcaps 0xf00000: Mono
Node 0x0b [Vendor Defined Widget] wcaps 0xf00000: Mono
Node 0x0c [Vendor Defined Widget] wcaps 0xf00000: Mono
Node 0x0d [Vendor Defined Widget] wcaps 0xf00000: Mono
Node 0x0e [Audio Output] wcaps 0x611: Stereo Digital
  Control: name="IEC958 Playback Con Mask", index=0, device=0
  Control: name="IEC958 Playback Pro Mask", index=0, device=0
  Control: name="IEC958 Playback Default", index=0, device=0
  Control: name="IEC958 Playback Switch", index=0, device=0
  Control: name="IEC958 Default PCM Playback Switch", index=0, device=0
  Device: name="VT1802 Digital", type="SPDIF", device=1
  Converter: stream=5, channel=0
  Digital: Enabled
  Digital category: 0x0
  PCM:
    rates [0x5e0]: 44100 48000 88200 96000 192000
    bits [0xe]: 16 20 24
    formats [0x1]: PCM
  Power states:  D0 D1 D2 D3 EPSS
  Power: setting=D0, actual=D0
Node 0x0f [Vendor Defined Widget] wcaps 0xf00000: Mono
Node 0x10 [Audio Input] wcaps 0x10051b: Stereo Amp-In
  Control: name="Capture Volume", index=0, device=0
    ControlAmp: chs=3, dir=In, idx=0, ofs=0
  Control: name="Capture Switch", index=0, device=0
    ControlAmp: chs=3, dir=In, idx=0, ofs=0
  Device: name="VT1802 Analog", type="Audio", device=0
  Amp-In caps: ofs=0x0b, nsteps=0x1f, stepsize=0x05, mute=1
  Amp-In vals:  [0x18 0x18]
  Converter: stream=1, channel=0
  SDI-Select: 0
  PCM:
    rates [0x560]: 44100 48000 96000 192000
    bits [0xe]: 16 20 24
    formats [0x1]: PCM
  Power states:  D0 D1 D2 D3 EPSS
  Power: setting=D0, actual=D0
  Connection: 1
     0x1e
Node 0x11 [Audio Input] wcaps 0x10051b: Stereo Amp-In
  Control: name="Capture Volume", index=1, device=0
    ControlAmp: chs=3, dir=In, idx=0, ofs=0
  Control: name="Capture Switch", index=1, device=0
    ControlAmp: chs=3, dir=In, idx=0, ofs=0
  Amp-In caps: ofs=0x0b, nsteps=0x1f, stepsize=0x05, mute=1
  Amp-In vals:  [0x98 0x98]
  Converter: stream=0, channel=0
  SDI-Select: 0
  PCM:
    rates [0x560]: 44100 48000 96000 192000
    bits [0xe]: 16 20 24
    formats [0x1]: PCM
  Power states:  D0 D1 D2 D3 EPSS
  Power: setting=D0, actual=D0
  Connection: 1
     0x1f
Node 0x12 [Vendor Defined Widget] wcaps 0xf00000: Mono
Node 0x13 [Vendor Defined Widget] wcaps 0xf00000: Mono
Node 0x14 [Audio Mixer] wcaps 0x20050b: Stereo Amp-In
  Amp-In caps: ofs=0x00, nsteps=0x00, stepsize=0x00, mute=1
  Amp-In vals:  [0x80 0x80] [0x00 0x00]
  Power states:  D0 D1 D2 D3
  Power: setting=D0, actual=D0
  Connection: 2
     0x34 0x21
Node 0x15 [Audio Mixer] wcaps 0x20050b: Stereo Amp-In
  Amp-In caps: ofs=0x00, nsteps=0x00, stepsize=0x00, mute=1
  Amp-In vals:  [0x00 0x00] [0x80 0x80]
  Power states:  D0 D1 D2 D3
  Power: setting=D3, actual=D3
  Connection: 2
     0x35 0x21
Node 0x16 [Vendor Defined Widget] wcaps 0xf00000: Mono
Node 0x17 [Vendor Defined Widget] wcaps 0xf00000: Mono
Node 0x18 [Audio Mixer] wcaps 0x20050b: Stereo Amp-In
  Amp-In caps: ofs=0x00, nsteps=0x00, stepsize=0x00, mute=1
  Amp-In vals:  [0x80 0x80] [0x80 0x80]
  Power states:  D0 D1 D2 D3
  Power: setting=D3, actual=D3
  Connection: 2
     0x38 0x21
Node 0x19 [Vendor Defined Widget] wcaps 0xf00000: Mono
Node 0x1a [Vendor Defined Widget] wcaps 0xf00000: Mono
Node 0x1b [Vendor Defined Widget] wcaps 0xf00000: Mono
Node 0x1c [Audio Mixer] wcaps 0x20050b: Stereo Amp-In
  Amp-In caps: ofs=0x00, nsteps=0x00, stepsize=0x00, mute=1
  Amp-In vals:  [0x80 0x80] [0x80 0x80]
  Power states:  D0 D1 D2 D3
  Power: setting=D0, actual=D0
  Connection: 2
     0x3c 0x21
Node 0x1d [Vendor Defined Widget] wcaps 0xf00000: Mono
Node 0x1e [Audio Selector] wcaps 0x300501: Stereo
  Control: name="Input Source", index=0, device=0
  Power states:  D0 D1 D2 D3
  Power: setting=D0, actual=D0
  Connection: 5
     0x2b 0x2a 0x29* 0x21 0x30
Node 0x1f [Audio Selector] wcaps 0x300501: Stereo
  Control: name="Input Source", index=1, device=0
  Power states:  D0 D1 D2 D3
  Power: setting=D0, actual=D0
  Connection: 5
     0x2b* 0x2a 0x29 0x21 0x30
Node 0x20 [Vendor Defined Widget] wcaps 0xf00000: Mono
Node 0x21 [Audio Mixer] wcaps 0x20050b: Stereo Amp-In
  Control: name="PCM Loopback Playback Volume", index=0, device=0
    ControlAmp: chs=3, dir=In, idx=3, ofs=0
  Control: name="PCM Loopback Playback Switch", index=0, device=0
    ControlAmp: chs=3, dir=In, idx=3, ofs=0
  Control: name="Internal Mic Playback Volume", index=0, device=0
    ControlAmp: chs=3, dir=In, idx=2, ofs=0
  Control: name="Internal Mic Playback Switch", index=0, device=0
    ControlAmp: chs=3, dir=In, idx=2, ofs=0
  Control: name="Mic Playback Volume", index=0, device=0
    ControlAmp: chs=3, dir=In, idx=0, ofs=0
  Control: name="Mic Playback Switch", index=0, device=0
    ControlAmp: chs=3, dir=In, idx=0, ofs=0
  Amp-In caps: ofs=0x17, nsteps=0x1f, stepsize=0x05, mute=1
  Amp-In vals:  [0x80 0x80] [0x80 0x80] [0x80 0x80]
  Power states:  D0 D1 D2 D3
  Power: setting=D3, actual=D3
  Connection: 3
     0x2b 0x2a 0x29
Node 0x22 [Beep Generator Widget] wcaps 0x70040c: Mono Amp-Out
  Amp-Out caps: ofs=0x0a, nsteps=0x12, stepsize=0x05, mute=1
  Amp-Out vals:  [0x00]
  Power states:  D0 D1 D2 D3
  Power: setting=D0, actual=D0
Node 0x23 [Vendor Defined Widget] wcaps 0xf00000: Mono
Node 0x24 [Pin Complex] wcaps 0x40050d: Stereo Amp-Out
  Control: name="Speaker Playback Switch", index=0, device=0
    ControlAmp: chs=3, dir=Out, idx=0, ofs=0
  Amp-Out caps: ofs=0x00, nsteps=0x00, stepsize=0x00, mute=1
  Amp-Out vals:  [0x00 0x00]
  Pincap 0x00010050: OUT EAPD Balanced
  EAPD 0x3: BALANCED EAPD
  Pin Default 0x90170110: [Fixed] Speaker at Int N/A
    Conn = Analog, Color = Unknown
    DefAssociation = 0x1, Sequence = 0x0
    Misc = NO_PRESENCE
  Pin-ctls: 0x40: OUT
  Power states:  D0 D1 D2 D3 EPSS
  Power: setting=D0, actual=D0
  Connection: 2
     0x14 0x3e*
Node 0x25 [Pin Complex] wcaps 0x40058d: Stereo Amp-Out
  Control: name="Headphone Playback Switch", index=0, device=0
    ControlAmp: chs=3, dir=Out, idx=0, ofs=0
  Control: name="Independent HP", index=0, device=0
  Amp-Out caps: ofs=0x00, nsteps=0x00, stepsize=0x00, mute=1
  Amp-Out vals:  [0x00 0x00]
  Pincap 0x0001001c: OUT HP EAPD Detect
  EAPD 0x2: EAPD
  Pin Default 0x0221401f: [Jack] HP Out at Ext Front
    Conn = 1/8, Color = Green
    DefAssociation = 0x1, Sequence = 0xf
  Pin-ctls: 0xc0: OUT HP
  Unsolicited: tag=21, enabled=1
  Power states:  D0 D1 D2 D3 EPSS
  Power: setting=D3, actual=D3
  Connection: 1
     0x15
Node 0x26 [Vendor Defined Widget] wcaps 0xf00000: Mono
Node 0x27 [Vendor Defined Widget] wcaps 0xf00000: Mono
Node 0x28 [Pin Complex] wcaps 0x40058d: Stereo Amp-Out
  Amp-Out caps: ofs=0x00, nsteps=0x00, stepsize=0x00, mute=1
  Amp-Out vals:  [0x80 0x80]
  Pincap 0x0000001c: OUT HP Detect
  Pin Default 0x422140f0: [N/A] HP Out at Ext Front
    Conn = 1/8, Color = Green
    DefAssociation = 0xf, Sequence = 0x0
  Pin-ctls: 0x00:
  Unsolicited: tag=00, enabled=0
  Power states:  D0 D1 D2 D3 EPSS
  Power: setting=D3, actual=D3
  Connection: 1
     0x18
Node 0x29 [Pin Complex] wcaps 0x400481: Stereo
  Control: name="Internal Mic Boost Volume", index=0, device=0
    ControlAmp: chs=3, dir=In, idx=0, ofs=0
  Pincap 0x00002324: IN Detect
    Vref caps: HIZ 50 100
  Pin Default 0x90a701f0: [Fixed] Mic at Int N/A
    Conn = Analog, Color = Unknown
    DefAssociation = 0xf, Sequence = 0x0
    Misc = NO_PRESENCE
  Pin-ctls: 0x21: IN VREF_50
  Unsolicited: tag=20, enabled=1
  Power states:  D0 D1 D2 D3 EPSS
  Power: setting=D0, actual=D0
Node 0x2a [Pin Complex] wcaps 0x400481: Stereo
  Pincap 0x00002324: IN Detect
    Vref caps: HIZ 50 100
  Pin Default 0x418130f0: [N/A] Line In at Ext Rear
    Conn = 1/8, Color = Blue
    DefAssociation = 0xf, Sequence = 0x0
  Pin-ctls: 0x00: VREF_HIZ
  Unsolicited: tag=00, enabled=0
  Power states:  D0 D1 D2 D3 EPSS
  Power: setting=D3, actual=D3
Node 0x2b [Pin Complex] wcaps 0x400481: Stereo
  Control: name="Mic Boost Volume", index=0, device=0
    ControlAmp: chs=3, dir=In, idx=0, ofs=0
  Pincap 0x00002324: IN Detect
    Vref caps: HIZ 50 100
  Pin Default 0x01a190f0: [Jack] Mic at Ext Rear
    Conn = 1/8, Color = Pink
    DefAssociation = 0xf, Sequence = 0x0
  Pin-ctls: 0x21: IN VREF_50
  Unsolicited: tag=20, enabled=1
  Power states:  D0 D1 D2 D3 EPSS
  Power: setting=D3, actual=D3
Node 0x2c [Vendor Defined Widget] wcaps 0xf00000: Mono
Node 0x2d [Pin Complex] wcaps 0x400701: Stereo Digital
  Pincap 0x00000010: OUT
  Pin Default 0x074411f0: [Jack] SPDIF Out at Ext Rear Panel
    Conn = RCA, Color = Black
    DefAssociation = 0xf, Sequence = 0x0
    Misc = NO_PRESENCE
  Pin-ctls: 0x40: OUT
  Power states:  D0 D1 D2 D3 EPSS
  Power: setting=D0, actual=D0
  Connection: 1
     0x0e
Node 0x2e [Vendor Defined Widget] wcaps 0xf00000: Mono
Node 0x2f [Vendor Defined Widget] wcaps 0xf00000: Mono
Node 0x30 [Pin Complex] wcaps 0x40040b: Stereo Amp-In
  Amp-In caps: ofs=0x00, nsteps=0x03, stepsize=0x2f, mute=0
  Amp-In vals:  [0x00 0x00]
  Pincap 0x00000020: IN
  Pin Default 0x50a601f0: [N/A] Mic at Int N/A
    Conn = Digital, Color = Unknown
    DefAssociation = 0xf, Sequence = 0x0
    Misc = NO_PRESENCE
  Pin-ctls: 0x00:
  Power states:  D0 D1 D2 D3 EPSS
  Power: setting=D0, actual=D0
Node 0x31 [Vendor Defined Widget] wcaps 0xf00000: Mono
Node 0x32 [Vendor Defined Widget] wcaps 0xf00000: Mono
Node 0x33 [Pin Complex] wcaps 0x40050c: Mono Amp-Out
  Amp-Out caps: ofs=0x00, nsteps=0x00, stepsize=0x00, mute=1
  Amp-Out vals:  [0x00]
  Pincap 0x00000010: OUT
  Pin Default 0x501701f0: [N/A] Speaker at Int N/A
    Conn = Analog, Color = Unknown
    DefAssociation = 0xf, Sequence = 0x0
    Misc = NO_PRESENCE
  Pin-ctls: 0x00:
  Power states:  D0 D1 D2 D3 EPSS
  Power: setting=D0, actual=D0
  Connection: 1
     0x3e
Node 0x34 [Audio Selector] wcaps 0x300501: Stereo
  Power states:  D0 D1 D2 D3
  Power: setting=D0, actual=D0
  Connection: 2
     0x08* 0x09
Node 0x35 [Audio Selector] wcaps 0x300501: Stereo
  Power states:  D0 D1 D2 D3
  Power: setting=D3, actual=D3
  Connection: 2
     0x08 0x09*
Node 0x36 [Vendor Defined Widget] wcaps 0xf00000: Mono
Node 0x37 [Vendor Defined Widget] wcaps 0xf00000: Mono
Node 0x38 [Audio Selector] wcaps 0x300501: Stereo
  Power states:  D0 D1 D2 D3
  Power: setting=D3, actual=D3
  Connection: 2
     0x08* 0x09
Node 0x39 [Vendor Defined Widget] wcaps 0xf00000: Mono
Node 0x3a [Vendor Defined Widget] wcaps 0xf00000: Mono
Node 0x3b [Vendor Defined Widget] wcaps 0xf00000: Mono
Node 0x3c [Audio Selector] wcaps 0x300501: Stereo
  Power states:  D0 D1 D2 D3
  Power: setting=D0, actual=D0
  Connection: 2
     0x08* 0x09
Codec: Intel CougarPoint HDMI
Address: 3
AFG Function Id: 0x1 (unsol 0)
Vendor Id: 0x80862805
Subsystem Id: 0x80860101
Revision Id: 0x100000
No Modem Function Group found
Default PCM:
    rates [0x0]:
    bits [0x0]:
    formats [0x0]:
Default Amp-In caps: N/A
Default Amp-Out caps: N/A
GPIO: io=0, o=0, i=0, unsolicited=0, wake=0
Node 0x02 [Audio Output] wcaps 0x6611: 8-Channels Digital
  Converter: stream=0, channel=0
  Digital: Enabled
  Digital category: 0x0
  PCM:
    rates [0x7f0]: 32000 44100 48000 88200 96000 176400 192000
    bits [0x1e]: 16 20 24 32
    formats [0x5]: PCM AC3
  Power states:  D0 D3 EPSS
  Power: setting=D0, actual=D0
Node 0x03 [Audio Output] wcaps 0x6611: 8-Channels Digital
  Converter: stream=0, channel=0
  Digital: Enabled
  Digital category: 0x0
  PCM:
    rates [0x7f0]: 32000 44100 48000 88200 96000 176400 192000
    bits [0x1e]: 16 20 24 32
    formats [0x5]: PCM AC3
  Power states:  D0 D3 EPSS
  Power: setting=D0, actual=D0
Node 0x04 [Audio Output] wcaps 0x6611: 8-Channels Digital
  Converter: stream=0, channel=0
  Digital: Enabled
  Digital category: 0x0
  PCM:
    rates [0x7f0]: 32000 44100 48000 88200 96000 176400 192000
    bits [0x1e]: 16 20 24 32
    formats [0x5]: PCM AC3
  Power states:  D0 D3 EPSS
  Power: setting=D0, actual=D0
Node 0x05 [Pin Complex] wcaps 0x40778d: 8-Channels Digital Amp-Out CP
  Amp-Out caps: ofs=0x00, nsteps=0x00, stepsize=0x00, mute=1
  Amp-Out vals:  [0x00 0x80]
  Pincap 0x09000094: OUT Detect HBR HDMI DP
  Pin Default 0x58560010: [N/A] Digital Out at Int HDMI
    Conn = Digital, Color = Unknown
    DefAssociation = 0x1, Sequence = 0x0
  Pin-ctls: 0x40: OUT
  Unsolicited: tag=00, enabled=0
  Power states:  D0 D3 EPSS
  Power: setting=D0, actual=D0
  Connection: 1
     0x02
Node 0x06 [Pin Complex] wcaps 0x40778d: 8-Channels Digital Amp-Out CP
  Control: name="IEC958 Playback Con Mask", index=1, device=0
  Control: name="IEC958 Playback Pro Mask", index=1, device=0
  Control: name="IEC958 Playback Default", index=1, device=0
  Control: name="IEC958 Playback Switch", index=1, device=0
  Amp-Out caps: ofs=0x00, nsteps=0x00, stepsize=0x00, mute=1
  Amp-Out vals:  [0x00 0x00]
  Pincap 0x09000094: OUT Detect HBR HDMI DP
  Pin Default 0x18560020: [Jack] Digital Out at Int HDMI
    Conn = Digital, Color = Unknown
    DefAssociation = 0x2, Sequence = 0x0
  Pin-ctls: 0x00:
  Unsolicited: tag=06, enabled=1
  Power states:  D0 D3 EPSS
  Power: setting=D0, actual=D0
  Connection: 1
     0x03
Node 0x07 [Pin Complex] wcaps 0x40778d: 8-Channels Digital Amp-Out CP
  Amp-Out caps: ofs=0x00, nsteps=0x00, stepsize=0x00, mute=1
  Amp-Out vals:  [0x00 0x80]
  Pincap 0x09000094: OUT Detect HBR HDMI DP
  Pin Default 0x58560030: [N/A] Digital Out at Int HDMI
    Conn = Digital, Color = Unknown
    DefAssociation = 0x3, Sequence = 0x0
  Pin-ctls: 0x40: OUT
  Unsolicited: tag=00, enabled=0
  Power states:  D0 D3 EPSS
  Power: setting=D0, actual=D0
  Connection: 1
     0x04
Node 0x08 [Vendor Defined Widget] wcaps 0xf00000: Mono
--endcollapse--


!!ALSA Device nodes
!!-----------------

crw-rw----+ 1 root audio 116,  9 Jan  8 14:13 /dev/snd/controlC0
crw-rw----+ 1 root audio 116,  8 Jan  8 14:13 /dev/snd/hwC0D0
crw-rw----+ 1 root audio 116,  7 Jan  8 14:13 /dev/snd/hwC0D3
crw-rw----+ 1 root audio 116,  6 Jan  9 18:19 /dev/snd/pcmC0D0c
crw-rw----+ 1 root audio 116,  5 Jan  9 18:19 /dev/snd/pcmC0D0p
crw-rw----+ 1 root audio 116,  4 Jan  8 14:13 /dev/snd/pcmC0D1p
crw-rw----+ 1 root audio 116,  3 Jan  8 14:13 /dev/snd/pcmC0D2p
crw-rw----+ 1 root audio 116,  2 Jan  8 14:13 /dev/snd/pcmC0D3p
crw-rw----+ 1 root audio 116,  1 Jan  8 14:13 /dev/snd/seq
crw-rw----+ 1 root audio 116, 33 Jan  8 14:13 /dev/snd/timer

/dev/snd/by-path:
total 0
drwxr-xr-x 2 root root  60 Jan  8 14:13 .
drwxr-xr-x 3 root root 260 Jan  8 14:13 ..
lrwxrwxrwx 1 root root  12 Jan  8 14:13 pci-0000:00:1b.0 -> ../controlC0


!!Aplay/Arecord output
!!------------

APLAY

**** List of PLAYBACK Hardware Devices ****
card 0: PCH [HDA Intel PCH], device 0: VT1802 Analog [VT1802 Analog]
  Subdevices: 1/1
  Subdevice #0: subdevice #0
card 0: PCH [HDA Intel PCH], device 1: VT1802 Digital [VT1802 Digital]
  Subdevices: 1/1
  Subdevice #0: subdevice #0
card 0: PCH [HDA Intel PCH], device 2: VT1802 HP [VT1802 HP]
  Subdevices: 1/1
  Subdevice #0: subdevice #0
card 0: PCH [HDA Intel PCH], device 3: HDMI 0 [HDMI 0]
  Subdevices: 1/1
  Subdevice #0: subdevice #0

ARECORD

**** List of CAPTURE Hardware Devices ****
card 0: PCH [HDA Intel PCH], device 0: VT1802 Analog [VT1802 Analog]
  Subdevices: 2/2
  Subdevice #0: subdevice #0
  Subdevice #1: subdevice #1

!!Amixer output
!!-------------

!!-------Mixer controls for card 0 [PCH]

Card hw:0 'PCH'/'HDA Intel PCH at 0xdf600000 irq 43'
  Mixer name	: 'Intel CougarPoint HDMI'
  Components	: 'HDA:11068446,10431053,00100000 HDA:80862805,80860101,00100000'
  Controls      : 33
  Simple ctrls  : 20
Simple mixer control 'Master',0
  Capabilities: pvolume pvolume-joined pswitch pswitch-joined penum
  Playback channels: Mono
  Limits: Playback 0 - 42
  Mono: Playback 24 [57%] [-27.00dB] [on]
Simple mixer control 'Headphone',0
  Capabilities: pvolume pswitch penum
  Playback channels: Front Left - Front Right
  Limits: Playback 0 - 42
  Mono:
  Front Left: Playback 42 [100%] [0.00dB] [on]
  Front Right: Playback 42 [100%] [0.00dB] [on]
Simple mixer control 'Speaker',0
  Capabilities: pswitch penum
  Playback channels: Front Left - Front Right
  Mono:
  Front Left: Playback [on]
  Front Right: Playback [on]
Simple mixer control 'PCM',0
  Capabilities: pvolume penum
  Playback channels: Front Left - Front Right
  Limits: Playback 0 - 255
  Mono:
  Front Left: Playback 255 [100%] [0.00dB]
  Front Right: Playback 255 [100%] [0.00dB]
Simple mixer control 'PCM Loopback',0
  Capabilities: pvolume pswitch penum
  Playback channels: Front Left - Front Right
  Limits: Playback 0 - 31
  Mono:
  Front Left: Playback 31 [100%] [12.00dB] [on]
  Front Right: Playback 31 [100%] [12.00dB] [on]
Simple mixer control 'Mic',0
  Capabilities: pvolume pswitch penum
  Playback channels: Front Left - Front Right
  Limits: Playback 0 - 31
  Mono:
  Front Left: Playback 0 [0%] [-34.50dB] [off]
  Front Right: Playback 0 [0%] [-34.50dB] [off]
Simple mixer control 'Mic Boost',0
  Capabilities: volume penum
  Playback channels: Front Left - Front Right
  Capture channels: Front Left - Front Right
  Limits: 0 - 3
  Front Left: 2 [67%] [20.50dB]
  Front Right: 2 [67%] [20.50dB]
Simple mixer control 'IEC958',0
  Capabilities: pswitch pswitch-joined penum
  Playback channels: Mono
  Mono: Playback [on]
Simple mixer control 'IEC958 Default PCM',0
  Capabilities: pswitch pswitch-joined penum
  Playback channels: Mono
  Mono: Playback [on]
Simple mixer control 'IEC958',1
  Capabilities: pswitch pswitch-joined penum
  Playback channels: Mono
  Mono: Playback [on]
Simple mixer control 'Capture',0
  Capabilities: cvolume cswitch penum
  Capture channels: Front Left - Front Right
  Limits: Capture 0 - 31
  Front Left: Capture 24 [77%] [19.50dB] [on]
  Front Right: Capture 24 [77%] [19.50dB] [on]
Simple mixer control 'Capture',1
  Capabilities: cvolume cswitch penum
  Capture channels: Front Left - Front Right
  Limits: Capture 0 - 31
  Front Left: Capture 24 [77%] [19.50dB] [off]
  Front Right: Capture 24 [77%] [19.50dB] [off]
Simple mixer control 'Digital',0
  Capabilities: cvolume penum
  Capture channels: Front Left - Front Right
  Limits: Capture 0 - 120
  Front Left: Capture 0 [0%] [-30.00dB]
  Front Right: Capture 0 [0%] [-30.00dB]
Simple mixer control 'Dynamic Power-Control',0
  Capabilities: enum
  Items: 'Disabled' 'Enabled'
  Item0: 'Enabled'
Simple mixer control 'Independent HP',0
  Capabilities: enum
  Items: 'OFF' 'ON'
  Item0: 'OFF'
Simple mixer control 'Input Source',0
  Capabilities: cenum
  Items: 'Internal Mic' 'Mic' 'Stereo Mixer'
  Item0: 'Internal Mic'
Simple mixer control 'Input Source',1
  Capabilities: cenum
  Items: 'Internal Mic' 'Mic' 'Stereo Mixer'
  Item0: 'Mic'
Simple mixer control 'Internal Mic',0
  Capabilities: pvolume pswitch penum
  Playback channels: Front Left - Front Right
  Limits: Playback 0 - 31
  Mono:
  Front Left: Playback 0 [0%] [-34.50dB] [off]
  Front Right: Playback 0 [0%] [-34.50dB] [off]
Simple mixer control 'Internal Mic Boost',0
  Capabilities: volume penum
  Playback channels: Front Left - Front Right
  Capture channels: Front Left - Front Right
  Limits: 0 - 3
  Front Left: 2 [67%] [20.50dB]
  Front Right: 2 [67%] [20.50dB]
Simple mixer control 'Loopback Mixing',0
  Capabilities: enum
  Items: 'Disabled' 'Enabled'
  Item0: 'Disabled'


!!Alsactl output
!!-------------

--startcollapse--
state.PCH {
	control.1 {
		iface MIXER
		name 'Speaker Playback Switch'
		value.0 true
		value.1 true
		comment {
			access 'read write'
			type BOOLEAN
			count 2
		}
	}
	control.2 {
		iface MIXER
		name 'PCM Loopback Playback Volume'
		value.0 31
		value.1 31
		comment {
			access 'read write'
			type INTEGER
			count 2
			range '0 - 31'
			dbmin -3450
			dbmax 1200
			dbvalue.0 1200
			dbvalue.1 1200
		}
	}
	control.3 {
		iface MIXER
		name 'PCM Loopback Playback Switch'
		value.0 true
		value.1 true
		comment {
			access 'read write'
			type BOOLEAN
			count 2
		}
	}
	control.4 {
		iface MIXER
		name 'Headphone Playback Volume'
		value.0 42
		value.1 42
		comment {
			access 'read write'
			type INTEGER
			count 2
			range '0 - 42'
			dbmin -6300
			dbmax 0
			dbvalue.0 0
			dbvalue.1 0
		}
	}
	control.5 {
		iface MIXER
		name 'Headphone Playback Switch'
		value.0 true
		value.1 true
		comment {
			access 'read write'
			type BOOLEAN
			count 2
		}
	}
	control.6 {
		iface MIXER
		name 'Loopback Mixing'
		value Disabled
		comment {
			access 'read write'
			type ENUMERATED
			count 1
			item.0 Disabled
			item.1 Enabled
		}
	}
	control.7 {
		iface MIXER
		name 'Capture Volume'
		value.0 24
		value.1 24
		comment {
			access 'read write'
			type INTEGER
			count 2
			range '0 - 31'
			dbmin -1650
			dbmax 3000
			dbvalue.0 1950
			dbvalue.1 1950
		}
	}
	control.8 {
		iface MIXER
		name 'Capture Switch'
		value.0 true
		value.1 true
		comment {
			access 'read write'
			type BOOLEAN
			count 2
		}
	}
	control.9 {
		iface MIXER
		name 'Capture Volume'
		index 1
		value.0 24
		value.1 24
		comment {
			access 'read write'
			type INTEGER
			count 2
			range '0 - 31'
			dbmin -1650
			dbmax 3000
			dbvalue.0 1950
			dbvalue.1 1950
		}
	}
	control.10 {
		iface MIXER
		name 'Capture Switch'
		index 1
		value.0 false
		value.1 false
		comment {
			access 'read write'
			type BOOLEAN
			count 2
		}
	}
	control.11 {
		iface MIXER
		name 'Input Source'
		value 'Internal Mic'
		comment {
			access 'read write'
			type ENUMERATED
			count 1
			item.0 'Internal Mic'
			item.1 Mic
			item.2 'Stereo Mixer'
		}
	}
	control.12 {
		iface MIXER
		name 'Input Source'
		index 1
		value Mic
		comment {
			access 'read write'
			type ENUMERATED
			count 1
			item.0 'Internal Mic'
			item.1 Mic
			item.2 'Stereo Mixer'
		}
	}
	control.13 {
		iface MIXER
		name 'Internal Mic Playback Volume'
		value.0 0
		value.1 0
		comment {
			access 'read write'
			type INTEGER
			count 2
			range '0 - 31'
			dbmin -3450
			dbmax 1200
			dbvalue.0 -3450
			dbvalue.1 -3450
		}
	}
	control.14 {
		iface MIXER
		name 'Internal Mic Playback Switch'
		value.0 false
		value.1 false
		comment {
			access 'read write'
			type BOOLEAN
			count 2
		}
	}
	control.15 {
		iface MIXER
		name 'Mic Playback Volume'
		value.0 0
		value.1 0
		comment {
			access 'read write'
			type INTEGER
			count 2
			range '0 - 31'
			dbmin -3450
			dbmax 1200
			dbvalue.0 -3450
			dbvalue.1 -3450
		}
	}
	control.16 {
		iface MIXER
		name 'Mic Playback Switch'
		value.0 false
		value.1 false
		comment {
			access 'read write'
			type BOOLEAN
			count 2
		}
	}
	control.17 {
		iface MIXER
		name 'Internal Mic Boost Volume'
		value.0 2
		value.1 2
		comment {
			access 'read write'
			type INTEGER
			count 2
			range '0 - 3'
			dbmin 0
			dbmax 3075
			dbvalue.0 2050
			dbvalue.1 2050
		}
	}
	control.18 {
		iface MIXER
		name 'Mic Boost Volume'
		value.0 2
		value.1 2
		comment {
			access 'read write'
			type INTEGER
			count 2
			range '0 - 3'
			dbmin 0
			dbmax 3075
			dbvalue.0 2050
			dbvalue.1 2050
		}
	}
	control.19 {
		iface MIXER
		name 'Independent HP'
		value OFF
		comment {
			access 'read write'
			type ENUMERATED
			count 1
			item.0 OFF
			item.1 ON
		}
	}
	control.20 {
		iface MIXER
		name 'Dynamic Power-Control'
		value Enabled
		comment {
			access 'read write'
			type ENUMERATED
			count 1
			item.0 Disabled
			item.1 Enabled
		}
	}
	control.21 {
		iface MIXER
		name 'IEC958 Playback Con Mask'
		value '0fff000000000000000000000000000000000000000000000000000000000000000000000000000000000000000000000000000000000000000000000000000000000000000000000000000000000000000000000000000000000000000000000000000000000000000000000000000000000000000000000000000000000000000000000000000000000000000000000000000000000000000000000000000000000000000000000000000000000000'
		comment {
			access read
			type IEC958
			count 1
		}
	}
	control.22 {
		iface MIXER
		name 'IEC958 Playback Pro Mask'
		value '0f00000000000000000000000000000000000000000000000000000000000000000000000000000000000000000000000000000000000000000000000000000000000000000000000000000000000000000000000000000000000000000000000000000000000000000000000000000000000000000000000000000000000000000000000000000000000000000000000000000000000000000000000000000000000000000000000000000000000000'
		comment {
			access read
			type IEC958
			count 1
		}
	}
	control.23 {
		iface MIXER
		name 'IEC958 Playback Default'
		value '0400000000000000000000000000000000000000000000000000000000000000000000000000000000000000000000000000000000000000000000000000000000000000000000000000000000000000000000000000000000000000000000000000000000000000000000000000000000000000000000000000000000000000000000000000000000000000000000000000000000000000000000000000000000000000000000000000000000000000'
		comment {
			access 'read write'
			type IEC958
			count 1
		}
	}
	control.24 {
		iface MIXER
		name 'IEC958 Playback Switch'
		value true
		comment {
			access 'read write'
			type BOOLEAN
			count 1
		}
	}
	control.25 {
		iface MIXER
		name 'IEC958 Default PCM Playback Switch'
		value true
		comment {
			access 'read write'
			type BOOLEAN
			count 1
		}
	}
	control.26 {
		iface MIXER
		name 'Master Playback Volume'
		value 24
		comment {
			access 'read write'
			type INTEGER
			count 1
			range '0 - 42'
			dbmin -6300
			dbmax 0
			dbvalue.0 -2700
		}
	}
	control.27 {
		iface MIXER
		name 'Master Playback Switch'
		value true
		comment {
			access 'read write'
			type BOOLEAN
			count 1
		}
	}
	control.28 {
		iface MIXER
		name 'IEC958 Playback Con Mask'
		index 1
		value '0fff000000000000000000000000000000000000000000000000000000000000000000000000000000000000000000000000000000000000000000000000000000000000000000000000000000000000000000000000000000000000000000000000000000000000000000000000000000000000000000000000000000000000000000000000000000000000000000000000000000000000000000000000000000000000000000000000000000000000'
		comment {
			access read
			type IEC958
			count 1
		}
	}
	control.29 {
		iface MIXER
		name 'IEC958 Playback Pro Mask'
		index 1
		value '0f00000000000000000000000000000000000000000000000000000000000000000000000000000000000000000000000000000000000000000000000000000000000000000000000000000000000000000000000000000000000000000000000000000000000000000000000000000000000000000000000000000000000000000000000000000000000000000000000000000000000000000000000000000000000000000000000000000000000000'
		comment {
			access read
			type IEC958
			count 1
		}
	}
	control.30 {
		iface MIXER
		name 'IEC958 Playback Default'
		index 1
		value '0400000000000000000000000000000000000000000000000000000000000000000000000000000000000000000000000000000000000000000000000000000000000000000000000000000000000000000000000000000000000000000000000000000000000000000000000000000000000000000000000000000000000000000000000000000000000000000000000000000000000000000000000000000000000000000000000000000000000000'
		comment {
			access 'read write'
			type IEC958
			count 1
		}
	}
	control.31 {
		iface MIXER
		name 'IEC958 Playback Switch'
		index 1
		value true
		comment {
			access 'read write'
			type BOOLEAN
			count 1
		}
	}
	control.32 {
		iface MIXER
		name 'PCM Playback Volume'
		value.0 255
		value.1 255
		comment {
			access 'read write user'
			type INTEGER
			count 2
			range '0 - 255'
			tlv '0000000100000008ffffec1400000014'
			dbmin -5100
			dbmax 0
			dbvalue.0 0
			dbvalue.1 0
		}
	}
	control.33 {
		iface MIXER
		name 'Digital Capture Volume'
		value.0 0
		value.1 0
		comment {
			access 'read write user'
			type INTEGER
			count 2
			range '0 - 120'
			tlv '0000000100000008fffff44800000032'
			dbmin -3000
			dbmax 3000
			dbvalue.0 -3000
			dbvalue.1 -3000
		}
	}
}
--endcollapse--


!!All Loaded Modules
!!------------------

Module
ip6t_LOG
xt_tcpudp
xt_pkttype
ipt_LOG
xt_limit
af_packet
vboxpci
vboxnetadp
vboxnetflt
vboxdrv
rfcomm
bnep
edd
ip6t_REJECT
nf_conntrack_ipv6
nf_defrag_ipv6
ip6table_raw
xt_NOTRACK
ipt_REJECT
iptable_raw
iptable_filter
ip6table_mangle
nf_conntrack_netbios_ns
nf_conntrack_broadcast
nf_conntrack_ipv4
nf_defrag_ipv4
ip_tables
xt_conntrack
nf_conntrack
ip6table_filter
ip6_tables
x_tables
snd_pcm_oss
snd_mixer_oss
snd_seq
snd_seq_device
coretemp
cpufreq_conservative
cpufreq_userspace
microcode
cpufreq_powersave
acpi_cpufreq
mperf
nls_iso8859_1
nls_cp437
vfat
fat
fuse
reiserfs
dm_mod
uvcvideo
videodev
v4l2_compat_ioctl32
snd_hda_codec_hdmi
ecb
btusb
bluetooth
snd_hda_codec_via
arc4
snd_hda_intel
snd_hda_codec
ath9k
mac80211
snd_hwdep
snd_pcm
snd_timer
ath9k_common
ath9k_hw
snd
ath
soundcore
cfg80211
mei
i2c_i801
snd_page_alloc
iTCO_wdt
sr_mod
cdrom
asus_nb_wmi
asus_wmi
sparse_keymap
pci_hotplug
sg
joydev
atl1c
battery
rfkill
iTCO_vendor_support
serio_raw
pcspkr
ac
i915
nouveau
ttm
drm_kms_helper
drm
i2c_algo_bit
mxm_wmi
wmi
video
button
acpi_call
fan
processor
thermal
thermal_sys


!!Sysfs Files
!!-----------

/sys/class/sound/hwC0D0/init_pin_configs:
0x24 0x90170110
0x25 0x0221401f
0x28 0x422140f0
0x29 0x90a701f0
0x2a 0x418130f0
0x2b 0x01a190f0
0x2d 0x074411f0
0x30 0x50a601f0
0x33 0x501701f0

/sys/class/sound/hwC0D0/driver_pin_configs:

/sys/class/sound/hwC0D0/user_pin_configs:

/sys/class/sound/hwC0D0/init_verbs:

/sys/class/sound/hwC0D3/init_pin_configs:
0x05 0x58560010
0x06 0x18560020
0x07 0x58560030

/sys/class/sound/hwC0D3/driver_pin_configs:

/sys/class/sound/hwC0D3/user_pin_configs:

/sys/class/sound/hwC0D3/init_verbs:


!!ALSA/HDA dmesg
!!------------------

[    8.769969] ath9k 0000:03:00.0: setting latency timer to 64
[    8.788804] snd_hda_intel 0000:00:1b.0: PCI INT A -> GSI 22 (level, low) -> IRQ 22
[    8.788862] snd_hda_intel 0000:00:1b.0: irq 43 for MSI/MSI-X
[    8.788886] snd_hda_intel 0000:00:1b.0: setting latency timer to 64
[    8.820214] ath: EEPROM regdomain: 0x60
--
[    8.849345] ieee80211 phy0: Atheros AR9285 Rev:2 mem=0xffffc90005800000, irq=17
[    9.337454] ALSA hda_codec.c:4877 autoconfig: line_outs=1 (0x24/0x0/0x0/0x0/0x0) type:speaker
[    9.337458] ALSA hda_codec.c:4881    speaker_outs=0 (0x0/0x0/0x0/0x0/0x0)
[    9.337460] ALSA hda_codec.c:4885    hp_outs=1 (0x25/0x0/0x0/0x0/0x0)
[    9.337462] ALSA hda_codec.c:4886    mono: mono_out=0x0
[    9.337464] ALSA hda_codec.c:4889    dig-out=0x2d/0x0
[    9.337465] ALSA hda_codec.c:4890    inputs:
[    9.337467] ALSA hda_codec.c:4894  Internal Mic=0x29
[    9.337469] ALSA hda_codec.c:4894  Mic=0x2b
[    9.337471] ALSA hda_codec.c:4896 
[    9.387737] Bluetooth: Core ver 2.16
--
[    9.760155] usbcore: registered new interface driver btusb
[    9.766433] HDMI status: Codec=3 Pin=6 Presence_Detect=0 ELD_Valid=0
[    9.770434] input: HDA Intel PCH HDMI/DP as /devices/pci0000:00/0000:00:1b.0/sound/card0/input10
[    9.871171] Linux video capture interface: v2.00


