upload=true&script=true&cardinfo=
!!################################
!!ALSA Information Script v 0.4.60
!!################################

!!Script ran on: Sat Jun  4 11:38:36 UTC 2011


!!Linux Distribution
!!------------------

Gentoo Base System release 2.0.2


!!DMI Information
!!---------------

Manufacturer:      System manufacturer
Product Name:      System Product Name
Product Version:   System Version


!!Kernel Information
!!------------------

Kernel release:    2.6.39.1
Operating System:  GNU/Linux
Architecture:      x86_64
Processor:         AMD Phenom(tm) II X6 1090T Processor
SMP Enabled:       Yes


!!ALSA Version
!!------------

Driver version:     1.0.24
Library version:    1.0.24.1
Utilities version:  1.0.24.2


!!Loaded ALSA modules
!!-------------------

snd_usb_audio
snd_hda_intel
snd_hda_intel


!!Sound Servers on this system
!!----------------------------

Pulseaudio:
      Installed - Yes (/usr/bin/pulseaudio)
      Running - No

ESound Daemon:
      Installed - Yes (/usr/bin/esd)
      Running - No

Jack:
      Installed - Yes (/usr/bin/jackd)
      Running - No


!!Soundcards recognised by ALSA
!!-----------------------------

 0 [CameraB404271  ]: USB-Audio - USB Camera-B4.04.27.1
                      OmniVision Technologies, Inc. USB Camera-B4.04.27.1 at 
usb-0000:00:12.2-3, high
 1 [SB             ]: HDA-Intel - HDA ATI SB
                      HDA ATI SB at 0xfcaf8000 irq 16
 2 [NVidia         ]: HDA-Intel - HDA NVidia
                      HDA NVidia at 0xfe97c000 irq 25


!!PCI Soundcards installed in the system
!!--------------------------------------

00:14.2 Audio device: ATI Technologies Inc SBx00 Azalia (Intel HDA) (rev 40)
01:06.0 Multimedia video controller: Brooktree Corporation Bt878 Video Capture 
(rev 11)
01:06.1 Multimedia controller: Brooktree Corporation Bt878 Audio Capture (rev 
11)
08:00.1 Audio device: nVidia Corporation Device 0bea (rev a1)


!!Advanced information - PCI Vendor/Device/Subsystem ID's
!!--------------------------------------------------------

00:14.2 0403: 1002:4383 (rev 40)
        Subsystem: 1043:8410
--
08:00.1 0403: 10de:0bea (rev a1)
        Subsystem: 1462:2304


!!Loaded sound module options
!!--------------------------

!!Module: snd_usb_audio
        async_unlink : Y
        device_setup : 0,0,0,0,0,0,0,0
        enable : Y,Y,Y,Y,Y,Y,Y,Y
        id : (null),(null),(null),(null),(null),(null),(null),(null)
        ignore_ctl_error : N
        index : -1,-1,-1,-1,-1,-1,-1,-1
        nrpacks : 8
        pid : -1,-1,-1,-1,-1,-1,-1,-1
        vid : -1,-1,-1,-1,-1,-1,-1,-1

!!Module: snd_hda_intel
        bdl_pos_adj : 32,32,-1,-1,-1,-1,-1,-1
        beep_mode : 2,2,2,2,2,2,2,2
        enable : Y,Y,Y,Y,Y,Y,Y,Y
        enable_msi : -1
        id : (null),(null),(null),(null),(null),(null),(null),(null)
        index : -1,-1,-1,-1,-1,-1,-1,-1
        model : (null),(null),(null),(null),(null),(null),(null),(null)
        patch : (null),(null),(null),(null),(null),(null),(null),(null)
        position_fix : 0,0,0,0,0,0,0,0
        probe_mask : -1,-1,-1,-1,-1,-1,-1,-1
        probe_only : 0,0,0,0,0,0,0,0
        single_cmd : N

!!Module: snd_hda_intel
        bdl_pos_adj : 32,32,-1,-1,-1,-1,-1,-1
        beep_mode : 2,2,2,2,2,2,2,2
        enable : Y,Y,Y,Y,Y,Y,Y,Y
        enable_msi : -1
        id : (null),(null),(null),(null),(null),(null),(null),(null)
        index : -1,-1,-1,-1,-1,-1,-1,-1
        model : (null),(null),(null),(null),(null),(null),(null),(null)
        patch : (null),(null),(null),(null),(null),(null),(null),(null)
        position_fix : 0,0,0,0,0,0,0,0
        probe_mask : -1,-1,-1,-1,-1,-1,-1,-1
        probe_only : 0,0,0,0,0,0,0,0
        single_cmd : N


!!HDA-Intel Codec information
!!---------------------------
--startcollapse--

Codec: VIA VT2020
Address: 0
AFG Function Id: 0x1 (unsol 0)
Vendor Id: 0x11060441
Subsystem Id: 0x104383e4
Revision Id: 0x100100
No Modem Function Group found
Default PCM:
    rates [0x0]:
    bits [0x0]:
    formats [0x0]:
Default Amp-In caps: N/A
Default Amp-Out caps: N/A
GPIO: io=1, o=0, i=0, unsolicited=1, wake=0
  IO[0]: enable=0, dir=0, wake=0, sticky=0, data=0, unsol=0
Node 0x08 [Audio Output] wcaps 0x41d: Stereo Amp-Out
  Control: name="Front Playback Volume", index=0, device=0
    ControlAmp: chs=3, dir=Out, idx=0, ofs=0
  Device: name="VT2020 Analog", type="Audio", device=0
  Amp-Out caps: ofs=0x2a, nsteps=0x2a, stepsize=0x05, mute=0
  Amp-Out vals:  [0x23 0x23]
  Converter: stream=0, channel=0
  PCM:
    rates [0x5e0]: 44100 48000 88200 96000 192000
    bits [0xe]: 16 20 24
    formats [0x1]: PCM
  Power states:  D0 D1 D2 D3
  Power: setting=D0, actual=D0
Node 0x09 [Audio Output] wcaps 0x41d: Stereo Amp-Out
  Control: name="Surround Playback Volume", index=0, device=0
    ControlAmp: chs=3, dir=Out, idx=0, ofs=0
  Amp-Out caps: ofs=0x2a, nsteps=0x2a, stepsize=0x05, mute=0
  Amp-Out vals:  [0x2a 0x2a]
  Converter: stream=0, channel=0
  PCM:
    rates [0x5e0]: 44100 48000 88200 96000 192000
    bits [0xe]: 16 20 24
    formats [0x1]: PCM
  Power states:  D0 D1 D2 D3
  Power: setting=D0, actual=D0
Node 0x0a [Audio Output] wcaps 0x41d: Stereo Amp-Out
  Control: name="Center Playback Volume", index=0, device=0
    ControlAmp: chs=1, dir=Out, idx=0, ofs=0
  Control: name="LFE Playback Volume", index=0, device=0
    ControlAmp: chs=2, dir=Out, idx=0, ofs=0
  Amp-Out caps: ofs=0x2a, nsteps=0x2a, stepsize=0x05, mute=0
  Amp-Out vals:  [0x2a 0x2a]
  Converter: stream=0, channel=0
  PCM:
    rates [0x5e0]: 44100 48000 88200 96000 192000
    bits [0xe]: 16 20 24
    formats [0x1]: PCM
  Power states:  D0 D1 D2 D3
  Power: setting=D3, actual=D3
Node 0x0b [Audio Output] wcaps 0x41d: Stereo Amp-Out
  Control: name="Side Playback Volume", index=0, device=0
    ControlAmp: chs=3, dir=Out, idx=0, ofs=0
  Amp-Out caps: ofs=0x2a, nsteps=0x2a, stepsize=0x05, mute=0
  Amp-Out vals:  [0x2a 0x2a]
  Converter: stream=0, channel=0
  PCM:
    rates [0x5e0]: 44100 48000 88200 96000 192000
    bits [0xe]: 16 20 24
    formats [0x1]: PCM
  Power states:  D0 D1 D2 D3
  Power: setting=D3, actual=D3
Node 0x0c [Audio Output] wcaps 0x41d: Stereo Amp-Out
  Control: name="Headphone Playback Volume", index=0, device=0
    ControlAmp: chs=3, dir=Out, idx=0, ofs=0
  Amp-Out caps: ofs=0x2a, nsteps=0x2a, stepsize=0x05, mute=0
  Amp-Out vals:  [0x2a 0x2a]
  Converter: stream=0, channel=0
  PCM:
    rates [0x5e0]: 44100 48000 88200 96000 192000
    bits [0xe]: 16 20 24
    formats [0x1]: PCM
  Power states:  D0 D1 D2 D3
  Power: setting=D3, actual=D3
Node 0x0d [Vendor Defined Widget] wcaps 0xf00000: Mono
Node 0x0e [Audio Output] wcaps 0x611: Stereo Digital
  Control: name="IEC958 Playback Con Mask", index=0, device=0
  Control: name="IEC958 Playback Pro Mask", index=0, device=0
  Control: name="IEC958 Playback Default", index=0, device=0
  Control: name="IEC958 Playback Switch", index=0, device=0
  Control: name="IEC958 Default PCM Playback Switch", index=0, device=0
  Device: name="VT2020 Digital", type="SPDIF", device=1
  Converter: stream=0, channel=0
  Digital: Enabled
  Digital category: 0x0
  PCM:
    rates [0x5e0]: 44100 48000 88200 96000 192000
    bits [0xe]: 16 20 24
    formats [0x1]: PCM
  Power states:  D0 D1 D2 D3
  Power: setting=D0, actual=D0
Node 0x0f [Audio Output] wcaps 0x611: Stereo Digital
  Converter: stream=8, channel=0
  Digital: Enabled
  Digital category: 0x0
  PCM:
    rates [0x5e0]: 44100 48000 88200 96000 192000
    bits [0xe]: 16 20 24
    formats [0x1]: PCM
  Power states:  D0 D1 D2 D3
  Power: setting=D0, actual=D0
Node 0x10 [Audio Input] wcaps 0x10051b: Stereo Amp-In
  Control: name="Capture Volume", index=0, device=0
    ControlAmp: chs=3, dir=In, idx=0, ofs=0
  Control: name="Capture Switch", index=0, device=0
    ControlAmp: chs=3, dir=In, idx=0, ofs=0
  Device: name="VT2020 Analog", type="Audio", device=0
  Amp-In caps: ofs=0x0b, nsteps=0x1f, stepsize=0x05, mute=1
  Amp-In vals:  [0x1c 0x1c]
  Converter: stream=1, channel=0
  SDI-Select: 0
  PCM:
    rates [0x560]: 44100 48000 96000 192000
    bits [0xe]: 16 20 24
    formats [0x1]: PCM
  Power states:  D0 D1 D2 D3
  Power: setting=D3, actual=D3
  Connection: 1
     0x1e
Node 0x11 [Audio Input] wcaps 0x10051b: Stereo Amp-In
  Control: name="Capture Volume", index=1, device=0
    ControlAmp: chs=3, dir=In, idx=0, ofs=0
  Control: name="Capture Switch", index=1, device=0
    ControlAmp: chs=3, dir=In, idx=0, ofs=0
  Amp-In caps: ofs=0x0b, nsteps=0x1f, stepsize=0x05, mute=1
  Amp-In vals:  [0x1c 0x1c]
  Converter: stream=0, channel=0
  SDI-Select: 0
  PCM:
    rates [0x560]: 44100 48000 96000 192000
    bits [0xe]: 16 20 24
    formats [0x1]: PCM
  Power states:  D0 D1 D2 D3
  Power: setting=D3, actual=D3
  Connection: 1
     0x1f
Node 0x12 [Vendor Defined Widget] wcaps 0xf00000: Mono
Node 0x13 [Audio Input] wcaps 0x100711: Stereo Digital
  Converter: stream=0, channel=0
  SDI-Select: 0
  Digital:
  Digital category: 0x0
  PCM:
    rates [0x1f0]: 32000 44100 48000 88200 96000
    bits [0xe]: 16 20 24
    formats [0x1]: PCM
  Power states:  D0 D1 D2 D3
  Power: setting=D0, actual=D0
  Connection: 1
     0x2f
Node 0x14 [Vendor Defined Widget] wcaps 0xf00000: Mono
Node 0x15 [Vendor Defined Widget] wcaps 0xf00000: Mono
Node 0x16 [Vendor Defined Widget] wcaps 0xf00000: Mono
Node 0x17 [Vendor Defined Widget] wcaps 0xf00000: Mono
Node 0x18 [Audio Mixer] wcaps 0x20050b: Stereo Amp-In
  Amp-In caps: ofs=0x00, nsteps=0x00, stepsize=0x00, mute=1
  Amp-In vals:  [0x00 0x00] [0x00 0x00]
  Power states:  D0 D1 D2 D3
  Power: setting=D0, actual=D0
  Connection: 2
     0x08 0x21
Node 0x19 [Audio Mixer] wcaps 0x20050b: Stereo Amp-In
  Amp-In caps: ofs=0x00, nsteps=0x00, stepsize=0x00, mute=1
  Amp-In vals:  [0x00 0x00] [0x80 0x80]
  Power states:  D0 D1 D2 D3
  Power: setting=D0, actual=D0
  Connection: 2
     0x09 0x21
Node 0x1a [Audio Mixer] wcaps 0x20050b: Stereo Amp-In
  Amp-In caps: ofs=0x00, nsteps=0x00, stepsize=0x00, mute=1
  Amp-In vals:  [0x00 0x00] [0x80 0x80]
  Power states:  D0 D1 D2 D3
  Power: setting=D3, actual=D3
  Connection: 2
     0x0b 0x21
Node 0x1b [Audio Mixer] wcaps 0x20050b: Stereo Amp-In
  Amp-In caps: ofs=0x00, nsteps=0x00, stepsize=0x00, mute=1
  Amp-In vals:  [0x00 0x00] [0x00 0x00]
  Power states:  D0 D1 D2 D3
  Power: setting=D3, actual=D3
  Connection: 2
     0x34 0x21
Node 0x1c [Audio Mixer] wcaps 0x20050b: Stereo Amp-In
  Amp-In caps: ofs=0x00, nsteps=0x00, stepsize=0x00, mute=1
  Amp-In vals:  [0x00 0x00] [0x80 0x80]
  Power states:  D0 D1 D2 D3
  Power: setting=D0, actual=D0
  Connection: 2
     0x35 0x21
Node 0x1d [Vendor Defined Widget] wcaps 0xf00000: Mono
Node 0x1e [Audio Selector] wcaps 0x300501: Stereo
  Control: name="Input Source", index=0, device=0
  Power states:  D0 D1 D2 D3
  Power: setting=D3, actual=D3
  Connection: 6
     0x2c 0x2b 0x2a 0x29* 0x28 0x21
Node 0x1f [Audio Selector] wcaps 0x300501: Stereo
  Control: name="Input Source", index=1, device=0
  Power states:  D0 D1 D2 D3
  Power: setting=D3, actual=D3
  Connection: 6
     0x2c 0x2b* 0x2a 0x29 0x28 0x21
Node 0x20 [Vendor Defined Widget] wcaps 0xf00000: Mono
Node 0x21 [Audio Mixer] wcaps 0x20050b: Stereo Amp-In
  Control: name="Front Mic Playback Volume", index=0, device=0
    ControlAmp: chs=3, dir=In, idx=3, ofs=0
  Control: name="Front Mic Playback Switch", index=0, device=0
    ControlAmp: chs=3, dir=In, idx=3, ofs=0
  Control: name="Rear Mic Playback Volume", index=0, device=0
    ControlAmp: chs=3, dir=In, idx=1, ofs=0
  Control: name="Rear Mic Playback Switch", index=0, device=0
    ControlAmp: chs=3, dir=In, idx=1, ofs=0
  Control: name="Line Playback Volume", index=0, device=0
    ControlAmp: chs=3, dir=In, idx=2, ofs=0
  Control: name="Line Playback Switch", index=0, device=0
    ControlAmp: chs=3, dir=In, idx=2, ofs=0
  Amp-In caps: ofs=0x17, nsteps=0x1f, stepsize=0x05, mute=1
  Amp-In vals:  [0x80 0x80] [0x80 0x80] [0x80 0x80] [0x1c 0x1c] [0x97 0x97]
  Power states:  D0 D1 D2 D3
  Power: setting=D0, actual=D0
  Connection: 5
     0x2c 0x2b 0x2a 0x29 0x28
Node 0x22 [Beep Generator Widget] wcaps 0x70040c: Mono Amp-Out
  Amp-Out caps: ofs=0x0a, nsteps=0x12, stepsize=0x05, mute=1
  Amp-Out vals:  [0x00]
  Power states:  D0 D1 D2 D3
  Power: setting=D0, actual=D0
Node 0x23 [Vendor Defined Widget] wcaps 0xf00000: Mono
Node 0x24 [Pin Complex] wcaps 0x40058d: Stereo Amp-Out
  Control: name="Front Playback Switch", index=0, device=0
    ControlAmp: chs=3, dir=Out, idx=0, ofs=0
  Amp-Out caps: ofs=0x00, nsteps=0x00, stepsize=0x00, mute=1
  Amp-Out vals:  [0x00 0x00]
  Pincap 0x0001001c: OUT HP EAPD Detect
  EAPD 0x2: EAPD
  Pin Default 0x01014010: [Jack] Line Out at Ext Rear
    Conn = 1/8, Color = Green
    DefAssociation = 0x1, Sequence = 0x0
  Pin-ctls: 0x40: OUT
  Unsolicited: tag=04, enabled=1
  Power states:  D0 D1 D2 D3
  Power: setting=D0, actual=D0
  Connection: 1
     0x18
Node 0x25 [Pin Complex] wcaps 0x40058d: Stereo Amp-Out
  Control: name="Surround Playback Switch", index=0, device=0
    ControlAmp: chs=3, dir=Out, idx=0, ofs=0
  Amp-Out caps: ofs=0x00, nsteps=0x00, stepsize=0x00, mute=1
  Amp-Out vals:  [0x00 0x00]
  Pincap 0x0000001c: OUT HP Detect
  Pin Default 0x01011012: [Jack] Line Out at Ext Rear
    Conn = 1/8, Color = Black
    DefAssociation = 0x1, Sequence = 0x2
  Pin-ctls: 0x40: OUT
  Unsolicited: tag=04, enabled=1
  Power states:  D0 D1 D2 D3
  Power: setting=D3, actual=D3
  Connection: 1
     0x19
Node 0x26 [Pin Complex] wcaps 0x40058d: Stereo Amp-Out
  Control: name="Center Playback Switch", index=0, device=0
    ControlAmp: chs=1, dir=Out, idx=0, ofs=0
  Control: name="LFE Playback Switch", index=0, device=0
    ControlAmp: chs=2, dir=Out, idx=0, ofs=0
  Amp-Out caps: ofs=0x00, nsteps=0x00, stepsize=0x00, mute=1
  Amp-Out vals:  [0x00 0x00]
  Pincap 0x00000014: OUT Detect
  Pin Default 0x01016011: [Jack] Line Out at Ext Rear
    Conn = 1/8, Color = Orange
    DefAssociation = 0x1, Sequence = 0x1
  Pin-ctls: 0x40: OUT
  Unsolicited: tag=04, enabled=1
  Power states:  D0 D1 D2 D3
  Power: setting=D3, actual=D3
  Connection: 1
     0x0a
Node 0x27 [Pin Complex] wcaps 0x40058d: Stereo Amp-Out
  Control: name="Side Playback Switch", index=0, device=0
    ControlAmp: chs=3, dir=Out, idx=0, ofs=0
  Amp-Out caps: ofs=0x00, nsteps=0x00, stepsize=0x00, mute=1
  Amp-Out vals:  [0x00 0x00]
  Pincap 0x00000014: OUT Detect
  Pin Default 0x01012014: [Jack] Line Out at Ext Rear
    Conn = 1/8, Color = Grey
    DefAssociation = 0x1, Sequence = 0x4
  Pin-ctls: 0x40: OUT
  Unsolicited: tag=04, enabled=1
  Power states:  D0 D1 D2 D3
  Power: setting=D3, actual=D3
  Connection: 1
     0x1a
Node 0x28 [Pin Complex] wcaps 0x40058d: Stereo Amp-Out
  Control: name="Headphone Playback Switch", index=0, device=0
    ControlAmp: chs=3, dir=Out, idx=0, ofs=0
  Amp-Out caps: ofs=0x00, nsteps=0x00, stepsize=0x00, mute=1
  Amp-Out vals:  [0x00 0x00]
  Pincap 0x0000233c: IN OUT HP Detect
    Vref caps: HIZ 50 100
  Pin Default 0x0221401f: [Jack] HP Out at Ext Front
    Conn = 1/8, Color = Green
    DefAssociation = 0x1, Sequence = 0xf
  Pin-ctls: 0xc0: OUT HP VREF_HIZ
  Unsolicited: tag=05, enabled=1
  Power states:  D0 D1 D2 D3
  Power: setting=D3, actual=D3
  Connection: 1
     0x1b
Node 0x29 [Pin Complex] wcaps 0x40058d: Stereo Amp-Out
  Control: name="Front Mic Boost Capture Volume", index=0, device=0
    ControlAmp: chs=3, dir=In, idx=0, ofs=0
  Control: name="Smart 5.1", index=0, device=0
  Amp-Out caps: ofs=0x00, nsteps=0x00, stepsize=0x00, mute=1
  Amp-Out vals:  [0x00 0x00]
  Pincap 0x0000233c: IN OUT HP Detect
    Vref caps: HIZ 50 100
  Pin Default 0x02a19037: [Jack] Mic at Ext Front
    Conn = 1/8, Color = Pink
    DefAssociation = 0x3, Sequence = 0x7
  Pin-ctls: 0x21: IN VREF_50
  Unsolicited: tag=04, enabled=1
  Power states:  D0 D1 D2 D3
  Power: setting=D3, actual=D3
  Connection: 1
     0x1c
Node 0x2a [Pin Complex] wcaps 0x40058d: Stereo Amp-Out
  Amp-Out caps: ofs=0x00, nsteps=0x00, stepsize=0x00, mute=1
  Amp-Out vals:  [0x00 0x00]
  Pincap 0x00002334: IN OUT Detect
    Vref caps: HIZ 50 100
  Pin Default 0x0181303e: [Jack] Line In at Ext Rear
    Conn = 1/8, Color = Blue
    DefAssociation = 0x3, Sequence = 0xe
  Pin-ctls: 0x20: IN VREF_HIZ
  Unsolicited: tag=04, enabled=1
  Power states:  D0 D1 D2 D3
  Power: setting=D3, actual=D3
  Connection: 2
     0x09* 0x0c
Node 0x2b [Pin Complex] wcaps 0x40058d: Stereo Amp-Out
  Control: name="Mic Boost Capture Volume", index=0, device=0
    ControlAmp: chs=3, dir=In, idx=0, ofs=0
  Amp-Out caps: ofs=0x00, nsteps=0x00, stepsize=0x00, mute=1
  Amp-Out vals:  [0x00 0x00]
  Pincap 0x00002334: IN OUT Detect
    Vref caps: HIZ 50 100
  Pin Default 0x01a19036: [Jack] Mic at Ext Rear
    Conn = 1/8, Color = Pink
    DefAssociation = 0x3, Sequence = 0x6
  Pin-ctls: 0x21: IN VREF_50
  Unsolicited: tag=04, enabled=1
  Power states:  D0 D1 D2 D3
  Power: setting=D3, actual=D3
  Connection: 2
     0x0a* 0x0c
Node 0x2c [Pin Complex] wcaps 0x400401: Stereo
  Pincap 0x00000020: IN
  Pin Default 0x503311f0: [N/A] CD at Int N/A
    Conn = ATAPI, Color = Black
    DefAssociation = 0xf, Sequence = 0x0
    Misc = NO_PRESENCE
  Pin-ctls: 0x00:
  Power states:  D0 D1 D2 D3
  Power: setting=D0, actual=D0
Node 0x2d [Pin Complex] wcaps 0x400701: Stereo Digital
  Pincap 0x00000090: OUT HDMI
  Pin Default 0x185600f0: [Jack] Digital Out at Int HDMI
    Conn = Digital, Color = Unknown
    DefAssociation = 0xf, Sequence = 0x0
  Pin-ctls: 0x40: OUT
  Power states:  D0 D1 D2 D3
  Power: setting=D0, actual=D0
  Connection: 1
     0x0e
Node 0x2e [Pin Complex] wcaps 0x400701: Stereo Digital
  Pincap 0x00000010: OUT
  Pin Default 0x074411f0: [Jack] SPDIF Out at Ext Rear Panel
    Conn = RCA, Color = Black
    DefAssociation = 0xf, Sequence = 0x0
    Misc = NO_PRESENCE
  Pin-ctls: 0x40: OUT
  Power states:  D0 D1 D2 D3
  Power: setting=D0, actual=D0
  Connection: 1
     0x0f
Node 0x2f [Pin Complex] wcaps 0x400601: Stereo Digital
  Pincap 0x00000030: IN OUT
  Pin Default 0x47c421f0: [N/A] SPDIF In at Ext Rear Panel
    Conn = RCA, Color = Grey
    DefAssociation = 0xf, Sequence = 0x0
    Misc = NO_PRESENCE
  Pin-ctls: 0x20: IN
  Power states:  D0 D1 D2 D3
  Power: setting=D0, actual=D0
Node 0x30 [Vendor Defined Widget] wcaps 0xf00000: Mono
Node 0x31 [Vendor Defined Widget] wcaps 0xf00000: Mono
Node 0x32 [Vendor Defined Widget] wcaps 0xf00000: Mono
Node 0x33 [Vendor Defined Widget] wcaps 0xf00000: Mono
Node 0x34 [Audio Selector] wcaps 0x300501: Stereo
  Control: name="Independent HP", index=0, device=0
  Power states:  D0 D1 D2 D3
  Power: setting=D3, actual=D3
  Connection: 3
     0x08 0x0b 0x0c*
Node 0x35 [Audio Selector] wcaps 0x300501: Stereo
  Power states:  D0 D1 D2 D3
  Power: setting=D0, actual=D0
  Connection: 3
     0x08 0x0b* 0x0c
Codec: Nvidia ID 14
Address: 0
AFG Function Id: 0x1 (unsol 0)
Vendor Id: 0x10de0014
Subsystem Id: 0x10de0101
Revision Id: 0x100100
No Modem Function Group found
Default PCM:
    rates [0x0]:
    bits [0x0]:
    formats [0x0]:
Default Amp-In caps: N/A
Default Amp-Out caps: N/A
GPIO: io=0, o=0, i=0, unsolicited=0, wake=0
Node 0x04 [Audio Output] wcaps 0x72b1: 8-Channels Digital Stripe CP
  Converter: stream=0, channel=0
  Digital:
  Digital category: 0x0
  PCM:
    rates [0x7f0]: 32000 44100 48000 88200 96000 176400 192000
    bits [0xe]: 16 20 24
    formats [0x5]: PCM AC3
  Unsolicited: tag=00, enabled=0
Node 0x05 [Pin Complex] wcaps 0x407381: 8-Channels Digital CP
  Pincap 0x09000094: OUT Detect HBR HDMI DP
  Pin Default 0x18560010: [Jack] Digital Out at Int HDMI
    Conn = Digital, Color = Unknown
    DefAssociation = 0x1, Sequence = 0x0
  Pin-ctls: 0x00:
  Unsolicited: tag=00, enabled=0
  Connection: 1
     0x04
Codec: Nvidia ID 14
Address: 1
AFG Function Id: 0x1 (unsol 0)
Vendor Id: 0x10de0014
Subsystem Id: 0x10de0101
Revision Id: 0x100100
No Modem Function Group found
Default PCM:
    rates [0x0]:
    bits [0x0]:
    formats [0x0]:
Default Amp-In caps: N/A
Default Amp-Out caps: N/A
GPIO: io=0, o=0, i=0, unsolicited=0, wake=0
Node 0x04 [Audio Output] wcaps 0x72b1: 8-Channels Digital Stripe CP
  Converter: stream=0, channel=0
  Digital:
  Digital category: 0x0
  PCM:
    rates [0x7f0]: 32000 44100 48000 88200 96000 176400 192000
    bits [0xe]: 16 20 24
    formats [0x5]: PCM AC3
  Unsolicited: tag=00, enabled=0
Node 0x05 [Pin Complex] wcaps 0x407381: 8-Channels Digital CP
  Pincap 0x09000094: OUT Detect HBR HDMI DP
  Pin Default 0x18560010: [Jack] Digital Out at Int HDMI
    Conn = Digital, Color = Unknown
    DefAssociation = 0x1, Sequence = 0x0
  Pin-ctls: 0x00:
  Unsolicited: tag=00, enabled=0
  Connection: 1
     0x04
Codec: Nvidia ID 14
Address: 2
AFG Function Id: 0x1 (unsol 0)
Vendor Id: 0x10de0014
Subsystem Id: 0x10de0101
Revision Id: 0x100100
No Modem Function Group found
Default PCM:
    rates [0x0]:
    bits [0x0]:
    formats [0x0]:
Default Amp-In caps: N/A
Default Amp-Out caps: N/A
GPIO: io=0, o=0, i=0, unsolicited=0, wake=0
Node 0x04 [Audio Output] wcaps 0x72b1: 8-Channels Digital Stripe CP
  Converter: stream=0, channel=0
  Digital:
  Digital category: 0x0
  PCM:
    rates [0x7f0]: 32000 44100 48000 88200 96000 176400 192000
    bits [0xe]: 16 20 24
    formats [0x5]: PCM AC3
  Unsolicited: tag=00, enabled=0
Node 0x05 [Pin Complex] wcaps 0x407381: 8-Channels Digital CP
  Pincap 0x09000094: OUT Detect HBR HDMI DP
  Pin Default 0x18560010: [Jack] Digital Out at Int HDMI
    Conn = Digital, Color = Unknown
    DefAssociation = 0x1, Sequence = 0x0
  Pin-ctls: 0x00:
  Unsolicited: tag=00, enabled=0
  Connection: 1
     0x04
Codec: Nvidia ID 14
Address: 3
AFG Function Id: 0x1 (unsol 0)
Vendor Id: 0x10de0014
Subsystem Id: 0x10de0101
Revision Id: 0x100100
No Modem Function Group found
Default PCM:
    rates [0x0]:
    bits [0x0]:
    formats [0x0]:
Default Amp-In caps: N/A
Default Amp-Out caps: N/A
GPIO: io=0, o=0, i=0, unsolicited=0, wake=0
Node 0x04 [Audio Output] wcaps 0x72b1: 8-Channels Digital Stripe CP
  Converter: stream=0, channel=0
  Digital:
  Digital category: 0x0
  PCM:
    rates [0x7f0]: 32000 44100 48000 88200 96000 176400 192000
    bits [0xe]: 16 20 24
    formats [0x5]: PCM AC3
  Unsolicited: tag=00, enabled=0
Node 0x05 [Pin Complex] wcaps 0x407381: 8-Channels Digital CP
  Pincap 0x09000094: OUT Detect HBR HDMI DP
  Pin Default 0x18560010: [Jack] Digital Out at Int HDMI
    Conn = Digital, Color = Unknown
    DefAssociation = 0x1, Sequence = 0x0
  Pin-ctls: 0x00:
  Unsolicited: tag=00, enabled=0
  Connection: 1
     0x04
--endcollapse--


!!USB Mixer information
!!---------------------------
--startcollapse--

USB Mixer: usb_id=0x14152000, ctrlif=1, ctlerr=0
Card: OmniVision Technologies, Inc. USB Camera-B4.04.27.1 at 
usb-0000:00:12.2-3, high
  Unit: 3
    Control: name="Mic Capture Volume", index=0
    Info: id=3, control=2, cmask=0xf, channels=4, type="S16"
    Volume: min=0, max=1, dBmin=0, dBmax=0
--endcollapse--


!!ALSA Device nodes
!!-----------------

crw-rw---- 1 root audio 116,  0 Jun  4  2011 /dev/snd/controlC0
crw-rw---- 1 root audio 116, 32 Jun  4  2011 /dev/snd/controlC1
crw-rw---- 1 root audio 116, 64 Jun  4  2011 /dev/snd/controlC2
crw-rw---- 1 root audio 116, 36 Jun  4  2011 /dev/snd/hwC1D0
crw-rw---- 1 root audio 116, 68 Jun  4  2011 /dev/snd/hwC2D0
crw-rw---- 1 root audio 116, 69 Jun  4  2011 /dev/snd/hwC2D1
crw-rw---- 1 root audio 116, 70 Jun  4  2011 /dev/snd/hwC2D2
crw-rw---- 1 root audio 116, 71 Jun  4  2011 /dev/snd/hwC2D3
crw-rw---- 1 root audio 116, 24 Jun  4 13:37 /dev/snd/pcmC0D0c
crw-rw---- 1 root audio 116, 56 Jun  4 13:36 /dev/snd/pcmC1D0c
crw-rw---- 1 root audio 116, 48 Jun  4 13:36 /dev/snd/pcmC1D0p
crw-rw---- 1 root audio 116, 49 Jun  4 13:36 /dev/snd/pcmC1D1p
crw-rw---- 1 root audio 116,  1 Jun  4  2011 /dev/snd/seq
crw-rw---- 1 root audio 116, 33 Jun  4  2011 /dev/snd/timer

/dev/snd/by-id:
total 0
drwxr-xr-x 2 root root  60 Jun  4  2011 .
drwxr-xr-x 4 root root 360 Jun  4  2011 ..
lrwxrwxrwx 1 root root  12 Jun  4  2011 
usb-OmniVision_Technologies__Inc._USB_Camera-B4.04.27.1-01 -> ../controlC0

/dev/snd/by-path:
total 0
drwxr-xr-x 2 root root 100 Jun  4  2011 .
drwxr-xr-x 4 root root 360 Jun  4  2011 ..
lrwxrwxrwx 1 root root  12 Jun  4  2011 pci-0000:00:12.2-usb-0:3:1.1 -> 
../controlC0
lrwxrwxrwx 1 root root  12 Jun  4  2011 pci-0000:00:14.2 -> ../controlC1
lrwxrwxrwx 1 root root  12 Jun  4  2011 pci-0000:08:00.1 -> ../controlC2


!!Aplay/Arecord output
!!------------

APLAY

**** List of PLAYBACK Hardware Devices ****
card 1: SB [HDA ATI SB], device 0: VT2020 Analog [VT2020 Analog]
  Subdevices: 2/2
  Subdevice #0: subdevice #0
  Subdevice #1: subdevice #1
card 1: SB [HDA ATI SB], device 1: VT2020 Digital [VT2020 Digital]
  Subdevices: 2/2
  Subdevice #0: subdevice #0
  Subdevice #1: subdevice #1

ARECORD

**** List of CAPTURE Hardware Devices ****
card 0: CameraB404271 [USB Camera-B4.04.27.1], device 0: USB Audio [USB Audio]
  Subdevices: 1/1
  Subdevice #0: subdevice #0
card 1: SB [HDA ATI SB], device 0: VT2020 Analog [VT2020 Analog]
  Subdevices: 2/2
  Subdevice #0: subdevice #0
  Subdevice #1: subdevice #1

!!Amixer output
!!-------------

!!-------Mixer controls for card 0 [CameraB404271]

amixer: Mixer load hw:0 error: Invalid argument
Card hw:0 'CameraB404271'/'OmniVision Technologies, Inc. USB Camera-B4.04.27.1 
at usb-0000:00:12.2-3, high'
  Mixer name    : 'USB Mixer'
  Components    : 'USB1415:2000'
  Controls      : 1
amixer: Mixer hw:0 load error: Invalid argument

!!-------Mixer controls for card 1 [SB]

Card hw:1 'SB'/'HDA ATI SB at 0xfcaf8000 irq 16'
  Mixer name    : 'VIA VT2020'
  Components    : 'HDA:11060441,104383e4,00100100'
  Controls      : 35
  Simple ctrls  : 21
Simple mixer control 'Headphone',0
  Capabilities: pvolume pswitch penum
  Playback channels: Front Left - Front Right
  Limits: Playback 0 - 42
  Mono:
  Front Left: Playback 42 [100%] [0.00dB] [on]
  Front Right: Playback 42 [100%] [0.00dB] [on]
Simple mixer control 'PCM',0
  Capabilities: pvolume penum
  Playback channels: Front Left - Front Right
  Limits: Playback 0 - 255
  Mono:
  Front Left: Playback 250 [98%] [-1.00dB]
  Front Right: Playback 250 [98%] [-1.00dB]
Simple mixer control 'Front',0
  Capabilities: pvolume pswitch penum
  Playback channels: Front Left - Front Right
  Limits: Playback 0 - 42
  Mono:
  Front Left: Playback 35 [83%] [-10.50dB] [on]
  Front Right: Playback 35 [83%] [-10.50dB] [on]
Simple mixer control 'Front Mic',0
  Capabilities: pvolume pswitch penum
  Playback channels: Front Left - Front Right
  Limits: Playback 0 - 31
  Mono:
  Front Left: Playback 28 [90%] [7.50dB] [on]
  Front Right: Playback 28 [90%] [7.50dB] [on]
Simple mixer control 'Front Mic Boost',0
  Capabilities: cvolume penum
  Capture channels: Front Left - Front Right
  Limits: Capture 0 - 3
  Front Left: Capture 2 [67%] [20.50dB]
  Front Right: Capture 2 [67%] [20.50dB]
Simple mixer control 'Surround',0
  Capabilities: pvolume pswitch penum
  Playback channels: Front Left - Front Right
  Limits: Playback 0 - 42
  Mono:
  Front Left: Playback 42 [100%] [0.00dB] [on]
  Front Right: Playback 42 [100%] [0.00dB] [on]
Simple mixer control 'Center',0
  Capabilities: pvolume pvolume-joined pswitch pswitch-joined penum
  Playback channels: Mono
  Limits: Playback 0 - 42
  Mono: Playback 42 [100%] [0.00dB] [on]
Simple mixer control 'LFE',0
  Capabilities: pvolume pvolume-joined pswitch pswitch-joined penum
  Playback channels: Mono
  Limits: Playback 0 - 42
  Mono: Playback 42 [100%] [0.00dB] [on]
Simple mixer control 'Side',0
  Capabilities: pvolume pswitch penum
  Playback channels: Front Left - Front Right
  Limits: Playback 0 - 42
  Mono:
  Front Left: Playback 42 [100%] [0.00dB] [on]
  Front Right: Playback 42 [100%] [0.00dB] [on]
Simple mixer control 'Line',0
  Capabilities: pvolume pswitch penum
  Playback channels: Front Left - Front Right
  Limits: Playback 0 - 31
  Mono:
  Front Left: Playback 0 [0%] [-34.50dB] [off]
  Front Right: Playback 0 [0%] [-34.50dB] [off]
Simple mixer control 'Mic Boost',0
  Capabilities: cvolume penum
  Capture channels: Front Left - Front Right
  Limits: Capture 0 - 3
  Front Left: Capture 2 [67%] [20.50dB]
  Front Right: Capture 2 [67%] [20.50dB]
Simple mixer control 'IEC958',0
  Capabilities: pswitch pswitch-joined penum
  Playback channels: Mono
  Mono: Playback [on]
Simple mixer control 'IEC958 Default PCM',0
  Capabilities: pswitch pswitch-joined penum
  Playback channels: Mono
  Mono: Playback [off]
Simple mixer control 'Capture',0
  Capabilities: cvolume cswitch penum
  Capture channels: Front Left - Front Right
  Limits: Capture 0 - 31
  Front Left: Capture 28 [90%] [25.50dB] [on]
  Front Right: Capture 28 [90%] [25.50dB] [on]
Simple mixer control 'Capture',1
  Capabilities: cvolume cswitch penum
  Capture channels: Front Left - Front Right
  Limits: Capture 0 - 31
  Front Left: Capture 28 [90%] [25.50dB] [on]
  Front Right: Capture 28 [90%] [25.50dB] [on]
Simple mixer control 'Digital',0
  Capabilities: cvolume penum
  Capture channels: Front Left - Front Right
  Limits: Capture 0 - 120
  Front Left: Capture 110 [92%] [25.00dB]
  Front Right: Capture 110 [92%] [25.00dB]
Simple mixer control 'Independent HP',0
  Capabilities: enum
  Items: 'OFF' 'ON'
  Item0: 'ON'
Simple mixer control 'Input Source',0
  Capabilities: cenum
  Items: 'Stereo Mixer' 'Front Mic' 'Rear Mic' 'Line'
  Item0: 'Front Mic'
Simple mixer control 'Input Source',1
  Capabilities: cenum
  Items: 'Stereo Mixer' 'Front Mic' 'Rear Mic' 'Line'
  Item0: 'Stereo Mixer'
Simple mixer control 'Rear Mic',0
  Capabilities: pvolume pswitch penum
  Playback channels: Front Left - Front Right
  Limits: Playback 0 - 31
  Mono:
  Front Left: Playback 0 [0%] [-34.50dB] [off]
  Front Right: Playback 0 [0%] [-34.50dB] [off]
Simple mixer control 'Smart 5.1',0
  Capabilities: pswitch pswitch-joined penum
  Playback channels: Mono
  Mono: Playback [off]

!!-------Mixer controls for card 2 [NVidia]

Card hw:2 'NVidia'/'HDA NVidia at 0xfe97c000 irq 25'
  Mixer name    : ''
  Components    : 'HDA:10de0014,10de0101,00100100'
  Controls      : 0
  Simple ctrls  : 0


!!Alsactl output
!!-------------

--startcollapse--
--endcollapse--


!!All Loaded Modules
!!------------------

Module
snd_seq_dummy
snd_seq_oss
snd_seq_midi_event
snd_seq
snd_pcm_oss
snd_mixer_oss
microcode
snd_hda_codec_via
snd_hda_intel
nvidia
snd_hda_codec
snd_usb_audio
snd_usbmidi_lib
snd_hwdep
snd_pcm
snd_rawmidi
mt352
snd_seq_device
snd_timer
dvb_bt8xx
bt878
8250_pci
snd
bttv
i2c_algo_bit
8250
videobuf_dma_sg
videobuf_core
serial_core
gspca_ov534
gspca_main
pcspkr
asus_atk0110
k10temp
btcx_risc
snd_page_alloc
tveeprom


!!Sysfs Files
!!-----------

/sys/class/sound/hwC1D0/init_pin_configs:
0x24 0x01014010
0x25 0x01011012
0x26 0x01016011
0x27 0x01012014
0x28 0x0221401f
0x29 0x02a19037
0x2a 0x0181303e
0x2b 0x01a19036
0x2c 0x503311f0
0x2d 0x185600f0
0x2e 0x074411f0
0x2f 0x47c421f0

/sys/class/sound/hwC1D0/driver_pin_configs:

/sys/class/sound/hwC1D0/user_pin_configs:

/sys/class/sound/hwC1D0/init_verbs:

/sys/class/sound/hwC2D0/init_pin_configs:
0x05 0x18560010

/sys/class/sound/hwC2D0/driver_pin_configs:

/sys/class/sound/hwC2D0/user_pin_configs:

/sys/class/sound/hwC2D0/init_verbs:

/sys/class/sound/hwC2D1/init_pin_configs:
0x05 0x18560010

/sys/class/sound/hwC2D1/driver_pin_configs:

/sys/class/sound/hwC2D1/user_pin_configs:

/sys/class/sound/hwC2D1/init_verbs:

/sys/class/sound/hwC2D2/init_pin_configs:
0x05 0x18560010

/sys/class/sound/hwC2D2/driver_pin_configs:

/sys/class/sound/hwC2D2/user_pin_configs:

/sys/class/sound/hwC2D2/init_verbs:

/sys/class/sound/hwC2D3/init_pin_configs:
0x05 0x18560010

/sys/class/sound/hwC2D3/driver_pin_configs:

/sys/class/sound/hwC2D3/user_pin_configs:

/sys/class/sound/hwC2D3/init_verbs:


!!ALSA/HDA dmesg
!!------------------

Disabling lock debugging due to kernel taint
HDA Intel 0000:00:14.2: PCI INT A -> GSI 16 (level, low) -> IRQ 16
hda_intel: position_fix set to 1 for device 1043:8410
autoconfig: line_outs=4 (0x24/0x25/0x26/0x27/0x0)
--
   inputs:
hda-codec: no NID for mapping control Independent HP:0:0
HDA Intel 0000:08:00.1: PCI INT B -> GSI 25 (level, low) -> IRQ 25
hda_intel: Disable MSI for Nvidia chipset
HDA Intel 0000:08:00.1: setting latency timer to 64
hda-codec: No codec parser is available
hda-codec: No codec parser is available
hda-codec: No codec parser is available
hda-codec: No codec parser is available
nvidia 0000:08:00.0: PCI INT A -> GSI 24 (level, low) -> IRQ 24
