
!!################################
!!ALSA Information Script v 0.4.59
!!################################

!!Script ran on: Mon Dec 27 13:58:35 UTC 2010


!!Linux Distribution
!!------------------

Fedora release 14 (Laughlin) Fedora release 14 (Laughlin) Fedora release 14 (Laughlin) Fedora release 14 (Laughlin)


!!DMI Information
!!---------------

Manufacturer:      To Be Filled By O.E.M.
Product Name:      To Be Filled By O.E.M.


!!Kernel Information
!!------------------

Kernel release:    2.6.35.10-72.fc14.x86_64
Operating System:  GNU/Linux
Architecture:      x86_64
Processor:         x86_64
SMP Enabled:       Yes


!!ALSA Version
!!------------

Driver version:     1.0.23
Library version:    
Utilities version:  1.0.23


!!Loaded ALSA modules
!!-------------------

snd_hda_intel


!!Sound Servers on this system
!!----------------------------

Pulseaudio:
      Installed - Yes (/usr/bin/pulseaudio)
      Running - Yes

Jack:
      Installed - Yes (/usr/bin/jackd)
      Running - No


!!Soundcards recognised by ALSA
!!-----------------------------

 0 [NVidia         ]: HDA-Intel - HDA NVidia
                      HDA NVidia at 0xfae78000 irq 23


!!PCI Soundcards installed in the system
!!--------------------------------------

00:08.0 Audio device: nVidia Corporation MCP79 High Definition Audio (rev b1)


!!Advanced information - PCI Vendor/Device/Susbsystem ID's
!!--------------------------------------------------------

00:08.0 0403: 10de:0ac0 (rev b1)
	Subsystem: 1849:2520


!!Loaded sound module options
!!--------------------------

!!Module: snd_hda_intel
	bdl_pos_adj : 32,-1,-1,-1,-1,-1,-1,-1,-1,-1,-1,-1,-1,-1,-1,-1,-1,-1,-1,-1,-1,-1,-1,-1,-1,-1,-1,-1,-1,-1,-1,-1
	beep_mode : 0,0,0,0,0,0,0,0,0,0,0,0,0,0,0,0,0,0,0,0,0,0,0,0,0,0,0,0,0,0,0,0
	enable : Y,Y,Y,Y,Y,Y,Y,Y,Y,Y,Y,Y,Y,Y,Y,Y,Y,Y,Y,Y,Y,Y,Y,Y,Y,Y,Y,Y,Y,Y,Y,Y
	enable_msi : -1
	id : (null),(null),(null),(null),(null),(null),(null),(null),(null),(null),(null),(null),(null),(null),(null),(null),(null),(null),(null),(null),(null),(null),(null),(null),(null),(null),(null),(null),(null),(null),(null),(null)
	index : -1,-1,-1,-1,-1,-1,-1,-1,-1,-1,-1,-1,-1,-1,-1,-1,-1,-1,-1,-1,-1,-1,-1,-1,-1,-1,-1,-1,-1,-1,-1,-1
	model : (null),(null),(null),(null),(null),(null),(null),(null),(null),(null),(null),(null),(null),(null),(null),(null),(null),(null),(null),(null),(null),(null),(null),(null),(null),(null),(null),(null),(null),(null),(null),(null)
	patch : (null),(null),(null),(null),(null),(null),(null),(null),(null),(null),(null),(null),(null),(null),(null),(null),(null),(null),(null),(null),(null),(null),(null),(null),(null),(null),(null),(null),(null),(null),(null),(null)
	position_fix : 0,0,0,0,0,0,0,0,0,0,0,0,0,0,0,0,0,0,0,0,0,0,0,0,0,0,0,0,0,0,0,0
	power_save : 0
	power_save_controller : Y
	probe_mask : -1,-1,-1,-1,-1,-1,-1,-1,-1,-1,-1,-1,-1,-1,-1,-1,-1,-1,-1,-1,-1,-1,-1,-1,-1,-1,-1,-1,-1,-1,-1,-1
	probe_only : 0,0,0,0,0,0,0,0,0,0,0,0,0,0,0,0,0,0,0,0,0,0,0,0,0,0,0,0,0,0,0,0
	single_cmd : N


!!HDA-Intel Codec information
!!---------------------------
--startcollapse--

Codec: VIA VT2020
Address: 0
Function Id: 0x1
Vendor Id: 0x11060441
Subsystem Id: 0x18492520
Revision Id: 0x100100
No Modem Function Group found
Default PCM:
    rates [0x0]:
    bits [0x0]:
    formats [0x0]:
Default Amp-In caps: N/A
Default Amp-Out caps: N/A
GPIO: io=1, o=0, i=0, unsolicited=1, wake=0
  IO[0]: enable=0, dir=0, wake=0, sticky=0, data=0, unsol=0
Node 0x08 [Audio Output] wcaps 0x41d: Stereo Amp-Out
  Control: name="Front Playback Volume", index=0, device=0
    ControlAmp: chs=3, dir=Out, idx=0, ofs=0
  Device: name="VT2020 Analog", type="Audio", device=0
  Amp-Out caps: ofs=0x2a, nsteps=0x2a, stepsize=0x05, mute=0
  Amp-Out vals:  [0x2a 0x2a]
  Converter: stream=0, channel=0
  PCM:
    rates [0x5e0]: 44100 48000 88200 96000 192000
    bits [0xe]: 16 20 24
    formats [0x1]: PCM
  Power states:  D0 D1 D2 D3
  Power: setting=D0, actual=D0
Node 0x09 [Audio Output] wcaps 0x41d: Stereo Amp-Out
  Control: name="Surround Playback Volume", index=0, device=0
    ControlAmp: chs=3, dir=Out, idx=0, ofs=0
  Amp-Out caps: ofs=0x2a, nsteps=0x2a, stepsize=0x05, mute=0
  Amp-Out vals:  [0x2a 0x2a]
  Converter: stream=0, channel=0
  PCM:
    rates [0x5e0]: 44100 48000 88200 96000 192000
    bits [0xe]: 16 20 24
    formats [0x1]: PCM
  Power states:  D0 D1 D2 D3
  Power: setting=D0, actual=D0
Node 0x0a [Audio Output] wcaps 0x41d: Stereo Amp-Out
  Control: name="Center Playback Volume", index=0, device=0
    ControlAmp: chs=1, dir=Out, idx=0, ofs=0
  Control: name="LFE Playback Volume", index=0, device=0
    ControlAmp: chs=2, dir=Out, idx=0, ofs=0
  Amp-Out caps: ofs=0x2a, nsteps=0x2a, stepsize=0x05, mute=0
  Amp-Out vals:  [0x2a 0x2a]
  Converter: stream=0, channel=0
  PCM:
    rates [0x5e0]: 44100 48000 88200 96000 192000
    bits [0xe]: 16 20 24
    formats [0x1]: PCM
  Power states:  D0 D1 D2 D3
  Power: setting=D3, actual=D3
Node 0x0b [Audio Output] wcaps 0x41d: Stereo Amp-Out
  Amp-Out caps: ofs=0x2a, nsteps=0x2a, stepsize=0x05, mute=0
  Amp-Out vals:  [0x2a 0x2a]
  Converter: stream=0, channel=0
  PCM:
    rates [0x5e0]: 44100 48000 88200 96000 192000
    bits [0xe]: 16 20 24
    formats [0x1]: PCM
  Power states:  D0 D1 D2 D3
  Power: setting=D3, actual=D3
Node 0x0c [Audio Output] wcaps 0x41d: Stereo Amp-Out
  Control: name="Headphone Playback Volume", index=0, device=0
    ControlAmp: chs=3, dir=Out, idx=0, ofs=0
  Amp-Out caps: ofs=0x2a, nsteps=0x2a, stepsize=0x05, mute=0
  Amp-Out vals:  [0x2a 0x2a]
  Converter: stream=0, channel=0
  PCM:
    rates [0x5e0]: 44100 48000 88200 96000 192000
    bits [0xe]: 16 20 24
    formats [0x1]: PCM
  Power states:  D0 D1 D2 D3
  Power: setting=D0, actual=D0
Node 0x0d [Vendor Defined Widget] wcaps 0xf00000: Mono
Node 0x0e [Audio Output] wcaps 0x611: Stereo Digital
  Control: name="IEC958 Playback Con Mask", index=0, device=0
  Control: name="IEC958 Playback Pro Mask", index=0, device=0
  Control: name="IEC958 Playback Default", index=0, device=0
  Control: name="IEC958 Playback Switch", index=0, device=0
  Control: name="IEC958 Default PCM Playback Switch", index=0, device=0
  Device: name="VT2020 Digital", type="SPDIF", device=1
  Converter: stream=0, channel=0
  Digital: Enabled
  Digital category: 0x0
  PCM:
    rates [0x5e0]: 44100 48000 88200 96000 192000
    bits [0xe]: 16 20 24
    formats [0x1]: PCM
  Power states:  D0 D1 D2 D3
  Power: setting=D0, actual=D0
Node 0x0f [Audio Output] wcaps 0x611: Stereo Digital
  Converter: stream=0, channel=0
  Digital:
  Digital category: 0x0
  PCM:
    rates [0x5e0]: 44100 48000 88200 96000 192000
    bits [0xe]: 16 20 24
    formats [0x1]: PCM
  Power states:  D0 D1 D2 D3
  Power: setting=D0, actual=D0
Node 0x10 [Audio Input] wcaps 0x10051b: Stereo Amp-In
  Control: name="Capture Volume", index=0, device=0
    ControlAmp: chs=3, dir=In, idx=0, ofs=0
  Control: name="Capture Switch", index=0, device=0
    ControlAmp: chs=3, dir=In, idx=0, ofs=0
  Device: name="VT2020 Analog", type="Audio", device=0
  Amp-In caps: ofs=0x0b, nsteps=0x1f, stepsize=0x05, mute=1
  Amp-In vals:  [0x13 0x13]
  Converter: stream=0, channel=0
  SDI-Select: 0
  PCM:
    rates [0x560]: 44100 48000 96000 192000
    bits [0xe]: 16 20 24
    formats [0x1]: PCM
  Power states:  D0 D1 D2 D3
  Power: setting=D0, actual=D0
  Connection: 1
     0x1e
Node 0x11 [Audio Input] wcaps 0x10051b: Stereo Amp-In
  Control: name="Capture Volume", index=1, device=0
    ControlAmp: chs=3, dir=In, idx=0, ofs=0
  Control: name="Capture Switch", index=1, device=0
    ControlAmp: chs=3, dir=In, idx=0, ofs=0
  Amp-In caps: ofs=0x0b, nsteps=0x1f, stepsize=0x05, mute=1
  Amp-In vals:  [0x00 0x00]
  Converter: stream=0, channel=0
  SDI-Select: 0
  PCM:
    rates [0x560]: 44100 48000 96000 192000
    bits [0xe]: 16 20 24
    formats [0x1]: PCM
  Power states:  D0 D1 D2 D3
  Power: setting=D0, actual=D0
  Connection: 1
     0x1f
Node 0x12 [Vendor Defined Widget] wcaps 0xf00000: Mono
Node 0x13 [Audio Input] wcaps 0x100711: Stereo Digital
  Converter: stream=0, channel=0
  SDI-Select: 0
  Digital:
  Digital category: 0x0
  PCM:
    rates [0x1f0]: 32000 44100 48000 88200 96000
    bits [0xe]: 16 20 24
    formats [0x1]: PCM
  Power states:  D0 D1 D2 D3
  Power: setting=D0, actual=D0
  Connection: 1
     0x2f
Node 0x14 [Vendor Defined Widget] wcaps 0xf00000: Mono
Node 0x15 [Vendor Defined Widget] wcaps 0xf00000: Mono
Node 0x16 [Vendor Defined Widget] wcaps 0xf00000: Mono
Node 0x17 [Vendor Defined Widget] wcaps 0xf00000: Mono
Node 0x18 [Audio Mixer] wcaps 0x20050b: Stereo Amp-In
  Amp-In caps: ofs=0x00, nsteps=0x00, stepsize=0x00, mute=1
  Amp-In vals:  [0x00 0x00] [0x00 0x00]
  Power states:  D0 D1 D2 D3
  Power: setting=D0, actual=D0
  Connection: 2
     0x08 0x21
Node 0x19 [Audio Mixer] wcaps 0x20050b: Stereo Amp-In
  Amp-In caps: ofs=0x00, nsteps=0x00, stepsize=0x00, mute=1
  Amp-In vals:  [0x00 0x00] [0x80 0x80]
  Power states:  D0 D1 D2 D3
  Power: setting=D0, actual=D0
  Connection: 2
     0x09 0x21
Node 0x1a [Audio Mixer] wcaps 0x20050b: Stereo Amp-In
  Amp-In caps: ofs=0x00, nsteps=0x00, stepsize=0x00, mute=1
  Amp-In vals:  [0x00 0x00] [0x80 0x80]
  Power states:  D0 D1 D2 D3
  Power: setting=D3, actual=D3
  Connection: 2
     0x0b 0x21
Node 0x1b [Audio Mixer] wcaps 0x20050b: Stereo Amp-In
  Amp-In caps: ofs=0x00, nsteps=0x00, stepsize=0x00, mute=1
  Amp-In vals:  [0x00 0x00] [0x00 0x00]
  Power states:  D0 D1 D2 D3
  Power: setting=D0, actual=D0
  Connection: 2
     0x34 0x21
Node 0x1c [Audio Mixer] wcaps 0x20050b: Stereo Amp-In
  Amp-In caps: ofs=0x00, nsteps=0x00, stepsize=0x00, mute=1
  Amp-In vals:  [0x00 0x00] [0x80 0x80]
  Power states:  D0 D1 D2 D3
  Power: setting=D0, actual=D0
  Connection: 2
     0x35 0x21
Node 0x1d [Vendor Defined Widget] wcaps 0xf00000: Mono
Node 0x1e [Audio Selector] wcaps 0x300501: Stereo
  Control: name="Input Source", index=0, device=0
  Power states:  D0 D1 D2 D3
  Power: setting=D0, actual=D0
  Connection: 6
     0x2c 0x2b 0x2a* 0x29 0x28 0x21
Node 0x1f [Audio Selector] wcaps 0x300501: Stereo
  Control: name="Input Source", index=1, device=0
  Power states:  D0 D1 D2 D3
  Power: setting=D0, actual=D0
  Connection: 6
     0x2c 0x2b* 0x2a 0x29 0x28 0x21
Node 0x20 [Vendor Defined Widget] wcaps 0xf00000: Mono
Node 0x21 [Audio Mixer] wcaps 0x20050b: Stereo Amp-In
  Control: name="Mic Playback Volume", index=0, device=0
    ControlAmp: chs=3, dir=In, idx=1, ofs=0
  Control: name="Mic Playback Switch", index=0, device=0
    ControlAmp: chs=3, dir=In, idx=1, ofs=0
  Control: name="Front Mic Playback Volume", index=0, device=0
    ControlAmp: chs=3, dir=In, idx=3, ofs=0
  Control: name="Front Mic Playback Switch", index=0, device=0
    ControlAmp: chs=3, dir=In, idx=3, ofs=0
  Control: name="Line Playback Volume", index=0, device=0
    ControlAmp: chs=3, dir=In, idx=2, ofs=0
  Control: name="Line Playback Switch", index=0, device=0
    ControlAmp: chs=3, dir=In, idx=2, ofs=0
  Amp-In caps: ofs=0x17, nsteps=0x1f, stepsize=0x05, mute=1
  Amp-In vals:  [0x80 0x80] [0x9f 0x9f] [0x9f 0x9f] [0x1f 0x1f] [0x97 0x97]
  Power states:  D0 D1 D2 D3
  Power: setting=D0, actual=D0
  Connection: 5
     0x2c 0x2b 0x2a 0x29 0x28
Node 0x22 [Beep Generator Widget] wcaps 0x70040c: Mono Amp-Out
  Amp-Out caps: ofs=0x0a, nsteps=0x12, stepsize=0x05, mute=1
  Amp-Out vals:  [0x00]
  Power states:  D0 D1 D2 D3
  Power: setting=D0, actual=D0
Node 0x23 [Vendor Defined Widget] wcaps 0xf00000: Mono
Node 0x24 [Pin Complex] wcaps 0x40058d: Stereo Amp-Out
  Control: name="Front Playback Switch", index=0, device=0
    ControlAmp: chs=3, dir=Out, idx=0, ofs=0
  Amp-Out caps: ofs=0x00, nsteps=0x00, stepsize=0x00, mute=1
  Amp-Out vals:  [0x00 0x00]
  Pincap 0x0001001c: OUT HP EAPD Detect
  EAPD 0x2: EAPD
  Pin Default 0x01014010: [Jack] Line Out at Ext Rear
    Conn = 1/8, Color = Green
    DefAssociation = 0x1, Sequence = 0x0
  Pin-ctls: 0x40: OUT
  Unsolicited: tag=04, enabled=1
  Power states:  D0 D1 D2 D3
  Power: setting=D3, actual=D3
  Connection: 1
     0x18
Node 0x25 [Pin Complex] wcaps 0x40058d: Stereo Amp-Out
  Control: name="Surround Playback Switch", index=0, device=0
    ControlAmp: chs=3, dir=Out, idx=0, ofs=0
  Amp-Out caps: ofs=0x00, nsteps=0x00, stepsize=0x00, mute=1
  Amp-Out vals:  [0x00 0x00]
  Pincap 0x0000001c: OUT HP Detect
  Pin Default 0x01011012: [Jack] Line Out at Ext Rear
    Conn = 1/8, Color = Black
    DefAssociation = 0x1, Sequence = 0x2
  Pin-ctls: 0x40: OUT
  Unsolicited: tag=04, enabled=1
  Power states:  D0 D1 D2 D3
  Power: setting=D3, actual=D3
  Connection: 1
     0x19
Node 0x26 [Pin Complex] wcaps 0x40058d: Stereo Amp-Out
  Control: name="Center Playback Switch", index=0, device=0
    ControlAmp: chs=1, dir=Out, idx=0, ofs=0
  Control: name="LFE Playback Switch", index=0, device=0
    ControlAmp: chs=2, dir=Out, idx=0, ofs=0
  Amp-Out caps: ofs=0x00, nsteps=0x00, stepsize=0x00, mute=1
  Amp-Out vals:  [0x00 0x00]
  Pincap 0x00000014: OUT Detect
  Pin Default 0x01016011: [Jack] Line Out at Ext Rear
    Conn = 1/8, Color = Orange
    DefAssociation = 0x1, Sequence = 0x1
  Pin-ctls: 0x40: OUT
  Unsolicited: tag=04, enabled=1
  Power states:  D0 D1 D2 D3
  Power: setting=D3, actual=D3
  Connection: 1
     0x0a
Node 0x27 [Pin Complex] wcaps 0x40058d: Stereo Amp-Out
  Amp-Out caps: ofs=0x00, nsteps=0x00, stepsize=0x00, mute=1
  Amp-Out vals:  [0x80 0x80]
  Pincap 0x00000014: OUT Detect
  Pin Default 0x410120f0: [N/A] Line Out at Ext Rear
    Conn = 1/8, Color = Grey
    DefAssociation = 0xf, Sequence = 0x0
  Pin-ctls: 0x00:
  Unsolicited: tag=04, enabled=1
  Power states:  D0 D1 D2 D3
  Power: setting=D3, actual=D3
  Connection: 1
     0x1a
Node 0x28 [Pin Complex] wcaps 0x40058d: Stereo Amp-Out
  Control: name="Headphone Playback Switch", index=0, device=0
    ControlAmp: chs=3, dir=Out, idx=0, ofs=0
  Amp-Out caps: ofs=0x00, nsteps=0x00, stepsize=0x00, mute=1
  Amp-Out vals:  [0x00 0x00]
  Pincap 0x0000233c: IN OUT HP Detect
    Vref caps: HIZ 50 100
  Pin Default 0x0221411f: [Jack] HP Out at Ext Front
    Conn = 1/8, Color = Green
    DefAssociation = 0x1, Sequence = 0xf
    Misc = NO_PRESENCE
  Pin-ctls: 0xc0: OUT HP VREF_HIZ
  Unsolicited: tag=05, enabled=1
  Power states:  D0 D1 D2 D3
  Power: setting=D0, actual=D0
  Connection: 1
     0x1b
Node 0x29 [Pin Complex] wcaps 0x40058d: Stereo Amp-Out
  Control: name="Front Mic Boost Capture Volume", index=0, device=0
    ControlAmp: chs=3, dir=In, idx=0, ofs=0
  Control: name="Smart 5.1", index=0, device=0
  Amp-Out caps: ofs=0x00, nsteps=0x00, stepsize=0x00, mute=1
  Amp-Out vals:  [0x00 0x00]
  Pincap 0x0000233c: IN OUT HP Detect
    Vref caps: HIZ 50 100
  Pin Default 0x02a19137: [Jack] Mic at Ext Front
    Conn = 1/8, Color = Pink
    DefAssociation = 0x3, Sequence = 0x7
    Misc = NO_PRESENCE
  Pin-ctls: 0x41: OUT VREF_50
  Unsolicited: tag=04, enabled=1
  Power states:  D0 D1 D2 D3
  Power: setting=D0, actual=D0
  Connection: 1
     0x1c
Node 0x2a [Pin Complex] wcaps 0x40058d: Stereo Amp-Out
  Control: name="Smart 5.1", index=0, device=0
  Amp-Out caps: ofs=0x00, nsteps=0x00, stepsize=0x00, mute=1
  Amp-Out vals:  [0x00 0x00]
  Pincap 0x00002334: IN OUT Detect
    Vref caps: HIZ 50 100
  Pin Default 0x0181303e: [Jack] Line In at Ext Rear
    Conn = 1/8, Color = Blue
    DefAssociation = 0x3, Sequence = 0xe
  Pin-ctls: 0x40: OUT VREF_HIZ
  Unsolicited: tag=04, enabled=1
  Power states:  D0 D1 D2 D3
  Power: setting=D0, actual=D0
  Connection: 2
     0x09* 0x0c
Node 0x2b [Pin Complex] wcaps 0x40058d: Stereo Amp-Out
  Control: name="Mic Boost Capture Volume", index=0, device=0
    ControlAmp: chs=3, dir=In, idx=0, ofs=0
  Control: name="Smart 5.1", index=0, device=0
  Amp-Out caps: ofs=0x00, nsteps=0x00, stepsize=0x00, mute=1
  Amp-Out vals:  [0x00 0x00]
  Pincap 0x00002334: IN OUT Detect
    Vref caps: HIZ 50 100
  Pin Default 0x01a19036: [Jack] Mic at Ext Rear
    Conn = 1/8, Color = Pink
    DefAssociation = 0x3, Sequence = 0x6
  Pin-ctls: 0x41: OUT VREF_50
  Unsolicited: tag=04, enabled=1
  Power states:  D0 D1 D2 D3
  Power: setting=D0, actual=D0
  Connection: 2
     0x0a* 0x0c
Node 0x2c [Pin Complex] wcaps 0x400401: Stereo
  Pincap 0x00000020: IN
  Pin Default 0x593701f8: [N/A] CD at Int ATAPI
    Conn = Analog, Color = Unknown
    DefAssociation = 0xf, Sequence = 0x8
    Misc = NO_PRESENCE
  Pin-ctls: 0x00:
  Power states:  D0 D1 D2 D3
  Power: setting=D0, actual=D0
Node 0x2d [Pin Complex] wcaps 0x400701: Stereo Digital
  Pincap 0x00000010: OUT
  Pin Default 0x074510f0: [Jack] SPDIF Out at Ext Rear Panel
    Conn = Optical, Color = Black
    DefAssociation = 0xf, Sequence = 0x0
  Pin-ctls: 0x40: OUT
  Power states:  D0 D1 D2 D3
  Power: setting=D0, actual=D0
  Connection: 1
     0x0e
Node 0x2e [Pin Complex] wcaps 0x400701: Stereo Digital
  Pincap 0x00000010: OUT
  Pin Default 0x474401f0: [N/A] SPDIF Out at Ext Rear Panel
    Conn = RCA, Color = Unknown
    DefAssociation = 0xf, Sequence = 0x0
    Misc = NO_PRESENCE
  Pin-ctls: 0x40: OUT
  Power states:  D0 D1 D2 D3
  Power: setting=D0, actual=D0
  Connection: 1
     0x0f
Node 0x2f [Pin Complex] wcaps 0x400601: Stereo Digital
  Pincap 0x00000030: IN OUT
  Pin Default 0x47c411f0: [N/A] SPDIF In at Ext Rear Panel
    Conn = RCA, Color = Black
    DefAssociation = 0xf, Sequence = 0x0
    Misc = NO_PRESENCE
  Pin-ctls: 0x20: IN
  Power states:  D0 D1 D2 D3
  Power: setting=D0, actual=D0
Node 0x30 [Vendor Defined Widget] wcaps 0xf00000: Mono
Node 0x31 [Vendor Defined Widget] wcaps 0xf00000: Mono
Node 0x32 [Vendor Defined Widget] wcaps 0xf00000: Mono
Node 0x33 [Vendor Defined Widget] wcaps 0xf00000: Mono
Node 0x34 [Audio Selector] wcaps 0x300501: Stereo
  Power states:  D0 D1 D2 D3
  Power: setting=D0, actual=D0
  Connection: 3
     0x08 0x0b 0x0c*
Node 0x35 [Audio Selector] wcaps 0x300501: Stereo
  Power states:  D0 D1 D2 D3
  Power: setting=D0, actual=D0
  Connection: 3
     0x08 0x0b* 0x0c
Codec: Nvidia MCP79/7A HDMI
Address: 3
Function Id: 0x1
Vendor Id: 0x10de0007
Subsystem Id: 0x10de0101
Revision Id: 0x100100
No Modem Function Group found
Default PCM:
    rates [0x0]:
    bits [0x0]:
    formats [0x0]:
Default Amp-In caps: N/A
Default Amp-Out caps: N/A
GPIO: io=0, o=0, i=0, unsolicited=0, wake=0
Node 0x04 [Audio Output] wcaps 0x211: Stereo Digital
  Control: name="IEC958 Playback Con Mask", index=1, device=0
  Control: name="IEC958 Playback Pro Mask", index=1, device=0
  Control: name="IEC958 Playback Default", index=1, device=0
  Control: name="IEC958 Playback Switch", index=1, device=0
  Device: name="NVIDIA HDMI", type="HDMI", device=3
  Converter: stream=0, channel=0
  Digital: Enabled
  Digital category: 0x0
  PCM:
    rates [0xc0]: 48000 88200
    bits [0xf]: 8 16 20 24
    formats [0x1]: PCM
Node 0x05 [Pin Complex] wcaps 0x400381: Stereo Digital
  Pincap 0x00000014: OUT Detect
  Pin Default 0x18560110: [Jack] Digital Out at Int HDMI
    Conn = Digital, Color = Unknown
    DefAssociation = 0x1, Sequence = 0x0
    Misc = NO_PRESENCE
  Pin-ctls: 0x40: OUT
  Unsolicited: tag=00, enabled=0
  Connection: 1
     0x04
Node 0x06 [Audio Output] wcaps 0x211: Stereo Digital
  Converter: stream=0, channel=0
  Digital:
  Digital category: 0x0
  PCM:
    rates [0xc0]: 48000 88200
    bits [0xf]: 8 16 20 24
    formats [0x1]: PCM
Node 0x07 [Pin Complex] wcaps 0x400381: Stereo Digital
  Pincap 0x00000014: OUT Detect
  Pin Default 0x58560121: [N/A] Digital Out at Int HDMI
    Conn = Digital, Color = Unknown
    DefAssociation = 0x2, Sequence = 0x1
    Misc = NO_PRESENCE
  Pin-ctls: 0x40: OUT
  Unsolicited: tag=00, enabled=0
  Connection: 1
     0x06
Node 0x08 [Audio Output] wcaps 0x211: Stereo Digital
  Converter: stream=0, channel=0
  Digital:
  Digital category: 0x0
  PCM:
    rates [0xc0]: 48000 88200
    bits [0xf]: 8 16 20 24
    formats [0x1]: PCM
Node 0x09 [Pin Complex] wcaps 0x400381: Stereo Digital
  Pincap 0x00000014: OUT Detect
  Pin Default 0x58560122: [N/A] Digital Out at Int HDMI
    Conn = Digital, Color = Unknown
    DefAssociation = 0x2, Sequence = 0x2
    Misc = NO_PRESENCE
  Pin-ctls: 0x40: OUT
  Unsolicited: tag=00, enabled=0
  Connection: 1
     0x08
Node 0x0a [Audio Output] wcaps 0x211: Stereo Digital
  Converter: stream=0, channel=0
  Digital:
  Digital category: 0x0
  PCM:
    rates [0xc0]: 48000 88200
    bits [0xf]: 8 16 20 24
    formats [0x1]: PCM
Node 0x0b [Pin Complex] wcaps 0x400381: Stereo Digital
  Pincap 0x00000014: OUT Detect
  Pin Default 0x58560123: [N/A] Digital Out at Int HDMI
    Conn = Digital, Color = Unknown
    DefAssociation = 0x2, Sequence = 0x3
    Misc = NO_PRESENCE
  Pin-ctls: 0x40: OUT
  Unsolicited: tag=00, enabled=0
  Connection: 1
     0x0a
Node 0x0c [Audio Output] wcaps 0x211: Stereo Digital
  Converter: stream=0, channel=0
  Digital:
  Digital category: 0x0
  PCM:
    rates [0xc0]: 48000 88200
    bits [0xf]: 8 16 20 24
    formats [0x1]: PCM
Node 0x0d [Pin Complex] wcaps 0x400381: Stereo Digital
  Pincap 0x00000014: OUT Detect
  Pin Default 0x58560124: [N/A] Digital Out at Int HDMI
    Conn = Digital, Color = Unknown
    DefAssociation = 0x2, Sequence = 0x4
    Misc = NO_PRESENCE
  Pin-ctls: 0x40: OUT
  Unsolicited: tag=00, enabled=0
  Connection: 1
     0x0c
--endcollapse--


!!ALSA Device nodes
!!-----------------

crw-rw----  1 root audio 116, 10 Dec 23 20:16 /dev/snd/controlC0
crw-rw----  1 root audio 116,  9 Dec 23 20:16 /dev/snd/hwC0D0
crw-rw----  1 root audio 116,  8 Dec 23 20:16 /dev/snd/hwC0D3
crw-rw----  1 root audio 116,  7 Dec 27 14:24 /dev/snd/pcmC0D0c
crw-rw----  1 root audio 116,  6 Dec 27 14:24 /dev/snd/pcmC0D0p
crw-rw----  1 root audio 116,  5 Dec 27 14:24 /dev/snd/pcmC0D1p
crw-rw----  1 root audio 116,  4 Dec 27 14:58 /dev/snd/pcmC0D3p
crw-rw----  1 root audio 116,  3 Dec 23 20:16 /dev/snd/seq
crw-rw----  1 root audio 116,  2 Dec 23 20:16 /dev/snd/timer

/dev/snd/by-path:
total 0
drwxr-xr-x 2 root root  60 Dec 23 20:16 .
drwxr-xr-x 3 root root 240 Dec 23 20:16 ..
lrwxrwxrwx 1 root root  12 Dec 23 20:16 pci-0000:00:08.0 -> ../controlC0


!!ALSA configuration files
!!------------------------

!!System wide config file (/etc/asound.conf)

#
# Place your global alsa-lib configuration here...
#

@hooks [
	{
		func load
		files [
			"/etc/alsa/pulse-default.conf"
		]
		errors false
	}
]


!!Aplay/Arecord output
!!------------

APLAY

**** List of PLAYBACK Hardware Devices ****
card 0: NVidia [HDA NVidia], device 0: VT2020 Analog [VT2020 Analog]
  Subdevices: 2/2
  Subdevice #0: subdevice #0
  Subdevice #1: subdevice #1
card 0: NVidia [HDA NVidia], device 1: VT2020 Digital [VT2020 Digital]
  Subdevices: 2/2
  Subdevice #0: subdevice #0
  Subdevice #1: subdevice #1
card 0: NVidia [HDA NVidia], device 3: NVIDIA HDMI [NVIDIA HDMI]
  Subdevices: 1/1
  Subdevice #0: subdevice #0

ARECORD

**** List of CAPTURE Hardware Devices ****
card 0: NVidia [HDA NVidia], device 0: VT2020 Analog [VT2020 Analog]
  Subdevices: 2/2
  Subdevice #0: subdevice #0
  Subdevice #1: subdevice #1

!!Amixer output
!!-------------

!!-------Mixer controls for card 0 [NVidia]

Card hw:0 'NVidia'/'HDA NVidia at 0xfae78000 irq 23'
  Mixer name	: 'Nvidia MCP79/7A HDMI'
  Components	: 'HDA:11060441,18492520,00100100 HDA:10de0007,10de0101,00100100'
  Controls      : 35
  Simple ctrls  : 19
Simple mixer control 'Headphone',0
  Capabilities: pvolume pswitch penum
  Playback channels: Front Left - Front Right
  Limits: Playback 0 - 42
  Mono:
  Front Left: Playback 42 [100%] [0.00dB] [on]
  Front Right: Playback 42 [100%] [0.00dB] [on]
Simple mixer control 'PCM',0
  Capabilities: pvolume penum
  Playback channels: Front Left - Front Right
  Limits: Playback 0 - 255
  Mono:
  Front Left: Playback 255 [100%] [0.00dB]
  Front Right: Playback 255 [100%] [0.00dB]
Simple mixer control 'Front',0
  Capabilities: pvolume pswitch penum
  Playback channels: Front Left - Front Right
  Limits: Playback 0 - 42
  Mono:
  Front Left: Playback 42 [100%] [0.00dB] [on]
  Front Right: Playback 42 [100%] [0.00dB] [on]
Simple mixer control 'Front Mic',0
  Capabilities: pvolume pswitch penum
  Playback channels: Front Left - Front Right
  Limits: Playback 0 - 31
  Mono:
  Front Left: Playback 31 [100%] [12.00dB] [on]
  Front Right: Playback 31 [100%] [12.00dB] [on]
Simple mixer control 'Front Mic Boost',0
  Capabilities: cvolume penum
  Capture channels: Front Left - Front Right
  Limits: Capture 0 - 3
  Front Left: Capture 0 [0%] [0.00dB]
  Front Right: Capture 0 [0%] [0.00dB]
Simple mixer control 'Surround',0
  Capabilities: pvolume pswitch penum
  Playback channels: Front Left - Front Right
  Limits: Playback 0 - 42
  Mono:
  Front Left: Playback 42 [100%] [0.00dB] [on]
  Front Right: Playback 42 [100%] [0.00dB] [on]
Simple mixer control 'Center',0
  Capabilities: pvolume pvolume-joined pswitch pswitch-joined penum
  Playback channels: Mono
  Limits: Playback 0 - 42
  Mono: Playback 42 [100%] [0.00dB] [on]
Simple mixer control 'LFE',0
  Capabilities: pvolume pvolume-joined pswitch pswitch-joined penum
  Playback channels: Mono
  Limits: Playback 0 - 42
  Mono: Playback 42 [100%] [0.00dB] [on]
Simple mixer control 'Line',0
  Capabilities: pvolume pswitch penum
  Playback channels: Front Left - Front Right
  Limits: Playback 0 - 31
  Mono:
  Front Left: Playback 31 [100%] [12.00dB] [off]
  Front Right: Playback 31 [100%] [12.00dB] [off]
Simple mixer control 'Mic',0
  Capabilities: pvolume pswitch penum
  Playback channels: Front Left - Front Right
  Limits: Playback 0 - 31
  Mono:
  Front Left: Playback 31 [100%] [12.00dB] [off]
  Front Right: Playback 31 [100%] [12.00dB] [off]
Simple mixer control 'Mic Boost',0
  Capabilities: cvolume penum
  Capture channels: Front Left - Front Right
  Limits: Capture 0 - 3
  Front Left: Capture 0 [0%] [0.00dB]
  Front Right: Capture 0 [0%] [0.00dB]
Simple mixer control 'IEC958',0
  Capabilities: pswitch pswitch-joined penum
  Playback channels: Mono
  Mono: Playback [on]
Simple mixer control 'IEC958 Default PCM',0
  Capabilities: pswitch pswitch-joined penum
  Playback channels: Mono
  Mono: Playback [on]
Simple mixer control 'IEC958',1
  Capabilities: pswitch pswitch-joined penum
  Playback channels: Mono
  Mono: Playback [on]
Simple mixer control 'Capture',0
  Capabilities: cvolume cswitch penum
  Capture channels: Front Left - Front Right
  Limits: Capture 0 - 31
  Front Left: Capture 19 [61%] [12.00dB] [on]
  Front Right: Capture 19 [61%] [12.00dB] [on]
Simple mixer control 'Capture',1
  Capabilities: cvolume cswitch penum
  Capture channels: Front Left - Front Right
  Limits: Capture 0 - 31
  Front Left: Capture 0 [0%] [-16.50dB] [on]
  Front Right: Capture 0 [0%] [-16.50dB] [on]
Simple mixer control 'Input Source',0
  Capabilities: cenum
  Items: 'Stereo Mixer' 'Mic' 'Front Mic' 'Line'
  Item0: 'Line'
Simple mixer control 'Input Source',1
  Capabilities: cenum
  Items: 'Stereo Mixer' 'Mic' 'Front Mic' 'Line'
  Item0: 'Stereo Mixer'
Simple mixer control 'Smart 5.1',0
  Capabilities: pswitch pswitch-joined penum
  Playback channels: Mono
  Mono: Playback [on]


!!Alsactl output
!!-------------

--startcollapse--
state.NVidia {
	control.1 {
		comment.access 'read write'
		comment.type INTEGER
		comment.count 2
		comment.range '0 - 42'
		comment.dbmin -6300
		comment.dbmax 0
		iface MIXER
		name 'Front Playback Volume'
		value.0 42
		value.1 42
	}
	control.2 {
		comment.access 'read write'
		comment.type BOOLEAN
		comment.count 2
		iface MIXER
		name 'Front Playback Switch'
		value.0 true
		value.1 true
	}
	control.3 {
		comment.access 'read write'
		comment.type INTEGER
		comment.count 2
		comment.range '0 - 42'
		comment.dbmin -6300
		comment.dbmax 0
		iface MIXER
		name 'Surround Playback Volume'
		value.0 42
		value.1 42
	}
	control.4 {
		comment.access 'read write'
		comment.type BOOLEAN
		comment.count 2
		iface MIXER
		name 'Surround Playback Switch'
		value.0 true
		value.1 true
	}
	control.5 {
		comment.access 'read write'
		comment.type INTEGER
		comment.count 1
		comment.range '0 - 42'
		comment.dbmin -6300
		comment.dbmax 0
		iface MIXER
		name 'Center Playback Volume'
		value 42
	}
	control.6 {
		comment.access 'read write'
		comment.type INTEGER
		comment.count 1
		comment.range '0 - 42'
		comment.dbmin -6300
		comment.dbmax 0
		iface MIXER
		name 'LFE Playback Volume'
		value 42
	}
	control.7 {
		comment.access 'read write'
		comment.type BOOLEAN
		comment.count 1
		iface MIXER
		name 'Center Playback Switch'
		value true
	}
	control.8 {
		comment.access 'read write'
		comment.type BOOLEAN
		comment.count 1
		iface MIXER
		name 'LFE Playback Switch'
		value true
	}
	control.9 {
		comment.access 'read write'
		comment.type INTEGER
		comment.count 2
		comment.range '0 - 42'
		comment.dbmin -6300
		comment.dbmax 0
		iface MIXER
		name 'Headphone Playback Volume'
		value.0 42
		value.1 42
	}
	control.10 {
		comment.access 'read write'
		comment.type BOOLEAN
		comment.count 2
		iface MIXER
		name 'Headphone Playback Switch'
		value.0 true
		value.1 true
	}
	control.11 {
		comment.access 'read write'
		comment.type INTEGER
		comment.count 2
		comment.range '0 - 31'
		comment.dbmin -3450
		comment.dbmax 1200
		iface MIXER
		name 'Mic Playback Volume'
		value.0 31
		value.1 31
	}
	control.12 {
		comment.access 'read write'
		comment.type BOOLEAN
		comment.count 2
		iface MIXER
		name 'Mic Playback Switch'
		value.0 false
		value.1 false
	}
	control.13 {
		comment.access 'read write'
		comment.type INTEGER
		comment.count 2
		comment.range '0 - 31'
		comment.dbmin -3450
		comment.dbmax 1200
		iface MIXER
		name 'Front Mic Playback Volume'
		value.0 31
		value.1 31
	}
	control.14 {
		comment.access 'read write'
		comment.type BOOLEAN
		comment.count 2
		iface MIXER
		name 'Front Mic Playback Switch'
		value.0 true
		value.1 true
	}
	control.15 {
		comment.access 'read write'
		comment.type INTEGER
		comment.count 2
		comment.range '0 - 31'
		comment.dbmin -3450
		comment.dbmax 1200
		iface MIXER
		name 'Line Playback Volume'
		value.0 31
		value.1 31
	}
	control.16 {
		comment.access 'read write'
		comment.type BOOLEAN
		comment.count 2
		iface MIXER
		name 'Line Playback Switch'
		value.0 false
		value.1 false
	}
	control.17 {
		comment.access 'read write'
		comment.type BOOLEAN
		comment.count 1
		iface MIXER
		name 'Smart 5.1'
		value true
	}
	control.18 {
		comment.access 'read write'
		comment.type INTEGER
		comment.count 2
		comment.range '0 - 31'
		comment.dbmin -1650
		comment.dbmax 3000
		iface MIXER
		name 'Capture Volume'
		value.0 19
		value.1 19
	}
	control.19 {
		comment.access 'read write'
		comment.type BOOLEAN
		comment.count 2
		iface MIXER
		name 'Capture Switch'
		value.0 true
		value.1 true
	}
	control.20 {
		comment.access 'read write'
		comment.type INTEGER
		comment.count 2
		comment.range '0 - 31'
		comment.dbmin -1650
		comment.dbmax 3000
		iface MIXER
		name 'Capture Volume'
		index 1
		value.0 0
		value.1 0
	}
	control.21 {
		comment.access 'read write'
		comment.type BOOLEAN
		comment.count 2
		iface MIXER
		name 'Capture Switch'
		index 1
		value.0 true
		value.1 true
	}
	control.22 {
		comment.access 'read write'
		comment.type INTEGER
		comment.count 2
		comment.range '0 - 3'
		comment.dbmin 0
		comment.dbmax 3075
		iface MIXER
		name 'Mic Boost Capture Volume'
		value.0 0
		value.1 0
	}
	control.23 {
		comment.access 'read write'
		comment.type INTEGER
		comment.count 2
		comment.range '0 - 3'
		comment.dbmin 0
		comment.dbmax 3075
		iface MIXER
		name 'Front Mic Boost Capture Volume'
		value.0 0
		value.1 0
	}
	control.24 {
		comment.access 'read write'
		comment.type ENUMERATED
		comment.count 1
		comment.item.0 'Stereo Mixer'
		comment.item.1 Mic
		comment.item.2 'Front Mic'
		comment.item.3 Line
		iface MIXER
		name 'Input Source'
		value Line
	}
	control.25 {
		comment.access 'read write'
		comment.type ENUMERATED
		comment.count 1
		comment.item.0 'Stereo Mixer'
		comment.item.1 Mic
		comment.item.2 'Front Mic'
		comment.item.3 Line
		iface MIXER
		name 'Input Source'
		index 1
		value 'Stereo Mixer'
	}
	control.26 {
		comment.access read
		comment.type IEC958
		comment.count 1
		iface MIXER
		name 'IEC958 Playback Con Mask'
		value '0fff000000000000000000000000000000000000000000000000000000000000000000000000000000000000000000000000000000000000000000000000000000000000000000000000000000000000000000000000000000000000000000000000000000000000000000000000000000000000000000000000000000000000000000000000000000000000000000000000000000000000000000000000000000000000000000000000000000000000'
	}
	control.27 {
		comment.access read
		comment.type IEC958
		comment.count 1
		iface MIXER
		name 'IEC958 Playback Pro Mask'
		value '0f00000000000000000000000000000000000000000000000000000000000000000000000000000000000000000000000000000000000000000000000000000000000000000000000000000000000000000000000000000000000000000000000000000000000000000000000000000000000000000000000000000000000000000000000000000000000000000000000000000000000000000000000000000000000000000000000000000000000000'
	}
	control.28 {
		comment.access 'read write'
		comment.type IEC958
		comment.count 1
		iface MIXER
		name 'IEC958 Playback Default'
		value '0400000000000000000000000000000000000000000000000000000000000000000000000000000000000000000000000000000000000000000000000000000000000000000000000000000000000000000000000000000000000000000000000000000000000000000000000000000000000000000000000000000000000000000000000000000000000000000000000000000000000000000000000000000000000000000000000000000000000000'
	}
	control.29 {
		comment.access 'read write'
		comment.type BOOLEAN
		comment.count 1
		iface MIXER
		name 'IEC958 Playback Switch'
		value true
	}
	control.30 {
		comment.access 'read write'
		comment.type BOOLEAN
		comment.count 1
		iface MIXER
		name 'IEC958 Default PCM Playback Switch'
		value true
	}
	control.31 {
		comment.access read
		comment.type IEC958
		comment.count 1
		iface MIXER
		name 'IEC958 Playback Con Mask'
		index 1
		value '0fff000000000000000000000000000000000000000000000000000000000000000000000000000000000000000000000000000000000000000000000000000000000000000000000000000000000000000000000000000000000000000000000000000000000000000000000000000000000000000000000000000000000000000000000000000000000000000000000000000000000000000000000000000000000000000000000000000000000000'
	}
	control.32 {
		comment.access read
		comment.type IEC958
		comment.count 1
		iface MIXER
		name 'IEC958 Playback Pro Mask'
		index 1
		value '0f00000000000000000000000000000000000000000000000000000000000000000000000000000000000000000000000000000000000000000000000000000000000000000000000000000000000000000000000000000000000000000000000000000000000000000000000000000000000000000000000000000000000000000000000000000000000000000000000000000000000000000000000000000000000000000000000000000000000000'
	}
	control.33 {
		comment.access 'read write'
		comment.type IEC958
		comment.count 1
		iface MIXER
		name 'IEC958 Playback Default'
		index 1
		value '0400000000000000000000000000000000000000000000000000000000000000000000000000000000000000000000000000000000000000000000000000000000000000000000000000000000000000000000000000000000000000000000000000000000000000000000000000000000000000000000000000000000000000000000000000000000000000000000000000000000000000000000000000000000000000000000000000000000000000'
	}
	control.34 {
		comment.access 'read write'
		comment.type BOOLEAN
		comment.count 1
		iface MIXER
		name 'IEC958 Playback Switch'
		index 1
		value true
	}
	control.35 {
		comment.access 'read write user'
		comment.type INTEGER
		comment.count 2
		comment.range '0 - 255'
		comment.tlv '0000000100000008ffffec1400000014'
		comment.dbmin -5100
		comment.dbmax 0
		iface MIXER
		name 'PCM Playback Volume'
		value.0 255
		value.1 255
	}
}
--endcollapse--


!!All Loaded Modules
!!------------------

Module
tcp_lp
fuse
sunrpc
p4_clockmod
freq_table
speedstep_lib
nf_conntrack_netbios_ns
ip6t_REJECT
ip6t_ipv6header
nf_conntrack_ipv6
ip6table_filter
ip6_tables
ipv6
uinput
raid1
snd_hda_codec_nvhdmi
ir_lirc_codec
snd_hda_codec_via
lirc_dev
ir_sony_decoder
ir_jvc_decoder
ir_rc6_decoder
ir_rc5_decoder
snd_hda_intel
snd_hda_codec
snd_hwdep
snd_seq
snd_seq_device
ir_nec_decoder
rc_imon_pad
snd_pcm
microcode
imon
rc_core
joydev
snd_timer
snd
shpchp
soundcore
snd_page_alloc
forcedeth
serio_raw
i2c_nforce2
wmi
nouveau
ttm
drm_kms_helper
drm
i2c_algo_bit
video
output
i2c_core


!!Sysfs Files
!!-----------

/sys/class/sound/hwC0D0/init_pin_configs:
0x24 0x01014010
0x25 0x01011012
0x26 0x01016011
0x27 0x410120f0
0x28 0x0221411f
0x29 0x02a19137
0x2a 0x0181303e
0x2b 0x01a19036
0x2c 0x593701f8
0x2d 0x074510f0
0x2e 0x474401f0
0x2f 0x47c411f0

/sys/class/sound/hwC0D0/driver_pin_configs:

/sys/class/sound/hwC0D0/user_pin_configs:

/sys/class/sound/hwC0D0/init_verbs:

/sys/class/sound/hwC0D3/init_pin_configs:
0x05 0x18560110
0x07 0x58560121
0x09 0x58560122
0x0b 0x58560123
0x0d 0x58560124

/sys/class/sound/hwC0D3/driver_pin_configs:

/sys/class/sound/hwC0D3/user_pin_configs:

/sys/class/sound/hwC0D3/init_verbs:


!!ALSA/HDA dmesg
!!------------------

[    8.122653] IR NEC protocol handler initialized
[    8.397608] HDA Intel 0000:00:08.0: power state changed by ACPI to D0
[    8.397732] HDA Intel 0000:00:08.0: power state changed by ACPI to D0
[    8.398968] ACPI: PCI Interrupt Link [LAZA] enabled at IRQ 23
[    8.398982] HDA Intel 0000:00:08.0: PCI INT A -> Link[LAZA] -> GSI 23 (level, low) -> IRQ 23
[    8.398992] hda_intel: Disable MSI for Nvidia chipset
[    8.399120] HDA Intel 0000:00:08.0: setting latency timer to 64
[    8.485034] IR RC5(x) protocol handler initialized
--
[    9.144988] lirc_dev: IR Remote Control driver registered, major 250 
[    9.153671] ALSA sound/pci/hda/hda_codec.c:4435: autoconfig: line_outs=3 (0x24/0x25/0x26/0x0/0x0)
[    9.153689] ALSA sound/pci/hda/hda_codec.c:4439:    speaker_outs=0 (0x0/0x0/0x0/0x0/0x0)
[    9.153703] ALSA sound/pci/hda/hda_codec.c:4443:    hp_outs=1 (0x28/0x0/0x0/0x0/0x0)
[    9.153716] ALSA sound/pci/hda/hda_codec.c:4444:    mono: mono_out=0x0
[    9.153726] ALSA sound/pci/hda/hda_codec.c:4447:    dig-out=0x2d/0x0
[    9.153737] ALSA sound/pci/hda/hda_codec.c:4455:    inputs: mic=0x2b, fmic=0x29, line=0x2a, fline=0x0, cd=0x0, aux=0x0
[    9.157368] IR LIRC bridge handler initialized
--
[136529.024064] [drm:drm_edid_block_valid] *ERROR* EDID checksum is invalid, remainder is 29
[166046.424155] [drm] nouveau 0000:01:00.0: unplugged HDMI Type A-1
[166047.203265] [drm] nouveau 0000:01:00.0: plugged HDMI Type A-1
[180880.125885] [drm:drm_edid_block_valid] *ERROR* EDID checksum is invalid, remainder is 6
--
[292496.157967] 
[320154.870705] [drm] nouveau 0000:01:00.0: unplugged HDMI Type A-1
[320155.540208] [drm] nouveau 0000:01:00.0: plugged HDMI Type A-1
[323409.226250] fuse init (API version 7.14)


